time_expression,POST_tag,time_token,type_token,time_expression_type,sentences,sentenceIndex,paragraphIndex,section,wikiId,normalised_value_start,normalised_value_end,source
"December 11 , 2004","NNP CD , CD",MONTH_REGEX DIGIT_REGEX_1 COMMA_REGEX YEAR_REGEX_1,TIME NUMERAL MODIFIER TIME,time_reference,"After 13 years on the air at WNYC-Radio, she debuted as the Met's radio announcer on December 11, 2004.",1,0,,1044439,2004-12-11,2004-12-11,ML
2006,CD,YEAR_REGEX_1,TIME,time_reference,She was also the Met's first announcer on Sirius XM Satellite Radio from 2006 and remained in both jobs until her death in 2015.,2,0,,1044439,2006-01-01,2006-12-31,ML
2015,CD,YEAR_REGEX_1,TIME,time_reference,She was also the Met's first announcer on Sirius XM Satellite Radio from 2006 and remained in both jobs until her death in 2015.,2,0,,1044439,2015-01-01,2015-12-31,ML
1980,CD,YEAR_REGEX_1,TIME,time_reference,"Later, she studied to be an opera singer – she was a lyric soprano – and received a degree in voice from the Manhattan School of Music in 1980.",1,2,== Early years ==,1044439,1980-01-01,1980-12-31,ML
1991,CD,YEAR_REGEX_1,TIME,time_reference,Juntwait began her career as a classical music radio announcer in 1991 at WNYC-FM radio in New York City.,0,4,== Broadcasting career ==,1044439,1991-01-01,1991-12-31,ML
2000,CD,YEAR_REGEX_1,TIME,time_reference,"In 2000, while continuing at WNYC, she began her Metropolitan Opera career as the back-up announcer for radio host Peter Allen, who retired from the Metropolitan Opera radio broadcasts in May 2004.",0,5,== Broadcasting career ==,1044439,2000-01-01,2000-12-31,ML
May 2004,NNP CD,MONTH_REGEX YEAR_REGEX_1,TIME TIME,time_reference,"In 2000, while continuing at WNYC, she began her Metropolitan Opera career as the back-up announcer for radio host Peter Allen, who retired from the Metropolitan Opera radio broadcasts in May 2004.",0,5,== Broadcasting career ==,1044439,2004-05-01,2004-05-31,ML
"September 20 , 2006","NNP CD , CD",MONTH_REGEX DIGIT_REGEX_1 COMMA_REGEX YEAR_REGEX_1,TIME NUMERAL MODIFIER TIME,time_reference,"On September 20, 2006, the Met announced that Juntwait would become a full-time Met employee, having been appointed as announcer of all programs on Sirius Satellite Radio's new Metropolitan Opera Radio channel.",3,5,== Broadcasting career ==,1044439,2006-09-20,2006-09-20,ML
the 1960s,DT NNS,PREFIX_REGEX_1 YEAR_REGEX_1,MODIFIER TIME,time_reference,The Prisoner from the 1960s.,2,6,== Broadcasting career ==,1044439,1960-01-01,1969-12-31,ML
"June 3 , 2015","NNP CD , CD",MONTH_REGEX DIGIT_REGEX_1 COMMA_REGEX YEAR_REGEX_1,TIME NUMERAL MODIFIER TIME,time_reference,"Juntwait died on June 3, 2015, of ovarian cancer, aged 58.",0,7,== Broadcasting career ==,1044439,2015-06-03,2015-06-03,ML
January 2015,NNP CD,MONTH_REGEX YEAR_REGEX_1,TIME TIME,time_reference,"According to a memorial published on the Metropolitan Opera website, Juntwait had been diagnosed with cancer over ten years prior to her death, but continued working with the Metropolitan Opera, missing only one Saturday matinee broadcast before January 2015.",1,7,== Broadcasting career ==,1044439,2015-01-01,2015-01-31,ML
"December 31 , 2014","NNP CD , CD",MONTH_REGEX DIGIT_REGEX_1 COMMA_REGEX YEAR_REGEX_1,TIME NUMERAL MODIFIER TIME,time_reference,"Her final live broadcast was on SiriusXM Radio on December 31, 2014.",2,7,== Broadcasting career ==,1044439,2014-12-31,2014-12-31,ML
"July 20 , 1989","NNP CD , CD",MONTH_REGEX DIGIT_REGEX_1 COMMA_REGEX YEAR_REGEX_1,TIME NUMERAL MODIFIER TIME,time_reference,"July 20, 1989.",3,10,== Further reading ==,1044439,1989-07-20,1989-07-20,ML
"August 3 , 1989","NNP CD , CD",MONTH_REGEX DIGIT_REGEX_1 COMMA_REGEX YEAR_REGEX_1,TIME NUMERAL MODIFIER TIME,time_reference,"August 3, 1989.",3,11,== Further reading ==,1044439,1989-08-03,1989-08-03,ML
December 2004,NNP CD,MONTH_REGEX YEAR_REGEX_1,TIME TIME,time_reference,December 2004.,3,12,== Further reading ==,1044439,2004-12-01,2004-12-31,ML
"December 7 , 2004","NNP CD , CD",MONTH_REGEX DIGIT_REGEX_1 COMMA_REGEX YEAR_REGEX_1,TIME NUMERAL MODIFIER TIME,time_reference,"December 7, 2004.",3,13,== Further reading ==,1044439,2004-12-07,2004-12-07,ML
"December 7 , 2012","NNP CD , CD",MONTH_REGEX DIGIT_REGEX_1 COMMA_REGEX YEAR_REGEX_1,TIME NUMERAL MODIFIER TIME,time_reference,"December 7, 2012.",3,14,== Further reading ==,1044439,2012-12-07,2012-12-07,ML
the 2004–2005,DT CD,PREFIX_REGEX_1 YEAR_REGEX_1,MODIFIER TIME,time_reference,"With the 2004–2005 broadcast season, Juntwait took to the air on her own, introducing a performance of Verdi's I Vespri Sicilani.",1,5,== Broadcasting career ==,1044439,2004-01-01,2005-12-31,LLM
"March 18 , 1957 – June 3 , 2015","NNP CD , CD NNP NNP CD , CD",MONTH_REGEX DIGIT_REGEX_1 COMMA_REGEX YEAR_REGEX_1 LINKAGE_REGEX MONTH_REGEX DIGIT_REGEX_1 COMMA_REGEX YEAR_REGEX_1,TIME NUMERAL MODIFIER TIME MODIFIER TIME NUMERAL MODIFIER TIME,time_reference,"Margaret Ann Juntwait (March 18, 1957 – June 3, 2015) was an American radio broadcaster, and the voice of the Metropolitan Opera radio broadcasts.",0,0,,1044439,1957-03-18,2015-06-03,LLM
13 years,CD NNS,DIGIT_REGEX_1 TIME_UNIT_REGEX,NUMERAL TIME,time_reference,"After 13 years on the air at WNYC-Radio, she debuted as the Met's radio announcer on December 11, 2004.",1,0,,1044439,,,ML
Early years,JJ NNS,PREFIX_REGEX_1 TIME_UNIT_REGEX,MODIFIER TIME,time_reference,Early years ==,1,1,== Early years ==,1044439,,,ML
a week,DT NN,INARTICLE_REGEX TIME_UNIT_REGEX,MODIFIER TIME,time_reference,"On Sirius, Juntwait hosted three or four live broadcasts a week during the opera season, and recorded introductions for hundreds of archive performances aired on the channel.",4,5,== Broadcasting career ==,1044439,,,ML
Hour,NNP,TIME_UNIT_REGEX,TIME,time_reference,"The plays aired on ""The Comedy-O-Rama Hour"", heard on XM Satellite Radio's Sonic Theater Channel.",4,6,== Broadcasting career ==,1044439,,,ML
ten years,JJ NNS,BASIC_NUMBER_REGEX_1 TIME_UNIT_REGEX,NUMERAL TIME,time_reference,"According to a memorial published on the Metropolitan Opera website, Juntwait had been diagnosed with cancer over ten years prior to her death, but continued working with the Metropolitan Opera, missing only one Saturday matinee broadcast before January 2015.",1,7,== Broadcasting career ==,1044439,,,ML
a few weeks,DT JJ NNS,INARTICLE_REGEX PREFIX_REGEX_1 TIME_UNIT_REGEX,MODIFIER MODIFIER TIME,time_reference,She recorded material for future broadcasts just a few weeks before she died.,3,7,== Broadcasting career ==,1044439,,,ML
Summer,NNP,SEASON_REGEX,TIME,time_reference,"""Oliver: At the Asbury Summer Theatre"".",1,11,== Further reading ==,1044439,,,ML
Sun,NNP,WEEK_ABBR_REGEX,TIME,time_reference,The New York Sun.,2,13,== Further reading ==,1044439,,,ML
Saturday,NNP,WEEK_REGEX,TIME,time_reference,"""The Metropolitan Opera Saturday Matinee Radio Broadcasts; Arias and airwaves: Weekly operas continue as 82nd season begins"".",1,14,== Further reading ==,1044439,,,ML
