time_expression,POST_tag,time_token,type_token,time_expression_type,sentences,sentenceIndex,paragraphIndex,section,wikiId,normalised_value_start,normalised_value_end,source
Am,VBP,HALFDAY_REGEX_1,TIME,,"The second single on I Am... was ""Hate Me Now"", featuring Sean ""Puffy"" Combs, which was used as an example by Nas's critics accusing him of moving towards more commercial themes.",8,17,== Career == | === 1998–2001: Heightened commercial direction and inconsistent output ===,146167,,,ML
Now,RB,TIMELINE_REGEX,TIME,time_reference,"However, the unedited copy of the ""Hate Me Now"" video made its way to MTV.",10,17,== Career == | === 1998–2001: Heightened commercial direction and inconsistent output ===,146167,,,ML
minutes,NNS,TIME_UNIT_REGEX,TIME,time_reference,"Within minutes of the broadcast, Combs and his bodyguards allegedly made their way into Steve Stoute's office and assaulted him, at one point apparently hitting Stoute over the head with a champagne bottle.",11,17,== Career == | === 1998–2001: Heightened commercial direction and inconsistent output ===,146167,,,ML
that June,IN NNP,PREFIX_REGEX_1 MONTH_REGEX,MODIFIER TIME,time_reference,"Stoute pressed charges, but he and Combs settled out-of-court that June.",12,17,== Career == | === 1998–2001: Heightened commercial direction and inconsistent output ===,146167,,,ML
Am,VBP,HALFDAY_REGEX_1,TIME,,"Columbia had scheduled to release the infringed material from I Am... under the title Nastradamus during the later half of 1999, but, at the last minute, Nas decided to record an entire new album for the 1999 release of Nastradamus.",13,17,== Career == | === 1998–2001: Heightened commercial direction and inconsistent output ===,146167,,,ML
a November,DT NNP,INARTICLE_REGEX MONTH_REGEX,MODIFIER TIME,time_reference,Nastradamus was therefore rushed to meet a November release date.,14,17,== Career == | === 1998–2001: Heightened commercial direction and inconsistent output ===,146167,,,ML
Am,VBP,HALFDAY_REGEX_1,TIME,,"Fans and critics feared that Nas's career was declining, artistically and commercially, as both I Am... and Nastradamus were criticized as inconsistent and overtly-commercialized.",16,17,== Career == | === 1998–2001: Heightened commercial direction and inconsistent output ===,146167,,,ML
Presents,NNP,TIMELINE_REGEX,TIME,time_reference,"In 2000, Nas & Ill Will Records Presents QB's Finest, which is popularly known as simply QB's Finest, was released on Nas's Ill Will Records.",17,17,== Career == | === 1998–2001: Heightened commercial direction and inconsistent output ===,146167,,,ML
Millennium,NNP,TIME_UNIT_REGEX,TIME,time_reference,"QB's Finest is a compilation album that featured Nas and a number of other rappers from Queensbridge projects, including Mobb Deep, Nature, Capone, the Bravehearts, Tragedy Khadafi, Millennium Thug and Cormega, who had briefly reconciled with Nas.",18,17,== Career == | === 1998–2001: Heightened commercial direction and inconsistent output ===,146167,,,ML
of previously,IN RB,PREFIX_REGEX_1 TIMELINE_REGEX,MODIFIER TIME,time_reference,"The Lost Tapes, a compilation of previously unreleased or bootlegged songs from 1998 to 2001, was released by Columbia in September 2002.",6,20,"== Career == | === 2001–2006: Feud with Jay-Z, Stillmatic, God's Son, and double album ===",146167,,,ML
of the year,IN DT NN,PREFIX_REGEX_1 PREFIX_REGEX_1 TIME_UNIT_REGEX,MODIFIER MODIFIER TIME,time_reference,Time Magazine named his album best hip-hop album of the year.,10,20,"== Career == | === 2001–2006: Feud with Jay-Z, Stillmatic, God's Son, and double album ===",146167,,,ML
Millennium,NNP,TIME_UNIT_REGEX,TIME,time_reference,"The album features guest appearances from Nas, Nashawn (Millennium Thug), Lil Jon, and Jully Black.",4,21,"== Career == | === 2001–2006: Feud with Jay-Z, Stillmatic, God's Son, and double album ===",146167,,,ML
months,NNS,TIME_UNIT_REGEX,TIME,time_reference,"The double-sided single ""Thief's Theme""/""You Know My Style"" was released months before the album's release, followed by the single ""Bridging the Gap"" upon the album's release.",2,22,"== Career == | === 2001–2006: Feud with Jay-Z, Stillmatic, God's Son, and double album ===",146167,,,ML
October,NNP,MONTH_REGEX,TIME,time_reference,"In October, Nas made a surprise appearance at Jay-Z's ""I Declare War"" concert, where they reconciled their beef.",5,22,"== Career == | === 2001–2006: Feud with Jay-Z, Stillmatic, God's Son, and double album ===",146167,,,ML
Am,VBP,HALFDAY_REGEX_1,TIME,,and I Am....,1,25,"== Career == | === 2006–2008: Hip Hop Is Dead, Untitled, and politicized efforts ===",146167,,,ML
November,NNP,MONTH_REGEX,TIME,time_reference,"Nas's former label, Columbia Records, released the compilation Greatest Hits in November.",4,25,"== Career == | === 2006–2008: Hip Hop Is Dead, Untitled, and politicized efforts ===",146167,,,ML
day,NN,TIME_UNIT_REGEX,TIME,time_reference,It's a new day.,16,25,"== Career == | === 2006–2008: Hip Hop Is Dead, Untitled, and politicized efforts ===",146167,,,ML
now,RB,TIMELINE_REGEX,TIME,time_reference,I'm here now.,18,25,"== Career == | === 2006–2008: Hip Hop Is Dead, Untitled, and politicized efforts ===",146167,,,ML
now,RB,TIMELINE_REGEX,TIME,time_reference,We the voice now.,21,25,"== Career == | === 2006–2008: Hip Hop Is Dead, Untitled, and politicized efforts ===",146167,,,ML
July,NNP,MONTH_REGEX,TIME,time_reference,"In July, Nas attained a shoe deal with Fila.",1,26,"== Career == | === 2006–2008: Hip Hop Is Dead, Untitled, and politicized efforts ===",146167,,,ML
July,NNP,MONTH_REGEX,TIME,time_reference,"In an interview with MTV News in July, Nas speculated that he might release two albums: one produced by DJ Premier and another by Dr. Dre—simultaneously the same day.",2,26,"== Career == | === 2006–2008: Hip Hop Is Dead, Untitled, and politicized efforts ===",146167,,,ML
of the Year,IN DT NNP,PREFIX_REGEX_1 PREFIX_REGEX_1 TIME_UNIT_REGEX,MODIFIER MODIFIER TIME,time_reference,"Nas was also awarded 'Emcee of the Year' in the HipHopDX 2008 Awards for his latest solo effort, the quality of his appearances on other albums and was described as having ""become an artist who thrives off of reinvention and going against the system.""",4,26,"== Career == | === 2006–2008: Hip Hop Is Dead, Untitled, and politicized efforts ===",146167,,,ML
moment,NN,TIMELINE_REGEX,TIME,time_reference,"Nas called the album a ""magic moment"" in his rap career.",4,29,== Career == | === 2009–2012: Distant Relatives and Life Is Good ===,146167,,,ML
a 2011,DT CD,INARTICLE_REGEX YEAR_REGEX_1,MODIFIER TIME,time_reference,"Common said of the project in a 2011 interview, ""At some point, we will do that.",6,29,== Career == | === 2009–2012: Distant Relatives and Life Is Good ===,146167,,,ML
Am,VBP,HALFDAY_REGEX_1,TIME,,"They released the track ""I Am Somebody"" in May 2014.",8,31,== Career == | === 2013–2019: Nasir and The Lost Tapes 2 ===,146167,,,ML
years,NNS,TIME_UNIT_REGEX,TIME,time_reference,"On October 16, 2016, he received the Jimmy Iovine Icon Award at 2016 REVOLT Music Conference for having a lasting impact and unique influence on music, numerous years in the rap business, his partnership with Hennessy, and Mass Appeal imprint by Puff Daddy.",0,33,== Career == | === 2013–2019: Nasir and The Lost Tapes 2 ===,146167,,,ML
a 1928,DT CD,INARTICLE_REGEX YEAR_REGEX_1,MODIFIER TIME,time_reference,"He performed ""On the Road Again"", a 1928 song by the Memphis Jug Band, which received universal acclaim with The Hollywood Reporter describing his performance as ""fantastic"" and the Financial Times praising his ""superb cover of the Memphis Jug Band's ""On the Road Again"", exposing the hip-hop blueprint within the 1928 stomper.""",1,34,== Career == | === 2013–2019: Nasir and The Lost Tapes 2 ===,146167,,,ML
June 15,NNP CD,MONTH_REGEX DIGIT_REGEX_1,TIME NUMERAL,time_reference,"In April 2018, Kanye West announced on Twitter that Nas's twelfth studio album will be released on June 15, also serving as executive producer for the album.",3,34,== Career == | === 2013–2019: Nasir and The Lost Tapes 2 ===,146167,,,ML
the day,DT NN,PREFIX_REGEX_1 TIME_UNIT_REGEX,MODIFIER TIME,time_reference,"The album was announced the day before release, titled Nasir.",4,34,== Career == | === 2013–2019: Nasir and The Lost Tapes 2 ===,146167,,,ML
August 13,NNP CD,MONTH_REGEX DIGIT_REGEX_1,TIME NUMERAL,time_reference,"On August 13, he revealed the album's title, King's Disease.",1,37,== Career == | === 2020–present: King's Disease series and Magic ===,146167,,,ML
December 24,NNP CD,MONTH_REGEX DIGIT_REGEX_1,TIME NUMERAL,time_reference,"On December 24, Nas released the album Magic.",5,37,== Career == | === 2020–present: King's Disease series and Magic ===,146167,,,ML
a year,DT NN,INARTICLE_REGEX TIME_UNIT_REGEX,MODIFIER TIME,time_reference,"About.com ranked him 1st on their list of the ""50 Greatest MCs of All Time"" in 2014, and a year later, Nas was featured on the ""10 Best Rappers of All Time"" list by Billboard.",9,39,== Artistry ==,146167,,,ML
the next couple of years,DT JJ NN IN NNS,PREFIX_REGEX_1 PREFIX_REGEX_1 PREFIX_REGEX_2 PREFIX_REGEX_1 TIME_UNIT_REGEX,MODIFIER MODIFIER MODIFIER MODIFIER TIME,time_reference,"The two traded subliminal responses for the next couple of years, until the beef was escalated further in 2001 after Jay-Z publicly addressed Nas at the Summer Jam, performing what would go on to be known as Takeover, ending the performance by saying ""ask Nas, he don't want it with Hov"".",3,42,== Controversies and feuds == | === Jay-Z ===,146167,,,ML
The following year,DT JJ NN,PREFIX_REGEX_1 PREFIX_REGEX_1 TIME_UNIT_REGEX,MODIFIER MODIFIER TIME,time_reference,"The following year, Nas signed with Def Jam Recordings, of which Jay-Z then served as president.",10,42,== Controversies and feuds == | === Jay-Z ===,146167,,,ML
105.1 days,CD NNS,DIGIT_REGEX_1 TIME_UNIT_REGEX,NUMERAL TIME,time_reference,"Nas appeared on Power 105.1 days later and addressed a number of fellow artists, including Nelly, Noreaga and Cam'ron himself.",1,44,== Controversies and feuds == | === Cam'ron ===,146167,,,ML
Now,RB,TIMELINE_REGEX,TIME,time_reference,"After Cam'ron heard of Nas's words, he appeared on Funkmaster Flex's Hot 97 and performed a freestyle diss over the beat to Nas's ""Hate Me Now"", making reference to Nas's mother, baby mother and daughter.",3,44,== Controversies and feuds == | === Cam'ron ===,146167,,,ML
days,NNS,TIME_UNIT_REGEX,TIME,time_reference,"Nas did not respond directly but appeared on the radio days later, calling Cam'ron a ""dummy"" for supposedly being used by Hot 97 to generate ratings.",4,44,== Controversies and feuds == | === Cam'ron ===,146167,,,ML
The 7 Day,DT CD NNP,PREFIX_REGEX_1 DIGIT_REGEX_1 TIME_UNIT_REGEX,MODIFIER NUMERAL TIME,time_reference,The 7 Day Theory.,1,46,== Controversies and feuds == | === 2Pac ===,146167,,,ML
three days,CD NNS,BASIC_NUMBER_REGEX_1 TIME_UNIT_REGEX,NUMERAL TIME,time_reference,"The two later met in Central Park before the 1996 MTV Video Music Awards and ended their feud, with 2Pac promising to remove any disses aimed at Nas from the official album release; however, 2Pac was shot four times in a drive-by shooting in Las Vegas, Nevada three days later on September 7, dying of his wounds on September 13, before any edits to the album could be made.",3,46,== Controversies and feuds == | === 2Pac ===,146167,,,ML
one week,CD NN,BASIC_NUMBER_REGEX_1 TIME_UNIT_REGEX,NUMERAL TIME,,"After Nas blamed Southern hip hop as the cause of the perceived artistic decline of the genre on his 2006 single ""Hip Hop Is Dead"", from the album of the same name, his then-Def Jam labelmate Young Jeezy took offense by claiming that Nas had ""no street credibility"" and vowing his album The Inspiration would outsell Hip Hop is Dead, which were released one week apart from each other in December 2006.",0,48,== Controversies and feuds == | === Young Jeezy ===,146167,,,ML
About two weeks,RB CD NNS,PREFIX_REGEX_1 BASIC_NUMBER_REGEX_1 TIME_UNIT_REGEX,MODIFIER NUMERAL TIME,time_reference,"About two weeks later, Nas was interviewed by Shaheem Reid of MTV News, where he criticised O'Reilly, calling him uncivilized and willing to go to extremes for publicity.",5,50,== Controversies and feuds == | === Bill O'Reilly and Virginia Tech controversy ===,146167,,,ML
the past,DT NN,PREFIX_REGEX_1 TIMELINE_REGEX,MODIFIER TIME,time_reference,He deals with the past.,1,51,== Controversies and feuds == | === Bill O'Reilly and Virginia Tech controversy ===,146167,,,ML
now,RB,TIMELINE_REGEX,TIME,time_reference,"The people he represents are Republican, older, a generation that has nothing to do with the reality of what's happening now with my generation. ...",2,51,== Controversies and feuds == | === Bill O'Reilly and Virginia Tech controversy ===,146167,,,ML
Year,NNP,TIME_UNIT_REGEX,TIME,time_reference,"In January 2012 Nas was involved in a dispute with a concert promoter in Angola, having accepted $300,000 for a concert in Luanda, Angola's capital for New Year's Eve and then not showing up.",8,59,== Personal life ==,146167,,,ML
of the end of the month,IN DT NN IN DT NN,PREFIX_REGEX_1 PREFIX_REGEX_1 PREFIX_REGEX_2 PREFIX_REGEX_1 PREFIX_REGEX_1 TIME_UNIT_REGEX,MODIFIER MODIFIER MODIFIER MODIFIER MODIFIER TIME,time_reference,"As of the end of the month Nas returned all $300,000 and after 49 days of travel ban Allocco and his son were both released.",11,59,== Personal life ==,146167,,,ML
12 am,CD VBP,DIGIT_REGEX_1 HALFDAY_REGEX_1,NUMERAL TIME,,"In May 2013, it was announced that Nas would open a sneaker store in Las Vegas called 12 am RUN (pronounced Midnight Run) as part of The LINQ retail development.",16,59,== Personal life ==,146167,,,ML
Am,VBP,HALFDAY_REGEX_1,TIME,,I Am... (1999),0,63,== Discography ==,146167,,,ML
