time_expression,POST_tag,time_token,type_token,time_expression_type,sentences,sentenceIndex,paragraphIndex,section,wikiId,normalised_value_start,normalised_value_end,source
21 March 1989,CD NNP CD,DIGIT_REGEX_1 MONTH_REGEX YEAR_REGEX_1,NUMERAL TIME TIME,time_point,Rochelle Eulah Eileen Humes (née Wiseman; born 21 March 1989) is an English singer and television presenter.,0,0,,19691951,1989-03-21,1989-03-21,ML
2019,CD,YEAR_REGEX_1,TIME,time_reference,"Humes regularly guest-hosts This Morning, and since 2019, she has co-presented the BBC game show The Hit List alongside husband Marvin Humes.",2,0,,19691951,2019-01-01,2019-12-31,ML
21 March 1989,CD NNP CD,DIGIT_REGEX_1 MONTH_REGEX YEAR_REGEX_1,NUMERAL TIME TIME,time_point,"Humes was born in Barking, London, on 21 March 1989.",0,2,== Early life ==,19691951,1989-03-21,1989-03-21,ML
2001–2005,CD,YEAR_REGEX_1,TIME,time_reference,=== 2001–2005: S Club Juniors and S Club 8,0,4,== Music career == | === 2001–2005: S Club Juniors and S Club 8 ===,19691951,2001-01-01,2005-12-31,ML
2001,CD,YEAR_REGEX_1,TIME,time_reference,"S Club Juniors were formed in 2001 as part of a reality series, known as S Club Search.",0,5,== Music career == | === 2001–2005: S Club Juniors and S Club 8 ===,19691951,2001-01-01,2001-12-31,ML
22 April 2002,CD NNP CD,DIGIT_REGEX_1 MONTH_REGEX YEAR_REGEX_1,NUMERAL TIME TIME,time_point,The single was promoted by the television series S Club Junior: The Story and was released in the UK on 22 April 2002 in a chart battle with the Sugababes who released their comeback single the same day.,4,5,== Music career == | === 2001–2005: S Club Juniors and S Club 8 ===,19691951,2002-04-22,2002-04-22,ML
22 July 2002,CD NNP CD,DIGIT_REGEX_1 MONTH_REGEX YEAR_REGEX_1,NUMERAL TIME TIME,time_point,"Released on 22 July 2002, the single reached number two in the UK charts selling 52,000 copies, and spent eight weeks inside the UK top 75 and sold in excess of 110,000 copies in the UK.",6,5,== Music career == | === 2001–2005: S Club Juniors and S Club 8 ===,19691951,2002-07-22,2002-07-22,ML
9 December 2002,CD NNP CD,DIGIT_REGEX_1 MONTH_REGEX YEAR_REGEX_1,NUMERAL TIME TIME,time_point,"Their fourth single, ""Puppy Love/Sleigh Ride"", was released on 9 December 2002.",10,5,== Music career == | === 2001–2005: S Club Juniors and S Club 8 ===,19691951,2002-12-09,2002-12-09,ML
January 2003,NNP CD,MONTH_REGEX YEAR_REGEX_1,TIME TIME,time_reference,"The Juniors began work on their second album in January 2003 and the band joined S Club on their S Club United tour in April 2003 where the announcement came of a name change to S Club 8 and an upbeat fifth single, ""Fool No More"".",12,5,== Music career == | === 2001–2005: S Club Juniors and S Club 8 ===,19691951,2003-01-01,2003-01-31,ML
April 2003,NNP CD,MONTH_REGEX YEAR_REGEX_1,TIME TIME,time_reference,"The Juniors began work on their second album in January 2003 and the band joined S Club on their S Club United tour in April 2003 where the announcement came of a name change to S Club 8 and an upbeat fifth single, ""Fool No More"".",12,5,== Music career == | === 2001–2005: S Club Juniors and S Club 8 ===,19691951,2003-04-01,2003-04-30,ML
29 September 2003,CD NNP CD,DIGIT_REGEX_1 MONTH_REGEX YEAR_REGEX_1,NUMERAL TIME TIME,time_point,"A second single, ""Sundown"", was released in the UK on 29 September 2003 reaching number four in the UK and became their sixth and final top ten hit, selling 37,000 copies in its first week and 80,000 altogether.",14,5,== Music career == | === 2001–2005: S Club Juniors and S Club 8 ===,19691951,2003-09-29,2003-09-29,ML
13 October 2003,CD NNP CD,DIGIT_REGEX_1 MONTH_REGEX YEAR_REGEX_1,NUMERAL TIME TIME,time_point,"The album, Sundown, was released on 13 October 2003 to dismal reviews.",15,5,== Music career == | === 2001–2005: S Club Juniors and S Club 8 ===,19691951,2003-10-13,2003-10-13,ML
29 December 2003,CD NNP CD,DIGIT_REGEX_1 MONTH_REGEX YEAR_REGEX_1,NUMERAL TIME TIME,time_point,"A sixth single, ""Don't Tell Me You're Sorry"", was released in the UK on 29 December 2003 and reached number 11 in the UK, becoming their first single to chart outside the top ten.",18,5,== Music career == | === 2001–2005: S Club Juniors and S Club 8 ===,19691951,2003-12-29,2003-12-29,ML
early 2005,JJ CD,PREFIX_REGEX_1 YEAR_REGEX_1,MODIFIER TIME,time_reference,S Club 8 split up in early 2005.,23,5,== Music career == | === 2001–2005: S Club Juniors and S Club 8 ===,19691951,2005-01-01,2005-12-31,ML
2005–2007,CD,YEAR_REGEX_1,TIME,time_reference,2005–2007: After S Club 8,1,6,== Music career == | === 2005–2007: After S Club 8 ===,19691951,2005-01-01,2007-12-31,ML
2005 and 2006,CD CC CD,YEAR_REGEX_1 LINKAGE_REGEX YEAR_REGEX_1,TIME MODIFIER TIME,time_range,"Between 2005 and 2006, following the split of S Club 8, Humes presented the BBC children's TV programme Smile which was her first presenting role.",0,7,== Music career == | === 2005–2007: After S Club 8 ===,19691951,2005-01-01,2006-12-31,ML
2006,CD,YEAR_REGEX_1,TIME,time_reference,Humes left the programme in 2006 for unknown reasons and the programme was axed soon after.,2,7,== Music career == | === 2005–2007: After S Club 8 ===,19691951,2006-01-01,2006-12-31,ML
February 2007,NNP CD,MONTH_REGEX YEAR_REGEX_1,TIME TIME,time_reference,"In February 2007, Humes appeared briefly on Never Mind The Buzzcocks as part of the show's regular Identity Parade feature, where contestants guess which person out of a line-up of five was featured in an old music video played only to the audience and viewers.",2,8,== Music career == | === 2005–2007: After S Club 8 ===,19691951,2007-02-01,2007-02-28,ML
22 October 2009,CD NNP CD,DIGIT_REGEX_1 MONTH_REGEX YEAR_REGEX_1,NUMERAL TIME TIME,time_point,"On 22 October 2009, after finding fame again with The Saturdays, Humes returned to appear as a guest on Never Mind the Buzzcocks on Phill Jupitus' team.",4,8,== Music career == | === 2005–2007: After S Club 8 ===,19691951,2009-10-22,2009-10-22,ML
2007–2014,CD,YEAR_REGEX_1,TIME,time_reference,2007–2014:,1,9,== Music career == | === 2007–2014: The Saturdays ===,19691951,2007-01-01,2014-12-31,ML
2007,CD,YEAR_REGEX_1,TIME,time_reference,"Since 2007, Humes has been a member of girl group The Saturdays, whose other members are Una Healy, Mollie King, Vanessa White, and fellow former S Club 8 member Frankie Bridge.",0,10,== Music career == | === 2007–2014: The Saturdays ===,19691951,2007-01-01,2007-12-31,ML
July 2008,NNP CD,MONTH_REGEX YEAR_REGEX_1,TIME TIME,time_reference,"The Saturdays made their chart debut in July 2008 with ""If This Is Love"", which reached the top ten in the United Kingdom.",1,10,== Music career == | === 2007–2014: The Saturdays ===,19691951,2008-07-01,2008-07-31,ML
October 2008,NNP CD,MONTH_REGEX YEAR_REGEX_1,TIME TIME,time_reference,"Its follow-up single ""Up"" was released in October 2008, and the song debuted at number-five on the UK Singles Chart; to date the single has sold 310,000 copies in the UK alone as well as staying in the charts for exclusive 30 weeks.",2,10,== Music career == | === 2007–2014: The Saturdays ===,19691951,2008-10-01,2008-10-31,ML
2008,CD,YEAR_REGEX_1,TIME,time_reference,"The band's debut studio album, Chasing Lights (2008) reached the top ten on the UK Albums Chart and was awarded Platinum selling status by the British Phonographic Industry (BPI).",3,10,== Music career == | === 2007–2014: The Saturdays ===,19691951,2008-01-01,2008-12-31,ML
2009,CD,YEAR_REGEX_1,TIME,time_reference,"Wordshaker (2009) was the band's follow-up studio album and also charted within the top ten on the UK Albums Chart and went on to gain a Silver selling status, with singles ""Forever Is Over"" and ""Ego"" charting within the top ten on the UK Singles Chart.",6,10,== Music career == | === 2007–2014: The Saturdays ===,19691951,2009-01-01,2009-12-31,ML
2010,CD,YEAR_REGEX_1,TIME,time_reference,Headlines! (2010) was released as the band's first Mini album and charted at number-three on the UK Albums Chart and number-ten on the Irish Album Chart.,7,10,== Music career == | === 2007–2014: The Saturdays ===,19691951,2010-01-01,2010-12-31,ML
2011,CD,YEAR_REGEX_1,TIME,time_reference,"The Saturdays third studio album, On Your Radar (2011) contained three highly successful selling singles and two of which—""Notorious"" and ""All Fired Up"" charted within the top ten on the UK Singles Chart.",9,10,== Music career == | === 2007–2014: The Saturdays ===,19691951,2011-01-01,2011-12-31,ML
2013,CD,YEAR_REGEX_1,TIME,time_reference,"""30 Days"" became the group's eleventh top-ten hit, while ""What About Us"" featuring Sean Paul saw The Saturdays earn their first number-one single in 2013, it is taken from their forthcoming fourth studio album, Living for the Weekend.",2,11,== Music career == | === 2007–2014: The Saturdays ===,19691951,2013-01-01,2013-12-31,ML
2004,CD,YEAR_REGEX_1,TIME,time_reference,Humes began her TV presenting career by co-hosting children's morning TV show Smile from 2004 until 2006.,0,13,== Television and radio career ==,19691951,2004-01-01,2004-12-31,ML
2006,CD,YEAR_REGEX_1,TIME,time_reference,Humes began her TV presenting career by co-hosting children's morning TV show Smile from 2004 until 2006.,0,13,== Television and radio career ==,19691951,2006-01-01,2006-12-31,ML
2013,CD,YEAR_REGEX_1,TIME,time_reference,"In 2013, Humes was a regular panellist on the first series of Sweat the Small Stuff, then became a regular team captain from the second series.",1,13,== Television and radio career ==,19691951,2013-01-01,2013-12-31,ML
August 2013,NNP CD,MONTH_REGEX YEAR_REGEX_1,TIME TIME,time_reference,"In August 2013, Humes and her husband joined This Morning as regular stand-in presenters.",2,13,== Television and radio career ==,19691951,2013-08-01,2013-08-31,ML
2018,CD,YEAR_REGEX_1,TIME,time_reference,"They no longer appear together however since 2018, Humes has guest hosted the show alongside a co-star.",3,13,== Television and radio career ==,19691951,2018-01-01,2018-12-31,ML
November and December 2018,NNP CC NNP CD,MONTH_REGEX LINKAGE_REGEX MONTH_REGEX YEAR_REGEX_1,TIME MODIFIER TIME TIME,time_reference,"Humes also appeared as a regular host on the show alongside Phillip Schofield for a short period between November and December 2018, filling in for Schofield's co-star Holly Willoughby during her stint on I'm a Celebrity...Get Me Out of Here!On 25 December 2013, Humes took part in the Strictly Come Dancing Christmas special.",4,13,== Television and radio career ==,19691951,2018-11-01,2018-12-31,ML
25 December 2013,CD NNP CD,DIGIT_REGEX_1 MONTH_REGEX YEAR_REGEX_1,NUMERAL TIME TIME,time_point,"Humes also appeared as a regular host on the show alongside Phillip Schofield for a short period between November and December 2018, filling in for Schofield's co-star Holly Willoughby during her stint on I'm a Celebrity...Get Me Out of Here!On 25 December 2013, Humes took part in the Strictly Come Dancing Christmas special.",4,13,== Television and radio career ==,19691951,2013-12-25,2013-12-25,ML
16 January 2014,CD NNP CD,DIGIT_REGEX_1 MONTH_REGEX YEAR_REGEX_1,NUMERAL TIME TIME,time_point,"On 16 January 2014, she competed in The Great Sport Relief Bake Off.",5,13,== Television and radio career ==,19691951,2014-01-16,2014-01-16,ML
2014,CD,YEAR_REGEX_1,TIME,time_reference,"Since 2014, Humes has co-hosted segments of the BBC Children in Need telethon.",6,13,== Television and radio career ==,19691951,2014-01-01,2014-12-31,ML
3 January 2015,CD NNP CD,DIGIT_REGEX_1 MONTH_REGEX YEAR_REGEX_1,NUMERAL TIME TIME,time_point,"On 3 January 2015, Humes and Alexander Armstrong co-hosted a one-off BBC One special called Frank Sinatra: Our Way.",7,13,== Television and radio career ==,19691951,2015-01-03,2015-01-03,ML
2015,CD,YEAR_REGEX_1,TIME,time_reference,"In 2015, Humes began co-hosting Ninja Warrior UK for ITV, where she appears alongside Ben Shephard and Chris Kamara.",8,13,== Television and radio career ==,19691951,2015-01-01,2015-12-31,ML
18 June 2015,CD NNP CD,DIGIT_REGEX_1 MONTH_REGEX YEAR_REGEX_1,NUMERAL TIME TIME,time_point,"On 18 June 2015, Humes was confirmed as a new co-host of The Xtra Factor, replacing Sarah-Jane Crawford.",9,13,== Television and radio career ==,19691951,2015-06-18,2015-06-18,ML
2015,CD,YEAR_REGEX_1,TIME,time_reference,She hosted the twelfth series with her Sweat the Small Stuff co-star Melvin Odoom in 2015.,10,13,== Television and radio career ==,19691951,2015-01-01,2015-12-31,ML
2016,CD,YEAR_REGEX_1,TIME,time_reference,"In 2016, Humes co-presented a new Sunday night entertainment series for ITV called The Next Great Magician alongside Stephen Mulhern.",11,13,== Television and radio career ==,19691951,2016-01-01,2016-12-31,ML
2017,CD,YEAR_REGEX_1,TIME,time_reference,"In 2017, she guest presented four episodes of Lorraine on ITV.",12,13,== Television and radio career ==,19691951,2017-01-01,2017-12-31,ML
2017,CD,YEAR_REGEX_1,TIME,time_reference,"In 2017, Humes sat in for Emma Willis on Sunday Morning Breakfast with Mulhern on multiple occasions on Heart London.",13,13,== Television and radio career ==,19691951,2017-01-01,2017-12-31,ML
2018,CD,YEAR_REGEX_1,TIME,time_reference,"In 2018, Humes took over Saturday early evenings (reformatted as Saturday drivetime) from Emma Bunton.",14,13,== Television and radio career ==,19691951,2018-01-01,2018-12-31,ML
2017,CD,YEAR_REGEX_1,TIME,time_reference,"In 2017, Humes was announced to be voicing the role of a Voice Trumpet in the children's television series Teletubbies.",16,13,== Television and radio career ==,19691951,2017-01-01,2017-12-31,ML
20 November 2018,CD NNP CD,DIGIT_REGEX_1 MONTH_REGEX YEAR_REGEX_1,NUMERAL TIME TIME,time_point,"On 20 November 2018, it was announced that Humes would co-host a music quiz show with husband Marvin Humes on BBC One called The Hit List.",17,13,== Television and radio career ==,19691951,2018-11-20,2018-11-20,ML
June 2014,NNP CD,MONTH_REGEX YEAR_REGEX_1,TIME TIME,time_reference,"In June 2014, Humes unveiled her first clothing range for Very.",0,15,== Other projects ==,19691951,2014-06-01,2014-06-30,ML
February 2019,NNP CD,MONTH_REGEX YEAR_REGEX_1,TIME TIME,time_reference,"In February 2019, Humes published her first children's book, The Mega Magic Hair Swap.",2,15,== Other projects ==,19691951,2019-02-01,2019-02-28,ML
February 2020,NNP CD,MONTH_REGEX YEAR_REGEX_1,TIME TIME,time_reference,"In February 2020, Humes launched her brand, My Little Coco.",3,15,== Other projects ==,19691951,2020-02-01,2020-02-29,ML
27 July 2012,CD NNP CD,DIGIT_REGEX_1 MONTH_REGEX YEAR_REGEX_1,NUMERAL TIME TIME,time_point,Humes married JLS member Marvin Humes on 27 July 2012 at Blenheim Palace.,0,17,== Personal life ==,19691951,2012-07-27,2012-07-27,ML
20 May 2013,CD NNP CD,DIGIT_REGEX_1 MONTH_REGEX YEAR_REGEX_1,NUMERAL TIME TIME,time_point,"The couple have two daughters; Alaia-Mai (born 20 May 2013) and Valentina Raine (born 10 March 2017), and one son; Blake Hampton (born on 9 October 2020).",1,17,== Personal life ==,19691951,2013-05-20,2013-05-20,ML
10 March 2017,CD NNP CD,DIGIT_REGEX_1 MONTH_REGEX YEAR_REGEX_1,NUMERAL TIME TIME,time_point,"The couple have two daughters; Alaia-Mai (born 20 May 2013) and Valentina Raine (born 10 March 2017), and one son; Blake Hampton (born on 9 October 2020).",1,17,== Personal life ==,19691951,2017-03-10,2017-03-10,ML
9 October 2020,CD NNP CD,DIGIT_REGEX_1 MONTH_REGEX YEAR_REGEX_1,NUMERAL TIME TIME,time_point,"The couple have two daughters; Alaia-Mai (born 20 May 2013) and Valentina Raine (born 10 March 2017), and one son; Blake Hampton (born on 9 October 2020).",1,17,== Personal life ==,19691951,2020-10-09,2020-10-09,ML
the end of 2019,DT NN IN CD,PREFIX_REGEX_1 PREFIX_REGEX_2 PREFIX_REGEX_1 YEAR_REGEX_1,MODIFIER MODIFIER MODIFIER TIME,time_reference,"At the end of 2019, Humes decided to take a break from her Heart FM commitments.",15,13,== Television and radio career ==,19691951,2019-12-31,2019-12-31,LLM
of March 2018,IN NNP CD,PREFIX_REGEX_1 MONTH_REGEX YEAR_REGEX_1,MODIFIER TIME TIME,time_reference,"As of March 2018, Humes began working with fashion retailer New Look.",1,15,== Other projects ==,19691951,2018-03-01,2018-03-31,LLM
late October 2006,JJ NNP CD,PREFIX_REGEX_1 MONTH_REGEX YEAR_REGEX_1,MODIFIER TIME TIME,time_reference,"In late October 2006, Humes was part of a group called The TigerLilys, who had a MySpace page displaying two tracks.",0,8,== Music career == | === 2005–2007: After S Club 8 ===,19691951,2006-10-21,2006-10-31,LLM
three years old,CD NNS JJ,BASIC_NUMBER_REGEX_1 TIME_UNIT_REGEX SUFFIX_REGEX,NUMERAL TIME MODIFIER,,"Her parents divorced when she was three years old, and she was raised by her mother and her uncle Paul Ince.",2,2,== Early life ==,19691951,1989-01-01,1989-12-31,LLM
presenter,NN,TIMELINE_REGEX,TIME,time_reference,Rochelle Eulah Eileen Humes (née Wiseman; born 21 March 1989) is an English singer and television presenter.,0,0,,19691951,,,ML
The Saturdays,DT NNP,PREFIX_REGEX_1 WEEK_REGEX,MODIFIER TIME,time_reference,"Humes began her career in British pop groups S Club Juniors and The Saturdays, and has gone on to co-present the ITV entertainment series Ninja Warrior UK.",1,0,,19691951,,,ML
This Morning,DT NNP,PREFIX_REGEX_1 DAY_TIME_REGEX,MODIFIER TIME,time_reference,"Humes regularly guest-hosts This Morning, and since 2019, she has co-presented the BBC game show The Hit List alongside husband Marvin Humes.",2,0,,19691951,,,ML
day,NN,TIME_UNIT_REGEX,TIME,time_reference,The single was promoted by the television series S Club Junior: The Story and was released in the UK on 22 April 2002 in a chart battle with the Sugababes who released their comeback single the same day.,4,5,== Music career == | === 2001–2005: S Club Juniors and S Club 8 ===,19691951,,,ML
eight weeks,CD NNS,BASIC_NUMBER_REGEX_1 TIME_UNIT_REGEX,NUMERAL TIME,time_reference,"Released on 22 July 2002, the single reached number two in the UK charts selling 52,000 copies, and spent eight weeks inside the UK top 75 and sold in excess of 110,000 copies in the UK.",6,5,== Music career == | === 2001–2005: S Club Juniors and S Club 8 ===,19691951,,,ML
7 October,CD NNP,DIGIT_REGEX_1 MONTH_REGEX,NUMERAL TIME,,"Their third single ""New Direction"" released on 7 October reached number two in the UK charts selling 55,000 copies in the first week.",7,5,== Music career == | === 2001–2005: S Club Juniors and S Club 8 ===,19691951,,,ML
six weeks,CD NNS,BASIC_NUMBER_REGEX_1 TIME_UNIT_REGEX,NUMERAL TIME,time_reference,"It became their third consecutive top ten hit, selling 130,000 copies in six weeks.",8,5,== Music career == | === 2001–2005: S Club Juniors and S Club 8 ===,19691951,,,ML
21 October,CD NNP,DIGIT_REGEX_1 MONTH_REGEX,NUMERAL TIME,,"The Juniors released their debut album Together on 21 October reaching number five in its first week of sale and selling 40,000 copies.",9,5,== Music career == | === 2001–2005: S Club Juniors and S Club 8 ===,19691951,,,ML
eight weeks,CD NNS,BASIC_NUMBER_REGEX_1 TIME_UNIT_REGEX,NUMERAL TIME,time_reference,"The single debuted at number six in the UK charts, and sold 85,000 copies in the UK, spending eight weeks inside the UK Top 40.",11,5,== Music career == | === 2001–2005: S Club Juniors and S Club 8 ===,19691951,,,ML
30 June,CD NNP,DIGIT_REGEX_1 MONTH_REGEX,NUMERAL TIME,,"The single released on 30 June reached number four in the UK chart, selling 26,000 copies in its first week and overall 75,000 copies in the UK.",13,5,== Music career == | === 2001–2005: S Club Juniors and S Club 8 ===,19691951,,,ML
Sundown,NNP,DAY_TIME_REGEX,TIME,time_reference,"A second single, ""Sundown"", was released in the UK on 29 September 2003 reaching number four in the UK and became their sixth and final top ten hit, selling 37,000 copies in its first week and 80,000 altogether.",14,5,== Music career == | === 2001–2005: S Club Juniors and S Club 8 ===,19691951,,,ML
Sundown,NNP,DAY_TIME_REGEX,TIME,time_reference,"The album, Sundown, was released on 13 October 2003 to dismal reviews.",15,5,== Music career == | === 2001–2005: S Club Juniors and S Club 8 ===,19691951,,,ML
the second week,DT JJ NN,PREFIX_REGEX_1 ORDINAL_REGEX_1 TIME_UNIT_REGEX,MODIFIER NUMERAL TIME,time_reference,It reached number 13 in the UK charts falling to 40 in the second week.,16,5,== Music career == | === 2001–2005: S Club Juniors and S Club 8 ===,19691951,,,ML
around the summer,IN DT NN,PREFIX_REGEX_1 PREFIX_REGEX_1 SEASON_REGEX,MODIFIER MODIFIER TIME,time_reference,"I Dream revolved around the summer school Avalon Heights, run by Professor Toone (played by Christopher Lloyd), where the characters tried to improve on their talents in the performing arts.",21,5,== Music career == | === 2001–2005: S Club Juniors and S Club 8 ===,19691951,,,ML
Sunday mornings,NNP NNS,WEEK_REGEX DAY_TIME_REGEX,TIME TIME,time_reference,The programme aired on Sunday mornings on BBC Two.,1,7,== Music career == | === 2005–2007: After S Club 8 ===,19691951,,,ML
The Saturdays,DT NNP,PREFIX_REGEX_1 WEEK_REGEX,MODIFIER TIME,time_reference,"On 22 October 2009, after finding fame again with The Saturdays, Humes returned to appear as a guest on Never Mind the Buzzcocks on Phill Jupitus' team.",4,8,== Music career == | === 2005–2007: After S Club 8 ===,19691951,,,ML
The Saturdays,DT NNP,PREFIX_REGEX_1 WEEK_REGEX,MODIFIER TIME,time_reference,The Saturdays ===,2,9,== Music career == | === 2007–2014: The Saturdays ===,19691951,,,ML
The Saturdays,DT NNP,PREFIX_REGEX_1 WEEK_REGEX,MODIFIER TIME,time_reference,"Since 2007, Humes has been a member of girl group The Saturdays, whose other members are Una Healy, Mollie King, Vanessa White, and fellow former S Club 8 member Frankie Bridge.",0,10,== Music career == | === 2007–2014: The Saturdays ===,19691951,,,ML
The Saturdays,DT NNP,PREFIX_REGEX_1 WEEK_REGEX,MODIFIER TIME,time_reference,"The Saturdays made their chart debut in July 2008 with ""If This Is Love"", which reached the top ten in the United Kingdom.",1,10,== Music career == | === 2007–2014: The Saturdays ===,19691951,,,ML
30 weeks,CD NNS,DIGIT_REGEX_1 TIME_UNIT_REGEX,NUMERAL TIME,time_reference,"Its follow-up single ""Up"" was released in October 2008, and the song debuted at number-five on the UK Singles Chart; to date the single has sold 310,000 copies in the UK alone as well as staying in the charts for exclusive 30 weeks.",2,10,== Music career == | === 2007–2014: The Saturdays ===,19691951,,,ML
20 weeks,CD NNS,DIGIT_REGEX_1 TIME_UNIT_REGEX,NUMERAL TIME,time_reference,"Headlines! saw release of top ten singles ""Missing You"" and ""Higher"" which features guest vocals from Flo Rida, both singles became a massive commercial success for the band with ""Higher"" spending a massive 20 weeks on the chart.",8,10,== Music career == | === 2007–2014: The Saturdays ===,19691951,,,ML
The Saturdays third,DT NNP JJ,PREFIX_REGEX_1 WEEK_REGEX ORDINAL_REGEX_1,MODIFIER TIME NUMERAL,time_reference,"The Saturdays third studio album, On Your Radar (2011) contained three highly successful selling singles and two of which—""Notorious"" and ""All Fired Up"" charted within the top ten on the UK Singles Chart.",9,10,== Music career == | === 2007–2014: The Saturdays ===,19691951,,,ML
The Saturdays,DT NNP,PREFIX_REGEX_1 WEEK_REGEX,MODIFIER TIME,time_reference,"The band released another extended play, Chasing The Saturdays which was only released in North America.",0,11,== Music career == | === 2007–2014: The Saturdays ===,19691951,,,ML
the Weekend,DT NNP,PREFIX_REGEX_1 TIME_UNIT_REGEX,MODIFIER TIME,time_reference,"The band's fourth studio album, Living for the Weekend saw the release of the singles; ""30 Days"", ""What About Us"", ""Gentleman"" and ""Disco Love"".",1,11,== Music career == | === 2007–2014: The Saturdays ===,19691951,,,ML
30 Days,CD NNPS,DIGIT_REGEX_1 TIME_UNIT_REGEX,NUMERAL TIME,,"""30 Days"" became the group's eleventh top-ten hit, while ""What About Us"" featuring Sean Paul saw The Saturdays earn their first number-one single in 2013, it is taken from their forthcoming fourth studio album, Living for the Weekend.",2,11,== Music career == | === 2007–2014: The Saturdays ===,19691951,,,ML
the Weekend,DT NNP,PREFIX_REGEX_1 TIME_UNIT_REGEX,MODIFIER TIME,time_reference,"The album's fourth single, ""Disco Love"", became their thirteenth top 10 single, with Living for the Weekend becoming their fourth top 10 album.",3,11,== Music career == | === 2007–2014: The Saturdays ===,19691951,,,ML
morning,NN,DAY_TIME_REGEX,TIME,time_reference,Humes began her TV presenting career by co-hosting children's morning TV show Smile from 2004 until 2006.,0,13,== Television and radio career ==,19691951,,,ML
This Morning,DT NNP,PREFIX_REGEX_1 DAY_TIME_REGEX,MODIFIER TIME,time_reference,"In August 2013, Humes and her husband joined This Morning as regular stand-in presenters.",2,13,== Television and radio career ==,19691951,,,ML
Christmas,NNP,HOLIDAY_REGEX,TIME,time_reference,"Humes also appeared as a regular host on the show alongside Phillip Schofield for a short period between November and December 2018, filling in for Schofield's co-star Holly Willoughby during her stint on I'm a Celebrity...Get Me Out of Here!On 25 December 2013, Humes took part in the Strictly Come Dancing Christmas special.",4,13,== Television and radio career ==,19691951,,,ML
Sunday night,NNP NN,WEEK_REGEX DAY_TIME_REGEX,TIME TIME,time_reference,"In 2016, Humes co-presented a new Sunday night entertainment series for ITV called The Next Great Magician alongside Stephen Mulhern.",11,13,== Television and radio career ==,19691951,,,ML
Sunday Morning,NNP NNP,WEEK_REGEX DAY_TIME_REGEX,TIME TIME,time_reference,"In 2017, Humes sat in for Emma Willis on Sunday Morning Breakfast with Mulhern on multiple occasions on Heart London.",13,13,== Television and radio career ==,19691951,,,ML
