time_expression,POST_tag,time_token,type_token,time_expression_type,sentences,sentenceIndex,paragraphIndex,section,wikiId,normalised_value_start,normalised_value_end,source
"August 25 , 1983","NNP CD , CD",MONTH_REGEX DIGIT_REGEX_1 COMMA_REGEX YEAR_REGEX_1,TIME NUMERAL MODIFIER TIME,time_reference,"David Kinkade (born August 25, 1983) is an American metal drummer and creator/ songwriter/ lyricist of The Monarch.",0,0,,20158675,1983-08-25,1983-08-25,ML
1983,CD,YEAR_REGEX_1,TIME,time_reference,David Kinkade was born in New Jersey in 1983.,0,2,== History ==,20158675,1983-01-01,1983-12-31,ML
August 2011,NNP CD,MONTH_REGEX YEAR_REGEX_1,TIME TIME,time_reference,"In August 2011, he was announced as the drummer of Soulfly, replacing Joe Nunez.",0,5,== History ==,20158675,2011-08-01,2011-08-31,ML
October 2011,NNP CD,MONTH_REGEX YEAR_REGEX_1,TIME TIME,time_reference,"In October 2011, he parted ways with Borknagar.",0,6,== History ==,20158675,2011-10-01,2011-10-31,ML
October 2012,NNP CD,MONTH_REGEX YEAR_REGEX_1,TIME TIME,time_reference,"In October 2012, he announced his retirement from music, leaving Soulfly after their show in Bangkok.",0,7,== History ==,20158675,2012-10-01,2012-10-31,ML
2020,CD,YEAR_REGEX_1,TIME,time_reference,"In 2020, Kinkade decided to return to creating music with his own band, The Monarch.",2,7,== History ==,20158675,2020-01-01,2020-12-31,ML
of 2021,IN CD,PREFIX_REGEX_1 YEAR_REGEX_1,MODIFIER TIME,time_reference,The Monarch independently released (digitally through Bloodblast Distribution) debut album “All The World’s Pain” in February of 2021.,0,8,== History ==,20158675,2021-01-01,2021-12-31,ML
2007,CD,YEAR_REGEX_1,TIME,time_reference,"In 2007, he started a foundation called the ""Metal 4 Pets Foundation"", which stands against animal abuse.",1,10,== Personal ==,20158675,2007-01-01,2007-12-31,ML
2021,CD,YEAR_REGEX_1,TIME,time_reference,"All The World's Pain (full length, 2021, Independent/ Bloodblast Distribution)",0,13,== Discography == | === With The Monarch ===,20158675,2021-01-01,2021-12-31,ML
2012,CD,YEAR_REGEX_1,TIME,time_reference,"Enslaved (full-length, 2012, Roadrunner Records)",0,15,== Discography == | === With Soulfly ===,20158675,2012-01-01,2012-12-31,ML
2010,CD,YEAR_REGEX_1,TIME,time_reference,"Universal (full-length, 2010, Indie Recordings)",0,17,== Discography == | === With Borknagar ===,20158675,2010-01-01,2010-12-31,ML
2006,CD,YEAR_REGEX_1,TIME,time_reference,"Sever All Negatives (EP, 2006)",0,20,== Discography == | === With Council of the Fallen ===,20158675,2006-01-01,2006-12-31,ML
20 years ago,CD NNS RB,DIGIT_REGEX_1 TIME_UNIT_REGEX SUFFIX_REGEX,NUMERAL TIME MODIFIER,,"By resurrecting my own personal project that I started 20 years ago, I’m finally making it happen on my own terms and under my own rules.",8,7,== History ==,20158675,2001-01-01,2001-12-31,LLM
now,RB,TIMELINE_REGEX,TIME,time_reference,"I’m older now, I have a child, a career.",4,7,== History ==,20158675,,,ML
February,NNP,MONTH_REGEX,TIME,time_reference,The Monarch independently released (digitally through Bloodblast Distribution) debut album “All The World’s Pain” in February of 2021.,0,8,== History ==,20158675,,,ML
currently,RB,TIMELINE_REGEX,TIME,time_reference,He currently lives in Chicago and works as a locomotive engineer.,3,10,== Personal ==,20158675,,,ML
"2012 , Century","CD , NNP",YEAR_REGEX_1 COMMA_REGEX TIME_UNIT_REGEX,TIME MODIFIER TIME,,"Urd (full-length, 2012, Century Media Records)",0,18,== Discography == | === With Borknagar ===,20158675,,,ML
of the Fallen,IN DT NNP,PREFIX_REGEX_1 PREFIX_REGEX_1 SEASON_REGEX,MODIFIER MODIFIER TIME,time_reference,With Council of the Fallen ===,1,19,== Discography == | === With Council of the Fallen ===,20158675,,,ML
