time_expression,POST_tag,time_token,type_token,time_expression_type,sentences,sentenceIndex,paragraphIndex,section,wikiId,normalised_value_start,normalised_value_end,source
8 December 1939,CD NNP CD,DIGIT_REGEX_1 MONTH_REGEX YEAR_REGEX_1,NUMERAL TIME TIME,time_point,"Sir James Galway  (born 8 December 1939) is an Irish virtuoso flute player from Belfast, nicknamed ""The Man with the Golden Flute"".",0,0,,221549,1939-12-08,1939-12-08,ML
2005,CD,YEAR_REGEX_1,TIME,time_reference,"In 2005, he received the Brit Award for Outstanding Contribution to Music at the Classic Brit Awards.",2,0,,221549,2005-01-01,2005-12-31,ML
1969 to 1975,CD TO CD,YEAR_REGEX_1 LINKAGE_REGEX YEAR_REGEX_1,TIME MODIFIER TIME,time_range,He auditioned for the Berlin Philharmonic Orchestra under Herbert von Karajan and was principal flute in the orchestra from 1969 to 1975.,6,4,== Education and career ==,221549,1969-01-01,1975-12-31,ML
1987,CD,YEAR_REGEX_1,TIME,time_reference,The album James Galway and The Chieftains in Ireland by Galway and The Chieftains reached number 32 in the UK Albums Chart in 1987.,9,4,== Education and career ==,221549,1987-01-01,1987-12-31,ML
1990,CD,YEAR_REGEX_1,TIME,time_reference,"In 1990, he was invited by Roger Waters to play at The Wall – Live in Berlin concert, held in Potsdamer Platz; he played Pink Floyd's songs ""Goodbye Blue Sky"" and ""Is There Anybody Out There?"".",12,4,== Education and career ==,221549,1990-01-01,1990-12-31,ML
June 2008,NNP CD,MONTH_REGEX YEAR_REGEX_1,TIME TIME,time_reference,"In June 2008, he was inducted into the Hollywood Bowl Hall of Fame along with Liza Minnelli and B. B. King.",14,4,== Education and career ==,221549,2008-06-01,2008-06-30,ML
2003,CD,YEAR_REGEX_1,TIME,time_reference,"In 2003 he formed the Music Education Consortium together with Julian Lloyd Webber, Evelyn Glennie, and Michael Kamen to pressure the British Government into providing better music education in schools.",1,5,== Education and career ==,221549,2003-01-01,2003-12-31,ML
1977,CD,YEAR_REGEX_1,TIME,time_reference,"He was made an Officer of the Order of the British Empire (OBE) in 1977, and was knighted in 2001, the first wind player ever to receive that honour.",3,5,== Education and career ==,221549,1977-01-01,1977-12-31,ML
2001,CD,YEAR_REGEX_1,TIME,time_reference,"He was made an Officer of the Order of the British Empire (OBE) in 1977, and was knighted in 2001, the first wind player ever to receive that honour.",3,5,== Education and career ==,221549,2001-01-01,2001-12-31,ML
December 2013,NNP CD,MONTH_REGEX YEAR_REGEX_1,TIME TIME,time_reference,"In December 2013 Galway launched First Flute, an online interactive series of lessons for beginning flute students of all ages.",5,5,== Education and career ==,221549,2013-12-01,2013-12-31,ML
the 2014,DT CD,PREFIX_REGEX_1 YEAR_REGEX_1,MODIFIER TIME,time_reference,He received the 2014 Gramophone Lifetime Achievement Award.,6,5,== Education and career ==,221549,2014-01-01,2014-12-31,ML
1972,CD,YEAR_REGEX_1,TIME,time_reference,"He married his second wife, Anna (Annie) Renggli, a daughter of a well-known Swiss architect, in 1972, and moved from Berlin to Lucerne, Switzerland, her hometown.",2,7,== Personal life ==,221549,1972-01-01,1972-12-31,ML
1978,CD,YEAR_REGEX_1,TIME,time_reference,"In 1978 he recorded for her an instrumental version of John Denver's ""Annie's Song"".",4,7,== Personal life ==,221549,1978-01-01,1978-12-31,ML
1984,CD,YEAR_REGEX_1,TIME,time_reference,"After their divorce, he moved to Meggen, Switzerland, a village next to Lucerne, where he resides now with his third wife, the American-born flutist Jeanne Galway (née Cinnante), whom he married in 1984.",6,7,== Personal life ==,221549,1984-01-01,1984-12-31,ML
August 1977,NNP CD,MONTH_REGEX YEAR_REGEX_1,TIME TIME,time_reference,"In August 1977, Galway was run over by a speeding motorcycle in Lucerne, breaking his left arm and both legs and required a four-month hospital stay.",0,8,== Personal life ==,221549,1977-08-01,1977-08-31,ML
December 2009,NNP CD,MONTH_REGEX YEAR_REGEX_1,TIME TIME,time_reference,"In December 2009, he fell down a flight of stairs at his home, fracturing his left wrist and breaking his right arm.",2,8,== Personal life ==,221549,2009-12-01,2009-12-31,ML
June 2015,NNP CD,MONTH_REGEX YEAR_REGEX_1,TIME TIME,time_reference,"Appearing on The Nolan Show in June 2015, Galway stated that he views his national identity as Irish.",3,8,== Personal life ==,221549,2015-06-01,2015-06-30,ML
1940–2020,CD,YEAR_REGEX_1,TIME,time_reference,"James's younger brother George Galway (1940–2020) was a jazz musician (clarinet, flute, and saxophone) and teacher based in Manchester, England.",7,8,== Personal life ==,221549,1940-01-01,2020-12-31,ML
the 1980s,DT CD,PREFIX_REGEX_1 YEAR_REGEX_1,MODIFIER TIME,time_reference,"George's elder child and James's nephew, Martin Galway, is a musician known for his work on Commodore 64 computer game music in the 1980s.",8,8,== Personal life ==,221549,1980-01-01,1989-12-31,ML
2014,CD,YEAR_REGEX_1,TIME,time_reference,All release dates for non-compilations below are taken from the liner notes for The Man with the Golden Flute – The Complete RCA Collection (71 CDs and 2 DVDs box set) (2014).,1,10,== Discography ==,221549,2014-01-01,2014-12-31,ML
1978,CD,YEAR_REGEX_1,TIME,time_reference,"SourcesGalway, James (1978).",0,14,== References ==,221549,1978-01-01,1978-12-31,ML
1982,CD,YEAR_REGEX_1,TIME,time_reference,"Galway, James; W. Mann (1982).",0,15,== References ==,221549,1982-01-01,1982-12-31,ML
1982,CD,YEAR_REGEX_1,TIME,time_reference,"Galway, James. (1982).",0,16,== References ==,221549,1982-01-01,1982-12-31,ML
1990,CD,YEAR_REGEX_1,TIME,time_reference,"ISBN 0-02-871380-X Reprinted 1990, London: Kahn & Averill London: Khan & Averill ISBN 1-871082-13-7",6,16,== References ==,221549,1990-01-01,1990-12-31,ML
15 September 2008,CD NNP CD,DIGIT_REGEX_1 MONTH_REGEX YEAR_REGEX_1,NUMERAL TIME TIME,time_point,IMGArtists.com 15 September 2008.,1,19,== External links ==,221549,2008-09-15,2008-09-15,ML
10 February 2009,CD NNP CD,DIGIT_REGEX_1 MONTH_REGEX YEAR_REGEX_1,NUMERAL TIME TIME,time_point,Archived from the original on 10 February 2009.,1,20,== External links ==,221549,2009-02-10,2009-02-10,ML
5 August 2008,CD NNP CD,DIGIT_REGEX_1 MONTH_REGEX YEAR_REGEX_1,NUMERAL TIME TIME,time_point,AllAboutJazz.com 5 August 2008.,2,20,== External links ==,221549,2008-08-05,2008-08-05,ML
1976,CD,YEAR_REGEX_1,TIME,time_reference,"Photo and details of Southern Africa tour, 1976, dedicated to tour organiser Hans Adler",0,24,== External links ==,221549,1976-01-01,1976-12-31,ML
"April 21 , 1989","NNP CD , CD",MONTH_REGEX DIGIT_REGEX_1 COMMA_REGEX YEAR_REGEX_1,TIME NUMERAL MODIFIER TIME,time_reference,"Interview with Sir James Galway, April 21, 1989",0,25,== External links ==,221549,1989-04-21,1989-04-21,ML
night-shifts,NNS,DAY_TIME_REGEX,TIME,time_reference,"His father, who played the flute, was employed at the Harland and Wolff shipyard until the end of the Second World War and spent night-shifts cleaning buses after the war, while his mother, a pianist, was a winder in a flax-spinning mill.",1,2,== Early life ==,221549,,,ML
day,NN,TIME_UNIT_REGEX,TIME,time_reference,"At the age of eleven Galway won the junior, senior, and open Belfast flute Championships in a single day.",3,2,== Early life ==,221549,,,ML
two years,CD NNS,BASIC_NUMBER_REGEX_1 TIME_UNIT_REGEX,NUMERAL TIME,time_reference,He left school at the age of fourteen and worked as an apprentice to a piano repairer for two years.,5,2,== Early life ==,221549,,,ML
fifteen years,JJ NNS,BASIC_NUMBER_REGEX_1 TIME_UNIT_REGEX,NUMERAL TIME,time_reference,He went on to spend fifteen years as an orchestral player.,4,4,== Education and career ==,221549,,,ML
now,RB,TIMELINE_REGEX,TIME,time_reference,"After their divorce, he moved to Meggen, Switzerland, a village next to Lucerne, where he resides now with his third wife, the American-born flutist Jeanne Galway (née Cinnante), whom he married in 1984.",6,7,== Personal life ==,221549,,,ML
16 September,CD NNP,DIGIT_REGEX_1 MONTH_REGEX,NUMERAL TIME,,"""Sir James Galway's New Recording O'Reilly Street to Be Released on 16 September"".",0,20,== External links ==,221549,,,ML
