time_expression,POST_tag,time_token,type_token,time_expression_type,sentences,sentenceIndex,paragraphIndex,section,wikiId,normalised_value_start,normalised_value_end,source
1956,CD,YEAR_REGEX_1,TIME,time_reference,He began recording in 1956.,0,2,== Biography ==,2335315,1956-01-01,1956-12-31,ML
1957,CD,YEAR_REGEX_1,TIME,time_reference,"In 1957, Hawkins was playing at Shreveport, Louisiana clubs, and although his music was influenced by the new rock and roll style of Elvis Presley and the guitar sounds of Scotty Moore, Hawkins blended that with the uniquely heavy blues sound of black Louisiana artists for his recording of his swamp-rock classic, ""Susie Q."" Fellow Louisiana guitarist and future Rock and Roll Hall of Famer James Burton provided the signature riff and solo.",1,2,== Biography ==,2335315,1957-01-01,1957-12-31,ML
1958,CD,YEAR_REGEX_1,TIME,time_reference,Suzy Q  was released in 1958.,4,2,== Biography ==,2335315,1958-01-01,1958-12-31,ML
1958,CD,YEAR_REGEX_1,TIME,time_reference,"In 1958 Hawkins recorded a single of Willie Dixon's ""My Babe"" at the Chess Records studio in Chicago, featuring Telecaster guitarist Roy Buchanan.",6,2,== Biography ==,2335315,1958-01-01,1958-12-31,ML
1998,CD,YEAR_REGEX_1,TIME,time_reference,"In 1998, Ace Records issued a compilation album, Dale Hawkins, Rock 'n' Roll Tornado, which contained a collection of his early works and previously unreleased material.",13,2,== Biography ==,2335315,1998-01-01,1998-12-31,ML
1969,CD,YEAR_REGEX_1,TIME,time_reference,"Other recordings included his 1969 country rock album, L.A., Memphis & Tyler, Texas; and a 1999 release, Wildcat Tamer, of all-new recordings that garnered Hawkins a 4-star review in Rolling Stone.",14,2,== Biography ==,2335315,1969-01-01,1969-12-31,ML
the 1990s,DT CD,PREFIX_REGEX_1 YEAR_REGEX_1,MODIFIER TIME,time_reference,"In the 1990s, he produced ""Goin Back to Mississippi"" by R. L. Burnside's slide guitarist, Kenny Brown.",1,3,== Biography ==,2335315,1990-01-01,1999-12-31,ML
the 2008,DT CD,PREFIX_REGEX_1 YEAR_REGEX_1,MODIFIER TIME,time_reference,Dale Hawkins was among hundreds of artists whose material was reportedly destroyed in the 2008 Universal fire.,0,5,== Biography ==,2335315,2008-01-01,2008-12-31,ML
2005,CD,YEAR_REGEX_1,TIME,time_reference,"In 2005, he was diagnosed with colon cancer and began chemotherapy while continuing to perform in the US and abroad.",0,7,== Death ==,2335315,2005-01-01,2005-12-31,ML
October 2007,NNP CD,MONTH_REGEX YEAR_REGEX_1,TIME TIME,time_reference,"In October 2007, The Louisiana Music Hall of Fame honored Dale Hawkins for his contributions to Louisiana music by inducting him into The Louisiana Music Hall Of Fame.",1,7,== Death ==,2335315,2007-10-01,2007-10-31,ML
"February 13 , 2010","NNP CD , CD",MONTH_REGEX DIGIT_REGEX_1 COMMA_REGEX YEAR_REGEX_1,TIME NUMERAL MODIFIER TIME,time_reference,"Hawkins died on February 13, 2010, from colon cancer in Little Rock, Arkansas.",0,8,== Death ==,2335315,2010-02-13,2010-02-13,ML
the early 1960s,DT JJ NNS,PREFIX_REGEX_1 PREFIX_REGEX_1 YEAR_REGEX_1,MODIFIER MODIFIER TIME,time_reference,He recorded more songs for Chess into the early 1960s.,8,2,== Biography ==,2335315,1960-01-01,1963-12-31,LLM
"August 22 , 1936 – February 13 , 2010","NNP CD , CD NNP NNP CD , CD",MONTH_REGEX DIGIT_REGEX_1 COMMA_REGEX YEAR_REGEX_1 LINKAGE_REGEX MONTH_REGEX DIGIT_REGEX_1 COMMA_REGEX YEAR_REGEX_1,TIME NUMERAL MODIFIER TIME MODIFIER TIME NUMERAL MODIFIER TIME,time_reference,"Delmar Allen ""Dale"" Hawkins (August 22, 1936 – February 13, 2010) was a pioneer American rock singer, songwriter, and rhythm guitarist who was often called the architect of swamp rock boogie.",0,0,,2335315,1936-08-22,2010-02-13,LLM
their 1968,PRP$ CD,PREFIX_REGEX_1 YEAR_REGEX_1,MODIFIER TIME,,Creedence Clearwater Revival's version of the song on their 1968 debut album helped launch their career and today it is probably the best-known version.,5,2,== Biography ==,2335315,,,ML
previously,RB,TIMELINE_REGEX,TIME,time_reference,"In 1998, Ace Records issued a compilation album, Dale Hawkins, Rock 'n' Roll Tornado, which contained a collection of his early works and previously unreleased material.",13,2,== Biography ==,2335315,,,ML
a 1999,DT CD,INARTICLE_REGEX YEAR_REGEX_1,MODIFIER TIME,time_reference,"Other recordings included his 1969 country rock album, L.A., Memphis & Tyler, Texas; and a 1999 release, Wildcat Tamer, of all-new recordings that garnered Hawkins a 4-star review in Rolling Stone.",14,2,== Biography ==,2335315,,,ML
their 2007,PRP$ CD,PREFIX_REGEX_1 YEAR_REGEX_1,MODIFIER TIME,,"It was recognized by the UK's music magazine, Mojo, as No. 10 in the Americana category in their 2007 Best of issue, while L.A., Memphis & Tyler, Texas was awarded No. 8 in the reissue category.",3,7,== Death ==,2335315,,,ML
