time_expression,POST_tag,time_token,type_token,time_expression_type,sentences,sentenceIndex,paragraphIndex,section,wikiId,normalised_value_start,normalised_value_end,source
8 August 1969,CD NNP CD,DIGIT_REGEX_1 MONTH_REGEX YEAR_REGEX_1,NUMERAL TIME TIME,time_point,"Faye Wong (born Xia Lin on 8 August 1969) is a Hong Kong singer-songwriter and actress, often referred as the ""Diva of Asia"".",0,0,,294664,1969-08-08,1969-08-08,ML
1987,CD,YEAR_REGEX_1,TIME,time_reference,"Born in Beijing, she moved to British Hong Kong in 1987 and came to public attention in the early 1990s by singing in Cantonese, often combining alternative music with mainstream Chinese pop.",2,0,,294664,1987-01-01,1987-12-31,ML
1994,CD,YEAR_REGEX_1,TIME,time_reference,"Since 1994, she has recorded mostly in her native Mandarin.",3,0,,294664,1994-01-01,1994-12-31,ML
2000,CD,YEAR_REGEX_1,TIME,time_reference,"In 2000, she was recognised by Guinness World Records as the Best Selling Canto-Pop Female.",4,0,,294664,2000-01-01,2000-12-31,ML
2005,CD,YEAR_REGEX_1,TIME,time_reference,"Following her second marriage in 2005, she withdrew from the limelight, but returned to the stage in 2010.",5,0,,294664,2005-01-01,2005-12-31,ML
2010,CD,YEAR_REGEX_1,TIME,time_reference,"Following her second marriage in 2005, she withdrew from the limelight, but returned to the stage in 2010.",5,0,,294664,2010-01-01,2010-12-31,ML
2046,CD,YEAR_REGEX_1,TIME,time_reference,In the West she is perhaps best known for starring in Wong Kar-wai's films Chungking Express and 2046.,7,0,,294664,2046-01-01,2046-12-31,ML
1969–1991,CD,YEAR_REGEX_1,TIME,time_reference,1969–1991: Early life and Shirley Wong =,1,2,== Life and career == | === 1969–1991: Early life and Shirley Wong ===,294664,1969-01-01,1991-12-31,ML
1985 to 1987,CD TO CD,YEAR_REGEX_1 LINKAGE_REGEX YEAR_REGEX_1,TIME MODIFIER TIME,time_range,"Despite her mother's opposition, Wong released 6 low-cost cover albums from 1985 to 1987 while still in high school, all in the form of cassettes, mostly consisting of songs by her personal idol, iconic Taiwanese singer Teresa Teng.",4,3,== Life and career == | === 1969–1991: Early life and Shirley Wong ===,294664,1985-01-01,1987-12-31,ML
1987,CD,YEAR_REGEX_1,TIME,time_reference,"In 1987, after being accepted to Xiamen University for college, she migrated to Hong Kong to join her father, who had been working there for a few years.",6,3,== Life and career == | === 1969–1991: Early life and Shirley Wong ===,294664,1987-01-01,1987-12-31,ML
1988,CD,YEAR_REGEX_1,TIME,time_reference,"Under Tai's tutelage, the 19-year-old signed with Cinepoly Records after winning third place in an ABU singing contest in 1988.",10,3,== Life and career == | === 1969–1991: Early life and Shirley Wong ===,294664,1988-01-01,1988-12-31,ML
1989,CD,YEAR_REGEX_1,TIME,time_reference,"In 1989, her debut album Shirley Wong sold over 30,000 copies and helped her win bronze at the ""Chik Chak New Artist Award"".",14,3,== Life and career == | === 1969–1991: Early life and Shirley Wong ===,294664,1989-01-01,1989-12-31,ML
1991,CD,YEAR_REGEX_1,TIME,time_reference,"Frustrated with her career decision, in 1991 she travelled to New York City for vocal studies and cultural exchange.",0,4,== Life and career == | === 1969–1991: Early life and Shirley Wong ===,294664,1991-01-01,1991-12-31,ML
1996,CD,YEAR_REGEX_1,TIME,time_reference,"Faye Wong explained in 1996,",2,4,== Life and career == | === 1969–1991: Early life and Shirley Wong ===,294664,1996-01-01,1996-12-31,ML
1992–1993,CD,YEAR_REGEX_1,TIME,time_reference,1992–1993:,1,7,== Life and career == | === 1992–1993: Rise to notability ===,294664,1992-01-01,1993-12-31,ML
The 1992,DT CD,PREFIX_REGEX_1 YEAR_REGEX_1,MODIFIER TIME,time_reference,The 1992 album Coming Home incorporated R&B influences and was a change in musical direction from the more traditional Cantopop fare of her earlier albums.,0,8,== Life and career == | === 1992–1993: Rise to notability ===,294664,1992-01-01,1992-12-31,ML
this 1972,DT CD,PREFIX_REGEX_1 YEAR_REGEX_1,MODIFIER TIME,time_reference,"(Thanks to Wong's cover, this 1972 song—in different language versions—would in the early 1990s become a huge regional hit in Thailand, Vietnam and the rest of Southeast Asia and even Turkey; the most popular English version was titled ""Broken-Hearted Woman"".)",2,8,== Life and career == | === 1992–1993: Rise to notability ===,294664,1972-01-01,1972-12-31,ML
2003,CD,YEAR_REGEX_1,TIME,time_reference,"Wong stated in a 1994 concert that she very much liked this song, after which various websites listed it as her personal favourite; however, in a 1998 CNN interview she declined to name one favourite song, saying that there were too many, and in 2003 she stated that she no longer liked her old songs.",4,8,== Life and career == | === 1992–1993: Rise to notability ===,294664,2003-01-01,2003-12-31,ML
1992–93,CD,YEAR_REGEX_1,TIME,time_reference,In 1992–93 she also starred in TVB shows such as File of Justice II (壹號皇庭II) and Legendary Ranger (原振俠).,6,8,== Life and career == | === 1992–1993: Rise to notability ===,294664,1992-01-01,1993-12-31,ML
1993,CD,YEAR_REGEX_1,TIME,time_reference,"In 1993, she wrote the Mandarin lyrics for her ballad ""No Regrets"" (執迷不悔) which led many to praise her as a gifted lyricist.",0,9,== Life and career == | === 1992–1993: Rise to notability ===,294664,1993-01-01,1993-12-31,ML
1993–1994,CD,YEAR_REGEX_1,TIME,time_reference,1993–1994:,1,10,== Life and career == | === 1993–1994: Alternative style ===,294664,1993-01-01,1994-12-31,ML
September 1993,NNP CD,MONTH_REGEX YEAR_REGEX_1,TIME TIME,time_reference,"Her next album 100,000 Whys (September 1993) showed considerable alternative music influences from the West, including the popular song ""Cold War"" (冷戰), a cover of ""Silent All These Years"" by Tori Amos.",0,11,== Life and career == | === 1993–1994: Alternative style ===,294664,1993-09-01,1993-09-30,ML
1994–1995,CD,YEAR_REGEX_1,TIME,time_reference,1994–1995:,1,13,== Life and career == | === 1994–1995: Mandarin market ===,294664,1994-01-01,1995-12-31,ML
1994,CD,YEAR_REGEX_1,TIME,time_reference,"Besides two Cantonese albums in 1994, Wong released two other albums in Mandarin in Taiwan, Mystery (迷) and Sky (天空).",0,14,== Life and career == | === 1994–1995: Mandarin market ===,294664,1994-01-01,1994-12-31,ML
1995,CD,YEAR_REGEX_1,TIME,time_reference,"In 1995, she released Decadent Sounds of Faye (菲靡靡之音), a cover album of songs originally recorded by her idol Teresa Teng, one of the most revered Chinese singers of the 20th century.",0,17,== Life and career == | === 1994–1995: Mandarin market ===,294664,1995-01-01,1995-12-31,ML
the 1995,DT CD,PREFIX_REGEX_1 YEAR_REGEX_1,MODIFIER TIME,time_reference,"Faye Wong along with her then yet-to-be husband and rock music icon Dou Wei, were the winner and the runner-up to the 1995 MTV International Viewer's Choice Award; claiming first and second-place respectively with the music videos ""Chess"" and ""Black Dream"".",0,18,== Life and career == | === 1994–1995: Mandarin market ===,294664,1995-01-01,1995-12-31,ML
1996,CD,YEAR_REGEX_1,TIME,time_reference,1996:,1,20,== Life and career == | === 1996: Restless and Cinepoly EPs ===,294664,1996-01-01,1996-12-31,ML
1996,CD,YEAR_REGEX_1,TIME,time_reference,"1996 saw the release of what many would consider her boldest and most artistically coherent effort to date, Fuzao (浮躁), usually translated as Restless or Impatience.",0,21,== Life and career == | === 1996: Restless and Cinepoly EPs ===,294664,1996-01-01,1996-12-31,ML
1994,CD,YEAR_REGEX_1,TIME,time_reference,"As Wong had covered their work in 1994, she had established a remote working relationship with them—even laying down vocals for a special duet version of ""Serpentskirt"" on the Asian release of the group's 1996 album, Milk And Kisses.",3,21,== Life and career == | === 1996: Restless and Cinepoly EPs ===,294664,1994-01-01,1994-12-31,ML
1996,CD,YEAR_REGEX_1,TIME,time_reference,"As Wong had covered their work in 1994, she had established a remote working relationship with them—even laying down vocals for a special duet version of ""Serpentskirt"" on the Asian release of the group's 1996 album, Milk And Kisses.",3,21,== Life and career == | === 1996: Restless and Cinepoly EPs ===,294664,1996-01-01,1996-12-31,ML
1993 to 1995,CD TO CD,YEAR_REGEX_1 LINKAGE_REGEX YEAR_REGEX_1,TIME MODIFIER TIME,time_range,"From 1993 to 1995, Cinepoly released an EP of Wong's songs each year: Like Wind (如風), Faye Disc (菲碟), and One Person, Two Roles (一人分飾兩角).",0,23,== Life and career == | === 1996: Restless and Cinepoly EPs ===,294664,1993-01-01,1995-12-31,ML
1996–97,CD,YEAR_REGEX_1,TIME,time_reference,"Then in 1996–97, she recorded ten original songs in Cantonese all written by lyricist Lin Xi",1,23,== Life and career == | === 1996: Restless and Cinepoly EPs ===,294664,1996-01-01,1997-12-31,ML
2002,CD,YEAR_REGEX_1,TIME,time_reference,"The other two songs were included in later compilations; the last to be released was ""Scary"" (心驚膽顫) in 2002.",5,23,== Life and career == | === 1996: Restless and Cinepoly EPs ===,294664,2002-01-01,2002-12-31,ML
1997,CD,YEAR_REGEX_1,TIME,time_reference,1997:,1,24,== Life and career == | === 1997: EMI and Faye Wong ===,294664,1997-01-01,1997-12-31,ML
1997,CD,YEAR_REGEX_1,TIME,time_reference,"Wong signed for the recording giant EMI in 1997 after her first daughter was born, in a contract worth HK$60 million (approx.",0,25,== Life and career == | === 1997: EMI and Faye Wong ===,294664,1997-01-01,1997-12-31,ML
autumn 1997,NN CD,SEASON_REGEX YEAR_REGEX_1,TIME TIME,time_reference,"Her first album with EMI was Faye Wong (王菲), released in autumn 1997.",0,26,== Life and career == | === 1997: EMI and Faye Wong ===,294664,1997-01-01,1997-12-31,ML
1996,CD,YEAR_REGEX_1,TIME,time_reference,Critics expecting another artistic breakthrough after 1996's Restlessness found—much to their dismay—a much more inoffensive and commercially oriented musical album.,1,26,== Life and career == | === 1997: EMI and Faye Wong ===,294664,1996-01-01,1996-12-31,ML
1997,CD,YEAR_REGEX_1,TIME,time_reference,"Wong's old company Cinepoly, which retains the copyright on her previous records, released a Mandarin compilation at the same time in 1997 to counteract her new EMI album (and indeed outperformed it).",7,26,== Life and career == | === 1997: EMI and Faye Wong ===,294664,1997-01-01,1997-12-31,ML
1998,CD,YEAR_REGEX_1,TIME,time_reference,1998:,1,27,== Life and career == | === 1998: Mainland China ===,294664,1998-01-01,1998-12-31,ML
1997,CD,YEAR_REGEX_1,TIME,time_reference,In 1997 singer Na Ying signed with EMI and struck a lasting friendship with Wong.,0,28,== Life and career == | === 1998: Mainland China ===,294664,1997-01-01,1997-12-31,ML
1998,CD,YEAR_REGEX_1,TIME,time_reference,"Na had been a regular at the annual CCTV New Year's Gala, the highest-watched TV show in Mainland China, and she invited Wong to do a duet with her on the upcoming show in 1998.",1,28,== Life and career == | === 1998: Mainland China ===,294664,1998-01-01,1998-12-31,ML
1998,CD,YEAR_REGEX_1,TIME,time_reference,"The collaboration by the ""Mainland Diva"" and ""Hong Kong Diva"", titled ""Let's Meet in 1998"", became an instant hit and arguably the most played song in Mainland China that year.",2,28,== Life and career == | === 1998: Mainland China ===,294664,1998-01-01,1998-12-31,ML
late 1998,JJ CD,PREFIX_REGEX_1 YEAR_REGEX_1,MODIFIER TIME,time_reference,"Thanks to this exposure, in late 1998 Wong finally held her first concert in her native Mainland China, and continued her tour in 9 cities.",3,28,== Life and career == | === 1998: Mainland China ===,294664,1998-01-01,1998-12-31,ML
1999,CD,YEAR_REGEX_1,TIME,time_reference,It was the best selling Chinese album in Singapore in 1999.,0,30,== Life and career == | === 1998: Mainland China ===,294664,1999-01-01,1999-12-31,ML
of 1999,IN CD,PREFIX_REGEX_1 YEAR_REGEX_1,MODIFIER TIME,time_reference,"Together with Lovers & Strangers and the compilation album Wishing We Last Forever, it gave Faye Wong 3 albums in the Singapore top 10 selling Chinese albums of 1999, making her one of the best selling artists in Singapore in 1999.",1,30,== Life and career == | === 1998: Mainland China ===,294664,1999-01-01,1999-12-31,ML
1999,CD,YEAR_REGEX_1,TIME,time_reference,"Together with Lovers & Strangers and the compilation album Wishing We Last Forever, it gave Faye Wong 3 albums in the Singapore top 10 selling Chinese albums of 1999, making her one of the best selling artists in Singapore in 1999.",1,30,== Life and career == | === 1998: Mainland China ===,294664,1999-01-01,1999-12-31,ML
1999,CD,YEAR_REGEX_1,TIME,time_reference,=== 1999:,0,31,== Life and career == | === 1999: Venturing into Japan ===,294664,1999-01-01,1999-12-31,ML
February 1999,NNP CD,MONTH_REGEX YEAR_REGEX_1,TIME TIME,time_reference,"The video game Final Fantasy VIII was released in Japan in February 1999, for which Faye Wong recorded the ballad ""Eyes on Me"" in English.",0,32,== Life and career == | === 1999: Venturing into Japan ===,294664,1999-02-01,1999-02-28,ML
2046,CD,YEAR_REGEX_1,TIME,time_reference,"In addition, she began filming for 2046 in August, a project she would pursue on and off over the next few years when her schedule permitted.",0,34,== Life and career == | === 1999: Venturing into Japan ===,294664,2046-01-01,2046-12-31,ML
2000,CD,YEAR_REGEX_1,TIME,time_reference,=== 2000:,0,35,== Life and career == | === 2000: Fable ===,294664,2000-01-01,2000-12-31,ML
2001–2004,CD,YEAR_REGEX_1,TIME,time_reference,2001–2004: Faye Wong and To Love =,1,38,== Life and career == | === 2001–2004: Faye Wong and To Love ===,294664,2001-01-01,2004-12-31,ML
2046,CD,YEAR_REGEX_1,TIME,time_reference,"While she was under contract with EMI and later Sony, she performed in the ensemble movie 2046 which had been in production since 1999 and finally wrapped in 2004.",0,41,== Life and career == | === 2001–2004: Faye Wong and To Love ===,294664,2046-01-01,2046-12-31,ML
1999,CD,YEAR_REGEX_1,TIME,time_reference,"While she was under contract with EMI and later Sony, she performed in the ensemble movie 2046 which had been in production since 1999 and finally wrapped in 2004.",0,41,== Life and career == | === 2001–2004: Faye Wong and To Love ===,294664,1999-01-01,1999-12-31,ML
2004,CD,YEAR_REGEX_1,TIME,time_reference,"While she was under contract with EMI and later Sony, she performed in the ensemble movie 2046 which had been in production since 1999 and finally wrapped in 2004.",0,41,== Life and career == | === 2001–2004: Faye Wong and To Love ===,294664,2004-01-01,2004-12-31,ML
November 2003,NNP CD,MONTH_REGEX YEAR_REGEX_1,TIME TIME,time_reference,"For her Sony album To Love (將愛), released in November 2003, she recorded 13 tracks, 10 in Mandarin and 3 in Cantonese.",0,43,== Life and career == | === 2001–2004: Faye Wong and To Love ===,294664,2003-11-01,2003-11-30,ML
the 2004,DT CD,PREFIX_REGEX_1 YEAR_REGEX_1,MODIFIER TIME,time_reference,"At the 2004 Golden Melody Awards, she was awarded Best Female Artist after being nominated many times.",1,44,== Life and career == | === 2001–2004: Faye Wong and To Love ===,294664,2004-01-01,2004-12-31,ML
2005–2009,CD,YEAR_REGEX_1,TIME,time_reference,=== 2005–2009: Hiatus ===,0,45,== Life and career == | === 2005–2009: Hiatus ===,294664,2005-01-01,2009-12-31,ML
January 2005,NNP CD,MONTH_REGEX YEAR_REGEX_1,TIME TIME,time_reference,"In January 2005, during the last concert of her tour, the usually reticent Faye Wong left a quote that left her fans wondering: ""If I ever retire from showbiz, I hope you all forget about me.""",0,46,== Life and career == | === 2005–2009: Hiatus ===,294664,2005-01-01,2005-01-31,ML
May 2005,NNP CD,MONTH_REGEX YEAR_REGEX_1,TIME TIME,time_reference,"In May 2005 her agent Katie Chan (陳家瑛) confirmed to press that Wong was ""resting indefinitely"".",1,46,== Life and career == | === 2005–2009: Hiatus ===,294664,2005-05-01,2005-05-31,ML
May 2008,NNP CD,MONTH_REGEX YEAR_REGEX_1,TIME TIME,time_reference,"She did, however, voluntarily perform for causes she truly cared about: she sang ""Wishing We Last Forever"" in May 2008 at a CCTV fundraising event for Sichuan earthquake victims, and ""Heart Sutra"" in May 2009 for a Buddhist ceremony at the Famen Temple.",2,47,== Life and career == | === 2005–2009: Hiatus ===,294664,2008-05-01,2008-05-31,ML
May 2009,NNP CD,MONTH_REGEX YEAR_REGEX_1,TIME TIME,time_reference,"She did, however, voluntarily perform for causes she truly cared about: she sang ""Wishing We Last Forever"" in May 2008 at a CCTV fundraising event for Sichuan earthquake victims, and ""Heart Sutra"" in May 2009 for a Buddhist ceremony at the Famen Temple.",2,47,== Life and career == | === 2005–2009: Hiatus ===,294664,2009-05-01,2009-05-31,ML
May 2009,NNP CD,MONTH_REGEX YEAR_REGEX_1,TIME TIME,time_reference,"In May 2009, Wong appeared in an ad for ""Royal Wind"" shampoo, sparking speculation that it would be the first step in her comeback.",3,47,== Life and career == | === 2005–2009: Hiatus ===,294664,2009-05-01,2009-05-31,ML
June 2009,NNP CD,MONTH_REGEX YEAR_REGEX_1,TIME TIME,time_reference,"In June 2009, a compilation of 3 CDs and 1 DVD was released by Universal Music and sold very well in the public.",4,47,== Life and career == | === 2005–2009: Hiatus ===,294664,2009-06-01,2009-06-30,ML
2010 to 2012,CD TO CD,YEAR_REGEX_1 LINKAGE_REGEX YEAR_REGEX_1,TIME MODIFIER TIME,time_range,=== 2010 to 2012 =,0,48,== Life and career == | === 2010 to 2012 ===,294664,2010-01-01,2012-12-31,ML
2010–2012,CD,YEAR_REGEX_1,TIME,time_reference,Comeback Tour (2010–2012),0,51,== Life and career == | === 2010 to 2012 ===,294664,2010-01-01,2012-12-31,ML
February 2010,NNP CD,MONTH_REGEX YEAR_REGEX_1,TIME TIME,time_reference,"Her return was clearly marked in February 2010, when she performed at the CCTV New Year's Gala watched by over 700 million people, covering Li Jian's ballad ""Legend"".",0,52,== Life and career == | === 2010 to 2012 ===,294664,2010-02-01,2010-02-28,ML
July 2010,NNP CD,MONTH_REGEX YEAR_REGEX_1,TIME TIME,time_reference,"Later in July 2010, she first announced a series of comeback concerts starting from 29 October 2010 onwards, namely 5 in Beijing and another 5 in Shanghai.",1,52,== Life and career == | === 2010 to 2012 ===,294664,2010-07-01,2010-07-31,ML
29 October 2010,CD NNP CD,DIGIT_REGEX_1 MONTH_REGEX YEAR_REGEX_1,NUMERAL TIME TIME,time_point,"Later in July 2010, she first announced a series of comeback concerts starting from 29 October 2010 onwards, namely 5 in Beijing and another 5 in Shanghai.",1,52,== Life and career == | === 2010 to 2012 ===,294664,2010-10-29,2010-10-29,ML
October 2010,NNP CD,MONTH_REGEX YEAR_REGEX_1,TIME TIME,time_reference,The tour began in October 2010 and concluded in June 2012.,3,52,== Life and career == | === 2010 to 2012 ===,294664,2010-10-01,2010-10-31,ML
June 2012,NNP CD,MONTH_REGEX YEAR_REGEX_1,TIME TIME,time_reference,The tour began in October 2010 and concluded in June 2012.,3,52,== Life and career == | === 2010 to 2012 ===,294664,2012-06-01,2012-06-30,ML
2016,CD,YEAR_REGEX_1,TIME,time_reference,2016:,1,54,== Life and career == | === 2016: Faye's Moments Live ===,294664,2016-01-01,2016-12-31,ML
2016,CD,YEAR_REGEX_1,TIME,time_reference,"""Faye’s Moments Live 2016” was a concert which was held in Shanghai’s 8,000-seat Mercedes-Benz Cultural Centre on 30 December 2016.",0,55,== Life and career == | === 2016: Faye's Moments Live ===,294664,2016-01-01,2016-12-31,ML
30 December 2016,CD NNP CD,DIGIT_REGEX_1 MONTH_REGEX YEAR_REGEX_1,NUMERAL TIME TIME,time_point,"""Faye’s Moments Live 2016” was a concert which was held in Shanghai’s 8,000-seat Mercedes-Benz Cultural Centre on 30 December 2016.",0,55,== Life and career == | === 2016: Faye's Moments Live ===,294664,2016-12-30,2016-12-30,ML
June 1996,NNP CD,MONTH_REGEX YEAR_REGEX_1,TIME TIME,time_reference,"In June 1996, the couple married.",1,57,== Personal life ==,294664,1996-06-01,1996-06-30,ML
3 January 1997,CD NNP CD,DIGIT_REGEX_1 MONTH_REGEX YEAR_REGEX_1,NUMERAL TIME TIME,time_point,"Their daughter, Dou Jingtong (竇靖童, meaning ""child of Dou and Jing"" [from Wong's given name Jingwen]) was born on 3 January 1997.",2,57,== Personal life ==,294664,1997-01-03,1997-01-03,ML
the 1998,DT CD,PREFIX_REGEX_1 YEAR_REGEX_1,MODIFIER TIME,time_reference,"The baby's voice appears in the song ""Tong"" on the 1998 album Sing and Play (唱遊), as well as the title track of the album Lovers & Strangers (只愛陌生人) released in 1999.",3,57,== Personal life ==,294664,1998-01-01,1998-12-31,ML
1999,CD,YEAR_REGEX_1,TIME,time_reference,"The baby's voice appears in the song ""Tong"" on the 1998 album Sing and Play (唱遊), as well as the title track of the album Lovers & Strangers (只愛陌生人) released in 1999.",3,57,== Personal life ==,294664,1999-01-01,1999-12-31,ML
late 1999,JJ CD,PREFIX_REGEX_1 YEAR_REGEX_1,MODIFIER TIME,time_reference,They divorced in late 1999 with Wong claiming the rights to the daughter and waiving child support.,4,57,== Personal life ==,294664,1999-01-01,1999-12-31,ML
2004,CD,YEAR_REGEX_1,TIME,time_reference,Wong began dating Mainland television actor Li Yapeng in 2004 in Beijing; their wedding took place in July 2005.,5,57,== Personal life ==,294664,2004-01-01,2004-12-31,ML
July 2005,NNP CD,MONTH_REGEX YEAR_REGEX_1,TIME TIME,time_reference,Wong began dating Mainland television actor Li Yapeng in 2004 in Beijing; their wedding took place in July 2005.,5,57,== Personal life ==,294664,2005-07-01,2005-07-31,ML
January 2011,NNP CD,MONTH_REGEX YEAR_REGEX_1,TIME TIME,time_reference,"In January 2011, appearing for the first time with her husband on a talk show, Wong told host Yang Lan that the past 5 years of her married life has been ""very steady, very satisfying"".",7,57,== Personal life ==,294664,2011-01-01,2011-01-31,ML
13 September 2013,CD NNP CD,DIGIT_REGEX_1 MONTH_REGEX YEAR_REGEX_1,NUMERAL TIME TIME,time_point,"On 13 September 2013, Wong and Li announced that they had divorced.",8,57,== Personal life ==,294664,2013-09-13,2013-09-13,ML
2014,CD,YEAR_REGEX_1,TIME,time_reference,"In 2014, rumours surfaced that Wong was back together with Nicholas Tse, whom she had dated in a high-profile relationship in 2000.",9,57,== Personal life ==,294664,2014-01-01,2014-12-31,ML
2000,CD,YEAR_REGEX_1,TIME,time_reference,"In 2014, rumours surfaced that Wong was back together with Nicholas Tse, whom she had dated in a high-profile relationship in 2000.",9,57,== Personal life ==,294664,2000-01-01,2000-12-31,ML
September 2014,NNP CD,MONTH_REGEX YEAR_REGEX_1,TIME TIME,time_reference,The duo were photographed in Wong's apartment in Beijing in September 2014.,10,57,== Personal life ==,294664,2014-09-01,2014-09-30,ML
2008,CD,YEAR_REGEX_1,TIME,time_reference,"In 2008, Wong was voted ""Asia's sexiest vegetarian woman"" in the poll conducted among members of PETA (People for the Ethical Treatment of Animals) and was again nominated for the award in 2010.",13,57,== Personal life ==,294664,2008-01-01,2008-12-31,ML
2010,CD,YEAR_REGEX_1,TIME,time_reference,"In 2008, Wong was voted ""Asia's sexiest vegetarian woman"" in the poll conducted among members of PETA (People for the Ethical Treatment of Animals) and was again nominated for the award in 2010.",13,57,== Personal life ==,294664,2010-01-01,2010-12-31,ML
August 2006,NNP CD,MONTH_REGEX YEAR_REGEX_1,TIME TIME,time_reference,"In August 2006, Li Yapeng published a thousand-word public online letter, ""Gratitude (感謝)"", on his Sina.com blog.",0,59,== Personal life == | === Charities and Smile Angel Foundation ===,294664,2006-08-01,2006-08-31,ML
26 December 2006,CD NNP CD,DIGIT_REGEX_1 MONTH_REGEX YEAR_REGEX_1,NUMERAL TIME TIME,time_point,On 26 December 2006 Wong made her first public appearance since 2005 at the foundation's inaugural fundraising ball.,5,59,== Personal life == | === Charities and Smile Angel Foundation ===,294664,2006-12-26,2006-12-26,ML
2005,CD,YEAR_REGEX_1,TIME,time_reference,On 26 December 2006 Wong made her first public appearance since 2005 at the foundation's inaugural fundraising ball.,5,59,== Personal life == | === Charities and Smile Angel Foundation ===,294664,2005-01-01,2005-12-31,ML
8 December 2007,CD NNP CD,DIGIT_REGEX_1 MONTH_REGEX YEAR_REGEX_1,NUMERAL TIME TIME,time_point,"At the second fundraising ball on 8 December 2007, Wong mentioned that although she would not return to her music career in 2008, she would consider it afterwards.",7,59,== Personal life == | === Charities and Smile Angel Foundation ===,294664,2007-12-08,2007-12-08,ML
2008,CD,YEAR_REGEX_1,TIME,time_reference,"At the second fundraising ball on 8 December 2007, Wong mentioned that although she would not return to her music career in 2008, she would consider it afterwards.",7,59,== Personal life == | === Charities and Smile Angel Foundation ===,294664,2008-01-01,2008-12-31,ML
May 2008,NNP CD,MONTH_REGEX YEAR_REGEX_1,TIME TIME,time_reference,"In May 2008, following the disastrous earthquake in Sichuan, the couple accepted a local girl who lost a leg trying to save her classmates, to their family as she underwent recuperation and treatments in Beijing.",11,59,== Personal life == | === Charities and Smile Angel Foundation ===,294664,2008-05-01,2008-05-31,ML
March 2012,NNP CD,MONTH_REGEX YEAR_REGEX_1,TIME TIME,time_reference,"In March 2012, the Smile Angel Foundation donated 15 million Japanese yen to ChildFund Japan to help needy children after the 2011 Tōhoku earthquake and tsunami.",13,59,== Personal life == | === Charities and Smile Angel Foundation ===,294664,2012-03-01,2012-03-31,ML
