time_expression,POST_tag,time_token,type_token,time_expression_type,sentences,sentenceIndex,paragraphIndex,section,wikiId,normalised_value_start,normalised_value_end,source
the 2011,DT CD,PREFIX_REGEX_1 YEAR_REGEX_1,MODIFIER TIME,time_reference,"In March 2012, the Smile Angel Foundation donated 15 million Japanese yen to ChildFund Japan to help needy children after the 2011 Tōhoku earthquake and tsunami.",13,59,== Personal life == | === Charities and Smile Angel Foundation ===,294664,2011-01-01,2011-12-31,ML
2012,CD,YEAR_REGEX_1,TIME,time_reference,"In 2012, Smile Angel Foundation established China's first charity paediatric hospital.",14,59,== Personal life == | === Charities and Smile Angel Foundation ===,294664,2012-01-01,2012-12-31,ML
April 2010,NNP CD,MONTH_REGEX YEAR_REGEX_1,TIME TIME,time_reference,"In April 2010, the China Social Sciences Press recognised Wong as one of the 13 ""richest souls"" in China.",16,59,== Personal life == | === Charities and Smile Angel Foundation ===,294664,2010-04-01,2010-04-30,ML
May 2013,NNP CD,MONTH_REGEX YEAR_REGEX_1,TIME TIME,time_reference,"In May 2013, Wong and Li topped the inaugural ""China Celebrity Philanthropist List"" compiled by the China Philanthropist magazine, which used a methodology designed to measure a celebrity's positive influence on charitable donations.",17,59,== Personal life == | === Charities and Smile Angel Foundation ===,294664,2013-05-01,2013-05-31,ML
19 May 2013,CD NNP CD,DIGIT_REGEX_1 MONTH_REGEX YEAR_REGEX_1,NUMERAL TIME TIME,time_point,"On 19 May 2013, Faye sang four songs in a memorial concert celebrating Teresa Teng's 60th birthday, with a portion of the concert proceeds going to the charity.",18,59,== Personal life == | === Charities and Smile Angel Foundation ===,294664,2013-05-19,2013-05-19,ML
2010,CD,YEAR_REGEX_1,TIME,time_reference,"In 2010, Sina Weibo users discovered Wong's microblog under the account ""veggieg (in Chinese)"", and unveiled a Faye Wong who is open, talkative and surprisingly funny with her use of cyberlanguage and puns.",0,61,== Personal life == | === Microblog ===,294664,2010-01-01,2010-12-31,ML
early 2015,JJ CD,PREFIX_REGEX_1 YEAR_REGEX_1,MODIFIER TIME,time_reference,"As of April 2014, the account had over 23 million followers, but it has not been active since early 2015.",1,61,== Personal life == | === Microblog ===,294664,2015-01-01,2015-12-31,ML
1994,CD,YEAR_REGEX_1,TIME,time_reference,"Her 1994 concerts were memorable for dreadlocks and extremely long sleeves, as well as for the silver-painted tears.",1,65,== Artistry and legacy == | === Concerts ===,294664,1994-01-01,1994-12-31,ML
1998,CD,YEAR_REGEX_1,TIME,time_reference,"Her 1998 concerts saw her sporting the ""burnt"" cheek makeup, the ""Indian chief"" look, and the soleless strap-on boots.",3,65,== Artistry and legacy == | === Concerts ===,294664,1998-01-01,1998-12-31,ML
2003,CD,YEAR_REGEX_1,TIME,time_reference,"At the start of her 2003 concerts her headgear was topped by an inverted shoe supporting a very long feather, and her makeup for that concert went through several changes of painted eye-shades.",4,65,== Artistry and legacy == | === Concerts ===,294664,2003-01-01,2003-12-31,ML
2003,CD,YEAR_REGEX_1,TIME,time_reference,"Her 2003 concerts set a Hong Kong record, selling 30,000 tickets within three days.",0,66,== Artistry and legacy == | === Concerts ===,294664,2003-01-01,2003-12-31,ML
1997,CD,YEAR_REGEX_1,TIME,time_reference,"After her release of Miyuki Nakajima's ""Mortal World"" (人間) in 1997, she ended her concerts for the next few years with this song while shaking hands with the audience, then taking a deep bow to a horizontal position before leaving the stage.",2,66,== Artistry and legacy == | === Concerts ===,294664,1997-01-01,1997-12-31,ML
2010 to 2012,CD TO CD,YEAR_REGEX_1 LINKAGE_REGEX YEAR_REGEX_1,TIME MODIFIER TIME,time_range,"However, during her recent Comeback Tour from 2010 to 2012, she ended with ""Flower of Paradise"" (彼岸花), a song from the album Fable (2000).",3,66,== Artistry and legacy == | === Concerts ===,294664,2010-01-01,2012-12-31,ML
2000,CD,YEAR_REGEX_1,TIME,time_reference,"However, during her recent Comeback Tour from 2010 to 2012, she ended with ""Flower of Paradise"" (彼岸花), a song from the album Fable (2000).",3,66,== Artistry and legacy == | === Concerts ===,294664,2000-01-01,2000-12-31,ML
1994,CD,YEAR_REGEX_1,TIME,time_reference,"In 1994, on one of the many trips to Beijing to see Dou Wei, Hong Kong paparazzi from Next Magazine followed her and tracked her down.",2,74,== Artistry and legacy == | === Public image ===,294664,1994-01-01,1994-12-31,ML
2012,CD,YEAR_REGEX_1,TIME,time_reference,"As Taiwanese lyricist Yao Chien, who initially declined to write lyrics for Wong because he never met and knew very little about her, recalled in 2012,",5,74,== Artistry and legacy == | === Public image ===,294664,2012-01-01,2012-12-31,ML
2004 and 2005,CD CC CD,YEAR_REGEX_1 LINKAGE_REGEX YEAR_REGEX_1,TIME MODIFIER TIME,time_range,In 2004 and 2005,0,77,== Artistry and legacy == | === Legacy ===,294664,2004-01-01,2005-12-31,ML
2011 and 2012,CD CC CD,YEAR_REGEX_1 LINKAGE_REGEX YEAR_REGEX_1,TIME MODIFIER TIME,time_range,"Faye Wong was ranked in the top 5 on the Forbes China Celebrity 100, as well as in 2011 and 2012 after her hiatus.",1,77,== Artistry and legacy == | === Legacy ===,294664,2011-01-01,2012-12-31,ML
2008,CD,YEAR_REGEX_1,TIME,time_reference,"In 2008, Wong was voted Asia's sexiest vegetarian Woman in a poll run by animal right group PETA.",3,77,== Artistry and legacy == | === Legacy ===,294664,2008-01-01,2008-12-31,ML
2009,CD,YEAR_REGEX_1,TIME,time_reference,"In 2009, to celebrate the 60th anniversary of the People's Republic of China, a government web portal conducted an online poll on The Most Influential Chinese Cultural Celebrity in the Past 60 Years; out of 192 candidates, Wong received over 7 million votes, second only to the deceased Teresa Teng from Taiwan, Wong's own personal idol.",4,77,== Artistry and legacy == | === Legacy ===,294664,2009-01-01,2009-12-31,ML
2014,CD,YEAR_REGEX_1,TIME,time_reference,"In 2014, she was named one of 10 most admired female singers in Asia by RHA media.",5,77,== Artistry and legacy == | === Legacy ===,294664,2014-01-01,2014-12-31,ML
the 2010s,DT CD,PREFIX_REGEX_1 YEAR_REGEX_1,MODIFIER TIME,time_reference,"""In the 2010s, fans have started Faye Wong-themed small businesses in Beijing and Wuhan.",7,77,== Artistry and legacy == | === Legacy ===,294664,2010-01-01,2019-12-31,ML
the 2013,DT CD,PREFIX_REGEX_1 YEAR_REGEX_1,MODIFIER TIME,time_reference,"The female protagonist in the 2013 Chinese film Beijing Flickers was prototyped after Wong, according to director Zhang Yuan.",3,83,== Artistry and legacy == | === Legacy ===,294664,2013-01-01,2013-12-31,ML
1993,CD,YEAR_REGEX_1,TIME,time_reference,"Zhang remembered when he shot his 1993 hit Beijing Bastards with Dou Wei, Wong as Dou's girlfriend would visit the set every day.",4,83,== Artistry and legacy == | === Legacy ===,294664,1993-01-01,1993-12-31,ML
2001,CD,YEAR_REGEX_1,TIME,time_reference,Japanese director Shunji Iwai had explained that the titular pop-star character of his 2001 film All About Lily Chou-Chou was conceived after attending a Faye Wong concert.,5,83,== Artistry and legacy == | === Legacy ===,294664,2001-01-01,2001-12-31,ML
the 2003,DT CD,PREFIX_REGEX_1 YEAR_REGEX_1,MODIFIER TIME,time_reference,Wong's name was also mentioned in the 2003 Japanese film The Blue Light as one of the protagonist's favourites.,6,83,== Artistry and legacy == | === Legacy ===,294664,2003-01-01,2003-12-31,ML
2007,CD,YEAR_REGEX_1,TIME,time_reference,"China's 2007 spacecraft Chang'e 1 played Faye Wong's version of ""Wishing We Last Forever"".",7,83,== Artistry and legacy == | === Legacy ===,294664,2007-01-01,2007-12-31,ML
29 June 2008,CD NNP CD,DIGIT_REGEX_1 MONTH_REGEX YEAR_REGEX_1,NUMERAL TIME TIME,time_point,Archived from the original on 29 June 2008.,1,100,== External links ==,294664,2008-06-29,2008-06-29,ML
7 January 2011,CD NNP CD,DIGIT_REGEX_1 MONTH_REGEX YEAR_REGEX_1,NUMERAL TIME TIME,time_point,Retrieved 7 January 2011.,2,100,== External links ==,294664,2011-01-07,2011-01-07,ML
a 2011,DT CD,INARTICLE_REGEX YEAR_REGEX_1,MODIFIER TIME,time_reference,"In a 2011 ""most popular celebrity in China"" marketing study she was also ranked in the top 5.",2,77,== Artistry and legacy == | === Legacy ===,294664,2011-01-01,2011-12-31,LLM
October 2010 to June 2012,NNP CD TO NNP CD,MONTH_REGEX YEAR_REGEX_1 LINKAGE_REGEX MONTH_REGEX YEAR_REGEX_1,TIME TIME MODIFIER TIME TIME,time_reference,"She does not attend music awards, nor was she involved in the promotion of her comeback concert tour, which was held in many different cities across Asia from October 2010 to June 2012.",2,49,== Life and career == | === 2010 to 2012 ===,294664,2010-10-01,2012-06-30,LLM
27–28 November 2008,CD NNP CD,DIGIT_REGEX_1 MONTH_REGEX YEAR_REGEX_1,NUMERAL TIME TIME,time_point,"For the foundation's publicity event on 27–28 November 2008, Wong and her husband visited children in Tibet who are in various stages of recovery after being cured with the help of the charity.",9,59,== Personal life == | === Charities and Smile Angel Foundation ===,294664,2008-11-27,2008-11-28,LLM
18 years,CD NNS,DIGIT_REGEX_1 TIME_UNIT_REGEX,NUMERAL TIME,time_reference,"The concert is notable in that Wong's first song in the concert, Li Bai's ""清平調"", is a duet with Teng planned 18 years prior, using vocals from Teng released posthumously for the first time.",19,59,== Personal life == | === Charities and Smile Angel Foundation ===,294664,2003-01-01,2021-12-31,LLM
millennium,NN,TIME_UNIT_REGEX,TIME,time_reference,The new millennium saw a shift in Wong's musical career with the album Fable (寓言).,0,36,== Life and career == | === 2000: Fable ===,294664,2000-01-01,2000-12-31,LLM
the 1994–95,DT CD,PREFIX_REGEX_1 YEAR_REGEX_1,MODIFIER TIME,time_reference,"There were two exceptions to the latter in the 1994–95 live concerts; first, many dancers joined Faye on stage for the lively song ""Flow Not Fly"".",2,64,== Artistry and legacy == | === Concerts ===,294664,1994-01-01,1995-12-31,LLM
30 years,CD NNS,DIGIT_REGEX_1 TIME_UNIT_REGEX,NUMERAL TIME,time_reference,Wong is considered by some as one of East Asia's biggest popstars with a career of over 30 years.,11,0,,294664,1991-01-01,2021-01-01,LLM
the early 1990s,DT JJ CD,PREFIX_REGEX_1 PREFIX_REGEX_1 YEAR_REGEX_1,MODIFIER MODIFIER TIME,time_reference,"In the early 1990s, Wong began a relationship with Dou Wei, a Beijing rocker of the band ""Black Panther"" who was much more famous in Mainland China.",0,57,== Personal life ==,294664,1990-01-01,1993-12-31,LLM
the early 1990s,DT JJ CD,PREFIX_REGEX_1 PREFIX_REGEX_1 YEAR_REGEX_1,MODIFIER MODIFIER TIME,time_reference,"Born in Beijing, she moved to British Hong Kong in 1987 and came to public attention in the early 1990s by singing in Cantonese, often combining alternative music with mainstream Chinese pop.",2,0,,294664,,,ML
a few years,DT JJ NNS,INARTICLE_REGEX PREFIX_REGEX_1 TIME_UNIT_REGEX,MODIFIER MODIFIER TIME,time_reference,"In 1987, after being accepted to Xiamen University for college, she migrated to Hong Kong to join her father, who had been working there for a few years.",6,3,== Life and career == | === 1969–1991: Early life and Shirley Wong ===,294664,,,ML
a year,DT NN,INARTICLE_REGEX TIME_UNIT_REGEX,MODIFIER TIME,time_reference,"The plan was for her to stay there for a year to fulfill the permanent residency requirement, and go to a university abroad thereafter.",7,3,== Life and career == | === 1969–1991: Early life and Shirley Wong ===,294664,,,ML
previously,RB,TIMELINE_REGEX,TIME,time_reference,"Following a brief modeling stint, she began singing lessons with Tai See-Chung (戴思聰), who was also from Mainland China and had previously tutored Hong Kong superstars Anita Mui, Andy Lau, Leon Lai and Aaron Kwok.",9,3,== Life and career == | === 1969–1991: Early life and Shirley Wong ===,294664,,,ML
the next two decades,DT JJ CD NNS,PREFIX_REGEX_1 PREFIX_REGEX_1 BASIC_NUMBER_REGEX_1 TIME_UNIT_REGEX,MODIFIER MODIFIER NUMERAL TIME,time_reference,"Wong returned to Hong Kong and found a new agent in Katie Chan, who would remain her agent for the next two decades.",0,6,== Life and career == | === 1969–1991: Early life and Shirley Wong ===,294664,,,ML
the early 1990s,DT JJ CD,PREFIX_REGEX_1 PREFIX_REGEX_1 YEAR_REGEX_1,MODIFIER MODIFIER TIME,time_reference,"(Thanks to Wong's cover, this 1972 song—in different language versions—would in the early 1990s become a huge regional hit in Thailand, Vietnam and the rest of Southeast Asia and even Turkey; the most popular English version was titled ""Broken-Hearted Woman"".)",2,8,== Life and career == | === 1992–1993: Rise to notability ===,294664,,,ML
a 1994,DT CD,INARTICLE_REGEX YEAR_REGEX_1,MODIFIER TIME,time_reference,"Wong stated in a 1994 concert that she very much liked this song, after which various websites listed it as her personal favourite; however, in a 1998 CNN interview she declined to name one favourite song, saying that there were too many, and in 2003 she stated that she no longer liked her old songs.",4,8,== Life and career == | === 1992–1993: Rise to notability ===,294664,,,ML
February,NNP,MONTH_REGEX,TIME,time_reference,"In February, it became the title track to her album No Regrets.",1,9,== Life and career == | === 1992–1993: Rise to notability ===,294664,,,ML
These Years,DT NNS,PREFIX_REGEX_1 TIME_UNIT_REGEX,MODIFIER TIME,time_reference,"Her next album 100,000 Whys (September 1993) showed considerable alternative music influences from the West, including the popular song ""Cold War"" (冷戰), a cover of ""Silent All These Years"" by Tori Amos.",0,11,== Life and career == | === 1993–1994: Alternative style ===,294664,,,ML
about the future,IN DT NN,PREFIX_REGEX_1 PREFIX_REGEX_1 TIMELINE_REGEX,MODIFIER MODIFIER TIME,time_reference,"Besides covering songs and learning distinctive vocal techniques, Wong recorded her own compositions ""Pledge"" (誓言), co-written with ex-husband Dou Wei, and her first and only spoken-word song ""Exit"" (出路), which expresses some of her pessimism about the future.",2,12,== Life and career == | === 1993–1994: Alternative style ===,294664,,,ML
years,NNS,TIME_UNIT_REGEX,TIME,time_reference,"The runaway hit ""I'm Willing"" (我願意) in Mystery became her trademark hit in the Mandarin-speaking communities for years, and has been covered by other singers such as Gigi Leung, Sammi Cheng and Jay Chou.",1,14,== Life and career == | === 1994–1995: Mandarin market ===,294664,,,ML
Decadent,NNP,TIME_UNIT_REGEX,TIME,time_reference,"In 1995, she released Decadent Sounds of Faye (菲靡靡之音), a cover album of songs originally recorded by her idol Teresa Teng, one of the most revered Chinese singers of the 20th century.",0,17,== Life and career == | === 1994–1995: Mandarin market ===,294664,,,ML
Decadent,NNP,TIME_UNIT_REGEX,TIME,time_reference,"Decadent Sounds sold well despite initial negative criticism, and has come to be recognised as an example of imaginative covering by recent critics.",2,17,== Life and career == | === 1994–1995: Mandarin market ===,294664,,,ML
December,NNP,MONTH_REGEX,TIME,time_reference,"In December, she released her Cantonese album Di-Dar which mixes an alternative yodelling style with a touch of Indian and Middle Eastern flavour.",0,19,== Life and career == | === 1994–1995: Mandarin market ===,294664,,,ML
each year,DT NN,PREFIX_REGEX_1 TIME_UNIT_REGEX,MODIFIER TIME,time_reference,"From 1993 to 1995, Cinepoly released an EP of Wong's songs each year: Like Wind (如風), Faye Disc (菲碟), and One Person, Two Roles (一人分飾兩角).",0,23,== Life and career == | === 1996: Restless and Cinepoly EPs ===,294664,,,ML
each year,DT NN,PREFIX_REGEX_1 TIME_UNIT_REGEX,MODIFIER TIME,time_reference,"Later, Cinepoly would release two compilations each year to compete with Faye's new releases, a tactic which has come under fire from her international fans.",8,26,== Life and career == | === 1997: EMI and Faye Wong ===,294664,,,ML
Year,NNP,TIME_UNIT_REGEX,TIME,time_reference,"Na had been a regular at the annual CCTV New Year's Gala, the highest-watched TV show in Mainland China, and she invited Wong to do a duet with her on the upcoming show in 1998.",1,28,== Life and career == | === 1998: Mainland China ===,294664,,,ML
that year,IN NN,PREFIX_REGEX_1 TIME_UNIT_REGEX,MODIFIER TIME,time_reference,"The collaboration by the ""Mainland Diva"" and ""Hong Kong Diva"", titled ""Let's Meet in 1998"", became an instant hit and arguably the most played song in Mainland China that year.",2,28,== Life and career == | === 1998: Mainland China ===,294664,,,ML
October,NNP,MONTH_REGEX,TIME,time_reference,"Sing and Play (唱遊) was released in October, and contained four songs composed by Faye: the opening track ""Emotional Life"", ""Face"", ""A Little Clever"" and ""Tong"" (both written for her daughter, the latter produced by Dou Wei).",0,29,== Life and career == | === 1998: Mainland China ===,294664,,,ML
the first three months,DT JJ CD NNS,PREFIX_REGEX_1 ORDINAL_REGEX_1 BASIC_NUMBER_REGEX_1 TIME_UNIT_REGEX,MODIFIER NUMERAL NUMERAL TIME,time_reference,"In Japan, the album sold close to 90,000 copies in the first three months after its release.",2,30,== Life and career == | === 1998: Mainland China ===,294664,,,ML
of the Year,IN DT NNP,PREFIX_REGEX_1 PREFIX_REGEX_1 TIME_UNIT_REGEX,MODIFIER MODIFIER TIME,time_reference,"The ""Eyes on Me"" single sold over 335,620 copies in Japan and 500,000 worldwide, making it the best-selling video game music disc to that date, and winning ""Song of the Year (Western Music)"" at the 14th Annual Japan Gold Disc Awards.",2,32,== Life and career == | === 1999: Venturing into Japan ===,294664,,,ML
later that year,RB IN NN,PREFIX_REGEX_1 PREFIX_REGEX_1 TIME_UNIT_REGEX,MODIFIER MODIFIER TIME,time_reference,"When the game was released in North America later that year, the theme song became very popular among gamers in the West; while it was not a mainstream hit there (as Wong had no desire to explore these markets), she gained many fans who were not previously familiar with her music.",3,32,== Life and career == | === 1999: Venturing into Japan ===,294664,,,ML
March,NNP,MONTH_REGEX,TIME,time_reference,"In March, she held two concerts in Nippon Budokan, with tickets for the first show on 11 March being sold out in one day and an extra show added on 12 March; she was the first Chinese singer to perform in that venue.",4,32,== Life and career == | === 1999: Venturing into Japan ===,294664,,,ML
the year,DT NN,PREFIX_REGEX_1 TIME_UNIT_REGEX,MODIFIER TIME,time_reference,"Earlier in the year, Pepsi-Cola had made Wong a spokesperson, and after these concerts she shot the promotional music video for ""Spectacular"" (精彩), which Pepsi used in commercials.",5,32,== Life and career == | === 1999: Venturing into Japan ===,294664,,,ML
late September,JJ NNP,PREFIX_REGEX_1 MONTH_REGEX,MODIFIER TIME,time_reference,"The album Lovers & Strangers (只愛陌生人) was released in late September, and sold over 800,000 copies, topping the charts in Hong Kong, Mainland China, Taiwan, Singapore and Malaysia.",0,33,== Life and career == | === 1999: Venturing into Japan ===,294664,,,ML
October,NNP,MONTH_REGEX,TIME,time_reference,"Wong also became a spokesperson for JPhone in October, performing in several commercials which aired in Japan.",3,33,== Life and career == | === 1999: Venturing into Japan ===,294664,,,ML
August,NNP,MONTH_REGEX,TIME,time_reference,"In addition, she began filming for 2046 in August, a project she would pursue on and off over the next few years when her schedule permitted.",0,34,== Life and career == | === 1999: Venturing into Japan ===,294664,,,ML
this year,DT NN,PREFIX_REGEX_1 TIME_UNIT_REGEX,MODIFIER TIME,time_reference,"Her other activities during this year included the Pepsi promotional duet and music video of ""Galaxy Unlimited"" with Aaron Kwok, the filming of Okinawa Rendezvous, as well as several concerts in China and Taiwan.",0,37,== Life and career == | === 2000: Fable ===,294664,,,ML
April,NNP,MONTH_REGEX,TIME,time_reference,"She wrote the music and lyrics for 3 songs, the title track ""To Love"", ""Leave Nothing"" (不留), ""Sunshine Dearest"" (陽寶), as well as the music for ""April Snow"" (四月雪).",1,43,== Life and career == | === 2001–2004: Faye Wong and To Love ===,294664,,,ML
a year,DT NN,INARTICLE_REGEX TIME_UNIT_REGEX,MODIFIER TIME,time_reference,"Afterwards, she held numerous successful concerts for over a year.",6,43,== Life and career == | === 2001–2004: Faye Wong and To Love ===,294664,,,ML
of the year,IN DT NN,PREFIX_REGEX_1 PREFIX_REGEX_1 TIME_UNIT_REGEX,MODIFIER MODIFIER TIME,time_reference,Faye Wong was awarded pan-Asian female artist of the year at the sixth CCTV-MTV Music Honors.,0,44,== Life and career == | === 2001–2004: Faye Wong and To Love ===,294664,,,ML
Two months,CD NNS,BASIC_NUMBER_REGEX_1 TIME_UNIT_REGEX,NUMERAL TIME,time_reference,"Two months later she wed actor Li Yapeng, and their daughter was born in the following year.",2,46,== Life and career == | === 2005–2009: Hiatus ===,294664,,,ML
the four years,DT CD NNS,PREFIX_REGEX_1 BASIC_NUMBER_REGEX_1 TIME_UNIT_REGEX,MODIFIER NUMERAL TIME,time_reference,"In the four years that followed, Faye Wong would not return, ignoring Live Nation's offer of 100m-HKD, and even rejecting the 3m-yuan offer for a once-in-a-lifetime opportunity to sing at the Beijing Olympics opening ceremony on her birthday—the Beijing native was the unanimous choice of netizens, receiving over 63% of the tens of millions of votes cast in a CCTV online poll.",0,47,== Life and career == | === 2005–2009: Hiatus ===,294664,,,ML
an ad,DT NN,INARTICLE_REGEX ERA_REGEX,MODIFIER TIME,time_reference,"In May 2009, Wong appeared in an ad for ""Royal Wind"" shampoo, sparking speculation that it would be the first step in her comeback.",3,47,== Life and career == | === 2005–2009: Hiatus ===,294664,,,ML
recent years,JJ NNS,PREFIX_REGEX_1 TIME_UNIT_REGEX,MODIFIER TIME,time_reference,"In recent years, Faye Wong completed an extensive concert tour, but is otherwise relatively inactive in the music industry.",0,49,== Life and career == | === 2010 to 2012 ===,294664,,,ML
Year,NNP,TIME_UNIT_REGEX,TIME,time_reference,"Her return was clearly marked in February 2010, when she performed at the CCTV New Year's Gala watched by over 700 million people, covering Li Jian's ballad ""Legend"".",0,52,== Life and career == | === 2010 to 2012 ===,294664,,,ML
10 days,CD NNS,DIGIT_REGEX_1 TIME_UNIT_REGEX,NUMERAL TIME,time_reference,"Despite her lengthy absence, interest was overwhelming: in mainland China tickets worth nearly 200 million yuan (US$29 million) were taken up in just 10 days while in Taiwan the computerised ticketing system crashed due to excessive traffic, and 90 percent of the tickets were sold within two hours after it was restored.",0,53,== Life and career == | === 2010 to 2012 ===,294664,,,ML
one morning and 2,CD NN CC CD,BASIC_NUMBER_REGEX_1 DAY_TIME_REGEX LINKAGE_REGEX DIGIT_REGEX_1,NUMERAL TIME MODIFIER NUMERAL,time_range,"The story repeated itself in Hong Kong, with 93% of the tickets gone in one morning and 2 ticketing phone lines added to the existing 3, to cope with the huge demand.",1,53,== Life and career == | === 2010 to 2012 ===,294664,,,ML
Moments,NNP,TIMELINE_REGEX,TIME,time_reference,Faye's Moments Live =,2,54,== Life and career == | === 2016: Faye's Moments Live ===,294664,,,ML
Moments,NNP,TIMELINE_REGEX,TIME,time_reference,"""Faye’s Moments Live 2016” was a concert which was held in Shanghai’s 8,000-seat Mercedes-Benz Cultural Centre on 30 December 2016.",0,55,== Life and career == | === 2016: Faye's Moments Live ===,294664,,,ML
5 years,CD NNS,DIGIT_REGEX_1 TIME_UNIT_REGEX,NUMERAL TIME,time_reference,"In January 2011, appearing for the first time with her husband on a talk show, Wong told host Yang Lan that the past 5 years of her married life has been ""very steady, very satisfying"".",7,57,== Personal life ==,294664,,,ML
the three December,DT CD NNP,PREFIX_REGEX_1 BASIC_NUMBER_REGEX_1 MONTH_REGEX,MODIFIER NUMERAL TIME,time_reference,"To date, the foundation has raised over 35 million renminbi, including over 29.5 million from auctions during the three December fundraisers, and helped more than 2008 children.",10,59,== Personal life == | === Charities and Smile Angel Foundation ===,294664,,,ML
a year,DT NN,INARTICLE_REGEX TIME_UNIT_REGEX,MODIFIER TIME,time_reference,The middle school student returned to her hometown a year later but help would not stop; the Lis agreed to continue paying for her medical needs until she turns 22 and visit her at least once a year.,12,59,== Personal life == | === Charities and Smile Angel Foundation ===,294664,,,ML
each year,DT NN,PREFIX_REGEX_1 TIME_UNIT_REGEX,MODIFIER TIME,time_reference,The Beijing-based hospital is expected to offer free surgery to 600 children with cleft lips each year and will start operations in June.,15,59,== Personal life == | === Charities and Smile Angel Foundation ===,294664,,,ML
of April 2014,IN NNP CD,PREFIX_REGEX_1 MONTH_REGEX YEAR_REGEX_1,MODIFIER TIME TIME,time_reference,"As of April 2014, the account had over 23 million followers, but it has not been active since early 2015.",1,61,== Personal life == | === Microblog ===,294664,,,ML
three days,CD NNS,BASIC_NUMBER_REGEX_1 TIME_UNIT_REGEX,NUMERAL TIME,time_reference,"Her 2003 concerts set a Hong Kong record, selling 30,000 tickets within three days.",0,66,== Artistry and legacy == | === Concerts ===,294664,,,ML
