time_expression,POST_tag,time_token,type_token,time_expression_type,sentences,sentenceIndex,paragraphIndex,section,wikiId,normalised_value_start,normalised_value_end,source
the next few years,DT JJ JJ NNS,PREFIX_REGEX_1 PREFIX_REGEX_1 PREFIX_REGEX_1 TIME_UNIT_REGEX,MODIFIER MODIFIER MODIFIER TIME,time_reference,"After her release of Miyuki Nakajima's ""Mortal World"" (人間) in 1997, she ended her concerts for the next few years with this song while shaking hands with the audience, then taking a deep bow to a horizontal position before leaving the stage.",2,66,== Artistry and legacy == | === Concerts ===,294664,,,ML
am,VBP,HALFDAY_REGEX_1,TIME,,"Even if it is stubbornness, I am still stubborn and regretless.",0,73,== Artistry and legacy == | === Public image ===,294664,,,ML
the morning,DT NN,PREFIX_REGEX_1 DAY_TIME_REGEX,MODIFIER TIME,time_reference,"...it just happened that I took a business trip to Hong Kong and on the flight back, I saw that tabloid magazine with photos from Beijing, of her coming out in the morning carrying the chamber pot to dump in the public toilet...",0,75,== Artistry and legacy == | === Public image ===,294664,,,ML
60 Years,CD NNS,DIGIT_REGEX_1 TIME_UNIT_REGEX,NUMERAL TIME,time_reference,"In 2009, to celebrate the 60th anniversary of the People's Republic of China, a government web portal conducted an online poll on The Most Influential Chinese Cultural Celebrity in the Past 60 Years; out of 192 candidates, Wong received over 7 million votes, second only to the deceased Teresa Teng from Taiwan, Wong's own personal idol.",4,77,== Artistry and legacy == | === Legacy ===,294664,,,ML
every day,DT NN,PREFIX_REGEX_1 TIME_UNIT_REGEX,MODIFIER TIME,time_reference,"Zhang remembered when he shot his 1993 hit Beijing Bastards with Dou Wei, Wong as Dou's girlfriend would visit the set every day.",4,83,== Artistry and legacy == | === Legacy ===,294664,,,ML
Today,NNP,TIMELINE_REGEX,TIME,time_reference,Faye Wong Today – feifan's fan site,0,97,== External links ==,294664,,,ML
