time_expression,POST_tag,time_token,type_token,time_expression_type,sentences,sentenceIndex,paragraphIndex,section,wikiId,normalised_value_start,normalised_value_end,source
"January 28 , 1968","NNP CD , CD",MONTH_REGEX DIGIT_REGEX_1 COMMA_REGEX YEAR_REGEX_1,TIME NUMERAL MODIFIER TIME,time_reference,"William Michael Griffin Jr. (born January 28, 1968), better known by his stage name Rakim (), is an American rapper and record producer.",0,0,,428906,1968-01-28,1968-01-28,ML
2006,CD,YEAR_REGEX_1,TIME,time_reference,"Paid in Full was named the greatest hip hop album of all time by MTV in 2006, while Rakim himself was ranked No. 4 on MTV's list of the Greatest MCs of All Time.",0,1,,428906,2006-01-01,2006-12-31,ML
1987–2007,CD,YEAR_REGEX_1,TIME,time_reference,The editors of About.com ranked him No. 2 on their list of the 'Top 50 MCs of Our Time (1987–2007)'.,2,1,,428906,1987-01-01,2007-12-31,ML
2012,CD,YEAR_REGEX_1,TIME,time_reference,"In 2012, The Source ranked him No. 1 on their list of the ""Top 50 Lyricists of All Time"".",3,1,,428906,2012-01-01,2012-12-31,ML
1985,CD,YEAR_REGEX_1,TIME,time_reference,"Rakim, then known as Kid Wizard in 1985, made his first recordings live at Wyandanch High School.",3,3,== Early life ==,428906,1985-01-01,1985-12-31,ML
1986,CD,YEAR_REGEX_1,TIME,time_reference,"He was initially introduced to the Nation of Islam in 1986, and later joined The Nation of Gods and Earths (also known as the 5 Percent Nation), and adopted the name Rakim Allah, choosing to also use it as his stage name, though it was most often shortened to simply Rakim.",4,3,== Early life ==,428906,1986-01-01,1986-12-31,ML
1985–1992,CD,YEAR_REGEX_1,TIME,time_reference,Pairing with Eric B. (1985–1992) =,1,5,== Career == | === Pairing with Eric B. (1985–1992) ===,428906,1985-01-01,1992-12-31,ML
1985,CD,YEAR_REGEX_1,TIME,time_reference,"First meeting in 1985, Eric B. and Rakim went on to release four studio albums before their separation in 1992.",0,6,== Career == | === Pairing with Eric B. (1985–1992) ===,428906,1985-01-01,1985-12-31,ML
1992,CD,YEAR_REGEX_1,TIME,time_reference,"First meeting in 1985, Eric B. and Rakim went on to release four studio albums before their separation in 1992.",0,6,== Career == | === Pairing with Eric B. (1985–1992) ===,428906,1992-01-01,1992-12-31,ML
2011,CD,YEAR_REGEX_1,TIME,time_reference,"They were nominated for induction into the Rock and Roll Hall of Fame in 2011, although they did not make the final selection.",2,6,== Career == | === Pairing with Eric B. (1985–1992) ===,428906,2011-01-01,2011-12-31,ML
1986–87,CD,YEAR_REGEX_1,TIME,time_reference,1986–87:,1,7,== Career == | ==== 1986–87: Beginnings and classic debut ====,428906,1986-01-01,1987-12-31,ML
1986,CD,YEAR_REGEX_1,TIME,time_reference,"The first tracks they recorded—""Eric B. Is President"" and ""My Melody""—were released as a single/b-side on the independent Zakia Records in 1986.",1,8,== Career == | ==== 1986–87: Beginnings and classic debut ====,428906,1986-01-01,1986-12-31,ML
early 1987,JJ CD,PREFIX_REGEX_1 YEAR_REGEX_1,MODIFIER TIME,time_reference,"After Def Jam Recordings founder Russell Simmons heard the single, the duo were signed to Island Records and began recording the album in Manhattan's Power Play Studios in early 1987.",2,8,== Career == | ==== 1986–87: Beginnings and classic debut ====,428906,1987-01-01,1987-12-31,ML
"July 7 , 1987","NNP CD , CD",MONTH_REGEX DIGIT_REGEX_1 COMMA_REGEX YEAR_REGEX_1,TIME NUMERAL MODIFIER TIME,time_reference,"On July 7, 1987, the duo released their debut album, Paid in Full, on the Island-subsidiary label 4th & B'way Records.",3,8,== Career == | ==== 1986–87: Beginnings and classic debut ====,428906,1987-07-07,1987-07-07,ML
1988–89,CD,YEAR_REGEX_1,TIME,time_reference,1988–89: Sophomore peak =,1,9,== Career == | ==== 1988–89: Sophomore peak ====,428906,1988-01-01,1989-12-31,ML
1988,CD,YEAR_REGEX_1,TIME,time_reference,"American author William Jelani Cobb wrote of the album's significance, ""On the heels of Paid in Full, Eric B. & Rakim delivered a full clip of album titled Follow the Leader in 1988.",3,10,== Career == | ==== 1988–89: Sophomore peak ====,428906,1988-01-01,1988-12-31,ML
the 1990s,DT NNS,PREFIX_REGEX_1 YEAR_REGEX_1,MODIFIER TIME,time_reference,"The release marked the high point in the collaboration between the two and prefaced the long slide they faced in the 1990s.""",5,10,== Career == | ==== 1988–89: Sophomore peak ====,428906,1990-01-01,1999-12-31,ML
1990–92,CD,YEAR_REGEX_1,TIME,time_reference,1990–92:,1,11,== Career == | ==== 1990–92: Final albums and dissolution ====,428906,1990-01-01,1992-12-31,ML
1990,CD,YEAR_REGEX_1,TIME,time_reference,"Let the Rhythm Hit 'Em, released in 1990, was Eric B. & Rakim's third album.",0,12,== Career == | ==== 1990–92: Final albums and dissolution ====,428906,1990-01-01,1990-12-31,ML
1998,CD,YEAR_REGEX_1,TIME,time_reference,"In 1998, the album was selected as one of The Source's 100 Best Rap Albums.",5,12,== Career == | ==== 1990–92: Final albums and dissolution ====,428906,1998-01-01,1998-12-31,ML
July 1989,NNP CD,MONTH_REGEX YEAR_REGEX_1,TIME TIME,time_reference,"The back cover features a dedication to the memories of Rakim's father William and producer Paul C., who had worked on many of the album's tracks before his murder in July 1989.",6,12,== Career == | ==== 1990–92: Final albums and dissolution ====,428906,1989-07-01,1989-07-31,ML
1992,CD,YEAR_REGEX_1,TIME,time_reference,"In 1992, Eric B & Rakim released their fourth and final album, Don't Sweat the Technique.",9,12,== Career == | ==== 1990–92: Final albums and dissolution ====,428906,1992-01-01,1992-12-31,ML
1993–present,CD,YEAR_REGEX_1,TIME,time_reference,Solo career (1993–present),1,13,== Career == | === Solo career (1993–present) ===,428906,1993-01-01,,ML
1993–2003,CD,YEAR_REGEX_1,TIME,time_reference,1993–2003:,1,14,"== Career == | ==== 1993–2003: Legal issues, solo debut and Aftermath stint ====",428906,1993-01-01,2003-12-31,ML
early 1993,JJ CD,PREFIX_REGEX_1 YEAR_REGEX_1,MODIFIER TIME,time_reference,"After his breakup with Eric B. in early 1993, Rakim kept a low profile, only making one notable appearance on the soundtrack to the 1993 film Gunmen.",0,15,"== Career == | ==== 1993–2003: Legal issues, solo debut and Aftermath stint ====",428906,1993-01-01,1993-12-31,ML
the 1993,DT CD,PREFIX_REGEX_1 YEAR_REGEX_1,MODIFIER TIME,time_reference,"After his breakup with Eric B. in early 1993, Rakim kept a low profile, only making one notable appearance on the soundtrack to the 1993 film Gunmen.",0,15,"== Career == | ==== 1993–2003: Legal issues, solo debut and Aftermath stint ====",428906,1993-01-01,1993-12-31,ML
1994,CD,YEAR_REGEX_1,TIME,time_reference,A reshuffling in MCA caused Rakim to be dropped from the label in 1994.,1,15,"== Career == | ==== 1993–2003: Legal issues, solo debut and Aftermath stint ====",428906,1994-01-01,1994-12-31,ML
1996,CD,YEAR_REGEX_1,TIME,time_reference,The 18th Letter in 1996.,3,15,"== Career == | ==== 1993–2003: Legal issues, solo debut and Aftermath stint ====",428906,1996-01-01,1996-12-31,ML
November 1997,NNP CD,MONTH_REGEX YEAR_REGEX_1,TIME TIME,time_reference,"In November 1997, the album The 18th Letter was released.",4,15,"== Career == | ==== 1993–2003: Legal issues, solo debut and Aftermath stint ====",428906,1997-11-01,1997-11-30,ML
June 1999,NNP CD,MONTH_REGEX YEAR_REGEX_1,TIME TIME,time_reference,"In June 1999, Rakim appeared on three tracks of ""The Seduction of Claude Debussy"" by Art of Noise.",0,16,"== Career == | ==== 1993–2003: Legal issues, solo debut and Aftermath stint ====",428906,1999-06-01,1999-06-30,ML
November 1999,NNP CD,MONTH_REGEX YEAR_REGEX_1,TIME TIME,time_reference,"AllMusic's Keith Farley notes that ""the album charts the artistic use of sampled breakbeats -- pioneered by the Art of Noise themselves -- with nods to '80s hip-hop plus their '90s equivalent, drum'n'bass.""In November 1999, Rakim released The Master, which received good reviews but sold poorly.",1,16,"== Career == | ==== 1993–2003: Legal issues, solo debut and Aftermath stint ====",428906,1999-11-01,1999-11-30,ML
2000,CD,YEAR_REGEX_1,TIME,time_reference,"Rakim was signed to Dr. Dre's Aftermath Entertainment record label in 2000, for work on an album tentatively titled Oh, My God.",2,16,"== Career == | ==== 1993–2003: Legal issues, solo debut and Aftermath stint ====",428906,2000-01-01,2000-12-31,ML
2003,CD,YEAR_REGEX_1,TIME,time_reference,"However, Rakim left the label in 2003 and Oh, My God was indefinitely shelved.",0,17,"== Career == | ==== 1993–2003: Legal issues, solo debut and Aftermath stint ====",428906,2003-01-01,2003-12-31,ML
2007–09,CD,YEAR_REGEX_1,TIME,time_reference,2007–09:,1,18,== Career == | ==== 2007–09: The Seventh Seal ====,428906,2007-01-01,2023-12-31,ML
1999,CD,YEAR_REGEX_1,TIME,time_reference,"Not having released an album since 1999, he eschewed touring in favor of infrequent gigs.",1,19,== Career == | ==== 2007–09: The Seventh Seal ====,428906,1999-01-01,1999-12-31,ML
2006,CD,YEAR_REGEX_1,TIME,time_reference,"Rakim was able to retain the tracks he had made with Dr. Dre and, in 2006, announced that he would release a new studio album, The Seventh Seal.",2,19,== Career == | ==== 2007–09: The Seventh Seal ====,428906,2006-01-01,2006-12-31,ML
2009,CD,YEAR_REGEX_1,TIME,time_reference,"The album was delayed into 2009; instead, he followed up with a live album, The Archive: Live, Lost & Found, in 2008.",3,19,== Career == | ==== 2007–09: The Seventh Seal ====,428906,2009-01-01,2009-12-31,ML
2008,CD,YEAR_REGEX_1,TIME,time_reference,"The album was delayed into 2009; instead, he followed up with a live album, The Archive: Live, Lost & Found, in 2008.",3,19,== Career == | ==== 2007–09: The Seventh Seal ====,428906,2008-01-01,2008-12-31,ML
2007,CD,YEAR_REGEX_1,TIME,time_reference,"In an interview with Billboard in 2007, when asked about story behind The Seventh Seal's title, Rakim said,",4,19,== Career == | ==== 2007–09: The Seventh Seal ====,428906,2007-01-01,2007-12-31,ML
2009,CD,YEAR_REGEX_1,TIME,time_reference,"In another interview with Billboard in 2009, he stated,",0,21,== Career == | ==== 2007–09: The Seventh Seal ====,428906,2009-01-01,2009-12-31,ML
"November 17 , 2009","NNP CD , CD",MONTH_REGEX DIGIT_REGEX_1 COMMA_REGEX YEAR_REGEX_1,TIME NUMERAL MODIFIER TIME,time_reference,"The Seventh Seal was released on November 17, 2009, after several delays on Rakim's own Ra Records, TVM, and SMC Recordings and distributed through Fontana and Universal Music Group.",0,23,== Career == | ==== 2007–09: The Seventh Seal ====,428906,2009-11-17,2009-11-17,ML
"July 14 , 2009","NNP CD , CD",MONTH_REGEX DIGIT_REGEX_1 COMMA_REGEX YEAR_REGEX_1,TIME NUMERAL MODIFIER TIME,time_reference,"Considered a comeback album after a ten-year gap between releases, the album features the two singles: ""Holy Are You"", which was released on July 14, 2009, and ""Walk These Streets"" which was released on October 7, 2009.",1,23,== Career == | ==== 2007–09: The Seventh Seal ====,428906,2009-07-14,2009-07-14,ML
"October 7 , 2009","NNP CD , CD",MONTH_REGEX DIGIT_REGEX_1 COMMA_REGEX YEAR_REGEX_1,TIME NUMERAL MODIFIER TIME,time_reference,"Considered a comeback album after a ten-year gap between releases, the album features the two singles: ""Holy Are You"", which was released on July 14, 2009, and ""Walk These Streets"" which was released on October 7, 2009.",1,23,== Career == | ==== 2007–09: The Seventh Seal ====,428906,2009-10-07,2009-10-07,ML
"November 22 , 2009","NNP CD , CD",MONTH_REGEX DIGIT_REGEX_1 COMMA_REGEX YEAR_REGEX_1,TIME NUMERAL MODIFIER TIME,time_reference,"The album sold 12,000 copies in the United States by November 22, 2009, according to SoundScan.",3,23,== Career == | ==== 2007–09: The Seventh Seal ====,428906,2009-11-22,2009-11-22,ML
2011–present,CD,YEAR_REGEX_1,TIME,time_reference,==== 2011–present: fourth studio album =,0,24,== Career == | ==== 2011–present: fourth studio album ====,428906,2011-01-01,,ML
2011,CD,YEAR_REGEX_1,TIME,time_reference,"In 2011, Rakim performed Paid in Full in its entirety at the Blue Note Jazz Club in New York City, in honor of the album's 25th anniversary.",0,25,== Career == | ==== 2011–present: fourth studio album ====,428906,2011-01-01,2011-12-31,ML
2012,CD,YEAR_REGEX_1,TIME,time_reference,"In 2012, Rakim announced that he and Eric B. would release a 25th anniversary edition of their 1987 album Paid in Full, which would contain new tracks recorded by Eric B. & Rakim, by the end of 2012; Rakim announced he would release a new solo album by the end of 2012.",2,25,== Career == | ==== 2011–present: fourth studio album ====,428906,2012-01-01,2012-12-31,ML
2013,CD,YEAR_REGEX_1,TIME,time_reference,"In an interview with The Detroit Free Press he announced he was in the studio with Pharrell Williams working on a new album set to be released in 2013, saying the first single will be released before the end of the year.",4,25,== Career == | ==== 2011–present: fourth studio album ====,428906,2013-01-01,2013-12-31,ML
"September 24 , 2013","NNP CD , CD",MONTH_REGEX DIGIT_REGEX_1 COMMA_REGEX YEAR_REGEX_1,TIME NUMERAL MODIFIER TIME,time_reference,"On September 24, 2013, he released a collaborative single with DMX entitled ""Don't Call Me"".",5,25,== Career == | ==== 2011–present: fourth studio album ====,428906,2013-09-24,2013-09-24,ML
2014,CD,YEAR_REGEX_1,TIME,time_reference,"In 2014, Rakim is featured on the collaborative single with American rock band Linkin Park, titled ""Guilty All the Same"".",6,25,== Career == | ==== 2011–present: fourth studio album ====,428906,2014-01-01,2014-12-31,ML
"March 6 , 2014","NNP CD , CD",MONTH_REGEX DIGIT_REGEX_1 COMMA_REGEX YEAR_REGEX_1,TIME NUMERAL MODIFIER TIME,time_reference,"The song was released on March 6, 2014, under Warner Bros. Records, as the first single from their sixth studio album, titled The Hunting Party.",7,25,== Career == | ==== 2011–present: fourth studio album ====,428906,2014-03-06,2014-03-06,ML
"March 7 , 2014","NNP CD , CD",MONTH_REGEX DIGIT_REGEX_1 COMMA_REGEX YEAR_REGEX_1,TIME NUMERAL MODIFIER TIME,time_reference,"The song was officially released on March 7, 2014, for digital download.",9,25,== Career == | ==== 2011–present: fourth studio album ====,428906,2014-03-07,2014-03-07,ML
"April 27 , 2015","NNP CD , CD",MONTH_REGEX DIGIT_REGEX_1 COMMA_REGEX YEAR_REGEX_1,TIME NUMERAL MODIFIER TIME,time_reference,"On April 27, 2015, Rakim announced he was working on a new album and planned to release it in the middle or end of 2015.",0,26,== Career == | ==== 2011–present: fourth studio album ====,428906,2015-04-27,2015-04-27,ML
2016–present,CD,YEAR_REGEX_1,TIME,time_reference,Reunion with Eric B. (2016–present),1,27,== Career == | === Reunion with Eric B. (2016–present) ===,428906,2016-01-01,,ML
"October 20 , 2016","NNP CD , CD",MONTH_REGEX DIGIT_REGEX_1 COMMA_REGEX YEAR_REGEX_1,TIME NUMERAL MODIFIER TIME,time_reference,"On October 20, 2016, it was announced via Twitter that Rakim had reunited with Eric B. after 26 years of dissolution.",0,28,== Career == | === Reunion with Eric B. (2016–present) ===,428906,2016-10-20,2016-10-20,ML
1986,CD,YEAR_REGEX_1,TIME,time_reference,"Kool Moe Dee says, ""any emcee that came after 1986 had to study Rakim just to know what to be able to do.",9,30,== Artistry ==,428906,1986-01-01,1986-12-31,ML
1986,CD,YEAR_REGEX_1,TIME,time_reference,"[...] Rakim, in 1986, gave us flow and that was the rhyme style from 1986 to 1994.",10,30,== Artistry ==,428906,1986-01-01,1986-12-31,ML
1986 to 1994,CD TO CD,YEAR_REGEX_1 LINKAGE_REGEX YEAR_REGEX_1,TIME MODIFIER TIME,time_range,"[...] Rakim, in 1986, gave us flow and that was the rhyme style from 1986 to 1994.",10,30,== Artistry ==,428906,1986-01-01,1994-12-31,ML
"July 11 , 1995","NNP CD , CD",MONTH_REGEX DIGIT_REGEX_1 COMMA_REGEX YEAR_REGEX_1,TIME NUMERAL MODIFIER TIME,time_reference,"On July 11, 1995, the Recording Industry Association of America (RIAA) certified the album platinum.",3,33,== Legacy ==,428906,1995-07-11,1995-07-11,ML
1997,CD,YEAR_REGEX_1,TIME,time_reference,The 18th Letter (1997),0,36,== Discography == | === Studio albums ===,428906,1997-01-01,1997-12-31,ML
1999,CD,YEAR_REGEX_1,TIME,time_reference,The Master (1999),0,37,== Discography == | === Studio albums ===,428906,1999-01-01,1999-12-31,ML
2009,CD,YEAR_REGEX_1,TIME,time_reference,The Seventh Seal (2009),0,38,== Discography == | === Studio albums ===,428906,2009-01-01,2009-12-31,ML
1987,CD,YEAR_REGEX_1,TIME,time_reference,Paid in Full (1987),0,40,== Discography == | === as Eric B. & Rakim ===,428906,1987-01-01,1987-12-31,ML
1988,CD,YEAR_REGEX_1,TIME,time_reference,Follow the Leader (1988),0,41,== Discography == | === as Eric B. & Rakim ===,428906,1988-01-01,1988-12-31,ML
1990,CD,YEAR_REGEX_1,TIME,time_reference,Let the Rhythm Hit 'Em (1990),0,42,== Discography == | === as Eric B. & Rakim ===,428906,1990-01-01,1990-12-31,ML
1992,CD,YEAR_REGEX_1,TIME,time_reference,Don't Sweat the Technique (1992),0,43,== Discography == | === as Eric B. & Rakim ===,428906,1992-01-01,1992-12-31,ML
of early 1980s,IN JJ CD,PREFIX_REGEX_1 PREFIX_REGEX_1 YEAR_REGEX_1,MODIFIER MODIFIER TIME,time_reference,Rakim's rhyming deviated from the simple rhyme patterns of early 1980s hip hop.,0,30,== Artistry ==,428906,1980-01-01,1989-12-31,LLM
of the 1980s,IN DT CD,PREFIX_REGEX_1 PREFIX_REGEX_1 YEAR_REGEX_1,MODIFIER MODIFIER TIME,time_reference,"Time magazine listed it as one of the eighteen albums of the 1980s in its ""All-TIME 100"" albums; editor Alan Light acknowledged the record for changing the ""sound, flow, and potential"" of hip hop and that if Rakim is ""the greatest MC of all time, as many argue, this album is the evidence"".",10,32,== Legacy ==,428906,1980-01-01,1989-12-31,LLM
of the 1980s,IN DT CD,PREFIX_REGEX_1 PREFIX_REGEX_1 YEAR_REGEX_1,MODIFIER MODIFIER TIME,time_reference,"Pitchfork placed Paid in Full at number fifty-two in its ""Top 100 Albums of the 1980s""; editor Sam Chennault wrote that Rakim inspired a generation of MCs and ""defined what it meant to be a hip-hop lyricist"".",1,33,== Legacy ==,428906,1980-01-01,1989-12-31,LLM
seven years old,CD NNS JJ,BASIC_NUMBER_REGEX_1 TIME_UNIT_REGEX SUFFIX_REGEX,NUMERAL TIME MODIFIER,,"He grew up in Wyandanch, New York on Long Island, and wrote his first rhyme at seven years old, about the famous cartoon character Mickey Mouse.",1,3,== Early life ==,428906,,,ML
quarterback,NN,TIME_UNIT_REGEX,TIME,time_reference,"He initially aspired to be a professional football player, and played quarterback in high school, however, after being introduced to local DJ Eric B., by Alvin Toney, he began writing lyrics to Eric's instrumentals and instead focused on a career in music.",2,3,== Early life ==,428906,,,ML
'80s,VB,YEAR_REGEX_2,TIME,,"AllMusic's Keith Farley notes that ""the album charts the artistic use of sampled breakbeats -- pioneered by the Art of Noise themselves -- with nods to '80s hip-hop plus their '90s equivalent, drum'n'bass.""In November 1999, Rakim released The Master, which received good reviews but sold poorly.",1,16,"== Career == | ==== 1993–2003: Legal issues, solo debut and Aftermath stint ====",428906,,,ML
the past,DT NN,PREFIX_REGEX_1 TIMELINE_REGEX,MODIFIER TIME,time_reference,"After the Apocalypse, God rises from the ashes to recreate the Kingdom, taking only the greatest elements from the past with them.",3,22,== Career == | ==== 2007–09: The Seventh Seal ====,428906,,,ML
of their 1987,IN PRP$ CD,PREFIX_REGEX_1 PREFIX_REGEX_1 YEAR_REGEX_1,MODIFIER MODIFIER TIME,time_reference,"In 2012, Rakim announced that he and Eric B. would release a 25th anniversary edition of their 1987 album Paid in Full, which would contain new tracks recorded by Eric B. & Rakim, by the end of 2012; Rakim announced he would release a new solo album by the end of 2012.",2,25,== Career == | ==== 2011–present: fourth studio album ====,428906,,,ML
June,NNP,MONTH_REGEX,TIME,time_reference,He performed at the annual Roots' Picnic in Philadelphia in June.,3,25,== Career == | ==== 2011–present: fourth studio album ====,428906,,,ML
the end of the year,DT NN IN DT NN,PREFIX_REGEX_1 PREFIX_REGEX_2 PREFIX_REGEX_1 PREFIX_REGEX_1 TIME_UNIT_REGEX,MODIFIER MODIFIER MODIFIER MODIFIER TIME,time_reference,"In an interview with The Detroit Free Press he announced he was in the studio with Pharrell Williams working on a new album set to be released in 2013, saying the first single will be released before the end of the year.",4,25,== Career == | ==== 2011–present: fourth studio album ====,428906,,,ML
end of 2015,NN IN CD,PREFIX_REGEX_2 PREFIX_REGEX_1 YEAR_REGEX_1,MODIFIER MODIFIER TIME,time_reference,"On April 27, 2015, Rakim announced he was working on a new album and planned to release it in the middle or end of 2015.",0,26,== Career == | ==== 2011–present: fourth studio album ====,428906,,,ML
late June 2018,JJ NNP CD,PREFIX_REGEX_1 MONTH_REGEX YEAR_REGEX_1,MODIFIER TIME TIME,time_reference,"""In late June 2018, a new song, King's Paradise, was released on the Luke Cage season 2 soundtrack.",4,26,== Career == | ==== 2011–present: fourth studio album ====,428906,,,ML
26 years,CD NNS,DIGIT_REGEX_1 TIME_UNIT_REGEX,NUMERAL TIME,time_reference,"On October 20, 2016, it was announced via Twitter that Rakim had reunited with Eric B. after 26 years of dissolution.",0,28,== Career == | === Reunion with Eric B. (2016–present) ===,428906,,,ML
the next morning,DT JJ NN,PREFIX_REGEX_1 PREFIX_REGEX_1 DAY_TIME_REGEX,MODIFIER MODIFIER TIME,time_reference,"The duo teased a potential reunion tour the next morning, hosting a poll for the fans to give their opinion on what city Eric B. & Rakim should start the tour.",1,28,== Career == | === Reunion with Eric B. (2016–present) ===,428906,,,ML
the near future,DT JJ NN,PREFIX_REGEX_1 PREFIX_REGEX_1 TIMELINE_REGEX,MODIFIER MODIFIER TIME,time_reference,"Since the announcement of the reunion, fans have speculated if the two will drop a new studio album in the near future.",3,28,== Career == | === Reunion with Eric B. (2016–present) ===,428906,,,ML
of Dawn,IN NNP,PREFIX_REGEX_1 DAY_TIME_REGEX,MODIFIER TIME,time_reference,"William Jelani Cobb stated in his book To the Break of Dawn that his rapping had ""stepped outside"" of the preceding era of old school hip hop and that while the vocabulary and lyrical dexterity of newer rappers had improved, it was ""nowhere near what Rakim introduced to the genre"".",3,32,== Legacy ==,428906,,,ML
of December 1997,IN NNP CD,PREFIX_REGEX_1 MONTH_REGEX YEAR_REGEX_1,MODIFIER TIME TIME,time_reference,"As of December 1997, it has sold over a million copies.",4,33,== Legacy ==,428906,,,ML
