time_expression,POST_tag,time_token,type_token,time_expression_type,sentences,sentenceIndex,paragraphIndex,section,wikiId,normalised_value_start,normalised_value_end,source
"January 3 , 1991","NNP CD , CD",MONTH_REGEX DIGIT_REGEX_1 COMMA_REGEX YEAR_REGEX_1,TIME NUMERAL MODIFIER TIME,time_reference,"Diamanté Anthony Blackmon (born January 3, 1991), better known by his stage name Carnage (or DJ Carnage), is a Guatemalan-American DJ and record producer.",0,0,,51243189,1991-01-03,1991-01-03,ML
"January 3 , 1991","NNP CD , CD",MONTH_REGEX DIGIT_REGEX_1 COMMA_REGEX YEAR_REGEX_1,TIME NUMERAL MODIFIER TIME,time_reference,"Diamanté Anthony Blackmon was born on January 3, 1991, in Guatemala.",0,2,== Early life ==,51243189,1991-01-03,1991-01-03,ML
October 2015,NNP CD,MONTH_REGEX YEAR_REGEX_1,TIME TIME,time_reference,"In October 2015, Carnage released his debut album Papi Gordo, which ranked at number 184 on the Billboard 200.",1,4,== Career ==,51243189,2015-10-01,2015-10-31,ML
April 2018,NNP CD,MONTH_REGEX YEAR_REGEX_1,TIME TIME,time_reference,"In April 2018, Carnage released his second album Battered Bruised & Bloody.",0,5,== Career ==,51243189,2018-04-01,2018-04-30,ML
2017,CD,YEAR_REGEX_1,TIME,time_reference,2017 - Step Brothers (with G-Eazy),0,10,== Discography == | === Extended plays ===,51243189,2017-01-01,2017-12-31,ML
2018,CD,YEAR_REGEX_1,TIME,time_reference,"2018""Mop"" (Borgore featuring Gucci Mane and Thirty Rack)",0,46,== Discography == | ==== As featuring artist ====,51243189,2018-01-01,2018-12-31,ML
2020Together,CD,YEAR_REGEX_1,TIME,time_reference,Nah Nah (with Timmy Trumpet featuring Wicked Minds)2020Together (with The Martinez Brothers featuring Elderbrook and Mike Dean)2021Ktm (as Gordo)MOONWALK (with Killy featuring Yung Bans)Back in Time (with Marshmello),0,44,== Discography == | ==== As lead artist ====,51243189,2021-01-01,2021-12-31,LLM
2019Letting,CD,YEAR_REGEX_1,TIME,time_reference,El Diablo (featuring Sludge)2019Letting People Go (featuring Prinze George),0,39,== Discography == | ==== As lead artist ====,51243189,2019-01-01,2019-12-31,LLM
2018Learn,CD,YEAR_REGEX_1,TIME,time_reference,Xan Man (as Thirty Rack)2018Learn How to Watch (featuring Mac Miller and MadeinTYO),0,35,== Discography == | ==== As lead artist ====,51243189,2018-01-01,2018-12-31,LLM
2017Homie,CD,YEAR_REGEX_1,TIME,time_reference,PSY Or DIE (with Timmy Trumpet) (Spinnin' Records)2017Homie (featuring Young Thug and Meek Mill),0,32,== Discography == | ==== As lead artist ====,51243189,2017-01-01,2017-12-31,LLM
2016Rari,CD,YEAR_REGEX_1,TIME,time_reference,"Warrior (with Dirtcaps and Jo Mersa) (Ultra Music)2016Rari (featuring Lil Yachty, Famous Dex and Ugly God)",0,29,== Discography == | ==== As lead artist ====,51243189,2016-01-01,2016-12-31,LLM
2015WDYW,CD,YEAR_REGEX_1,TIME,time_reference,"Let The Freak Out (with Erick Morillo, Mr. V and Harry Romero) (Ultra Music)2015WDYW (featuring Lil Uzi",0,25,== Discography == | ==== As lead artist ====,51243189,2015-01-01,2015-12-31,LLM
2014Krakatoa,CD,YEAR_REGEX_1,TIME,time_reference,(Ultra Music)2014Krakatoa (with Junkie Kid) (Musical Freedom),1,22,== Discography == | ==== As lead artist ====,51243189,2014-01-01,2014-12-31,LLM
2014Dimitri,CD,YEAR_REGEX_1,TIME,time_reference,Dinah Washington - I've Got You Under My Skin (Carnage & Victor Niglio Remix)2014Dimitri Vegas & Like Mike and Moguai - Mammoth (Heroes x Villains and Carnage Remix) (Spinnin' Records)2015Avicii - Waiting For Love (Carnage and Headhunterz Remix) (PRMD),0,50,== Discography == | === Remixes ===,51243189,2014-01-01,2014-12-31,LLM
2013Incredible,CD,YEAR_REGEX_1,TIME,time_reference,Loaded (with G-Eazy) (Free Download)2013Incredible (with Borgore) (Spinnin’ Records),0,18,== Discography == | ==== As lead artist ====,51243189,2013-01-01,2013-12-31,LLM
2012Hardwell,CD,YEAR_REGEX_1,TIME,time_reference,2012Hardwell - Spaceman (Carnage Festival Trap Remix) (Revealed Recordings)2013Martin Solveig and The Cataracs featuring Kyle - Hey Now (Carnage Remix) (Mixture),0,48,== Discography == | === Remixes ===,51243189,2012-01-01,2012-12-31,LLM
2009Flowin,CD,YEAR_REGEX_1,TIME,time_reference,2009Flowin (with Foreign Beggars and MRX),0,14,== Discography == | ==== As lead artist ====,51243189,2009-01-01,2009-12-31,LLM
'97,NNP,YEAR_REGEX_2,TIME,time_reference,Mase In '97 (featuring Lil Yachty),0,31,== Discography == | ==== As lead artist ====,51243189,1997-01-01,1997-12-31,LLM
Tomorrowland,NNP,TIMELINE_REGEX,TIME,time_reference,"Carnage is known for his live performances at major music festivals such as Tomorrowland and Ultra Music Festival and his hit singles ""Bricks"" with Migos and ""I Like Tuh"" with ILoveMakonnen.",1,0,,51243189,,,ML
16 years old,CD NNS JJ,DIGIT_REGEX_1 TIME_UNIT_REGEX SUFFIX_REGEX,NUMERAL TIME MODIFIER,,"When he was 16 years old, he started playing in small clubs in his hometown of Frederick.",4,2,== Early life ==,51243189,,,ML
November,NNP,MONTH_REGEX,TIME,time_reference,"It includes 15 songs  such as ""Touch"", ""Bricks"", and ""November Skies"".",2,4,== Career ==,51243189,,,ML
2012Marilyn,CD,YEAR_REGEX_1,TIME,time_reference,(Dented Records)2012Marilyn (Morbit Records),1,14,== Discography == | ==== As lead artist ====,51243189,,,ML
November,NNP,MONTH_REGEX,TIME,time_reference,November Skies (with Tomas Barfod and Nina Kinert) (Ultra Musi),0,28,== Discography == | ==== As lead artist ====,51243189,,,ML
2021Migos,CD,YEAR_REGEX_1,TIME,time_reference,"2021Migos - Jane (Culture III; Quality Control, Capitol, Motown)",0,52,== Discography == | === Producer ===,51243189,,,ML
