time_expression,POST_tag,time_token,type_token,time_expression_type,sentences,sentenceIndex,paragraphIndex,section,wikiId,normalised_value_start,normalised_value_end,source
"August 6 , 1999","NNP CD , CD",MONTH_REGEX DIGIT_REGEX_1 COMMA_REGEX YEAR_REGEX_1,TIME NUMERAL MODIFIER TIME,time_reference,"Jay Gerard Bradley (born August 6, 1999), known professionally as Almighty Jay (formerly YBN Almighty Jay), is an American rapper.",0,0,,57008595,1999-08-06,1999-08-06,ML
August 2020,NNP CD,MONTH_REGEX YEAR_REGEX_1,TIME TIME,time_reference,He was part of the YBN collective before their disbandment in August 2020.,1,0,,57008595,2020-08-01,2020-08-31,ML
February 2018,NNP CD,MONTH_REGEX YEAR_REGEX_1,TIME TIME,time_reference,"Bradley started dating model Blac Chyna in February 2018, but they split in June.",0,4,== Personal life ==,57008595,2018-02-01,2018-02-28,ML
March 2019,NNP CD,MONTH_REGEX YEAR_REGEX_1,TIME TIME,time_reference,"In March 2019, Bradley was attacked in New York City, where his money and chains were taken.",0,6,== Personal life == | === Assault in New York City ===,57008595,2019-03-01,2019-03-31,ML
March to August 2019,NNP TO NNP CD,MONTH_REGEX LINKAGE_REGEX MONTH_REGEX YEAR_REGEX_1,TIME MODIFIER TIME TIME,time_reference,Bradley dated rapper DreamDoll from March to August 2019.,1,4,== Personal life ==,57008595,2019-03-01,2019-08-31,LLM
June,NNP,MONTH_REGEX,TIME,time_reference,"Bradley started dating model Blac Chyna in February 2018, but they split in June.",0,4,== Personal life ==,57008595,,,ML
