time_expression,POST_tag,time_token,type_token,time_expression_type,sentences,sentenceIndex,paragraphIndex,section,wikiId,normalised_value_start,normalised_value_end,source
2005,CD,YEAR_REGEX_1,TIME,time_reference,"(I'm Sorry)"" in 2005.",4,41,== Career == | === 2017–2020: The Time Is Now ===,636406,2005-01-01,2005-12-31,ML
31 May 2019,CD NNP CD,DIGIT_REGEX_1 MONTH_REGEX YEAR_REGEX_1,NUMERAL TIME TIME,time_point,"On 31 May 2019, David released a new single ""When You Know What Love Is"" from his upcoming eighth album.",6,41,== Career == | === 2017–2020: The Time Is Now ===,636406,2019-05-31,2019-05-31,ML
23 August 2019,CD NNP CD,DIGIT_REGEX_1 MONTH_REGEX YEAR_REGEX_1,NUMERAL TIME TIME,time_point,"His next UK garage single ""Do You Miss Me Much"" was released on 23 August 2019.",8,41,== Career == | === 2017–2020: The Time Is Now ===,636406,2019-08-23,2019-08-23,ML
2021–present,CD,YEAR_REGEX_1,TIME,time_reference,2021–present: Walk the Line =,1,42,== Career == | === 2021–present: Walk the Line ===,636406,2021-01-01,,ML
2022,CD,YEAR_REGEX_1,TIME,time_reference,"After appearing on KSI's BMG released album All Over The Place, David signed with the independent as a solo artist in order to record his new album 22 (due to be released in 2022).",0,43,== Career == | === 2021–present: Walk the Line ===,636406,2022-01-01,2022-12-31,ML
12 December 2021,CD NNP CD,DIGIT_REGEX_1 MONTH_REGEX YEAR_REGEX_1,NUMERAL TIME TIME,time_point,"Debuting on ITV on 12 December 2021, David joined Gary Barlow, Dawn French and Alesha Dixon on the judging panel.",4,43,== Career == | === 2021–present: Walk the Line ===,636406,2021-12-12,2021-12-12,ML
9 September 2020,CD NNP CD,DIGIT_REGEX_1 MONTH_REGEX YEAR_REGEX_1,NUMERAL TIME TIME,time_point,"On 9 September 2020, David signed a global publishing deal with New York-based Round Hill Music.",0,45,== Publishing deals ==,636406,2020-09-09,2020-09-09,ML
2007,CD,YEAR_REGEX_1,TIME,time_reference,"Speaking to The Sunday Times in 2007, David said that ""The whole Bo' Selecta!",2,47,== Caricature on Bo' Selecta! ==,636406,2007-01-01,2007-12-31,ML
2016,CD,YEAR_REGEX_1,TIME,time_reference,"He reiterated this stance on The Jonathan Ross Show in 2016 and explained that, contrary to popular belief, he had not fled the UK to escape negative attention brought about from the show.",12,47,== Caricature on Bo' Selecta! ==,636406,2016-01-01,2016-12-31,ML
June 2020,NNP CD,MONTH_REGEX YEAR_REGEX_1,TIME TIME,time_reference,"In June 2020, Francis apologised for his portrayal of David (among other black celebrities such as Michael Jackson, Mel B, and Trisha Goddard) in the show as a response to the Black Lives Matter movement and George Floyd protests, stating that ""I want to say sorry for any upset I caused whether I was Michael Jackson, Craig David or Trisha Goddard...",13,47,== Caricature on Bo' Selecta! ==,636406,2020-06-01,2020-06-30,ML
2000,CD,YEAR_REGEX_1,TIME,time_reference,Born to Do It (2000),0,49,== Discography ==,636406,2000-01-01,2000-12-31,ML
2002,CD,YEAR_REGEX_1,TIME,time_reference,Slicker Than Your Average (2002),0,50,== Discography ==,636406,2002-01-01,2002-12-31,ML
2005,CD,YEAR_REGEX_1,TIME,time_reference,The Story Goes... (2005),0,51,== Discography ==,636406,2005-01-01,2005-12-31,ML
2007,CD,YEAR_REGEX_1,TIME,time_reference,Trust Me (2007),0,52,== Discography ==,636406,2007-01-01,2007-12-31,ML
2010,CD,YEAR_REGEX_1,TIME,time_reference,Signed Sealed Delivered (2010),0,53,== Discography ==,636406,2010-01-01,2010-12-31,ML
2016,CD,YEAR_REGEX_1,TIME,time_reference,Following My Intuition (2016),0,54,== Discography ==,636406,2016-01-01,2016-12-31,ML
2018,CD,YEAR_REGEX_1,TIME,time_reference,The Time Is Now (2018),0,55,== Discography ==,636406,2018-01-01,2018-12-31,ML
2022,CD,YEAR_REGEX_1,TIME,time_reference,22 (2022),0,56,== Discography ==,636406,2022-01-01,2022-12-31,ML
2018,CD,YEAR_REGEX_1,TIME,time_reference,The Time Is Now Tour (2018),0,59,== Concert tours ==,636406,2018-01-01,2018-12-31,ML
24 March 2010,CD NNP CD,DIGIT_REGEX_1 MONTH_REGEX YEAR_REGEX_1,NUMERAL TIME TIME,time_point,"On 24 March 2010 (World Tuberculosis Day), the World Health Organization appointed Craig David as a Goodwill Ambassador against tuberculosis.",2,61,== Personal life and activism ==,636406,2010-03-24,2010-03-24,ML
January 2021,NNP CD,MONTH_REGEX YEAR_REGEX_1,TIME TIME,time_reference,"In January 2021 it was announced that Craig David would appear in an E-Sports series in a campaign with Mclaren and British American Tobacco (BAT) in order to enable them to reach their customers ""in new, exciting and engaging ways"" to push the nicotine pouch brand VELO.",5,61,== Personal life and activism ==,636406,2021-01-01,2021-01-31,ML
2013,CD,YEAR_REGEX_1,TIME,time_reference,"Craig has also been criticised by Action on Smoking and Health in 2013 for appearing in another Big Tobacco funded appearance in Penang, Malaysia where Japan Tobacco International sponsored a concert.",7,61,== Personal life and activism ==,636406,2013-01-01,2013-12-31,ML
30 December 2020,CD NNP CD,DIGIT_REGEX_1 MONTH_REGEX YEAR_REGEX_1,NUMERAL TIME TIME,time_point,"On 30 December 2020, it was announced that in the Queen’s New Year Honours List David had been appointed as MBE in recognition of his services to music.",0,63,== Honours and awards ==,636406,2020-12-30,2020-12-30,ML
15 December 2021,CD NNP CD,DIGIT_REGEX_1 MONTH_REGEX YEAR_REGEX_1,NUMERAL TIME TIME,time_point,David received his award at Windsor Castle on 15 December 2021.,2,63,== Honours and awards ==,636406,2021-12-15,2021-12-15,ML
23 April 2011,CD NNP CD,DIGIT_REGEX_1 MONTH_REGEX YEAR_REGEX_1,NUMERAL TIME TIME,time_point,I Love Music Festival at Tenerife (23 April 2011),0,69,== External links ==,636406,2011-04-23,2011-04-23,ML
31 December 2019 and 1 January 2020,CD NNP CD CC CD NNP CD,DIGIT_REGEX_1 MONTH_REGEX YEAR_REGEX_1 LINKAGE_REGEX DIGIT_REGEX_1 MONTH_REGEX YEAR_REGEX_1,NUMERAL TIME TIME MODIFIER NUMERAL TIME TIME,time_range,"On 31 December 2019 and 1 January 2020, David performed on BBC One's New Year Live concert at Westminster Central Hall with his full band and TS5 DJ set.",9,41,== Career == | === 2017–2020: The Time Is Now ===,636406,2019-12-31,2020-01-01,LLM
23 November,CD NNP,DIGIT_REGEX_1 MONTH_REGEX,NUMERAL TIME,,"On 23 November, David released his second single from The Time Is Now, ""I Know You"" featuring Bastille.",1,41,== Career == | === 2017–2020: The Time Is Now ===,636406,2017-11-23,2017-11-23,LLM
a 2015,DT CD,INARTICLE_REGEX YEAR_REGEX_1,MODIFIER TIME,time_reference,"In a 2015 interview with the Daily Mirror, David stated that he had no hard feelings towards Francis, explaining how he had seen him at a wedding and given him a hug, assuring him they were ""cool"".",10,47,== Caricature on Bo' Selecta! ==,636406,2015-01-01,2015-12-31,LLM
The 2010 Sunday,DT CD NNP,PREFIX_REGEX_1 YEAR_REGEX_1 WEEK_REGEX,MODIFIER TIME TIME,time_reference,The 2010 Sunday Times Rich List indicated that Craig David is worth £8 million.,7,26,== Career == | === 2009–2010: New label and Signed Sealed Delivered ===,636406,2010-01-01,2010-12-31,LLM
two 2008,CD CD,BASIC_NUMBER_REGEX_1 YEAR_REGEX_1,NUMERAL TIME,,David received two 2008 UK Urban Music Award nominations for Best Album with Trust Me and Best R&B Act.,2,19,== Career == | === 2005–2008: The Story Goes... and Trust Me ===,636406,2008-01-01,2008-12-31,LLM
Tonight,NNP,DAY_TIME_REGEX,TIME,time_reference,"David's earliest exposure came when he worked on a B-side to British group Damage's cover of ""Wonderful Tonight"", on the track ""I'm Ready"".",0,7,== Career == | === Early career ===,636406,,,ML
seventeen year-old,JJ NN,BASIC_NUMBER_REGEX_1 TIME_UNIT_REGEX,NUMERAL TIME,time_reference,"It struck me that any seventeen year-old that could write a song like this had huge potential.""",2,8,== Career == | === Early career ===,636406,,,ML
7 Days,CD NNPS,DIGIT_REGEX_1 TIME_UNIT_REGEX,NUMERAL TIME,,"When Lester later heard the song ""7 Days"", he said he immediately heard a number-one record and promoted the contract to an album deal the same day.",5,8,== Career == | === Early career ===,636406,,,ML
7 Days,CD NNPS,DIGIT_REGEX_1 TIME_UNIT_REGEX,NUMERAL TIME,,"The single ""7 Days"" hit the top 10 in the U.S.; although ""Walking Away"", which had reached number 3 in the UK and number 5 in Australia, missed the top 40 in the U.S. and was the last of his singles to chart there.",3,11,== Career == | === 2000–2003: Born to Do It and Slicker Than Your Average ===,636406,,,ML
Fall,NNP,SEASON_REGEX,TIME,time_reference,"Although ""What's Your Flava?"" and ""Rise & Fall"" (duet with Sting) received airplay on the urban contemporary and soft adult contemporary formats, they did not make the Hot R&B/Hip-Hop Songs chart or the Adult Contemporary chart.",4,12,== Career == | === 2000–2003: Born to Do It and Slicker Than Your Average ===,636406,,,ML
7 Days,CD NNPS,DIGIT_REGEX_1 TIME_UNIT_REGEX,NUMERAL TIME,,"No More (I'm Sorry)"", tied with ""7 Days"" as his longest-running single in the charts since ""Re-Rewind"", spending 15 weeks inside the UK top 75.",3,15,== Career == | === 2005–2008: The Story Goes... and Trust Me ===,636406,,,ML
July,NNP,MONTH_REGEX,TIME,time_reference,"In July, a new track titled ""Are You Up for This"" started receiving airplay on various radio stations as part of a promo with Ice Cream Records, which also featured a remix with Wittyboy called ""Nutter Butter"".",1,18,== Career == | === 2005–2008: The Story Goes... and Trust Me ===,636406,,,ML
the night,DT NN,PREFIX_REGEX_1 DAY_TIME_REGEX,MODIFIER TIME,time_reference,"He picked up the ""Man of The Match"" award on the night and played in the same England side as ex-internationals such as Alan Shearer, Teddy Sheringham and David Seaman, and played against the likes of Romário, Paolo Di Canio, Jaap Stam, and Luís Figo.",1,19,== Career == | === 2005–2008: The Story Goes... and Trust Me ===,636406,,,ML
days,NNS,TIME_UNIT_REGEX,TIME,time_reference,"""Where's Your Love"" featuring Tinchy Stryder and Rita Ora, a homage to his UK garage days, was digitally released on 10 November 2008.",2,21,== Career == | === 2008–2009: Greatest Hits ===,636406,,,ML
the following week,DT VBG NN,PREFIX_REGEX_1 PREFIX_REGEX_1 TIME_UNIT_REGEX,MODIFIER MODIFIER TIME,time_reference,"The second single, ""Insomnia"", produced by Jim Beanz from Timbaland productions, a dance track with hard bassline beats, was released the following week on 17 November 2008.",3,21,== Career == | === 2008–2009: Greatest Hits ===,636406,,,ML
Night,NNP,DAY_TIME_REGEX,TIME,time_reference,"On 29 December 2008, a new mix of ""Insomnia"", titled ""Up All Night Mix"", was made available for digital download.",0,22,== Career == | === 2008–2009: Greatest Hits ===,636406,,,ML
February to April 2009,NNP TO NNP CD,MONTH_REGEX LINKAGE_REGEX MONTH_REGEX YEAR_REGEX_1,TIME MODIFIER TIME TIME,time_reference,"From February to April 2009, David toured Russia, the Far East and performed one show in Los Angeles as part of a Greatest Hits tour.",3,22,== Career == | === 2008–2009: Greatest Hits ===,636406,,,ML
following one week,VBG CD NN,PREFIX_REGEX_1 BASIC_NUMBER_REGEX_1 TIME_UNIT_REGEX,MODIFIER NUMERAL TIME,time_reference,"The first single from David's fifth studio album Signed Sealed Delivered was ""One More Lie (Standing in the Shadows)"" and it was released in the UK on 22 March 2010 where it made number 76 with the album following one week later on 29 March 2010, which entered the UK chart at number 13.",0,25,== Career == | === 2009–2010: New label and Signed Sealed Delivered ===,636406,,,ML
the last ten years,DT JJ JJ NNS,PREFIX_REGEX_1 PREFIX_REGEX_1 BASIC_NUMBER_REGEX_1 TIME_UNIT_REGEX,MODIFIER MODIFIER NUMERAL TIME,time_reference,"On 17 March 2010, David released a UK garage compilation album titled Rewind Old Skool Classics mixed with DJ Spoony featuring some of their favourite UK garage hits from the last ten years.",0,26,== Career == | === 2009–2010: New label and Signed Sealed Delivered ===,636406,,,ML
Two weeks,CD NNS,BASIC_NUMBER_REGEX_1 TIME_UNIT_REGEX,NUMERAL TIME,time_reference,"Two weeks later on 31 May 2010, the second single to be taken from Signed Sealed Delivered, titled ""All Alone Tonight (Stop, Look, Listen)"" was released.",1,26,== Career == | === 2009–2010: New label and Signed Sealed Delivered ===,636406,,,ML
the weeks,DT NNS,PREFIX_REGEX_1 TIME_UNIT_REGEX,MODIFIER TIME,time_reference,In the weeks leading up to the release BBC Radio Two backed the single by naming it their 'Record of the Week' and adding it to their 'A-List'.,3,26,== Career == | === 2009–2010: New label and Signed Sealed Delivered ===,636406,,,ML
The Morning,DT NNP,PREFIX_REGEX_1 DAY_TIME_REGEX,MODIFIER TIME,time_reference,"On 20 May 2010, David appeared as a co-host on The Morning Show in Australia alongside Kylie Gillies, whilst regular male presenter Larry Emdur was on holiday.",4,26,== Career == | === 2009–2010: New label and Signed Sealed Delivered ===,636406,,,ML
August,NNP,MONTH_REGEX,TIME,time_reference,He also tweeted about working with August Rigo and more recently Fraser T Smith.,1,28,"== Career == | === 2011–2013: Collaborations, new material and TS5 launch ===",636406,,,ML
Day 2011,NNP CD,TIME_UNIT_REGEX YEAR_REGEX_1,TIME TIME,time_reference,"In February 2011, David agreed to do a desert trek for Comic Relief as part of Red Nose Day 2011.",3,28,"== Career == | === 2011–2013: Collaborations, new material and TS5 launch ===",636406,,,ML
the Millennium,DT NNP,PREFIX_REGEX_1 TIME_UNIT_REGEX,MODIFIER TIME,time_reference,"David performed at the Michael Jackson tribute concert, held in Cardiff at the Millennium Stadium on 8 October 2011.",7,28,"== Career == | === 2011–2013: Collaborations, new material and TS5 launch ===",636406,,,ML
December,NNP,MONTH_REGEX,TIME,time_reference,"In December, he featured on the Blackout Mode dance track ""Freak on the Dancefloor"" that appeared on the compilation album R&B Collection 2012.",10,28,"== Career == | === 2011–2013: Collaborations, new material and TS5 launch ===",636406,,,ML
their 2009,PRP$ CD,PREFIX_REGEX_1 YEAR_REGEX_1,MODIFIER TIME,,"In July 2012, it was revealed David was writing with Backstreet Boys on their 20th-anniversary album, the follow-up to their 2009 album ""This Is Us"" and the first they released since the return of Kevin Richardson who departed from the band in 2005.",0,30,"== Career == | === 2011–2013: Collaborations, new material and TS5 launch ===",636406,,,ML
May,NNP,MONTH_REGEX,TIME,time_reference,"Starting in March 2013, David embarked on a world tour starting with three shows across Australia, followed by four in Europe (France, Belgium, Germany and The Netherlands) and finally finishing in May with four shows in England (Birmingham, Manchester, Southampton and London).",0,32,"== Career == | === 2011–2013: Collaborations, new material and TS5 launch ===",636406,,,ML
every Friday evening,DT NNP NN,PREFIX_REGEX_1 WEEK_REGEX DAY_TIME_REGEX,MODIFIER TIME TIME,time_reference,to Capital Xtra every Friday evening from 10:00 pm.,0,33,"== Career == | === 2011–2013: Collaborations, new material and TS5 launch ===",636406,,,ML
the week,DT NN,PREFIX_REGEX_1 TIME_UNIT_REGEX,MODIFIER TIME,time_reference,"Premiering it on his TS5 radio show the week before, he wanted to preview some of the new music he has been working on in anticipation of his long-awaited sixth studio album.",1,35,== Career == | === 2014–2016: Following My Intuition and return to fame ===,636406,,,ML
The following week,DT JJ NN,PREFIX_REGEX_1 PREFIX_REGEX_1 TIME_UNIT_REGEX,MODIFIER MODIFIER TIME,time_reference,"The following week, on 10 September 2015, David appeared on Kurupt FM's 'Sixty Minute Takeover' on BBC Radio 1Xtra with MistaJam.",1,36,== Career == | === 2014–2016: Following My Intuition and return to fame ===,636406,,,ML
Now,RB,TIMELINE_REGEX,TIME,time_reference,"He performed ""Fill Me In"" over the track ""Where Are Ü Now"" and it became a viral internet hit.",2,36,== Career == | === 2014–2016: Following My Intuition and return to fame ===,636406,,,ML
the night,DT NN,PREFIX_REGEX_1 DAY_TIME_REGEX,MODIFIER TIME,time_reference,"Two snippets of potential new album tracks were also played on the night and this 1Xtra appearance led to David making surprise performances of the ""Fill Me In"" /",3,36,== Career == | === 2014–2016: Following My Intuition and return to fame ===,636406,,,ML
Now,RB,TIMELINE_REGEX,TIME,time_reference,"""Where Are Ü Now"" remix at Fabric with Kurupt FM and Alexandra Palace with Major Lazer and Diplo.",4,36,== Career == | === 2014–2016: Following My Intuition and return to fame ===,636406,,,ML
the second day,DT JJ NN,PREFIX_REGEX_1 ORDINAL_REGEX_1 TIME_UNIT_REGEX,MODIFIER NUMERAL TIME,time_reference,"On 19 March 2016, at the second day of the Ultra Music Festival 2016, during the set of the Dutch DJ and record producer Hardwell, he appeared to present their new track ""No Holding Back"", which was released on 19 August 2016.",1,38,== Career == | === 2014–2016: Following My Intuition and return to fame ===,636406,,,ML
Now,RB,TIMELINE_REGEX,TIME,time_reference,=== 2017–2020: The Time Is Now =,0,40,== Career == | === 2017–2020: The Time Is Now ===,636406,,,ML
Now,RB,TIMELINE_REGEX,TIME,time_reference,"On 15 September 2017, David announced the release of the seventh studio album, The Time Is Now, which was released in January 2018, along with the single ""Heartline"".",0,41,== Career == | === 2017–2020: The Time Is Now ===,636406,,,ML
a day,DT NN,INARTICLE_REGEX TIME_UNIT_REGEX,MODIFIER TIME,time_reference,David and Dan Smith from Bastille performed the song live a day later on Sounds Like Friday Night.,2,41,== Career == | === 2017–2020: The Time Is Now ===,636406,,,ML
Now,RB,TIMELINE_REGEX,TIME,time_reference,"The Time Is Now debuted at number 2 on the UK Albums Chart, kept off the top spot by The Greatest Showman: Original Motion Picture Soundtrack.",5,41,== Career == | === 2017–2020: The Time Is Now ===,636406,,,ML
July,NNP,MONTH_REGEX,TIME,time_reference,"In July, David made a cameo appearance in Love Island, performing the single as a DJ at a Ministry of Sound pool party.",7,41,== Career == | === 2017–2020: The Time Is Now ===,636406,,,ML
May,NNP,MONTH_REGEX,TIME,time_reference,"In May, he appeared on ""Summertime"", a single from People Just Do Nothing stars Kurupt FM, which appeared on their album The Greatest Hits (Part 1).",1,43,== Career == | === 2021–present: Walk the Line ===,636406,,,ML
October,NNP,MONTH_REGEX,TIME,time_reference,"In October, he scored a Top 40 single with MNEK called ""Who You Are"", which was produced by Digital Farm Animals and released by Moor in association with BMG.",2,43,== Career == | === 2021–present: Walk the Line ===,636406,,,ML
the year,DT NN,PREFIX_REGEX_1 TIME_UNIT_REGEX,MODIFIER TIME,time_reference,David ended the year as one of the judges on new talent show Walk the Line.,3,43,== Career == | === 2021–present: Walk the Line ===,636406,,,ML
Dawn,NNP,DAY_TIME_REGEX,TIME,time_reference,"Debuting on ITV on 12 December 2021, David joined Gary Barlow, Dawn French and Alesha Dixon on the judging panel.",4,43,== Career == | === 2021–present: Walk the Line ===,636406,,,ML
a futures,DT NNS,INARTICLE_REGEX TIMELINE_REGEX,MODIFIER TIME,time_reference,"The agreement includes all of David's music catalogue to date, and also includes a futures agreement that will see all of his new music administered by the company.",1,45,== Publishing deals ==,636406,,,ML
The Sunday,DT NNP,PREFIX_REGEX_1 WEEK_REGEX,MODIFIER TIME,time_reference,"Speaking to The Sunday Times in 2007, David said that ""The whole Bo' Selecta!",2,47,== Caricature on Bo' Selecta! ==,636406,,,ML
the years,DT NNS,PREFIX_REGEX_1 TIME_UNIT_REGEX,MODIFIER TIME,time_reference,"However, he has also denied that his career had been ruined as a result of the show, and has said that he was satisfied with his musical output over the years.",9,47,== Caricature on Bo' Selecta! ==,636406,,,ML
am,VBP,HALFDAY_REGEX_1,TIME,,"all people who I am a big fan of.""",14,47,== Caricature on Bo' Selecta! ==,636406,,,ML
month,NN,TIME_UNIT_REGEX,TIME,time_reference,Bo' Selecta! was removed from the video on demand service All 4 later that same month for similar reasons.,15,47,== Caricature on Bo' Selecta! ==,636406,,,ML
Now,RB,TIMELINE_REGEX,TIME,time_reference,The Time Is Now (2018),0,55,== Discography ==,636406,,,ML
Now,RB,TIMELINE_REGEX,TIME,time_reference,The Time Is Now Tour (2018),0,59,== Concert tours ==,636406,,,ML
Day,NNP,TIME_UNIT_REGEX,TIME,time_reference,"On 24 March 2010 (World Tuberculosis Day), the World Health Organization appointed Craig David as a Goodwill Ambassador against tuberculosis.",2,61,== Personal life and activism ==,636406,,,ML
presenter,NN,TIMELINE_REGEX,TIME,time_reference,He appears in the series alongside other UK stars including presenter Rory Reid and Fred Sirieix.,6,61,== Personal life and activism ==,636406,,,ML
Year,NNP,TIME_UNIT_REGEX,TIME,time_reference,"On 30 December 2020, it was announced that in the Queen’s New Year Honours List David had been appointed as MBE in recognition of his services to music.",0,63,== Honours and awards ==,636406,,,ML
