time_expression,POST_tag,time_token,type_token,time_expression_type,sentences,sentenceIndex,paragraphIndex,section,wikiId,normalised_value_start,normalised_value_end,source
5 May 1981,CD NNP CD,DIGIT_REGEX_1 MONTH_REGEX YEAR_REGEX_1,NUMERAL TIME TIME,time_point,"Craig Ashley David  (born 5 May 1981) is a British singer, songwriter, rapper, DJ and record producer who rose to fame in 1999, featuring on the single ""Re-Rewind"" by Artful Dodger.",0,0,,636406,1981-05-05,1981-05-05,ML
1999,CD,YEAR_REGEX_1,TIME,time_reference,"Craig Ashley David  (born 5 May 1981) is a British singer, songwriter, rapper, DJ and record producer who rose to fame in 1999, featuring on the single ""Re-Rewind"" by Artful Dodger.",0,0,,636406,1999-01-01,1999-12-31,ML
2000,CD,YEAR_REGEX_1,TIME,time_reference,"David's debut studio album, Born to Do It, was released in 2000, after which he has released a further five studio albums and worked with a variety of artists such as Sting, Tinchy Stryder, Big Narstie, Kano and Jay Sean.",1,0,,636406,2000-01-01,2000-12-31,ML
2005,CD,YEAR_REGEX_1,TIME,time_reference,"He wrote and released the song ""Johnny"" in 2005 about his sad memories of being bullied.",1,4,== Early life ==,636406,2005-01-01,2005-12-31,ML
2000–2003,CD,YEAR_REGEX_1,TIME,time_reference,2000–2003: Born to Do It and Slicker Than Your Average ===,1,9,== Career == | === 2000–2003: Born to Do It and Slicker Than Your Average ===,636406,2000-01-01,2003-12-31,ML
1999,CD,YEAR_REGEX_1,TIME,time_reference,"The song ""Re-Rewind (The Crowd Say Bo Selecta)"", from the Artful Dodger album It's All About the Stragglers, hit number two on the UK charts in 1999; thus, paving the way for a solo career.",0,10,== Career == | === 2000–2003: Born to Do It and Slicker Than Your Average ===,636406,1999-01-01,1999-12-31,ML
May 2001,NNP CD,MONTH_REGEX YEAR_REGEX_1,TIME TIME,time_reference,"The success of David's debut, which was written almost entirely by David and Mark Hill of Artful Dodger, led to the United States release of ""Fill Me In"" in May 2001.",0,11,== Career == | === 2000–2003: Born to Do It and Slicker Than Your Average ===,636406,2001-05-01,2001-05-31,ML
17 July 2001,CD NNP CD,DIGIT_REGEX_1 MONTH_REGEX YEAR_REGEX_1,NUMERAL TIME TIME,time_point,"Born to Do It was released in the United States on 17 July 2001, peaking at number 11 on the Billboard 200 chart and sold over 1 million copies.",2,11,== Career == | === 2000–2003: Born to Do It and Slicker Than Your Average ===,636406,2001-07-17,2001-07-17,ML
April 2009,NNP CD,MONTH_REGEX YEAR_REGEX_1,TIME TIME,time_reference,"In April 2009, MTV viewers voted Born to Do It as number 2 on their ""Greatest Album of All-Time"" poll, behind Michael Jackson's Thriller.",0,12,== Career == | === 2000–2003: Born to Do It and Slicker Than Your Average ===,636406,2009-04-01,2009-04-30,ML
2002,CD,YEAR_REGEX_1,TIME,time_reference,"The follow-up album, Slicker Than Your Average, was released in 2002.",1,12,== Career == | === 2000–2003: Born to Do It and Slicker Than Your Average ===,636406,2002-01-01,2002-12-31,ML
2003,CD,YEAR_REGEX_1,TIME,time_reference,"The album's first four singles continued David's streak of top 10 hits in the UK, bringing a total of nine consecutive top 10 hits until ""World Filled with Love"" peaked at number 15 in 2003.",2,12,== Career == | === 2000–2003: Born to Do It and Slicker Than Your Average ===,636406,2003-01-01,2003-12-31,ML
2005–2008,CD,YEAR_REGEX_1,TIME,time_reference,2005–2008:,1,14,== Career == | === 2005–2008: The Story Goes... and Trust Me ===,636406,2005-01-01,2008-12-31,ML
August 2005,NNP CD,MONTH_REGEX YEAR_REGEX_1,TIME TIME,time_reference,"David later signed on with Warner Music and put together his third album, The Story Goes..., which was released worldwide in August 2005 (excluding the U.S. where it was never released).",0,15,== Career == | === 2005–2008: The Story Goes... and Trust Me ===,636406,2005-08-01,2005-08-31,ML
March 2006,NNP CD,MONTH_REGEX YEAR_REGEX_1,TIME TIME,time_reference,"The album's third single, ""Unbelievable"", debuted at number 18 in March 2006.",4,15,== Career == | === 2005–2008: The Story Goes... and Trust Me ===,636406,2006-03-01,2006-03-31,ML
2007,CD,YEAR_REGEX_1,TIME,time_reference,"In 2007, David collaborated with British rapper Kano on his album London Town, for the single ""This Is the Girl"".",0,16,== Career == | === 2005–2008: The Story Goes... and Trust Me ===,636406,2007-01-01,2007-12-31,ML
27 August 2007,CD NNP CD,DIGIT_REGEX_1 MONTH_REGEX YEAR_REGEX_1,NUMERAL TIME TIME,time_point,The track was released on 27 August 2007 and debuted at number 18 on the UK charts.,1,16,== Career == | === 2005–2008: The Story Goes... and Trust Me ===,636406,2007-08-27,2007-08-27,ML
5 November 2007,CD NNP CD,DIGIT_REGEX_1 MONTH_REGEX YEAR_REGEX_1,NUMERAL TIME TIME,time_point,"The first single from his album Trust Me, ""Hot Stuff (Let's Dance)"", was released on 5 November 2007.",0,17,== Career == | === 2005–2008: The Story Goes... and Trust Me ===,636406,2007-11-05,2007-11-05,ML
1983,CD,YEAR_REGEX_1,TIME,time_reference,"David successfully sought permission from David Bowie to sample his 1983 number-one single ""Let's Dance"".",1,17,== Career == | === 2005–2008: The Story Goes... and Trust Me ===,636406,1983-01-01,1983-12-31,ML
23 June 2008,CD NNP CD,DIGIT_REGEX_1 MONTH_REGEX YEAR_REGEX_1,NUMERAL TIME TIME,time_point,"""Officially Yours"" was released on 23 June 2008 and peaked at number 158 on the UK Singles Chart, becoming his lowest-charting single to date and was the final single from Trust Me.",0,18,== Career == | === 2005–2008: The Story Goes... and Trust Me ===,636406,2008-06-23,2008-06-23,ML
17 August 2008,CD NNP CD,DIGIT_REGEX_1 MONTH_REGEX YEAR_REGEX_1,NUMERAL TIME TIME,time_point,"On 17 August 2008, David performed at a birthday tribute concert for songwriter Don Black at the London Palladium.",2,18,== Career == | === 2005–2008: The Story Goes... and Trust Me ===,636406,2008-08-17,2008-08-17,ML
2008,CD,YEAR_REGEX_1,TIME,time_reference,David took part in Soccer Aid 2008 at Wembley Stadium on 7 September 2008.,0,19,== Career == | === 2005–2008: The Story Goes... and Trust Me ===,636406,2008-01-01,2008-12-31,ML
7 September 2008,CD NNP CD,DIGIT_REGEX_1 MONTH_REGEX YEAR_REGEX_1,NUMERAL TIME TIME,time_point,David took part in Soccer Aid 2008 at Wembley Stadium on 7 September 2008.,0,19,== Career == | === 2005–2008: The Story Goes... and Trust Me ===,636406,2008-09-07,2008-09-07,ML
7 November 2008,CD NNP CD,DIGIT_REGEX_1 MONTH_REGEX YEAR_REGEX_1,NUMERAL TIME TIME,time_point,"On 7 November 2008, David was recognised for his contribution to the music industry by receiving an honorary degree of Doctor of Music, from Southampton Solent University at a graduation ceremony held at Southampton Guildhall.",3,19,== Career == | === 2005–2008: The Story Goes... and Trust Me ===,636406,2008-11-07,2008-11-07,ML
2008–2009,CD,YEAR_REGEX_1,TIME,time_reference,2008–2009:,1,20,== Career == | === 2008–2009: Greatest Hits ===,636406,2008-01-01,2009-12-31,ML
24 November 2008,CD NNP CD,DIGIT_REGEX_1 MONTH_REGEX YEAR_REGEX_1,NUMERAL TIME TIME,time_point,David released his first Greatest Hits album on 24 November 2008.,0,21,== Career == | === 2008–2009: Greatest Hits ===,636406,2008-11-24,2008-11-24,ML
10 November 2008,CD NNP CD,DIGIT_REGEX_1 MONTH_REGEX YEAR_REGEX_1,NUMERAL TIME TIME,time_point,"""Where's Your Love"" featuring Tinchy Stryder and Rita Ora, a homage to his UK garage days, was digitally released on 10 November 2008.",2,21,== Career == | === 2008–2009: Greatest Hits ===,636406,2008-11-10,2008-11-10,ML
17 November 2008,CD NNP CD,DIGIT_REGEX_1 MONTH_REGEX YEAR_REGEX_1,NUMERAL TIME TIME,time_point,"The second single, ""Insomnia"", produced by Jim Beanz from Timbaland productions, a dance track with hard bassline beats, was released the following week on 17 November 2008.",3,21,== Career == | === 2008–2009: Greatest Hits ===,636406,2008-11-17,2008-11-17,ML
29 December 2008,CD NNP CD,DIGIT_REGEX_1 MONTH_REGEX YEAR_REGEX_1,NUMERAL TIME TIME,time_point,"On 29 December 2008, a new mix of ""Insomnia"", titled ""Up All Night Mix"", was made available for digital download.",0,22,== Career == | === 2008–2009: Greatest Hits ===,636406,2008-12-29,2008-12-29,ML
April 2009,NNP CD,MONTH_REGEX YEAR_REGEX_1,TIME TIME,time_reference,"In April 2009, Born to Do It came second in a poll by MTV UK for the Greatest Album Ever, which received over 40,000 votes, beaten by Michael Jackson's album Thriller.",5,22,== Career == | === 2008–2009: Greatest Hits ===,636406,2009-04-01,2009-04-30,ML
14 May 2009,CD NNP CD,DIGIT_REGEX_1 MONTH_REGEX YEAR_REGEX_1,NUMERAL TIME TIME,time_point,"On 14 May 2009, David participated in the Hillsborough Memorial football match at Anfield.",6,22,== Career == | === 2008–2009: Greatest Hits ===,636406,2009-05-14,2009-05-14,ML
26 July 2009,CD NNP CD,DIGIT_REGEX_1 MONTH_REGEX YEAR_REGEX_1,NUMERAL TIME TIME,time_point,"On 26 July 2009, David participated in the Sir Bobby Robson Trophy match at St James' Park, playing alongside boyhood hero Alan Shearer.",7,22,== Career == | === 2008–2009: Greatest Hits ===,636406,2009-07-26,2009-07-26,ML
2009–2010,CD,YEAR_REGEX_1,TIME,time_reference,2009–2010:,1,23,== Career == | === 2009–2010: New label and Signed Sealed Delivered ===,636406,2009-01-01,2010-12-31,ML
18 September 2009,CD NNP CD,DIGIT_REGEX_1 MONTH_REGEX YEAR_REGEX_1,NUMERAL TIME TIME,time_point,"On 18 September 2009, fans got the first taste of the new album with an exclusive demo posted on his official website, a thirty-second snippet covering Stevie Wonder's ""Signed, Sealed, Delivered I'm Yours"".",0,24,== Career == | === 2009–2010: New label and Signed Sealed Delivered ===,636406,2009-09-18,2009-09-18,ML
2 October 2009,CD NNP CD,DIGIT_REGEX_1 MONTH_REGEX YEAR_REGEX_1,NUMERAL TIME TIME,time_point,"On 2 October 2009, David revealed to his fans via Twitter and his website that he had signed a new record deal with Universal Motown.",1,24,== Career == | === 2009–2010: New label and Signed Sealed Delivered ===,636406,2009-10-02,2009-10-02,ML
30 November 2009,CD NNP CD,DIGIT_REGEX_1 MONTH_REGEX YEAR_REGEX_1,NUMERAL TIME TIME,time_point,"The UK edition of Jay Sean's new album All or Nothing which was released on 30 November 2009, features David on a track entitled ""Stuck in the Middle"".",2,24,== Career == | === 2009–2010: New label and Signed Sealed Delivered ===,636406,2009-11-30,2009-11-30,ML
1967,CD,YEAR_REGEX_1,TIME,time_reference,"David performed a bold new cover of ""I Wan'na Be like You"" from Walt Disney's 1967 film The Jungle Book on the ITV programme Ultimate Movie Toons, broadcast 28 March 2010.",3,24,== Career == | === 2009–2010: New label and Signed Sealed Delivered ===,636406,1967-01-01,1967-12-31,ML
28 March 2010,CD NNP CD,DIGIT_REGEX_1 MONTH_REGEX YEAR_REGEX_1,NUMERAL TIME TIME,time_point,"David performed a bold new cover of ""I Wan'na Be like You"" from Walt Disney's 1967 film The Jungle Book on the ITV programme Ultimate Movie Toons, broadcast 28 March 2010.",3,24,== Career == | === 2009–2010: New label and Signed Sealed Delivered ===,636406,2010-03-28,2010-03-28,ML
22 March 2010,CD NNP CD,DIGIT_REGEX_1 MONTH_REGEX YEAR_REGEX_1,NUMERAL TIME TIME,time_point,"The first single from David's fifth studio album Signed Sealed Delivered was ""One More Lie (Standing in the Shadows)"" and it was released in the UK on 22 March 2010 where it made number 76 with the album following one week later on 29 March 2010, which entered the UK chart at number 13.",0,25,== Career == | === 2009–2010: New label and Signed Sealed Delivered ===,636406,2010-03-22,2010-03-22,ML
29 March 2010,CD NNP CD,DIGIT_REGEX_1 MONTH_REGEX YEAR_REGEX_1,NUMERAL TIME TIME,time_point,"The first single from David's fifth studio album Signed Sealed Delivered was ""One More Lie (Standing in the Shadows)"" and it was released in the UK on 22 March 2010 where it made number 76 with the album following one week later on 29 March 2010, which entered the UK chart at number 13.",0,25,== Career == | === 2009–2010: New label and Signed Sealed Delivered ===,636406,2010-03-29,2010-03-29,ML
17 March 2010,CD NNP CD,DIGIT_REGEX_1 MONTH_REGEX YEAR_REGEX_1,NUMERAL TIME TIME,time_point,"On 17 March 2010, David released a UK garage compilation album titled Rewind Old Skool Classics mixed with DJ Spoony featuring some of their favourite UK garage hits from the last ten years.",0,26,== Career == | === 2009–2010: New label and Signed Sealed Delivered ===,636406,2010-03-17,2010-03-17,ML
31 May 2010,CD NNP CD,DIGIT_REGEX_1 MONTH_REGEX YEAR_REGEX_1,NUMERAL TIME TIME,time_point,"Two weeks later on 31 May 2010, the second single to be taken from Signed Sealed Delivered, titled ""All Alone Tonight (Stop, Look, Listen)"" was released.",1,26,== Career == | === 2009–2010: New label and Signed Sealed Delivered ===,636406,2010-05-31,2010-05-31,ML
20 May 2010,CD NNP CD,DIGIT_REGEX_1 MONTH_REGEX YEAR_REGEX_1,NUMERAL TIME TIME,time_point,"On 20 May 2010, David appeared as a co-host on The Morning Show in Australia alongside Kylie Gillies, whilst regular male presenter Larry Emdur was on holiday.",4,26,== Career == | === 2009–2010: New label and Signed Sealed Delivered ===,636406,2010-05-20,2010-05-20,ML
27 August 2010,CD NNP CD,DIGIT_REGEX_1 MONTH_REGEX YEAR_REGEX_1,NUMERAL TIME TIME,time_point,"On 27 August 2010, Swiss DJ Remady released an album titled No Superstar on which David features on the track ""Do It on My Own"".",5,26,== Career == | === 2009–2010: New label and Signed Sealed Delivered ===,636406,2010-08-27,2010-08-27,ML
the 2010,DT CD,PREFIX_REGEX_1 YEAR_REGEX_1,MODIFIER TIME,time_reference,"David was nominated for 'Best Video' at the 2010 Urban Music Awards for the song ""One More Lie (Standing in the Shadows)"".",6,26,== Career == | === 2009–2010: New label and Signed Sealed Delivered ===,636406,2010-01-01,2010-12-31,ML
2011–2013,CD,YEAR_REGEX_1,TIME,time_reference,"2011–2013: Collaborations, new material and TS5 launch ===",1,27,"== Career == | === 2011–2013: Collaborations, new material and TS5 launch ===",636406,2011-01-01,2013-12-31,ML
February 2011,NNP CD,MONTH_REGEX YEAR_REGEX_1,TIME TIME,time_reference,"In February 2011, David agreed to do a desert trek for Comic Relief as part of Red Nose Day 2011.",3,28,"== Career == | === 2011–2013: Collaborations, new material and TS5 launch ===",636406,2011-02-01,2011-02-28,ML
May 2011,NNP CD,MONTH_REGEX YEAR_REGEX_1,TIME TIME,time_reference,"In May 2011, David made a guest appearance on NRJ12's French reality TV show Les Anges 2 where he offered advice to contestants trying to make a life in Miami.",5,28,"== Career == | === 2011–2013: Collaborations, new material and TS5 launch ===",636406,2011-05-01,2011-05-31,ML
1 August 2011,CD NNP CD,DIGIT_REGEX_1 MONTH_REGEX YEAR_REGEX_1,NUMERAL TIME TIME,time_point,"Released on 1 August 2011, David features on Erick Morillo's new mix CD Subliminal Invasion on a track titled ""Fly Away"".",6,28,"== Career == | === 2011–2013: Collaborations, new material and TS5 launch ===",636406,2011-08-01,2011-08-01,ML
8 October 2011,CD NNP CD,DIGIT_REGEX_1 MONTH_REGEX YEAR_REGEX_1,NUMERAL TIME TIME,time_point,"David performed at the Michael Jackson tribute concert, held in Cardiff at the Millennium Stadium on 8 October 2011.",7,28,"== Career == | === 2011–2013: Collaborations, new material and TS5 launch ===",636406,2011-10-08,2011-10-08,ML
2012,CD,YEAR_REGEX_1,TIME,time_reference,"In December, he featured on the Blackout Mode dance track ""Freak on the Dancefloor"" that appeared on the compilation album R&B Collection 2012.",10,28,"== Career == | === 2011–2013: Collaborations, new material and TS5 launch ===",636406,2012-01-01,2012-12-31,ML
2012,CD,YEAR_REGEX_1,TIME,time_reference,"In 2012, David featured on a number of tracks whilst recording his own album, including releases with Stereo Palma titled ""Our Love"" and a collaboration with Mohombi and DJ Asaad titled ""Addicted"".",0,29,"== Career == | === 2011–2013: Collaborations, new material and TS5 launch ===",636406,2012-01-01,2012-12-31,ML
July 2012,NNP CD,MONTH_REGEX YEAR_REGEX_1,TIME TIME,time_reference,"In July 2012, it was revealed David was writing with Backstreet Boys on their 20th-anniversary album, the follow-up to their 2009 album ""This Is Us"" and the first they released since the return of Kevin Richardson who departed from the band in 2005.",0,30,"== Career == | === 2011–2013: Collaborations, new material and TS5 launch ===",636406,2012-07-01,2012-07-31,ML
2005,CD,YEAR_REGEX_1,TIME,time_reference,"In July 2012, it was revealed David was writing with Backstreet Boys on their 20th-anniversary album, the follow-up to their 2009 album ""This Is Us"" and the first they released since the return of Kevin Richardson who departed from the band in 2005.",0,30,"== Career == | === 2011–2013: Collaborations, new material and TS5 launch ===",636406,2005-01-01,2005-12-31,ML
January 2013,NNP CD,MONTH_REGEX YEAR_REGEX_1,TIME TIME,time_reference,"In January 2013, David announced on Twitter that he had signed a publishing deal with Universal Music Publishing Group (UMPG).",0,31,"== Career == | === 2011–2013: Collaborations, new material and TS5 launch ===",636406,2013-01-01,2013-01-31,ML
March 2013,NNP CD,MONTH_REGEX YEAR_REGEX_1,TIME TIME,time_reference,"Starting in March 2013, David embarked on a world tour starting with three shows across Australia, followed by four in Europe (France, Belgium, Germany and The Netherlands) and finally finishing in May with four shows in England (Birmingham, Manchester, Southampton and London).",0,32,"== Career == | === 2011–2013: Collaborations, new material and TS5 launch ===",636406,2013-03-01,2013-03-31,ML
September 2013,NNP CD,MONTH_REGEX YEAR_REGEX_1,TIME TIME,time_reference,"In September 2013, Capital FM announced that David's DJ show 'TS5' would move",1,32,"== Career == | === 2011–2013: Collaborations, new material and TS5 launch ===",636406,2013-09-01,2013-09-30,ML
2014–2016,CD,YEAR_REGEX_1,TIME,time_reference,2014–2016:,1,34,== Career == | === 2014–2016: Following My Intuition and return to fame ===,636406,2014-01-01,2016-12-31,ML
2 July 2014,CD NNP CD,DIGIT_REGEX_1 MONTH_REGEX YEAR_REGEX_1,NUMERAL TIME TIME,time_point,"On 2 July 2014, David previewed a teaser track titled ""Cold"" on his official SoundCloud page.",0,35,== Career == | === 2014–2016: Following My Intuition and return to fame ===,636406,2014-07-02,2014-07-02,ML
September 2014,NNP CD,MONTH_REGEX YEAR_REGEX_1,TIME TIME,time_reference,"A further teaser track titled ""Seduction"" was uploaded to the same SoundCloud page in September 2014.",2,35,== Career == | === 2014–2016: Following My Intuition and return to fame ===,636406,2014-09-01,2014-09-30,ML
5 September 2015,CD NNP CD,DIGIT_REGEX_1 MONTH_REGEX YEAR_REGEX_1,NUMERAL TIME TIME,time_point,"On 5 September 2015, David featured on BBC Radio 1's Live Lounge with Sigala where they covered Wiz Khalifa and Charlie Puth's ""See You Again"" mixed with the Little Mix track ""Black Magic"".",0,36,== Career == | === 2014–2016: Following My Intuition and return to fame ===,636406,2015-09-05,2015-09-05,ML
10 September 2015,CD NNP CD,DIGIT_REGEX_1 MONTH_REGEX YEAR_REGEX_1,NUMERAL TIME TIME,time_point,"The following week, on 10 September 2015, David appeared on Kurupt FM's 'Sixty Minute Takeover' on BBC Radio 1Xtra with MistaJam.",1,36,== Career == | === 2014–2016: Following My Intuition and return to fame ===,636406,2015-09-10,2015-09-10,ML
7 November 2015,CD NNP CD,DIGIT_REGEX_1 MONTH_REGEX YEAR_REGEX_1,NUMERAL TIME TIME,time_point,"It was later revealed that the Radio 1Xtra appearance led to a collaboration between David and Big Narstie who also featured on the show and the track they recorded titled ""When the Bassline Drops"" was played on MistaJam's BBC Radio 1 and BBC Radio 1Xtra show on 7 November 2015, it was later revealed the track is to be released under SpeakerBox/JEM on 27 November 2015.",0,37,== Career == | === 2014–2016: Following My Intuition and return to fame ===,636406,2015-11-07,2015-11-07,ML
27 November 2015,CD NNP CD,DIGIT_REGEX_1 MONTH_REGEX YEAR_REGEX_1,NUMERAL TIME TIME,time_point,"It was later revealed that the Radio 1Xtra appearance led to a collaboration between David and Big Narstie who also featured on the show and the track they recorded titled ""When the Bassline Drops"" was played on MistaJam's BBC Radio 1 and BBC Radio 1Xtra show on 7 November 2015, it was later revealed the track is to be released under SpeakerBox/JEM on 27 November 2015.",0,37,== Career == | === 2014–2016: Following My Intuition and return to fame ===,636406,2015-11-27,2015-11-27,ML
13 December 2015,CD NNP CD,DIGIT_REGEX_1 MONTH_REGEX YEAR_REGEX_1,NUMERAL TIME TIME,time_point,"David made a surprise appearance on The X Factor on 13 December 2015, where he performed his breakthrough single ""Re-Rewind"" during a medley with Reggie 'n' Bollie and Fuse ODG.",1,37,== Career == | === 2014–2016: Following My Intuition and return to fame ===,636406,2015-12-13,2015-12-13,ML
5 February 2016,CD NNP CD,DIGIT_REGEX_1 MONTH_REGEX YEAR_REGEX_1,NUMERAL TIME TIME,time_point,"""When the Bassline Drops"" debuted at number 50 in the UK and peaked at number 10 on 5 February 2016, becoming David's highest-charting single since 2007.",2,37,== Career == | === 2014–2016: Following My Intuition and return to fame ===,636406,2016-02-05,2016-02-05,ML
2007,CD,YEAR_REGEX_1,TIME,time_reference,"""When the Bassline Drops"" debuted at number 50 in the UK and peaked at number 10 on 5 February 2016, becoming David's highest-charting single since 2007.",2,37,== Career == | === 2014–2016: Following My Intuition and return to fame ===,636406,2007-01-01,2007-12-31,ML
25 January 2016,CD NNP CD,DIGIT_REGEX_1 MONTH_REGEX YEAR_REGEX_1,NUMERAL TIME TIME,time_point,"On 25 January 2016, it was announced that Craig David had signed a recording contract with Insanity Records (a joint venture between Sony Music UK and Insanity Management) and independent company Speakerbox Media.",0,38,== Career == | === 2014–2016: Following My Intuition and return to fame ===,636406,2016-01-25,2016-01-25,ML
19 March 2016,CD NNP CD,DIGIT_REGEX_1 MONTH_REGEX YEAR_REGEX_1,NUMERAL TIME TIME,time_point,"On 19 March 2016, at the second day of the Ultra Music Festival 2016, during the set of the Dutch DJ and record producer Hardwell, he appeared to present their new track ""No Holding Back"", which was released on 19 August 2016.",1,38,== Career == | === 2014–2016: Following My Intuition and return to fame ===,636406,2016-03-19,2016-03-19,ML
2016,CD,YEAR_REGEX_1,TIME,time_reference,"On 19 March 2016, at the second day of the Ultra Music Festival 2016, during the set of the Dutch DJ and record producer Hardwell, he appeared to present their new track ""No Holding Back"", which was released on 19 August 2016.",1,38,== Career == | === 2014–2016: Following My Intuition and return to fame ===,636406,2016-01-01,2016-12-31,ML
19 August 2016,CD NNP CD,DIGIT_REGEX_1 MONTH_REGEX YEAR_REGEX_1,NUMERAL TIME TIME,time_point,"On 19 March 2016, at the second day of the Ultra Music Festival 2016, during the set of the Dutch DJ and record producer Hardwell, he appeared to present their new track ""No Holding Back"", which was released on 19 August 2016.",1,38,== Career == | === 2014–2016: Following My Intuition and return to fame ===,636406,2016-08-19,2016-08-19,ML
2016,CD,YEAR_REGEX_1,TIME,time_reference,"In 2016, David appeared on Kaytranada's album 99.9%, on the track ""Got It Good"", which he also co-wrote.",0,39,== Career == | === 2014–2016: Following My Intuition and return to fame ===,636406,2016-01-01,2016-12-31,ML
19 August 2016,CD NNP CD,DIGIT_REGEX_1 MONTH_REGEX YEAR_REGEX_1,NUMERAL TIME TIME,time_point,"On 19 August 2016, Craig announced on social networks that his sixth studio album, Following My Intuition, would finally be released on 30 September 2016.",2,39,== Career == | === 2014–2016: Following My Intuition and return to fame ===,636406,2016-08-19,2016-08-19,ML
30 September 2016,CD NNP CD,DIGIT_REGEX_1 MONTH_REGEX YEAR_REGEX_1,NUMERAL TIME TIME,time_point,"On 19 August 2016, Craig announced on social networks that his sixth studio album, Following My Intuition, would finally be released on 30 September 2016.",2,39,== Career == | === 2014–2016: Following My Intuition and return to fame ===,636406,2016-09-30,2016-09-30,ML
2000,CD,YEAR_REGEX_1,TIME,time_reference,"It debuted at number one on the UK Albums Chart, giving David his first number-one album since his debut, Born to Do It, reached the top spot in 2000.",3,39,== Career == | === 2014–2016: Following My Intuition and return to fame ===,636406,2000-01-01,2000-12-31,ML
2017–2020,CD,YEAR_REGEX_1,TIME,time_reference,=== 2017–2020: The Time Is Now =,0,40,== Career == | === 2017–2020: The Time Is Now ===,636406,2017-01-01,2020-12-31,ML
15 September 2017,CD NNP CD,DIGIT_REGEX_1 MONTH_REGEX YEAR_REGEX_1,NUMERAL TIME TIME,time_point,"On 15 September 2017, David announced the release of the seventh studio album, The Time Is Now, which was released in January 2018, along with the single ""Heartline"".",0,41,== Career == | === 2017–2020: The Time Is Now ===,636406,2017-09-15,2017-09-15,ML
January 2018,NNP CD,MONTH_REGEX YEAR_REGEX_1,TIME TIME,time_reference,"On 15 September 2017, David announced the release of the seventh studio album, The Time Is Now, which was released in January 2018, along with the single ""Heartline"".",0,41,== Career == | === 2017–2020: The Time Is Now ===,636406,2018-01-01,2018-01-31,ML
2018,CD,YEAR_REGEX_1,TIME,time_reference,"The single peaked at number 5 in 2018, making it David's highest charting single since ""Don't Love You No More",3,41,== Career == | === 2017–2020: The Time Is Now ===,636406,2018-01-01,2018-12-31,ML
