,Sentence,Business meeting,Coincidence,Education,Music making,Personal life,Public celebration
146,"Magnet featured the Bee Gees song ""Wish You Were Here"" (from the 1989 album One) in a new acoustic version.",2.2665085e-10,6.8808777e-07,6.7448134e-08,0.9999912,8.090582e-06,9.005477e-11
147,"The lead single, ""Please"", had coincidental lyrics about 'loss'.",1.5334127e-06,0.038592465,0.96140546,1.9960506e-08,5.3327017e-07,1.1606365e-08
148,"In recent years, Gibb sang the vocals to the opening titles to the British ITV show The Dame Edna Treatment.",0.9979261,5.14275e-07,2.4102997e-06,0.002044536,3.247189e-06,2.3339595e-05
149,"In August 2003, Gibb announced the release of a new single of ""My Lover's Prayer"", a song first recorded by the Bee Gees in 1997 on the album Still Waters, with lead vocals by Gibb and singers Wanya Morris and Lance Bass.",0.6632451,0.004086025,4.3807265e-07,0.332663,2.1216533e-06,3.2951125e-06
150,That version was played on the radio but was never actually released.,8.5257597e-07,5.4235965e-08,1.2199572e-08,0.99994445,3.664354e-08,5.463933e-05
151,"In October 2003, Gibb recorded a second version of the song with Alistair Griffin, a-runner up in the UK television program Fame Academy on which Gibb appeared as a judge.",0.0005283378,0.0043519298,0.99410206,8.987367e-06,3.2052408e-10,0.0010085544
152,"In January 2004, the new version of that song was released in the UK as a double A side CD single.",0.005373961,9.446034e-05,0.9870024,0.0034373824,1.8842657e-05,0.004072932
153,It eventually reached number 5 in the UK music charts.,0.042258512,0.0021840706,1.315203e-07,0.0017376773,0.9522386,0.0015810999
154,"In late 2004, Gibb embarked a solo tour of Germany, Russia and Asia with singer Alistair Griffin as the opening act.",0.9997991,8.602825e-05,3.672009e-07,0.00011357483,6.021901e-09,9.888739e-07
155,"On his return to the UK, Gibb released a CD and DVD of live recordings from the German leg of the tour, backed by the Frankfurt Neue Philharmonic Orchestra of Frankfurt, Germany.",0.06548657,0.000111233356,0.6373114,0.2970816,9.811541e-08,9.082461e-06
156,"In 2005, Gibb made a solo tour of Latin America.",0.90366787,0.028799595,0.0021241389,0.06537958,5.2768564e-07,2.8382472e-05
157,"In January 2005, Gibb joined his brother Barry and several other artists under the name One World Project to record a charity single in aid of Asian tsunami relief, titled ""Grief Never Grows Old"".",0.00037569363,0.07604525,0.35916442,0.14068235,0.3001724,0.12355989
158,"Other artists who performed on the single included Boy George, Steve Winwood, Jon Anderson, Rick Wakeman, Sir Cliff Richard, Bill Wyman, America, Kenney Jones, Chicago, Brian Wilson of The Beach Boys, Russell Watson and Davy Spillane.",0.009384115,0.025238618,0.0005137142,0.9648447,1.3489245e-05,5.4011725e-06
159,"In June 2005, Gibb joined The X Factor runner up band G4 at a sell-out concert at the Royal Albert Hall in London, singing the Bee Gees song ""First of May"".",0.999894,6.4819296e-06,4.5417502e-07,9.388611e-05,6.722746e-09,5.1568563e-06
160,"In December 2005, a recordings of this performance was released as part of double A side single, credited as ""G4 feat Robin Gibb"" together with G4's cover version of the Johnny Mathis song ""When a Child is Born"".",0.00012076876,0.00011509327,1.1586974e-05,0.9827256,0.016798574,0.00022837723
161,"""First of May"" also appeared on the platinum selling album G4 & Friends, which reached number 6 in the UK album charts.",0.99991655,6.019643e-10,6.8155597e-09,2.1516596e-06,2.3293316e-08,8.1246675e-05
162,"In the same year, Gibb presented master classes at Paul McCartney's Liverpool Institute for Performing Arts and oversaw the selection for release of thesis works by music graduates for the next two terms.",5.4522566e-08,2.6238308e-07,0.9997789,2.0680723e-06,3.829896e-09,0.00021868436
163,"On 20 February 2006, Gibb and Barry performed at a concert for Diabetes Research Institute of the University of Miami in Hollywood, Florida.",0.002514703,0.0019641118,1.4814881e-06,0.98600733,3.6784044e-05,0.009475636
164,This was their first joint performance since Maurice's death.,2.2264912e-06,5.524238e-09,7.335704e-08,0.99999774,5.9320713e-09,3.454116e-11
165,"In March 2006, Gibb announced plans for more solo concerts in Shanghai, China and Portugal.",0.7501331,3.6023075e-06,0.0002902073,0.24957243,4.509143e-07,2.6219055e-07
166,"In May 2006, Gibb took part in the Prince's Trust 30th birthday Concert at the Tower of London along with Barry.",0.8569621,0.00048673447,0.0026796514,0.05347214,2.3715241e-08,0.08639929
167,"They sang three songs: ""Jive Talkin'"", ""To Love Somebody"" and ""You Should Be Dancing"".",0.00029110562,0.5293254,0.004345811,0.4000559,4.2703596e-09,0.065981805
168,"In September 2006, Gibb performs at the Miss World 2006 contest finals in Warsaw, Poland.",0.0041349824,0.021044293,1.1445231e-08,0.10597829,6.173071e-06,0.8688363
169,"In November 2006, Gibb released his sixth album My Favourite Christmas Carols the last album released in his lifetime, backed by The Serlo Concert, a London choir.",0.115255035,8.237097e-07,3.6327244e-06,0.5941334,0.00021188302,0.29039526
170,"This album featured a new song by Gibb called ""Mother of Love"", which was released in Europe as a download single.",0.21752226,0.045776658,0.6569641,0.07473802,0.0038382043,0.0011607324
171,The song was inspired by Maurice and was Gibb's first new composition since Maurice died.,0.9968777,2.1710885e-05,0.0014119017,0.0016886339,3.91096e-09,8.304682e-09
172,"Gibb donated all royalties from ""Mother of Love"" to the Janki Foundation for Global Healthcare, and dedicated the song to Dadi Janki, the organisation's spiritual leader.",1.0438474e-06,1.5762857e-06,0.00043983886,0.98592466,0.010322828,0.0033099947
173,"Gibb dedicated the album to his mother, Barbara.",0.98646694,0.00032218717,9.104921e-08,0.012437074,1.1449688e-06,0.0007725066
174,My Favourite Christmas Carols has a bonus DVD disc titled A Personal Christmas Moment with Robin Gibb.,4.180223e-05,5.504909e-06,0.018830672,0.79664445,0.16469508,0.019782495
175,"Also in November 2006, Gibb performed a solo concert, entitled 'Bee Gees – Greatest Hits' at the Araneta Coliseum (now Smart Araneta Coliseum) in Manila, Philippines.",0.0060606934,0.012032138,1.8501385e-09,0.9819031,8.143117e-09,4.050672e-06
176,Gibb marked his return to his birthplace by playing a concert at the Isle of Man TT festival in 2007.,0.74282646,0.0020483872,0.22803764,0.025695803,0.0007185257,0.00067317154
177,"Gibb donated all of his share of the money from this concert to the children's ward at Noble's Hospital, Isle of Man, and invited all emergency service staff and marshals for the TT to attend for free.",0.03273912,6.0885407e-07,2.2922583e-08,0.96646166,0.0007975868,9.635772e-07
178,"On 18 May 2008, Gibb released the song ""Alan Freeman Days"" in tribute to the Australian DJ Alan Freeman.",0.084394015,1.9262905e-05,0.0064256587,1.6348136e-05,2.5127782e-05,0.90911955
179,"The song was issued as a download only track, although a promotional CD was issued by Academy Recordings.",6.451833e-05,2.5692101e-05,0.978509,0.009382642,5.1347654e-10,0.012018163
180,"In December 2008, ""Alan Freeman Days"" was followed by another downloadable song titled ""Wing and a Prayer"", which shared the same name as a song from the 1989 One album.",4.0685194e-05,0.01910773,0.02210036,0.0014518781,0.06726362,0.8900357
181,"However, the new song was actually a reworking of the song, ""Sing Slowly Sisters"", that had remained unreleased since 1970.",0.006695153,5.7321613e-06,0.99309844,0.0001970395,3.6441081e-06,2.8908868e-08
182,"Later in December, Gibb issued another song, ""Ellan Vannin (Home Coming Mix)"", featuring the King William's College Choir from the Isle of Man.",6.572713e-06,0.0026604326,0.6436965,0.3536342,1.8002261e-06,6.253908e-07
183,"(""Ellan Vannin"" is the Manx name for the Isle of Man.)",0.00012630029,0.03547,0.013111804,0.0012513105,0.9463363,0.0037043125
184,"On 8 September 2007, Gibb performed at a concert in Salt Lake City, Utah at EnergySolutions Arena for the Nu Skin Enterprises Convention, singing a set of Bee Gees hits.",0.00201756,0.56638724,3.26639e-08,0.43117818,7.9007077e-07,0.00041615366
185,"On 25 October 2007, Gibb performed at the National Palace of Culture in Sofia, Bulgaria and sang the Bee Gees' most famous songs.",0.10323616,0.85715383,4.1575296e-07,0.039608218,4.243898e-09,1.3911676e-06
186,"In 2008, Gibb completed a new solo album entitled 50 St. Catherine's Drive, but it was never released until 2014.",0.9999182,7.799261e-09,1.2765593e-06,8.036921e-05,8.962391e-08,1.3452493e-08
187,"The song ""Instant Love"" was a collaboration with Gibb's son, Robin-John both having written the music and vocals.",0.37911788,0.32224518,0.029674476,0.26886666,9.4751405e-05,1.1088891e-06
188,"""Instant Love"" featuring Robin-John on lead vocals appeared in a short film called Bloodtype: The Search in which Robin-John appeared.",7.6024793e-07,0.99119776,3.0408892e-05,0.008752229,1.8738287e-05,6.051899e-08
189,"On 25 October 2008, to mark the 30th anniversary of the song ""Saturday Night Fever"" topping the UK charts, Gibb performed with special guests including Ronan Keating, Stephen Gateley, Sam Sparro, Sharleen Spiteri, Gabriella Climi and Bryn Christopher at the London music festival BBC Electric Proms.",1.3035002e-05,7.127632e-07,3.3826777e-10,5.4619335e-07,1.653588e-12,0.9999857
190,"Gibb went back to the top of the UK charts in 2009 when he collaborated with singers Ruth Jones, Rob Brydon and Tom Jones on a new version of ""Islands in the Stream"", written by Gibb and his brothers Barry and Maurice.",0.8551619,8.5325755e-06,0.13616857,0.007553084,0.0011075016,3.5948125e-07
191,"The new version, inspired by the BBC comedy TV show Gavin & Stacey, was created to benefit the charity Comic Relief.",0.961529,0.037086315,0.00011480261,0.00024814208,0.0006369082,0.00038472752
192,===,0.0018068925,2.1080356e-05,2.7498634e-05,0.00044118572,0.9977034,1.2509472e-11
193,2010–2012:,0.99995637,1.1776466e-06,2.088435e-06,3.6882848e-06,4.165497e-09,3.6541856e-05
194,Final years =,0.029330071,0.0006840621,2.6595205e-06,0.96988183,8.874442e-06,9.246172e-05
195,==,0.124878764,0.21344112,0.0013716007,0.0017026727,0.65860575,7.902396e-08
196,"In 2010, Gibb was also a guest mentor on the Australian version of The X Factor, alongside TV host Kyle Sandilands, actress/singer Natalie Imbruglia, and singers Ronan Keating and Guy Sebastian.",0.00065220945,4.337996e-06,0.99934,3.2506855e-06,3.1475697e-08,2.4862655e-07
197,"Also in 2010, Gibb toured in Australia with Bonnie Tyler as his supporting guest.",0.9723617,0.00079186365,0.023069752,0.0037762665,5.3504723e-10,4.7435012e-07
198,"Together they performed at Melbourne, Sydney, Brisbane and Perth.",4.1041397e-09,1.1464083e-06,4.403724e-06,0.9999944,1.6217078e-09,5.496407e-10
199,"In September 2011, Gibb recorded the Bee Gees classic ""I've Gotta Get a Message to You"" with British Army men The Soldiers for a charity single in the UK, it was produced with his son Robin John Gibb and the video for which was produced by Vintage TV.",1.9736195e-05,0.9972945,3.1370608e-05,0.00015561013,4.765567e-06,0.0024940139
200,Gibb was the subject of an edition of the BBC genealogy documentary series Who Do You Think You Are?,0.00087831833,0.9276029,1.3435329e-07,4.0293385e-06,0.054570965,0.016943622
201,first broadcast on 21 September 2011.,0.77635247,1.2412531e-05,9.393465e-06,0.000917977,0.019762414,0.2029454
202,"On 30 January 2012, Gibb announced his intention to appear onstage at the Coming Home Concert at the London Palladium in February to benefit British soldiers returning home from Afghanistan.",0.9999981,2.5619212e-08,1.5255579e-10,1.5049087e-06,6.002839e-11,3.9812082e-07
203,It would be his last performance onstage.,0.99874026,4.1000653e-12,1.1418371e-09,0.001259672,6.323221e-08,1.4310574e-08
204,"Over a period of two years, Gibb and Robin-John wrote the score for The Titanic Requiem, recorded by Royal Philharmonic Orchestra to commemorate the 100th anniversary of the sinking of the Titanic.",2.5860774e-07,2.4926067e-08,3.1956783e-06,0.9999534,5.040674e-07,4.2636035e-05
205,"Gibb was due to attend the piece's première on 10 April 2012 at the Central Hall, Westminster, London, but his failing health kept him away.",0.9995142,9.827505e-08,9.593765e-06,5.65067e-07,1.54558e-10,0.00047536902
206,He died the next month.,2.866187e-14,6.387149e-11,2.2320008e-07,4.0901674e-12,0.99999976,1.2373318e-11
207,==,0.124878764,0.21344112,0.0013716007,0.0017026727,0.65860575,7.902396e-08
208,Personal life ==,0.002554406,0.00046550567,4.8373266e-07,1.0761044e-09,8.063284e-05,0.996899
209,"In 1968, Gibb married Molly Hullis, a secretary in Robert Stigwood's organisation.",1.833654e-05,0.30604485,4.1340553e-09,1.199946e-07,7.384195e-05,0.69386286
210,Not long before they were married they survived the Hither Green rail crash together.,8.483734e-10,0.16615109,2.5447298e-06,1.1020309e-05,0.83382845,6.815625e-06
211,"They had two children together, Spencer (b. 1972) and Melissa (b. 1974).",1.8516474e-08,2.507782e-06,9.694122e-10,7.916929e-06,0.99956375,0.00042576788
212,"The couple divorced in 1980 after years of living separate lives, with Gibb almost permanently in the US and Hullis remaining in the UK; she filed for divorce on 22 May 1980.",0.00017609174,0.00039486654,5.742998e-07,3.1907205e-06,0.48419687,0.5152284
213,"On 9 September 1983, Gibb was arrested and sentenced to 14 days in jail for speaking to the press about his previous marriage in breach of a court order.",0.00040264046,5.4691263e-08,9.2069924e-10,6.260313e-11,4.535977e-08,0.99959725
214,"Gibb's second marriage, from 1985 until his death, was to Dwina Murphy, an author and artist.",0.66572124,0.021287352,0.00019921197,3.7122572e-05,0.017734962,0.2950202
215,She is interested in the Druidry religion and is a follower of the neo-Hindu Brahma Kumaris movement.,6.664527e-10,0.0011200374,0.00020348647,2.787706e-06,0.07542588,0.9232479
216,"The couple had a son, Robin-John (known as RJ, b. 1983).",3.781743e-15,2.5392137e-07,2.5965056e-11,1.2130824e-06,0.9999733,2.5281688e-05
217,"Robin-John's first major musical project was the Titanic Requiem (2012), written with Gibb and first performed at the Central Hall, Westminster, London, on 10 April 2012, by the Royal Philharmonic Orchestra and RSVP Voices.",2.1551955e-06,1.606595e-05,9.031079e-07,0.9999536,5.3333893e-09,2.7285168e-05
218,"At 50 years of age, Gibb began an affair with his 25-year-old housekeeper, Claire Yang, that eight years later produced his fourth child, Snow Evelyn Robin Juliet Gibb, born 4 November 2008.",0.014676834,4.2898986e-07,2.190458e-05,7.960157e-06,0.9698585,0.015434302
219,"Gibb and his wife divided their time between their homes in Peel, Isle of Man, their mansion in Miami, Florida and their main residence in Thame, Oxfordshire.",0.82889277,0.00275133,0.0006164171,1.4663134e-05,0.16669294,0.0010319599
220,"On 10 March 1988, younger brother Andy died in Oxford, of myocarditis.",3.0062767e-12,1.7745514e-08,1.0376133e-07,1.5056893e-11,0.99999666,3.168664e-06
221,"On 12 January 2003, twin brother Maurice died in Miami Beach, Florida, of complications from a twisted intestine.",2.448106e-09,0.010424793,0.029646648,0.00031005294,0.9596185,3.3496143e-08
222,"Politically, Gibb was a supporter of New Labour, the British Labour Party when Tony Blair was Prime Minister.",0.9999695,1.86803e-06,1.7753462e-06,9.63582e-08,2.0938937e-07,2.6423926e-05
223,"He launched a rally in Huddersfield, West Yorkshire, ahead of the 2005 General Election.",0.00017780282,1.0296824e-07,5.270539e-07,1.4051524e-08,0.001962145,0.9978594
224,"He was a close friend of Blair, who was criticised for staying at Gibb's Miami mansion during Christmas 2006.",0.0952493,0.090214565,3.957545e-07,5.6980307e-06,1.5456309e-06,0.81452847
225,"In 2008, Gibb publicly stated that he continued to get on ""like a house on fire"" with Blair and said that the then Labour prime minister, Gordon Brown, regularly listened to the Bee Gees.",0.0017805158,0.99621296,1.6872099e-06,0.0009534688,9.109501e-05,0.00096028735
226,"""He listens to our music every day.",0.033884127,0.010738211,0.00042918956,0.028790103,0.92615837,1.6907281e-08
227,"Gordon likes our music and I like Gordon"", he told The Times.",9.736602e-08,0.9855055,9.412586e-05,0.01437945,2.0831327e-05,3.4508945e-09
228,"In a tribute upon his death, longtime friend Tony Blair said: ""Robin was not only an exceptional and extraordinary musician and songwriter, he was a highly intelligent, interesting and committed human being.",0.37147322,0.26476124,0.049475905,0.21748921,0.09676898,3.1399744e-05
229,He was a great friend with a wonderful open and fertile mind and a student of history and politics.,9.85144e-12,3.2155944e-07,0.9999993,1.261448e-09,3.1252864e-07,4.940038e-08
230,"""Gibb worked on behalf of several charities.",0.5616052,5.596616e-05,0.025544357,0.25840995,0.049759727,0.104624815
231,He was the organiser of the Sunseeker Ball in aid of the Outward Bound Trust.,1.9714795e-08,8.9536e-08,3.0350853e-07,4.8347062e-11,4.4222943e-05,0.9999554
232,"For the International Confederation of Societies of Authors and Composers (CISAC), Gibb served as president from 2007 to 2012.",0.95204884,6.864995e-06,0.00059851125,0.047345687,3.537431e-12,1.1399513e-07
233,"He was also the longest serving president (2008–2011) of the Heritage Foundation, which honours figures of British culture and facilitated his campaign on behalf of the Bomber Command Memorial Appeal.",0.20816682,1.2389494e-08,5.6306058e-06,0.002115773,5.310346e-05,0.78965867
234,==,0.124878764,0.21344112,0.0013716007,0.0017026727,0.65860575,7.902396e-08
235,Health issues and death ==,0.9996257,0.00020105559,1.3062428e-06,4.0977199e-07,1.781365e-05,0.00015384567
236,"On 14 August 2010, while performing in Belgium, Gibb began to feel abdominal pains.",9.334872e-06,0.993324,1.3590015e-06,0.0066653956,1.8541083e-10,3.9619433e-10
237,"On 18 August 2010 at an Oxford hospital, he underwent emergency surgery.",0.04538379,0.94885665,7.236747e-08,3.071255e-05,0.005717589,1.108938e-05
238,Gibb recovered and returned to perform concerts in New Zealand and Australia.,0.55877244,0.000692947,0.1640847,0.27644902,2.4722516e-08,8.47407e-07
239,"During this time, Gibb was also involved in promoting fund-raising for the memorial dedicated to RAF Bomber Command in Green Park, London.",0.10099522,1.4832318e-05,0.031076977,0.59118325,0.008472743,0.268257
240,"Gibb also wrote The Titanic Requiem with his son Robin-John, which was recorded by the Royal Philharmonic Orchestra to commemorate the 100th anniversary of the sinking of the Titanic in 2012.",1.6237602e-05,1.12108005e-07,1.4415108e-05,0.99814224,0.0016438896,0.00018297606
241,"Gibb continued to make television appearances and other events following his surgery, but in April 2011 he was forced by health problems to cancel his tour of Brazil.",0.99991894,8.0545826e-05,1.834984e-11,4.4851663e-07,1.0790756e-10,3.0113434e-10
242,Another concert in Paris was cancelled in October 2011.,0.10270897,0.00046617838,0.7293436,0.13413279,0.033224482,0.00012400767
243,"On 14 October, Gibb was due to perform the charity single with the Soldiers, but was again rushed to hospital with severe abdominal pains.",5.1837233e-06,0.00073715765,2.9427815e-07,0.9992562,5.53495e-07,5.676186e-07
244,"On 18 October, following his release from the hospital, Gibb appeared on ITV's The Alan Titchmarsh Show  looking gaunt and frail.",0.18574154,0.75946456,0.0026804667,0.00023685319,0.051873975,2.586481e-06
245,"On 27 October 2011, Gibb cancelled an appearance only minutes before he was due to perform at the Poppy Appeal Concert in London.",0.9995547,9.819322e-08,1.08870275e-07,5.544865e-08,7.801489e-11,0.0004450838
246,"In November 2011, he was diagnosed with colorectal cancer, which had metastasised to his liver several months earlier.",0.95056015,0.048789136,9.462962e-05,0.00016960489,0.00038574898,6.8979045e-07
247,"In March 2012, Gibb was hospitalised for intestinal surgery and cancelled scheduled appearances while recovering.",0.9997143,0.00028569982,1.0299891e-09,1.8489827e-08,3.2606213e-11,9.784444e-09
248,"In April, however, he contracted pneumonia and fell into a coma, which he came out of later in April.",0.8996896,0.00026744287,4.3693976e-06,0.0006655202,0.09936721,5.8157802e-06
249,"He died in London on 20 May 2012, at the age of 62.",0.096322924,0.00012865975,0.26058736,7.497757e-08,0.64296,8.892729e-07
250,"While it was initially reported that he died from cancer, Robin-John Gibb said that his father's cancer had gone into remission by the time of his death, and the cause was kidney failure.",0.009530932,0.009692482,0.0016691651,0.018785693,0.9603216,6.294366e-08
251,"His funeral was held on 8 June 2012 and he was buried at the Church of St. Mary the Virgin, near his home in Thame, Oxfordshire.",2.7085385e-05,0.0002663109,5.9126783e-06,6.113584e-05,0.0130194165,0.98662007
252,"In September of the same year, a blue plaque was placed on the house.",0.00011908085,5.451858e-06,1.1356507e-05,4.9939572e-05,0.017906072,0.98190814
253,===,0.0018068925,2.1080356e-05,2.7498634e-05,0.00044118572,0.9977034,1.2509472e-11
254,Reactions ===,2.066209e-06,0.9889126,5.500582e-06,0.011060565,1.8928953e-05,1.8583044e-07
255,"Robin and his brother Barry had famously clashed personally and professionally for decades before his death, and that conflict lasted to the end.",0.4389787,0.5205499,0.00020409087,0.00018055852,0.00017256361,0.03991419
256,"Nonetheless, Barry delivered a eulogy at his brother's funeral saying: ""Even right up to the end we found conflict with each other, which now means nothing.",1.0423717e-08,0.067304574,6.442022e-09,4.4113587e-08,3.2182356e-08,0.9326954
257,It just means nothing.,2.5323461e-06,0.00013957644,0.26113307,0.7387246,1.719172e-08,1.4385078e-07
258,If there's conflict in your lives – get rid of it.,1.3289973e-08,0.49694556,9.180105e-05,3.5167806e-05,0.13409589,0.36883152
259,"""At",0.0007066047,0.36135596,4.081529e-05,0.6240004,0.01388385,1.2506145e-05
260,"Gibb's funeral, Barry talked about the connection between Robin and his twin brother Maurice, saying, ""they were both beautiful and now they're together"".",1.565501e-07,0.99798656,2.0884409e-05,6.366892e-07,0.0018798765,0.00011191115
261,Barry added details about Robin's struggle losing his brother Maurice a decade earlier.,0.007140344,0.14453714,0.6677196,0.0020520485,0.026769882,0.15178101
262,"Barry said: ""I think the greatest pain for Robin in the past 10 years was losing his twin brother, and I think it did all kinds of things to him.",4.6000107e-08,0.98879725,0.0016159536,3.191022e-09,0.009585045,1.7687347e-06
263,"""The",0.00048885593,0.15069434,3.435951e-05,0.008300112,0.84043604,4.627512e-05
264,"Who's Roger Daltrey recalled: ""A lovely, lovely guy.",0.25162697,0.33414364,4.633674e-07,0.3834223,0.0030382846,0.027768414
265,I hear everyone talking about the success of their career but I haven't heard many talk about him as a singer and I used to think he was one of the best.,0.00021732047,0.29852188,3.9218634e-05,0.68783015,5.080967e-09,0.013391459
266,"To me, singing is about moving people and Robin's voice had something about it that could move me and, I'm sure, millions of others.",0.0010288006,0.006706278,0.18569677,0.8061168,0.00044748787,3.880883e-06
267,"It was almost like his heart was on the outside.""",3.1220676e-10,6.956205e-05,0.0025969988,0.00036380326,0.9969228,4.678484e-05
268,"John Travolta recalled, ""I thought Robin was one of the most wonderful people, gifted, generous and a real friend to everyone he knew.",4.192305e-07,0.9180368,4.8415994e-05,6.9243135e-05,0.08184502,1.3244859e-07
269,"And we'll miss him.""",5.843029e-08,6.0825926e-07,0.0032101192,3.563309e-05,0.9967535,2.643507e-13
270,"Tim Rice described Gibb as ""a charming man"".",0.14158489,0.8583217,5.8526082e-05,2.1502676e-05,9.394845e-06,3.9442557e-06
271,"Rice added: ""I saw him only a couple of weeks ago, He wasn't at all well but was putting up a marvellous fight.",4.188857e-10,0.9987866,3.58109e-09,0.0012133168,4.452743e-10,7.1098405e-08
272,"It's a terrible loss for the music industry.""",0.9951007,0.0012192628,0.003661867,3.723731e-11,2.514648e-07,1.798429e-05
273,"Gibb's friend Cliff Richard said, ""We are a fraternity of people who sing pop and rock and Robin is another one of us who's gone too soon, too early.""",0.8711385,0.00017683614,0.12819453,0.00034043385,0.00014976348,3.0046245e-09
274,"Ringo Starr told the BBC: ""Robin will be remembered as a musician and as a singer and part of the Bee Gees.""",0.000798309,0.0019863057,2.4046535e-06,0.0015963872,0.9956149,1.6254135e-06
275,"Dionne Warwick said: ""He was wonderful.",9.146644e-13,0.00025717338,1.4475295e-09,0.999742,7.801866e-07,4.395639e-08
276,He was a jokester.,3.9780185e-05,1.1959064e-05,0.000734673,0.000111229936,0.9920963,0.0070059914
277,He had an incredibly witty sense of humour and was fun to be around.,0.001343278,0.558386,0.30750757,0.12741038,0.0034275807,0.0019251865
278,"""Kenny Rogers recalled: ""Robin was a part of something unique.",1.0070016e-08,3.624019e-06,6.2006626e-07,0.99835384,0.001641951,1.2588679e-09
279,"Mostly, Robin was a good guy who didn't deserve to die this young.",3.7133652e-06,6.014944e-08,4.140234e-05,1.186629e-07,0.9999547,1.360292e-12
280,"We will all miss him for what he was as a person and what he brought to music.""",1.4768513e-08,2.1960922e-07,0.9988153,2.534984e-09,0.00118445,2.7663907e-10
