,Sentence,Business meeting,Coincidence,Education,Music making,Personal life,Public celebration
0,"Robin Hugh Gibb  (22 December 1949 – 20 May 2012) was a British singer, songwriter and record producer, who gained worldwide fame as a member of the pop group the Bee Gees with older brother Barry and fraternal twin brother Maurice.",0.035424236,0.77532274,0.00043367175,0.018138776,0.17067818,2.3242083e-06
1,Robin Gibb also had his own successful solo career.,0.98596627,6.5130307e-10,1.667857e-08,0.014033492,1.8260815e-07,1.3331513e-13
2,Their youngest brother Andy was also a singer.,0.2249208,0.14400089,0.06941754,0.22676839,0.33488187,1.0513464e-05
3,"Gibb was born in Douglas on the Isle of Man to English parents, Hugh and Barbara Gibb; the family later moved to Manchester for three years (where Andy was born) before settling in Redcliffe, just north of Brisbane, Australia.",0.3674049,0.6203165,0.00088920596,0.00013157522,0.010955283,0.0003025693
4,Gibb began his career as part of the family trio (Barry-Maurice-Robin).,0.99030757,7.248132e-07,3.1494315e-07,0.009627101,6.437873e-05,1.8741614e-08
5,"When the group found their first success, they returned to England, where they achieved worldwide fame.",0.9877506,0.00879389,0.0007754262,0.002680072,1.052603e-07,2.3890936e-09
6,"In 2002, the Bee Gees were appointed as CBEs for their ""contribution to music"".",0.9992004,0.00079017354,3.0877945e-09,5.6159656e-08,2.4253393e-09,9.442468e-06
7,"However, investiture at Buckingham Palace was delayed until 2004.",0.19735828,1.4818498e-05,0.00013025184,1.0479082e-06,0.0014753811,0.8010202
8,"With record sales estimated in excess of 200 million, the Bee Gees became one of the most successful pop groups of all time.",0.0041757477,0.9952781,2.1677565e-10,0.0004734943,1.2851908e-07,7.2546245e-05
9,"Music historian Paul Gambaccini described Gibb as ""one of the major figures in the history of British music"" and ""one of the best white soul voices ever"" owing to his distinctive vibrato-laden soulful voice.",0.023756811,0.0011904727,8.685277e-07,0.9748549,7.920927e-05,0.0001177631
10,"From 2008 to 2011, Gibb was President of the U.K.-based Heritage Foundation, which honours figures in British culture.",0.06489377,6.0262075e-05,0.0009898298,6.422789e-08,5.24082e-07,0.93405557
11,"After a career spanning six decades, Gibb last performed onstage in February 2012 supporting injured British servicemen at a charity concert at the London Palladium.",0.9527837,4.7845634e-07,1.0273078e-09,0.047153655,1.818876e-10,6.2125764e-05
12,"On 20 May 2012, Gibb died at the age of 62 from liver and kidney failure brought on by colorectal cancer.",0.31003568,0.000619438,0.57468337,0.08713397,0.027526898,7.041664e-07
13,"As an instrumentalist, Gibb primarily played a variety of keyboards, notably piano, organ and Mellotron on the Bee Gees album Odessa (1969); he also played acoustic guitar and organ on his debut solo album Robin's Reign (1970).",0.085581616,0.000839573,1.1057357e-06,0.91357774,5.397304e-09,1.6285484e-14
14,==,0.12487878,0.21344116,0.0013716018,0.0017026735,0.6586057,7.902412e-08
15,Childhood ==,7.233917e-08,1.8502411e-05,5.0440907e-08,6.127425e-08,0.69064564,0.30933568
16,"Robin Hugh Gibb was born on 22 December 1949 in Jane Crookall Maternity Home in Douglas, Isle of Man, to Barbara Gibb (née Pass) and Hugh Gibb.",0.0009971319,1.3736314e-07,2.1106071e-07,0.00042939783,0.99856335,9.729672e-06
17,He was the fraternal twin of Maurice Gibb and was the older of the two by 35 minutes.,0.01720377,0.0009101614,0.3422656,6.3257903e-06,0.6394888,0.00012536412
18,"Apart from Maurice, he had one sister, Lesley Evans, and two brothers, Barry and Andy.",4.2473775e-07,0.0004071413,0.018445427,0.0002675689,5.0987586e-05,0.98082846
19,"As children in Manchester, Gibb and his brothers began committing crimes such as petty burglary and arson.",0.99971145,1.2826013e-06,4.092159e-05,1.46378e-07,0.00023915984,7.0829024e-06
20,"Their neighbour in Willaston, Isle of Man, Marie Beck, was a friend of his mother and her sister Peggy.",2.4084964e-06,0.04846752,4.6856703e-06,4.4812128e-07,0.94905394,0.0024709736
21,"Helen Kenney, another neighbour, was living in Douglas Head.",1.1831778e-06,0.46313813,4.07759e-05,0.11144079,0.42537916,2.1388251e-09
22,"As Kenney recalls, ""Barry and the twins used to come into Mrs Beck's house and we would talk to them.",4.908795e-10,0.9997842,0.000102833525,1.1085565e-05,8.272659e-05,1.9173494e-05
23,"Robin once said to me, 'We're going to be rich one day, we're going to form a band!'",0.99539584,0.0021181328,1.9512623e-05,0.0024656157,9.626658e-07,2.0440976e-13
24,"Little did I realise he meant it.""",2.902409e-09,0.028680913,0.000797517,4.936769e-05,0.97047216,3.3757848e-09
25,==,0.124878764,0.21344112,0.0013716007,0.0017026727,0.65860575,7.902396e-08
26,Career ==,1.0,4.7553845e-13,2.1761314e-17,4.5407397e-19,9.245216e-14,7.686053e-12
27,===,0.0018068925,2.1080356e-05,2.7498634e-05,0.00044118572,0.9977034,1.2509472e-11
28,1955–1958:,0.016885752,3.0402482e-05,5.4449933e-06,0.0031047964,0.9799723,1.2646636e-06
29,The Rattlesnakes ===,1.318456e-10,1.0,1.9096908e-09,2.8484703e-10,1.0975927e-10,2.1427769e-14
30,"In 1955, when the Gibbs moved back to their hometown of Manchester, the brothers formed the Rattlesnakes.",0.00051895797,0.9049019,0.0028135988,0.052928865,0.038835738,1.0218181e-06
31,"The band consisted of Barry on guitar and vocals, Robin and Maurice on vocals, Paul Frost on drums, and Kenny Horrocks on tea-chest bass.",0.87417275,5.6480157e-08,0.001345582,0.12438192,9.973221e-05,1.373083e-08
32,The quintet performed in local theatres in Manchester.,1.4131111e-09,2.8224866e-08,1.4528541e-10,0.9999999,1.6666647e-07,2.2908693e-12
33,"Their influences at that time were popular acts, such as the Everly Brothers, Cliff Richard, and Paul Anka.",0.74966866,0.2477896,0.00018488713,0.002356167,6.311162e-07,2.098415e-08
34,"In May 1958, the group was disbanded as Frost and Horrocks left, and the name changed to Wee Johnny Hayes and the Blue Cats.",0.9983108,4.4022226e-09,6.076704e-06,0.0014912661,8.748652e-06,0.00018304083
35,"In August 1958, the family travelled to Australia on the same ship as Red Symons, who also became a prominent musician in Australia.",5.1131828e-08,8.096711e-06,9.484814e-05,0.00222349,0.9976736,2.6771685e-08
36,===,0.0018068915,2.1080356e-05,2.7498634e-05,0.00044118572,0.9977034,1.2509472e-11
37,1958–1969: Bee Gees ===,0.16215836,0.83752453,2.6336222e-10,0.00028637695,3.074048e-05,3.324992e-09
38,"The boys finally changed their name to the Bee Gees, while they were living in Queensland, Australia.",8.113973e-05,0.999884,2.467148e-12,3.9043888e-07,3.446541e-05,9.222044e-10
39,"The Bee Gees' debut television appearance was in 1960 on Desmond Tester's Strictly for Moderns when they performed ""Time Is Passing By"".",0.225485,0.7734223,4.660059e-10,0.0010927074,9.400138e-10,8.8839985e-10
40,"When they signed to Festival Records at the start of 1963 (but they were assigned to Leedon Records) they released their debut single, ""The Battle of the Blue and the Grey"".",0.9731199,5.62192e-08,6.673057e-10,0.026880065,2.2597307e-10,1.072979e-11
41,"Their 1964 single ""Claustrophobia"" is notable for being the first song that features Gibb as an instrumentalist playing melodica.",0.99987304,8.974807e-06,1.710287e-09,0.000117958625,1.9989854e-10,2.4478657e-12
42,"The first Bee Gees record on which he sang lead was ""I Don't Think It's Funny"" in 1965.",0.5737694,0.015752418,5.150241e-06,0.4104728,2.6650272e-07,9.349399e-12
43,"In 1966, he wrote his first song ""I Don't Know Why I Bother With Myself"" that was credited to him.",0.0011071232,0.004934031,1.9336136e-05,0.9938676,6.490215e-05,7.019038e-06
44,"Also in 1966, Gibb and his brother Barry took more solo vocals.",0.08044833,8.616763e-05,6.328618e-06,0.9172961,6.5040695e-05,0.0020980213
45,"The group's first period of British success in the late 1960s started with ""New York Mining Disaster 1941"" and the band added drummer Colin Petersen and guitarist Vince Melouney to their line up.",0.9998629,5.5966146e-05,7.527824e-12,8.110931e-05,1.9860287e-10,1.1848741e-14
46,They toured Europe in 1967 and 1968 as well as the US in August 1968.,0.26494756,0.47737163,2.5246996e-05,0.25764647,8.808021e-06,2.8783106e-07
47,"The band's first UK No. 1 was ""Massachusetts"" which features Gibb on lead vocal.",0.94794124,8.856e-08,1.753218e-08,0.052017096,4.1633048e-05,1.1536385e-09
48,"On 13 June 1968, Gibb recorded demos for seven songs, accompanying himself on guitar.",0.44462547,0.42230976,0.0049647074,0.12808461,3.8213716e-06,1.1703448e-05
49,The tape listed Robin alone as artist and songwriter.,0.00014887101,0.0001417487,6.628757e-06,0.9996997,3.11476e-06,4.226997e-10
50,"Of these, one – ""Indian Gin and Whisky Dry"" – later appeared on Idea.",1.142318e-06,0.8728456,0.009393949,0.00025088195,0.00030998548,0.117198534
51,"On 27 July 1968, Gibb collapsed and fell unconscious.",0.037998073,0.88589746,9.54134e-06,0.047147438,0.028939305,8.1422795e-06
52,"He was later admitted to a London nursing home suffering from nervous exhaustion, and was moved to a facility in Sussex on 31 July to continue his recuperation.",0.08493359,0.014275165,2.243137e-05,0.00018398098,0.9005836,1.2230403e-06
53,"The group, about to embark on its first US tour, cancelled four dates after Gibb had a relapse and flew back to England for additional rest.",0.9998845,1.946825e-05,9.596683e-05,7.2016526e-08,1.9654707e-09,7.9054145e-11
54,"Gibb co-wrote ""Only One Woman"", The Marbles' debut single, which was a hit in several countries, especially in Europe and New Zealand.",0.028648952,0.00011085348,1.10487804e-07,0.97122115,3.933505e-06,1.5034527e-05
55,The Marbles were a British rock duo consisting of Graham Bonnet and Trevor Gordon.,0.016829828,0.0049623144,1.3565409e-07,0.96590984,0.01229786,4.390519e-10
56,"The Bee Gees' single ""I Started a Joke,"" on which Robin sang lead, was not released as a single in the UK but was the group's first US Top 10 hit.",0.9681801,0.006158357,1.3656528e-07,0.02555299,0.00010834811,1.3432516e-08
57,Gibb claimed that the melody of the song was inspired by the sounds he heard in a jet engine.,0.00066904514,0.0030617642,0.011299779,0.98369306,0.0012761549,1.0089263e-07
58,"In August, the band started to record Odessa.",0.996326,6.0973395e-07,5.666895e-10,0.003673332,2.4657687e-09,2.431803e-10
59,"In January 1969, Gibb co-wrote another Marbles single, ""The Walls Fell Down,"" and co-produced the sessions that same month.",0.84885365,0.0020837134,2.5541783e-07,0.14897963,8.263512e-05,3.3051062e-11
60,"However, the rivalry with Barry eventually prompted Robin to leave the group and begin a solo career (three months after guitarist Vince Melouney left the band) after his song ""Lamplight"" was relegated to the B-side of Barry's song ""First of May"".",0.96071565,0.0008016491,0.038062178,0.00040960533,8.5256725e-06,2.2460151e-06
61,"Meanwhile, there were rumours during this period that he was dealing with drug problems, allegedly leading his parents to threaten legal action to make him a ward of court (the UK age of majority at that time being 21, while Gibb was only 19).",0.99909246,0.0007603188,1.0445314e-06,7.378368e-07,1.0790068e-06,0.00014434673
62,The Bee Gees' last recording session with Robin was in February 1969.,0.027265318,0.5292892,1.4732333e-11,0.44339207,5.3437678e-05,1.5706271e-09
63,Gibb's last performance with the group was on The Tom Jones Show and Top of the Pops before leaving the group.,0.9999981,1.1049939e-08,1.4024582e-07,1.4926807e-06,6.6387007e-10,2.3331289e-07
64,===,0.0018068925,2.1080356e-05,2.7498634e-05,0.00044118572,0.9977034,1.2509472e-11
65,1969–1970:,0.85907257,7.240755e-05,9.0113204e-08,0.004825175,0.13602918,4.6605862e-07
66,Solo career ===,1.0,1.7569262e-12,6.44053e-13,1.0885304e-09,4.085746e-09,5.5907813e-11
67,"On 19 March 1969, he announced that he was leaving the Bee Gees the same day as the band recorded ""Tomorrow Tomorrow"", their first single without Robin.",0.99799734,0.00200187,3.4195227e-09,4.2818414e-07,2.294356e-07,2.0158066e-11
68,"In his solo career, Gibb was initially successful with a number 2 UK hit, ""Saved by the Bell"", which sold over one million copies and received a gold disc.",0.9040059,7.852528e-05,5.277023e-09,0.08375032,6.4146536e-07,0.01216453
69,He performed that song on the German TV show Beat-Club.,2.1171416e-05,0.13445742,0.0075142197,0.857885,0.00012168329,5.345144e-07
70,"Also in 1969, Gibb co-produced ""Love for Living"".",0.01942836,2.3851246e-07,1.952611e-09,0.98056453,6.911444e-06,4.7057075e-08
71,The song was performed by Clare Torry and was released as a single.,0.00015952252,9.086857e-05,9.454163e-05,0.045569405,2.0572422e-06,0.95408356
72,"He also started a mini-tour, making television appearances in a dozen countries to promote ""Saved by the Bell"".",0.99817705,0.0013572326,1.773595e-07,0.00041057952,5.461481e-08,5.503663e-05
73,"By 19 July 1969, New Musical Express announced ""Tonight, [Robin Gibb] is fronting a 97-piece orchestra and a 60-piece choir in a recording of his latest composition, 'To Heaven and Back', which was inspired by the Apollo 11 moonshot.",0.21512032,1.0053041e-05,0.0011304598,0.78373814,1.0638627e-06,2.6973552e-08
74,"It is an entirely instrumental piece, with the choir being used for astral effects.",6.4188804e-05,0.00024405125,2.3052567e-07,0.9996892,5.5924403e-07,1.8310329e-06
75,"The single will be billed as by 'The Robin Gibb Orchestra and Chorus' and it will be rush-released as soon as possible by Polydor"".",0.00062932854,2.3279425e-09,2.430359e-06,0.9993666,1.7085367e-06,6.563784e-10
76,"At that time, he was doing a musical score for Henry The Eighth and making his own film called Family Tree.",0.0008884211,4.3086255e-09,3.2330118e-07,0.95326686,0.045844436,1.5564229e-13
77,"Later, it was reported on NME that Gibb wrote dozens of songs for Tom Jones.",0.92780006,0.00015574472,0.03170237,0.040219303,0.000122004465,4.753485e-07
78,A meeting between Gibb and Jones was said to be arranged for Gibb's return from a three-day promo trip to Germany.,2.425773e-05,0.9999566,3.1156958e-07,9.500319e-09,1.6301625e-05,2.4556957e-06
79,"On 31 January and 1 February 1970, Gibb performed in Auckland, New Zealand.",0.29250124,1.2974228e-08,7.545233e-08,0.7074906,1.913792e-07,7.843564e-06
80,"However, Robin's first solo album, Robin's Reign (1970) was less successful and he soon found that being a solo artist was unsatisfying.",0.99595094,0.003407968,0.00034050943,0.00030054865,1.0149807e-07,3.1925842e-12
81,"Maurice played bass on the song ""Mother and Jack"", but was subsequently removed from the project by producer Robert Stigwood.",2.2069134e-08,2.6202736e-07,2.4528766e-09,0.99999964,9.160618e-08,9.270491e-16
82,"Also in that year, Colin Petersen produced ""Make a Stranger Your Friend"" performed by Jonathan Kelly, on which Gibb sang on the chorus with Mick Taylor, Klaus Voormann, Madeline Bell, three members of The Family Dogg, Jackie Lomax, Peter Sellers, Spike Milligan and others.",0.0007805875,0.00019654984,9.936305e-07,0.011395899,4.7592534e-06,0.98762125
83,"By January 1970, Gibb started to record his second solo album Sing Slowly Sisters until February, but the album would go unreleased until 2015.",0.999998,1.369385e-07,1.8442814e-06,1.427345e-07,2.9444717e-11,1.5223064e-12
84,"He wanted ""Great Caesar's Ghost"" to be released as a single around 1970 with ""Engines, Aeroplanes"" as the B-side but the two songs were not included on that album and were unreleased to this day.",0.00012801395,0.0014555693,7.631275e-08,0.9984163,9.558002e-09,1.1032144e-12
85,"On 13 June, Gibb and Maurice reunited and they recorded four songs, with two of the four tracks released on their upcoming album 2 Years On.",0.04935731,0.86649156,0.036266368,0.047884785,1.4113935e-08,6.8108914e-09
86,The session was originally for Maurice alone as he brought Gibb to the sessions.,0.0006481767,0.015606235,1.0467831e-07,0.9836579,4.5468818e-10,8.758133e-05
87,"On 21 June sessions, the pair recorded another five songs.",0.3763525,0.25823477,0.0002862853,0.36331558,0.0018101183,8.50679e-07
88,===,0.0018068925,2.1080356e-05,2.7498634e-05,0.00044118572,0.9977034,1.2509472e-11
89,1970–1979:,0.07547817,1.1113458e-05,1.1582494e-07,0.47087812,0.4491884,0.0044440487
90,Bee Gees comeback ===,0.85521454,0.14473294,2.055053e-05,2.7591408e-05,4.221135e-06,7.9726036e-08
91,"In August, the pair returned to the studio and they announced that the Bee Gees were back, with or without Barry's contribution.",0.013566247,0.9519317,0.00029663625,0.03420287,1.7457547e-06,8.8000826e-07
92,"One of the fourteen songs, ""Back Home"" and ""I'm Weeping"" was also released on 2 Years On.",0.000983523,6.12746e-07,0.9977344,0.0012660332,6.4870055e-06,8.874925e-06
93,On 21 August it was announced that Barry had rejoined the group and they were recording together.,0.027513957,0.27794498,2.720467e-05,0.6945016,6.50001e-07,1.15505445e-05
94,"The first song after the announcement was ""Lonely Days"" which reached No. 3 in the US Billboard Hot 100.",0.011716766,2.2291362e-05,1.107071e-06,0.00045276593,2.093124e-06,0.987805
95,"On the 2 Years On album, Gibb's compositions included ""Alone Again"".",0.019343494,0.97094876,0.00039855807,0.009296938,5.7525567e-06,6.529339e-06
96,"He also co-wrote and sang lead vocals on the title track as well as ""Man For All Seasons"".",0.079570696,6.7519625e-07,0.0076395655,0.8923998,0.017155314,0.0032339261
97,"In December 1970, Gibb recorded a demo ""After the Laughter"".",0.97787505,0.0005562496,3.9111129e-07,0.021567067,9.621653e-09,1.3143556e-06
98,"The Bee Gees had their first US No. 1 single ""How Can You Mend a Broken Heart"", with Gibb contributing on the song, writing with Barry and singing lead vocals on its first verse.",0.00019536752,0.9229002,0.007688312,0.06765556,0.0010041109,0.00055649475
99,"In April 1972, two months after the departure of drummer Geoff Bridgford, he wrote his last solo composition on a Bee Gees record until 1999, ""Never Been Alone"".",0.0010535779,0.2514991,2.8345696e-08,0.7427353,0.0006011811,0.004110777
100,"In 1976, on the group's Children of the World album, he sang lead on ""Love Me"" as well as doing falsetto on the track's coda, and he also used his falsetto on his lead vocal part on the song ""Lovers"" as Barry provided lead vocals on the entire song.",4.865977e-06,8.294671e-07,5.9417467e-08,0.9999943,2.8055784e-09,4.3556184e-10
101,"On the Saturday Night Fever soundtrack, he did not sing lead vocals on any Bee Gees song, unlike their previous and next albums.",7.56614e-05,9.5732044e-05,2.004281e-09,0.9998286,3.762728e-11,2.8225627e-12
102,"Four tracks off the album reached the UK Top 10; ""How Deep Is Your Love"", ""More Than A Woman"", ""Stayin' Alive"", and ""You Should Be Dancing"".",6.3855864e-06,1.3093303e-05,0.0003998693,0.0022555382,8.420667e-06,0.99731666
103,"Moreover, ""Night Fever"" held the top rank in 1978.",2.0238991e-07,2.3554407e-09,7.08068e-11,0.9999933,2.4032115e-06,4.0287428e-06
104,"In 1978, Gibb performed on the Sesame Street Fever album for the Sesame Street children's TV program.",0.99407035,5.0002413e-06,5.773986e-07,0.0056151315,9.507705e-06,0.00029946238
105,"He was one of the singers on the ""Sesame Street Fever"" title track, he sang a song called ""Trash"" for the character Oscar the Grouch, and spoke with Cookie Monster at the beginning of ""C is for Cookie"".",0.0015357549,0.043418553,0.009370811,0.91280204,0.0005972646,0.0322756
106,===,0.0018068925,2.1080356e-05,2.7498634e-05,0.00044118572,0.9977034,1.2509472e-11
107,1980–1985:,0.00014649145,2.2871474e-05,1.5213021e-09,0.0004362576,0.7466207,0.25277367
108,Collaborations with artists ===,0.7467384,0.00012244713,0.15160263,0.067986175,0.03197867,0.0015716461
109,"In January 1980, Gibb co-wrote and co-produced with Blue Weaver Jimmy Ruffin's 1980 album Sunrise.",0.7703233,4.813925e-09,1.8991638e-08,0.22967623,3.4576982e-07,8.242263e-08
110,"Ruffin had enjoyed one of his first significant hits, ""Hold on to My Love"", from the album Sunrise, which Robin Gibb had written and produced.",0.13118684,6.099544e-08,1.1298467e-05,0.8688018,2.625378e-08,8.788416e-09
111,"""Hold on to My Love"" had reached and stayed in the US Top 30 hits for 14 years.",0.047137488,2.245649e-08,3.4353218e-07,0.9519567,2.8919874e-05,0.0008764822
112,"Also in 1980, he duetted with Marcy Levy on the song ""Help Me!""",8.573059e-06,0.0013125434,1.0304833e-09,0.9986766,2.2563977e-06,2.4684946e-10
113,(reached No. 50 in the US) featured on the soundtrack of the film Times Square.,0.007210492,2.3133613e-07,1.6266653e-06,0.6912919,0.30136847,0.00012725698
114,"The other artists performing on the film, including Gary Numan, Roxy Music, Ramones, The Cure and The Cars.",0.33528927,0.0001844542,5.3142e-11,0.66452616,5.049841e-08,1.1312805e-09
115,"Also in 1980, most of Barbra Streisand's album Guilty was co-written by Gibb with Barry.",3.6928832e-05,6.695845e-06,1.3055849e-08,0.9998456,1.5131009e-09,0.000110691595
116,"In February 1981, the Bee Gees returned to the studio and recorded Living Eyes, unlike the previous album, this album was not a successful as their fans described it as a worst album.",0.098634936,0.9001509,1.5432275e-10,0.0012134681,3.989881e-08,7.700022e-07
117,They then worked on Dionne Warwick's album Heartbreaker and recorded songs for the film Staying Alive.,5.1727064e-08,2.052782e-08,2.7429415e-08,0.9999999,1.5271706e-10,1.3423963e-15
118,====,0.0008281037,4.9745104e-05,1.64031e-05,9.948394e-06,0.9990958,1.3139766e-10
119,Initial solo success,0.00044379945,0.98353624,3.6448907e-07,0.015819663,0.0001624191,3.7604812e-05
120,=,0.0052374,0.9944846,1.1614881e-05,0.00024722322,1.9252171e-05,9.708544e-09
121,=,0.0052374,0.9944846,1.1614881e-05,0.00024722322,1.9252171e-05,9.708544e-09
122,==,0.124878764,0.21344116,0.0013716005,0.0017026726,0.6586057,7.9023955e-08
123,"He recorded his second solo album with Maurice's participation, How Old Are You?.",2.9268736e-05,1.4850563e-05,0.009910792,0.9900448,1.8605917e-07,5.843803e-11
124,"The lead single ""Juliet"" was a success in Europe as well as ""Another Lonely Night in New York"" and the title track.",0.36212686,7.742255e-06,4.8070277e-08,0.57487375,2.8504215e-05,0.06296307
125,"In 1984, he released his third solo album Secret Agent, a new wave/synthpop-influenced LP (reached No. 97 in the US, No. 31 in Germany and No. 20 in Switzerland).",0.99356866,3.1667968e-10,1.6503254e-09,0.0064238077,5.9176764e-06,1.504103e-06
126,"The album's lead and first single ""Boys Do Fall in Love"" reached the Billboard magazine top 40 list of hits, as well as reaching No. 70 in the UK, No. 7 in South Africa and No. 10 in Italy.",0.11280186,0.8778427,5.3020813e-08,0.008406488,0.00094830594,4.963051e-07
127,"Other singles such as the title track and ""In Your Diary"" did not repeat the success of the first single.",0.0005516226,0.014175286,2.712867e-06,0.9848236,0.0002643136,0.00018250085
128,"Due to the success of ""Boys Do Fall in Love"", he performed the song in several TV shows including Eldorado (Danish TV).",0.53677493,0.30870238,3.2565474e-06,0.00010319349,0.15439896,1.72306e-05
129,"In 1985, he released his fourth solo album Walls Have Eyes with the singles ""Like a Fool"" and ""Toys""; both songs did not chart in the US or UK.",0.99827373,2.6495092e-05,9.714942e-07,0.0016376135,5.504028e-05,6.046638e-06
130,These three albums were more successful in Europe than in the UK or US.,0.06564933,0.23193799,0.58160925,0.0034952739,0.008140069,0.109168045
131,"In 1986, Gibb joined Thompson Twins, Zak Starkey, Cliff Richard, Bonnie Tyler, John Parr and Holly Johnson under the name Anti-Heroin Project to record a charity single called ""Live-In World"".",0.43209437,0.018772114,2.2468808e-07,0.5487737,0.0002583912,0.00010115337
132,=== 1986–2002,0.02083088,7.429351e-06,5.7519284e-08,0.97335047,0.005380988,0.0004301427
133,===,0.0018068925,2.1080356e-05,2.7498634e-05,0.00044118572,0.9977034,1.2509472e-11
134,"In late 1986, the Bee Gees began writing and recording songs for their album ESP to be released in 1987.",0.97053164,0.02867673,8.474269e-09,0.00079155836,1.0528069e-08,2.3934787e-10
135,"In 1992, Lulu recorded ""Let Me Wake Up in Your Arms"" on which he co-wrote.",1.80828e-05,1.1322505e-08,1.9565465e-09,0.9999819,1.5308263e-10,3.480785e-08
136,"Gibb later contributed vocals on the Brazilian duo José y Durval's ""Palavras/Palabras"" (a Spanish or Portuguese version of ""Words"").",0.13982026,0.00023385459,0.0008637719,0.85743386,4.3507196e-05,0.0016047496
137,"In 1998, the Bee Gees recorded their own version of ""Ellan Vannin"" with lead vocals by Gibb.",0.0014016251,0.035535548,9.523021e-08,0.96305704,5.708195e-06,6.3049244e-10
138,It was later released as a single as a limited edition CD to benefit the Manx Children in Need charity.,2.908708e-09,0.00056994543,0.00047751353,0.027660947,1.08078775e-05,0.97128075
139,"In 2001, the Bee Gees released their last album This Is Where I Came In and features his last composition on a Bee Gees record ""Embrace"".",0.052089978,0.0038577125,2.5379565e-08,0.944052,3.556393e-07,1.706127e-09
140,===,0.0018068908,2.1080356e-05,2.7498634e-05,0.00044118552,0.9977034,1.2509472e-11
141,2003–2009:,0.8676592,2.8362242e-06,7.699749e-05,0.12476602,2.4756089e-06,0.0074925823
142,Touring years =,0.99999094,3.7718797e-09,2.3034985e-08,9.057297e-06,2.7268545e-09,5.269454e-11
143,=,0.0052374024,0.9944846,1.1614892e-05,0.00024722322,1.9252171e-05,9.708544e-09
144,=,0.0052374024,0.9944846,1.1614892e-05,0.00024722322,1.9252171e-05,9.708544e-09
145,"On 27 January 2003, Robin released a solo album, Magnet in Germany on SPV GmbH, and worldwide shortly afterwards.",0.006515971,3.5472148e-08,0.00017795604,0.9928334,0.00047266626,9.837175e-09
