,Sentence,Business meeting,Coincidence,Education,Music making,Personal life,Public celebration
0,"Jack Scott (born Giovanni Domenico Scafone Jr.; January 24, 1936 – December 12, 2019) was a Canadian-American singer and songwriter.",1.5558093e-05,0.00029133572,0.00011099179,9.000507e-05,0.9993049,0.0001872105
1,"He was inducted into the Canadian Songwriters Hall of Fame in 2011 and was called ""undeniably the greatest Canadian rock and roll singer of all time.""",0.00019007087,0.00871314,1.5556043e-07,0.9712261,2.1312266e-05,0.01984919
2,==,0.12487809,0.21344268,0.0013716145,0.0017026803,0.65860486,7.902394e-08
3,Career ==,1.0,4.755348e-13,2.1761231e-17,4.5407227e-19,9.245165e-14,7.685994e-12
4,"Scott spent his early childhood in Windsor, Ontario, across the river from Detroit, Michigan.",6.460599e-09,1.4951535e-05,1.6307693e-08,3.3167886e-09,0.999985,2.3521167e-09
5,"When he was 10, his family moved to Hazel Park, a Detroit suburb.",4.5599148e-14,3.980073e-11,3.6172387e-12,2.0614817e-11,1.0,4.218723e-09
6,"He grew up listening to hillbilly music and was taught to play the guitar by his mother, Laura.",8.722615e-06,4.5878192e-08,0.9989497,2.4120806e-07,0.0010412589,1.9775086e-10
7,"As a teenager, he pursued a singing career and recorded as ""Jack Scott"".",0.9874442,0.0009381169,8.665984e-08,0.005843133,0.0057705087,3.8821818e-06
8,"At the age of 18, he formed the Southern Drifters.",0.8466026,0.09992944,0.025853839,0.0003470688,0.0010733464,0.02619374
9,"After leading the band for three years, he signed to ABC-Paramount Records as a solo artist in 1957.",0.9987484,1.15620936e-10,1.0652388e-11,0.001251566,3.065802e-10,6.9116194e-14
10,"After recording two good-selling local hits for ABC-Paramount in 1957, he switched to the Carlton record label and had a double-sided national hit in 1958 with ""Leroy"" (#11) /",0.00013294537,1.9748866e-05,1.577991e-05,0.9997284,0.00010174686,1.3245043e-06
11,"""My True Love"" (#3).",9.602285e-06,0.0008189782,0.016880104,3.3796366e-07,0.9817861,0.0005049537
12,"The record sold over one million copies, earning Scott his first gold disc.",0.27625525,0.0036591727,4.6420797e-07,0.68952686,0.00018205756,0.030376159
13,"Later in 1958, ""With Your Love"" (#28) reached the Top 40.",1.8376912e-07,0.005252161,1.0495507e-06,0.9930555,0.001620667,7.041092e-05
14,"In all, six of 12 songs on his first album became hit singles.",0.695759,0.02447647,6.6042834e-05,0.27968946,2.168925e-06,6.8923823e-06
15,"On most of these tracks, he was backed up by the vocal group the Chantones.",0.00033146245,1.704631e-05,0.0061948816,0.99345666,2.9257674e-08,5.78074e-12
16,"He served in the United States Army during most of 1959, just after ""Goodbye Baby"" (#8) made the Top Ten. 1959 also saw him chart with ""The Way I Walk"" (#35).",0.113123134,0.084185906,3.8600588e-06,0.044415105,0.0013271498,0.75694484
17,"Most of his Carlton master tapes were believed lost or destroyed until Rollercoaster Records in England released a vinyl EP, ""Jack Scott Rocks"", and CD, The Way I Walk, which were for the most part mastered from original tapes rather than the disc dubs used for previous reissues.",9.404674e-08,0.9495389,0.049152672,0.00024237289,0.0008583998,0.00020773386
18,"At the beginning of 1960, Scott again changed record labels, this time to Top Rank Records.",0.97733706,0.006828497,1.7458723e-06,0.015806766,2.6012442e-05,8.9230706e-10
19,"He then recorded four Billboard Hot 100 hits – ""What in the World's Come Over You"" (#5), ""Burning Bridges"" (#3) b/w ""Oh Little One"" (#34), and ""It Only Happened Yesterday"" (#38).",0.00027232533,0.009594418,1.2446738e-05,0.98788995,0.001366404,0.0008644384
20,"""What in the World's Come Over You"" was Scott's second gold disc winner.",0.000570273,0.76253253,0.0039494126,0.006223026,5.6957897e-06,0.22671908
21,Scott continued to record and perform during the 1960s and 1970s.,0.0029999209,0.00027491368,1.0935736e-08,0.99672514,4.3537725e-08,4.3150738e-08
22,"His song ""You're Just Gettin' Better"" reached the country charts in 1974.",0.0012138576,5.9634306e-07,4.117487e-10,0.00016327892,0.0029946377,0.99562764
23,"In May 1977, he recorded a Peel session for BBC Radio 1 disc jockey John Peel.",8.039926e-05,0.00017737442,0.004573391,0.86612093,0.12877668,0.00027126266
24,"Scott had more US singles (19), in a shorter period of time (41 months), than any other recording artist except for The Beatles, Elvis Presley, Fats Domino and Connie Francis.",0.66979057,0.09788329,0.00018906123,0.088129275,0.0045589344,0.13944888
25,"He wrote all of his own hits, except one: ""Burning Bridges.""It has been said that ""with the exception of Roy Orbison and Elvis Presley, no white rock and roller of the time ever developed a finer voice with a better range than Jack Scott, or cut a more convincing body of work in rockabilly, rock and roll, country-soul, gospel or blues"".",0.0040094047,0.03319335,0.00017139787,0.96260095,7.855302e-06,1.7092116e-05
26,"Scott recorded his penultimate album, a live album with British band The Class of '58 whilst headlining at the Rockhouse Festival in The Netherlands in 1994; a recording which had to be postponed from its originally scheduled 1993 date due to the pregnancy of Double Bass player, Chris Coleman.",0.9571556,0.042712238,1.747952e-05,0.0001126533,2.1513786e-06,1.1717558e-09
27,The album was released in 1995 on the Rockhouse label.,0.9867698,4.1418534e-05,8.213972e-09,0.013187153,1.4804932e-06,1.4623988e-07
28,"In 2007, Jack Scott was voted into the Michigan Rock and Roll Legends Hall of Fame.",5.7150297e-05,0.55904573,2.497752e-09,0.09017028,4.702656e-05,0.35067976
29,"In 2011, he was inducted into the Canadian Songwriters Hall of Fame.",0.0031962118,0.00022967042,4.833134e-06,0.48500386,3.519414e-06,0.51156193
30,Later Scott was nominated for the Hit Parade Hall of Fame.,4.2004143e-05,0.69101524,9.102511e-12,0.17691855,4.6551707e-11,0.13202417
31,He continued singing and touring and lived in a suburb of Detroit.,2.6580738e-09,2.0465568e-05,1.8002527e-08,0.9892573,0.010720578,1.6254735e-06
32,"Scott's final album, the studio album ""Way to Survive"" was released in 2015, with Scott returning to his Rock & Roll roots whilst taking influences from two of his favorite music genres, country and blues.",0.9748585,0.02425666,0.00025771715,0.00036360516,0.0002631365,3.089559e-07
33,"Scott died of congestive heart failure on December 12, 2019, at the age of 83.",0.00015646087,0.000302247,0.27006733,0.0002968491,0.7291757,1.4123674e-06
34,"His niece, singer and actress Rio Scafone, announced his death on her Facebook page, stating that he had suffered a massive heart attack on December 8 and there was nothing they could do for him.",1.6856648e-08,4.126769e-07,0.9569741,6.098789e-05,0.039568014,0.0033964273
35,"Scott died four days later, in the afternoon.",1.3031824e-07,0.31141332,0.008936388,2.2366366e-07,0.6796498,1.6275278e-07
36,==,0.12487809,0.21344268,0.0013716145,0.0017026803,0.65860486,7.902394e-08
37,Discography ==,0.9999943,1.2030798e-08,8.3584145e-10,5.3618996e-06,2.8147706e-09,3.2553942e-07
38,===,0.0018069104,2.1080758e-05,2.7498896e-05,0.00044119143,0.9977034,1.2509519e-11
39,Albums ===,1.4328854e-05,5.2965725e-06,9.111505e-05,9.328187e-08,2.537148e-06,0.99988663
40,===,0.0018069104,2.1080758e-05,2.7498896e-05,0.00044119143,0.9977034,1.2509519e-11
41,Singles =,0.00032514802,0.15757526,0.00061795657,0.23594217,0.60341454,0.0021248732
42,==,0.12487809,0.21344268,0.0013716145,0.0017026803,0.65860486,7.902394e-08
