,Sentence,Business meeting,Coincidence,Education,Music making,Personal life,Public celebration
0,"Julio José Iglesias de la Cueva (Spanish: [ˈxuljo iˈɣlesjas]; born 23 September 1943) is a Spanish singer, songwriter and former professional footballer.",0.00020859805,2.2667805e-07,2.8207942e-06,0.00040808498,0.98511446,0.0142658185
1,"Iglesias is recognized as the most commercially successful Spanish singer in the world and one of the top record sellers in music history, having sold more than 100 million records worldwide in 14 languages.",0.73779863,2.5315694e-05,1.1659983e-05,3.2894495e-05,0.0003693914,0.26176202
2,"It is estimated that during his career he has performed in more than 5000 concerts, for over 60 million people in five continents.",0.96350336,0.00017699208,5.302548e-06,0.029542038,0.00013408721,0.0066382983
3,"In April 2013, Iglesias was inducted into the Latin Songwriters Hall of Fame.",9.276467e-05,0.00015345766,2.4427882e-06,0.5919582,2.0159894e-06,0.40779105
4,"In 1983, Iglesias was celebrated as having recorded songs in the most languages in the world, and in 2013 for being the artist in Latin music with the most records sold in history.",0.82470703,7.63093e-05,0.0001671208,0.17375307,0.00024153045,0.0010549676
5,"In April 2013 in Beijing, he was honoured as the most popular international artist in China.",9.055316e-05,2.4170237e-07,5.5080132e-08,3.7997806e-06,2.1849852e-08,0.99990535
6,"In Brazil, France, Italy and elsewhere, Iglesias is the most successful foreign record seller, while in his home country, Spain, he has sold the most records in history, with 23 million records.",0.5228143,0.0015772129,1.648813e-05,0.00029922396,8.867041e-05,0.47520405
7,"During his career, Iglesias has won many awards in the music industry, including the Grammy, Latin Grammy, World Music Award, Billboard Music Award, American Music Award and Lo Nuestro Award.",8.499364e-06,4.031079e-06,8.844487e-09,1.2099373e-10,3.6031445e-13,0.9999875
8,He has been awarded the Gold Medal for Merit in the Fine Arts of Spain and the Legion of Honour of France.,0.002493302,0.009968783,0.00067933806,0.0001377558,4.7114943e-07,0.9867203
9,UNICEF named him Special Ambassador for the Performing Arts in 1989.,0.018162368,4.740873e-12,3.0488387e-10,0.0008882318,0.000109041765,0.9808404
10,He has had a star on the Hollywood Walk of Fame since 1985.,0.00031232982,8.880382e-10,1.7592323e-10,8.2689366e-10,1.9259687e-06,0.99968576
11,==,0.12487878,0.21344116,0.0013716018,0.0017026735,0.6586057,7.902412e-08
12,Early life ==,0.0019447311,0.1456498,0.022118498,4.7269286e-06,0.8208643,0.009417961
13,"Iglesias was born in Madrid to Julio Iglesias Sr., a medical doctor from Ourense who became one of the youngest gynecologists in the country, and María del Rosario de la Cueva y Perignat.",1.2045258e-06,7.474371e-09,1.0578327e-06,3.3986538e-08,0.99982697,0.00017075203
14,"His paternal grandparents, Manuela Puga Noguerol and Ulpiano Iglesias Sarria, were of Galician ancestry.",5.3862145e-06,2.9129822e-05,0.020365857,2.6033567e-06,0.6362369,0.34336013
15,"His maternal grandparents were José de la Cueva y Orejuela (1887–1955) and Dolores de Perignat y Ruiz de Benavides, who was a native of Guayama, Puerto Rico.",3.5901032e-06,5.6238544e-08,0.0006844554,3.6832403e-06,0.99685884,0.0024494266
16,"The name ""Iglesias"" translates as ""churches"", although Iglesias claims to be of Jewish ancestry on his maternal side.",0.00018937871,8.9367965e-08,0.001100999,0.10896768,0.8894637,0.00027811743
17,"He has said that his mother's family name, ""de la Cueva"", meaning literally ""of the cave"" and referring to Jewish people in hiding, is a common Jewish name.",0.0018629548,0.006270727,4.634522e-07,0.9847112,0.0052829827,0.0018716443
18,"He has proclaimed himself Jewish ""from the waist up"".",0.12380715,7.8651785e-05,0.009861796,0.8400265,0.025395596,0.00083023903
19,He alternated playing professional football with studying law at the CEU San Pablo University in Madrid.,8.203354e-07,4.674063e-05,0.97749025,0.022461142,2.0896099e-08,1.0121407e-06
20,"In his youth, he was a goalkeeper for Real Madrid Castilla in the Segunda División.",0.99995446,1.3010365e-05,2.4646024e-05,7.841216e-06,5.4251275e-09,4.57741e-08
21,His professional football career was ruined when he was involved in a serious automobile accident in 1963 that left him unable to walk for two years.,0.920166,0.0074076806,3.951256e-09,2.9064967e-07,3.810958e-05,0.072387986
22,The accident smashed his lower spine and left his legs permanently weakened and requiring therapy for several years.,0.080088146,0.91798544,2.1008835e-05,1.4081065e-05,0.0013487058,0.00054256624
23,"He has said of those years, ""I had more courage and attitude than talent"".",0.9999987,1.1955382e-07,3.4233423e-07,7.804361e-07,8.3807367e-10,6.3618707e-13
24,"While he was in hospital after the accident, a nurse named Eladio Magdaleno gave him a guitar so that he could recover the dexterity of his hands.",0.35700867,0.0006342914,0.021084435,0.0018993616,0.6182173,0.0011559753
25,"In learning to play, he discovered his musical talent.",2.4330237e-07,1.6585831e-05,0.99176395,0.008219283,1.4798389e-08,3.493578e-16
26,"After his rehabilitation, Iglesias studied for three months at Bell Educational Trust's Language School in Cambridge, England.",5.9358885e-12,1.4595589e-10,0.9999999,6.96166e-08,1.763426e-08,8.43087e-09
27,"After that, he returned to obtain his law degree at Complutense University of Madrid.",1.21214e-09,2.0894854e-06,0.99999774,8.459221e-08,3.5367549e-12,9.237662e-12
28,==,0.124878764,0.21344107,0.0013716007,0.0017026727,0.65860575,7.9024126e-08
29,Entertainment career ==,0.99999976,8.078629e-14,4.8587403e-16,4.5823945e-20,3.0192655e-17,1.9823372e-07
30,"In 1968, he won the Benidorm International Song Festival, a songwriter's event in Spain, with the song ""La vida sigue igual"" (meaning ""Life Goes On The Same"") which was used in the film La vida sigue igual about his own life.",0.0042921347,0.033315364,0.00038645937,2.906628e-05,0.00041695626,0.96156
31,"He then signed a deal with Discos Columbia, the Spanish branch of the Columbia Records company, and released his first studio album, titled Yo Canto, or I Sing.",0.9999268,4.490661e-06,1.2104013e-05,5.6514073e-05,3.5082542e-15,1.438217e-12
32,The album spent 15 weeks in the Spanish charts,0.99910307,7.5460406e-07,6.8564636e-06,3.3226595e-06,1.886801e-08,0.00088595506
33,and peaked at No. 3.,2.6981377e-06,4.1870468e-08,9.514287e-12,0.9999968,5.1932756e-07,6.166698e-10
34,"He represented Spain in the 1970 Eurovision Song Contest, finishing in fourth place behind Ireland's winning entry, performed by Dana.",2.8345485e-06,5.299674e-07,6.2650427e-09,0.9999871,7.5919054e-08,9.376774e-06
35,"His entry was the song ""Gwendolyne.""",0.001973279,2.0740003e-06,1.179816e-05,0.78064317,0.00019284045,0.2171769
36,"Shortly after, he had a number one hit in many European countries with ""Un Canto A Galicia"", sung in Galician, in honour of his father, who hailed from Galicia.",0.00392157,0.4168967,0.16991894,0.047569674,0.21972314,0.14196995
37,That single sold 1 million copies in Germany.,0.0013888942,0.0002824926,6.1012574e-06,0.06683193,0.043813,0.88767755
38,"In 1975, he found success in the Italian market by recording a song exclusively in Italian, called ""Se mi lasci non vale"" or ""If You Leave Me, It Can't Be.""",0.00011284671,0.0058755423,2.9391282e-07,0.99399394,8.6298456e-08,1.7269564e-05
39,"Notable albums from this decade are A flor de piel (1974, with the European hit ""Manuela""), El amor (1975), and Soy (1973).",0.71729594,9.471913e-06,2.5262672e-09,0.0057543693,1.2253395e-05,0.27692795
40,"He also sang in French: one of his popular songs in this language became ""Je n'ai pas changé.""",0.41095933,0.032430474,0.0041918913,0.53640217,0.016015992,3.7777202e-08
41,"In 1979, he moved to Miami, Florida, in the United States, signed a deal with CBS International and started singing in different languages such as French, Italian, Portuguese and German.",0.99996495,3.367185e-06,1.2997592e-05,1.8740859e-05,9.519153e-09,3.0058003e-10
42,"Two years later, he released the album De niña a mujer in five languages, which he dedicated to his daughter, who appeared on the cover with him.",0.9781796,0.0005616519,0.005258822,0.00036713597,0.015504199,0.0001285935
43,"From it came the first English-language hit of his career, a Spanish cover of ""Begin the Beguine"" which became number 1 in the United Kingdom; he also released a collection, Julio (1983).",0.9999949,3.3668325e-08,4.3297805e-09,5.130694e-06,5.9959033e-09,7.1116546e-12
44,"In 1984, he released 1100 Bel Air Place, the hit album which established him as a star in the English-speaking entertainment industry.",0.9999989,1.0177031e-06,3.5457578e-11,1.311527e-10,4.5071703e-11,1.157146e-08
45,It sold over three million albums in the United States alone.,0.00088155037,3.1519576e-06,0.0061406204,0.35317105,5.2317706e-10,0.63980365
46,"The first single, ""To All the Girls I've Loved Before"", a duet with Willie Nelson, hit No. 1 on the Country charts and went Top Five in the Billboard Hot 100.",0.0005650184,0.001636551,1.8164789e-07,0.983613,0.014184818,4.874933e-07
47,"It also featured ""All of You"", in vocal duet with Diana Ross, a Top Twenty Pop hit, that climbed to No. 2 on the Adult Contemporary Chart with the help of a popular video.",0.042549413,6.7193396e-05,4.2703697e-08,0.02136738,2.6061089e-06,0.9360134
48,He also performs duets with The Beach Boys for those years.,0.06935364,2.4392102e-07,1.5058979e-06,0.9306441,1.1079704e-07,3.9810527e-07
49,"Iglesias won a Grammy Award for Best Latin Pop Album in the 1988 Grammy Awards for the album Un hombre solo (""A Man Alone"").",1.0212157e-12,9.991032e-10,1.3469448e-10,1.0746273e-11,2.9771652e-10,1.0
50,"In that year, he recorded a duet with Stevie Wonder, ""My Love"", in his Non Stop album, a crossover success in 1988.",1.911267e-07,1.2920316e-06,1.7743583e-09,0.99999714,2.6995062e-09,1.4373461e-06
51,Iglesias made a cameo appearance as himself on The Golden Girls as Sophia Petrillo's date on St. Valentine's Day 1989.,0.00069172296,0.00069672754,1.4358326e-08,0.0015370676,0.9843812,0.012693205
52,"In 1993, recorded Summer Wind with Frank Sinatra.",0.9953029,2.6760542e-06,4.478916e-06,0.0046678632,1.734792e-05,4.6109976e-06
53,"In 1994, released Crazy, including duets with Dolly Parton, Sting and Art Garfunkel.",0.4610696,0.0001163473,2.5532515e-10,0.538814,6.104994e-08,1.8536792e-08
54,"In 1995, Iglesias was the recipient of the Excellence Award at the 1995 Lo Nuestro Awards.",1.0484325e-07,9.789117e-06,1.3607596e-13,3.047646e-08,3.9353512e-08,0.99999
55,"In 2001, Iglesias was recognized as the Person of the Year by the Latin Recording Academy.",2.9071628e-06,1.4753572e-05,1.1833653e-08,3.0741253e-07,1.138642e-07,0.9999819
56,"A year later, Iglesias was inducted into the International Latin Music Hall of Fame.",4.2095357e-06,2.2861632e-06,3.329464e-06,0.0015427254,4.0715776e-07,0.9984471
57,"In 2003, Iglesias released his album Divorcio (""Divorce"").",4.4443637e-05,2.1111762e-07,0.0003026358,4.6441386e-07,1.1568579e-05,0.9996407
58,"In its first day of sales, Divorcio sold a record 350,000 albums in Spain, and reached the number 1 spot on the charts in Spain, Portugal, France, Italy, and Russia.",0.00012248952,0.00044023074,2.3701488e-05,3.94223e-07,2.0736672e-06,0.9994111
59,"In 2003 and 2004, aided by the success of his Divorcio album, Iglesias went on a ten-month world tour which took him from Europe to Asia and then on to North America, South America and Africa.",7.5578406e-05,0.031876773,0.025110394,1.3255958e-05,2.9191946e-07,0.9429237
60,More than half the shows on that tour sold out within days of going on sale.,0.003566541,4.9334663e-05,0.93412596,0.06224754,1.0706787e-05,4.297126e-08
61,"In December 2004, his Dutch girlfriend Miranda Rijnsburger and Iglesias himself recorded a duet of the Christmas song ""Silent Night"".",1.1686447e-08,2.4293179e-08,5.79658e-06,0.8606536,0.030022247,0.10931841
62,"The song, which was not officially released, also included a voice message from Iglesias, Rijnsburger, and their four young children.",9.499073e-05,0.001584984,0.00019099867,0.17424063,0.81234384,0.011544578
63,The song was released online through the singer's official website and a CD was included on their Christmas card as a holiday gift from the Iglesias family to their friends and fans around the world.,7.447004e-09,3.9814686e-06,0.000106639745,1.3884249e-09,3.8977516e-10,0.9998894
64,"In 2008, Iglesias recorded another song as a gift to his fans.",9.2605626e-07,2.7913913e-09,2.110301e-05,1.3147292e-07,3.677883e-05,0.9999411
65,"The family recorded ""The Little Drummer Boy"" in Spanish and English and included it in the family's Christmas card.",1.4154348e-09,0.0020396558,2.15222e-06,0.0009808893,0.9941659,0.0028113483
66,"Iglesias also made investments in the Dominican Republic's eastern town of Punta Cana, a major tourist destination, where he took to spending most of the year.",0.001115152,0.0013651795,0.015852243,0.42709914,0.55327576,0.0012925026
67,He became a Dominican citizen in 2005.,0.30519584,2.0174655e-06,8.062257e-05,0.039376967,0.6553414,3.2094088e-06
68,"In September 2006, Iglesias released a new English-language album, which he titled Romantic Classics.",0.9720519,6.6277903e-06,0.0006517129,0.0054542045,0.021811875,2.3685283e-05
69,"""I've chosen songs from the 1960s, 1970s and 1980s that I believe will come to be regarded as the new standards,"" Iglesias stated in the album's sleeve notes.",0.989888,0.00041315288,3.0601302e-06,0.0096948445,6.213368e-07,3.0764974e-07
70,"The album featured his interpretations of Foreigner's ""I Want to Know What Love Is"", the Wham!",0.29157263,0.04866562,0.6583384,0.0014158464,8.858142e-07,6.588794e-06
71,"selection ""Careless Whisper"", and Richard Marx's ""Right Here Waiting"".",2.1308484e-05,0.0007644075,4.6997066e-08,0.9992142,1.1504173e-08,8.026399e-09
72,"Romantic Classics was Iglesias's highest debut on the Billboard charts, entering at number 31 in the United States, 21 in Canada, 10 in Australia, and top spots across Europe and Asia.",0.94113517,5.7270194e-07,1.6936502e-08,0.0026402993,0.002564465,0.05365941
73,"He returned to the studio to record songs in Filipino and Indonesian for his Asian releases of Romantic Classics, which helped propel record sales in the Asian entertainment industry.",0.95001096,0.003549168,0.024110865,0.022329004,1.6194423e-07,1.4249316e-10
74,Iglesias promoted Romantic Classics in 2006; it was seen all over the world on television shows.,0.00360669,0.43289626,0.001255067,0.027462598,0.015154608,0.51962477
75,"In the United States, for example, he appeared on Dancing With The Stars, where he sang his version of ""I Want To Know What Love Is"", Good Morning America, The View, Fox and Friends and Martha Stewart.",2.1985372e-08,0.99600667,1.7863307e-05,4.440401e-06,7.0722826e-14,0.003971165
76,"In 2008, Iglesias made a music video with Gulnara Karimova, the daughter of Uzbek dictator Islam Karimov.",6.87706e-05,0.6123407,0.113687254,6.269653e-05,0.0007051379,0.27313545
77,"In October 2012, he performed a concert in Equatorial Guinea where tickets were reportedly $1,000 each.",0.8171145,0.000111333335,0.00041847484,0.1445379,0.00018299445,0.03763482
78,"Iglesias's performance of the song ""La Mer"" (""The Sea"") is featured in the soundtrack of the 2011 film Tinker Tailor Soldier Spy.",0.078582466,0.002474765,2.6828937e-05,0.9186428,5.1446532e-05,0.00022163299
79,The performance comes from a live album that he recorded live at the Olympia in 1976.,0.003190581,5.7153193e-06,0.10836552,0.8884236,1.4322889e-05,1.7821944e-07
80,"On 1 April 2013, in Beijing, he received two historic awards:",9.037342e-10,3.7947747e-09,1.6172071e-09,3.5513267e-10,3.7601963e-10,1.0
81,"First & Most Popular International Artist of All Time in China, an award given by Sony Music China and which was presented to Iglesias by the world-renowned Chinese artist Lang Lang, and the Guinness World Records for the Best-selling Male Latin Artist.",0.0031084986,4.048391e-06,7.9425355e-08,1.5992317e-05,6.5581435e-07,0.9968707
82,"As Iglesias is a composer and lyricist, some of his songs being of his own authorship and composition, on 23 April 2013, he was inducted into the Latin Songwriters Hall of Fame, alongside Armando Manzanero and José Feliciano.",3.147422e-05,2.8802217e-05,0.0010261984,0.92550695,0.0005842481,0.072822206
83,"In 2015, Iglesias was slated to perform a complete concert for the first time with his son Julio Iglesias Jr. in a tour in Romania, on 22 May at Sala Polivalentă in Cluj-Napoca and 2 July at Sala Palatului in the capital city, Bucharest.",0.004136596,0.00010199402,1.30335875e-05,0.09692766,0.89846206,0.0003585946
84,Berklee College of Music awarded Iglesias an Honorary Doctorate in May 2015 in recognition of his achievements and influence in music and for his enduring contribution to American and international culture.,1.2868088e-07,1.5028034e-10,0.0042541767,1.1541882e-06,9.184032e-08,0.9957444
85,==,0.12487869,0.21344112,0.0013716009,0.001702674,0.6586059,7.902398e-08
86,Personal life ==,0.0025544034,0.00046550538,4.8373266e-07,1.0761044e-09,8.063284e-05,0.996899
87,"On 29 January 1971, Iglesias married Isabel Preysler, a Filipina television host.",7.082287e-08,2.5339701e-09,9.125703e-12,2.8772384e-11,0.9997763,0.00022357593
88,"Preysler, a Filipina of Spanish ancestry, was also a member of the wealthy and aristocratic Pérez de Tagle family.",9.717158e-05,9.1222464e-05,3.67838e-06,1.3625928e-08,0.99967635,0.00013153284
89,"The couple had three children: Chábeli (born 3 September 1971), a socialite; Julio Jr. (born 25 February 1973), a singer; and Enrique (born 8 May 1975), an internationally successful singer-songwriter, actor, and record producer.",1.5740923e-06,1.295965e-07,2.7614837e-09,5.2199394e-11,0.0008382327,0.99916005
90,"In the 1970s, Iglesias and his family were extensively depicted on the front pages of international newspapers and magazines.",2.7823291e-06,7.149266e-07,6.144644e-08,5.5551638e-08,0.2916561,0.7083403
91,The marriage ended in divorce in 1979.,2.9123846e-11,9.472974e-10,1.4382406e-12,1.8330333e-09,0.00405763,0.9959423
92,The couple also applied for marriage annulment by the Catholic Church which was granted in 1980.,9.943343e-07,9.120565e-09,1.5425171e-06,2.909872e-07,0.20724992,0.79274726
93,"Whenever Iglesias was not on tour, he spent his time at his Miami residence, purchased in 1978 for $650,000.",0.0010797346,2.8678167e-05,0.0019243737,0.0003173928,0.014371354,0.98227847
94,"The mansion on the private Indian Creek Island, whose interior design was made by Virginia Sipl, was placed on the market in 2006 for a quoted $28 million, making it one of the ""Ten Most Expensive Homes in the South"" in 2006 according to Forbes magazine.",0.0009438745,9.582177e-07,0.42106712,5.770347e-05,0.001235549,0.5766948
95,"After his divorce, Iglesias lived with Dutch model Miranda Rijnsburger, 22 years his junior, whom he married on 26 August 2010 in a small church in Marbella, Spain.",8.806322e-09,5.7769553e-06,4.7452776e-08,1.536467e-11,0.9084238,0.09157032
96,"They had five children: Miguel Alejandro Iglesias (born 7 September 1997), Rodrigo Iglesias (born 3 April 1999), twins Cristina and Victoria Iglesias (born 1 May 2001), and Guillermo Iglesias (born 5 May 2007).",0.0029489493,1.2955338e-05,8.651685e-07,6.297528e-08,0.75030583,0.24673136
97,"They took up residence in the Dominican Republic, where Iglesias had acquired several hotel complexes, as well as the Punta Cana International Airport, which he acquired jointly with other investors, including fashion designer Oscar de la Renta.",3.1269643e-05,0.46117336,0.5365115,1.0088551e-07,0.0022809827,2.7659614e-06
98,"On 19 December 2005, Iglesias's father died of a heart attack at the age of 90.",2.4064958e-12,5.1427338e-11,1.0676434e-09,1.6717339e-10,1.0,1.883446e-10
99,"A week before his father's death, it became known that Ronna Keitt, his father's 42-year-old wife, was pregnant with their second child.",7.521322e-12,6.228154e-05,4.6279078e-05,4.152885e-08,0.9998914,2.9893612e-09
100,"Their first child, Jaime, had been born on 18 May 2004.",5.4825914e-08,0.0039604893,3.9173217e-05,1.2717858e-06,0.9958677,0.00013134474
101,"The second child, Ruth, was born on 26 July 2006.",9.457453e-10,4.850524e-05,5.177095e-06,0.005741794,0.99420434,2.9410293e-07
102,"In 2008, after his house in Indian Creek did not sell at his asking price, he ordered it razed and said he planned to build another on the lot.",1.1840727e-07,4.180024e-06,0.9999858,1.7703998e-09,5.90699e-06,3.894279e-06
103,"In 2012, he purchased the property next door for $15 million and announced that he planned to build a new home on the combined properties.",0.20079625,8.9845315e-05,0.62434137,1.1954769e-05,0.17475788,2.6874886e-06
104,"In 2020, he agreed to sell it to Jared Kushner and his wife Ivanka Trump, a daughter of then-U.S. President Donald Trump.",0.12316099,0.015567115,0.85059124,9.368336e-10,0.010617247,6.345742e-05
105,"In 2019, a court in Valencia ruled that Iglesias is the father of Javier Sánchez, son of Portuguese former dancer Maria Edite Santos.",6.5091444e-07,3.9448343e-05,5.7847883e-05,1.6491614e-07,0.81194717,0.18795471
106,"Sánchez had been pursuing his paternity suit in court since 1992, arguing that he was conceived when his mother allegedly had an affair with Iglesias in the Catalonia region in July 1975.",1.0085568e-05,0.4804925,0.00011762522,6.04808e-05,0.13391893,0.38540033
107,"The singer, who rejected all those claims, had refused on several occasions to undergo a paternity test.",2.30495e-06,0.99118704,0.008226681,1.799574e-06,0.00058057095,1.6555969e-06
108,"The Sánchez legal team argued that DNA evidence obtained in the US by an investigator proved their case; however, the DNA sample did not come directly from the singer but was collected from ""a bottle of water"" used by his son, Julio Iglesias Jr, which he left on a Miami beach.",4.100967e-11,0.9998591,5.77631e-08,9.601001e-12,0.00014057389,3.744936e-07
109,"The presiding judge, José Miguel Bort, rejected this DNA claim but ruled in favor of Sánchez.",1.9565079e-10,0.9999931,2.8763106e-10,6.427459e-11,3.4019538e-07,6.551515e-06
110,"Delivering the verdict, judge Bort said his decision was reached in part because of the ""resemblance between the two men"" and on the basis of Edite's testimony.",1.1227401e-14,0.9999995,1.4140907e-07,7.684425e-15,6.538144e-10,3.681133e-07
111,"Iglesias appealed the verdict and the Provincial Court of Valencia reversed judge Bort's ruling, declaring it canot be proven that Sánchez is the son of Iglesias.",5.1738297e-08,0.7090504,0.00024035032,5.0278235e-09,0.2861128,0.004596325
112,"The matter was taken to the Supreme Court of the country, and, in April 2021, the Court dismissed the claims made by Sánchez, imposing also the costs of the process on him.",0.10195886,0.4953611,0.028743612,1.5307264e-06,0.00024331886,0.3736916
113,==,0.12487881,0.21344115,0.0013716004,0.0017026734,0.65860564,7.902403e-08
114,Honours and Awards ==,6.2639725e-07,3.8374973e-11,3.7292084e-05,6.148993e-11,1.3277109e-13,0.9999621
115,===,0.0018068925,2.1080356e-05,2.7498634e-05,0.00044118572,0.9977034,1.2509472e-11
116,Honours =,9.831309e-05,4.5936166e-09,0.9345544,0.0014534895,1.2668717e-10,0.0638937
117,==,0.12487881,0.21344115,0.0013716004,0.0017026734,0.65860564,7.902403e-08
118,====,0.00082811393,4.9745104e-05,1.64031e-05,9.948556e-06,0.9990958,1.3139814e-10
119,Spanish National Honours ==,0.6222921,2.5384763e-09,1.2204439e-05,9.489787e-07,9.664594e-08,0.37769467
120,==,0.12487881,0.21344115,0.0013716004,0.0017026734,0.65860564,7.902403e-08
121,Gold Medal of Merit in the Fine Arts,0.00038801925,4.79938e-09,2.9404522e-05,5.0275418e-08,3.6672304e-06,0.9995789
122,Gold Medal of the Community of Madrid,2.0360769e-09,7.692359e-09,1.0299823e-07,1.6628591e-06,0.0025047262,0.9974935
123,====,0.0008281143,4.9745104e-05,1.64031e-05,9.948547e-06,0.9990958,1.3139814e-10
124,Foreign Honours ==,0.020549674,1.969762e-07,0.9774415,2.541637e-08,3.955471e-08,0.0020087291
125,==,0.12487874,0.2134411,0.0013716008,0.0017026729,0.6586058,7.902397e-08
126,France,0.16172902,0.033636026,0.0141934715,0.7738688,0.016553147,1.9571056e-05
127,Knight of the Legion of Honor,2.276497e-05,0.0004855538,0.00087596284,4.1091214e-05,4.510113e-05,0.99852955
128,Medal of the City of Paris,5.7181586e-07,1.9060555e-09,1.657993e-07,3.8244865e-09,7.55683e-05,0.9999237
129,==,0.12487874,0.2134411,0.0013716008,0.0017026729,0.6586058,7.902397e-08
130,Discography ==,0.9999943,1.2030798e-08,8.35843e-10,5.3618996e-06,2.814776e-09,3.2554004e-07
131,==,0.124878764,0.21344112,0.0013716007,0.0017026727,0.65860575,7.902396e-08
132,Awards and nominations ==,4.2284832e-06,9.654204e-10,3.5180038e-12,1.5419893e-10,8.16167e-15,0.9999958
133,==,0.12487874,0.2134411,0.0013716008,0.0017026729,0.6586058,7.902397e-08
134,References ==,2.5077099e-05,0.01809889,8.965034e-05,0.06194966,4.4582564e-09,0.9198367
135,==,0.12487874,0.2134411,0.0013716008,0.0017026729,0.6586058,7.902397e-08
136,External links ==,0.00023526642,1.3075892e-06,6.913511e-10,2.5650536e-07,3.6421334e-08,0.9997632
137,Official website,0.001225552,4.507715e-12,3.0528519e-10,4.2257152e-08,5.405287e-12,0.99877435
138,Musicadelrecuerdo.com Musica de Julio Iglesias,1.6232712e-05,1.0047573e-05,2.403172e-07,1.5596686e-06,4.696289e-05,0.9999249
139,Julio Iglesias at IMDb,0.06322216,1.8283468e-05,7.8281545e-08,0.0005707904,0.0006814281,0.9355072
