,Sentence,Business meeting,Coincidence,Education,Music making,Personal life,Public celebration
127,"PopClips and MTV, Elephant Parts, and Television Parts ===",2.4924393e-06,0.4250864,0.00023530907,4.034278e-06,0.0021957671,0.572476
128,"During this time, Nesmith created a video clip for ""Rio"", which helped spur Nesmith's creation of a television program called PopClips for the Nickelodeon cable network.",0.6502264,0.05326098,1.4017685e-06,0.19504303,0.055538684,0.04592947
129,"In 1980, PopClips was sold to the Time Warner/Amex consortium.",0.00010192149,0.00016354528,3.0939143e-05,1.8381113e-05,0.039272845,0.9604123
130,Time Warner/Amex developed PopClips into the MTV network.,0.06644785,0.010438752,0.00015802472,0.00034105615,0.0002415866,0.9223727
131,"Nesmith won the first Grammy Award given for (long-form) Music-Video in 1982, for his hour-long Elephant Parts and also had a short-lived series on NBC inspired by the video called Michael Nesmith in Television Parts.",0.0006775583,0.00036413263,4.633269e-08,7.071981e-05,1.1056532e-07,0.9988875
132,"Television Parts included many other artists who were unknown at the time, but went on to become major stars in their own right.",0.22151646,0.7691273,1.2102759e-06,0.009351333,8.6435264e-08,3.56884e-06
133,"Jay Leno, Jerry Seinfeld, Garry Shandling, Whoopi Goldberg, and Arsenio Hall all became well-known artists after their appearances on Nesmith's show.",0.08966979,0.91026914,1.4970168e-05,2.1055565e-05,5.058248e-10,2.5084879e-05
134,The concept of the show was to have comics render their stand-up routines into short comedy films much like the ones in Elephant Parts.,0.1160708,0.20110947,4.3246797e-05,0.68277013,4.4939433e-10,6.3319126e-06
135,"Nesmith assembled writers Jack Handey, William Martin, John Levenstein, and Michael Kaplan, along with directors William Dear (who had directed Elephant Parts) and Alan Myerson, as well as producer Ward Sylvester to create the show.",0.0005573467,2.3634711e-05,5.1027706e-07,0.99941826,2.8772124e-07,7.803059e-11
136,The half-hour show ran for eight episodes in the summer of 1985 on NBC Thursday nights in prime time.,0.29285657,0.004181249,1.4875063e-08,0.0001967413,0.0008375916,0.7019278
137,===,0.0018068925,2.1080356e-05,2.7498634e-05,0.00044118572,0.9977034,1.2509472e-11
138,Pacific Arts and legal dispute,0.00029040757,1.3272129e-05,0.9961934,0.0004905056,2.2999936e-06,0.00301021
139,===,0.0018068915,2.1080356e-05,2.749861e-05,0.00044118572,0.9977034,1.2509472e-11
140,"Nesmith formed the Pacific Arts Corporation, Inc. in  1974 to manage and develop media projects.",0.3429928,5.8325463e-06,6.490757e-09,0.655942,2.7961266e-07,0.0010590269
141,"Pacific Arts Video became a pioneer in the home video market, producing and distributing a wide variety of videotaped programs, although the company eventually ceased operations after an acrimonious contract dispute with PBS over home video licensing rights and payments for several series, including Ken Burns' The Civil War.",0.027156893,0.00012933441,0.9055515,0.044739343,3.7506987e-07,0.022422673
142,The dispute escalated into a lawsuit that went to jury trial in federal court in Los Angeles.,0.0002506359,0.21619326,0.0017960094,2.7160343e-09,8.60392e-06,0.7817515
143,"On February 3, 1999, a jury awarded Nesmith and his company Pacific Arts $48.875 million in compensatory and punitive damages, prompting his widely quoted comment, ""It's like finding your grandmother stealing your stereo.",0.029276991,0.50287473,0.0013539143,1.5251825e-10,1.8225432e-08,0.46649438
144,"You're happy to get your stereo back, but it's sad to find out your grandmother is a thief.""",3.0244408e-07,9.514045e-05,0.9925211,7.031586e-09,0.0073831584,2.1257452e-07
145,"PBS appealed the ruling, but the appeal never reached court and a settlement was reached, with the amount paid to Pacific Arts and Nesmith kept confidential.",7.0522e-05,0.01800918,0.008278489,3.5297262e-10,4.4881024e-10,0.9736419
146,"Nesmith's current Pacific Arts project is Videoranch 3D, a virtual environment on the internet that hosts live performances at various virtual venues inside the ranch.",0.098191336,0.0009072156,0.0015801099,0.89821553,2.783323e-06,0.0011030894
147,"He performed live inside Videoranch 3D on May 25, 2009.",6.609363e-08,0.00014301851,2.570899e-07,0.99985564,1.23459545e-08,9.140091e-07
148,===,0.0018068925,2.1080356e-05,2.7498634e-05,0.00044118572,0.9977034,1.2509472e-11
149,Movies and books,0.00015125546,0.0005109913,0.80224305,0.00019452766,4.555546e-05,0.19685462
150,===,0.0018068925,2.1080356e-05,2.7498634e-05,0.00044118572,0.9977034,1.2509472e-11
151,"Nesmith was the executive producer for the films Repo Man, Tapeheads, and Timerider: The Adventure of Lyle Swann, as well as his own solo recording and film projects.",0.9997209,8.568934e-07,8.042863e-07,3.0947467e-05,0.00024646838,6.1256313e-12
152,"In 1998, Nesmith published his first novel, The Long Sandy Hair of Neftoon Zamora.",0.87877566,4.925611e-07,1.3507559e-05,0.00050413737,0.1206713,3.4850524e-05
153,It was developed originally as an online project and was later published as a hardcover book by St Martin's Press.,1.698638e-12,1.7502896e-07,0.008717966,3.110451e-07,2.0768678e-09,0.9912815
154,"Nesmith's second novel, The America Gene, was released in July 2009 as an online download from Videoranch.com.",0.049236443,0.00017638427,8.107013e-05,0.046024576,0.8923135,0.01216798
155,===,0.0018068925,2.1080356e-05,2.7498634e-05,0.00044118572,0.9977034,1.2509472e-11
156,Recent history =,0.8052377,0.0005131934,0.00013343118,0.1940996,3.229065e-09,1.615205e-05
157,==,0.124878764,0.21344112,0.0013716007,0.0017026727,0.65860575,7.902396e-08
158,"In the early 1980s, Nesmith teamed with satirist P. J. O'Rourke to ride his vehicle Timerider in the annual Baja 1000 off-road race.",0.005349634,0.04284471,2.0834734e-06,3.141256e-06,0.0238275,0.9279729
159,This is chronicled in O'Rourke's 2009 book Driving Like Crazy.,5.0763845e-11,0.0052167876,4.7980495e-09,7.154268e-06,0.00077974616,0.99399626
160,"During the 1990s, Nesmith, as trustee and president of the Gihon Foundation, hosted the Council on Ideas, a gathering of intellectuals from different fields who were asked to identify the most important issues of their day and publish the result.",0.0011809849,0.0006237025,0.013872672,1.4664903e-05,2.7351146e-07,0.9843077
161,The foundation ceased the program in 2000 and started a new program for the performing arts.,0.30526933,0.0100576775,0.52460605,0.0017909248,0.033638325,0.12463766
162,"Nesmith also spent a decade as a board of trustees member, nominating member and vice-chair of the American Film Institute.",0.9999573,6.0619204e-10,4.2725504e-05,3.2046266e-08,4.610769e-10,6.1504335e-10
163,"In 1992, Nesmith undertook a concert tour of North America to promote the CD release of his RCA solo albums (although he included the song ""Rio"" from the album From a Radio Engine to the Photon Wing).",0.99635625,3.7241614e-07,7.4877225e-06,0.0035702328,2.2917398e-08,6.565632e-05
164,The concert tour ended at the Britt Festival in Oregon.,0.10589978,0.011518162,2.1671662e-08,0.018376408,0.86416954,3.6052814e-05
165,"A video and CD, both entitled Live at the Britt Festival, were released capturing the 1992 concert.",8.079311e-08,0.9552182,1.1354151e-07,6.5029944e-06,3.2556235e-09,0.044775076
166,Nesmith continues to record and release his own music.,0.99575055,3.163095e-11,3.2442436e-08,0.004249445,3.120994e-08,5.921639e-14
167,"His most recent album, Rays, was released in 2006.",0.0010794305,4.0679775e-09,0.00013813771,0.998782,3.7189045e-07,6.6127626e-08
168,"In 2011, he returned to producing, working with blues singer and guitarist Carolyn Wonderland.",0.000286365,2.606146e-07,0.0053831697,0.99433017,7.465159e-10,4.688803e-11
169,"Nesmith produced Wonderland's version of Robert Johnson's ""I Believe I'll",9.3047635e-07,0.00049185765,1.5980809e-06,0.99949014,1.5475718e-05,6.326598e-10
170,"Dust My Broom"" on her album Peace Meal.",0.23590924,0.040837325,0.012237221,0.69553643,1.8979946e-06,0.01547791
171,"Wonderland married writer-comedian A. Whitney Brown on March 4, 2011, in a ceremony officiated by Nesmith.",6.2882116e-08,8.892907e-05,2.9502845e-12,4.6076316e-08,3.9734023e-06,0.999907
172,"In 2012, Nesmith briefly toured Europe prior to rejoining the Monkees for their tours of the United States.",0.99894196,0.0005602046,0.0004976366,2.6154484e-07,1.0320245e-08,2.4945182e-10
173,"Intermixing the Monkees concerts, Nesmith also launched solo tours of the U.S. Unlike his 1992 U.S. tour, which predominantly featured music from his RCA recordings, Nesmith stated that his 2013 tour would feature songs he considers ""thematic, chronological and most often requested by fans"".",0.9998344,0.0001389286,2.2755059e-05,3.7753798e-06,2.2524908e-08,2.77598e-08
174,"Chris Scruggs, grandson of Earl Scruggs, replaced the late Red Rhodes on the steel guitar.",2.5788015e-07,1.2131156e-06,1.9916042e-06,0.0023515674,0.99764496,1.140917e-10
175,"The tour was captured on a forthcoming live album, Movies Of The Mind.",0.4018751,0.5637214,4.5531673e-05,0.019055309,6.263827e-06,0.015296377
176,"In 2014, he guest-starred in season four, episode 9 of the IFC comedy series Portlandia in the fictitious role of the father of the mayor of Portland, Oregon.",1.10190665e-08,0.0021274404,0.00022700964,0.88978505,0.107745625,0.00011485905
177,"In 2017, he released a memoir and companion ""soundtrack"" album titled Infinite Tuesday: An Autobiographical Riff.",0.77414036,0.0019469616,1.645011e-07,0.21512379,1.4095109e-08,0.008788734
178,"In 2018, he announced that he would be doing a five-date tour of California with a revamped version of The First National Band, including a date at The Troubadour, where he performed before The Monkees.",0.99679524,0.0021761216,0.0005444058,0.00048434426,1.0945396e-08,2.0279192e-08
179,"On February 20, a tour was announced as ""The Monkees Present: The Mike and Micky Show"", their first tour as a duo.",0.9998845,0.000110976005,1.3754043e-07,4.0059194e-06,3.2921528e-09,3.5060467e-07
180,"The pair will play Monkees music and promote the tour under the Monkees banner, but Nesmith stated, ""there's no pretense there about Micky and I",0.8787964,0.070526145,9.009566e-09,0.050590776,8.6176515e-05,4.0831046e-07
181,[sic] being the Monkees.,0.5365544,0.4627441,0.0005644476,0.00012585249,1.8314711e-06,9.261959e-06
182,"We're not.""",1.7420475e-11,9.1062367e-07,6.43335e-08,1.3489176e-06,0.99999774,1.4837504e-11
183,"The tour was cut short in June 2018, with four shows left unplayed, due to Nesmith having a “minor health issue”;  Dolenz and he rescheduled the unplayed concerts plus adding several other including an Australian tour in 2019.",0.61480594,6.060317e-06,8.806341e-07,0.38518712,1.9142012e-09,7.6612225e-13
184,After recovering from his health scare Michael Nesmith and the First National Band Redux went on a tour of the U. S. with mostly the same lineup and setlist as the southern California shows.,0.0011768568,0.030806618,0.00040895364,0.9625299,0.00507771,1.1912491e-14
185,"In 2019 Nesmith toured focusing on his 1972 album, And the Hits Just Keep on Comin', in a two piece configuration with pedal steel player Pete Finney, the first time in this format since 1974 with Red Rhodes.",8.832201e-05,1.8895354e-07,5.103468e-11,0.9999114,1.20208785e-08,2.2322543e-15
186,Nesmith was also joined by special guests Ben Gibbard and Scott McCaughey on opening night in Seattle.,0.6414127,0.00021924159,4.891406e-09,0.35836744,4.363234e-07,1.236061e-07
187,==,0.124878764,0.21344112,0.0013716007,0.0017026727,0.65860575,7.902396e-08
188,Other appearances ==,6.686187e-05,0.99752146,7.1036617e-09,8.704087e-05,3.4741554e-06,0.0023211953
189,Nesmith had a cameo appearance as a taxi driver in the Whoopi Goldberg film Burglar.,0.973407,0.0122635905,8.929719e-06,0.014296398,2.262437e-05,1.4858216e-06
190,"He had cameo appearances in his own films including Timerider: The Adventure of Lyle Swann (Race Official), Repo Man (Rabbi), and Tapeheads (Water Man).",6.6313146e-06,0.9991749,3.073568e-08,0.00058606296,0.00023243963,2.3924104e-08
191,"In a promotional video to support Pacific Arts's video release of Tapeheads, Nesmith was introduced with a voice-over making fun of his Monkees persona.",0.6730135,0.32649696,0.00048079045,3.25668e-08,5.043827e-10,8.709203e-06
192,"The narration teases Nesmith, who approaches the camera to speak, poking fun at his ""missing hat"".",0.96964014,0.030315656,4.3327862e-05,2.6326894e-08,8.065144e-07,1.9735797e-09
193,An opportunistic lookalike from the U.S. cashed in on his similarity to Nesmith by appearing on talk shows and doing interviews in Australia during the 1980s.,3.0642455e-05,0.9999671,1.8341129e-06,5.2710427e-09,1.1999128e-07,3.8937316e-07
194,"The scam was successful, the lookalike being far enough from America to avoid detection as a fraud (which was more likely in the U.S., where the real Nesmith had made many media and show-business acquaintances).",1.2304266e-05,0.99898237,0.0009336735,8.946747e-08,5.654122e-06,6.600251e-05
195,"An entertaining interviewee, the impersonator's charade was not discovered until after he had vanished from the public eye.",3.4069763e-12,0.0005016244,9.389958e-05,4.911638e-11,9.2553167e-11,0.99940443
196,"The impostor, Barry Faulkner, who had pulled various fraudulent scams for 40 years, was finally apprehended and sent to jail in 2009.",0.00018108968,0.018366331,0.38202342,1.5247818e-05,0.0003417141,0.5990722
197,==,0.124878764,0.21344112,0.0013716007,0.0017026727,0.65860575,7.902396e-08
198,Personal life ==,0.002554406,0.00046550567,4.8373266e-07,1.0761044e-09,8.063284e-05,0.996899
199,Nesmith has been married three times and has four children.,0.0008117806,1.2729211e-08,5.826543e-10,3.7363827e-07,0.99914837,3.9482442e-05
200,"He met his first wife, Phyllis Ann Barbour in 1964, while at San Antonio College.",2.2203222e-08,0.18913846,5.0967185e-07,1.2233512e-09,0.00011574657,0.8107453
201,"Together, they had three children: Christian, born in 1965; Jonathan, born in 1968; and Jessica, born in 1970.",2.3330742e-06,0.00037404292,1.4478127e-08,1.489324e-05,0.7976543,0.20195441
202,Nesmith and Barbour divorced in 1972.,0.00693375,1.4816097e-05,5.0461773e-09,1.03131415e-05,0.1082686,0.88477254
203,"Nesmith also has a son, Jason, born in August 1968 to Nurit Wilde, whom he met while working on The Monkees.",0.0217755,1.3227077e-05,4.840446e-07,9.80583e-08,0.9782104,3.158769e-07
204,"In 1976, he married his second wife, Kathryn Bild.",2.2222375e-09,4.985822e-05,5.742709e-10,1.087458e-08,0.9990639,0.0008862031
205,"In 2000, he married his third wife, Victoria Kennedy, but the marriage ended in divorce in 2011.",0.112341955,8.159977e-06,4.4220517e-08,1.1664725e-06,0.22360365,0.664045
206,"When the Monkees' TV series ended in 1968, Nesmith enrolled part-time at the University of California, Los Angeles, where he studied American history and music history.",0.9481521,2.4541472e-07,0.051847655,3.3755077e-09,2.0296878e-10,1.8896378e-10
207,"In 1973, Nesmith founded the Countryside Records label with Jac Holzman, the founder of Elektra Records.",0.99997294,1.6472491e-08,4.253044e-08,3.009954e-07,2.6657894e-05,2.2879987e-09
208,"In 1974, Nesmith started Pacific Arts Records and released what he called ""a book with a soundtrack"", titled The Prison, as the company's first release.",0.98713744,1.9800677e-08,2.1228493e-11,0.012862536,4.4323695e-08,1.6204564e-10
209,===,0.0018068925,2.1080356e-05,2.7498634e-05,0.00044118572,0.9977034,1.2509472e-11
210,Health issues ===,0.022066195,0.0009842445,1.2579221e-08,2.1374053e-06,0.97660387,0.00034355538
211,"Nesmith was forced to cancel the last four dates of his 2018 tour with Micky Dolenz due to a ""minor health scare"".",0.99999905,1.0485076e-08,3.9830306e-11,9.4057026e-07,1.7204626e-09,4.736965e-14
212,"However, in an interview with Rolling Stone published on July 26 of that year, Nesmith said he had undergone quadruple bypass heart surgery, and had been hospitalized for over a month.",0.98172426,0.01603863,4.7008543e-05,3.028834e-07,1.613658e-05,0.0021736543
213,==,0.124878764,0.21344112,0.0013716007,0.0017026727,0.65860575,7.902396e-08
214,Discography ==,0.9999943,1.2030798e-08,8.3584145e-10,5.3618996e-06,2.8147706e-09,3.2553942e-07
215,==,0.124878764,0.21344112,0.0013716007,0.0017026727,0.65860575,7.902396e-08
216,Filmography ==,0.99997985,3.8154094e-10,9.0419326e-07,1.224641e-10,4.517803e-06,1.4692185e-05
217,===,0.0018068925,2.1080356e-05,2.7498634e-05,0.00044118572,0.9977034,1.2509472e-11
218,Television =,0.00025781558,9.350069e-07,5.8261732e-05,2.0610311e-07,0.0047286637,0.99495405
219,==,0.124878764,0.21344112,0.0013716007,0.0017026727,0.65860575,7.902396e-08
220,===,0.0018068925,2.1080356e-05,2.7498634e-05,0.00044118572,0.9977034,1.2509472e-11
221,Films ===,0.000111359484,0.0012811136,4.3347463e-08,2.0629207e-06,0.45267862,0.5459268
222,===,0.0018068925,2.1080356e-05,2.7498634e-05,0.00044118572,0.9977034,1.2509472e-11
223,Home video =,0.0013022838,4.0955555e-07,3.6375608e-10,3.947106e-09,7.287368e-06,0.99869007
224,==,0.124878764,0.21344112,0.0013716007,0.0017026727,0.65860575,7.902396e-08
225,==,0.124878764,0.21344112,0.0013716007,0.0017026727,0.65860575,7.902396e-08
226,Books ==,1.5036712e-10,0.00014521737,0.9997936,2.5393868e-11,8.250156e-09,6.126449e-05
227,(n.b. books proper – not including The Prison and The Garden)The Long Sandy Hair of Neftoon Zamora (1998),0.0022668194,0.020715013,7.3689343e-06,7.4531266e-07,0.15342401,0.8235861
228,The America Gene (2009),5.009019e-05,0.00011314005,5.844526e-05,2.1460065e-07,0.9990138,0.0007643172
229,Infinite Tuesday: An Autobiographical Riff (2017),0.9149704,0.032954957,1.8169314e-07,0.0436035,0.00016012519,0.0083108395
230,===,0.0018068925,2.1080356e-05,2.7498634e-05,0.00044118572,0.9977034,1.2509472e-11
231,Audio books ===,1.2035731e-10,3.1612706e-06,0.24954896,3.6355388e-07,3.7537188e-08,0.7504475
232,The Long Sandy Hair of Neftoon Zamora (2004) (with Nesmith reading the story),0.069139384,0.0012620648,1.966845e-05,0.0035884506,0.92462546,0.0013650027
233,Infinite Tuesday: An Autobiographical Riff (2017) (narrated by Nesmith),0.99632734,6.5576173e-06,1.1641602e-08,0.0036636984,5.243935e-07,1.8886009e-06
234,==,0.12487865,0.2134413,0.001371599,0.0017026742,0.65860564,7.902395e-08
235,References ==,2.5077119e-05,0.018098911,8.965051e-05,0.06194974,4.4582813e-09,0.9198366
236,==,0.124878764,0.21344112,0.0013716007,0.0017026727,0.65860575,7.902396e-08
237,External links ==,0.00023526642,1.3075892e-06,6.913511e-10,2.5650536e-07,3.6421334e-08,0.9997632
238,"Videoranch, a Michael Nesmith company",0.033963885,0.22238162,0.3378135,0.11903967,0.28577518,0.0010262004
239,Michael Nesmith at IMDb,0.9993106,1.6894504e-08,9.796797e-08,9.230752e-06,0.00068010844,8.384491e-11
240,Article in Wired magazine about Michael Nesmith and the Council on Ideas,0.7916683,0.14183916,0.052181147,2.4137526e-06,1.7629659e-06,0.014307206
241,Michael Nesmith biography,0.919217,1.28633815e-08,2.9124785e-09,2.5203732e-08,0.08078274,2.2607536e-07
242,(Unofficial),0.021540726,6.026489e-10,1.7620022e-07,0.024026146,1.1160049e-05,0.9544218
243,Michael Nesmith home page,0.99988747,2.3523943e-09,4.9614646e-09,1.1109619e-08,0.00011217489,3.413765e-07
244,SWINDLE Magazine interview,0.00020651845,0.98141426,0.0011957714,4.6688387e-12,2.6005307e-07,0.017183183
245,Michael Nesmith interviewed on the Pop Chronicles (1969),0.9959353,0.0036427486,6.7967543e-09,1.1291285e-07,0.00036503765,5.6737423e-05
246,Michael Nesmith: Overcoming The Monkees at NPR.com,0.8257242,0.13402589,0.038748868,2.8752174e-09,2.5538058e-05,0.0014756034
247,Nesmith at Allmusic.com,0.028742412,1.1048724e-06,3.161232e-05,0.96280974,0.008415128,2.322638e-09
248,Michael Nesmith discography at Discogs,0.99997616,8.2450714e-07,6.980427e-08,2.2171442e-05,6.230922e-07,9.2951154e-08
249,Michael Nesmith interview 2013,0.9584369,0.04154911,2.0068621e-06,2.9169345e-09,6.6283513e-07,1.1247824e-05
250,Michael Nesmith Interview NAMM Oral History Library (2019),0.78602535,0.21371636,6.163949e-05,1.6904549e-08,0.000164704,3.1968026e-05
