,Sentence,Business meeting,Coincidence,Education,Music making,Personal life,Public celebration
0,"Robert Michael Nesmith (born December 30, 1942) is an American musician, songwriter, actor, producer, novelist, businessman, and philanthropist, best known as a member of the pop rock band the Monkees and co-star of the TV series The Monkees (1966–1968).",0.12208937,0.0009801236,0.0022424986,0.0001502096,0.8742919,0.00024589343
1,"Nesmith's songwriting credits include ""Different Drum"" (sung by Linda Ronstadt with the Stone Poneys).",0.0004043457,0.00022323456,0.004351587,0.9948237,0.00019712409,7.0385924e-12
2,"After the break-up of the Monkees, Nesmith continued his successful songwriting and performing career, first with the seminal country rock group the First National Band, with whom he had a top-40 hit, ""Joanne"", and then as a solo artist.",0.99999726,4.51951e-10,2.8106293e-11,2.7455858e-06,1.0815767e-11,1.5932877e-13
3,"He plays a 12-string guitar, performing on a custom-built Gretsch electric during his time with the Monkees and various 12-string acoustic models during his post-Monkees career.",0.46474054,3.4550908e-06,0.5352491,3.101742e-07,6.566385e-06,2.6528362e-08
4,He is also an executive producer of the cult film Repo Man (1984).,0.83605236,3.59027e-06,0.10912195,0.05317891,0.001309277,0.00033393776
5,"In 1981, Nesmith won the first Grammy Award given for Video of the Year for his hour-long television show, Elephant Parts.",2.3038288e-05,5.1836647e-05,2.479721e-10,1.1457642e-07,1.6257389e-09,0.999925
6,==,0.124878764,0.21344112,0.0013716007,0.0017026727,0.65860575,7.902396e-08
7,Early life ==,0.0019447302,0.14564976,0.022118486,4.7269286e-06,0.8208643,0.009417957
8,"Nesmith was born in Houston, Texas, in 1942.",0.9984053,1.4395649e-10,2.3578409e-08,1.3914372e-09,0.0015946954,7.734701e-09
9,He is an only child; his parents Warren and Bette Nesmith (née McMurray) divorced when he was four.,1.194095e-05,2.699985e-09,1.977125e-07,6.666599e-06,0.99975115,0.0002299799
10,"His mother married Robert Graham in 1962, and they remained married until 1975.",3.555265e-05,4.8401403e-06,4.5287295e-11,0.00024917378,0.97295105,0.026759317
11,Nesmith and his mother moved to Dallas to be closer to her family.,2.8086106e-07,8.9113335e-08,4.2317128e-09,8.750531e-12,0.99999964,7.367195e-12
12,"She took temporary jobs ranging from clerical work to graphic design, eventually attaining the position of executive secretary at Texas Bank and Trust.",0.9801226,0.019454464,0.0004223974,2.4113632e-07,9.956401e-14,2.420404e-07
13,"When Nesmith was 13, his mother invented the typewriter correction fluid known commercially as Liquid Paper.",3.232062e-08,6.423198e-05,7.917462e-08,0.014606931,0.98532873,4.5221835e-08
14,"Over the next 25 years, she built the Liquid Paper Corporation into a multimillion-dollar international company, which she sold to Gillette in 1979 for $48 million.",0.0009651776,0.0027806323,0.022136072,1.5567928e-05,0.00020902649,0.97389346
15,She died a few months later at age 56.,2.1120302e-07,1.3758539e-08,0.22459427,1.528682e-06,0.7754037,2.9396833e-07
16,"Nesmith participated in choral and drama activities at Thomas Jefferson High School in Dallas, but he enlisted in the Air Force in 1960 without graduating.",0.85969394,4.856767e-08,8.6261425e-05,0.020741753,0.11946811,9.9877125e-06
17,"He completed basic training at Lackland Air Force Base in San Antonio, was trained as an aircraft mechanic at Sheppard Air Force Base in Wichita Falls, Texas, and then was permanently stationed at the Clinton-Sherman Air Force Base near Burns Flat, Oklahoma.",1.061076e-07,7.9732627e-07,8.282628e-06,0.00025585276,0.99973387,1.0769229e-06
18,He obtained a GED certificate and was honorably discharged in 1962.,0.0005812791,9.860887e-10,0.9983851,7.516243e-11,1.4271053e-06,0.001032279
19,"He enrolled in San Antonio College, where he met John Kuehne and began a musical collaboration.",1.0061076e-10,0.009603508,0.99038976,6.7388764e-06,2.0837973e-08,1.3481144e-10
20,"They won the first San Antonio College talent award, performing a mixture of standard folk songs and a few of Nesmith's original songs.",0.011905426,0.15936105,0.029308889,0.0013174826,0.001336752,0.7967704
21,"Nesmith began to write more songs and poetry, then he moved to Los Angeles and began singing in folk clubs around the city.",0.43081313,0.38974515,0.17877103,0.0006366336,9.237554e-06,2.4881623e-05
22,"He served as the ""Hootmaster"" for the Monday night hootenanny at The Troubadour, a West Hollywood nightclub that featured new artists.",1.2898473e-05,1.7443472e-08,4.7387264e-11,1.0227095e-06,3.6800473e-13,0.99998605
23,"Randy Sparks from the New Christy Minstrels offered Nesmith a publishing deal for his songs, and Barry Freedman told him about upcoming auditions for a new TV series called The Monkees.",0.994666,0.005284364,2.1753633e-06,4.7539295e-05,5.244837e-10,7.505181e-09
24,"In October 1965, Nesmith landed the role as the wool hat-wearing guitar player ""Mike"" in the show, which required real-life musical talent for writing, instrument playing, singing, and performing in live concerts as part of The Monkees band.",0.99997747,2.2145692e-05,2.2656584e-08,4.0988684e-07,1.5126271e-10,1.36744106e-11
25,"The Monkees television series aired from 1966 until 1968, and has developed a cult following over the years.",0.99999475,3.7890106e-06,1.4613902e-06,8.619604e-09,5.0025166e-09,4.2436884e-08
26,==,0.124878764,0.21344112,0.0013716007,0.0017026727,0.65860575,7.902396e-08
27,Career ==,1.0,4.755348e-13,2.1761231e-17,4.5407227e-19,9.245165e-14,7.685994e-12
28,"After a tour of duty in the Air Force, Nesmith was given a guitar as a Christmas present from his mother and stepfather.",0.00057448086,2.908056e-07,3.8497936e-05,3.5390777e-09,0.99938655,1.7228444e-07
29,"Learning as he went, he played solo and in a series of working bands, performing folk, country, and occasionally rock and roll.",1.7013374e-09,1.3973069e-07,0.9996333,0.00036023022,6.2685367e-06,2.1478304e-13
30,"His verse poems became the basis for song lyrics, and after moving to Los Angeles with Phyllis and friend John London, he signed a publishing deal for his songs.",0.02678218,0.95572567,0.01745154,1.8973793e-05,1.3948552e-07,2.138057e-05
31,"Nesmith's ""Mary, Mary"" was recorded by the Paul Butterfield Blues Band, while ""Different Drum"" and ""Some of Shelly's Blues"" were recorded by Linda Ronstadt and the Stone Poneys.",0.0014674627,0.00018081137,0.00015584745,0.9981888,7.0336537e-06,1.0650725e-11
32,"""Pretty Little Princess"", written in 1965, was recorded by Frankie Laine and released as a single in 1968 on ABC Records.",0.00892896,0.00015465423,1.2724318e-07,0.99090827,8.084189e-06,7.297779e-09
33,"Later, ""Some of Shelly's Blues"" and ""Propinquity (I've Just Begun to Care)"" were made popular by the Nitty Gritty Dirt Band on their 1970 album Uncle Charlie & His Dog Teddy.",7.434872e-06,0.0036882749,2.157004e-06,0.99630165,9.262881e-09,5.1355e-07
34,Nesmith began his recording career in 1963 by releasing a single on the Highness label.,0.9999999,1.0890068e-11,2.3574562e-09,1.6313001e-07,1.8398184e-11,9.794026e-15
35,"He followed this in 1965 with a one-off single released on Edan Records followed by two more recorded singles; one was titled ""The New Recruit"" under the name ""Michael Blessing"", released on Colpix Records, coincidentally also the label of Davy Jones, though they did not meet until the Monkees formed.",0.53803647,0.4605629,8.593813e-05,0.0012204201,3.9335668e-05,5.4886594e-05
36,===,0.0018068925,2.1080356e-05,2.7498634e-05,0.00044118572,0.9977034,1.2509472e-11
37,The Monkees ===,0.050327316,0.93641657,0.01068675,0.0013829845,0.0011636832,2.2688786e-05
38,"From 1965 to early 1970, Nesmith was a member of the television pop-rock band the Monkees, created for the television situation comedy of the same name.",0.9999958,4.043229e-06,5.4231098e-08,1.11733094e-07,6.719597e-09,3.858464e-11
39,Nesmith won his role largely by appearing nonchalant when he auditioned.,0.32776472,0.6719403,1.5799604e-07,0.0002542244,4.038682e-05,1.4715157e-07
40,"He rode his motorcycle to the audition, and wore a wool hat to keep his hair out of his eyes; producers Bob Rafelson and Bert Schneider remembered the ""wool hat"" guy, and called Nesmith back.",0.99921703,0.00077268266,4.583074e-06,1.9904547e-07,4.9181162e-06,6.3238906e-07
41,"Once he was cast, Screen Gems bought his songs so they could be used in the show.",0.0009853521,0.64774275,0.017281014,0.33399093,3.6194752e-11,4.2068216e-09
42,"Many of the songs Nesmith wrote for the Monkees, such as ""The Girl I Knew Somewhere"", ""Mary, Mary"", and ""Listen to the Band"", became minor hits.",5.651921e-07,0.9991084,2.7795493e-06,0.00088831224,7.333909e-11,1.0680961e-13
43,"One song he wrote, ""You Just May Be the One"", is in mixed meter, interspersing 5/4 bars into an otherwise 4/4 structure.",2.8615643e-09,0.6506233,1.1862302e-08,0.34933394,1.4453791e-05,2.8335227e-05
44,"As part of a promotional deal, Gretsch guitar company built a one-off, natural-finish, 12-string electric guitar for Nesmith when he was performing with the Monkees.",0.9996977,3.356597e-06,6.274721e-05,1.3568729e-07,0.00023605104,5.2237624e-08
45,"The custom-made guitar was frequently cited at that time as being worth $5,000 (the equivalent of $36,500 in 2018), which was undoubtedly inflated for publicity purposes.",0.011539258,0.2312814,0.0009793068,0.10194189,8.493438e-06,0.6542496
46,"He earlier played a customized Gretsch 12-string, which had originally been a six-string model.",0.0007639439,0.12862559,0.001853205,0.8670322,0.001722548,2.5673612e-06
47,"Nesmith used this guitar for his appearances on the television series, as well as the Monkees' live appearances in 1966 and 1967.",0.9561625,0.04160319,0.0018138582,0.00042051572,1.2200588e-08,2.199964e-09
48,"Beginning in 1968, Nesmith used a white six-string Gibson SG Custom for his live appearances with the Monkees.",0.9965395,0.0012616477,0.0020036863,7.1841314e-05,0.00012297546,3.902396e-07
49,"He used that guitar in their motion picture Head for the live version of ""Circle Sky"", and also for the final original Monkees tour in 1969.",0.5695946,0.38333726,0.046559058,0.0005089597,7.555017e-09,3.534732e-08
50,"In a post on his Facebook page in 2011, Nesmith reported that both guitars were stolen in the early 1970s.",0.00055188313,0.023758624,0.9754313,0.0002509037,4.0711475e-06,3.1558338e-06
51,"As with the other Monkees, Nesmith came to be frustrated by the band's manufactured image.",0.97294396,0.027034128,2.1160093e-05,1.189596e-07,1.694946e-07,5.336343e-07
52,Nesmith was the most publicly vocal Monkee about the band's prefabricated image.,0.98616564,0.00038039166,7.117458e-07,3.6901274e-05,0.0015501406,0.011866173
53,"The Monkees succeeded in ousting supervisor Don Kirshner and took control of their records and song choices, but they worked as a four-man group on only one album, 1967's Headquarters.",0.99931943,0.00059841736,8.194089e-05,2.2792757e-07,1.790806e-09,2.46993e-08
54,"Nesmith withheld many of his songs from the final Monkees albums, opting to release them on his post-Monkees solo records.",0.99968934,0.0002962662,6.6711914e-06,7.719427e-06,8.86666e-09,2.6100206e-08
55,"During the band's first independent press conference, Nesmith called More of The Monkees ""probably the worst record in the history of the world"".",0.9999995,4.8243265e-07,1.4629196e-10,3.697701e-09,1.5738296e-11,2.6553211e-08
56,The band never regained its credibility after fans learned they had not played the instruments on their earlier records.,0.6346644,0.18548584,0.07177498,0.108074576,1.9905949e-07,1.782655e-11
57,Sales still continued to be profitable until the disastrous release of the movie Head.,0.3769396,0.0038778195,4.8669e-05,0.619102,2.5923662e-06,2.9285722e-05
58,"Nesmith's last contractual Monkees commitment was a commercial for Kool-Aid and Nerf balls in April 1970 (fittingly, the spot ends with Nesmith frowning and saying, ""Enerf's enerf!"").",0.9999957,4.273556e-06,4.7507637e-11,8.341311e-09,5.697636e-10,9.483933e-11
59,"As the band's sales declined, Nesmith asked to be released from his contract, despite it costing him: ""I had three years left ... at $150,000 [equivalent to $980,940 in 2018] a year.""",1.0,6.889523e-12,1.7263424e-08,1.0528843e-10,4.1367166e-12,5.290626e-13
60,"He remained in a financial bind until 1980, when he received his inheritance from his mother's estate.",3.7340976e-06,0.09040776,1.7376937e-05,0.00015203925,0.9031736,0.006245456
61,"In a 1980 interview with Playboy, he said of that time: ""I had to start telling little tales to the tax man while they were putting tags on the furniture.""",0.0018331727,0.25037742,9.356563e-10,2.1361191e-07,0.000111817004,0.7476774
62,====,0.0008281033,4.9745104e-05,1.6403084e-05,9.948394e-06,0.9990958,1.3139814e-10
63,Return to the Monkees =,0.9909499,0.0016808554,0.0073048654,3.5699613e-05,2.4608797e-05,4.07836e-06
64,===,0.0018068925,2.1080356e-05,2.7498634e-05,0.00044118572,0.9977034,1.2509472e-11
65,"Nesmith did not participate in the Monkees' 20th anniversary reunion, but he did appear during an encore with the other three members at the Greek Theatre on September 7, 1986.",0.7925005,0.18967827,5.6569275e-05,0.00043058908,2.1267329e-06,0.017331947
66,"In a 1987 interview for Nick Rocks, Nesmith stated, ""When Peter called up and said 'we're going to go out, do you want to go?'",0.9956381,0.004093586,6.0946117e-05,2.3243458e-05,5.414901e-06,0.00017868799
67,I was booked.,0.95418906,0.0026374045,0.004722738,0.00039165252,0.038056538,2.7718938e-06
68,"But, if you get to L. A ... I'll play.""",0.001830201,1.005221e-05,0.29078874,0.5473954,0.1599756,2.7491813e-09
69,"Nesmith next joined his fellow Monkees band members for the 1986 ""Monkees Christmas Melody"" video for MTV appearing throughout dressed/disguised as Santa Claus until the finale, when he revealed his identity - and participation - to all.",0.00031529827,0.02360831,9.720949e-08,9.475785e-09,0.016680192,0.95939606
70,"Nesmith appeared again in 1989 with Dolenz, Tork, and Jones.",0.9109043,0.0002754659,8.778532e-08,0.08868458,0.00013557063,2.504264e-08
71,"Prior to the official kickoff of The Monkees '89 tour (on July 1 in Winnipeg, Manitoba, Canada) all four Monkees gathered in Los Angeles, California, making two live radio appearances (KLOS-FM: The Mark an Brian Show on June 28 and  KIIS Radio on June 30th) to promote their reunion concert at the Universal Amphitheatre where they appeared together as a foursome live on stage on July 9.",0.003923668,0.9959221,6.9068046e-05,7.369384e-05,6.8824264e-08,1.13256565e-05
72,The following day (July 10th) all four band members were in attendance as the Monkees received a Hollywood Walk of Fame star.,0.0002954937,0.00053954666,4.6666446e-05,6.145618e-07,1.9441254e-08,0.9991177
73,"In 1995, Nesmith was again reunited with the Monkees to record their studio album (and first to feature all four since Head), titled Justus, released in 1996.",0.99972576,0.00025570506,2.5940087e-06,1.5794501e-05,6.297687e-10,1.0270954e-13
74,"He also wrote and directed a Monkees television special, Hey, Hey, It's the Monkees.",0.77778333,1.1675346e-05,0.21142803,0.010776605,1.9102687e-07,8.9213984e-08
75,"To support the reunion, Nesmith, Jones, Dolenz, and",0.30459583,2.455708e-07,3.0537512e-07,0.69540364,1.2837983e-09,2.0103867e-08
76,Tork briefly toured the UK in 1997.,0.9928618,0.004778443,0.00063623005,0.0011787507,0.0005447445,1.2172703e-09
77,The UK tour was the last appearance of all four Monkees performing together.,0.6928119,0.077756956,0.000101610036,0.22926815,7.793174e-06,5.3714986e-05
78,"In 2012, 2013, and 2014, after Jones's death, Nesmith reunited with Dolenz and Tork to perform concerts throughout the United States.",0.30215994,0.0007638793,0.002513714,0.6839463,0.010616135,2.0302318e-08
79,"Backed with a seven-piece band that included Nesmith's son, Christian, the trio performed 27 songs from The Monkees discography (""Daydream Believer"" was sung by the audience).",0.9844519,0.015387167,6.619313e-05,9.4334566e-05,7.0305454e-08,2.8905916e-07
80,"When asked why he had decided to return to the Monkees, Nesmith stated, ""I never really left.",0.99997663,7.4821526e-07,2.270215e-05,2.84494e-10,1.16311544e-10,9.462476e-13
81,It is a part of my youth that is always active in my thoughts and part of my overall work as an artist.,0.00026811045,7.957862e-06,0.8106066,0.0064394274,0.18248616,0.00019175393
82,It stays in a special place.,0.00066125777,0.73995566,8.855623e-06,0.20854443,0.00015397235,0.05067587
83,"""In 2016, Nesmith contributed vocally and instrumentally to the Monkees' 50th anniversary album Good Times!.",0.98248196,2.7202177e-07,1.5710822e-05,0.017501993,1.2827812e-07,6.037905e-09
84,"He additionally contributed a song, ""I Know What I Know"", and was reportedly ""thrilled"" at the outcome of the album.",2.1791355e-07,8.9566114e-05,0.99880123,0.001108995,1.2616301e-12,1.7140864e-14
85,"Despite not touring with Dolenz and Tork for the majority of the Monkees' 50th-anniversary reunion in 2016, Nesmith did twice fill in for the ailing Peter Tork and appeared for the final show of the tour, which featured the three surviving band members (the last show to do so).",0.9999323,5.024581e-05,8.193826e-06,9.197713e-06,1.8694264e-09,2.3437146e-11
86,"At the end of the final show, Nesmith announced his retirement from the Monkees, never to tour again.",1.0,5.1529705e-09,1.9667479e-09,7.170098e-11,4.1993867e-11,1.0259502e-12
87,"In 2018, Nesmith and Dolenz toured together as a duo for the first time under the banner ""The Monkees Present: The Mike and Micky Show"".",0.99892575,0.00014096046,3.408791e-07,0.00093281735,1.2416159e-07,4.311452e-10
88,The tour was cut short four dates out due to Nesmith having health issues (he was flown back home and proceeded to have quadruple bypass surgery).,0.99999666,7.005523e-07,4.0400425e-09,2.598857e-06,6.119187e-10,3.4714367e-11
89,"He contributed two songs for the Monkees' 13th studio album, Christmas Party (the group's first Christmas album), released on October 12, 2018.",0.2919116,0.031836852,0.045256477,0.38642237,6.6403857e-07,0.24457207
90,"In 2019, Nesmith and Dolenz reunited again to make up the cancelled dates of the tour and adding several more dates, including a forthcoming tour of Australia and New Zealand.",0.9984463,0.00021735129,0.00023979861,0.0010965252,2.0377655e-09,8.7948956e-14
91,"Nesmith and Dolenz announced a follow-up tour, ""An Evening with the Monkees"", to begin in early 2020.",0.9999969,1.4845825e-06,1.5810414e-06,1.5295645e-07,4.8588905e-10,5.5035278e-12
92,"The tour was delayed, however, due the COVID-19 pandemic.",0.99994123,1.6865623e-07,4.0858004e-06,3.003579e-05,2.4387251e-05,9.844895e-08
93,"It was announced by Nesmith and Dolenz on May 4, 2021 that the Monkees will disband following a farewell tour.",0.9997249,2.259377e-05,0.00025139024,6.7079884e-07,3.136197e-07,2.3519222e-09
94,"Dubbed ""The Monkees Farewell Tour"", the tour consisted of over 40 dates in the US from September to November.",0.9999409,3.8722563e-05,4.282068e-06,1.271787e-08,4.4856467e-08,1.6037977e-05
95,"However, because of restrictions due to the ongoing COVID-19 pandemic, they were not able to play shows in Canada, the UK or Australia.",0.00021961695,4.2707192e-08,3.941986e-05,0.9997409,1.1399064e-10,3.7393758e-11
96,"The final date of the tour was held on November 14, 2021 at the Greek Theatre in Los Angeles.",0.99946684,0.000106075764,1.5167527e-07,0.00020437244,1.4450729e-06,0.00022131165
97,==,0.124878764,0.21344112,0.0013716007,0.0017026727,0.65860575,7.902396e-08
98,Solo career ==,1.0,3.7522574e-14,1.2341718e-14,1.3744411e-10,2.7685932e-11,1.3774395e-12
99,"In 1969, Nesmith formed the group First National Band with Kuehne, John Ware, and Red Rhodes.",0.20265391,1.6892808e-07,6.857176e-08,0.79710615,0.00023965887,4.6729727e-14
100,"Nesmith wrote most of the songs for the band, including the single ""Joanne"", which received some airplay and was a moderate chart hit for seven weeks during 1970, rising to number 21 on the Billboard Top 40.",0.045421466,5.4739136e-05,8.1952146e-11,0.9545237,6.043755e-10,8.254133e-08
101,The First National Band has been credited with being among the pioneers of country-rock music.,0.9814757,0.000107845415,8.301699e-08,0.018416153,7.200189e-08,4.180543e-10
102,"As he prepared for his exit from The Monkees in 1970, Nesmith was approached by John Ware of The Corvettes, a band that featured Nesmith's friend John London, who played on some of the earliest pre-Monkees Nesmith 45s, as well as numerous Monkees sessions, and had 45s produced by Nesmith for the Dot label in 1969.",0.9735093,0.02598927,0.0004550177,4.6122088e-05,3.0858922e-07,3.1306445e-08
103,Ware wanted Nesmith to put together a band.,0.7582711,0.00032849563,2.2620372e-06,0.24139678,1.341077e-06,9.358716e-13
104,"Nesmith said he would be interested only if noted pedal steel player Orville ""Red"" Rhodes was part of the project; Nesmith's musical partnership with Rhodes continued until Rhodes's death in 1995.",1.3760987e-08,2.1512715e-05,4.9074213e-11,0.99993014,4.8271995e-05,1.2884664e-12
105,The new band was christened Michael Nesmith and the First National Band and went on to record three albums for RCA Records in 1970.,0.9998105,1.5838121e-07,2.0122568e-10,0.00018923734,7.22998e-08,1.1023164e-14
106,Nesmith has been considered one of the pioneers of country rock.,0.9997967,3.0332508e-06,1.0574889e-08,0.000197597,2.7152726e-06,7.08461e-11
107,He also had moderate commercial success with the First National Band.,0.8806548,0.00011330327,7.894257e-09,0.11923179,6.988697e-09,5.8183325e-08
108,"Their second single, ""Joanne,"" hit number 21 on the Billboard chart, number 17 on Cashbox, and number four in Canada, with the follow-up ""Silver Moon"" making number 42 Billboard, number 28 Cashbox, and number  13 in Canada.",0.00017482194,1.6700528e-07,4.075724e-10,0.9998221,1.7694735e-07,2.8957331e-06
109,"Two more singles charted (""Nevada Fighter"" made number 70 Billboard, number 73 Cashbox, and number 67 Canada, and ""Propinquity""",0.013843347,2.9542553e-06,3.9003747e-10,0.9859035,2.6824876e-09,0.00025023255
110,"reached number 95 Cashbox), and the first two LPs charted in the lower regions of the Billboard album chart.",4.099607e-05,4.8383048e-05,2.6443792e-09,0.9999106,1.3355803e-08,3.0548156e-10
111,No clear answer has ever been given for the band's breakup.,0.99468994,0.0043180767,1.8469354e-05,0.00097108836,2.747748e-07,2.1916435e-06
112,"Nesmith followed up with The Second National Band, a band that, besides Nesmith, consisted of Michael Cohen (keyboards and Moog), Johnny Meeks (of The Strangers) (bass), jazzer Jack Ranelli (drums), and Orville Rhodes (pedal steel), as well as an appearance by singer, musician, and songwriter José Feliciano on congas.",1.5293903e-05,0.00086240226,6.707216e-06,0.99911565,3.6900687e-08,2.1204284e-14
113,"The album, Tantamount to Treason Vol. 1, was a commercial and critical disaster.",0.99999976,2.2452372e-07,2.0073701e-10,2.3561086e-08,7.515268e-12,1.105261e-09
114,"Nesmith then recorded And the Hits Just Keep on Comin', featuring only him on guitar and Red Rhodes on pedal steel.",5.1220565e-07,5.8138585e-06,6.223776e-10,0.9999937,4.356582e-09,9.520663e-16
115,"Nesmith became more heavily involved in producing, working on Iain Matthews's album Valley Hi and Bert Jansch's L.A. Turnaround.",0.98201686,0.00075193634,0.00053189025,0.016699143,1.3294296e-07,4.8600544e-13
116,"Nesmith was given a label of his own, Countryside, through Elektra Records, as Elektra's Jac Holzman was a fan of Nesmith's.",0.99876416,8.575401e-09,2.2443031e-05,9.826856e-08,0.0012133201,3.1887908e-09
117,"It featured a number of artists produced by Nesmith, including Garland Frady and Red Rhodes.",4.360186e-06,1.0982327e-07,4.4593634e-12,0.9997385,0.0002569418,5.734048e-11
118,"The staff band at Countryside also helped Nesmith on his next, and last, RCA album, Pretty Much Your Standard Ranch Stash.",0.99423236,3.449176e-07,4.6446388e-08,0.00576725,2.2639692e-09,2.471615e-11
119,"Countryside folded when David Geffen replaced Holzman, as Countryside was unnecessary in Geffen's eyes.",0.99997616,8.5642705e-06,1.5179557e-05,5.5889156e-09,1.017628e-07,2.7225543e-08
120,"In the mid-1970s, Nesmith briefly collaborated as a songwriter with Linda Hargrove, resulting in the tune ""I've Never Loved Anyone More"", a hit for Lynn Anderson and recorded by many others, as well as the songs ""Winonah"" and ""If You Will Walk With Me,"" both of which were recorded by Hargrove.",0.9131199,0.03348387,0.037275046,0.015806876,0.00012363328,0.00019060621
121,"Of these songs, only ""Winonah"" was recorded by Nesmith himself.",0.99983656,1.3392982e-07,5.4805844e-07,0.00016273101,1.277883e-09,2.331874e-12
122,"During this same period, Nesmith started his multimedia company Pacific Arts, which initially put out audio records, eight-track tapes, and cassettes, followed in 1981 with ""video records.""",0.89404607,8.939322e-06,6.911422e-08,0.104189724,0.0015989771,0.00015609592
123,"Nesmith recorded a number of LPs for his label, and had a moderate worldwide hit in 1977 with his song ""Rio"", the single taken from the album From a Radio Engine to the Photon Wing.",0.089534506,6.9665083e-07,3.8428094e-05,0.9104214,1.5389386e-07,4.89331e-06
124,"In 1983, Nesmith produced the music video for the Lionel Richie single ""All Night Long"".",0.3744273,3.029592e-05,1.0285542e-09,0.5558097,3.508131e-08,0.06973272
125,"In 1987, he produced the music video for the Michael Jackson single ""The Way You Make Me Feel"".",8.203756e-08,1.4248775e-06,0.00015269176,0.017286468,0.0013612793,0.98119813
126,===,0.0018068925,2.1080356e-05,2.7498634e-05,0.00044118572,0.9977034,1.2509472e-11
