,Sentence,Business meeting,Coincidence,Education,Music making,Personal life,Public celebration
147,===,0.0018068925,2.1080356e-05,2.7498634e-05,0.00044118572,0.9977034,1.2509472e-11
148,Seizures =,0.75435066,2.5578531e-06,1.3894961e-09,0.24564578,9.658316e-07,4.8149498e-09
149,==,0.12487865,0.2134413,0.001371599,0.0017026742,0.65860564,7.902395e-08
150,"On October 14, 2011, Ross suffered two seizures in the same day, once in the morning and again in the early evening.",0.014714886,0.8287203,1.1801784e-06,0.00016738627,0.1563964,7.795684e-09
151,"Following the morning seizure, he was unconscious and CPR was performed.",0.000105501276,0.003591305,1.0119345e-08,0.70440996,0.2918933,1.0351763e-10
152,"After suffering the second seizure, Ross was admitted to a hospital in Birmingham, Alabama, where doctors ran a battery of tests.",1.4591795e-05,0.9297875,4.2855707e-08,0.0007056467,0.06949228,1.964838e-11
153,They declared him healthy.,0.30100912,0.014767571,1.1274223e-10,0.6698367,0.014386629,5.0483207e-12
154,Ross attributes the episodes to a lack of sleep in the previous week.,0.13003553,0.8699426,1.33986e-06,2.0052787e-05,2.1089805e-07,1.7102319e-07
155,"Ross later noted the incident in the remix of Meek Mill's song ""Ima Boss"", with the line ""Had a couple seizures, call it minor setbacks /",0.0040785656,0.9958288,1.6769706e-09,9.047015e-05,2.173661e-06,1.2242295e-11
156,"Everybody praying for me, I respect that / Woke up in the hospital, where my checks at? /",9.950947e-05,0.48629478,6.297645e-07,7.683404e-05,0.5130767,0.0004515253
157,"Then I put 8 chains where my neck's at"".",0.00017215249,0.9897585,9.930608e-07,0.008003701,1.3219741e-05,0.0020515018
158,===,0.0018068925,2.1080356e-05,2.7498634e-05,0.00044118572,0.9977034,1.2509472e-11
159,Drive-by shooting =,0.03720665,8.185107e-06,3.282908e-08,0.3782303,0.00010869415,0.58444613
160,==,0.124878764,0.21344112,0.0013716007,0.0017026727,0.65860575,7.902396e-08
161,"On January 27, 2013, while celebrating his 37th birthday, Ross and his girlfriend were the targets of a drive-by shooting in Fort Lauderdale, Florida.",9.5073236e-05,0.32732406,4.20818e-09,0.048410922,0.05347771,0.57069224
162,"Neither Ross nor his girlfriend were hurt, but they ended up crashing their car into an apartment in an attempt to escape the shooting.",0.00035660734,0.11675069,4.2151674e-05,0.0022799035,0.8805674,3.236179e-06
163,===,0.0018068925,2.1080356e-05,2.7498634e-05,0.00044118572,0.9977034,1.2509472e-11
164,2018 hospitalization,0.076600194,9.962446e-07,1.8314324e-08,0.90990096,0.013462091,3.5838413e-05
165,===,0.0018068925,2.1080356e-05,2.7498634e-05,0.00044118572,0.9977034,1.2509472e-11
166,"On March 2, 2018, Ross was hospitalized after being found unresponsive in his Miami, Florida, home from a possible heart attack.",0.010225481,0.0043646554,4.2984993e-06,0.65254813,0.3328567,7.140674e-07
167,Ross was on life support.,0.00071859016,0.002609707,0.0018162474,0.038048957,0.9565998,0.00020675681
168,He was released from hospital just a few days later.,1.22353495e-05,0.004880877,5.440516e-08,2.5818517e-06,0.9951042,9.055567e-09
169,===,0.0018068915,2.1080356e-05,2.749861e-05,0.00044118572,0.9977034,1.2509472e-11
170,Family =,1.3356818e-07,8.1635386e-11,1.7888283e-09,2.1019213e-09,0.9999976,2.2451864e-06
171,==,0.124878764,0.21344112,0.0013716007,0.0017026727,0.65860575,7.902396e-08
172,"Ross has four children: Toie Roberts, William Roberts III, Berkeley Hermes Roberts, and Billion Leonard Roberts.",2.8702056e-05,7.867173e-05,2.1427053e-05,0.00024895874,0.9957937,0.0038285744
173,"Ross was briefly engaged to Lira ""Galore"" Mercer in 2015.",4.0361963e-05,7.10019e-06,5.5268616e-09,0.00025716142,0.0177292,0.98196614
174,==,0.124878764,0.21344112,0.0013716007,0.0017026727,0.65860575,7.902396e-08
175,Legal issues ==,0.0005703375,2.6216961e-08,1.6688939e-05,0.00032790433,3.9842373e-05,0.9990452
176,"In January 2008, Ross was arrested on gun and marijuana charges.",0.70948637,0.26741275,0.019024884,0.00014443543,0.0024222548,0.00150922
177,"During a deposition of Officer Rey Hernandez, a Miami Beach cop who arrested Ross, Ross's lawyer, Allan Zamren, asked Hernandez why Ross's case was assigned to the gang task force.",0.995514,0.0036286882,8.0824675e-06,0.00079309393,1.7965893e-06,5.4381984e-05
178,"The officer stated that it was because Ross claimed affiliation with Triple C's (aka Carol City Cartel), and other known gang members.",0.4044466,0.044138778,0.0038032916,0.5473842,0.00014654417,8.0519516e-05
179,"Zamren pressed Hernandez for a personal link between Ross and the gang members, but the officer did not provide proof.",4.9953283e-05,0.9523834,0.0004945753,0.039300017,0.0072848145,0.000487263
180,"In August 2008, YouTube entertainer DJ Vlad filed a lawsuit against Ross for assault and battery.",0.0024688127,0.0077895103,8.659833e-05,1.2269913e-07,6.033221e-08,0.9896549
181,"Vlad claimed Ross organized an ambush on him at the 2008 Ozone Awards in Houston, Texas for asking questions about his past as a correctional officer.",0.0004905844,0.8330547,1.3633824e-07,2.304819e-08,9.820594e-09,0.16645454
182,"In June 2010 ""Freeway"" Ricky Ross sued Ross for using his name, filing a copyright infringement lawsuit in a California federal court.",0.012827159,0.19039127,0.0035426102,0.0032096088,4.5460126e-07,0.79002887
183,"Jay-Z had been called to testify in the lawsuit, as he was CEO of Def Jam when Ross/Roberts was signed.",0.029610086,0.8085562,0.002465087,0.011292935,1.1442336e-06,0.14807445
184,"""Freeway"" Ricky Ross, a reformed drug kingpin, sought $10 million in damages in his lawsuit.",0.32414916,8.980987e-05,0.00016390343,7.7039415e-09,4.832097e-09,0.6755971
185,"Also, Freeway Ricky Ross threatened to block the release of Ross's album, Teflon Don.",0.9999944,5.966007e-07,4.5293095e-06,4.522151e-07,2.4272113e-09,1.1094162e-08
186,"A week after the lawsuit was filed, Rick Ross responded to the charges: ""It's like owning a restaurant, you're gonna have a few slip and falls.",0.328864,0.11780677,0.5533237,8.007436e-10,3.674255e-06,1.8330595e-06
187,"You get lawsuits, you deal with them, and get them out your way … sometimes you lose.""",1.1855992e-07,0.47789547,0.28157112,6.6196316e-07,6.02316e-08,0.24053252
188,"He denied rumors that he would change his name to ""Ricky Rozay"" as a consequence of the lawsuit.",0.817896,0.0039904728,0.13817996,0.00022694275,1.1950046e-06,0.039705396
189,"The lawsuit was thrown out of court on July 3, 2010.",1.1297319e-06,1.49194675e-05,0.0013698064,5.117211e-07,3.6886368e-07,0.99861324
190,"The album Teflon Don was released as scheduled on July 20, 2010.",0.999951,6.078309e-07,3.5910293e-08,4.799716e-05,3.6298388e-07,1.6295252e-09
191,A federal judge ruled that the case should be refiled in California state court because it fell under California state law.,0.00011400513,0.0027974804,0.01565963,1.8428674e-06,0.082503535,0.89892346
192,"""Freeway"" Ricky Ross refiled the case with the State of California and the federal case is on appeal in the United States Court of Appeals for the Ninth Circuit.",0.10351784,0.00022558277,0.0037972282,5.995177e-07,7.133211e-05,0.89238745
193,The state case was filed in 2011 in California.,1.398919e-05,0.0074255336,3.105384e-05,1.8681787e-06,4.5129284e-05,0.99248236
194,"""Freeway"" Ricky Ross refiled in Los Angeles Superior Court with publicity rights claims.",0.77279663,2.5402704e-08,2.1566286e-05,5.3660996e-09,1.684115e-09,0.22718176
195,Trial was set for early May 2012.,0.9517604,0.040953,1.8339142e-07,1.9982498e-09,1.1420813e-05,0.007274879
196,The case was dismissed by a judge in the Los Angeles Superior Court.,3.6538518e-06,0.16571766,0.628259,2.4384958e-11,0.0030827364,0.20293692
197,The California State case was updated with a motion in Freeway Rick Ross's favor as to Warner Bros. Records and their use of the name and image Rick Ross in July 2012.,0.32964286,0.005778787,0.003409595,6.793725e-06,6.4852735e-05,0.6610971
198,"The New York Post reported that a trial was set for August 27, 2013, in Freeway Rick Ross versus Rick Ross and Warner Music Group.",0.3379854,0.006429929,1.1688747e-06,1.0390726e-08,2.9641145e-05,0.6555538
199,"On December 30, 2013, the court ruled in favor of the rapper Rick Ross, allowing him to keep the name based on a First Amendment ruling.",0.0065624136,0.4731788,0.00921912,1.0199842e-05,0.0002171241,0.5108124
200,"In 2011, the rapper Teflon Don filed a trademark infringement lawsuit against Ross for the use of the name as an album title.",0.077828035,0.91892517,1.624823e-05,0.0031292147,9.9395416e-05,1.9275321e-06
201,"On March 26, 2011, Ross was arrested in Shreveport for possession of marijuana.",0.00021637153,0.9996007,1.6811631e-05,0.00010651657,5.6754092e-05,2.8239685e-06
202,"According to the police records, a strong odor of marijuana was detected from his room at the Hilton in Downtown Shreveport.",2.7056406e-09,0.9950411,0.0049014566,4.4394774e-08,5.7511217e-05,3.401923e-09
203,"Ross was arrested on June 27, 2014, in Greensboro, N.C., following his performance at the 2014 SuperJam at the Greensboro Coliseum.",0.013807717,0.9839364,6.7492285e-05,0.0020127746,6.30658e-05,0.00011243745
204,The arrest stemmed from a year-old warrant for another North Carolina arrest related to marijuana possession; Ross reportedly failed to appear in court for that violation in 2013.,0.9976693,0.0014040156,0.0009208853,4.5705224e-08,5.8244354e-06,4.913266e-08
205,"On June 24, 2015, Rick Ross and his bodyguard were arrested in Fayette County, Georgia on kidnapping and assault charges.",0.90442026,0.06673573,0.019544402,3.3955042e-05,0.008899935,0.0003656811
206,"Both were accused for forcing a lands keeper into a guesthouse and beating him in the head with a handgun, allegedly over money he owed Ross.",0.082233086,0.6709568,0.10591495,5.6298893e-07,4.054141e-05,0.14085397
207,"On April 4, 2017, Ross pled no contest to a felony count of aggravated assault.",1.0,1.522454e-09,1.5590077e-08,2.1070725e-09,2.0230141e-10,9.33554e-09
208,The other felony charges were dropped.,0.81217605,3.3565164e-05,0.18746096,1.4705194e-09,0.00032810197,1.3169922e-06
209,"Ross was sentenced to time served in jail, having already been incarcerated for a week and was also ordered to pay a $10,000 fine.",0.4291109,0.00027421745,0.00040871213,1.1854899e-09,1.2746837e-06,0.5702049
210,Ross was sentenced as a first time felony offender; and upon payment of the fine the conviction was erased from his record.,0.9998282,1.6002255e-07,0.00017140977,5.9009963e-12,4.236446e-09,2.3227828e-07
211,"Ross pled no contest to 5 misdemeanours; of assault, battery, two counts of pointing a pistol at someone, and possession of less than 1 oz of cannabis.",0.8757186,0.007270215,7.814708e-05,1.2701119e-06,3.5374008e-08,0.116931796
212,For the five misdemeanours he was given a total of 60 months probation.,0.8696028,1.2309922e-09,0.13035399,1.3226467e-15,1.0607874e-08,4.322548e-05
213,==,0.124878764,0.21344112,0.0013716007,0.0017026727,0.65860575,7.902396e-08
214,Business ventures ==,0.9611288,0.00027951412,0.0008071435,1.8791164e-07,0.00035701375,0.037427258
215,"As of 2017, Ross owned several different Wingstop restaurant locations.",0.005522769,1.261052e-07,0.00064554636,0.9751439,0.01868753,7.582315e-08
216,"Wingstop is a fast food chain, specializing in chicken wings.",3.4494735e-07,2.243682e-07,3.8973758e-05,0.046820454,0.95314,3.5767868e-11
217,==,0.124878764,0.21344112,0.0013716007,0.0017026727,0.65860575,7.902396e-08
218,Controversy ==,0.007442614,0.0179224,3.7528474e-07,3.284331e-08,0.97214377,0.0024907996
219,===,0.0018068925,2.1080356e-05,2.7498634e-05,0.00044118572,0.9977034,1.2509472e-11
220,Feud with 50 Cent =,0.99999857,1.1495748e-06,9.047682e-09,9.36985e-09,7.999434e-08,1.298788e-07
221,==,0.124878764,0.21344112,0.0013716007,0.0017026727,0.65860575,7.902396e-08
222,"In January 2009, Ross started a feud with rapper 50 Cent because he supposedly looked at him the wrong way at the BET Hip Hop Awards in 2008.",0.6366108,0.3617178,3.1468237e-05,4.4507913e-05,0.0001204241,0.0014750315
223,50 Cent told news sources that he did not remember seeing Ross there.,8.1408125e-06,0.0033664212,1.1888309e-06,0.9962741,0.00034244815,7.7617315e-06
224,"In late January, ""Mafia Music"", by Ross, leaked onto the Internet.",0.00023667203,0.0005029491,1.3816981e-06,0.016509516,4.5543187e-09,0.98274946
225,There were several lines that seemed to diss 50 Cent.,0.0046351417,0.80440146,0.1909614,1.3638581e-07,1.857753e-06,5.1196363e-08
226,"Days later, 50 Cent released ""Officer Ricky (Go Head, Try Me)"" in response to Ross's disparaging remarks on his ""Mafia Music"" song.",0.70658046,0.16224062,0.06547479,0.03893795,1.3594491e-06,0.026764818
227,"Before going to Venezuela, 50 Cent uploaded a video entitled ""Warning Shot"", wherein he stated: ""Rick Ross- I'mma fuck your life up for fun.""",0.12218772,0.87719345,0.00048297842,4.7007325e-06,0.00012600783,5.103939e-06
228,"In addition, 50 Cent released the first of a series of ""Officer Ricky"" cartoons.",0.9996778,6.272478e-05,8.207314e-05,0.0001758583,3.0529874e-09,1.5362773e-06
229,"Early in February, 50 Cent once again made a video which he uploaded to YouTube in which he interviewed ""Tia"", the mother of one of Ross's children.",0.0020762347,0.1499827,0.0065337075,1.099571e-06,0.8411486,0.00025762105
230,She verifies that he was a correctional officer and claims his whole persona is fake and fraudulent.,0.00032393454,0.05498069,0.9074052,2.9033123e-07,0.018929813,0.018359952
231,"On February 5, 2009, The Game, who 50 Cent has a long-standing ""beef"" with, called up Seattle R&B station KUBE.",0.0010497863,0.39575082,3.8651688e-06,0.6031939,5.7507357e-08,1.5053114e-06
232,"When asked about the beef between 50 Cent and Ross, Game sided with 50 Cent and said that things are not looking good for Ross.",0.38747567,0.5034849,0.00021400514,0.10854676,0.0002785613,1.5987861e-09
233,"He offered to help, stating, ""Rick Ross, holla at your boy, man,"" and, ""50 eating you, boy.""",9.784117e-07,0.007086574,0.99204224,0.00019782527,0.0006711903,1.1158052e-06
234,"On his album Deeper Than Rap, Ross references 50 Cent in the song ""In Cold Blood"".",0.00030346966,0.07384955,4.5210356e-05,0.9257828,1.3947961e-05,5.0450494e-06
235,A video for the song was released that portrayed 50 Cent's mock funeral.,1.3142793e-05,0.10191957,7.559369e-05,2.2684976e-06,3.561213e-09,0.89798945
236,"Upon release, Ross stated that he has ended 50 Cent's career.",1.0,2.1103022e-09,5.93053e-14,1.5792355e-09,3.2794416e-12,3.7909493e-12
237,"That same day Ross released a new diss track called ""Push 'Em Over The Edge"".",0.9892021,0.00017532076,0.00011439717,0.0017741303,2.539529e-05,0.008708718
238,"The next day 50 Cent released the controversial video ""A Psychic Told Me"", dissing DJ Khaled.",0.0009306381,0.0015875485,0.00017728051,4.7841315e-08,1.0261015e-05,0.99729425
239,"On February 12, 50 Cent responded with ""Tia Told Me"", along with Lloyd Banks' response ""Officer Down"" and Tony Yayo's ""Somebody Snitched"".",0.018184789,0.015832523,0.47307625,0.49275583,8.985812e-05,6.074772e-05
240,"In an interview, 50 Cent said Ross is ""Albert From CB4.",0.0022760783,0.07194522,2.577011e-06,0.9188355,4.126758e-05,0.006899331
241,You ever seen the movie?,1.2662802e-09,0.98595506,5.2449304e-06,0.013918595,0.00012058095,4.5282673e-07
242,"He's Albert,"" he added.",4.2427323e-06,0.09198095,0.0007197453,0.51380837,0.39329436,0.00019225101
243,"""It never gets worse than this.",4.7519952e-09,1.8824241e-05,2.660283e-10,3.192279e-10,0.99998116,1.8403033e-11
244,You get a guy that was a correctional officer come out and base his entire career on writing material from a drug dealer's perspective.,0.041681487,0.0034698131,0.9548201,2.151381e-10,6.9754556e-08,2.854449e-05
245,"""On January 30, 2013, 50 Cent claimed via Twitter that the drive-by shooting that Ross experienced on his birthday two days ago was ""staged"", reigniting the feud.",0.18266897,0.5016127,5.6709537e-06,0.0027524156,0.0053664614,0.30759376
246,"A year later, on March 28, 2014, Rick Ross was asked about his feud with 50 Cent.",0.5605052,0.41141364,0.008275687,2.648838e-07,0.00050176994,0.019303516
247,"He stated that he does not wish to speak on him anymore, and that he is done with the feud.",0.9092538,0.07311546,0.016462574,0.0010760345,5.14958e-07,9.154617e-05
248,His feud with 50 Cent has been resurfacing.,0.99904054,0.00095344015,7.10678e-08,1.556639e-06,1.3300361e-06,2.9780902e-06
249,"The reason of the second reignition would be because of Ross's MMG record-label artist Meek Mill, who defended his mentor and criticised 50 on his 4/4 EP.",0.0073282616,1.2751743e-08,0.9926676,1.0291749e-09,4.1121853e-06,2.580555e-08
250,===,0.0018068925,2.1080356e-05,2.7498634e-05,0.00044118572,0.9977034,1.2509472e-11
251,Lyric controversy ===,0.02762603,0.81757015,0.0036327366,2.4793033e-07,3.0792144e-05,0.15114014
252,"In a line on rapper Rocko's 2013 song ""U.O.E.N.O."", Rick Ross raps the line, ""Put molly all in her champagne/",0.00080560613,0.00028568637,6.929268e-05,0.18063247,0.0002689227,0.817938
253,She ain't even know it/,2.1568392e-10,0.4121832,0.51999426,0.026792964,0.0007559639,0.040273644
254,I took her home and I enjoyed that/,1.6143681e-13,0.20920485,0.012136308,0.775319,0.0032909221,4.9006823e-05
255,"She ain't even know it.""",1.2571984e-08,0.17160565,0.716471,0.023027716,0.08545226,0.003443279
256,"A petition containing 72,000 signatures was presented to Reebok, demanding they drop Ross as a spokesman for the lyrics which appeared to condone date rape.",0.33142856,0.010584249,0.00031645581,0.00054426386,0.005835659,0.65129083
257,"Ross has apologized for the lyrics, claiming they weren't about rape.",0.7919854,0.0145634785,0.02218889,6.702046e-07,6.454781e-05,0.17119698
258,"On April 11, 2013, one month after the song's release, Ross was dropped by Reebok.",0.0025648193,0.77024645,0.06385983,1.7273617e-06,0.00976513,0.15356207
259,"Reebok stated, ""while we do not believe that Rick Ross condones sexual assault, we are very disappointed he has yet to display an understanding of the seriousness of this issue or an appropriate level of remorse.""",0.00018621387,0.0023178814,0.99745196,1.8233763e-07,3.19305e-05,1.1601598e-05
260,"They continued on to say, ""at this time, it is in everyone's best interest for Reebok to end its partnership with Mr. Ross.""",0.9771275,0.022788925,1.0320654e-05,3.007046e-05,2.2650864e-05,2.0630414e-05
261,"Though Ross apologized for the lyrics, he also argued that his lyrics were misinterpreted because he did not directly use the word ""rape.""",0.0008135989,0.037051667,0.95556825,7.964773e-08,2.6938117e-06,0.006563654
262,"He says, ""You know I would never use the term rape in my records … in reality some people do these things, and shouldn't it be brought to light so young women can protect themselves?!""",0.9909738,0.00020999229,0.0009977317,2.4898038e-06,0.007814857,1.0552812e-06
263,"He continued on Twitter, ""I would never use the term 'rape' in my records and as far as my camp.",0.1864855,0.43250167,0.21283406,0.038274795,0.12989326,1.0666095e-05
264,"Hip-Hop don't condone that, the streets don't condone that, nobody condones that.",1.3896829e-06,0.00042072526,0.62782717,4.950625e-06,0.1551083,0.21663746
265,"""A 2013",4.1476294e-08,0.049683925,3.0546473e-06,1.8366315e-08,0.9503129,1.1964343e-09
266,Ross concert organized by the student association of Carleton University was cancelled after protests that his lyrics promote rape culture.,0.8043225,0.0006864769,0.06429289,0.12783353,0.00010646064,0.002758148
267,Rocko later dropped the Rick Ross verse in order to get radio play.,6.3479924e-06,0.0013449561,0.9982545,0.0003913109,4.7503725e-09,2.9608286e-06
268,===,0.0018068925,2.1080356e-05,2.7498634e-05,0.00044118572,0.9977034,1.2509472e-11
269,Comment on female rappers =,0.0005621039,0.009163922,7.10904e-12,1.9692985e-05,0.9901506,0.00010374738
270,==,0.124878764,0.21344112,0.0013716007,0.0017026727,0.65860575,7.902396e-08
271,"In 2017, Ross was criticized for stating in an interview that he never signed a female rapper because ""I would end up fucking [her] and fucking the business up.""",0.9673082,0.032427326,1.4851177e-07,0.00024728914,1.6565506e-05,3.321429e-07
272,"Ross quickly apologized through a Facebook post where he called his comments ""insensitive"" and a ""mistake [he regrets].""",0.008042419,0.0876841,0.43751913,1.829867e-09,0.0011769041,0.4655774
273,==,0.124878764,0.21344112,0.0013716007,0.0017026727,0.65860575,7.902396e-08
274,Discography ==,0.9999943,1.2030798e-08,8.3584145e-10,5.3618996e-06,2.8147706e-09,3.2553942e-07
275,Studio albums,0.9989698,1.624496e-07,0.00092205545,0.00010677246,6.7923694e-10,1.2428644e-06
276,Port of Miami (2006),0.0056881015,5.3481504e-09,0.00012708954,0.9924919,0.0016929287,4.057824e-09
277,Trilla (2008),0.07004689,0.004160475,0.056671843,0.83929944,0.029070435,0.0007509532
278,Deeper Than Rap (2009),1.40944705e-08,5.215557e-05,0.0014445537,0.00012046677,0.9983714,1.1469574e-05
279,Teflon Don (2010),8.984018e-05,4.5317156e-06,2.0019744e-09,2.4792389e-05,0.9998808,1.8571946e-08
280,"God Forgives, I Don't (2012)",7.280602e-07,0.0023081694,0.16524076,2.1884362e-05,0.7968894,0.03553901
281,Mastermind (2014),2.6900856e-05,6.240522e-07,9.300319e-07,0.00147358,0.99849737,6.0772453e-07
282,Hood Billionaire (2014),0.84598833,0.0003004257,0.0015133751,0.031151524,0.011656353,0.10939006
283,Black Market (2015),0.00014209615,0.06747275,0.91612864,4.6678015e-05,0.015873205,0.00033669153
284,Rather You Than Me (2017),0.00066659885,1.9278012e-05,2.4176927e-07,3.9715875e-09,0.011372335,0.98794156
285,Port of Miami 2 (2019),0.004439273,4.7292184e-09,2.3961247e-06,0.9701249,0.025433395,3.4967045e-09
286,Richer Than I Ever Been (2021)Collaborative albums,0.028025093,0.00057390484,0.005366145,0.9647058,3.981241e-05,0.0012893053
287,Custom Cars & Cycles (with Triple C's) (2009),1.0205383e-09,0.0011417059,4.3508828e-07,9.133978e-06,0.9988206,2.8087661e-05
288,==,0.124878764,0.21344112,0.0013716007,0.0017026727,0.65860575,7.902396e-08
289,Filmography ==,0.99997985,3.8154094e-10,9.0419326e-07,1.224641e-10,4.517803e-06,1.4692185e-05
290,==,0.124878764,0.21344112,0.0013716007,0.0017026727,0.65860575,7.902396e-08
291,Awards and nominations ==,4.2284873e-06,9.654204e-10,3.5180038e-12,1.5419893e-10,8.16167e-15,0.9999958
292,===,0.0018068925,2.1080356e-05,2.7498634e-05,0.00044118572,0.9977034,1.2509472e-11
293,Bet Awards ===,1.1145473e-07,1.663336e-06,2.6898294e-14,7.5522975e-09,5.1940293e-13,0.9999982
294,===,0.0018068925,2.1080356e-05,2.7498634e-05,0.00044118572,0.9977034,1.2509472e-11
295,Grammy Awards ===,6.5383485e-09,1.4023966e-07,9.21136e-12,6.4295756e-11,9.473387e-13,0.9999999
296,The Grammy Awards are awarded annually by the National Academy of Recording Arts and Sciences of the United States.,0.0011118772,0.00010089251,4.505155e-06,3.3651625e-06,1.3325756e-09,0.99877936
297,Rick Ross has five nomination,0.00070078875,2.0056264e-06,1.0170039e-06,2.1260196e-06,2.9372399e-07,0.9992938
298,===,0.0018068925,2.1080356e-05,2.7498634e-05,0.00044118572,0.9977034,1.2509472e-11
299,The Source =,6.945896e-10,1.0,4.9980822e-12,2.9065122e-11,1.3415656e-10,8.01326e-09
300,==,0.12487865,0.2134413,0.001371599,0.0017026742,0.65860564,7.902395e-08
301,==,0.12487865,0.2134413,0.001371599,0.0017026742,0.65860564,7.902395e-08
302,References ==,2.5077119e-05,0.018098911,8.965051e-05,0.06194974,4.4582813e-09,0.9198366
303,==,0.12487865,0.2134413,0.001371599,0.0017026742,0.65860564,7.902395e-08
304,External links ==,0.00023526642,1.3075892e-06,6.913511e-10,2.5650536e-07,3.6421334e-08,0.9997632
305,Official website,0.0012255516,4.507715e-12,3.0528519e-10,4.2257152e-08,5.4052973e-12,0.99877435
306,Rick Ross at IMDb,0.91323453,0.0037353819,0.015454934,0.048873056,0.00060350954,0.018098593
