,Sentence,Business meeting,Coincidence,Education,Music making,Personal life,Public celebration
119,"The marked the centennial of Indian cinema and Babelsberg Studio, the world's oldest film studio.",0.99781847,3.88216e-08,3.672125e-06,0.002100241,4.42048e-07,7.710785e-05
120,"In Summer 2012 Rahman composed a Punjabi song for the London Olympics opening ceremony, directed by Danny Boyle, part of a medley showcasing Indian influence in the UK.",0.001571696,0.022056498,5.668845e-09,0.038716607,1.182231e-05,0.9376434
121,Indian musician Ilaiyaraja's song from the 1981 Tamil-language film Ram Lakshman was also chosen for the medley.,0.0013825019,0.943043,3.0437888e-09,0.053728577,0.0016607038,0.00018523478
122,"In December 2012 Rahman and Shekhar Kapoor launched Qyuki, a networking site which is a platform for story writers to exchange their thoughts.",9.0512043e-07,0.1806998,9.854831e-07,0.013878098,1.2926422e-08,0.8054202
123,"Cisco invested ₹270 million in the startup, giving it a 17-percent share.",0.9926198,3.273016e-05,9.351564e-06,0.00022314973,6.803164e-11,0.007114862
124,Qyuki uses Cisco's cloud infrastructure for the site.,0.00030633004,9.651065e-06,2.154028e-05,0.99948275,2.894662e-10,0.0001796807
125,"On 20 December he released the single ""Infinite Love"" in English and Hindi, commemorating the last day of the Mayan calendar to spread hope, peace and love.",0.0024040309,1.8241886e-05,1.47416695e-05,0.3054746,7.697378e-06,0.6920807
126,"Rahman's 2013 tour, Rahmanishq, was announced on 29 July 2013 in Mumbai.",0.2969005,0.013588656,5.4126595e-08,0.68689686,1.0521994e-09,0.0026139207
127,"Beginning in Sydney on 24 August, the tour moved to a number of cities in India.",0.3152732,0.08885833,0.5927346,0.0006731552,1.8391569e-05,0.0024423755
128,"In January 2016, after a long break Rahman performed live in Chennai and for the first time in Coimbatore & Madurai, with a complete Tamil playlist.",2.193776e-12,2.7938083e-06,4.818816e-11,0.99999726,3.0792247e-13,2.1904792e-10
129,"As the name suggests, Nenje Yezhu (which means rise up) began 2016 with a positive note and with music from the heart.",0.9279759,1.3406947e-05,5.7916164e-05,0.06239761,0.009535415,1.9700245e-05
130,"The proceeds of this concert will be used for flood relief in Tamil Nadu and also for creating awareness against cancer, supporting VS Medical Trust outside Chennai.",4.1963915e-07,6.098611e-08,1.5320459e-09,0.99937433,3.216697e-05,0.0005930975
131,Rahman released a 19-minute orchestral composition The Flying Lotus  in 2017 featuring the demonetisation.,4.9847393e-10,5.5469824e-09,3.240461e-09,0.9999962,8.0699426e-11,3.7891534e-06
132,This musical piece is an open interpretation of this major stance against black money which also includes Narendra Modi's speech.,8.498145e-06,8.890073e-05,1.3688254e-09,0.9999012,6.443436e-08,1.3054047e-06
133,"On 15 August 2018, Rahman appeared as the host in the 5-episode series of Amazon Prime Video titled ""Harmony"".",0.000115841125,0.9823418,7.67963e-05,0.016509755,4.8223394e-09,0.0009558593
134,"Rahman launched India's first YouTube Original, ARRived, which aims to find the best singing talent from across country.",2.53008e-08,0.999998,1.4629934e-07,4.5906046e-07,2.791984e-11,1.4871503e-06
135,The series has 13 episodes and the first episode was uploaded on 7 November 2018.,0.99998975,5.6512636e-08,3.0191293e-07,7.2650874e-07,6.1920126e-12,9.19961e-06
136,"Rahman is the main judge and he is accompanied by Shaan, Vidya Vox and Clinton Cerejo.",0.97299206,0.00032015247,0.00030843777,0.015197087,8.008087e-09,0.011182303
137,"On 16 January 2019, Maruti Suzuki India Limited launched NEXA Music, a platform where 24 artists will be picked and mentored by Rahman and Clinton Cerejo to create international music in India.",2.0083795e-05,0.0009210275,0.032699205,0.9663353,1.10318474e-07,2.4341402e-05
138,Rahman also appeared as a judge on The Voice.,0.0138500035,0.98022217,0.0056591462,0.0002685756,9.243526e-09,2.0944522e-07
139,The show began airing on 3 February 2019 on StarPlus.,0.9276862,0.0007644038,0.0011887866,0.070333734,2.6696396e-05,2.6642016e-07
140,"Rahman partnered with Marvel to compose a promotional track titled ""Marvel Anthem"" in Hindi, Tamil and Telugu for Avengers: Endgame (2019).",2.120857e-06,4.5323185e-07,1.4971429e-08,0.9999962,2.586231e-10,1.2048492e-06
141,Rahman has sung and composed the track spiced up with rap and heavy percussion.,8.037046e-08,0.00036905913,4.9850028e-06,0.99962544,3.3364742e-07,1.4074694e-09
142,"The lyrics are by Nirmika Singh, and MC Heam (rap).",1.2566983e-05,0.19968264,0.7137268,0.0042029796,0.004176224,0.07819883
143,"The film's team also walked the red carpet and also took a selfie with over 3,500 audience members.",0.0020045836,0.4773312,9.304379e-08,5.4648063e-07,1.6555787e-06,0.52066195
144,"The Irish rock band U2 collaborated with Rahman to release a single, ""Ahimsa"", in December 2019.",0.13892107,0.032376792,0.0007549501,0.827946,1.1888392e-06,4.922115e-10
145,"The song was named for the Sanskrit word for non-violence, and lyrically was intended to celebrate the ethnical and spiritual diversity in India.",4.917018e-06,0.00048142226,1.3184462e-07,0.66698694,6.671602e-08,0.33252656
146,"Rahman stated that ahimsa requires courage and strength, and that the song is a celebration of non-violence and peace.",4.3072792e-05,0.3713422,0.0003504414,0.29340136,5.0628435e-09,0.3348629
147,==,0.124877945,0.21344653,0.001371655,0.001702694,0.6586011,7.902461e-08
148,Musical style and impact ==,0.012166287,3.5946327e-05,5.4859556e-05,0.9481966,0.0027942855,0.036752038
149,"Skilled in Carnatic music, Western and Hindustani classical music and the Qawwali style of Nusrat Fateh Ali Khan, Rahman is noted for film songs amalgamating elements of these and other genres, layering instruments from different musical idioms in an improvisational style.",5.6663503e-05,0.12103121,6.0374123e-06,0.8788167,4.5664943e-05,4.3635628e-05
150,"During the 1980s Rahman recorded monaural arrangements in common with his musical predecessors, K. V. Mahadevan and Vishwanathan–Ramamoorthy.",2.437457e-14,9.701869e-06,4.853138e-16,0.99999034,3.6350492e-11,1.6236238e-12
151,He has also worked as a pianist in Ilaiyaraaja's troupe for hundreds of movies.,0.9762147,9.84961e-11,4.0469872e-10,0.023782676,2.6711712e-06,1.7418088e-11
152,"In later years his methodology changed, as he experimented with the fusion of traditional instruments with new electronic sounds and technology.",9.171263e-05,0.014830448,0.001824034,0.28043896,0.30561858,0.39719623
153,Rahman's musical interests and outlook originate in his love of experimentation.,0.0021192997,0.98761904,0.00028201804,0.009978561,1.0590774e-06,3.7500172e-08
154,"His compositions have an auteuristic use of counterpoint, orchestration and the human voice, melding Indian pop music with a unique timbre, form and instrumentation.",0.004055348,0.0018550444,6.282166e-05,0.9939627,2.6601734e-05,3.7420945e-05
155,"With this syncretic style and wide-ranging lyrics, the appeal of Rahman's music crosses classes and cultures in Indian society.",1.0994496e-08,0.9994332,0.00031158284,3.232569e-06,6.288296e-06,0.00024572422
156,"His first soundtrack, for Roja, was listed on Time's all-time ""10 Best Soundtracks"" in 2005.",0.010861746,1.05196904e-07,8.335162e-09,0.9760048,3.2476494e-11,0.013133366
157,"Film critic Richard Corliss said that the composer's ""astonishing debut work parades Rahman's gift for alchemizing outside influences until they are totally Tamil, totally Rahman"", and his initial global success is attributed to the South Asian diaspora.",0.02544311,0.8888123,1.1562875e-07,0.085743256,8.887126e-08,1.0206592e-06
158,"Music producer Ron Fair considers Rahman ""one of the world's great living composers in any medium"".",2.2652506e-05,0.0002856115,8.6831584e-08,0.9996902,1.0449479e-08,1.5146941e-06
159,Director Baz Luhrmann said:  I had come to the music of A. R. Rahman through the emotional and haunting score of Bombay and the wit and celebration of Lagaan.,6.408685e-11,0.86181825,1.3723852e-08,0.1381817,6.823705e-10,2.3382335e-10
160,But the more of AR's music I encountered the more I was to be amazed at the sheer diversity of styles: from swinging brass bands to triumphant anthems; from joyous pop to West-End musicals.,9.499039e-08,0.999913,4.808045e-07,8.38478e-05,2.6164723e-06,2.0332806e-08
161,"Whatever the style, A. R. Rahman's music always possesses a profound sense of humanity and spirit, qualities that inspire me the most.",4.9875027e-05,0.81412965,0.042542387,0.14236778,0.00091021974,7.018024e-08
162,Rahman introduced 7.1 surround sound technology to South Indian films.,0.0004298762,0.003601996,1.4707841e-08,0.8005154,1.0724404e-08,0.19545273
163,"Rahman is one of the best-selling music artists in India, with an estimated 150 million records sold worldwide.",0.3441937,0.00057122717,0.0006509499,0.5751668,1.6713119e-07,0.07941715
164,On 21 May 2014 Rahman announced that he has partnered with former Black Eyed Peas' Will.i.am to recreate an early popular track 'Urvashi Urvashi'.,0.5495747,0.056418657,0.0006702076,0.3933352,1.169576e-06,3.6712088e-08
165,Track is 'Birthday'.,4.990235e-07,9.5458545e-06,1.3953906e-08,0.004396755,0.10503162,0.8905615
166,==,0.12487781,0.21344641,0.0013716524,0.0017026925,0.6586014,7.902465e-08
167,Personal life ==,0.002554406,0.00046550515,4.8373175e-07,1.0761065e-09,8.063284e-05,0.996899
168,"Rahman is married to Saira Banu (not to be confused with actress Saira Banu); they have three children: Khatija, Rahima and Ameen.",9.475553e-06,0.7222684,0.0001901059,2.3942343e-05,0.24875225,0.02875577
169,"Ameen has sung ""NaNa"" from Couples Retreat, and Khatija has sung ""Pudhiya Manidha"" from Enthiran.",5.4839515e-05,3.0248082e-05,6.472637e-06,0.99693066,2.7037154e-07,0.0029775978
170,"Composer G. V. Prakash Kumar is the son of Rahman's elder sister, A. R. Reihana.",6.0087936e-05,8.415712e-06,0.00023485812,0.00032647117,0.9993482,2.1903075e-05
171,"Rahman's younger sister, Fathima, heads his music conservatory in Chennai.",3.2737155e-06,1.2623543e-05,0.0003570066,0.14146729,0.8581579,1.9139534e-06
172,"The youngest, Ishrath, has a music studio.",0.0037681598,3.34476e-10,1.0089808e-05,0.011805438,0.9844163,7.404521e-12
173,A.R. Rahman is the co-brother of film actor Rahman.,7.3385614e-05,0.16147374,0.00040056472,0.68096226,0.15566146,0.0014285768
174,"Born Hindu, Rahman converted to Islam when he was in his 20s.",0.47889194,0.5125291,0.0059076683,0.0001478451,0.00013715948,0.0023863844
175,"After the early death of his father, his family experienced difficult times; Sufism influenced his mother, who was a practising Hindu and, eventually, his family.",1.7805654e-08,8.25307e-06,0.030018326,1.9993307e-07,0.010413252,0.9595599
176,"During the 81st Academy Awards ceremony Rahman paid tribute to his mother: ""There is a Hindi dialogue, mere pass ma hai, which means 'even if I have got nothing I have my mother here'.""",1.6438273e-05,6.465817e-05,0.00012579758,9.722609e-07,2.36973e-06,0.9997898
177,"He said, ""Ella pughazhum iraivanukke"" (""All praise to God"" in Tamil, a translation from the Quran) before his speech.",0.013579106,2.4945984e-05,0.007437865,0.45332503,0.52457035,0.0010627018
178,==,0.12487809,0.21344268,0.0013716145,0.0017026803,0.65860486,7.902394e-08
179,Philanthropy ==,0.0017611146,4.8106144e-11,0.58773905,3.2400549e-06,0.13586771,0.27462882
180,Rahman is involved with a number of charitable causes.,9.833759e-05,0.00037171048,0.00012924691,0.99191135,3.0901313e-06,0.007486353
181,"In 2004 he was appointed as the global ambassador of the Stop TB Partnership, a WHO project.",0.9999987,2.6586534e-08,4.7512516e-10,4.1413483e-07,1.0892641e-13,9.394394e-07
182,"Rahman has supported Save the Children India and worked with Yusuf Islam on ""Indian Ocean"", a song featuring a-ha keyboard player Magne Furuholmen and Travis drummer Neil Primrose.",5.5248875e-06,0.0030282044,3.4585669e-06,0.9969607,2.1287403e-06,4.16469e-11
183,Proceeds from the song went to help orphans in Banda Aceh who were affected by the 2004 Indian Ocean Tsunami.,1.363411e-09,0.00047531124,0.00023840267,0.22842617,1.4175191e-05,0.7708459
184,"He produced the single ""We Can Make It Better"" by Don Asian with Mukhtar Sahota.",2.0559903e-05,2.4234414e-06,2.5814476e-08,0.9999769,1.5670575e-07,2.5095e-08
185,"In 2008 Rahman opened the KM Music Conservatory with an audio-media education facility to train aspiring musicians in vocals, instruments, music technology and sound design.",6.4743273e-09,2.3590756e-09,0.9999981,1.8521889e-06,6.4295487e-12,2.0592477e-09
186,"The conservatory (with prominent musicians on staff and a symphony orchestra) is located near his studio in Kodambakkam, Chennai and offers courses at several levels.",0.008760985,2.7859787e-07,0.8094393,0.18179274,1.4235569e-06,5.265702e-06
187,Violinist L. Subramaniam is on its advisory board.,0.00013514291,1.8051679e-09,2.618508e-07,0.9998646,2.7939011e-08,1.5521561e-09
188,Several of Rahman's proteges from the studio have scored feature films.,0.005532282,3.5169594e-06,1.1715329e-07,0.9944641,2.2539168e-10,9.151073e-13
189,"In 2009, he founded Sunshine Orchestra with a vision to introduce India's first symphony orchestra where economically and socially deprived children get free music education by the KM Music Conservatory.",0.014324557,0.0022928722,0.013575416,0.62298805,0.07933494,0.26748422
190,He composed the theme music for a 2006 short film for The Banyan to aid poor women in Chennai.,1.7344642e-10,2.0389948e-10,6.4278563e-13,0.9999987,9.682561e-09,1.3330929e-06
191,"In 2008 Rahman and noted percussionist Sivamani created a song, ""Jiya Se Jiya"", inspired by the Free Hugs Campaign and promoted it with a video filmed in a number of Indian cities for a cause.",1.1411515e-09,2.2905541e-10,2.237595e-07,2.9423434e-05,4.1434652e-07,0.99996996
192,"In 2017, he announced one heart foundation which would support people from music industry.",0.85094905,1.3573482e-06,0.0012820187,0.12327924,0.0005245815,0.023963815
193,"Rahman announced  Ta Futures, a collaborative culture project that would curate and celebrate the sounds of Tamil Nadu.",0.009276072,0.0003791108,9.0802473e-07,0.98983884,1.6394823e-06,0.000503369
194,"While this idea initially started off like a city symphony project where we were looking at capturing the sounds of the city, I wanted to make it more participatory.",1.4901116e-10,2.9626978e-08,6.170551e-05,0.064193934,0.000372975,0.9353714
195,"In children, particularly, I want it to trigger a whole different thought process as this is not about film music or film stars and I want them to create and compose their future - Rahman on announcing Ta Futures project on Chennai",0.12849821,0.35638478,6.534723e-05,0.0005347637,0.51316,0.0013569068
196,"In 2019, Rahman performed a Sufi Benefit Concert at the annual New York gala of Pratham, one of the largest non-governmental organisations in India, which focuses on the provision of quality education to India's underprivileged children.",2.3686468e-11,7.0503053e-10,2.0925171e-11,4.132787e-05,2.2333342e-12,0.99995863
197,Rahman and his ensemble performed the full dinner concert on a pro-bono basis.,4.2022254e-08,8.640986e-10,2.7779513e-12,0.99657923,8.65222e-13,0.0034207508
198,"Afterward, Rahmam wrote on Twitter that his ""long time dream of performing #Sufimusic for human causes came true"" and thanked attendees for their respect and generosity.",3.1442486e-08,8.1107944e-05,2.8566567e-09,2.1447638e-06,1.5585745e-12,0.9999167
199,==,0.12487781,0.21344641,0.0013716524,0.0017026925,0.6586014,7.902465e-08
200,Discography ==,0.9999943,1.2030752e-08,8.358399e-10,5.3618996e-06,2.8147706e-09,3.2553942e-07
201,==,0.12487781,0.21344641,0.0013716524,0.0017026925,0.6586014,7.902465e-08
202,Filmography ==,0.99997985,3.8154094e-10,9.0419326e-07,1.224641e-10,4.517803e-06,1.4692185e-05
203,===,0.0018069104,2.1080758e-05,2.7498896e-05,0.00044119143,0.9977034,1.2509519e-11
204,Composer =,0.7396092,8.908869e-08,0.16851191,0.09182944,4.1641197e-05,7.797475e-06
205,==,0.124877945,0.21344653,0.001371655,0.001702694,0.6586011,7.902461e-08
206,===,0.0018069104,2.1080758e-05,2.7498896e-05,0.00044119143,0.9977034,1.2509519e-11
207,Director =,0.9999963,1.1763431e-08,1.6820043e-06,1.1136661e-06,9.1968315e-07,1.495964e-08
208,==,0.124877945,0.21344653,0.001371655,0.001702694,0.6586011,7.902461e-08
209,Le Musk,1.1240597e-09,0.0013655603,5.254805e-06,1.283184e-07,0.99862814,1.003626e-06
210,===,0.0018069104,2.1080758e-05,2.7498896e-05,0.00044119143,0.9977034,1.2509519e-11
211,Producer and writer,0.0011491447,6.474771e-10,0.00024350405,0.9986071,2.0232997e-07,1.216718e-09
212,===,0.0018069104,2.1080758e-05,2.7498896e-05,0.00044119143,0.9977034,1.2509519e-11
213,Le Musk,1.1240597e-09,0.0013655603,5.254805e-06,1.283184e-07,0.99862814,1.003626e-06
214,Atkan Chatkan (2020; producer),0.0652781,8.0897587e-07,1.6430148e-06,0.05578495,0.8789345,1.7923162e-10
215,99 Songs (2021),0.07786594,2.6865027e-07,4.1604413e-05,0.88336813,0.03872382,1.9443198e-07
216,===,0.0018069088,2.1080758e-05,2.7498896e-05,0.000441192,0.9977034,1.2509519e-11
217,Performer =,0.01119124,1.7262797e-08,5.576623e-07,0.0005031781,1.7670245e-05,0.9882874
218,==,0.124877945,0.21344653,0.001371655,0.001702694,0.6586011,7.902461e-08
219,One Heart (2017),1.357214e-07,1.0046162e-08,1.647327e-05,0.5495707,0.44411886,0.006293861
220,===,0.0018069104,2.1080758e-05,2.7498896e-05,0.00044119143,0.9977034,1.2509519e-11
221,Actor =,0.15450597,1.02309286e-07,1.9449435e-07,0.82505465,0.02043834,8.2421224e-07
222,==,0.124877945,0.21344653,0.001371655,0.001702694,0.6586011,7.902461e-08
223,"Bigil (2019) (Cameo in ""Singappenney"" song)",0.0017111828,0.08049621,1.3184016e-08,0.9148953,0.0028526853,4.4614506e-05
224,Aaraattu (2021),0.029030576,8.720387e-06,4.5670826e-05,0.016838742,0.9540739,2.3878529e-06
225,==,0.124877945,0.21344653,0.001371655,0.001702694,0.6586011,7.902461e-08
226,Awards ==,8.535015e-10,2.7788607e-08,7.99061e-13,1.3207355e-11,1.5073803e-12,1.0
227,"A six-time National Film Award winner and recipient of six Tamil Nadu State Film Awards, he has fifteen Filmfare Awards and sixteen Filmfare Awards South for his music.",0.8636044,6.0699977e-06,3.956743e-05,0.000112978974,1.8458408e-05,0.13621855
228,"Rahman has received a Kalaimamani from the Government of Tamil Nadu for excellence in the field of music, musical-achievement awards from the governments of Uttar Pradesh and Madhya Pradesh and a Padma Shri from the Government of India.",6.7980475e-09,6.17478e-06,5.2478316e-07,2.5604348e-07,1.4535904e-13,0.9999931
229,"In 2006, he received an award from Stanford University for his contributions to global music.",4.2446892e-08,8.991055e-06,0.2659485,1.7422088e-05,5.8153315e-11,0.73402506
230,"The following year, Rahman entered the Limca Book of Records as ""Indian of the Year for Contribution to Popular Music"".",2.700617e-05,0.18131486,3.576245e-11,0.6074663,4.6574307e-11,0.21119183
231,He received the 2008 Lifetime Achievement Award from the Rotary Club of Madras.,1.3297784e-13,3.5494643e-10,2.2393983e-12,1.3729279e-12,2.5321958e-11,1.0
232,"In 2009, for his Slumdog Millionaire score, Rahman won the Broadcast Film Critics Association Award, the Golden Globe Award for Best Original Score, the BAFTA Award for Best Film Music and two Academy Awards (Best Original Score and Best Original Song, the latter shared with Gulzar) at the 81st Academy Awards.",1.4137137e-06,0.0010309856,3.531656e-05,0.025332646,9.516805e-10,0.9735996
233,"He has received honorary doctorates from Middlesex University, Aligarh Muslim University, Anna University in Chennai and Miami University in Ohio.",3.2250764e-08,2.1226729e-06,0.019164117,9.622348e-05,3.1222393e-05,0.9807062
234,The composer has won two Grammy Awards: Best Compilation Soundtrack Album and Best Song Written for Visual Media.,2.872677e-07,0.00010758255,0.00022341507,0.00013616787,3.1243518e-11,0.9995326
235,"Rahman received the Padma Bhushan, India's third-highest civilian honour, in 2010.",5.4356757e-08,4.654992e-06,0.00020268043,0.001539639,3.3128028e-11,0.9982529
236,"His work in 127 Hours won him Golden Globe, BAFTA, and two Academy Award nominations (Best Original Music Score and Best Original Song) in 2011.",0.025383634,0.00075043447,0.08232185,0.002513558,2.3000484e-07,0.8890303
237,Rahman is an Honorary Fellow of the Trinity College of Music.,1.29870305e-05,0.0009963576,0.7718709,0.22546923,7.144048e-08,0.0016504436
238,On 24 October 2014 Rahman was awarded an honorary doctorate from Berklee College of Music during a concert paying tribute to his music featuring an international cast of students.,1.8234532e-07,1.2874774e-07,0.02105211,0.0001384116,1.565667e-11,0.9788092
239,"Upon receiving his award he commented that being honoured by Berklee illustrates how his life has come full circle, as at the start of his career, he had planned to study at Berklee before being offered the opportunity to score Roja.",1.8682531e-05,0.94818944,0.050683096,6.064722e-08,1.909547e-12,0.0011087162
240,"During his 7 May 2012 acceptance speech of his honorary doctorate from Miami University in Ohio, Rahman mentioned that he received a Christmas card from the family of the President of the United States and an invitation to dinner at the White House.",2.2173926e-16,2.1230347e-08,7.9995795e-07,4.6040824e-13,9.557155e-13,0.99999917
241,"A street was named in his honour in Markham, Ontario, Canada in November 2013.",1.3033519e-05,4.0739188e-08,1.2848407e-08,1.0029925e-05,0.00033364046,0.9996432
242,"On 4 October 2015, the government of Seychelles named A. R. Rahman Cultural Ambassador for Seychelles in appreciation of the ""invaluable services contributed to enhance Seychelles' Arts and Culture development.",0.00022878817,6.0489846e-10,9.338437e-09,5.233011e-05,1.3183096e-09,0.99971884
243,"""In January 2018, He has been appointed as the Brand Ambassador of the Sikkim government.",0.9997286,3.360038e-10,3.420716e-08,2.2570765e-09,5.0377657e-06,0.000266412
244,A.R. Rahman will promote and project the state's achievements nationally and globally.,8.5044585e-06,1.9810932e-08,7.182267e-07,0.8706183,2.6061786e-09,0.12937248
245,"Rahman was honoured with the Pride of Indian Music award at the first Zee Cine Awards Tamil, held on 4 January 2020 in Chennai.",5.8269785e-09,4.963469e-07,5.423657e-10,8.862173e-07,3.7536816e-15,0.99999857
246,"The UK-based world-music magazine Songlines named him one of ""Tomorrow's World Music Icons"" in August 2011.",0.0861813,0.31578422,1.669661e-05,6.758831e-09,2.3499756e-07,0.5980176
247,"For years, he has been regularly listed one among The 500 Most Influential Muslims in the world.",0.5068255,0.05012161,0.00023914635,0.001465347,1.3016837e-07,0.44134828
248,"Currently, he is also on the Board of Advisors of India's International Movement to Unite Nations (I.I.M.U.N.).",0.0001594751,1.1705478e-07,0.006016751,0.9937966,1.8581563e-06,2.51752e-05
249,== 99 Songs ==,0.012107456,1.656783e-05,9.03375e-05,0.9871349,0.0005984472,5.228368e-05
250,"99 Songs is a musical romance film co-written and produced by A. R. Rahman, who thus makes his debut in both roles, apart from composing the original score and songs.",0.001428153,2.1009603e-06,1.7505938e-07,0.99855834,1.123663e-05,3.2124759e-13
251,"99 Songs is the first Indian soundtrack album to use Dolby Atmos technology, and Rahman became the first Indian artist to create music album of the film in this technology.",0.011125852,1.3220915e-05,3.5507334e-08,0.9888604,2.215246e-07,2.7302693e-07
252,"The film stars debutants Ehan Bhat and Edilsy Vargas, alongside Aditya Seal, Lisa Ray and Manisha Koirala among others portray supporting characters.",0.33932346,0.00021852109,5.611004e-07,0.6603705,2.8643167e-06,8.418426e-05
253,The film is a sensual story about art and self-discovery of a struggling singer who wants to be a successful music composer.,0.99999917,3.5461989e-07,4.034095e-08,1.4156394e-07,2.898697e-08,3.3344028e-07
254,The background music and soundtrack for the film was composed by A. R. Rahman.,3.4684915e-09,4.278372e-06,6.2734545e-13,0.9999957,3.1606824e-09,2.411405e-09
255,"The full soundtrack was released by Sony Music India on 20 March 2020., which consist of 14 songs included The Oracle (song), Humnawaa & more, each in Hindi, Tamil and Telugu languages & The album received highly positive reviews from critics.",0.0518853,1.0850271e-05,1.6930007e-07,0.94657487,1.8801156e-09,0.0015287916
256,A. R. Rahman said in an interview with Anupama Chopra:There are two things could happen.,5.2203104e-09,0.9999354,2.2222804e-09,3.7321828e-05,2.735293e-05,1.723893e-10
257,One saying this is going to be a new wave in Hindi cinema or (smile) they will just throw it in my face,0.4548707,0.40742454,4.377419e-07,0.0005323152,0.079739496,0.05743251
258,==,0.124877945,0.21344653,0.001371655,0.001702694,0.6586011,7.902461e-08
259,Biographies ==,0.0017652877,1.1836043e-05,6.848027e-08,6.590759e-12,1.11336085e-05,0.99821174
260,Nasreen Munni Kabir (2011).,2.5214597e-06,0.0003335874,1.5996633e-08,6.33907e-06,0.013704691,0.98595285
261,A. R. Rahman: The Spirit of Music.,7.746073e-08,0.9860115,7.787342e-05,0.013801057,1.1663406e-05,9.775855e-05
262,Om Books International.,5.4569116e-10,4.0669274e-05,0.0018222531,0.9955069,4.8564525e-05,0.002581609
263,ISBN 978-93-80070-14-8.,2.0466825e-08,3.853741e-11,4.0330983e-07,1.7203101e-08,1.3337585e-05,0.9999862
264,"Mathai, Kamini (2009).",1.0890767e-05,0.002983837,7.5020404e-07,0.008553379,0.15944824,0.829003
265,A. R. Rahman: The Musical Storm.,5.035163e-05,0.9568576,0.0006182065,0.04246057,1.3130925e-05,9.2217256e-08
266,Viking Press.,9.918361e-07,0.0020366535,0.015775168,0.21203588,0.75094336,0.019207947
267,ISBN 978-06-70083-71-8.,4.4271495e-08,1.2833964e-10,7.5181526e-07,1.3591323e-07,0.00014260106,0.9998565
