,Sentence,Business meeting,Coincidence,Education,Music making,Personal life,Public celebration
0,Allah Rakha Rahman (pronunciation ; born A. S. Dileep Kumar; 6 January 1967),0.0023365149,9.720954e-08,0.076793194,0.9169007,0.0037938727,0.0001755392
1,"is an Indian film composer, record producer, singer and songwriter who works predominantly in Tamil and Hindi films.",0.9997198,4.4718753e-09,6.6632815e-08,0.00024855047,2.6943091e-05,4.57552e-06
2,"In 2010, the Indian government awarded him the Padma Bhushan, the nation's third-highest civilian award.",1.2558124e-08,9.0124885e-09,1.9733326e-07,1.0648818e-08,1.4905334e-10,0.99999976
3,"Among Rahman's awards are six National Film Awards, two Academy Awards, two Grammy Awards, a BAFTA Award, a Golden Globe Award, fifteen Filmfare Awards and seventeen Filmfare Awards South.",3.5221405e-05,0.000675945,0.00011805127,7.597988e-08,2.639391e-12,0.9991708
4,Rahman initially composed scores for different documentaries and jingles for advertisements and Indian television channels.,0.00053385936,0.06543399,1.245384e-06,0.9335097,2.7715545e-09,0.00052114925
5,"With his in-house studio Panchathan Record Inn, Rahman's film-scoring career began during the early 1990s with the Tamil film Roja.",0.4638744,3.3758613e-07,6.516039e-08,0.53612494,7.8300135e-12,2.3851803e-07
6,"Following that, he went on to score several songs for Tamil language films, including Ratnam's politically charged Bombay, the urban Kadhalan, Thiruda Thiruda, and S. Shankar's debut film Gentleman.",0.005411091,0.49877793,3.0817003e-07,0.49556968,0.00022585873,1.5169433e-05
7,"Rahman's score for his first Hollywood film, the comedy Couples Retreat (2009), won the BMI Award for Best Score.",3.8481883e-07,0.0003419806,1.7680362e-07,0.75821126,3.4696138e-10,0.2414462
8,His music for Slumdog Millionaire (2008) earned him Best Original Score and Best Original Song at the 81st Academy Awards.,3.3900521e-06,1.083946e-05,0.00014529227,0.7705496,5.6351808e-09,0.22929092
9,He was also awarded Best Compilation Soundtrack Album and Best Song Written for Visual Media at the 2010 Grammy Awards.,1.046318e-11,5.9827616e-05,2.0896291e-08,9.404731e-05,3.3217541e-12,0.9998461
10,"He is nicknamed ""Isai Puyal"" (musical storm) and ""Mozart of Madras"".",9.781286e-06,5.629699e-08,1.14644074e-07,0.71076924,0.25686747,0.032353397
11,"Rahman has also become a humanitarian and philanthropist, donating and raising money for a number of causes and charities.",0.0035410128,0.012155888,0.035630696,0.10525489,1.1767656e-05,0.8434057
12,"In 2006, he was honoured by Stanford University for his contributions to global music.",2.3457698e-08,5.9599213e-08,0.5126749,0.00011455705,6.340144e-11,0.48721048
13,"In 2008, he received Lifetime Achievement Award from the Rotary Club of Madras.",4.692539e-13,8.12789e-10,2.39715e-12,5.5085546e-12,7.679327e-12,1.0
14,"In 2009, he was included on the Time list of the world's 100 most influential people.",1.265246e-05,1.7775197e-07,5.124991e-08,3.640398e-09,9.596753e-09,0.9999871
15,"In 2013, he introduced 7.1 surround sound technology to South Indian films.",0.0017052811,3.9473613e-05,5.4840377e-09,0.077369496,1.9175411e-08,0.92088574
16,"In 2014, he was awarded an honorary doctorate from Berklee College of Music.",2.4516007e-06,1.6874746e-09,0.0125349825,5.2023726e-08,4.8054416e-10,0.9874626
17,He has also received honorary doctorate from Aligarh Muslim University.,3.380074e-08,9.1251123e-10,1.3908271e-05,2.7057747e-06,1.1565889e-09,0.9999833
18,"In 2017, he made his debut as a director and writer for the film Le Musk.",0.99985945,1.392647e-07,7.575761e-05,5.5929562e-05,8.722188e-06,6.894553e-11
19,==,0.124877945,0.21344653,0.001371655,0.001702694,0.6586011,7.902461e-08
20,Early life ==,0.0019447302,0.14564976,0.022118486,4.7269286e-06,0.8208643,0.009417957
21,"Allah Rakha Rahman was born as A. S. Dileep Kumar in Madras, Tamil Nadu, on 6 January 1967.",0.042085614,0.014739102,0.00027071242,0.5721778,0.3069035,0.0638233
22,"His father, R. K. Shekhar from a Mudaliar family, was a film-score composer and conductor for Tamil and Malayalam films.",1.5153147e-07,9.792358e-07,8.6999763e-10,0.27029026,0.7297085,7.0807175e-08
23,Rahman began studying piano at age four.,0.0002650061,4.0485048e-08,4.7658235e-05,0.99967396,1.3324701e-05,9.7000144e-11
24,"He assisted his father in the studio, playing the keyboard.",1.917702e-09,5.8071574e-09,0.00011955593,0.012881888,0.9869985,8.118484e-17
25,"After his father's death when Rahman was nine years old, the rental of his father's musical equipment provided his family's income.",1.1392293e-05,0.0009763303,0.00362956,2.9081037e-05,0.9937338,0.0016198573
26,"Raised by his mother, Kareema (born Kashturi), Rahman, who was studying in Padma Seshadri Bala Bhavan had to work to support his family.",3.5066605e-06,0.0006677718,0.0003122028,0.0004620589,0.9952733,0.003281149
27,which led to him to routinely miss classes and fail exams.,0.00014108144,4.5343873e-05,0.9998117,1.1403487e-07,1.5357888e-06,2.7821437e-07
28,"Therefore, the Principal Mrs YGP summoned Rahman and his mother and told them that Rahman should focus on academics irrespective of family circumstances.",0.0007697166,0.09523073,2.307163e-05,0.9032987,0.0006770444,7.38297e-07
29,"However, in an interview in 2012, Rahman said that his mother was summoned and was told to take him to the streets of Kodambakkam to beg and not to send him to the school anymore.",1.3758579e-10,0.982156,0.0074333013,1.5021502e-06,0.00014198791,0.010267201
30,"Rahman attended another school called MCN for a year, and later joined Madras Christian College Higher Secondary School, where he was admitted on his music talent and formed a band with his high school classmates.",9.467848e-10,0.006186142,4.954604e-05,0.9937643,4.9200253e-12,2.6327693e-10
31,"However, after discussing with his mother, he later dropped out of school to pursue a career as a full-time musician.",0.8941586,6.044302e-05,0.105776995,1.7323798e-06,1.8343561e-06,4.5610815e-07
32,"Rahman was a keyboard player and arranger for bands such as Roots (with childhood friend and percussionist Sivamani, John Anthony, Suresh Peters, JoJo and Raja) and founded the Chennai-based rock group Nemesis Avenue.",0.00019739012,0.07659138,0.00043551344,0.92276984,5.8230476e-06,4.7604342e-08
33,"He mastered the keyboard, piano, synthesizer, harmonium and guitar, and was particularly interested in the synthesizer because it was the ""ideal combination of music and technology"".",0.00093804597,0.0002846307,0.9299707,0.0685434,0.00026327075,1.1346021e-09
34,"Rahman began his early musical training under Master Dhanraj, and at age 11 began playing in the orchestra of Malayalam composer (and close friend of his father) M. K. Arjunan.",3.3248587e-06,8.105774e-06,0.0003143206,0.9996251,4.8918577e-05,1.2002302e-07
35,"He soon began working with other composers, such as M. S. Viswanathan, Vijaya Bhaskar, Ilaiyaraaja, Ramesh Naidu, Vijay Anand, Hamsalekha and Raj–Koti, accompanied Zakir Hussain, Kunnakudi Vaidyanathan and L. Shankar on world tours and obtained a scholarship from Trinity College London to the Trinity College of Music.",1.0196732e-06,0.05345955,0.94652075,1.87317e-05,1.5519691e-09,7.5979525e-09
36,"Studying in Madras, Rahman graduated with a diploma in Western classical music from the school.",1.3242145e-09,0.001340145,0.018590327,0.97924095,1.2333692e-06,0.00082726707
37,Rahman was introduced to Qadiri tariqa when his younger sister was seriously ill in 1984.,1.1169366e-10,0.96768624,3.5594967e-09,3.209852e-05,0.03227981,1.8794002e-06
38,His mother was a practising Hindu.,4.771664e-07,8.819949e-10,2.5156682e-05,0.00025054556,0.99966085,6.29425e-05
39,"At the age of 23, he converted to Islam with other members of his family in 1989, changing his name to Allah Rakha Rahman (A. R. Rahman).",0.97483546,0.00020234399,5.0450035e-05,0.0050699953,0.0004743016,0.019367578
40,==,0.124877945,0.21344653,0.001371655,0.001702694,0.6586011,7.902461e-08
41,Career ==,1.0,4.755348e-13,2.1761231e-17,4.5407227e-19,9.245165e-14,7.685994e-12
42,===,0.0018069104,2.1080758e-05,2.7498896e-05,0.00044119143,0.9977034,1.2509519e-11
43,Soundtracks ===,1.39534395e-05,0.00017970653,6.154309e-07,0.26279828,8.302089e-05,0.7369244
44,Rahman initially composed scores for different documentaries and jingles for advertisements and Indian television channels.,0.00053385936,0.06543399,1.245384e-06,0.9335097,2.7715545e-09,0.00052114925
45,"In 1987 Rahman, then still known as Dileep, composed jingles for a line of watches introduced by Allwyn.",0.0001274673,3.4994486e-05,3.042032e-09,0.1344467,0.0004261469,0.86496466
46,"He also arranged the jingles for some advertisements that went on to become very popular, including the popular jingle for Titan Watches, in which he used the theme from Mozart's Symphony no.25.",7.0536903e-06,0.26463303,4.9257255e-06,0.7353439,1.3159284e-06,9.834568e-06
47,"In 1992, he was approached by director Mani Ratnam to compose the score and soundtrack for his Tamil film, Roja.",2.6382422e-06,0.071283415,1.8292425e-06,0.9287106,1.9445062e-07,1.3212217e-06
48,"Rahman's film career began in 1992 when he started Panchathan Record Inn, a recording and mixing studio in his backyard.",0.99999726,2.2250393e-09,7.269604e-13,2.571598e-06,1.7310657e-12,1.4531601e-07
49,"It would become the most-advanced recording studio in India, and arguably one of Asia's most sophisticated and high-tech studios.",0.71803206,0.0011027667,0.09359226,0.18721527,8.32388e-06,4.94163e-05
50,"Cinematographer Santosh Sivan signed Rahman for his second film Yoddha, a Malayalam film starring Mohanlal and directed by Sivan's brother Sangeeth Sivan that released in September 1992.",0.057344977,8.125815e-06,5.151301e-05,0.0011139811,0.9414814,1.8221193e-08
51,"The following year, Rahman received the National Film Awards (Silver Lotus) award for best music director at the National Film Awards for Roja.",7.2318116e-08,3.948217e-06,3.5767574e-08,0.0062051085,5.2926974e-10,0.9937908
52,"The films' score was critically and commercially successful in its original and dubbed versions, led by the innovative theme ""Chinna Chinna Aasai"".",3.464196e-05,1.7196628e-06,1.919612e-10,0.99996364,6.267304e-11,4.420026e-10
53,"Rahman followed this with successful scores and songs for Tamil–language films for the Chennai film industry, including Ratnam's politically charged Bombay, Thiruda Thiruda and S. Shankar's debut film Gentleman (with its popular dance song, ""Chikku Bukku Rayile""), the urban Kadhalan.",0.094108395,0.19722474,5.08207e-07,0.6319386,0.0045366515,0.07219116
54,"Rahman collaborated with director Bharathiraaja on Kizhakku Cheemayile and Karuththamma, producing successful Tamil rural folk-inspired film songs; he also composed for K. Balachander's Duet, which had some memorable Saxophone themes.",2.2878785e-08,3.842666e-06,4.4786921e-10,0.9999962,2.3006125e-08,1.6956665e-08
55,The 1995 film Indira and romantic comedies Mr. Romeo and Love Birds also drew attention.,0.013460376,0.010373712,9.2551045e-10,0.42633376,0.12953496,0.42029724
56,Rahman attracted a Japanese audience with Muthu's success there.,2.8374213e-06,0.99970394,2.5470258e-06,0.00029065073,1.8570898e-11,2.5385274e-09
57,"His soundtracks are known in the Tamil Nadu film industry and abroad for his versatility in combining Western classical music, Carnatic and Tamil traditional and folk-music traditions, jazz, reggae and rock music.",0.1669963,6.435189e-05,0.0010068571,0.82959676,2.6152184e-05,0.0023095824
58,"The soundtrack for Bombay sold 15 million copies worldwide, and ""Bombay Theme"" would later reappear in his soundtrack for Deepa Mehta's Fire and a number of compilations and other media.",1.8795496e-05,4.09769e-07,2.4719833e-09,0.0017756921,3.4956668e-07,0.9982047
59,"It was featured in the 2002 Palestinian film Divine Intervention and the 2005 Nicolas Cage film, Lord of War.",3.0089804e-08,0.0006681686,1.2628534e-07,0.9993278,3.9878178e-06,5.7967867e-08
60,"Rangeela, directed by Ram Gopal Varma, was Rahman's Bollywood debut.",0.999416,7.2044386e-06,7.0802306e-09,0.0005600329,7.4080257e-09,1.68215e-05
61,Successful scores and songs for Dil Se.. and the percussive Taal followed.,0.001743455,0.0002011198,1.489255e-05,0.9976151,1.3457856e-08,0.0004255421
62,"Sufi mysticism inspired ""Chaiyya Chaiyya"" from the former film and ""Zikr"" from his soundtrack album for Netaji Subhas Chandra Bose: The Forgotten Hero (which featured elaborate orchestral and choral arrangements).",8.854364e-05,0.042613674,3.8485427e-07,0.26285475,8.7053166e-07,0.6944418
63,"Rahman's soundtrack album for the Chennai production Minsaara Kanavu won him his second National Film Award for Best Music Direction and a South FilmFare Award for Best Music Direction in a Tamil film in 1997, the latter setting a record of six consecutive wins; he later went on to win the award three consecutive additional times.",0.00027812546,0.0008784958,1.8814172e-06,0.046054527,1.405463e-08,0.952787
64,"The musical cues in the soundtrack albums for Sangamam and Iruvar used Carnatic vocals, the veena, rock guitar and jazz.",9.300196e-07,0.0004890893,1.577709e-06,0.9995065,1.9530771e-06,1.5237799e-12
65,"During the 2000s, Rahman composed scores and popular songs for Rajiv Menon's Kandukondain Kandukondain, Alaipayuthey, Ashutosh Gowariker's Swades, Rang De Basanti and songs with Hindustani motifs for 2005's Water.",8.570576e-09,0.00045679507,9.585368e-06,0.9995246,9.057434e-06,4.941287e-10
66,"Rahman has worked with Indian poets and lyricists such as Javed Akhtar, Gulzar, Vairamuthu and Vaali, and has produced commercially successful soundtracks with directors Mani Ratnam and S. Shankar (Gentleman, Kadhalan, Indian, Jeans, Mudhalvan, Nayak, Boys, Sivaji, Enthiran, I and 2.0).",1.3851675e-05,0.20593889,0.0001533069,0.7938772,1.1093171e-05,5.6753124e-06
67,"In 2005 Rahman expanded his Panchathan Record Inn studio by establishing AM Studios in Kodambakkam, Chennai, creating the most cutting-edge studio in Asia.",0.00015712684,2.1231509e-07,9.492674e-10,0.99984264,1.333209e-08,5.2641185e-09
68,"The following year he launched his own music label, KM Music, with his score for Sillunu Oru Kaadhal.",0.032718,1.2147666e-06,5.230433e-09,0.96728075,4.585639e-08,4.2791756e-10
69,"Rahman scored the Mandarin-language film Warriors of Heaven and Earth in 2003 after researching and using Chinese and Japanese classical music, and won the Just Plain Folks Music Organization|Just",8.462895e-07,0.003431854,6.0822156e-05,0.9965064,2.0153145e-08,8.06871e-12
70,Plain Folks Music Award For Best Music Album for his score for 2006's Varalaru (God Father).,0.04434535,0.0002564951,4.0746534e-07,0.0037732397,0.0014285652,0.9501959
71,"He co-scored Shekhar Kapur's second British film, Elizabeth: The Golden Age, in 2007 and received a Best Composer Asian Film Award nomination at the Hong Kong International Film Festival for his Jodhaa Akbar score.",0.0005122857,0.0007363281,2.675747e-06,0.9987406,5.31966e-07,7.6110086e-06
72,"Rahman's music has been sampled for other scores in India, appearing in Inside Man, Lord of War, Divine Intervention and The Accidental Husband.",1.0963312e-08,0.028224163,1.44463375e-08,0.9717758,3.4294267e-10,5.2764726e-09
73,"His score for his first Hollywood film, the 2009 comedy Couples Retreat, won the BMI London Award for Best Score.",8.663847e-05,0.00015537787,1.858805e-06,0.019031577,3.1266953e-09,0.9807246
74,"Rahman's music for 2008's Slumdog Millionaire won a Golden Globe and two Academy Awards (a first for an Asian), and the songs ""Jai Ho"" and ""O... Saya"" from its soundtrack were internationally successful.",8.213183e-06,0.076582864,0.011030845,0.68712425,1.6805563e-08,0.22525385
75,"His music on 2008's Bollywood Jaane Tu... Ya Jaane Na was popular with Indian youth; that year, his score and songs for Jodhaa Akbar won critical acclaim, a Best Composer Asian Film Award nomination and IIFA awards for best music direction and score.",0.29528975,0.5644065,3.5503366e-05,0.13304022,8.132988e-07,0.007227138
76,"In 2010, Rahman composed the original score and songs for the romantic Vinnaithaandi Varuvaayaa, the sci-fi romance Enthiran and Danny Boyle's 127 Hours, composing for the Imtiaz Ali musical Rockstar; the latter's soundtrack was a critical and commercial success.",4.170085e-06,0.00027002316,3.3084825e-07,0.9997254,1.9015638e-09,2.144511e-10
77,"In 2012 Rahman composed for Ekk Deewana Tha and the American drama People Like Us, and collaborated with director Yash Chopra on Jab Tak Hai Jaan.",2.4302739e-05,0.028263498,1.0649814e-09,0.9717121,1.3170082e-07,7.927554e-09
78,all were positively received.,1.465317e-09,0.41212174,2.268387e-07,1.4522573e-06,2.898977e-07,0.5878763
79,By the end of the year his music for Mani Ratnam's Kadal topped the iTunes India chart for December.,2.604635e-09,0.00033933338,8.758089e-08,0.99904174,2.4688557e-06,0.0006163426
80,"In 2013, Rahman had two releases: Raanjhanaa and Maryan.",4.198577e-06,2.4544981e-06,2.3757887e-10,0.9999933,1.5950489e-08,2.3519733e-10
81,"Both were successful, with the former nominated for a number of awards and the latter the iTunes India Tamil Album of 2013.",3.454508e-07,0.0007784665,6.365983e-08,0.99829394,2.7529434e-10,0.000927174
82,"The year 2014 was one of the busiest years for Rahman, with him claiming to have worked in 12 films in various languages.",0.6275468,0.06616026,0.0013875498,0.3048971,3.018549e-07,8.038467e-06
83,"While his first release for the year was the Imtiaz Ali's road movie Highway which garnered positive reviews, his very next release was the performance captured animation film Kochadaiiyaan, a Rajinikanth starrer directed by Soundarya Rajinikanth.",0.9998423,1.4447194e-05,2.35894e-07,0.0001383581,3.661748e-06,9.193118e-07
84,The film's soundtrack was long-listed at the forthcoming Academy Awards.,0.018896883,5.766585e-07,6.523395e-07,0.0071766423,2.3697273e-09,0.97392523
85,"His next were the scores for the two back to back Hollywood films, Million Dollar Arm and The Hundred Foot Journey, both of which got into the contended list for the original score category nomination at the Oscars.",0.028257975,0.7433464,7.655066e-05,0.2278734,7.884018e-08,0.00044563148
86,Then he composed for the period drama Kaaviya Thalaivan teaming up with director Vasanthabalan for the first time.,4.4566492e-05,4.359005e-06,6.9434306e-12,0.9999511,4.6131e-09,8.412455e-12
87,His next release was Shankar's thriller I and K. S. Ravikumar's period action film Lingaa.,0.92648405,0.0086355535,4.3005304e-08,0.064758494,0.00012198091,9.315156e-10
88,===,0.0018069104,2.1080758e-05,2.7498896e-05,0.00044119143,0.9977034,1.2509519e-11
89,Background scores ===,1.4381337e-07,2.2669239e-08,9.075144e-12,0.9999999,3.983526e-12,6.556121e-12
90,His background scores are often characterised by the usage of subtle orchestration and ambient sounds.,9.503347e-09,0.000548433,2.863574e-09,0.9994516,3.9325904e-10,1.8469038e-08
91,"He often employs contemporary instruments such as Guitars, Cello, Flute, Strings, Keyboard, Finger board, Harpejji, Santoor and traditional Indian instruments such as Shehnai, Sitar, Mrudangam, Veenai & Tabla to create scores.",3.56021e-05,0.0010767815,0.00057862257,0.99830866,3.0269646e-07,2.6144595e-10
92,"Some of the films which fetched him appreciations for background scores include Roja, Bombay, Iruvar, Minsara Kanavu, Dil Se.., Taal, Lagaan, The Legend of Bhagat Singh, Swades, Rang De Basanti, Bose: The Forgotten Hero, Guru, Jodhaa Akbar, Raavanan, Vinnaithaandi Varuvaayaa, Rockstar, Enthiran, Kadal, Kochadaiiyaan and I. A. R. Rahman received two Academy Awards for Slumdog Millionaire and two Academy Award nominations for 127 Hours.",0.0003055946,0.005522409,1.2886484e-05,0.9905172,9.30253e-12,0.0036419146
93,"Recently, his scores for Kochadaiiyaan, Million Dollar Arm and The Hundred-Foot Journey have been nominated in the long list released by Academy of Motion Picture Arts and Sciences.",0.71406657,0.0065159393,9.929812e-07,0.27429506,1.3818251e-09,0.005121404
94,In 2017 his Mersal music's background score has impressed one and all.,1.196654e-11,7.4816253e-06,2.907885e-09,0.9999925,4.3260326e-12,3.9058715e-10
95,"In 2018, Rahman got national award for the background score of Mom.",7.80579e-08,1.8505975e-07,1.5710008e-11,0.99926895,1.3156922e-09,0.00073083944
96,Qutub-E-Kripa,2.2519146e-06,0.015413484,1.2710747e-07,0.96826404,0.011470972,0.004849159
97,"an ensemble of young musicians of KM Music Conservatory, have been co-credited alongside A. R. Rahman for the background scores of films such as 24, O Kadhal Kanmani, Tamasha, OK Jaanu, Kaatru Veliyidai, Mom, Chekka Chivantha Vaanam, Sarkar and 2.0.",1.4070618e-10,3.298991e-08,9.274616e-12,1.0,8.7524904e-11,2.2442803e-13
98,"They have also scored for the Netflix Show, Daughters of Destiny.",0.00036228696,3.0778342e-06,1.4795739e-09,0.9996346,2.5931748e-09,6.82525e-10
99,===,0.0018069088,2.1080758e-05,2.7498896e-05,0.000441192,0.9977034,1.2509519e-11
100,Performing and other projects ===,0.19981222,0.0009030601,0.18649822,0.12961678,0.47631449,0.006855145
101,Rahman has also been involved in non-film projects.,6.3799966e-06,0.0029565857,8.062821e-11,0.997033,3.3546935e-10,3.984007e-06
102,"Vande Mataram, an album of original compositions released for India's 50th anniversary of its independence in 1997, is one of India's best-selling non-film albums.",0.010835627,1.0516371e-06,3.3636212e-08,0.84930754,0.022552766,0.11730295
103,"He followed it with an album for the Bharat Bala–directed video Jana Gana Mana, a collection of performances by leading exponents and artists of Indian classical music.",0.00088309956,0.5272882,9.228556e-07,0.46472192,4.707766e-09,0.007105842
104,"Rahman has written advertising jingles and orchestrations for athletic events, television and Internet media, documentaries and short films, frequently using the Czech Film Orchestra and the Chennai Strings Orchestra.",3.5886712e-06,0.0010227156,8.880043e-07,0.9988188,1.5926173e-07,0.00015378307
105,"In 1999, Rahman partnered with choreographers Shobana and Prabhu Deva and a Tamil film-dancing troupe to perform with Michael Jackson in Munich, Germany at his Michael Jackson and Friends concert.",2.8249185e-09,0.0005205972,1.5180981e-09,0.95500195,2.305248e-06,0.044475216
106,"In 2002 he composed the music for his first stage production, Bombay Dreams, which was commissioned by Andrew Lloyd Webber.",3.878319e-07,4.8710685e-10,1.5337922e-12,0.99999964,2.3957507e-12,8.686674e-12
107,"The Finnish folk-music band Värttinä collaborated with Rahman on the Toronto production of The Lord of the Rings, and in 2004 he composed  ""Raga's Dance"" for Vanessa-Mae's album Choreography (performed by Mae and the Royal Philharmonic Orchestra).",3.0424094e-10,4.4648386e-06,7.835624e-08,0.99999547,4.2054475e-09,1.3494599e-08
108,"Since 2004 Rahman has performed three successful world tours before audiences in Singapore, Australia, Malaysia, Dubai, the United Kingdom, Canada, the United States and India, and has been collaborating with Karen David on her upcoming studio album.",0.0042399284,0.012597256,0.0014248561,0.9817379,2.4025936e-11,1.8843888e-08
109,"A two-disc CD, Introducing A. R. Rahman  (featuring 25 of his Tamil film-score pieces), was released in May 2006 and his non-film album Connections was released on 12 December 2008.",0.86661065,0.0032015536,0.0011270671,0.12900558,1.2510308e-09,5.520334e-05
110,Rahman performed at a White House state dinner arranged by US President Barack Obama during an official visit by Indian Prime Minister Manmohan Singh on 24 November 2009.,3.1398145e-11,2.9594265e-08,3.5228814e-12,0.004175569,1.3242961e-10,0.99582446
111,"He is one of over 70 artists on ""We Are the World 25 for Haiti"", a charity single to raise relief funds in the wake of the 2010 Haiti earthquake.",0.25672525,0.0035473919,0.038034294,0.6745745,0.00086933066,0.026249219
112,"In 2010, Rahman composed ""Jai Jai Garvi Gujarat"" in honour of the 50th anniversary of the formation of Gujarat State, ""Semmozhiyaana Thamizh Mozhiyaam"" as part of the World Classical Tamil Conference 2010, and the theme song for the 2010 Commonwealth Games, ""Jiyo Utho Bado Jeeto"".",6.140488e-11,7.608616e-10,1.7848885e-08,0.96934503,1.6606618e-08,0.03065495
113,"Rahman began his first world tour, (A. R. Rahman Jai Ho Concert: The Journey Home World Tour) on 11 June 2010 at Nassau Coliseum in New York; 16 cities worldwide were scheduled.",0.0001670353,6.0176794e-06,3.9987945e-06,0.9998229,8.261727e-11,9.4918455e-08
114,Some of Rahman's notable compositions were performed by the London Philharmonic Orchestra in April 2010.,9.722081e-07,2.0958852e-05,2.9670986e-07,0.9999778,4.3462175e-11,4.9044534e-08
115,"In February 2011 Rahman collaborated with Michael Bolton on Bolton's album, Gems – The Duets Collection, reworking his ""Sajna"" from Couples Retreat.",4.2768694e-05,0.006529871,0.0011236367,0.9491185,7.3164633e-06,0.043177906
116,"On 20 May 2011 Mick Jagger announced the formation of a supergroup, SuperHeavy, with Dave Stewart, Joss Stone, Damian Marley and Rahman; its self-titled album was scheduled for release in September 2011.",0.962526,0.009907725,0.0002181768,0.027315883,3.225079e-05,7.965906e-12
117,"The album would have Jagger singing on Rahman's composition, ""Satyameva Jayate"" (""The Truth Alone Triumphs"").",0.00022436124,0.001720289,5.5878586e-06,0.99804974,1.4536297e-09,9.079114e-09
118,"In January 2012 the Deutsches Filmorchester Babelsberg announced that it would join KM Music Conservatory musicians for a 100-member concert tour of five Indian cities (Germany and India 2011–2012: Infinite Opportunities), performing Rahman's songs.",0.00087756146,2.9481896e-05,3.7966552e-06,0.99908864,5.0533754e-07,4.6046878e-11
