,Sentence,Business meeting,Coincidence,Education,Music making,Personal life,Public celebration
131,"Her fourth Musart album, La sentimental (1964), includes both ranchera and bolero songs.",4.129997e-05,3.2196258e-06,2.1343192e-06,4.465753e-07,1.1939685e-08,0.9999529
132,"It is her first album without mariachi arrangements; Benjamín ""Chamín"" Correa is credited as the album's guitarist.",0.94765896,3.160948e-06,2.593569e-06,0.052335024,4.4441945e-10,2.4186775e-07
133,La sentimental peaked at number 9 on Record World Latin American LP Hit Parade.,9.69383e-06,2.9945888e-06,1.3980844e-07,0.008497274,0.0008522236,0.99063766
134,"""Mi destino fue quererte"" peaked at number 4 on Record World Latin American Single Hit Parade and became one of Flor Silvestre's signature songs.",0.00034050204,9.9500674e-08,3.9578654e-07,0.001225047,0.0030326396,0.99540126
135,"In December 1964, Cashbox ranked her among the top ten Mexican folk singers of the year.",0.00024560635,4.7064134e-07,3.4288706e-07,3.8089627e-06,1.8202625e-09,0.9997497
136,"Her fifth Musart album, La acariciante voz de Flor Silvestre, was released in 1965.",0.9946173,0.0006303691,0.00011441087,0.00013908347,4.8068985e-05,0.004450779
137,"One of the album's singles, ""Una limosna"", topped the Record World Latin American Single Hit Parade chart.",0.6804649,0.31559524,5.8213204e-06,0.0038473622,1.2010045e-09,8.669677e-05
138,"The album also includes her hits ""Gaviota traidora"", ""El mar y la esperanza"", ""Amor se escribe con llanto"", and ""Espumas"".",0.99949145,5.1680286e-07,0.00050104584,3.1089364e-06,1.9597231e-10,3.890112e-06
139,"Celosa con Flor Silvestre y otros éxitos (1966), her sixth studio album for Musart Records, peaked at number 11 on Record World Latin American LP Hit Parade.",0.99800056,3.7009147e-07,4.4514908e-07,0.0013316035,6.538112e-08,0.0006667953
140,"The album's lead single, ""Celosa"", peaked at number 9 on Cashbox Mexico's Best Sellers and number 4 on Record World Latin American Single Hit Parade.",0.0056500435,4.620823e-06,5.7797865e-06,0.9924102,1.0712729e-06,0.0019284138
141,"""¿Por qué, Dios mío?"", another single included in Celosa, also charted well on Record World Latin American Single Hit Parade.",0.01546156,0.048540358,9.8249424e-05,0.93364644,6.367937e-08,0.002253268
142,"In 1967, she released two albums, Boleros rancheros con la acariciante voz de Flor Silvestre and Flor Silvestre, vol.",0.057961732,1.8056608e-05,0.00803156,7.1656155e-05,1.0591184e-06,0.933916
143,"6,",0.009709494,2.2440898e-05,0.2561394,0.00013594858,0.7339915,1.2387127e-06
144,and,5.2654322e-08,0.0074165864,0.00077006087,0.9918132,1.524999e-07,2.9369271e-08
145,"made her last film of the decade, El as de oros.",0.9882009,1.0164831e-06,0.002134815,0.001597044,1.1367267e-06,0.008064956
146,"In 1968, she released two albums, Flor Silvestre, vol.",0.37323397,4.079496e-05,0.62560713,0.00025233708,5.933647e-06,0.0008597165
147,"7 and Flor Silvestre, vol. 8.",3.2272655e-07,0.00035931444,1.4539582e-06,1.962939e-07,0.18858173,0.811057
148,"Flor Silvestre, vol.",2.649848e-08,3.7017566e-07,7.085631e-07,1.8041679e-07,0.9997863,0.00021243573
149,"7 includes ""Reconciliación"", one of her major hits from the late 1960s, as well as several other hits, including ""Cenizas de amor"", ""Cariño malo"", ""Triunfamos"", and ""Tres días"".",0.99793744,5.9996757e-05,9.965198e-06,0.00082125794,1.260215e-11,0.0011713912
150,"Flor Silvestre, vol.",2.649848e-08,3.7017566e-07,7.085631e-07,1.8041679e-07,0.9997863,0.00021243573
151,"8 features arrangements by famous guitarist Antonio Bribiesca and composer Gustavo A. Santiago and includes the hits ""No vuelvo a amar"" and ""Tú, sólo tú"".",0.0369392,0.041276865,0.019690687,0.10145067,2.2305558e-07,0.8006424
152,===,0.0018068925,2.1080356e-05,2.7498634e-05,0.00044118572,0.9977034,1.2509472e-11
153,1970–1989:,0.9435251,1.5892023e-05,3.561488e-06,0.0030692287,0.031824496,0.021561667
154,Final films and multiple musical genres ===,0.021495614,8.093008e-06,2.1990942e-12,0.9776683,0.00072234933,0.00010555036
155,"In 1970, she released her album Amor, siempre amor, accompanied by the Mariachi Guadalajara.",0.84354645,3.216101e-06,3.5646093e-07,0.0005372776,7.5083345e-10,0.15591268
156,"The album features innovative mariachi, piano, harmonica, and steel (Hawaiian) guitar arrangements in its songs.",0.35276088,2.055064e-05,0.007301485,0.6399019,1.1368054e-05,3.875687e-06
157,"Its first track, ""La cruz de lo imposible"", is songwriter Lupita Ramos' first work.",0.999925,3.1486705e-10,1.746836e-06,7.316207e-05,1.3032649e-12,1.5062429e-10
158,This was Flor Silvestre and Ramos' first collaboration; Ramos went on to author several other songs for Flor Silvestre.,0.008238635,3.0209103e-06,0.00076120946,0.9909244,6.263993e-06,6.654147e-05
159,"Another notable track is ""La mitad de mi orgullo"", by José Alfredo Jiménez.",2.1763444e-06,0.00017347625,4.5777554e-07,0.99981767,1.6058319e-06,4.5998268e-06
160,"In the early 1970s, she recorded her first bolero album, Y las canciones de sus tríos favoritos.",0.9988188,0.00016079728,9.4687806e-07,0.0010181419,9.526423e-11,1.3459288e-06
161,"The album features cover versions of popular boleros from the 1950s, including ""Un siglo de ausencia"", ""Condición"", ""El reloj"", and ""La barca"".",0.8429442,0.1126992,0.00017795569,0.044026688,2.4759274e-06,0.00014947263
162,"Cashbox included the album in its Latin Picks section and described it as ""a masterpiece for lovers of Latin boleros"".",3.8061432e-07,0.1618313,5.2979664e-07,0.8381678,1.0577051e-09,7.597835e-09
163,It was later rereleased as Sus canciones favoritas con...,0.32305488,0.2752057,0.00093838805,0.19577049,2.4954647e-07,0.20503026
164,Flor Silvestre (LP reissue) and Mis boleros favoritos (CD reissue).,5.234035e-06,6.0508185e-08,0.9997367,1.0727269e-07,2.4192152e-05,0.00023370872
165,"In 1972, she released three albums: Una gran intérprete y dos grandes compositores, a tribute to songwriters Cornelio Reyna and Ferrusquilla; La voz que acaricia, which includes her hits ""Solo con las estrellas"" and ""Hastío""; and Canciones con alma, her second album of bolero songs.",0.99529654,7.519891e-08,0.00016250966,0.0032981704,1.9448774e-09,0.0012426195
166,"She sang two tracks from Una gran intérprete y dos grandes compositores in the two films she made that year; she sang ""Tema eterno"" in La yegua colorada and ""No me lo tomes a mal"" in Valente Quintero.",0.07014565,8.229405e-05,0.0070250914,0.92238486,1.7686963e-11,0.00036211647
167,"Billboard included Canciones con alma in its Top Album Picks section and wrote, ""A good solid LP overall of love ballads.",0.08100894,0.022706453,2.2680007e-07,0.8962825,5.08332e-11,1.8889709e-06
168,"Best cuts: 'Vuelve', 'Tormento', 'Quisiera'"".",1.4429827e-06,0.9942088,9.697164e-07,2.044168e-05,3.8442948e-05,0.005730062
169,"In 1973, she played one of Pancho Villa's lovers in La muerte de Pancho Villa and released her first norteño album, La onda norteña de Flor Silvestre.",0.60911226,0.008141857,3.0724215e-05,0.38174012,9.355163e-09,0.00097502203
170,The album's cover is a photograph of her as the character in the film.,0.9993062,0.0006691934,1.7299979e-05,1.1121527e-06,9.583781e-09,6.269851e-06
171,"She also played Felipe Carrillo Puerto's wife, Isabel Palma, in the film Peregrina (released in 1974), in which she sang the Guty Cárdenas bolero ""Quisiera"".",0.0006758025,8.496631e-06,2.1597856e-05,0.76179636,0.0011969038,0.23630086
172,"In 1974, she released her album Con todo mi amor a mi lindo Puerto Rico, which is a tribute to two famous Puerto Rican songwriters, Rafael Hernández and Pedro Flores.",0.9955739,1.7014571e-08,6.294494e-06,0.00017522373,5.998088e-09,0.004244647
173,"For this album she recorded four Hernández songs, ""Campanitas de cristal"", ""Inconsolable"", ""No me quieras tanto"", and ""Silencio"", and three Flores songs, ""Obsesión"", ""Amor"", and ""Esperanza inútil"".",0.73037106,5.930098e-05,0.0014344505,0.008943727,2.863645e-09,0.25919157
174,"The album also includes ""Cruz de olvido"", one of her hits, and ""Vuelve pronto"", a Spanish-language version of ""Paper Roses"".",0.17404884,5.8113576e-05,0.8130381,0.01284342,5.7682424e-08,1.146745e-05
175,"The album's release coincided with her appearance in the film Mi aventura en Puerto Rico, in which she sang ""Desvelo de amor"" and ""Obsesión"".",0.75939524,0.0002102478,0.0063714124,0.06892424,9.936768e-10,0.16509888
176,This same year she appeared on the film Peregrina.,0.036548868,3.9066897e-05,4.539461e-05,0.94321847,0.00044668483,0.019701513
177,"She sang ""La palma"" in Simón Blanco (1975) and played the female leads in Don Herculano enamorado (1975), El moro de cumpas (1977), and Mi caballo el cantador (1979).",0.15470703,2.8404993e-05,2.9821836e-06,0.84526163,2.0650813e-10,4.519427e-08
178,"In 1978, she released her album Ahora sí va en serio, which includes several songs written by Joan Sebastian.",0.23881456,3.1168813e-07,0.008768546,0.7522428,1.5462723e-07,0.00017352485
179,The title track was included in the Cashbox Latin Singles to Watch list.,3.388046e-05,2.8587758e-07,9.781549e-09,0.9999658,3.2169645e-11,1.0617163e-12
180,"Other Sebastian songs included in the album are ""Levantado en armas"", ""Te regalo mi pena"", and ""Trono caído"".",0.50486094,0.0038311016,0.31304833,0.06375859,6.710208e-05,0.11443394
181,"In 1979, Cashbox included her single ""Morir al lado de mi amor"" in its Latin Singles to Watch list.",3.772261e-05,5.2373456e-05,9.841402e-10,0.9963516,2.3574684e-09,0.0035582324
182,===,0.0018068925,2.1080356e-05,2.7498634e-05,0.00044118572,0.9977034,1.2509472e-11
183,1989–2020:,0.33510482,8.1581146e-07,4.425636e-05,9.4789255e-05,2.4031497e-05,0.66473126
184,Banda albums and tributes ===,0.03132358,0.008892645,5.65295e-05,0.9423818,0.0007390972,0.016606329
185,"In 1989, she recorded banda music for the first time.",0.7016173,7.3565575e-06,1.5177936e-09,0.29837525,6.2837158e-09,6.6862924e-08
186,"She told the press, ""I was very afraid to record with a tambora; I thought it was too much sound, a lot of equipment, but when I recorded I loved it, I felt happy, and more because it was the band of Don Ramón López Alvarado.",0.004037162,0.9925505,2.88499e-05,0.0028104642,2.1046053e-05,0.0005519204
187,"We recorded 'Los mirasoles', 'La rama', and 'Quiero que sepas'"".",0.000441127,6.772561e-05,8.7575145e-08,0.99949086,1.4130272e-10,1.987028e-07
188,"She made her final film, Triste recuerdo, in 1990.",0.92888796,1.2576376e-06,0.00019113383,0.023578554,0.003103052,0.044238094
189,"In 1991, she recorded her first banda album, Flor Silvestre con tambora, which includes a banda version of one of her bolero hits, ""Caricia y herida"".",0.99896634,4.0775274e-07,1.0016835e-07,0.0009320989,1.9543247e-09,0.0001010977
190,"In 1994, she released her album Me regalo contigo, which includes a song dedicated to her marriage with Aguilar, ""Para siempre juntos"", and a vallenato song, ""Sólo para ti"".",0.68086076,2.649287e-08,5.2470746e-08,4.685821e-06,3.3834183e-07,0.31913415
191,"In 2001, she released her second banda album, Flor Silvestre con tambora, which includes new versions of her 1960s hits ""Cariño santo"", ""Celosa"", ""Desolación"", ""Mi destino fue quererte"", and ""El mar y la esperanza"".",0.995047,3.447892e-07,0.0042632227,9.55865e-06,1.2596286e-08,0.0006798319
192,"On 21 December 2010, she released her most recent album, Soledad: canto a mi amado y a su recuerdo, which she dedicated to her late husband.",0.11977725,1.7683314e-08,0.028960977,2.5360564e-06,1.6724224e-08,0.85125923
193,"The album features interesting songs she had never recorded before, such as ""Soledad"", ""Y llegaste tú"", ""El andariego"", ""Luz de luna"", ""Amanecí en tus brazos"", ""Las ciudades"", ""Los ejes de mi carreta"", and ""Sombras"".",0.358198,0.4011689,0.23997664,0.00056070293,9.824185e-10,9.571014e-05
194,"On 9 March 2015, her documentary Flor Silvestre: su destino fue querer premiered at Zapopan's Plaza de las Américas as part of the Guadalajara International Film Festival.",3.607572e-06,9.1909413e-10,4.1074345e-06,1.7089052e-10,2.3777402e-10,0.99999225
195,"The 24-minute documentary features interviews with Flor Silvestre, who recounts her life and career; her five children, Dalia, Francisco, Marcela, Antonio, and Pepe; and singers Angélica María and Guadalupe Pineda.",0.0042691007,4.362005e-07,7.030939e-05,4.9641322e-11,8.420102e-05,0.9955759
196,"In 2016, she was featured on ""Para morir iguales"", a track of her son Antonio's most recent album, Caballo viejo.",0.0005718241,0.99846053,0.00061326387,0.00018179265,4.5365084e-08,0.00017270778
197,==,0.12487865,0.2134413,0.001371599,0.0017026742,0.65860564,7.902395e-08
198,Personal life ==,0.002554406,0.00046550567,4.8373266e-07,1.0761044e-09,8.063284e-05,0.996899
199,"Flor Silvestre married her first husband, Andrés Nieto, in the 1940s.",2.8142396e-05,1.12122e-05,0.001410848,9.28784e-12,0.12979938,0.8687504
200,"She gave birth to her first child, singer and dancer Dalia Inés Nieto, when she was 16 years old.",0.00041886818,4.041354e-07,0.002036148,1.8711346e-09,8.316261e-05,0.99746144
201,"Around 1953, Flor Silvestre married radio announcer and bullfighting chronicler Francisco Rubiales Calvo ""Paco Malgesto"" (1914–1978), who would later become a famous presenter and pioneer of Mexican television.",1.2000581e-07,1.3067244e-11,5.2796295e-10,4.4744236e-11,0.0033012137,0.9966987
202,"They had two children, translator Francisco Rubiales and singer and actress Marcela Rubiales.",3.0634887e-06,1.9868992e-05,1.7348795e-05,3.900733e-05,0.71645916,0.2834616
203,They lived in a house in Mexico City's Lindavista neighborhood.,2.3357877e-06,0.058483254,0.92571163,1.911016e-06,0.00045066062,0.015350263
204,The couple separated and began divorce proceedings in 1958.,2.641705e-10,1.1476275e-08,2.8886756e-08,1.3068869e-07,0.99883896,0.0011609459
205,"Flor Silvestre's third and last husband was singer and actor Antonio Aguilar, who died in 2007.",1.0741436e-07,3.128638e-10,2.3007544e-08,6.0293426e-10,0.9035839,0.096416056
206,He was the love of her life.,1.0898889e-06,0.0016472668,0.0038006103,0.17285028,0.14625761,0.6754431
207,They first met in 1950 when he was invited to sing on her program Increíble pero cierto at the Verde y Oro studio of radio station XEW in Mexico City.,1.42921e-05,0.9968256,0.0018882405,0.0008748258,1.8079186e-08,0.00039714898
208,"In 1955, they made their first film together, La huella del chacal, but their relationship began when they made the film El rayo de Sinaloa in 1957.",0.3815603,0.617814,1.3329275e-06,0.00061857,2.1346077e-08,5.848326e-06
209,"They married in 1959 (or 1960, according to some sources) and had two sons who also became singers and actors, Antonio ""Toño"" Aguilar and José ""Pepe"" Aguilar.",0.001332893,7.570085e-05,5.8923337e-07,2.43078e-07,0.970403,0.028187532
210,"Aguilar built her a spacious home and ranch, El Soyate, northeast of Tayahua, Zacatecas.",0.8451939,2.5747178e-05,0.0041677887,6.01344e-05,0.13461837,0.01593388
211,"On 28 February 2012, Flor Silvestre underwent surgery to extirpate the cancer-stricken half of her right lung.",0.18014929,1.7188098e-05,1.9738414e-05,6.545263e-07,9.1479335e-05,0.81972164
212,She responded well to the surgery.,0.0006005794,0.9992256,9.2692287e-10,5.60446e-06,0.0001675884,5.8069645e-07
213,==,0.12487865,0.2134413,0.001371599,0.0017026742,0.65860564,7.902395e-08
214,Death ==,1.22766375e-08,0.89292735,1.5102256e-07,2.2871276e-10,0.10707257,1.2502109e-09
215,"Flor Silvestre died on 25 November 2020, on her estate in ""El Soyate"" Villanueva, Zacatecas, Mexico.",5.725209e-05,2.9914853e-09,0.000381784,2.4000487e-08,0.07448362,0.92507726
216,She died of natural causes.,1.227999e-08,7.053952e-07,2.7680885e-06,6.4398633e-09,0.99999547,1.0365721e-06
217,==,0.124878764,0.21344112,0.0013716007,0.0017026727,0.65860575,7.902396e-08
218,Awards and honors ==,3.3128806e-08,3.3484566e-11,4.0547104e-07,2.3831672e-12,8.8440147e-14,0.9999995
219,Flor Silvestre received many awards and honors throughout her career.,7.2575324e-07,4.672325e-13,2.7568587e-09,1.1394346e-12,1.6566071e-11,0.9999993
220,She has her handprints in the Plaza de las Estrellas (the Mexican equivalent of the Hollywood Walk of Fame).,8.6217886e-05,2.7135584e-07,3.162781e-05,3.3493115e-09,6.036534e-09,0.99988186
221,"In 1966, Musart Records awarded her The Golden Clover (known as Trébol de Oro in Spanish) for being one of the label's best-selling artists in 1965.",0.003912063,1.8688509e-06,3.360651e-10,8.15653e-05,1.3344387e-06,0.9960032
222,"In 1970, Musart Records awarded her another Golden Clover for being one of the label's best-selling artists in 1969.",0.016457604,5.767838e-07,1.6681453e-12,0.00093123404,0.00017410869,0.98243654
223,"In 1972, she won the Record World Award for Best Mexican Actress-Singer.",3.0877761e-06,2.7673892e-08,1.1050002e-09,2.876635e-07,2.3450011e-11,0.99999654
224,"In 2001, the National Association of Actors awarded her the Eduardo Arozamena Medal for her 50-year career.",0.98886514,1.2593184e-11,5.8871032e-09,1.2624166e-10,2.0691136e-11,0.011134916
225,"In 2008, she was the grand marshal of the Comité Mexicano Cívico Patriótico's Mexican Independence Parade in Los Angeles, California.",6.324496e-09,2.9337555e-10,0.00029140778,3.548325e-08,1.5226156e-07,0.99970835
226,"In 2010, the twenty-first edition of the World Mariachi Day (Día Mundial del Mariachi) awarded her the Pedro Infante Medal for her ""outstanding work and dissemination of Mexican music"".",8.101149e-09,1.2082215e-12,8.161776e-09,7.3579025e-12,4.375922e-13,1.0
227,"In 2012, the Confederation of Livestock Organizations awarded her a ""bull sculpture"" for her contribution to Mexican culture.",5.0520903e-08,1.496535e-07,2.0865604e-08,1.2975996e-09,1.7889683e-13,0.99999976
228,"In 2013, the Association of Mexican Cinema Journalists awarded her the Special Silver Goddess for her career.",0.016781548,1.0543739e-09,8.118656e-10,0.00021746563,3.319773e-10,0.983001
229,"Mexican actor Ignacio López Tarso presented her with the award and said: ""For me it is a great honor and personal satisfaction to give you this award, to a great figure of Mexican cinema who, either walking or on horseback, made the best movies of the Mexican film industry"".",1.5923783e-08,1.329601e-07,8.3135127e-10,1.5057215e-13,1.3655845e-11,0.9999999
230,"In 2014, the Government of the State of Zacatecas paid tribute to her career and gave her a special accolade at the Teatro Calderón in the state capital as part of the First Corrido Festival.",2.7922752e-07,6.291438e-13,2.2548091e-08,2.4180633e-06,6.7879686e-13,0.99999726
231,"In 2015, while promoting the release of her documentary entitled Flor Silvestre: Su destino fue querer, she was honored in Lagos de Moreno, Jalisco; Los Angeles, California; and Aguascalientes, Aguascalientes.",1.0305511e-12,1.2857183e-12,1.2290655e-09,4.0809338e-16,8.33885e-16,1.0
232,==,0.12487865,0.2134413,0.001371599,0.0017026742,0.65860564,7.902395e-08
233,Discography ==,0.9999943,1.2030752e-08,8.358399e-10,5.3618996e-06,2.8147706e-09,3.2553942e-07
234,Flor Silvestre made her first recordings in 1950 for the Mexican Columbia label (Discos Columbia de México).,0.9965166,2.0246318e-08,0.00061266654,0.002866871,2.2105306e-08,3.935661e-06
235,"In these recording sessions, she was backed up by the mariachis of Gilberto Parra and Rubén Fuentes.",0.53009456,0.0120131085,0.00018344182,0.008061845,7.8466485e-07,0.44964623
236,"Ten of these recordings, which were originally released on 78 rpm singles, were included in the greatest hits album Flor Silvestre canta sus éxitos, released in 1964 by Columbia's subsidiary label Okeh.",0.7481877,0.027391983,0.0005522435,0.22274424,3.438436e-07,0.0011234669
237,This compilation album was later remastered and reissued in digital format by Sony Music Entertainment México in 2016.,0.36766478,0.00015269955,0.22956403,0.24461737,1.536976e-08,0.15800115
238,Flor Silvestre also recorded some songs for the RCA Víctor label in 1957.,0.117959596,1.2934825e-06,0.0007049764,0.87575525,0.0055789156,9.459601e-09
239,"For this label, she recorded a single containing her first version of ""Cielo rojo"" on side A and ""Qué padre es la vida"" on side B.",0.019024586,4.993943e-05,0.9790366,0.0012261124,2.3823153e-08,0.00066273706
240,"In 1957, Flor Silvestre signed a contract with the Musart label.",0.99997485,1.3118695e-08,4.040309e-09,1.1229857e-08,2.4527646e-05,6.398733e-07
241,"Among her first recordings for Musart are the songs ""Nuestro gran amor"" and ""Pajarillo de la sierra"", included in the soundtrack album of the Heraclio Bernal films, and ""Te he de querer"", ""La chancla"", and ""La Valentina"", included in the soundtrack album for the film La cucaracha.",0.46151394,0.00045697502,4.5766907e-07,0.537406,7.2271675e-11,0.0006226318
242,"In 1958, she released her first studio album for Musart, Flor Silvestre.",0.99998856,1.3184717e-07,5.7961247e-06,6.013452e-07,8.24855e-10,4.9092887e-06
243,"Musart has more than 300 of Flor Silvestre's recordings, many of them available in digital format since 2008.",1.927978e-05,2.648997e-06,2.1892338e-05,5.3984263e-06,2.5018505e-07,0.9999505
244,===,0.0018068925,2.1080356e-05,2.7498634e-05,0.00044118572,0.9977034,1.2509472e-11
245,Singles =,0.00032514555,0.15757574,0.00061795744,0.23594025,0.603416,0.002124874
246,==,0.124878764,0.21344112,0.0013716007,0.0017026727,0.65860575,7.902396e-08
247,Her hit singles include:,0.04771989,0.0002914648,4.655584e-09,0.95198274,4.9493947e-06,9.354991e-07
248,===,0.0018068915,2.1080356e-05,2.749861e-05,0.00044118572,0.9977034,1.2509472e-11
249,Studio albums ===,0.91877866,0.006697673,0.03360911,0.04075146,6.7151063e-06,0.00015638402
250,===,0.0018068915,2.1080356e-05,2.749861e-05,0.00044118572,0.9977034,1.2509472e-11
251,Extended plays =,5.921119e-09,4.1722123e-10,1.336567e-14,1.0,1.2161182e-14,2.6518666e-11
252,==,0.124878764,0.21344112,0.0013716007,0.0017026727,0.65860575,7.902396e-08
253,Para morir iguales,0.022099612,0.8873632,0.0011387754,5.679752e-05,0.08846719,0.00087439845
254,Desolación,0.2640415,0.00085962797,0.023566727,0.00020705377,0.003828204,0.7074969
255,Volver a verte,1.8188202e-06,0.33161998,0.067288615,0.07408599,0.5269946,9.065164e-06
256,Mi destino fue quererte,0.010925922,0.0009100077,0.00056102057,0.00030769472,0.56554127,0.42175415
257,Aquel amor,2.6467555e-07,0.00036613864,0.00014418592,4.5228666e-07,0.00499555,0.9944935
258,Vámonos,6.908797e-06,7.128979e-05,3.9970155e-07,0.7845005,0.21451849,0.0009024883
259,Celosa,8.538319e-05,2.272575e-09,0.0045682215,0.99095553,0.004390709,6.588697e-08
260,Una limosna,0.0001119637,0.9989858,3.3860963e-06,0.0004522634,0.00039424308,5.2296826e-05
261,Miel amarga,1.3076901e-05,6.2940613e-09,7.23966e-11,1.09791884e-07,0.99998474,2.0710322e-06
262,Perdámonos,1.08402446e-07,5.610387e-05,6.657084e-06,0.5724486,0.42743194,5.666795e-05
263,===,0.0018068925,2.1080356e-05,2.7498634e-05,0.00044118572,0.9977034,1.2509472e-11
264,Compilation albums ===,0.00039932827,0.04546357,1.7952934e-05,0.8444651,0.00019913907,0.10945494
265,Flor Silvestre canta sus éxitos (1964),0.50683534,0.007546212,0.00017089809,0.0013338757,0.06983547,0.41427815
266,Los éxitos de Flor Silvestre (1972),0.49679682,4.7135185e-07,7.960111e-08,8.5861204e-05,0.44317266,0.05994414
267,El disco de oro de Flor Silvestre (1977),0.030460121,4.0001916e-05,2.3723826e-05,0.010854542,0.0005003949,0.95812124
268,15 éxitos (1984),0.00043150142,3.9574385e-08,7.833113e-10,1.183592e-05,0.9991099,0.00044658993
269,"15 éxitos, vol.",2.1630809e-05,0.0014141155,0.0023472756,0.72561294,0.0027894387,0.2678146
270,2 (1989),0.8833628,5.918497e-07,2.4836402e-06,8.049847e-05,0.044922665,0.07163079
271,15 grandes éxitos (1998),0.11391043,1.7413164e-05,0.331647,7.52064e-05,0.30683574,0.24751422
272,Colección de oro: Flor Silvestre con mariachi (2003),0.00032034208,0.0010570156,6.1911e-06,2.6229122e-06,0.002326771,0.9962871
273,Mexicanísimo: Flor Silvestre (2015),0.004694351,7.421023e-07,0.00017114035,1.4496835e-07,0.0010816227,0.994052
274,Serie del recuerdo 2 en 1: Flor Silvestre (2016),0.00092808,6.113157e-07,1.0160301e-07,0.0006363839,0.9984345,3.5126138e-07
275,Mi México querido (2020),0.9266894,1.7990182e-07,4.2098823e-06,7.092134e-05,0.03416833,0.039066903
276,==,0.124878764,0.21344112,0.0013716007,0.0017026727,0.65860575,7.902396e-08
277,Selected filmography ==,0.9993844,2.3660364e-07,1.7798152e-08,1.5420081e-06,0.0005353864,7.836989e-05
278,"Flor Silvestre appeared in more than seventy films, almost always as the star and sometimes as a supporting actress or musical guest.",0.24803166,0.0032418226,0.021370359,0.72296673,0.004377934,1.1585991e-05
279,"Her film career spanned several genres, including ranchera comedy, rural drama, Mexican western, horror film, urban comedy, and Mexican Revolution drama.",0.9992919,8.6592045e-06,0.0005833019,6.076791e-06,9.9796644e-08,0.00010982047
280,She starred in the following Mexican classics:,0.61431175,0.0014355682,0.3168422,0.063041516,5.8866012e-06,0.004363178
281,==,0.124878764,0.21344112,0.0013716007,0.0017026727,0.65860575,7.902396e-08
282,References ==,2.507712e-05,0.018098895,8.9650435e-05,0.06194967,4.4582564e-09,0.9198367
283,==,0.124878764,0.21344112,0.0013716007,0.0017026727,0.65860575,7.902396e-08
284,External links ==,0.00023526642,1.3075868e-06,6.913511e-10,2.5650485e-07,3.6421334e-08,0.9997632
285,Official website,0.0012255516,4.507715e-12,3.0528519e-10,4.2257152e-08,5.405287e-12,0.99877435
286,Flor Silvestre at IMDb,0.11441673,1.4020462e-08,4.5505458e-05,1.4012711e-08,0.88527226,0.0002655119
287,Flor Silvestre at the TCM Movie Database,4.184329e-06,0.0051915175,0.00016980934,2.9599281e-05,0.980082,0.014522932
288,Flor Silvestre discography at Discogs,0.01471322,1.4783905e-05,4.277281e-05,1.0029654e-05,0.0026169694,0.98260224
