,Sentence,Business meeting,Coincidence,Education,Music making,Personal life,Public celebration
0,Roni Ben-Hur is an Israeli jazz guitarist who immigrated to the United States in 1985.,0.00037297516,7.945193e-06,1.3601647e-08,0.0014345408,0.99818426,2.6997284e-07
1,His parents were Tunisian-Jewish from Tunisia.,5.5204122e-08,1.0529615e-06,8.6550784e-08,8.954107e-08,0.9999987,3.108503e-10
2,==,0.12487809,0.21344268,0.0013716145,0.0017026803,0.65860486,7.902394e-08
3,Biography ==,0.35590583,3.5694214e-10,3.2671657e-11,9.202332e-11,5.127074e-05,0.64404285
4,"Roni Bohobza grew up in Dimona, Israel.",6.6756695e-07,0.094134375,0.0017827415,0.05598011,0.8480476,5.4446326e-05
5,He is the youngest of seven children and one of two born after the family emigrated from Tunisia in 1955.,1.3844706e-05,8.373323e-07,1.5784872e-09,2.5418692e-07,0.99965966,0.00032542014
6,His surname was legally changed to Ben-Hur via ritual at age 10.,0.0020972723,2.1210742e-08,7.3981634e-09,3.4595388e-07,0.99786454,3.7835132e-05
7,"When he was eleven, he started playing guitar.",0.43589315,0.00011613182,0.047620885,0.5161656,0.00020415503,8.2549545e-10
8,He learned about jazz from a high school's friend's record collection.,8.212359e-12,0.0021548532,0.9978452,6.416141e-10,1.6512606e-08,3.6405787e-08
9,In Israel he performed in clubs and at weddings and bar mitzvahs until he had enough money to move to the U.S.,1.2981776e-05,1.9199768e-05,8.148333e-07,3.5086112e-05,1.1023342e-07,0.9999318
10,"He arrived in New York City in 1985, spending time at Barry Harris's Jazz Cultural Theater.",0.00020910635,0.99252653,1.4610772e-10,0.0032960495,0.0014227906,0.0025455717
11,"He took lessons from Harris, then became a member of his band.",3.6758452e-06,2.554028e-07,0.99999595,1.4605843e-07,9.2950904e-11,7.2236955e-16
12,Ben-Hur's experience as an educator dates back to 1981 in Israel.,0.98562545,5.1557618e-05,0.004384256,6.113298e-06,0.009917037,1.5652939e-05
13,"In the U.S. he started jazz music programs at Professional Performing Arts School, the Coalition School for Social Change, and at the Lucy Moses School.",0.0001849744,4.8884986e-06,0.20372462,0.79584277,1.9097362e-07,0.0002424556
14,"At the request of  Bette Midler, he started a jazz program for New York City high schools.",0.90809524,8.691746e-05,9.509424e-07,0.08306946,0.0028498392,0.0058975415
15,"Ben-Hur began a jazz camp in Saint-Cézaire-sur-Siagne, France, with Santi Debriano.",0.011504469,0.1847417,0.04111121,0.000133227,0.7623629,0.00014654342
16,"With Nilson Matta, he began a jazz and Brazilian music camp in Bar Harbor, Maine, both intended for adult jazz amateurs.",5.0729204e-06,0.049918152,0.0011940092,0.0028301885,0.9419062,0.004146375
17,He is the founding director of the jazz program at the Lucy Moses School at Kaufman Center in Manhattan where he teaches.,0.032502007,7.4531677e-06,0.9647992,0.002581012,2.6903554e-06,0.00010760741
18,"His book Talk Jazz: Guitar (Mel Bay, 2004) includes a CD with a removable guitar track of Ben-Hur performing the exercises in the book with Tardo Hammer on piano, Earl May on bass, and Leroy Williams on drums.",0.001097103,0.35235822,0.0014016661,0.6449884,0.00013259088,2.2094959e-05
19,His album Anna's Dance was named by The Village Voice one of the best jazz albums of 2001.,1.198788e-07,0.003616273,2.2362971e-07,4.6570603e-06,5.510474e-06,0.99637324
20,"All About Jazz called him ""a virtuoso guitarist with impeccable swing"".",0.0004722954,0.00032832654,1.909246e-05,0.99845874,0.0007172087,4.309404e-06
21,"In 2000, he won the Jazziz reader poll for ""Best New Talent"".",6.090922e-10,1.8416276e-06,1.9005256e-10,1.7688698e-06,7.948972e-06,0.99998844
22,"Ben-Hur lives in Teaneck, New Jersey, with his wife, singer Amy London, and their two daughters.",0.009810479,9.384831e-05,7.0440313e-07,3.1670087e-08,0.9900946,3.4186382e-07
23,==,0.12487809,0.21344268,0.0013716145,0.0017026803,0.65860486,7.902394e-08
24,Discography ==,0.9999943,1.2030798e-08,8.3584145e-10,5.3618996e-06,2.8147706e-09,3.2553942e-07
25,"Backyard with Barry Harris (TCB, 1995)",0.00020767753,0.0038546417,6.716413e-07,0.7335828,0.2574298,0.0049244333
26,"Sofia's Butterfly (TCB, 1998)",2.2120819e-06,0.0002836209,4.1407693e-06,0.032761447,0.9669486,4.247968e-08
27,"Anna's Dance (Reservoir, 2001)",1.7100196e-05,0.051672786,0.0006834142,9.21898e-06,0.051003754,0.8966138
28,"Signature (Reservoir, 2005)",0.38406372,0.040678617,6.112168e-05,2.3299513e-06,0.47393206,0.101262085
29,"Keepin' It Open (Motéma, 2007)",0.0013051025,7.2069515e-06,4.561765e-06,0.011231444,0.0040942817,0.9833574
30,"Smile with Gene Bertoncini (Motéma, 2008)",6.966976e-07,0.0101547055,1.177239e-05,1.563071e-05,0.98980683,1.0339431e-05
31,"Fortuna (Motéma, 2009)",2.1465581e-05,1.7218946e-06,0.0016225957,0.015201989,0.98279095,0.00036128744
32,"Mojave with Nilson Matta (Motéma, 2011)",4.2677966e-05,0.059994385,0.0056767985,0.041564506,0.6099291,0.28279254
33,"Our Thing with Santi Debriano, Duduka Da Fonseca (Motéma, 2012)",1.2655089e-09,0.2742047,0.6031778,0.0070650056,0.047524147,0.06802835
34,"Alegria de Viver with Leny Andrade (Motéma, 2014)",0.0025138017,0.08356622,0.0071530323,0.009485224,0.8972145,6.726608e-05
35,"Introspection with Harvie S. (Jazzheads, 2018)",2.4510878e-06,0.31354278,0.58708143,0.00013570291,0.083636485,0.015601162
36,"Stories (Dot Time Records, 2021)",0.023471981,0.009293781,4.2818574e-05,0.02669693,0.0027732705,0.9377212
37,==,0.12487809,0.21344268,0.0013716145,0.0017026803,0.65860486,7.902394e-08
38,References ==,2.507712e-05,0.018098895,8.9650435e-05,0.06194967,4.4582564e-09,0.9198367
39,==,0.12487809,0.21344268,0.0013716145,0.0017026803,0.65860486,7.902394e-08
40,External links ==,0.00023526642,1.3075892e-06,6.913511e-10,2.5650536e-07,3.6421334e-08,0.9997632
41,Official site,0.00010639902,2.473917e-10,3.9114192e-10,1.2280146e-08,9.812631e-12,0.99989355
