,Sentence,Business meeting,Coincidence,Education,Music making,Personal life,Public celebration
139,"Throughout his life Kenny wrote and co-wrote many songs, including ""There Is No God But God"" (recorded by Elvis Presley), ""When The Chimes Ring (At Evening)"", ""I Counted on You"", ""You Are Happiness"", ""A Soldiers Rosary"", ""I'm Heading Back To Paradise"", ""The Sweetest Dream"", ""Rose of Roses"", ""Don't Put It Off Til' Sunday"", ""Do You Feel That Way Too?"", ""Sorry You Said Goodbye"", ""My Lonesome Years"", ""Movita"" and many more.",3.944172e-06,0.00061169226,3.2349348e-05,0.9993519,6.0622554e-08,2.568887e-10
140,"Kenny's composition ""I Can't Stand Losing You"" which was written by Kenny in the early 1930s when he was in high school, was recorded by The Ink Spots for Decca Records in 1940.",0.00014697122,0.98843515,0.0018872677,0.009530668,4.1247009e-10,5.175273e-09
141,"Although it was recorded in 1940, Decca decided to wait to release it until March 1943.",0.29495087,5.3013413e-05,9.500747e-08,0.7049959,4.4778268e-08,8.473801e-08
142,"Soon after its release, the song became a #1 hit on the R&B charts and was listed there for 7 weeks.",4.3703574e-05,0.15080197,1.8818627e-09,0.72954744,4.9281323e-07,0.11960632
143,===,0.0018068925,2.1080356e-05,2.7498634e-05,0.00044118572,0.9977034,1.2509472e-11
144,Television appearances =,0.97374743,1.4618582e-06,1.8163517e-09,7.6391515e-09,9.839934e-09,0.026251122
145,==,0.124878764,0.21344112,0.0013716007,0.0017026727,0.65860575,7.902396e-08
146,Throughout his career Kenny made dozens of television appearances both with The Ink Spots and as a solo act.,0.6177521,0.19228752,1.4142581e-05,0.18994626,2.3318915e-08,3.3225824e-09
147,In 1936 Kenny and The Ink Spots became the first African Americans to appear on Television.,0.01219322,0.9400766,1.6319738e-06,0.044496365,0.0032317105,4.274727e-07
148,Kenny was later also featured with The Ink Spots on The Ed Sullivan Show multiple times.,0.00030627864,0.9639261,2.5570253e-05,0.035741918,1.2626857e-07,4.5375735e-08
149,"He also was featured with The Ink Spots on shows such as Songs for Sale three times, The Buick-Berle Show twice, Star of the Family, Wonderful Town, USA and more.",1.8246125e-06,0.000270734,6.3845955e-06,0.9997204,1.5724277e-07,4.965127e-07
150,"Kenny was featured as a solo act on The Merv Griffin Show, The Steve Allen Plymouth Show, The Joey Bishop Show, The Robert Q. Lewis Show, The Jack Paar Tonight Show, The Generation Gap with Dennis Wholey, Flashback and four times as a solo on The Ed Sullivan Show.",0.00012623463,0.9815576,7.246892e-08,0.01831591,1.3069096e-07,1.1114056e-09
151,In 1966 CBC Television aired a musical variety show called The Bill Kenny Show.,0.00039734395,0.0140497545,9.920438e-09,0.9855525,3.5738108e-07,7.562709e-12
152,Kenny hosted as well as performed on the program.,3.4903314e-07,0.04597179,1.6158912e-05,0.9537602,1.1114736e-07,0.0002514204
153,"In the mid- to late 1960s Kenny hosted, emceed, and performed for a number of charity telethons in Canada.",3.884935e-06,0.0026607949,3.7576498e-07,0.0001232454,0.00046695126,0.99674475
154,==,0.124878764,0.21344112,0.0013716007,0.0017026727,0.65860575,7.902396e-08
155,Personal life ==,0.002554406,0.00046550567,4.8373266e-07,1.0761044e-09,8.063284e-05,0.996899
156,Kenny was married three times.,2.3588398e-06,0.004691688,1.4735166e-06,0.0017793056,0.98809564,0.0054295138
157,His first marriage was to Zena Boyd in 1937.,0.049180515,0.0014059948,5.5675423e-07,0.00018536563,0.63860095,0.3106267
158,"His second marriage came in 1947 to Marguerite Wendell, a model from Chicago introduced to Kenny by heavyweight champion boxer Joe Louis.",2.7351464e-07,0.9253695,7.232225e-05,1.6764833e-09,0.0010893466,0.07346859
159,Kenny's engagement to Ms. Wendell ended in 1949 when Kenny learned that she had tricked him into marrying her by claiming that her unborn child was his.,1.8182475e-07,0.2973194,1.9374376e-08,1.691686e-07,8.532612e-05,0.70259494
160,Kenny later found out that Ms. Wendell had adopted the child in a plan to acquire support money from him.,5.81549e-09,0.9981584,9.972086e-05,1.7004447e-09,0.0016755237,6.640872e-05
161,He filed for divorce in 1949 and sued Ms. Wendell.,1.2970546e-07,0.00012676627,7.047229e-08,1.2145739e-07,0.005396571,0.9944764
162,"Kenny's last marriage was to Audrey McBurney, a former model of Vancouver, British Columbia.",4.0182832e-07,0.00015536272,3.2079558e-11,1.5012764e-09,0.997042,0.0028021312
163,The two were married in 1949 following McBurney's divorce from a man named Roy Norman Buchanan.,5.796483e-06,7.5116975e-07,3.3964302e-09,3.661735e-06,0.99907047,0.00091929757
164,"Shortly after the Kenny-McBurney wedding, Buchanan charged that Kenny had lured away McBurney with gifts and promises of affection.",1.7482182e-05,0.03616695,2.1067332e-05,2.480321e-08,0.002054223,0.96174026
165,"Buchanan named Kenny as a co-respondent and asked for $50,000 ""heart balm"".",0.0858453,0.0018050177,6.686509e-06,0.9057185,0.004480466,0.0021440736
166,"The damage claim was dropped, however; and Kenny settled with Buchanan out of court for $1,300.",0.00026717893,0.9997305,5.584733e-08,6.460899e-10,1.92967e-06,3.2178002e-07
167,Kenny first met McBurney after an Ink Spots performance in Vancouver at The Cave Supper Club where she was a member of the audience.,2.5972978e-15,1.0,8.645824e-14,4.083074e-09,4.4402375e-14,1.3146773e-13
168,"Later on, Audrey became Bill's business manager.",0.9999987,1.3248334e-06,2.9673116e-08,5.717287e-08,1.0128944e-08,4.634026e-09
169,"On July 4, 1969, Kenny was severely burnt when the gas tank of his sports car exploded in an underground parking garage in Vancouver as he lit a cigar while starting the vehicle; third-degree burns to his face and hands contributed to later respiratory problems, stemming from the fumes he inhaled.",2.9260296e-08,0.9745127,1.6452128e-11,5.4348013e-05,0.025433011,2.1841078e-09
170,Kenny and McBurney remained married until Kenny's death in 1978.,2.0788899e-07,4.2648066e-06,1.4217604e-09,7.087311e-05,0.9991405,0.00078404846
171,"Although he never had any children of his own, Kenny became acting father of McBurney's daughter, Dixie Lee, from her marriage to Roy Buchanan.",1.2496601e-05,0.23181286,3.0723168e-06,0.084994994,0.68315494,2.1545024e-05
172,"Bill Kenny was tall, standing at six feet, three inches.",7.681985e-05,0.8232613,0.0006561711,0.17556904,0.0004366615,5.02097e-09
173,===,0.0018068925,2.1080356e-05,2.7498634e-05,0.00044118572,0.9977034,1.2509472e-11
174,Activism and civil rights ===,3.774449e-05,1.810299e-07,0.8986644,0.0025853014,2.129668e-08,0.09871237
175,"Throughout his life, Kenny was known for his actions against racism and his involvement in his community.",0.0015444844,0.00037379266,0.9968466,0.0010903241,0.00014425829,5.145846e-07
176,"In 1945 in an article with the Baltimore Afro-American newspaper, he expressed his dislike of James Eastland, Theodore G. Bilbo and ""all of the rest of the whites who reside in the South and North for that matter, that thrive daily on discriminatory practices against my race"".",3.906692e-06,0.3644301,0.63483924,0.00040230676,0.00014581268,0.00017869603
177,Kenny went on to say:,0.0071203797,0.977183,9.864294e-06,0.015686298,3.510649e-07,1.927902e-08
178,"As a loyal American citizen, I believe in America, but I am a complete alien where democracy is concerned.",1.5567976e-07,0.76876265,0.016816927,0.2142754,0.00014492492,3.964066e-08
179,"To the white man while I am on the stage, I am Mr. Bill Kenny.",0.0006914264,0.8369058,0.0046985345,0.0017077712,0.15599376,2.6583036e-06
180,"But when I am on the streets and still wear my colored face, I am no higher nor lower than the scum of this earth so far as he is concerned.",9.070856e-10,0.8495808,0.0027392118,0.0011398424,0.08672919,0.05981097
181,"On the other hand, after he learns of me, he immediately thinks differently because he feels that I have money.",0.00037594856,0.03063218,0.8255298,0.008517666,0.13494433,3.0865799e-09
182,I am now wondering what Gen. MacArthur can teach the Japs (sic) about democracy when MacArthur knows nothing of that which he expects to teach Japan.,7.327389e-11,4.8622953e-11,1.0,1.5152371e-10,1.5042239e-12,6.6864185e-14
183,"If the American's set about to teach the kind of democracy practiced here in America, this entire world in time, will be full of low ideals because there can be no crime committed by man lower than that of taking away the rights of an individual or a people.",4.2056643e-11,1.233556e-06,0.99999845,3.957462e-08,2.98238e-07,2.5878728e-12
184,"The Americans have since the beginning robbed the colored man of his legitimate rights, and this is a low crime.",5.2019554e-05,2.2431686e-06,0.98660815,1.4683007e-05,0.013322912,2.7514175e-11
185,"In 1949 Bill Kenny made headlines when he spoke out against racism and the ""southern bugaboos of prejudice"".",0.001085467,0.501902,0.2802888,0.11445883,0.019320479,0.08294447
186,"Here is an excerpt from an article in the June 22, 1949, Miami Beach newspaper:",1.5577861e-07,0.0069750976,3.161796e-10,0.0029627911,0.9876819,0.0023800274
187,"An event that will go down in radio history took place over station WGBS in Miami Beach recently, when Barry Gray, the vituperant disc jockey, invited Bill Kenny, leader of the Ink Spots, to be his guest on the station.",0.00031721024,0.81567323,2.6138541e-05,0.17908409,0.0004230852,0.0044762194
188,This invitation posed many problems that had to be solved before this appearance could materialize.,7.808889e-05,0.8097751,0.0032750245,3.663139e-06,3.9962868e-07,0.18686767
189,Radio Station WGBS broadcasts right from the Copa City Club which is definitely prohibited area for any Negro.,2.5381445e-05,8.659848e-06,8.03124e-08,0.99996316,2.7627111e-06,1.9175032e-10
190,"But the Ink Spots road manager, Murray Nadel, never one to be stumped by problems, called the police department and got a special police escort to take him and Bill Kenny to the radio show.",0.0104926545,0.13017741,0.84495425,0.002744875,0.011621771,8.9800005e-06
191,"Barry Gray, long known for his fearless tactics in fighting the problems of a minority, immediately turned the interview into a forum seeking Bill Kenny's views on race prejudices in the South.",6.0761736e-06,0.9996946,0.00029747214,8.6190255e-08,1.0797085e-06,7.195146e-07
192,The interview lasted for a half-hour and Kenny and Gray talked about nothing but the southern bugaboos of prejudice.,0.0003120225,0.99937373,1.0565756e-05,7.5920656e-07,1.16858155e-05,0.0002913191
193,After the show went off the air both Barry and Bill sat around expecting the phone to ring violently all night long with many protests for what had just been discussed on the Southern air.,0.00014721444,0.18188983,0.7520427,0.0009609814,0.064888574,7.067853e-05
194,But a great surprise was in store for both of them because the phone did ring many times but every call was from listeners who were very amiable and agreed with Kenny and Gray on their attitude on Southern prejudice.,7.812891e-08,0.81230974,0.00600802,1.5176787e-05,0.18166699,9.855255e-11
195,"It is a good sign for modern progress to realize that most of the Southerners, as individuals, agree wholeheartedly that all these unseen walls should be torn down and Negro talent should get its chance on Southern radio.",0.9999238,6.7149344e-06,6.905105e-05,4.913882e-07,1.3845491e-08,1.0261367e-11
196,"The radio station, received over 3,000 calls after this precedent breaking broadcast and from all that number there was not one single complaint.",4.740874e-06,8.5901054e-05,9.665671e-05,0.014399027,0.9854036,1.0069046e-05
197,"An added sidelight worth noting is the fact that when Bill and his road manager left the radio studio they dismissed the police escort as there was no need for this ""protection.""",0.99995303,1.37676625e-05,3.19196e-05,3.7296366e-09,1.0465438e-07,1.1828832e-06
198,===,0.0018068925,2.1080356e-05,2.7498634e-05,0.00044118572,0.9977034,1.2509472e-11
199,Charity work =,0.31612682,5.174117e-07,2.6876118e-05,0.65686846,0.01988465,0.0070926696
200,==,0.124878764,0.21344112,0.0013716007,0.0017026727,0.65860575,7.902396e-08
201,"In 1973, all of the proceeds from Bill Kenny's RCA album With Love and the proceeds from Kenny's book of Poems Who Is He went to the establishment of a local foster home for needy children.",9.247207e-06,0.9193434,0.00021032682,0.052182876,3.86534e-05,0.02821548
202,"Also in 1973, Kenny was awarded the Vancouver Interfaith Brotherhood award by Justice Angelo Branca who said Kenny was ""a man of outstanding human qualities"".",3.3168902e-12,0.004293062,4.8238094e-09,2.4966344e-06,8.738689e-09,0.9957045
203,Throughout his career Kenny made appearances on numerous charity telethons particularly benefiting handicapped or homeless children.,0.005295996,0.9575715,6.717041e-06,3.8775984e-06,0.00039263046,0.036729265
204,==,0.124878764,0.21344112,0.0013716007,0.0017026727,0.65860575,7.902396e-08
205,Death ==,1.2276638e-08,0.89292747,1.5102201e-07,2.2871278e-10,0.107072435,1.250211e-09
206,"Kenny died from a respiratory illness on March 23, 1978, in New Westminster, Canada.",2.4798787e-08,2.7701057e-08,9.947139e-10,8.466518e-05,0.99991524,1.9551264e-08
207,His funeral service was held at the Unitarian Church of Vancouver.,4.0919698e-11,1.6443771e-07,0.000409707,0.00014455242,0.00029294725,0.99915266
208,"Although there were tears from some in the congregation and from the nine eulogists, Mrs. Audrey Kenny asked that the service be kept cheerful.",3.6907506e-09,0.14263706,1.644304e-07,0.00024133902,0.0033061837,0.8538153
209,"About 200 people – family, friends, and a few fans – were in attendance.",2.9648058e-05,0.079510584,1.8986005e-06,0.0017149755,0.0056637567,0.91307914
210,==,0.124878764,0.21344112,0.0013716007,0.0017026727,0.65860575,7.902396e-08
211,In popular culture ==,7.71703e-07,1.5093133e-07,9.313332e-10,4.924995e-11,2.0151242e-11,0.99999905
212,"Kenny's voice has been featured in television shows such as The Walking Dead, The Simpsons, The Visitor, The Singing Detective, Sanford, The Blacklist, Manhattan, Defiance, Arrested Development, The Wonder Years, Wayward Pines, Better Call Saul, Watchmen and more.",6.3051564e-11,0.99952126,0.00037435797,0.000104355764,1.5558941e-12,1.8443032e-13
213,Kenny's unusual high singing voice and impeccable diction was often imitated on Television.,0.00014049457,0.87724453,0.10479805,0.01781557,1.3156633e-06,9.812216e-09
214,The most famous example is that of Fred G. Sanford (played by comedian Redd Foxx) on the 1970s sitcom Sanford and Son.,1.5094014e-09,0.0014868714,0.00015259936,6.9885596e-07,0.9983584,1.4728249e-06
215,"Foxx would often sing The Ink Spots hit ""If I Didn't Care"" while imitating Kenny's hand gestures and clear diction.",3.5824301e-09,3.8693335e-05,0.8071548,0.1928062,2.4911063e-07,1.1973432e-10
216,"In one episode (""Lamont As Othello""), Foxx sang ""If I Didn't Care"" but couldn't hit the last high note, at which point he remarked: ""Ah!",8.970661e-05,0.038370587,0.9275364,0.03399775,5.4331745e-06,8.472261e-08
217,Bill Kenny used to hit that note.,6.5347626e-07,6.6410204e-05,6.5089067e-09,0.99992895,3.992474e-06,2.2873155e-15
218,"""Kenny's voice has been featured in such films as The Shawshank Redemption, Get Low, Radio Days, Raging Bull, Revolutionary Road, The Aviator, Iris, Sphere, Tree's Lounge, Malcolm X, Maria's Lovers, How to Make an American Quilt, Men Don't Leave, Twenty Bucks, Mr. Nobody, Hyde Park on Hudson and more.",1.5568096e-08,0.14174658,0.0002999593,0.8579534,1.0233782e-09,5.423328e-13
219,"Kenny appeared as himself in Pardon My Sarong, and The Great American Broadcast.",0.002404715,0.12483756,0.00049603754,0.8722368,2.3893703e-05,1.029815e-06
220,"Kenny's voice is featured in the video games Fallout, Fallout 3, Fallout 4, Fallout: New Vegas, L.A. Noire, BioShock and Mafia II.",1.4336667e-10,0.013955274,3.7452153e-07,0.9860444,1.7518667e-11,1.09752126e-13
221,==,0.124878764,0.21344112,0.0013716007,0.0017026727,0.65860575,7.902396e-08
222,US Pop Hits on which Bill Kenny sang lead ==,0.006895723,0.0015072698,3.4395304e-09,0.99151164,8.528343e-05,4.813179e-10
223,==,0.124878764,0.21344112,0.0013716007,0.0017026727,0.65860575,7.902396e-08
224,References ==,2.5076562e-05,0.01809866,8.964928e-05,0.06195029,4.458229e-09,0.9198363
