,Sentence,Business meeting,Coincidence,Education,Music making,Personal life,Public celebration
0,"William Francis Kenny Jr. (June 12, 1914 – March 23, 1978) was an American vocalist with a wide vocal range spanning four octaves.",0.00010143584,0.021330616,0.0102867605,0.96278906,0.0054920437,6.36672e-08
1,"Often regarded as one of the most influential high-tenor singers of all time, Kenny was noted for his ""bell-like"" vocal clarity and impeccable diction.",0.008611297,0.7146394,0.028492277,0.24823833,1.3545631e-05,5.237693e-06
2,"Although he is most famous for his role as lead tenor with the Ink Spots, Kenny also led a successful solo career after disbanding the Ink Spots in 1954.",0.27163336,7.700252e-06,2.2712755e-05,0.7283362,2.3724758e-09,3.351536e-11
3,"Throughout the 1950s and 60s Kenny recorded, toured the world and appeared on many popular variety television shows.",0.0006650337,0.9962786,1.3466571e-07,0.0030560172,2.8462009e-07,4.636024e-09
4,In 1966 Kenny became the star and host of his own musical variety show The Bill Kenny Show which aired on CBC.,0.023505209,0.14385463,2.032223e-07,0.8326396,3.9824906e-07,5.3720334e-11
5,"In 1989, 11 years after his death, Bill Kenny was inducted into the Rock and Roll Hall of Fame.",0.016280811,0.9513039,1.6137185e-05,0.023227058,3.054762e-05,0.0091417525
6,"Kenny is often noted as being the ""godfather"" of R&B tenor vocalists.",0.00016844257,3.5084017e-06,5.737893e-05,0.99976975,9.811225e-07,1.3649994e-11
7,==,0.124878764,0.21344112,0.0013716007,0.0017026727,0.65860575,7.902396e-08
8,Early life and education,1.0034215e-06,8.4857e-08,0.989184,4.8302115e-07,0.00058919046,0.010225159
9,==,0.124878764,0.21344112,0.0013716007,0.0017026727,0.65860575,7.902396e-08
10,"Kenny was born William Francis Kenny Jr. in 1914 at Mercy Hospital in Philadelphia, Pennsylvania.",5.6668745e-07,0.00023559752,1.49142e-10,0.0024274283,0.9973363,4.1634134e-08
11,"Although Kenny was born in Philadelphia, he spent much of his young life in Baltimore, Maryland, with his twin brother Herb Kenny, who later on would also become a member of The Ink Spots.",4.9080677e-07,0.9889254,3.9892e-05,0.0002375666,0.010796711,3.920377e-09
12,"The boys' father, William Francis Kenny Sr., died of influenza in 1919 when the boys were five years old.",5.23709e-14,3.9878216e-08,1.7026132e-10,6.260139e-10,1.0,4.876977e-16
13,"That same year, their widowed mother, Jennie Kenny (1894–1958) moved the boys to Washington D. C and then to Baltimore, where the family attended St. Peter Claver Church and lived at 1151 Carey Street.",8.652476e-12,2.442115e-06,8.7913024e-11,4.13675e-10,0.9999976,1.1400109e-08
14,Mrs. Kenny worked as a dressmaker and made drapery for department stores to support the boys.,2.1557757e-05,0.99844766,6.920318e-09,2.0985808e-06,0.0015277523,8.197167e-07
15,"It was in the third grade that young Bill walked out on stage at his school, St. Peter's Parochial, to sing his first song in public.",0.005665121,0.0004480879,0.01851176,0.9753745,5.546629e-07,4.8202104e-08
16,"It was ""The Japanese Sandman"".",4.6249817e-05,0.10134549,2.8248203e-05,0.04164956,0.85686386,6.662096e-05
17,"Kenny demonstrated early on his high Tenor singing abilities, singing C over high C and participating in various school operettas at Booker T. Washington Junior High School and later at Douglass High School where he graduated.",3.6067763e-06,0.16670378,0.0009825062,0.8323101,4.981585e-09,8.613089e-09
18,"Here is an excerpt from a 1944 interview with the Baltimore Afro-American newspaper, where Kenny recalls singing as a young boy",7.324737e-06,0.14810081,9.567531e-09,0.85187316,1.2745314e-05,5.8408978e-06
19,'I've been singing since I was 7 and never had a voice lesson in my life.,4.5074987e-05,3.363368e-06,0.9999504,9.164061e-09,5.2146817e-07,7.145333e-07
20,"I was sitting in class one day, and I began singing.",4.984872e-07,0.898398,0.00018531508,0.10141604,1.4583458e-07,1.7410796e-08
21,"My teacher wanted to know who was singing and at first I was afraid to answer, but finally, I confessed.",3.6060428e-07,0.14274389,0.17375134,0.683414,4.479056e-06,8.5957276e-05
22,I was singing a full soprano then and unless you knew you would have thought a girl was singing.,2.799079e-09,0.0032466839,2.1242588e-09,0.9967533,3.6825377e-08,9.0046853e-10
23,"Anyhow, the teacher kept me after school, but instead of punishing me, he arranged for me to sing in the auditorium.",0.0005637211,0.6836513,0.031155935,0.27904847,3.4221603e-06,0.005577099
24,"My voice hasn't changed much yet,' he said.",0.020363063,0.0006070044,0.0013907314,0.0005970411,0.9770421,3.033799e-08
25,'It's still rather high.',0.248179,0.008093476,0.73767567,0.0058900863,0.00016168777,4.0024513e-08
26,He made a few high notes for the AFRO. ',0.0012756933,0.008513907,0.012348919,0.87709296,0.10076857,1.0583432e-08
27,"Well, that performance started me singing in earnest.'",0.006182137,0.010681428,5.4937384e-09,0.9829543,0.00016378703,1.8296167e-05
28,"Although his voice has always been high, kids never teased him about it.",0.99995494,4.0282983e-05,3.555067e-08,4.4620356e-06,4.158533e-07,6.038978e-13
29,"'They always kept quiet when I sang and seemed to enjoy it,' Kenny said.",5.0429264e-07,0.05417172,8.685321e-07,0.9458259,1.0002217e-06,4.325674e-13
30,Kenny's speaking voice is quite low and husky.,6.0583005e-08,0.99256986,0.0028978742,0.0038786237,0.00065347494,3.7629993e-11
31,It was in high school that Kenny began to focus on singing more than before and often appeared singing solo in his school assemblies.,0.00012269685,0.48997188,5.2841155e-05,0.509851,1.7243e-08,1.5773453e-06
32,"After graduation, Kenny attended an art school in Washington, D.C., but would on occasion, appear as a soloist in amateur contests in theaters throughout the Baltimore-Washington, D.C. metropolitan area.",6.385352e-05,0.9525368,0.0041531026,0.04319649,3.4034667e-06,4.6363864e-05
33,==,0.124878764,0.21344112,0.0013716007,0.0017026727,0.65860575,7.902396e-08
34,Career ==,1.0,4.7553845e-13,2.1761314e-17,4.5407397e-19,9.245216e-14,7.686053e-12
35,"While Kenny was on vacation in Atlantic City, New Jersey, the young singer competed in 22 amateur night club contests, winning 21 of them.",0.005386193,0.030189712,7.4764404e-07,0.0002267209,0.00040934965,0.9637873
36,"Bill Kenny's first professional booking was in Atlantic City, New Jersey, at the Ritz-Carlton Gardens.",0.84765345,0.1495464,2.192736e-08,0.0027956483,4.3553487e-06,1.5281663e-07
37,"After Milton Berle's brother, Phil Berle, heard Kenny singing ballads, he signed him to a contract.",0.94999415,0.022645248,3.4375462e-06,0.027354501,1.4731429e-06,1.2440756e-06
38,"Because jobs were too difficult to get in New York City, Berle decided to release Kenny from the contract after a short time.",0.01124937,0.9887454,6.8106766e-07,1.9270837e-07,3.8159988e-06,4.9451245e-07
39,"It was around this time that Kenny sang ""Trees"" in an amateur contest at the Savoy Ballroom in Harlem, and won first place, and a position singing with a group known as ""The Ink Spots"".",2.4732706e-05,0.9343378,0.0022940764,0.02674833,0.03631739,0.00027763672
40,===,0.0018068925,2.1080356e-05,2.7498634e-05,0.00044118572,0.9977034,1.2509472e-11
41,Influences and musical impact =,0.0057907323,0.00014834931,0.265927,0.00019630122,0.033211038,0.6947266
42,==,0.124878764,0.21344112,0.0013716007,0.0017026727,0.65860575,7.902396e-08
43,"In a 1992 interview, Kenny's twin brother Herb noted that singer Morton Downey had a tremendous influence on Bill and that Bill would often listen to Downey when he came home from school.",2.7733952e-06,0.0008713067,0.99907196,9.373568e-07,5.299739e-05,6.7342802e-09
44,It also is assumed that singer Orlando Roberson had influenced Kenny early on.,4.1288808e-05,0.011641419,0.8257365,0.16254945,3.1269945e-05,4.213858e-11
45,Kenny has often been regarded as one of the most influential vocalists of the 20th Century.,6.817435e-05,0.53528273,5.633453e-05,0.45783356,1.1127129e-05,0.0067480993
46,"Singers such as Elvis Presley, Sam Cooke, Michael Bublé, Clyde McPhatter, Garland Jeffreys, Johnny Mathis, Tony Williams (The Platters), Del Shannon, Rudy West (The Five Keys), Sollie McElroy (The Flamingos), Jackie Wilson, Johnny Bragg (The Prisonaires), Nolan Strong and Prentice Moreland have all noted Bill Kenny as a major influence on their own singing.",0.0006215297,0.00082492194,6.454079e-05,0.99822325,0.00026574262,1.3084979e-08
47,"Elvis Presley frequently spoke of his admiration of Kenny and was once noted as saying that he could ""honestly never hope to equal the musical achievements of Bill Kenny"".",6.282868e-07,0.9985481,0.00022460667,0.0012261899,4.442276e-07,5.882551e-11
48,"In 1971 Presley recorded Kenny's composition ""There Is No God But God"".",0.00094855024,0.26197234,4.948585e-07,0.73707765,9.328478e-07,2.4582068e-08
49,"In the book ""Group Harmony: The Black Urban Roots of Rhythm and Blues"" by Stuart L. Goosman, Bill Kenny's immense influence on other vocal group singers is expressed in this excerpt:",0.23010652,0.45351344,0.3132169,0.0030799496,5.575948e-05,2.7416518e-05
50,"Before the R&B era, before The Ravens, Orioles, and Clovers, young Black Males who wanted to sing wanted to be just like Bill Kenny and The Ink Spots.",2.3125129e-05,0.06088097,6.630198e-05,0.9374901,0.0015394965,2.1426463e-09
51,The group had the sound and they had the look.,6.12955e-06,0.00018873547,0.007582405,0.9903223,0.0019004922,3.5987643e-08
52,"During the 1950s, Harold Winley sang bass for The Clovers and remembered the impact of The Ink Spots: ""But during that time"" he said, ""you know, the groups that you would hear around on the corner singing were mostly singing Ink Spots.",5.712897e-06,0.00017872223,3.8876768e-10,0.99981517,4.2918376e-07,5.074165e-13
53,"You hear cats going down the street, you know guys that had tenor voices man, in the morning, at night, singing Bill Kenny and doing the hands, like he used to do.",4.6965986e-05,0.7719317,0.076435745,0.15158345,2.2132235e-06,1.0522447e-09
54,It was either Bill Kenny or Billy Eckstine.,0.00036099736,0.0007990975,2.0963098e-05,0.99532664,0.0028427006,0.00064964034
55,Understand what I'm saying?,6.384563e-09,0.60660475,0.0017777997,0.03552191,0.3538795,0.002215997
56,"Those were the voices you would hear.""",8.3662965e-11,0.003109001,0.00012935283,0.99672556,3.6011937e-05,3.4123113e-10
57,"Some of Kenny's favorite vocalists over the years included Ella Fitzgerald, Vic Damone, Lena Horne, Paul Robeson, John Gary, Roland Hayes and Nat King Cole.",0.87491745,0.0037188316,4.6231176e-05,0.121314466,3.0103677e-06,6.469388e-12
58,===,0.0018068925,2.1080356e-05,2.7498634e-05,0.00044118572,0.9977034,1.2509472e-11
59,The Ink Spots ===,0.0007526088,0.9122411,0.008835439,0.018808847,0.059361916,1.5104008e-09
60,In 1936 The Ink Spots 1st Tenor Jerry Daniels left the group and was replaced by Bill Kenny.,0.92143804,0.0767152,0.0017841514,4.2255273e-05,2.005892e-05,7.5572125e-08
61,"Bill Kenny made his first recordings with The Ink Spots ""It Ain't Nobody's Biz'ness What I Do"" and the swing tune ""Your Feet's Too Big"" on May 12 of that year.",0.3701481,0.40933865,1.7384803e-08,0.22051287,2.702087e-07,9.577678e-08
62,"Kenny had a brief solo on ""Your Feet's Too Big"".",7.50277e-05,0.55548817,7.573142e-08,0.4444367,1.0466722e-08,1.40869365e-11
63,Kenny's first known solo feature came in February 1938 on a radio broadcast for radio station WEAF.,0.24747674,0.0001465496,1.2505308e-06,0.75237256,1.711821e-06,1.1905345e-06
64,"The song was ""Tune In On My Heart"" from the 1929 Broadway musical ""Remote Control"", lyrics and music by Buddy Valentine and Gene Johnston.",1.6752986e-11,1.491127e-06,2.3814962e-08,0.9999982,1.7364446e-08,2.0478053e-07
65,"Kenny's first recorded solo feature to be recorded in a studio came in 1938 for Decca records on the ballad ""I Wish You The Best Of Everything"".",0.0021027974,4.496392e-08,2.3876626e-10,0.99789715,2.1341693e-09,4.244118e-08
66,In 1939 The Ink Spots were scheduled for a recording session at Decca recording studio in NYC.,0.40220323,0.009964318,3.2814845e-07,0.58782953,2.6781356e-06,1.1982361e-09
67,"Songwriter Jack Lawrence brought with him his latest composition ""If I Didn't Care"" for The Ink Spots to record.",5.1998192e-09,1.0199085e-05,0.00014349319,0.9998361,1.0074639e-05,1.013217e-11
68,"Bill Kenny was featured throughout except for the middle ""talking Bass"" part done by Orville ""Hoppy"" Jones.",3.927085e-09,0.0010434913,3.991359e-11,0.99895644,2.8873437e-10,1.5747929e-11
69,"Each member was paid only $37.50 for the recording, however, once the record sold 200,000 Decca destroyed the original contract and The Ink Spots were paid an additional $3,750.",0.12056998,0.00019737861,0.04621744,0.8327925,1.9070061e-06,0.00022082034
70,The record went on to sell more than 19 million copies and was Bill Kenny's first top hit feature.,0.00017143831,3.941228e-05,4.9129464e-11,0.9997888,7.200084e-08,2.2888413e-07
71,"The year 1939 was the start of a new format for The Ink Spots that would feature Charlie Fuqua's trademark Guitar intro, Bill Kenny's Tenor lead, and Hoppy Jones ""talking bass"".",0.91373587,0.0035093059,2.1814267e-05,0.08273083,2.1432459e-06,1.5994092e-07
72,"Other Bill Kenny features such as ""Address Unknown"", ""My Prayer"", ""Memories of You"", ""I'm Gettin' Sentimental Over You"", and ""Bless You (For Being An Angel)"" all reach the top of the U. S Pop charts in 1939.",0.00014941914,0.008579139,1.3267179e-07,0.99117446,8.380806e-05,1.3008896e-05
73,It was around this time that The Ink Spots signed an additional five-year recording contract with Decca.,0.9998412,6.228411e-09,1.1474347e-06,0.0001565003,1.0751063e-06,4.062699e-11
74,====,0.0008281029,4.9745056e-05,1.6403084e-05,9.948394e-06,0.9990958,1.313979e-10
75,1940s,0.21323453,0.061824348,0.6745443,3.4490906e-05,0.00025689063,0.050105423
76,====,0.0008281029,4.9745056e-05,1.6403084e-05,9.948394e-06,0.9990958,1.313979e-10
77,From 1940 to 1949 Bill Kenny was featured lead singer on 40 of 45 Ink Spots recordings that reached the top of the U. S Pop charts.,0.0119249765,0.015367008,1.3507292e-06,0.9722493,0.00045724792,1.4692422e-07
78,During the 1940s Kenny was featured in two major motion pictures: The Great American Broadcast (1941) and the Abbott and Costello film Pardon My Sarong (1942).,0.999959,2.7203938e-05,1.6977735e-06,8.761323e-06,1.5841508e-06,1.8902498e-06
79,"In 1944 Ella Fitzgerald joined The Ink Spots at Decca studios where she and Kenny were to be featured on a song entitled ""Into Each Life Some Rain Must Fall"".",0.052511286,0.86189157,0.08528567,0.00023701554,2.0716032e-05,5.370467e-05
80,That song reached #1 on the U. S Pop charts and #1 on the R&B charts.,1.17782136e-07,0.00851937,1.1457724e-08,0.9877819,0.0019484961,0.0017502006
81,"The flip side of that recording ""I'm Making Believe"" reached #1 on the U. S Pop charts and #2 on the R&B charts.",5.642235e-06,0.006436103,8.7405394e-10,0.99355173,5.9089366e-06,5.876093e-07
82,"In February 1945 Fitzgerald teamed up with The Ink Spots and was featured again with Kenny on a recording of ""I'm Beginning To See The Light"" and ""That's The Way It Is"".",0.009014934,0.0018590677,8.449634e-06,0.9891149,2.7468438e-06,2.2540865e-09
83,"""I'm Beginning To See The Light"" reached #5 on the U. S Pop charts.",2.0019574e-05,0.9660402,4.974266e-07,0.0001528189,0.033578493,0.00020803418
84,"That same year, The Ink Spots manager Moe Gale, began trying to advertise the quartet as ""The Ink Spots (Featuring Bill Kenny)"" due to Kenny's increasing leadership role.",0.22037567,0.74090326,0.0042902925,0.034429282,1.5275446e-06,1.7615193e-08
85,In 1948 The Ink Spots featuring Bill Kenny appeared on the first-ever Ed Sullivan Television show.,0.2679367,0.7315527,1.6598991e-05,0.0004850726,8.168008e-06,7.761668e-07
86,"In 1949 Bill Kenny made his first solo recordings ""Echoes"" and ""Land of Love"" without The Ink Spots on Decca records.",1.3342587e-05,0.0011531343,3.7847477e-07,0.998833,9.4398054e-08,1.04342174e-10
87,"Although these were Kenny solo recordings, Decca decided to label them as ""The Ink Spots"".",0.0007238443,9.2842485e-05,8.508601e-08,0.9991829,3.9667606e-07,5.8849392e-12
88,"Kenny's recording of ""Echoes"" reached #24 on the U. S Pop charts.",5.9579265e-06,0.73581845,1.9820675e-06,0.17232586,3.511275e-07,0.0918473
89,==== 1950s,0.0028260574,0.018291293,1.2808072e-06,0.09221488,0.8815883,0.0050781784
90,====,0.0008281029,4.9745056e-05,1.6403084e-05,9.948394e-06,0.9990958,1.313979e-10
91,"In 1950, Ella Fitzgerald teamed up once again with Bill Kenny & The Ink Spots and recorded ""Little Small Town Girl"" and ""I Still Feel The Same About You"".",7.6207216e-05,0.0030497543,0.0022094348,0.98887885,0.0057857665,2.4433455e-09
92,Both were duos with Fitzgerald and Kenny.,6.4511006e-08,9.687768e-10,9.42036e-07,0.9999989,6.309972e-08,2.0038632e-11
93,Their previous collaborations were more like solo features than duets and didn't include as much harmonizing as these two recordings.,0.0014395649,7.936636e-05,0.00042292222,0.9980134,4.468131e-05,3.488209e-08
94,"In 1950, Kenny's solo recording of ""If"" reached #23 on the U. S Pop charts but, like his solo recordings from 1949 were labeled ""The Ink Spots"".",0.00044953535,0.00014843929,1.4471223e-08,0.9993973,8.199073e-07,3.904288e-06
95,"In 1951 Bill Kenny recorded two more solo recordings ""I'm Lucky I Have You"" and ""I Don't Stand a Ghost of a Chance with You"" which featured cornetist Bobby Hackett.",5.3583185e-06,0.923995,3.486531e-10,0.07599887,5.475642e-07,1.5795676e-07
96,"These were also solo recordings labeled as ""The Ink Spots"".",2.6523467e-05,3.8099998e-07,7.570745e-08,0.99997294,1.70916e-07,2.3001156e-12
97,"This happened once more in October 1951 with Bill Kenny solo recordings """,9.050172e-05,9.486992e-06,5.339818e-10,0.99989986,1.3761732e-07,2.077142e-10
98,"And Then I Prayed"" and ""Honest And Truly"" on which he performs the ""talking bass"" part made famous by Orville ""Hoppy"" Jones.",0.00019376223,0.0022423815,3.723353e-06,0.99755967,4.2317103e-07,1.0214322e-08
99,"The last Ink Spots studio recordings were of the gospel composition ""Somebody Bigger Than You And I"" and the Blues number ""Do Something For Me"" both recorded in February 1951.",2.997486e-10,8.90751e-06,9.569857e-07,0.99998534,1.4423185e-07,4.645879e-06
100,"In 1952 Charlie Fuqua, Baritone singer, Guitarist, and original member since 1934, decided to leave Bill Kenny to form his own Ink Spots group.",0.4575243,0.0008046511,0.0006233234,0.54104716,5.768211e-07,6.2945014e-09
101,"It was decided by the court ruling that Fuqua would have to name his group ""The 'New' Ink Spots"" however after a short time he dropped the ""New"" and thus two groups were using the name ""The Ink Spots"".",0.05043068,0.02714307,0.0029726895,0.9193918,6.0207953e-05,1.6925544e-06
102,"This resulted in great conflict and confusion however Bill Kenny kept performing with The Ink Spots and started billing them as ""Bill Kenny & His Ink Spots"".",0.904105,0.052016992,7.692821e-05,0.04380079,3.131289e-07,8.488371e-09
103,"A few live recordings and ""radio checks"" of Bill Kenny's Ink Spots from 1952/1953 survive today.",5.305229e-06,0.28971303,1.9320046e-06,0.71026593,1.1705631e-07,1.37130055e-05
104,"After being with The Ink Spots for 18 years, Bill Kenny decided to leave the group for good in 1954, resulting in The Ink Spots disbanding.",0.9740631,0.008769322,0.00036252072,0.016805086,1.5374193e-08,1.376562e-09
105,===,0.0018068925,2.1080356e-05,2.7498634e-05,0.00044118572,0.9977034,1.2509472e-11
106,Solo career ===,1.0,1.7569262e-12,6.44053e-13,1.0885304e-09,4.085746e-09,5.5907813e-11
107,"In 1951, Kenny started upon a solo career that would last until his death in 1978.",0.59552354,8.3932207e-07,1.0081352e-08,0.40435278,0.00012276921,1.4196911e-07
108,"From 1951 to 1952 all Decca recordings labeled ""The Ink Spots"" featured only the voice of Bill Kenny, therefore, making all Ink Spots recordings from '51 to '52 Bill Kenny solo recordings.",0.00013250262,0.00028977718,2.5410789e-06,0.9995751,1.3634512e-07,5.496232e-13
109,"From 1952 to 1953 Bill Kenny recorded 33 solos for Decca, some labeled as ""The Ink Spots"" and some as ""Bill Kenny"" or ""Bill Kenny of The Ink Spots"".",0.0011603094,0.0002779365,5.0172517e-08,0.99856097,6.9676014e-07,5.8987567e-12
110,"Later on, Kenny recorded 14 sides for RCA's Vik label, four for the TEL label, two for the Warwick label, two for the AUB label, and two for RCA.",0.13504165,0.0010989115,3.6472507e-08,0.8638594,4.2760398e-08,1.7468665e-10
111,"These recordings featured arrangements by such prominent arrangers as Sy Oliver, Marty Gold, Leonard Joy, Morty Craft, Charles Shirley, and Leroy Kirkland.",7.286093e-06,6.6642126e-05,1.4076633e-08,0.99978167,2.8367353e-06,0.00014163097
112,====,0.0008281029,4.9745056e-05,1.6403084e-05,9.948394e-06,0.9990958,1.313979e-10
113,Solo albums ==,0.9962831,6.0522136e-11,1.02118785e-08,0.0037167042,2.5829155e-07,5.1742517e-12
114,==,0.124878764,0.21344112,0.0013716007,0.0017026727,0.65860575,7.902396e-08
115,"In 1951, Kenny released his first album Precious Memories on the Decca label under the ""Faith Series"" and recorded four songs also on the ""Faith Series"" that were not included in the Precious Memories album.",0.017237866,1.5484817e-06,2.298078e-06,0.98275834,6.752459e-09,3.558703e-09
116,"Kenny's recorded version of the Gospel composition ""It Is No Secret"" from the album Precious Memories, reached #18 on the US pop charts in 1951.",4.6394714e-05,0.0008094747,2.6630594e-06,0.9348407,4.8733165e-07,0.06430031
117,"In 1960 Kenny released his second album ""Mr. Ink Spot"" on the Warwick label.",0.07815717,0.613008,7.71892e-05,0.30869505,6.262088e-05,2.3767061e-08
118,"This album contained songs previously made famous by Bill Kenny and The Ink Spots as well as some standards such as ""I Don't Know Why"", ""It Might As Well Be Spring"", and ""You'll Never Know"".",0.5509075,0.44183677,0.0068068025,0.0004486558,3.552715e-07,2.2748217e-09
119,The Orchestrations on the album were arranged and conducted by Charles Shirley.,5.873865e-07,8.2824075e-10,2.8297977e-09,0.99999917,2.8960039e-09,2.6338938e-07
120,In 1962 Kenny released an album on Mercury's subsidiary label Wing Records entitled Bill Kenny Sings,0.006540739,0.0007474108,1.9506564e-05,0.9926736,1.8798823e-05,7.356301e-15
121,The Golden Hits of the Ink Spots.,1.8046745e-05,0.99995065,1.0179928e-06,9.956793e-06,2.0167727e-05,7.834541e-08
122,"This album featured such hits as ""If I Didn't Care"", ""I Don't Want To Set The World On Fire"", ""I'll Get By"", and ""Do I Worry?"".",0.08182122,0.002106871,0.07645649,0.16727221,0.67234313,1.03450596e-07
123,In 1966 Kenny recorded an album for DOT Records entitled Remember Me.,1.7203985e-06,9.165922e-06,3.2504905e-09,0.9999889,2.52581e-07,7.1463244e-09
124,"The album contained songs featured on his CBC television program The Bill Kenny Show including ""Me and My Shadow"", ""Danny Boy"", ""You're Nobody 'Till Somebody Loves You"", ""I Left My Heart in San Francisco"", and ""I'll Be Seeing You"".",1.3147613e-05,0.9703975,4.6985397e-07,0.029512476,1.211681e-06,7.5212105e-05
125,"In 1973 Kenny released his first album in seven years, With Love, for RCA Victor.",0.118156604,0.00068618596,7.298287e-07,0.8811564,2.0784737e-08,1.03546675e-07
126,"This album featured songs composed by such songwriters as Irving Berlin, Lennon-McCartney, Kris Kristofferson, and George & Ira Gershwin.",0.13332382,0.00027830945,0.13339677,0.7314557,0.0015313342,1.4060282e-05
127,The arrangements on this album were written by Doug Parker.,0.31775126,1.3905075e-06,1.4299085e-06,0.6816559,0.00034449113,0.00024556945
128,"3 other albums, ""Are You Lonesome Tonight?""[1], ""Bill Kenny Sings""[2], and ""The Ink Spots - If I Didn't Care""[3] was recorded by Bill.",2.176091e-06,0.066653766,7.715008e-06,0.93333584,4.6596182e-07,3.3976133e-10
129,"""Are You Lonesome Tonight?"" includes the same recordings as ""With Love"", and has an unknown release date.",7.9036305e-08,0.022999754,1.3032215e-05,0.9769717,1.5346859e-05,6.378521e-08
130,"""Bill Kenny Sings"" included several new recordings, ""No Summer Love"", ""Tomorrow Always Comes"", and ""Love Me Baby"".",0.05373325,0.06691942,0.0002030329,0.8790357,0.000108533786,1.460966e-12
131,"All other recordings included in the album are from ""With Love"".",0.00014763603,0.00024980283,1.0497851e-05,0.9995921,1.35965406e-11,4.203848e-09
132,"Both Albums are assumed to be released in the coming years of his death, and most likely were released in 1977, one year before his death.",0.9076752,0.006259415,0.0087621845,0.077239804,1.8549478e-06,6.144232e-05
133,"""The Ink Spots - If I Didn't Care"" was recorded in 1977, and released in 1979, and despite the name, it was a set of Bill Kenny recordings covering previously made Ink Spots' songs.",3.059332e-05,3.376234e-05,5.111624e-06,0.999915,1.5463496e-05,1.3395927e-10
134,"It includes ""Whispering Grass (Don't Tell The Trees), ""Maybe"", ""The Gyspy"", ""To Each His Own"", ""I Don't Want To Set The World On Fire"", ""I'll Get By"", ""If I Didn't Care"", ""It's A Sin To Tell A Lie"", ""We Three (My Echo, My Shadow, and Me"", and ""When The Swallows Come Back To Capistrano"".",0.30652833,7.8797086e-05,0.47786748,0.2154973,1.3790827e-07,2.805607e-05
135,====,0.0008281029,4.9745056e-05,1.6403084e-05,9.948394e-06,0.9990958,1.313979e-10
136,Compositions =,5.7941425e-09,3.3887845e-06,0.00010443832,0.9997931,1.9403408e-06,9.718432e-05
137,=,0.0052375095,0.9944845,1.1614813e-05,0.00024722883,1.9252557e-05,9.708692e-09
138,==,0.124878764,0.21344112,0.0013716007,0.0017026727,0.65860575,7.902396e-08
