,Sentence,Business meeting,Coincidence,Education,Music making,Personal life,Public celebration
0,"Alexandre Magno Abrão (April 9, 1970 – March 6, 2013), better known by his stage name Chorão, was a Brazilian singer-songwriter, rapper, lyricist, guitarist, skateboarder, record and film producer, screenwriter and entrepreneur.",3.9804036e-07,2.8453328e-06,2.3663115e-05,0.0017472389,0.9981565,6.941995e-05
1,"Best known for being a founding member and the vocalist/main lyricist of the influential alternative rock band Charlie Brown Jr., Folha de S. Paulo critic André Barcinski considered him ""the nearest thing to a punk hero Brazilian mainstream music ever had"", and Eduardo Tristão Girão of Portal Uai called him ""the bad boy of Brazilian rock"" and ""the spokesman of the youth of the 1990s"".",5.132379e-06,0.0011481692,1.3051744e-05,0.96745265,7.4660293e-06,0.031373497
2,"Having been born and raised for most of his childhood in São Paulo, Chorão was the only Charlie Brown Jr. member not to hail originally from Santos, and its only founding member to remain consistently in all of the group's line-ups.",7.907418e-07,0.0029799242,0.0015618668,0.99514955,0.0002589965,4.883136e-05
3,==,0.12487799,0.21344264,0.0013716135,0.0017026799,0.65860504,7.90238e-08
4,Biography ==,0.35590583,3.5694214e-10,3.2671657e-11,9.202332e-11,5.127074e-05,0.64404285
5,"Alexandre Magno Abrão was born in the district of Tremembé in the Northeast Zone of São Paulo on April 9, 1970.",1.6249382e-08,1.9698419e-07,1.0976814e-09,4.0308172e-05,0.9998324,0.00012700638
6,"He also had a brother, Ricardo; a sister, Tânia, who died of a stroke in 2015 aged 55; and was cousin of journalist and television presenter Sonia Abrão.",2.5415673e-05,1.9414549e-05,0.021556033,1.2585854e-06,0.007514698,0.97088313
7,"He experienced an unhappy childhood; his parents, Nilda and Geraldo Abrão, divorced when he was 11 years old, and he dropped out of school in the seventh grade as he couldn't afford the tuition fees and due to his unruly behavior.",0.050870072,0.0011744698,0.0026629465,2.766666e-07,0.040874682,0.9044176
8,"Prior to beginning his musical career he worked as a delivery boy for his mother, a cook, until she suffered the first in a series of debilitating strokes in 1984, and briefly as a realtor alongside his father, who would die of cancer in 2001.",0.9965199,0.0025081562,1.0265331e-06,1.109413e-07,0.00097063265,9.731833e-08
9,"Many times while trying to live on his own he was frequently evicted and had his possessions confiscated due to the non-payment of rent (an experience which would later inspire the Charlie Brown Jr. song ""Confisco"").",0.0005786559,0.2053285,0.741782,9.0062827e-07,4.2614765e-08,0.052309968
10,"Eventually taking skateboarding as a pastime, he received the nickname ""Chorão"" (roughly translated as ""cry-baby"") from his friends due to his emotionality.",2.4406478e-07,0.0012139683,0.0007786931,0.011721379,0.98420423,0.0020815018
11,"Around this time he would also develop his long-time cocaine addiction, which would plague him for the rest of his life.",0.9932488,0.0067407,5.252779e-07,1.8096297e-06,7.4683576e-06,8.336351e-07
12,"In 1987 his family moved to the coastal town of Santos, where he would form his first musical project, the hardcore punk/crossover thrash band",0.046092622,0.028132496,0.036469847,0.8882497,0.0010030431,5.232498e-05
13,What's Up; he was invited to be its vocalist after being spotted by a member of the audience at a bar while covering a Suicidal Tendencies song.,0.9791189,4.961114e-05,0.00020376328,0.020627748,1.6931904e-10,2.2718865e-08
14,"What's Up underwent its first line-up change in 1990, when they were joined by then-12-year-old bassist Champignon, and then in 1992 when Marcão, Thiago Castanho and Renato Pelado were approached.",0.99977607,0.00015768124,6.060161e-05,5.699451e-06,3.1829872e-09,2.2086323e-10
15,"However, Chorão thought the band was taking too long to make a breakthrough and decided to revamp it under a new name; he eventually settled on ""Charlie Brown Jr."", explaining that ""Charlie Brown"" came to him after recalling a time when he crashed with his car into a coconut stand with a drawing of the eponymous character of Charles M. Schulz's comic strip Peanuts on it, and the ""Jr."" alluding to the fact that he considered his band to be ""the children of rock"", following the lead of other famous groups at the time such as Raimundos, Nação Zumbi, Planet Hemp and O Rappa.",2.1859796e-05,0.5458129,2.562143e-05,0.4391029,0.015036696,9.26628e-08
16,"During its 21-year lifespan, Charlie Brown Jr. released ten studio albums and was nominated for seven Latin Grammy Awards, winning two; their success, though, was frequently overshadowed by controversies and clashes regarding Chorão and his bandmates, who often described him as a ""domineering"" person – constant creative divergences would culminate in the band's entire line-up departing following the release of their 2004 album Tamo Aí na Atividade.",0.96877676,0.00085123867,0.00040070975,1.067786e-05,5.676823e-10,0.029960629
17,"In 2007 he threatened to sue Marcão and Champignon after they performed in the United States under the ""Charlie Brown Jr."" name, as he was the one who held the rights of it.",0.9990006,9.427808e-07,2.812811e-05,0.00097016944,3.220958e-12,1.4855912e-07
18,"Both would return to the band in 2011, but Pelado and Chorão never made amends.",0.8956852,0.0006256892,0.091486946,0.012000547,0.00019700424,4.5401353e-06
19,"In 2012, during a performance at Apucarana, Paraná, Chorão and Champignon got into an altercation and the latter was expelled from the band on stage.",3.4024153e-05,0.27163607,0.30382243,0.42450735,4.15467e-08,2.1489463e-07
20,"The following day, though, they reconciled.",1.0332676e-06,0.9945826,0.0046735625,8.069366e-07,0.00074129156,7.623852e-07
21,"Known for his brash, boorish personality, Chorão also got into many feuds with other musicians and brawls; in 2003 he insulted CPM 22 vocalist Badauí due to a ""tongue-in-cheek"" statement he gave to a magazine.",0.00047479945,0.26286623,7.8857585e-07,1.265136e-05,1.5718396e-10,0.7366456
22,"(In a later interview given after Chorão's death, the band would state the feud had ended after they talked to him privately.)",1.7709891e-07,0.9900656,0.00016743522,3.1101056e-06,4.7505898e-07,0.009763176
23,"The same year, he slapped a 17-year-old teenager in the face at a supermarket, claiming he overheard him ""badmouthing"" Charlie Brown Jr..",0.018097442,0.3061414,0.012810998,0.5991135,0.01659881,0.047237765
24,In 2005 he got involved in a car crash which ended in four people getting wounded.,0.00067494734,0.018568926,2.092517e-06,0.56937367,0.41134486,3.5594112e-05
25,"In 2008 he was expelled from a Gol flight en route to Manaus, after refusing to switch off an electronic device and insulting those aboard the airplane.",5.6995363e-05,0.008768894,0.9788376,1.9457598e-06,0.0011538288,0.011180622
26,"His most well-publicized feud, though, was with Los Hermanos vocalist Marcelo Camelo; in 2002 Chorão was invited to be a spokesman for a series of ads by Coca-Cola, leading many to criticize him (Camelo included) as a ""sell-out"".",0.086155124,0.6793644,0.00030918044,1.451255e-06,5.9844116e-09,0.23416984
27,"On July 4, 2004, he and Camelo met at an airport in Fortaleza; after an altercation, Chorão punched him in the face and broke his nose.",9.050639e-05,0.9999027,1.0844083e-06,1.9200977e-06,3.142421e-06,7.281484e-07
28,"He would later apologize, but Los Hermanos still launched two lawsuits against him.",8.592971e-06,4.816868e-05,0.9999372,9.270218e-11,8.309144e-09,6.133172e-06
29,"As of 2015, two years after Chorão's death and eleven after the incident, both were still pending.",0.1878204,7.077513e-06,0.012745254,0.50599694,0.16105625,0.13237403
30,"Outside music, Chorão wrote and co-produced the 2007 film O Magnata, which was directed by long-time collaborator Johnny Araújo and starred Paulo Vilhena, Milhem Cortaz, Rosanne Mulholland, Maria Luísa Mendonça, Chico Díaz, Priscila Sol, Marcos Mion and Marcelo Nova.",1.924912e-13,6.874305e-05,2.6902688e-07,0.99993,9.1685325e-07,2.444866e-11
31,"Charlie Brown Jr.'s eighth album, Ritmo, Ritual e Responsa, was billed as the first part of its soundtrack; the band also cameos as itself on the film.",5.6041054e-06,9.907006e-05,1.5294123e-05,0.99987924,2.2019626e-09,8.129572e-07
32,"Despite being a moderate box office success, O Magnata received reviews ranging from mixed to negative.",4.3985063e-10,0.9997085,7.444232e-10,0.00020576162,3.0629559e-09,8.57325e-05
33,"By the time of his death Chorão was working on the script of a second film, entitled O Cobrador; it was originally announced for a 2016 release, with Cortaz and Vilhena returning for new roles, but since then no further announcements were given.",8.246325e-06,0.0025293275,0.006756746,0.9752033,0.0155023765,3.558441e-11
34,"In 2005 Chorão inaugurated his own indoor skatepark and musical venue in Santos, Chorão Skate Park; Charlie Brown Jr.'s DVD Skate Vibration was recorded at its opening party.",1.6358772e-05,0.007862447,0.00152606,0.8454318,0.00039069372,0.14477248
35,"However, by the time of his death, it began to decline due to financial difficulties and the non-payment of debts.",0.00010429949,0.9774252,0.018742483,2.9161725e-07,1.3634461e-05,0.0037139866
36,"Despite a series of protests and petitions organized by fans, acquaintances and relatives of Chorão, former Charlie Brown Jr. members and Detonautas Roque Clube vocalist Tico Santa Cruz, it eventually closed down to the public in late 2013 and was demolished in early 2014.",0.0033447852,2.175025e-05,0.00043903818,0.99262816,6.497458e-07,0.0035656858
37,"In 2009 he launched his own clothing brand for skateboarders, DO.",0.55925715,0.021414282,0.36029005,1.9733734e-05,0.04717021,0.011848521
38,"CE.He also illustrated the cover art of Charlie Brown Jr.'s 1999 single ""Zóio de Lula"".",0.8587783,4.016756e-07,0.009909376,0.01831991,9.917102e-08,0.11299195
39,===,0.0018069088,2.1080758e-05,2.7498896e-05,0.000441192,0.9977034,1.2509519e-11
40,"Death, tributes and legacy",1.6750474e-07,6.416473e-05,0.073250994,2.781499e-09,8.671984e-06,0.92667603
41,===,0.0018069104,2.1080758e-05,2.7498896e-05,0.00044119143,0.9977034,1.2509519e-11
42,By his final years Chorão's drug abuse issues began to take their toll on his life and health.,0.00014273338,0.9993556,0.00020351863,0.00021890763,3.9448507e-05,3.974904e-05
43,"His long-time companion Graziela Gonçalves divorced him in 2011, and his son Alexandre and previous wife Thaís Lima unsuccessfully tried to admit him to a rehabilitation clinic.",0.0011657943,0.20861594,1.4033045e-06,1.312713e-05,0.03746177,0.75274193
44,"Even though it was denied by Alexandre, Chorão began to sink into a major depression following his divorce.",9.99224e-05,0.025518915,0.0013628841,2.6084366e-05,0.0022899036,0.97070223
45,"On March 6, 2013, his driver found him dead at his apartment in the bairro of Pinheiros in São Paulo; the police, who initially dismissed the possibility of homicide, stated that the apartment was ""heavily damaged"" and in ""state of disarray"".",6.3075975e-11,0.99499786,2.6604368e-08,3.0806777e-09,0.0049996953,2.4968574e-06
46,"His cause of death was later ruled a cocaine overdose, but investigators could not determine if the overdose was intentional or accidental.",1.7177493e-09,0.99998856,7.4158204e-09,6.305109e-11,1.1502548e-05,5.337053e-10
47,"His wake was held at the Arena Santos and he was buried at the Cemitério Memorial Necrópole Ecumênica, where six months later his former bandmate Champignon would also be buried following his suicide.",1.6442722e-07,0.045931935,0.34253156,0.61126864,2.2470314e-05,0.00024519872
48,"By a somewhat strange coincidence, Chorão died on the 14th anniversary of one of Charlie Brown Jr.'s most well-regarded releases, Preço Curto...",0.0002116873,0.0001338665,7.8492485e-05,0.6885064,0.001616024,0.30945355
49,Prazo Longo.,0.00078461535,7.165421e-10,2.6980852e-06,0.0029250677,0.010209554,0.98607814
50,"Following his death, then-mayor of Santos Paulo Alexandre Barbosa announced a three-day period of mourning, and fans made tributes to him in skateparks all around the city.",6.043058e-11,2.450763e-09,3.5568122e-05,0.00016522653,0.00048011515,0.9993191
51,"American band Guns N' Roses would pay their respects to Chorão by posting on their official Facebook page a video of their song ""Don't Cry"", dedicating it to him, and sertanejo universitário singer Lucas Lucco wrote a song in his honor entitled ""Ninguém Podia Prever"".",1.6927894e-05,9.3855204e-05,0.11151328,0.865487,0.0002049689,0.022683911
52,"A life-long fan of Santos FC, he also received tributes by the team's former players Robinho, Walter Montillo and Elano.",0.004489459,0.015553408,0.2657196,0.71418947,5.768244e-06,4.2186715e-05
53,"Rap duo Bonde da Stronda, who befriended Chorão later in life, covered ""Lutar pelo que É Meu"" as an homage to him at a performance in Campo Grande, Mato Grosso do Sul on March 9, 2013.",2.4926703e-06,0.00023932054,6.4171873e-06,0.003242766,1.1783051e-07,0.9965089
54,"Television presenter Luciano Huck, Ira! vocalist Nasi, long-time friends and frequent Charlie Brown Jr. collaborators Negra Li and Rodolfo Abrantes, former actor Alexandre Frota, politician Marta Suplicy and footballer Neymar, among others, also made statements on his death and gave their condolences.",0.76216274,0.015562033,0.006712459,0.13175687,0.019329133,0.06447673
55,Then-Governor of São Paulo Geraldo Alckmin stated he would name a skatepark in the North Zone of the city of São Paulo after Chorão.,1.3444457e-09,0.00016202466,0.0026458013,0.5507704,0.3162895,0.13013224
56,"International newspapers and websites such as HuffPost, The Washington Post, The San Diego Union-Tribune, Billboard and Latin Times also commented on Chorão's death, the latter noticeably mistranslating his stage name as ""Big Crying"".",4.5757547e-12,0.1684312,0.006399255,0.008262633,0.81664723,0.00025968492
57,"On March 29, 2015, a biographical musical about Chorão entitled Dias de Luta, Dias de Glória premiered, written by Well Rianc and directed by Bruno and Luiz Sorrentino.",1.8058338e-06,3.73683e-09,2.804568e-07,0.99999726,9.215945e-11,5.7230744e-07
58,Rapper DZ6 starred as Chorão.,2.2702402e-07,0.0017817945,3.3880538e-06,0.9982145,1.2392547e-07,1.2189435e-08
59,"Despite good critical reception, Chorão's brother Ricardo lambasted it as being ""disrespectful"" and ""innacurate"".",2.9262355e-06,6.727107e-05,0.00017852576,3.275864e-07,6.531814e-08,0.9997509
60,"A street in the city of Franco da Rocha, São Paulo was named after him in 2017.",2.066317e-09,1.8377295e-05,1.3090706e-05,0.4580804,5.6142988e-05,0.54183203
61,===,0.0018069088,2.1080758e-05,2.7498896e-05,0.000441192,0.9977034,1.2509519e-11
62,Documentary =,0.00034680136,1.2728026e-06,2.3618695e-07,2.1691817e-06,4.7408184e-07,0.99964905
63,==,0.12487809,0.21344268,0.0013716145,0.0017026803,0.65860486,7.902394e-08
64,"Shortly after Chorão's death, film producers Felipe Elias, Victor Santini Stockler and Roberta Franco launched a crowdfunding campaign on website Catarse to finance a documentary about his story with Charlie Brown Jr. entitled Marginal Alado; it reached R$41,513.00, surpassing its original intended goal of R$35,000.00.",5.453288e-06,2.5872505e-05,5.5079645e-06,0.00010433105,7.054408e-06,0.9998517
65,"Directed by Felipe Novaes, the film premiered across festivals in Brazil in 2019, receiving a wide release on movie theaters and streaming services on April 8, 2021.",0.021482179,1.11591e-05,4.096082e-07,0.03712707,9.768685e-09,0.94137913
66,==,0.12487799,0.21344264,0.0013716135,0.0017026799,0.65860504,7.90238e-08
67,Personal life ==,0.002554406,0.00046550515,4.8373175e-07,1.0761065e-09,8.063284e-05,0.996899
68,"Chorão met his future wife, fashion designer Graziela Gonçalves, in 1994; they married in 2003.",2.8252398e-07,0.47686097,8.65167e-08,2.6875266e-06,0.063778035,0.45935795
69,"Affectionately nicknamed ""Grazon"" by him, Chorão claimed she was ""his muse"" and dedicated many of Charlie Brown Jr.'s songs to her, the most notable being ""Proibida pra Mim (Grazon)"" (off Transpiração Contínua Prolongada) and ""Céu Azul"" (off Música Popular Caiçara), written shortly after their separation in 2011.",3.4494818e-07,1.2975049e-08,1.5261489e-07,0.9937318,4.9400633e-06,0.0062626847
70,"From a previous, short-lived marriage with Thaís Lima, which allegedly ended after he found out she was cheating on him, he had a son also named Alexandre (born 1990).",5.6089893e-06,0.01277354,7.050343e-09,1.5323817e-06,0.9839649,0.0032543822
71,"In 2017 Alexandre published the book Eu Estava Lá Também, a compilation of photographs and memoirs from his father dating from 2005–2012; in 2020 he would reveal that, shortly after his death, he had ordered a diamond made of a lock of his father's hair.",0.00011640176,0.0006835859,6.584584e-08,1.0064517e-09,0.99572915,0.0034707987
72,"In 2018 Graziela published through Companhia das Letras her memoir, Se Não Eu, Quem Vai Fazer Você Feliz?, in which she details her love life with Chorão.",1.3497028e-06,0.063995935,0.00025998073,0.13090432,0.00232462,0.80251384
73,==,0.12487799,0.21344264,0.0013716135,0.0017026799,0.65860504,7.90238e-08
74,Discography ==,0.9999943,1.2030798e-08,8.3584145e-10,5.3618996e-06,2.8147706e-09,3.2553942e-07
75,"For a more comprehensive list, see Charlie Brown Jr.",0.002592177,0.0001156982,3.8319166e-07,0.9964322,0.0002289691,0.00063047564
76,discography1997 – Transpiração Contínua Prolongada,0.99894315,4.266233e-06,4.772676e-08,0.0007195882,3.1170068e-06,0.00032980484
77,1999 – Preço Curto...,0.515837,2.105536e-05,3.0135283e-07,0.4826488,0.00028833706,0.0012044837
78,Prazo Longo,0.00067019305,6.513996e-10,3.3277506e-06,0.003908974,0.01549821,0.9799193
79,2000 – Nadando com os Tubarões,5.431249e-05,0.5966523,5.727545e-05,0.008274376,0.30800727,0.08695441
80,2001 – Abalando a Sua Fábrica,0.0042537414,1.2702225e-05,2.3237662e-07,0.0014067108,0.9435943,0.05073232
81,2002 – Bocas Ordinárias,1.6634247e-05,0.0005776043,3.0514466e-05,0.99937516,1.464759e-09,1.430903e-07
82,2004 – Tamo Aí na Atividade,8.2955594e-05,1.2786007e-05,4.6358214e-06,0.31212708,0.023158683,0.66461384
83,2005 – Imunidade Musical,0.030697856,4.97963e-09,1.89245e-05,0.9692778,5.4203874e-06,5.1198745e-10
84,"2007 – Ritmo, Ritual e Responsa",2.0948358e-08,1.7528281e-06,1.0934917e-05,0.0027611055,0.0020456722,0.9951805
85,2009 – Camisa 10 Joga Bola Até na Chuva,0.03792656,0.029139789,4.3851358e-08,0.047134995,0.25498682,0.63081175
86,2013 – La Familia 013 (posthumous),0.04491072,1.2652592e-06,8.119776e-07,1.240752e-05,0.9122026,0.042872116
87,==,0.12487799,0.21344264,0.0013716135,0.0017026799,0.65860504,7.90238e-08
88,References ==,2.5077119e-05,0.018098911,8.965051e-05,0.06194974,4.4582813e-09,0.9198366
89,==,0.12487799,0.21344264,0.0013716135,0.0017026799,0.65860504,7.90238e-08
90,External links ==,0.00023526642,1.3075868e-06,6.913511e-10,2.5650485e-07,3.6421334e-08,0.9997632
91,Chorão at IMDb,0.023384511,0.00096957525,1.2085502e-07,0.9745428,0.0010966503,6.242408e-06
