,Sentence,Business meeting,Coincidence,Education,Music making,Personal life,Public celebration
0,"Emma Harriet Nicholson, Baroness Nicholson of Winterbourne (born 16 October 1941) is a British politician, who has been a life peer since 1997.",0.052987203,9.188812e-07,3.1971877e-06,9.336517e-08,0.20385596,0.7431526
1,"She was elected as the Conservative Member of Parliament for Torridge and West Devon in 1987, before switching to the Liberal Democrats in 1995.",0.99071866,0.00093706546,3.7857575e-07,1.8433229e-09,0.0066257394,0.0017182367
2,She was also the Liberal Democrat Member of the European Parliament for South East England from 1999 to 2009.,0.97095144,5.1017973e-06,0.009867162,1.5335469e-05,0.014724761,0.004436243
3,"In 2016, she announced she was re-joining the Conservative Party ""with tremendous pleasure"".",0.99999845,2.74824e-10,6.8690275e-07,7.7795397e-07,3.0002735e-08,9.0088665e-09
4,"In 2017, Baroness Nicholson was appointed as Prime Minister's Trade Envoy for Kazakhstan.",0.9999981,1.6868553e-06,1.151954e-09,1.2657992e-07,2.5216972e-08,1.2643527e-07
5,==,0.12487809,0.21344268,0.0013716145,0.0017026803,0.65860486,7.902394e-08
6,Early life ==,0.0019447282,0.14564982,0.022118477,4.726933e-06,0.8208643,0.009417961
7,"Born in Oxford and a descendant of the family which founded London gin distillers J&W Nicholson & Co, Lady Nicholson is the third of four daughters of Sir Godfrey Nicholson, Bt and his wife, Lady Katharine (the fifth daughter of the 27th Earl of Crawford).",0.008384661,0.00029401464,1.1653443e-06,2.151781e-08,0.9100257,0.08129444
8,"Her uncle was Lord Chancellor in the 1960s, and his daughter, her cousin Eliza Manningham-Buller, became Director General of MI5.",0.8809366,3.5316689e-06,0.00021296203,1.4672106e-06,0.03951715,0.07932823
9,She was diagnosed as deaf at the age of 16.,0.45921037,2.2193939e-05,0.5384923,0.0007586451,0.00020784688,0.0013086667
10,"She was educated at St Mary's School, Wantage and the Royal Academy of Music.",2.8125785e-07,2.9283742e-08,0.9999981,1.5271388e-06,4.993501e-11,1.9890005e-10
11,==,0.12487809,0.21344268,0.0013716145,0.0017026803,0.65860486,7.902394e-08
12,Career ==,1.0,4.7553666e-13,2.1761314e-17,4.5407573e-19,9.245199e-14,7.686009e-12
13,"Prior to her political career, she was a computer programmer and systems analyst from 1962 to 1974, and a director of the Save the Children Foundation from 1974 to 1985.",0.99972004,2.9769386e-05,4.025672e-06,3.645717e-05,0.00014426945,6.5357715e-05
14,"She contested the constituency of Blyth in 1979, but was defeated.",1.4592897e-06,0.0005248966,6.005424e-09,4.848256e-06,2.3398432e-05,0.9994454
15,"She was elected a Conservative Member of Parliament for Torridge and West Devon in 1987, having acting as vice-chairman of the Conservative Party between 1983 and 1987.",0.04569106,0.00014646036,7.29775e-05,2.2294746e-06,0.09493506,0.85915226
16,"She defected to the Liberal Democrats in 1995, telling Robin Oakley, the BBC's Political Editor: ""The Conservative Party has changed so much, while my principles have not changed at all.",0.99986756,3.5365432e-05,8.526113e-05,5.2391124e-07,8.809215e-06,2.4816793e-06
17,"I would argue that it is not so much a case of my leaving the party, but the party leaving me.",0.17011245,2.5664396e-05,0.00021010703,0.00013598987,0.008922041,0.8205937
18,"""Nicholson fought for the release of Katiza Cebekhulu, the ""missing witness"" in the case of the death of Stompie Seipei.",0.009702532,0.8312656,0.00037879433,0.13089448,0.0011506245,0.026607856
19,"The South African national had been part of the so-called Mandela United Football Club, the bodyguards of Winnie Mandela.",0.0019780858,1.3880795e-06,0.98590523,0.012106041,1.0272968e-08,9.3052395e-06
20,"Cebekhulu later claimed that Nicholson had demanded £50,000 from him to obtain copyright over a book she had Fred Bridgland write about him; Nicholson denied this, saying her motives were ""exclusively humanitarian and honourable"".",0.96192497,0.0001391677,0.008408682,8.434997e-06,3.1385068e-07,0.029518368
21,"She was succeeded by John Burnett, Baron Burnett in 1997, when Tony Blair won his landslide.",0.06693035,0.0017536294,6.253032e-06,4.0026793e-05,0.0007944925,0.9304752
22,"That year, Nicholson was made a life peer as Baroness Nicholson of Winterbourne, of Winterbourne, in the Royal County of Berkshire.",0.07421753,6.7728597e-06,5.2280676e-08,0.0002215957,2.868716e-05,0.9255253
23,==,0.12487809,0.21344268,0.0013716145,0.0017026803,0.65860486,7.902394e-08
24,European Parliament ==,0.02618228,0.00058856787,0.0012560742,0.0026895262,0.08234476,0.8869388
25,"Lady Nicholson became a member of the European Parliament in 1999, joining the Committee on Foreign Affairs and serving as the committee's Vice President from 2004 to 2007.",0.9998565,9.283211e-05,1.8897413e-07,4.98034e-05,3.288236e-07,2.331744e-07
26,She was President of the Delegation for Relations with Iraq and President of the Committee on Women's Rights of the Euro-Mediterranean Parliamentary Assembly.,0.008766106,0.5469461,0.0001014823,0.12471673,0.07388927,0.24558029
27,"Lady Nicholson was also a member of the subcommittee on Human Rights, the Delegation for relations with Iran and the Delegation for relations with the Mashreq countries (i.e. the eastern Arab world).",0.53498983,0.24480012,1.8470449e-06,0.22015993,4.2915763e-06,4.403317e-05
28,"She was Rapporteur for Kashmir, and in 2007 her controversial report on Kashmir was passed by a majority of 522 to 9.",0.0005499264,1.1091373e-05,2.173275e-06,0.0048505575,7.676804e-09,0.9945862
29,"During the Iraq War, Nicholson gave evidence to the United Nations that she claimed showed Iraq had ""hidden material used to make weapons of mass destruction"".",3.536735e-10,0.99969363,6.4718292e-06,0.0002983711,5.12902e-12,1.5505394e-06
30,"She described the draining of the Mesopotamian Marshes as a ""genocide"".",3.4182753e-07,0.009321503,0.010121901,0.974934,3.2187367e-05,0.005590105
31,She has monitored elections in many countries.,0.0038473064,0.00022555888,0.052771434,0.91838646,1.5658866e-06,0.02476772
32,"In 2006, Lady Nicholson was Chief Observer of the European Union Election Observation Mission to Yemen.",0.86720943,0.0017625982,0.0003996236,0.08020237,0.0016434393,0.04878243
33,"She was a member of European Union Election Observation Missions to Palestine (2005), Azerbaijan (2005), Lebanon (2005), Afghanistan (2005), Armenia (2007) and Pakistan (2008).",0.0015946752,4.2102756e-06,2.1944431e-06,0.99712855,2.0135228e-06,0.0012683197
34,In January and December 2005 she was a member of the United Nations Election Observation Missions to Iraq.,1.3017537e-07,9.256324e-05,0.003445409,0.99615866,3.444723e-07,0.00030294625
35,"She also generated controversy through her strong opposition to international adoptions, which she believed had become a market and subject to corruption.",1.187588e-05,0.03147844,0.00020259713,1.716054e-05,5.8603382e-05,0.9682313
36,While the EP's Special Rapporteur for Romania's EU accession she and some others in the international community criticised international adoptions.,8.96266e-06,0.011630809,0.14499654,0.50292253,0.32915747,0.011283643
37,"Due partially to her pressure, the Romanian government in 2005 implemented legislation that de facto banned the practice, in line with practices in some of the EU member states.",0.0003699109,0.26119837,0.05014902,0.3191398,0.092601314,0.27654153
38,"The measure generated controversy, mainly in the US, Israel, France, Spain and Italy, particularly from prospective parents.",1.5846159e-07,0.032096513,0.0011127634,1.40215e-07,0.95979893,0.006991601
39,"International and Romanian media also called attention to poor conditions in Romanian orphanages and hospitals where abandoned children remained for prolonged periods, while acknowledging some progress made in reforming child protection.",2.0530759e-07,0.01905796,0.0015934748,0.03732914,0.9367708,0.0052484944
40,"In December 2005 and July 2006, the EP passed measures requesting Romania deal with outstanding pipeline cases, despite Romania having dismissed these formally through legislation after consultation with an Independent Panel of EU Experts on Family Law.",5.072558e-05,0.039098676,0.42629728,0.001635286,0.5302558,0.0026622496
41,Critics claimed that this panel was stacked with opponents of international adoptions.,0.0014883741,0.99461573,0.0018187538,0.00066048605,0.0014016372,1.5011238e-05
42,The U.S. Congress also passed repeated measures and held hearings opposing the ban.,0.00037288343,0.9989635,0.0005431536,0.00010880959,1.4517306e-06,1.0278483e-05
43,Lady Nicholson stood down from the European Parliament at the 2009 elections.,0.99998033,1.4457174e-08,5.3570297e-06,6.0923626e-09,1.3182297e-05,1.0240232e-06
44,==,0.12487799,0.21344264,0.0013716135,0.0017026799,0.65860504,7.90238e-08
45,House of Lords ==,0.5564149,1.6425872e-06,0.44344693,0.00010139664,4.7728336e-06,3.0342158e-05
46,"In 2009, Lady Nicholson returned to London and resumed her political work at the House of Lords.",0.9997004,0.00022832662,6.66945e-05,3.833803e-06,6.5994595e-07,7.553995e-09
47,"In February 2010, she founded the All-Party Parliamentary Group (APPG) for Business Development in Iraq and the Regions and has served as its Chair.",0.5111045,0.015122216,0.0009240403,0.29525033,0.00020185801,0.1773971
48,"She is also a member of the All-Party Parliamentary Group for Human Trafficking, chairs the All-Party Parliamentary Group for Foreign Affairs and speaks regularly on health care and education in the Middle East and Eastern Europe and business development in Iraq and its wider neighbourhood.",0.04195455,0.0008661553,0.15863809,0.0014270263,0.00010598168,0.79700816
49,"In 2013 she argued that the Iraq War was ""resoundingly"" worth it, and claiming Liberal Democrat party members who took an opposing stance were ""guilty of hypocrisy"".",1.2520476e-05,0.00014892878,0.15990397,0.09254497,4.1674582e-07,0.7473892
50,She was appointed as Prime Minister's Trade Envoy for Iraq on 30 January 2014.,0.9766614,0.00083627977,3.9752692e-07,7.906725e-05,0.000133804,0.022289101
51,"She resigned the Liberal Democrat whip in July 2016, to sit as a non-affiliated member.",0.999923,9.160428e-07,7.558763e-05,4.920405e-07,1.457336e-09,7.185488e-09
52,"However, on 10 September 2016, she announced she was re-joining the Conservative Party ""with tremendous pleasure"" and would sit on the Conservative benches in the House of Lords.",0.9999993,1.0081036e-08,5.622088e-07,1.1762261e-07,3.060385e-08,2.0976653e-11
53,"Listing her reasons for rejoining the Tories, she highlighted Theresa May's education speech on 9 September as evidence that the prime minister ""leads a party with a real commitment to delivering for the next generation and building a country that works for everyone"".",0.98389024,5.7271677e-06,0.015828185,7.45255e-08,0.00013727453,0.00013853906
54,"She left the Liberal Democrats to rejoin the Conservatives in 2016, quoting the position of Theresa May on grammar schools as the reason for the defection.",0.7712161,0.0012581421,0.22731704,1.5036749e-06,0.00020571842,1.4813709e-06
55,"However, the Liberal Democrats claimed that she had said her reason for leaving the party was her position on Europe.",0.9990534,0.00011238659,0.00077612966,3.9343564e-07,5.7023666e-05,5.533457e-07
56,Baroness Nicholson visited Kazakhstan as Prime Minister's Trade Envoy on 28 April 2019.,0.99952817,0.0004547861,5.0996194e-09,1.6783837e-05,6.078239e-08,1.6849978e-07
57,The six-day visit was focused on expanding trade relations with the Central Asian country.,0.99919826,0.00036628565,3.9711065e-07,0.000296808,0.00013813467,7.885217e-08
58,==,0.12487809,0.21344268,0.0013716145,0.0017026803,0.65860486,7.902394e-08
59,Other work ==,5.917793e-08,0.35352334,5.5943527e-08,0.64647055,5.9761574e-06,2.799437e-09
60,"Lady Nicholson is the Executive Chairman of the AMAR Foundation, which works to rebuild and improve the lives of disadvantaged communities in war-torn areas.",0.00061611383,0.004428699,5.1838833e-06,1.6819893e-05,4.1189505e-05,0.994892
61,"She is Executive Chairman of the Iraq Britain Business Council an organisation which facilitates business, trade investment, human resources, training and transfer of technology and know-how into the Republic of Iraq.",0.0009014636,0.93930197,0.028529268,0.00017275037,0.0006044351,0.030490102
62,Lady Nicholson is Executive Chairman of the Associatia Children's High Level Group.,0.26535898,0.01319887,5.2838385e-07,0.0003251714,0.72107077,4.5633933e-05
63,"She co-founded its English counterpart, the Children's High Level Group (now the charity Lumos, ""working to end the harm of institutionalisation & help children worldwide be reunited with family"") with novelist and philanthropist J. K. Rowling.",0.049514078,1.0622763e-05,0.14068913,0.80696636,5.7448135e-05,0.0027624075
64,Lady Nicholson is the co-chairman with the Prime Minister of Romania of the High Level Group for Romania's Children and the co-chairman with the Prime Minister of Moldova of the High Level Group for Moldovan Children.,1.4791439e-05,4.1897502e-07,6.422016e-12,2.7469864e-06,0.99998176,2.519078e-07
65,"Lady Nicholson is also a member of the American Bar Association's Middle East North Africa Council, the Arab Gulf Programme for United Nations Development Organisations Prize Committee and Freedom House International Solidarity Committee.",0.24211653,0.26177058,5.628365e-08,6.015453e-05,4.1865866e-07,0.49605232
66,"She is a board member of the Foundation for Dialogue Among Civilisations, the American Islamic Congress, and a member of the Board of Advisors for the New York University Center for Dialogues, Islamic World.",0.00015296583,0.3006043,0.6975598,0.0010117411,2.4106694e-07,0.0006710231
67,"She is Vice President of The Little Foundation, and is Honorary Advisor to the Prime Minister and Government of Iraq on Public Health and related issues.",0.030917931,1.4834251e-05,0.0002202013,0.73199075,0.19069359,0.046162684
68,"Nicholson was a Trustee of the Booker Prize until 2009, after which she was made an honorary Vice President.",0.9928104,1.7103395e-07,0.00037036854,0.0014661296,2.703475e-10,0.005352961
69,"In June 2020, Nicholson referred to model Munroe Bergdorf on Twitter as 'a weird creature' and shared posts Bergdorf considered transphobic, resulting in an official complaint to the Parliamentary Standards Commissioner.",3.015291e-08,0.99984336,1.4214688e-10,1.3806384e-11,2.1655243e-08,0.00015666551
70,"This led to criticism of Booker from writers including Damian Barr, Marlon James and Sarah Perry.",0.10532199,0.32410118,3.0048943e-05,0.5695282,2.2750132e-07,0.0010183707
71,Booker subsequently announced that they would be dissolving all honorary titles and roles associated with the event.,0.99559927,5.7393995e-06,0.0002461271,3.4907808e-07,6.5325395e-08,0.0041484074
72,==,0.12487799,0.21344264,0.0013716135,0.0017026799,0.65860504,7.90238e-08
73,Personal life ==,0.002554406,0.00046550515,4.8373175e-07,1.0761065e-09,8.063284e-05,0.996899
74,"On 9 May 1987, Nicholson married Sir Michael Harris Caine, with whom she had a foster son Amar Kanim, who was rescued from Iraq after surviving a napalm attack in March 1991.",9.257176e-10,1.4780763e-06,3.4807378e-13,1.0823957e-12,0.9999708,2.7735947e-05
75,She set up the Amar Foundation to support projects in Iraq.,0.15531208,0.00046403141,0.0012724098,0.36509693,8.123591e-06,0.47784635
76,She was widowed in 1999.,3.338413e-07,3.8333908e-07,0.0006710453,6.377735e-06,0.31120458,0.68811727
77,"She is President of the Council of the Caine Prize for African Writing, which was named after her late husband.",0.00070969353,2.5890392e-06,0.19590281,0.0047617927,0.00038755994,0.79823554
78,==,0.12487799,0.21344264,0.0013716135,0.0017026799,0.65860504,7.90238e-08
79,Awards and honours ==,1.0720082e-06,4.9515947e-12,1.3013774e-06,1.3471567e-11,4.9381018e-14,0.9999976
80,"In 2017, Lady Nicholson received an honorary doctorate in International Leadership and Humanitarian Service from Brigham Young University in the United States for her charity and humanitarian work across the Middle East.",4.4090466e-08,7.839224e-08,0.7949515,8.1178335e-08,4.557863e-08,0.20504834
81,==,0.12487799,0.21344264,0.0013716135,0.0017026799,0.65860504,7.90238e-08
82,References ==,2.5077119e-05,0.018098911,8.965051e-05,0.06194974,4.4582813e-09,0.9198366
83,==,0.12487799,0.21344264,0.0013716135,0.0017026799,0.65860504,7.90238e-08
84,External links ==,0.00023526642,1.3075868e-06,6.913511e-10,2.5650485e-07,3.6421334e-08,0.9997632
85,Media related to Emma Nicholson at Wikimedia Commons,5.448495e-08,8.040065e-05,2.9324558e-06,7.204397e-12,3.995864e-08,0.99991655
86,Hansard 1803–2005: contributions in Parliament by Emma Nicholson,0.0010194951,0.0010617807,0.0022259858,0.007870963,0.049454164,0.93836766
87,Official website,0.0012255516,4.507715e-12,3.0528519e-10,4.2257152e-08,5.405287e-12,0.99877435
88,Profile at the European Parliament,0.09521672,0.0014098927,3.944548e-08,2.7502686e-08,1.0315938e-06,0.90337235
89,Liberal Democrats,0.945258,0.05368838,0.00042020253,1.38035885e-08,0.0005859182,4.747569e-05
90,AMAR International Charitable Foundation,2.576355e-06,6.8146403e-07,7.23818e-08,0.54105467,0.00024712627,0.4586949
91,Iraq Britain Business Council,6.754104e-06,0.9698583,0.022082083,0.0062135663,1.2222092e-07,0.0018391936
