,Sentence,Business meeting,Coincidence,Education,Music making,Personal life,Public celebration
0,"Gift Iyumame Eke (née Uwame; born 18 November 1978), professionally known as Muma Gee (), meaning ""do good Gift"", is a Nigerian singer-songwriter, actress, businesswoman, fashion designer, television personality and politician.",1.2078959e-09,5.4982876e-12,6.214144e-11,2.329747e-12,0.99999785,2.170191e-06
1,"She was born, raised, and resides in Port Harcourt.",1.720171e-07,2.5714722e-05,9.175867e-05,0.0010773039,0.99264777,0.0061573093
2,"Uwame's first taste of stardom came through her song ""Kade"", which became the title track of her first official album, released in 2006.",0.99627435,9.77856e-06,0.0007146316,0.00300115,7.135334e-08,1.7892738e-08
3,"The single's accompanying music video directed by Wudi Awa, received five nominations, including two from the AMEN Awards (Best Picture and Best Costume) and one each from the Nigerian Music Video Awards, the Headies Awards, and the Sound City Music Video Awards.",6.033501e-08,0.0006932319,9.079029e-08,8.785932e-11,1.0964126e-11,0.99930656
4,Uwame rose to prominence in 2010 as a contestant on the celebrity edition of Nigerian reality TV series Gulder Ultimate Search.,0.13005024,0.86660075,3.3432997e-07,1.3499763e-06,0.00025345534,0.003093904
5,"Prior to entering the show, she had worked on her second studio album The Woman in Question, that would be released a day after her eviction.",1.5828731e-05,2.3821003e-05,0.9999603,8.340386e-11,7.565148e-12,1.9215895e-08
6,"""Amebo"" and ""African Juice"" were the two singles released from the album.",0.0005562094,0.99016297,4.724176e-06,0.0057345834,0.0035400589,1.4924557e-06
7,"Uwame had also collaborated with artists and producers such as Samini, VIP, OJB, Cobhams Asuquo and Terry G, among others.",5.292787e-06,4.437222e-08,0.00023588019,0.99972016,3.73175e-05,1.2899972e-06
8,"In 2009, she was nominated for four awards at the 3rd Nigerian Music Video Awards.",2.0219358e-10,1.9998166e-05,1.8878339e-08,1.1822279e-09,1.865209e-09,0.99998
9,"In early 2012, Uwame started work on a new album called Motherland and has since released singles ""Port Harcourt Is Back"", ""African Woman Skilashy"" and ""Jikele"".",0.13506553,3.649122e-07,0.03344384,0.74238694,0.08910338,4.258116e-08
10,"As an actress, she starred in the Nollywood films Last Dance (2006), Solid Affection (2008), Secret Code (2011), and The Code (2011).",0.14192125,5.7468856e-07,0.0015497981,0.12556282,2.1486875e-07,0.7309653
11,"Among her accomplishments are numerous titles and honours such as, Oonyon 1 of Upata Kingdom, Queen of African music, Pop Queen, and Mrs. Ngor-Okpala.",0.87656486,0.00015864152,0.00012881483,0.00033768595,0.00018401914,0.122625984
12,"Uwame's social life and alleged relationships have gained widespread coverage in the media, with the most prominent being her emotional affair with former GUS campmate Emeka Ike.",0.57105076,0.0013204138,0.000105355524,5.3726035e-05,0.23609318,0.19137657
13,"In 2011, Uwame married actor Prince Eke, and gave birth to a twin boy and girl, on 18 April 2014.",2.0377877e-08,1.9007219e-05,4.839141e-07,7.5607964e-11,0.9886103,0.011370032
14,==,0.12487812,0.21344274,0.0013716157,0.001702681,0.65860474,7.902393e-08
15,Early life ==,0.0019447311,0.1456498,0.022118498,4.7269286e-06,0.8208643,0.009417961
16,"Born in Port Harcourt, Rivers State to Ekpeye parents, Uwame grew up in a strict Christian household, the third of six children.",1.4100635e-08,1.2907665e-09,3.455872e-07,2.19587e-08,0.9999995,1.6153429e-07
17,"Her father, who was involved in Military Medicine, died when she was a child.",5.7963356e-10,2.3093993e-10,3.591006e-07,1.2659727e-06,0.99999833,1.0176839e-10
18,"After her father's demise, Uwame was raised by her mother.",2.0656007e-07,2.6765986e-07,0.020738464,0.0002623704,0.97899675,1.9360007e-06
19,"At age four, she joined the local choir at her church, The Seventh-day Adventist.",0.0002548475,0.966383,0.029286576,0.0038975438,6.205552e-05,0.000116050905
20,It was there that she began to realise her musical talent and potential.,0.85139304,0.13598892,4.1838307e-06,0.012613891,1.5613781e-13,2.045658e-10
21,"Upon finishing her primary and secondary school education in Abuja, Uwame enrolled at the University of Port Harcourt and earned a degree in Theatre Arts.",3.183948e-06,5.0706194e-07,0.9748565,0.025131295,7.1745276e-06,1.2542556e-06
22,"In addition to her academic background, she owned and operated numerous other businesses including vehicle leasing company, restaurant, tailor shop and beauty salon.",0.13821335,0.0002255783,0.8113821,7.786868e-07,4.1778894e-06,0.050174024
23,"She also became part of Port Harcourt's burgeoning music scene, performing at nightclubs and inner city bars.",6.9521134e-06,0.010681915,1.5810394e-05,0.97884655,2.2591041e-07,0.010448574
24,==,0.12487795,0.2134465,0.0013716551,0.0017026935,0.65860116,7.9024545e-08
25,Career ==,1.0,4.755348e-13,2.1761231e-17,4.5407227e-19,9.245165e-14,7.685994e-12
26,=== 2006:,0.013516924,0.31797504,6.666836e-09,0.6651938,0.0032853712,2.8892862e-05
27,Kade =,4.9044116e-05,0.0195844,0.95641804,0.001938158,0.022009496,8.8547796e-07
28,=,0.0052374126,0.9944846,1.1614782e-05,0.00024722368,1.9252171e-05,9.708581e-09
29,=,0.0052374126,0.9944846,1.1614782e-05,0.00024722368,1.9252171e-05,9.708581e-09
30,"Moving to Lagos, Muma Gee settled in Surulere, a residential and commercial area of that city.",5.298784e-07,0.998588,1.03724716e-07,1.6461346e-09,0.0014113983,2.6394114e-09
31,"Shortly after, she met record producer Nelson Brown.",1.8764732e-08,0.99999213,6.6685985e-10,7.0102406e-06,1.0215805e-07,7.5485735e-07
32,Brown was instrumental in putting together most of the songs on Muma Gee's debut full-length.,6.0378432e-05,2.022184e-06,6.040829e-08,0.99993086,6.6959697e-06,5.665278e-10
33,"In 2006, the album, entitled Kade was released as a CD to music stores.",1.0080879e-08,0.00056287536,0.99923456,0.00020251513,2.8129822e-08,6.7487925e-08
34,"Muma Gee had explained the meaning of its title in an interview, ""it is a courageous word that gives hope.",0.4165475,0.5731659,0.008238674,3.7848104e-06,0.0012062731,0.00083790504
35,I believe so much in empowerment.,2.628423e-08,0.024460185,0.9753488,5.3599424e-06,0.00016172118,2.391939e-05
36,So Kade represents advocacy and empowerment towards nation building [...],0.0004889067,9.187614e-06,0.29474247,0.70472676,8.3649365e-10,3.2648426e-05
37,"For example, in my language, we say Kade, meaning go, but its typical meaning is keep moving on and you will get there someday.""",0.00019536541,0.94972634,0.026036242,0.023056027,0.000757438,0.00022861603
38,"Following the release of the aforementioned album, Wudi Awa was contacted by Muma Gee in regards to producing a music video for its title track single.",0.41237748,0.5655415,0.021945344,3.081327e-05,0.00010483892,4.9161426e-09
39,"Soon after the video was shot, edited and sent to TV stations, it quickly gained popularity, capturing the attention of music lovers in Nigeria.",5.8713306e-07,0.03304291,0.00010872815,1.1974094e-09,1.0611778e-05,0.96683717
40,"Kade would later be nominated for AMEN Awards, Nigerian Music Video Awards, The Headies Awards, and Sound City Music Video Awards.",1.4725579e-10,0.082802184,4.3779404e-05,7.571659e-10,5.930977e-11,0.917154
41,===,0.0018069104,2.1080758e-05,2.7498896e-05,0.00044119157,0.9977034,1.2509519e-11
42,"2007–2010: Star Trek, The Woman in Question and Gulder Ultimate Search =",0.009732237,0.98992527,3.211019e-07,6.1338774e-09,7.4609896e-05,0.00026747794
43,==,0.12487811,0.21344267,0.0013716144,0.0017026801,0.6586048,7.9023934e-08
44,"In June 2007, Muma Gee performed at the annual Nigerian Breweries-sponsored Star Trek music tour.",0.01144902,0.89800656,2.5089956e-05,0.08840156,0.002117338,5.4941637e-07
45,She was the only female solo artist called upon to sing at the last leg of the national tour.,0.001999291,1.9845158e-05,6.0488525e-10,0.99793303,1.1558858e-08,4.7782538e-05
46,"The concert was held at the Hotel Presidential venue in Enugu and featured a star-studded line-up of Nigerian musicians, including P-Square, Daddy Showkey, Davina, and Shine Band, among others.",0.05759008,0.1441191,5.0026733e-07,0.69662154,0.10140392,0.0002649432
47,"Muma Gee appeared on stage wearing a beaded blouse and a black, rippling skirt.",0.013943454,0.7154383,9.651115e-06,0.27059662,2.4686442e-06,9.50146e-06
48,She involved a group of male fans into a dance competition for a chance to win her love.,1.942957e-07,6.9371094e-06,7.3601063e-09,1.0833698e-12,1.2048135e-09,0.99999285
49,"The climax of her show came when she hugged, cuddled and attempted to have a liplock with the winner in public.",1.32355835e-05,0.012441984,1.6698801e-06,3.9703625e-07,1.2734144e-09,0.9875426
50,"The young male fan also was treated to a love song she belted out before closing her set with a performance of her hit track ""Kade"".",0.00077982165,0.018763028,4.9879196e-05,0.9781496,0.0022568556,7.8876974e-07
51,"By the end of 2007, she began hinting that she was working on new material for her next album.",0.94159025,0.044746928,0.001644216,0.0120185455,1.3631339e-07,1.6132627e-09
52,"The following year, on 18 May 2008, it was announced that ""Amebo"" would be the first single to be released from the album.",0.94199187,0.055501565,0.0002787311,0.00039057896,0.0016841631,0.00015320323
53,"According to Muma Gee, this song was what she had long desired to create: ""I have been doing my own thing.",0.84577596,0.011217577,6.3877036e-05,0.1352602,0.007421104,0.0002611937
54,I've been experimenting even while at the University of Port Harcourt.,1.0275806e-09,0.74014336,0.015299084,0.2445496,7.95361e-06,6.711706e-09
55,"Now, I want to see what I can achieve professionally.""",0.94495994,0.012440848,0.03779643,0.0048027365,4.74978e-09,2.2386102e-09
56,"Explaining what ""Amebo"" was specifically about, she says, ""I am a homegirl, I am an indigenous musician.",0.093170956,0.8608376,0.043410413,0.0016296722,0.0006398079,0.0003114528
57,I believe so much in Nigeria.,1.5009401e-07,0.12947729,0.73273605,0.002705898,0.13503823,4.2399093e-05
58,"So, ""Amebo"" simply talks about our people, our values, and our heritage.""",0.009189125,0.08444996,0.40131226,0.33319977,0.043638334,0.12821056
59,"On 25 May, Muma Gee premiered the song at an exclusive night party in Ikoyi.",0.00044301123,2.2655724e-05,7.831001e-09,0.009965374,1.6835824e-05,0.9895521
60,"Other roles she played at the event included meeting fans, and signing autographs.",3.2874537e-05,0.20437688,1.2031865e-08,1.9747546e-05,1.41527945e-08,0.7955705
61,"""Amebo"" was sent to radio afterwards; Muma Gee also spoke briefly about the new album's content and direction, saying, ""I figured out that there are lots of love songs in the album.",0.0017867417,0.9899155,0.0076217116,0.00020280735,0.00010181138,0.00037131563
62,Maybe I am learning the rules to falling in love.,4.9102004e-13,0.9577361,0.0002955148,4.625444e-10,0.04196839,1.335325e-07
63,"(Laughs) and it's finding interest in my songwriting, maybe, maybe not, well I am not sure.""",6.78814e-05,0.9997763,4.135634e-08,0.000155682,1.2479688e-07,1.5768938e-08
64,"In 2009, Muma Gee released the album's second single ""African Juice"" and its accompanying music video, the latter of which earned her several nominations at that year's Nigerian Music Video Awards.",0.00025126312,0.97743714,8.021681e-05,6.9964176e-06,0.021432992,0.0007914979
65,"On 26 February 2010, Vanguard announced that Muma Gee's second studio album was titled The Woman in Question and that it would be released in March.",0.001351053,0.99648064,0.0001578922,5.895557e-05,0.0019515434,3.5680028e-08
66,"Along with these details, it was announced Muma Gee had songs with Samini, VIP, and Terry G on the album and that producers on the album would include Cobhams Asuquo, Puffy T, Terry G and OJB.",0.014678341,0.0055404673,0.00035683136,0.9720681,0.0073562968,2.234497e-08
67,"Beginning March 2010, Muma Gee appeared in the reality television show Gulder Ultimate Search.",8.663164e-05,0.9998876,3.857835e-10,2.5891312e-08,2.5732628e-05,3.6896208e-10
68,She had been selected with nine other celebrity participants.,0.00028605582,0.0013023015,9.881701e-08,3.6052102e-06,4.8658524e-08,0.9984079
69,"After being sent to the jungle, she naturally connected with fellow campmate Emeka Ike.",2.8157936e-08,0.9999776,2.2056516e-05,7.0660584e-09,3.4350694e-07,3.375369e-13
70,"However, their extra-closeness soon prompted viewers to believe their friendship was beyond platonic.",3.9947268e-10,0.9993718,0.00031622028,1.8638933e-09,0.00013143974,0.00018058595
71,"Various news outlets and gossip sites depicted Ike as a handsome married actor, with whom Muma Gee was romantically lovestruck.",1.6122933e-05,0.022113537,3.1121793e-08,0.000416957,0.97743416,1.9072666e-05
72,It was further alleged that the pair engaged in lewd conduct during a bathroom scene on the show.,3.927088e-05,0.99990165,1.3842637e-06,5.58419e-05,8.0884064e-08,1.7765551e-06
73,Muma Gee admitted to an emotional relationship with her campmate but denied the sex allegations.,5.510569e-06,0.00045260845,2.2667173e-06,0.000116849435,0.99942243,3.4858402e-07
74,"In another incident, contestant Chioma Chukwuka defied Muma Gee and threw her property out of their tent.",0.013570156,0.012066694,0.9600697,3.586509e-05,0.014252589,5.0589574e-06
75,She had verbally attacked Muma Gee on several occasions at the camp and made disparaging remarks about her marital status.,6.604665e-08,0.99121463,0.00097861,7.0052214e-05,0.006652137,0.0010844045
76,"Throughout their time in the Jungle, both contestants rivalled each other.",3.7504908e-08,0.9999188,2.4728795e-05,8.797933e-09,5.646244e-05,4.846866e-10
77,They were evicted on the same day for not being able to complete their respective tasks.,0.0016747015,0.33070335,0.6574912,2.2338169e-08,0.00023472615,0.009896059
78,Uwame's The Woman in Question was released the next day.,0.54562813,0.00080107345,0.00017330419,0.0018704005,1.5890968e-05,0.45151126
79,"On 8 May 2010, in an interview with Nigeriafilms.com, Chukwuka claimed her actions against Muma Gee were deliberate and a mere display of her blatant side.",0.95485693,0.041894574,8.553312e-06,1.03182664e-07,0.003239834,3.8353118e-10
80,"During June 2010, Muma Gee was invited for Thanksgiving at the Redeemed Christian Church, by Gus winner Emeka Ike and his wife Emma.",3.4974327e-08,9.5347417e-07,3.1816256e-08,7.8925375e-08,0.9999809,1.802837e-05
81,"There, she met and befriended up-and-coming Nollywood actor Prince Eke—Ike's best friend—whom she felt was God-sent and who would propose to her seconds later.",5.097307e-07,0.99980015,6.912334e-05,1.03095754e-10,1.38371234e-08,0.00013029246
82,"On 23 June, Uwame received an engagement ring from Eke shortly after he had arrived safely from work.",1.7687615e-06,6.2731044e-05,1.4921713e-05,6.382923e-09,0.005712852,0.99420774
83,She would then wed him the following year.,3.2951542e-05,3.890225e-08,5.915427e-07,6.5329637e-06,0.9979196,0.0020403368
84,=== 2011–present: Marriage and Motherland ===,4.5271937e-09,6.6667463e-09,5.902345e-09,9.266437e-10,0.9868557,0.013144247
85,"On 23 July 2011, reports surfaced announcing the date for Muma Gee and Eke's White wedding as 18 November, and venue at Recovery House, Port Harcourt International Church.",2.4526319e-08,1.4026681e-06,1.5682277e-11,8.038419e-12,0.99999475,3.861926e-06
86,"In August 2011, Muma Gee was reported to have moved temporarily from Lagos back to Port Harcourt to participate in politics.",1.8988865e-07,0.00041579342,6.674272e-07,5.105723e-06,0.9995783,6.3906893e-09
87,Although no further details were released about the development at the time.,1.1026559e-07,0.00015959017,4.0766626e-09,0.9829601,0.000116137206,0.01676407
88,She would later reveal in interviews that there were no political intentions behind her relocation to the city.,0.00023823889,0.9657214,2.3964758e-06,1.4152307e-06,9.088327e-06,0.03402746
89,"On 6 September 2011, Muma Gee revealed that the wedding was undergoing its final adjustments.",6.803994e-05,0.0018313662,7.125802e-08,3.128843e-08,0.6838792,0.3142213
90,"However, on 4 November 2011, the couple decided to push back the wedding date to work on Muma Gee's music video, ""Port Harcourt Is Back"".",0.010728416,6.2533434e-07,2.008712e-06,9.225849e-11,0.98925054,1.8445578e-05
91,"On 20 December 2011, Muma Gee and Prince Eke were married in a double traditional wedding ceremony in Ahoada East and Ngor Okpala respectively.",8.2738165e-12,3.4754917e-06,2.965048e-11,2.181448e-12,0.9999962,3.6364233e-07
92,A formal white wedding later took place on 23 December 2011 in Port Harcourt.,4.358437e-09,3.4972954e-06,4.5615717e-08,2.266092e-06,0.0044059046,0.9955883
93,"After her marriage to Eke, Muma Gee continued to work on her music career.",0.28370067,0.00062762416,8.696902e-06,0.0002815088,0.71537656,4.970757e-06
94,"In February 2012, she released ""Port Harcourt Is Back"" and its music video, which was directed by her husband Prince Eke.",0.03619049,9.3363014e-05,0.8504807,0.0001444093,0.0002118204,0.11287935
95,"Speaking about the concept of the song, she explained ""It's a single and more of appreciation for the transformation in my birthplace.""",6.700245e-05,7.810359e-07,0.0018163703,8.179982e-09,2.4218762e-08,0.9981158
96,"Furthermore, Muma Gee stated that her new album called Motherland was in the making, and that ""it was inspired by what I experienced when I went to Port Harcourt after many years in Lagos.",0.0013146582,0.0013100494,0.0011612208,0.07404559,0.9221685,5.8427737e-12
97,"It is warm and welcoming.""",0.00046669645,0.00086670084,0.9854515,1.8114208e-05,0.013178388,1.8651628e-05
98,"On 8 April that same year, the album's second single ""African Woman Skillashy"" followed.",0.9998857,4.859956e-05,6.660066e-08,1.531467e-07,6.230013e-05,3.1432066e-06
99,"The music video, directed by Bobby Hai Ndackson was released soon after.",0.0033727437,0.9439368,1.0178337e-06,8.1061844e-05,5.7635e-10,0.05260839
100,"Muma Gee told Vanguard that ""[the song] is all about the African woman, her beauty and how she makes herself beautiful.",0.051491752,0.16614,0.02896976,0.023637563,0.068976216,0.66078466
101,An African woman is therefore not to be messed up with or looked down upon because she's feminine.,3.151652e-05,0.06239415,0.03643746,0.005193238,0.8959012,4.239616e-05
102,"Even though she's beautiful, she's strong and has a sense of pride.",3.3398937e-06,0.0074312002,0.98317426,0.0019483947,2.0653977e-05,0.0074221664
103,"""In March 2013, she released ""Jikele"" as the album's third single.",0.9796882,0.0031399315,0.014368479,0.0025870255,1.3994112e-05,0.00020228974
104,Motherland was revealed to be a 12-track album and when asked why is it taking so long?,0.19368072,6.155643e-05,0.029233616,0.25814763,0.5188765,1.0877739e-08
105,"she commented ""One needs to take one's time because good work takes time.",3.0214062e-07,1.1300004e-05,0.9959234,5.781708e-06,0.0040591396,5.215624e-13
106,"But it must be worth the wait in the end.""",6.5597356e-05,0.96752656,0.0048602107,0.005153106,0.022351123,4.338235e-05
107,"At the 4th City People Awards, 14 July 2013, she lost South South Musician of the Year to fellow Rivers State recording artist Oba Omega; present at the occasion were the celebrities Rita Dominic and Yvonne Nelson from Ghana.",1.3542159e-11,0.0895668,0.8142588,2.0553529e-05,4.7049154e-05,0.09610671
108,"Muma Gee competed in the first Imo State intercommunity beauty pageant, representing the community of Umuhu in Ngor Okpala.",5.2013054e-13,2.4878863e-09,1.7777214e-08,1.3121854e-08,1.0,1.044646e-08
109,"She came into the competition through her matrimonial union with Eke, whose heritage stems from the Umuhu people.",0.0010002253,0.0013157673,0.0007164576,2.0933722e-08,0.94829136,0.048676208
110,"On 1 August 2013, she was named Mrs. Ngor Okpala by first lady of Imo State, Nneoma Nkechi Okorocha, after beating off challenges from 28 other entrants.",1.2777061e-08,6.0553702e-05,1.1129178e-09,5.1542327e-07,0.4425738,0.5573651
111,"It was also made known on 23 September 2013, that Muma Gee has commenced a new recording session—possibly for Motherland—with Slim Burna and P Jaydino in the studio.",0.029181844,0.0015549508,0.0004156096,0.7117417,0.25710595,5.0129462e-12
112,"On 15 February 2014, whilst heavily pregnant with her first child, she confirmed in a telephone interview with Saturday Beats of The Punch that she will be performing at the album launch party for Motherland regardless of her physical condition.",0.0066262293,0.0015170011,1.2561075e-05,0.9791971,2.13329e-05,0.012625767
113,"On 18 April, just weeks before the anticipated concert, Uwame delivered twins – a boy and a girl commenting on this Uwame said, ""I was not initially expecting twins.",5.1066727e-05,0.9694332,4.928037e-05,4.8965717e-08,0.030466495,3.817542e-09
114,All I knew was that I started getting big and bigger.,1.04215e-11,0.7192167,1.3200862e-05,0.23509185,0.04567815,3.1392943e-08
115,"And people would see me and say, oh, you are looking so beautiful.",2.119969e-08,0.0029967749,6.808851e-05,1.837283e-05,1.9818798e-07,0.99691653
116,"I didn't believe I was going to have twins.""",6.1535324e-16,0.9948584,2.08745e-08,7.404775e-12,0.0051416545,9.419634e-12
117,==,0.124877945,0.21344653,0.0013716558,0.0017026949,0.6586011,7.902461e-08
118,Politics ==,0.00898892,0.00088462065,5.025393e-05,1.1236856e-07,0.7970919,0.19298424
119,"In October 2014, Muma Gee officially announced her intent to run for a seat in the federal House of Representatives via the Ahoada East–Abua–Odual constituency in Rivers State.",1.8757407e-06,5.9575796e-06,4.7105795e-09,3.479328e-07,0.9999918,3.1256037e-10
120,"She initially registered to run as a member of the Rivers State People's Democratic Party but later switched allegiance to the Labour Party, becoming the party's nominee for the seat.",0.9881781,1.38912965e-05,0.0034109342,0.0012544142,0.005229157,0.0019135907
121,"While elaborating on the reasons for her decision to join politics, Muma Gee described the move as the appropriate means to ""liberate her people"" who she says deserves representation that is qualitative and has their best interest in mind.",0.99676895,0.0011106349,0.00025725877,1.9929557e-05,0.0018421251,1.0482871e-06
122,"She was defeated at the federal election by Betty Apiafi, who ran as a PDP candidate and who has represented the constituency since 2007.",0.00037185833,0.00023630181,3.8113417e-06,0.010920903,0.0059157996,0.9825514
123,==,0.124877915,0.21344647,0.0013716553,0.0017026936,0.65860116,7.902455e-08
124,Personal life ==,0.002554406,0.00046550538,4.8373266e-07,1.0761065e-09,8.063284e-05,0.996899
125,"Uwame lives in Port Harcourt with her actor husband, whom she has been happily married to since 2011.",3.3692453e-05,6.296977e-06,1.9247719e-07,1.3757975e-06,0.9997923,0.00016618347
126,They are both devout Christians and did not participate in courtship.,1.2311579e-12,6.8739786e-07,7.00062e-10,3.4137568e-10,0.99999714,2.1495543e-06
127,"As of 18 April 2014, they had two children, a twin boy and girl, whom they named Chika and Chisa Eke.",1.8030774e-05,0.00071576535,6.327144e-08,5.741143e-08,0.99924767,1.8488981e-05
128,"Her third child and second daughter in 28 months, Okwuluoka, was born on the same day as her father Prince Eke on 18 August 2016.",8.050927e-08,0.00019851155,0.00016857807,3.3310688e-08,0.99960977,2.2940536e-05
129,==,0.124877915,0.21344647,0.0013716553,0.0017026936,0.65860116,7.902455e-08
130,Discography ==,0.9999943,1.2030798e-08,8.35843e-10,5.3618996e-06,2.814776e-09,3.2554004e-07
131,===,0.0018069096,2.1080758e-05,2.7498896e-05,0.00044119143,0.9977034,1.2509519e-11
132,Studio albums ===,0.91877854,0.0066976813,0.033609178,0.04075151,6.715119e-06,0.00015638431
133,==,0.124877915,0.21344647,0.0013716553,0.0017026936,0.65860116,7.902455e-08
134,Filmography ==,0.99997985,3.8154094e-10,9.0419326e-07,1.224641e-10,4.517795e-06,1.4692185e-05
