sentences,sentenceIndex,paragraphIndex,section,wikiId
Peter Stuart is an American singer-songwriter.,0,0,N/A,12121353
"Stuart is the founder and lead singer of the band Dog's Eye View, which is best known for its single, ""Everything Falls Apart"".",1,0,N/A,12121353
"In 2002, he released a solo album entitled Propeller.",2,0,N/A,12121353
==,0,1,== Biography ==,12121353
Biography ==,1,1,== Biography ==,12121353
===,0,2,== Biography == | === Early life ===,12121353
Early life =,1,2,== Biography == | === Early life ===,12121353
==,2,2,== Biography == | === Early life ===,12121353
"Stuart is a native of Glen Head, New York, on Long Island, His father died when he was eight years old, and the loss of his father was the topic of his first song.",0,3,== Biography == | === Early life ===,12121353
"Stuart studied film at Northwestern University in Illinois, where he was a member of the Delta Tau Delta college fraternity.",1,3,== Biography == | === Early life ===,12121353
Stuart graduated from Northwestern in 1989.,2,3,== Biography == | === Early life ===,12121353
===,0,4,== Biography == | === Early career ===,12121353
Early career ===,1,4,== Biography == | === Early career ===,12121353
"Stuart began his music career by performing in small venues, including clubs, coffee houses and college campuses.",0,5,== Biography == | === Early career ===,12121353
"Stuart formed the Chicago-based band Gravity Beavers in June 1990, with three other members – Arch Alcantara, Howie Kantoff and Doug Kenrick.",1,5,== Biography == | === Early career ===,12121353
John Schulte replaced Doug Kenrick in October 1990.,2,5,== Biography == | === Early career ===,12121353
The band changed its name to Monster in April 1991.,3,5,== Biography == | === Early career ===,12121353
"Stuart listed the now defunct band's influences as Kansas, Cat Stevens, Neil Young and Jimi Hendrix in a January 1992 Chicago Tribune article.",4,5,== Biography == | === Early career ===,12121353
"Stuart also said he became a fan of the Scottish alternative band, Del Amitri, when he was nineteen years old.",5,5,== Biography == | === Early career ===,12121353
"In 1994, Stuart joined the combined Tori Amos and Cracker tour as their opening act, appearing as an acoustic solo or occasionally with a backup bassist.",6,5,== Biography == | === Early career ===,12121353
"Stuart next worked with the Counting Crows in 1995, shortly before signing a contract with Columbia Records.",7,5,== Biography == | === Early career ===,12121353
===,0,6,== Biography == | === Dog's Eye View (1995–1999) ===,12121353
Dog's Eye View (1995–1999),1,6,== Biography == | === Dog's Eye View (1995–1999) ===,12121353
===,2,6,== Biography == | === Dog's Eye View (1995–1999) ===,12121353
Stuart formed Dog's Eye View after signing with Columbia Records.,0,7,== Biography == | === Dog's Eye View (1995–1999) ===,12121353
He wrote all of the band's songs.,1,7,== Biography == | === Dog's Eye View (1995–1999) ===,12121353
"Dog's Eye View released its debut album, Happy Nowhere, in October 1995.",2,7,== Biography == | === Dog's Eye View (1995–1999) ===,12121353
"The album included the very successful 1996 single, Everything Falls Apart, which received wide airplay on radio and MTV.",3,7,== Biography == | === Dog's Eye View (1995–1999) ===,12121353
Stuart has said that he wrote the single in just fifteen minutes aboard an airplane while suffering the effects of a hangover.,4,7,== Biography == | === Dog's Eye View (1995–1999) ===,12121353
"Stuart sang with Dog's Eye View on Sweet Relief II: Gravity of the Situation, a 1996 tribute album dedicated to Vic Chesnutt.",5,7,== Biography == | === Dog's Eye View (1995–1999) ===,12121353
Other artists on the album included The Smashing Pumpkins and R.E.M.,6,7,== Biography == | === Dog's Eye View (1995–1999) ===,12121353
===,0,8,== Biography == | === Return to solo career (1999–2006) ===,12121353
Return to solo career (1999–2006),1,8,== Biography == | === Return to solo career (1999–2006) ===,12121353
===,2,8,== Biography == | === Return to solo career (1999–2006) ===,12121353
"Stuart left Dog's Eye View after the release of the band's second album, Daisy, a commercial disappointment, to pursue solo work.",0,9,== Biography == | === Return to solo career (1999–2006) ===,12121353
"Stuart described production on Daisy, which was released in 1997, as an ""albatross.""",1,9,== Biography == | === Return to solo career (1999–2006) ===,12121353
"He contributed songs for the Go-Go's 2001 studio album, God Bless The Go-Go's.",2,9,== Biography == | === Return to solo career (1999–2006) ===,12121353
"He also co-wrote a track for Bon Jovi's 2000 album, Crush.",3,9,== Biography == | === Return to solo career (1999–2006) ===,12121353
Stuart also toured as an opening act for Live and Paula Cole during this time.,4,9,== Biography == | === Return to solo career (1999–2006) ===,12121353
"Stuart followed Paula Cole's tour bus in a rental car during his gig as her opening act, which lasted for six weeks.",5,9,== Biography == | === Return to solo career (1999–2006) ===,12121353
"After his acoustic opening performance, which averaged about 45-minutes before Cole took the stage, Stuart would sell his CDs, which contained just four songs.",6,9,== Biography == | === Return to solo career (1999–2006) ===,12121353
He returned to the Counting Crows as their opening act in August 2000.,7,9,== Biography == | === Return to solo career (1999–2006) ===,12121353
"In 2000, Matchbox Twenty brought Stuart onto their tour as an opening act.",8,9,== Biography == | === Return to solo career (1999–2006) ===,12121353
"Stuart also sung backing vocals for the band's 2000 album, Mad Season.",9,9,== Biography == | === Return to solo career (1999–2006) ===,12121353
"Speaking to ABC News at the time, Matchbox Twenty vocalist Rob Thomas praised Stuart's yet unreleased album saying, ""Peter's one of my dearest friends.",10,9,== Biography == | === Return to solo career (1999–2006) ===,12121353
His new album is great; it's f—king amazing.,11,9,== Biography == | === Return to solo career (1999–2006) ===,12121353
"I can't believe no one has picked it up yet.""",12,9,== Biography == | === Return to solo career (1999–2006) ===,12121353
"(Stuart had been between labels at the time of Matchbox Twenty's tour and was pitching his solo album to various record labels.)In 2001, Richard Lloyd of the rock band Television teamed with Stuart and drummer Chris Butler to record The Cover Doesn't Matter, which marked Lloyd's first solo album release since 1987.",13,9,== Biography == | === Return to solo career (1999–2006) ===,12121353
"Stuart's solo album, produced by Andrew Williams, was completed in early 2001.",14,9,== Biography == | === Return to solo career (1999–2006) ===,12121353
Stuart sold several thousand copies in 2001 and 2002 on tour while shopping the album to potential record labels.,15,9,== Biography == | === Return to solo career (1999–2006) ===,12121353
"Stuart's album, named Propeller, was picked up by Vanguard Records, which released it on August 13, 2002.",16,9,== Biography == | === Return to solo career (1999–2006) ===,12121353
"Propeller featured background vocals from Adam Duritz, frontman of the Counting Crows, and Moon Zappa.",17,9,== Biography == | === Return to solo career (1999–2006) ===,12121353
"Other guest artists who contributed to Stuart's solo debut included Mark Isham, D. J. Bonebrake, Greg Leisz, a multi-instrumentalist who added some guitar work, as well as David Immergluck and Charlie Gillingham, both of the Counting Crows.",18,9,== Biography == | === Return to solo career (1999–2006) ===,12121353
"Billboard published a largely positive review of the album, writing in its August 24, 2002, edition: ""When you find yourself humming along with an entire album and not wanting it to end, while also feeling that the artist is being completely honest and heartfelt, the project is definitely a special one.",19,9,== Biography == | === Return to solo career (1999–2006) ===,12121353
"Stuart, the former Dog's Eye View frontman, accomplishes this difficult task with his solo debut.""",20,9,== Biography == | === Return to solo career (1999–2006) ===,12121353
===,0,10,== Biography == | === Dog's Eye View reunion ===,12121353
Dog's Eye View reunion ===,1,10,== Biography == | === Dog's Eye View reunion ===,12121353
"After an extended hiatus, Dog's Eye View released a third album (also on Vanguard); the album was entitled Tomorrow Always Comes.",0,11,== Biography == | === Dog's Eye View reunion ===,12121353
"It featured backing vocals by singers Jason Mraz and Kelly Moneymaker, as well as an appearance from Paul Doucette of Matchbox Twenty.",1,11,== Biography == | === Dog's Eye View reunion ===,12121353
==,0,12,== Later work ==,12121353
Later work ==,1,12,== Later work ==,12121353
"A 2021 issue of Esquire reported that Stuart was no longer involved in the music business, had obtained a master's degree in clinical psychology, and was working as a therapist in Austin, Texas.",0,13,== Later work ==,12121353
==,0,14,== References ==,12121353
References ==,1,14,== References ==,12121353
