sentences,sentenceIndex,paragraphIndex,section,wikiId
"Kara (Hangul: 카라, Japanese: カラ, often stylized as KARA)   was a South Korean pop girl group formed by DSP Media in 2007.",0,0,N/A,16176403
"The group's final lineup was composed of Gyuri, Seungyeon, Hara and Youngji.",1,0,N/A,16176403
"Members Nicole and Jiyoung officially departed from the group in 2014, while Sunghee left in 2008.",2,0,N/A,16176403
"The group originally started off as a quartet and made their debut in March 2007 with their first studio album The First Blooming and its single ""Break It"" while displaying a strong female image and a mature R&B sound.",3,0,N/A,16176403
"Expectations for the group were big because they were considered as successors to their senior labelmate, Fin.",4,0,N/A,16176403
K.L.,5,0,N/A,16176403
"However, their debut was not well received by the public and was a commercial failure.",6,0,N/A,16176403
"The following year, Kim Sung-hee departed the group due to parental pressure, and members Goo Hara and Kang Jiyoung were brought in.",7,0,N/A,16176403
"After their addition, the group also changed their musical style and their image to the ""pretty but natural"" appeal, releasing their first mini-album, Rock U in July 2008.",8,0,N/A,16176403
"They achieved their first number one song with ""Honey"" (2009).",9,0,N/A,16176403
"In July 2009, the group released their second studio album, Revolution and spawned the hit single ""Mister"", whose choreography featured the ""butt-dance"", that helped increase the group's popularity within East Asia.",10,0,N/A,16176403
"Their follow-up singles including ""Lupin"" (2010), ""Jumping"" (2010), ""Step"" (2011), and ""Pandora"" (2012) were also successful and helped further establish the group within the Korean music industry.",11,0,N/A,16176403
"The group were ranked at No. 6 and No. 5 in  Gallup Korea in 2009 and 2010 respectively, thus making them the second best girl group in Korea for 2010.",12,0,N/A,16176403
"They were also ranked at No. 4 and 13 in February 2012 and 2013's Forbes Korea Power Celebrity list, respectively.",13,0,N/A,16176403
"After finding national success, the group began to expand their music to Japan by signing to Universal Music Japan's subsidiary label, Universal Sigma in 2010.",14,0,N/A,16176403
"The group's debut was a success as they were dubbed as ""Japan's No. 1 Rookie Artist of 2010"" by Oricon and also receiving the ""New Artist of the Year Award (International)"" from the Japan Gold Disc Awards.",15,0,N/A,16176403
"In April 2011, the group achieved their first number one single in Japan with ""Jet Coaster Love"", making them the first foreign female group since the creation of the Oricon to rank number one in the first week of release and also the first foreign female group in thirty years to do so.",16,0,N/A,16176403
"Overall, the group managed to sell over one million physical singles within two years, making them one of the fastest-selling South Korean acts in Japan.",17,0,N/A,16176403
"In 2014, Nicole Jung and Kang Jiyoung decided not to renew their contracts with DSP Media thus leaving the group to pursue their own endeavors; Nicole debuted as solo artist and Jiyoung became an actress in Japan.",18,0,N/A,16176403
"Following their departures, a reality show titled Kara Project was aired on TV to select members to join the group.",19,0,N/A,16176403
Seven trainees from DSP Media took part in the program.,20,0,N/A,16176403
The winner of the competition was Heo Youngji who became the latest  member to join the group.,21,0,N/A,16176403
"On January 15, 2016, Kara disbanded after DSP Media announced that the contracts with Park Gyu-ri, Han Seung-yeon and Goo Ha-ra expired and they decided not to renew their contracts.",0,1,N/A,16176403
"Members Gyuri and Youngji have mentioned the possibilities of reunion, though no further updates have been released.",1,1,N/A,16176403
==,0,2,== Name ==,16176403
Name ==,1,2,== Name ==,16176403
"The group's name comes from the Greek word ""chara"" (χαρά, lit.",0,3,== Name ==,16176403
"""joy""), which they interpreted to mean ""sweet melody"".",1,3,== Name ==,16176403
==,0,4,== History ==,16176403
History ==,1,4,== History ==,16176403
===,0,5,== History == | === 2007: Early beginnings and debut ===,16176403
2007:,1,5,== History == | === 2007: Early beginnings and debut ===,16176403
Early beginnings and debut,2,5,== History == | === 2007: Early beginnings and debut ===,16176403
=,3,5,== History == | === 2007: Early beginnings and debut ===,16176403
==,4,5,== History == | === 2007: Early beginnings and debut ===,16176403
"The group started off as a quartet with members Park Gyuri, Han Seung-yeon, Kim Sung-hee, and Jung Nicole.",0,6,== History == | === 2007: Early beginnings and debut ===,16176403
"On March 29, 2007, Kara debuted on M.net's M! Countdown with ""Break It"" from their first album The First Blooming.",1,6,== History == | === 2007: Early beginnings and debut ===,16176403
Their debut song displayed a strong female image and R&B sound.,2,6,== History == | === 2007: Early beginnings and debut ===,16176403
"Other singles from the same album were titled ""If U Wanna"" and ""Secret World"".",3,6,== History == | === 2007: Early beginnings and debut ===,16176403
Music videos for the first two singles were created.,4,6,== History == | === 2007: Early beginnings and debut ===,16176403
"Although their album was acclaimed by critics, it was not well received by the general public and was overshadowed by other girl groups who debuted the same year.",5,6,== History == | === 2007: Early beginnings and debut ===,16176403
All promotions for their first album ended in the summer of 2007.,6,6,== History == | === 2007: Early beginnings and debut ===,16176403
"In August 2007, the group came out with a documentary on M.net called Kara Self Camera which showcased the group, their talents, and the relationships they had with each other.",7,6,== History == | === 2007: Early beginnings and debut ===,16176403
"The first season debuted on August 8, 2007, and ended on December 12, 2007, with over 15 episodes.",8,6,== History == | === 2007: Early beginnings and debut ===,16176403
"In the following months, member Seungyeon continued participating in many television variety shows to keep the group's name recognizable to the public, as their first album was not a commercial success.",9,6,== History == | === 2007: Early beginnings and debut ===,16176403
"Comparisons were often drawn between them and their senior labelmates, Fin.",10,6,== History == | === 2007: Early beginnings and debut ===,16176403
"K.L, because of their similarities in style and concept as well as the fact that the two groups were signed to the same label.",11,6,== History == | === 2007: Early beginnings and debut ===,16176403
"Additionally, each individual member of Kara was paralleled to a member of Fin.",12,6,== History == | === 2007: Early beginnings and debut ===,16176403
K.L.,13,6,== History == | === 2007: Early beginnings and debut ===,16176403
"In response to the comparisons, the members of Kara stated that they regarded the comparisons as beneficial and inspiring.",14,6,== History == | === 2007: Early beginnings and debut ===,16176403
===,0,7,"== History == | === 2008: First line-up changes, Rock U, Pretty Girl and career breakthrough ===",16176403
2008:,1,7,"== History == | === 2008: First line-up changes, Rock U, Pretty Girl and career breakthrough ===",16176403
"First line-up changes, Rock U, Pretty Girl and career breakthrough ===",2,7,"== History == | === 2008: First line-up changes, Rock U, Pretty Girl and career breakthrough ===",16176403
"The group was scheduled to have their comeback in March 2008 with their second album, however, member Kim Sung-hee suddenly announced that she would be leaving the group and she decided to retire their entertainment industry due to this she first announced her departure from the group due to her parental pressure and hence she failed all of her college exams she made her decision to leave in order to focus on school and education.",0,8,"== History == | === 2008: First line-up changes, Rock U, Pretty Girl and career breakthrough ===",16176403
"In response, DSP stated that the second album that was recorded would be shelved and replaced by a mini-album to come in May; in addition, two members would join the group.",1,8,"== History == | === 2008: First line-up changes, Rock U, Pretty Girl and career breakthrough ===",16176403
"Auditions were held, and the two new members were eventually revealed to be Goo Ha-ra and Kang Jiyoung.",2,8,"== History == | === 2008: First line-up changes, Rock U, Pretty Girl and career breakthrough ===",16176403
"The group made their return in the music industry as a quintet on July 24, 2008, with ""Rock U"" on M! Countdown.",3,8,"== History == | === 2008: First line-up changes, Rock U, Pretty Girl and career breakthrough ===",16176403
Their first mini-album titled Rock U was released the next day.,4,8,"== History == | === 2008: First line-up changes, Rock U, Pretty Girl and career breakthrough ===",16176403
"They made their comeback with the ""cute"" and ""playful"" image which was the complete opposite of the group's original image from their debut.",5,8,"== History == | === 2008: First line-up changes, Rock U, Pretty Girl and career breakthrough ===",16176403
"The second season of Kara Self Camera premiered on August 18, 2008, which chronicled how the group was adapting to their two new members.",6,8,"== History == | === 2008: First line-up changes, Rock U, Pretty Girl and career breakthrough ===",16176403
"On November 29, 2008, DSP released a teaser video for their upcoming single, ""Pretty Girl"", which received over 40,000 hits within 12 hours.",7,8,"== History == | === 2008: First line-up changes, Rock U, Pretty Girl and career breakthrough ===",16176403
"The full video was released on December 2, 2008, online and was positively received by the public.",8,8,"== History == | === 2008: First line-up changes, Rock U, Pretty Girl and career breakthrough ===",16176403
"The EP, Pretty Girl, was released on December 4, embodying a ""fun-party"" concept.",9,8,"== History == | === 2008: First line-up changes, Rock U, Pretty Girl and career breakthrough ===",16176403
"The group began promoting their comeback on all major music shows on December 4, 2008, starting with M! Countdown.",10,8,"== History == | === 2008: First line-up changes, Rock U, Pretty Girl and career breakthrough ===",16176403
"During their first national performance on KBS's Music Bank, member Goo Hara accidentally gasped ""ah!""",11,8,"== History == | === 2008: First line-up changes, Rock U, Pretty Girl and career breakthrough ===",16176403
"live on air due to slipping on falling confetti, and reportedly cried profusely afterwards.",12,8,"== History == | === 2008: First line-up changes, Rock U, Pretty Girl and career breakthrough ===",16176403
"The incident became a hot issue to many viewers, but Goo Hara received comfort instead of criticism from the general public.",13,8,"== History == | === 2008: First line-up changes, Rock U, Pretty Girl and career breakthrough ===",16176403
"Park Gyuri attributed their popularity increase to their ""pretty but natural"" appeal, while media reports gave credit to the band for finally finding its own identity in the music industry since the group's debut and to older male fans, most notably singer Shin Hae Chul.",14,8,"== History == | === 2008: First line-up changes, Rock U, Pretty Girl and career breakthrough ===",16176403
"Due to their increasingly hectic schedule as their popularity rose, a few of the group's members were taken to the hospital on December 19 after a Music Bank rehearsal for cold symptoms and exhaustion.",0,9,"== History == | === 2008: First line-up changes, Rock U, Pretty Girl and career breakthrough ===",16176403
=== 2009:,0,10,"== History == | === 2009: Rise in popularity in South Korea, Honey and Revolution ===",16176403
"Rise in popularity in South Korea, Honey and Revolution ===",1,10,"== History == | === 2009: Rise in popularity in South Korea, Honey and Revolution ===",16176403
"At the end of January 2009, DSP announced that it would commence voting on January 28 at the group's official website for the follow-up single to ""Pretty Girl"", which ended on February 2.",0,11,"== History == | === 2009: Rise in popularity in South Korea, Honey and Revolution ===",16176403
"By the deadline of February 2, ""Honey"" was the clear winner, with 60% of the votes.",1,11,"== History == | === 2009: Rise in popularity in South Korea, Honey and Revolution ===",16176403
"The song was remixed from the original version, and also underwent a slight name change from ""하니"" (Ha-ni) to ""Honey"".",2,11,"== History == | === 2009: Rise in popularity in South Korea, Honey and Revolution ===",16176403
"The group released the music video for ""Honey"" on February 16 and had their first live broadcasting comeback on KBS's Music Bank program on February 13, 2009; a repackaged mini-album entitled Honey followed on February 19 which featured remixed versions of songs from the group's previous EP.",3,11,"== History == | === 2009: Rise in popularity in South Korea, Honey and Revolution ===",16176403
"""Honey"" became the group's first number one single when it topped Gaon's weekly singles chart.",0,12,"== History == | === 2009: Rise in popularity in South Korea, Honey and Revolution ===",16176403
The song earned the group their first music show award on M!,1,12,"== History == | === 2009: Rise in popularity in South Korea, Honey and Revolution ===",16176403
Countdown on March 5.,2,12,"== History == | === 2009: Rise in popularity in South Korea, Honey and Revolution ===",16176403
It held onto the position for three nonconsecutive weeks.,3,12,"== History == | === 2009: Rise in popularity in South Korea, Honey and Revolution ===",16176403
"The song also won the Mutizen award on SBS's program Inkigayo and the ""Best Dance Award"" at the 2009 Mnet Asian Music Awards.",4,12,"== History == | === 2009: Rise in popularity in South Korea, Honey and Revolution ===",16176403
"At the end of March, the group was chosen for the fourth season of MBC's Idol Show, which marked the group's first hosting duties for a show.",5,12,"== History == | === 2009: Rise in popularity in South Korea, Honey and Revolution ===",16176403
"The group then had a reality show called MTV Meta Friends, which chronicled a group of fans getting a chance to become friends with the group members.",6,12,"== History == | === 2009: Rise in popularity in South Korea, Honey and Revolution ===",16176403
"For the show, the group had their first concert since their debut in 2007.",7,12,"== History == | === 2009: Rise in popularity in South Korea, Honey and Revolution ===",16176403
"In June 2009, the group stated they would make their comeback in late July, with their concept upgraded.",0,13,"== History == | === 2009: Rise in popularity in South Korea, Honey and Revolution ===",16176403
"The first teaser pictures of the group were then released in mid-July, showing radical changes in the group's style and also saw a slight return of their ""strong and mature"" image previously seen from their debut.",1,13,"== History == | === 2009: Rise in popularity in South Korea, Honey and Revolution ===",16176403
"Their single ""Wanna"" was released on July 28, 2009, and immediately charted on various digital music charts.",0,14,"== History == | === 2009: Rise in popularity in South Korea, Honey and Revolution ===",16176403
"The music video was released on July 29, with the full album, Revolution, available online on July 30.",1,14,"== History == | === 2009: Rise in popularity in South Korea, Honey and Revolution ===",16176403
"Comeback activities commenced on July 31, beginning with KBS's Music Bank; the group performed both ""Wanna"" and ""Mister"".",2,14,"== History == | === 2009: Rise in popularity in South Korea, Honey and Revolution ===",16176403
"""Mister"" proved to be popular with netizens due to the ""butt dance"" that is featured prominently in the choreography.",3,14,"== History == | === 2009: Rise in popularity in South Korea, Honey and Revolution ===",16176403
"Due to the popularity of ""Mister"", Kara's overall popularity increased, evidenced by an influx of advertisement requests by various companies; in total, they had more advertisements in October 2009 than they had had the previous two years.",4,14,"== History == | === 2009: Rise in popularity in South Korea, Honey and Revolution ===",16176403
"""Wanna"" also became a number one single for the group and won the Mutizen award on August 30, 2009, from Inkigayo.",0,15,"== History == | === 2009: Rise in popularity in South Korea, Honey and Revolution ===",16176403
"During promotions for Revolution, the group also performed internationally, including at Bangkok's Parc Paragon.",0,16,"== History == | === 2009: Rise in popularity in South Korea, Honey and Revolution ===",16176403
"On November 25, 2009, M. Net premiered the reality show called Kara Bakery, which followed the group as they attempted to plan, open, and advertise their own bakery.",1,16,"== History == | === 2009: Rise in popularity in South Korea, Honey and Revolution ===",16176403
The show had 8 episodes and ran until early 2010.,2,16,"== History == | === 2009: Rise in popularity in South Korea, Honey and Revolution ===",16176403
All proceeds from the bakery was donated to charity.,3,16,"== History == | === 2009: Rise in popularity in South Korea, Honey and Revolution ===",16176403
"On December 14, 2009, it was reported that the group held a fan-meeting for their Japanese fans earlier that year in February marking the group's first promotional tour in Japan.",0,17,"== History == | === 2009: Rise in popularity in South Korea, Honey and Revolution ===",16176403
"Over 3,000 fans were reportedly registered, exceeding the capacity of the venue which resulted in a second showcase.",1,17,"== History == | === 2009: Rise in popularity in South Korea, Honey and Revolution ===",16176403
===,0,18,"== History == | === 2010: Lupin, Japanese debut, and Girl's Talk ===",16176403
2010:,1,18,"== History == | === 2010: Lupin, Japanese debut, and Girl's Talk ===",16176403
"Lupin, Japanese debut, and Girl's Talk ===",2,18,"== History == | === 2010: Lupin, Japanese debut, and Girl's Talk ===",16176403
"After a short hiatus, DSP released two teaser photos of the group's comeback concept on February 9, 2010.",0,19,"== History == | === 2010: Lupin, Japanese debut, and Girl's Talk ===",16176403
"The photos garnered a lot of interest because compared to their past album concepts, the new photos showed the members in dark outfits and smokey makeup that elicited a darker, more mature, and sexier feel.",1,19,"== History == | === 2010: Lupin, Japanese debut, and Girl's Talk ===",16176403
"The next day, the album jacket was unveiled with a ""Stealer"" concept as well as the title track named ""Lupin"", which became number one on several online music charts shortly after release.",2,19,"== History == | === 2010: Lupin, Japanese debut, and Girl's Talk ===",16176403
"The teaser video was released on February 12 on Naver; the EP, Lupin, followed on February 17.",3,19,"== History == | === 2010: Lupin, Japanese debut, and Girl's Talk ===",16176403
"The music video was released on February 22, garnering more than 90,000 views in the first 2 hours.",4,19,"== History == | === 2010: Lupin, Japanese debut, and Girl's Talk ===",16176403
The group began their broadcasting comeback starting on M!,5,19,"== History == | === 2010: Lupin, Japanese debut, and Girl's Talk ===",16176403
"Countdown on February 25, 2010.",6,19,"== History == | === 2010: Lupin, Japanese debut, and Girl's Talk ===",16176403
"On March 4, 2010, the group won their first number one award for ""Lupin"" on M! Countdown.",0,20,"== History == | === 2010: Lupin, Japanese debut, and Girl's Talk ===",16176403
"On the following week, the group won yet another award on M! Countdown, making it their second consecutive win on the music program.",1,20,"== History == | === 2010: Lupin, Japanese debut, and Girl's Talk ===",16176403
"""Lupin"" also gave the group their first number one win on Music Bank on March 12, 2010, making it the group's first win on this particular music show since their debut, holding onto the position for three consecutive weeks.",2,20,"== History == | === 2010: Lupin, Japanese debut, and Girl's Talk ===",16176403
The song also won the Mutizen award from Inkigayo on March 14.,3,20,"== History == | === 2010: Lupin, Japanese debut, and Girl's Talk ===",16176403
"In March 2010, it was announced that the group will participate in the 8th Annual Korean Music Festival to be held at Hollywood Bowl in Los Angeles, with member Jung Nicole as host.",4,20,"== History == | === 2010: Lupin, Japanese debut, and Girl's Talk ===",16176403
"Afterwards, the group became very active in Japan, holding showcases and hand shake events as preparation for their official Japanese debut.",5,20,"== History == | === 2010: Lupin, Japanese debut, and Girl's Talk ===",16176403
"The group was featured in a video message for a show called Arashi no Shukudai-kun, hosted by Japanese idol group Arashi.",6,20,"== History == | === 2010: Lupin, Japanese debut, and Girl's Talk ===",16176403
"The group then held fan meetings on May 8 with more than 8,000 fans at Japan's Grand Prince Hotel.",7,20,"== History == | === 2010: Lupin, Japanese debut, and Girl's Talk ===",16176403
"In addition, the group had an official Japan fan club meeting with 3,000 fans at Yokohama's Minato Mirai Hall on May 9.",8,20,"== History == | === 2010: Lupin, Japanese debut, and Girl's Talk ===",16176403
"The group later on signed with Universal Music Japan's subsidiary label, Universal Sigma.",9,20,"== History == | === 2010: Lupin, Japanese debut, and Girl's Talk ===",16176403
"On August 11, the group released their debut single, the Japanese remake of their Korean song, ""Mister"".",10,20,"== History == | === 2010: Lupin, Japanese debut, and Girl's Talk ===",16176403
The single ranked in various music charts and proved to be very popular in Japan.,11,20,"== History == | === 2010: Lupin, Japanese debut, and Girl's Talk ===",16176403
"Following the release, the single exceeded expectations as it charted at number five on Oricon's Daily Singles Chart with debut sales of 29,238 copies.",12,20,"== History == | === 2010: Lupin, Japanese debut, and Girl's Talk ===",16176403
"The song eventually became the most downloaded song of all time by a Korean artist in Japan, with downloads exceeding 2 million as of March 2012.",13,20,"== History == | === 2010: Lupin, Japanese debut, and Girl's Talk ===",16176403
"The group later on released their second single entitled ""Jumping"" on November 10, 2010.",14,20,"== History == | === 2010: Lupin, Japanese debut, and Girl's Talk ===",16176403
"The song quickly climbed up on many charts including mobile downloads, and debuted at number 5 on the Daily Singles Chart of Oricon.",15,20,"== History == | === 2010: Lupin, Japanese debut, and Girl's Talk ===",16176403
"It eventually rose to number 2, only behind Arashi.",16,20,"== History == | === 2010: Lupin, Japanese debut, and Girl's Talk ===",16176403
"The single peaked at number 5 on Oricon's Weekly Singles Chart with debut sales of 54,977.",17,20,"== History == | === 2010: Lupin, Japanese debut, and Girl's Talk ===",16176403
"On September 29, 2010, the group released their compilation album, Kara Best 2007-2010.",18,20,"== History == | === 2010: Lupin, Japanese debut, and Girl's Talk ===",16176403
The album is a compilation of their selected Korean tracks.,19,20,"== History == | === 2010: Lupin, Japanese debut, and Girl's Talk ===",16176403
"It ranked number two on the Oricon Daily Albums Chart on the first day of release, selling 18,223 copies.",20,20,"== History == | === 2010: Lupin, Japanese debut, and Girl's Talk ===",16176403
"It was announced on November 3, 2010, that the album was certified gold by the RIAJ, making the group the first ever Korean group since the 1990s to release an all-Korean album that was able break the 100 thousand copies barrier in Japan.",21,20,"== History == | === 2010: Lupin, Japanese debut, and Girl's Talk ===",16176403
"It was eventually certified platinum with shipments exceeding 250,000 copies.",22,20,"== History == | === 2010: Lupin, Japanese debut, and Girl's Talk ===",16176403
"On October 23, 2010, the band represented Korea and performed at the 7th annual Asia Song Festival, organized by Korea Foundation for International Culture Exchange, at the Seoul Olympic Stadium.",0,21,"== History == | === 2010: Lupin, Japanese debut, and Girl's Talk ===",16176403
"Their debut Japanese album, Girl's Talk, was released on November 24, 2010.",1,21,"== History == | === 2010: Lupin, Japanese debut, and Girl's Talk ===",16176403
"It sold 107,000 copies in its first week and ranked number 2 in the Oricon Weekly Album Chart, making this the first album by a non-Japanese girl group in Japan in 6 years and 9 months to sell more than 100,000 albums in its first week.",2,21,"== History == | === 2010: Lupin, Japanese debut, and Girl's Talk ===",16176403
"The album was certified double platinum by the RIAJ on November 18, 2011, with sales exceeding half a million in Japan.",3,21,"== History == | === 2010: Lupin, Japanese debut, and Girl's Talk ===",16176403
"After taking a nine-month hiatus in the Korean music industry, the group announced the release of their single ""Jumping"", which was then promoted in both Korea and Japan.",4,21,"== History == | === 2010: Lupin, Japanese debut, and Girl's Talk ===",16176403
"It was released as the title track for their fourth Korean mini-album of the same name, Jumping.",5,21,"== History == | === 2010: Lupin, Japanese debut, and Girl's Talk ===",16176403
