sentences,sentenceIndex,paragraphIndex,section,wikiId
The drama revolved around the love stories of each member of the group including Nicole and Jiyoung.,7,33,"== History == | === 2014–2015: Second line-up changes, Day & Night, In Love and Girl's Story ===",16176403
"The group released their mini-album, Day & Night, in South Korea on August 18 before going on their third Japanese tour on October 24.",8,33,"== History == | === 2014–2015: Second line-up changes, Day & Night, In Love and Girl's Story ===",16176403
"They returned with track titled ""Mamma Mia"", which was produced by Duble Sidekick.",9,33,"== History == | === 2014–2015: Second line-up changes, Day & Night, In Love and Girl's Story ===",16176403
A music video was filmed in the Gyonggi Province on July 9.,10,33,"== History == | === 2014–2015: Second line-up changes, Day & Night, In Love and Girl's Story ===",16176403
Mamma Mia was also released as their 11th Japanese single and the first single to feature Youngji after Nicole and Jiyoung departure.,11,33,"== History == | === 2014–2015: Second line-up changes, Day & Night, In Love and Girl's Story ===",16176403
So Good was announced later as the B-side of the single.,12,33,"== History == | === 2014–2015: Second line-up changes, Day & Night, In Love and Girl's Story ===",16176403
"On March 15, 2015, the group released a Japanese triple A-side single, ""Summer-gic/Sunshine Miracle/Sunny Days"".",0,34,"== History == | === 2014–2015: Second line-up changes, Day & Night, In Love and Girl's Story ===",16176403
"It topped Oricon Daily Singles Chart selling over 28,000 copies.",1,34,"== History == | === 2014–2015: Second line-up changes, Day & Night, In Love and Girl's Story ===",16176403
"Subsequently, It was ranked number two at the Oricon Weekly Singles Chart with sales of 52,496 copies, behind V6's ""Timeless.",2,34,"== History == | === 2014–2015: Second line-up changes, Day & Night, In Love and Girl's Story ===",16176403
"""The group released their seventh mini-album, In Love, on May 26, 2015.",3,34,"== History == | === 2014–2015: Second line-up changes, Day & Night, In Love and Girl's Story ===",16176403
"Its lead single, ""Cupid"", was performed prior to its official release at KBS' Dream Concert on May 23, 2015.",4,34,"== History == | === 2014–2015: Second line-up changes, Day & Night, In Love and Girl's Story ===",16176403
"The group released their fifth Japanese album, Girl's Story on June 17, 2015.",5,34,"== History == | === 2014–2015: Second line-up changes, Day & Night, In Love and Girl's Story ===",16176403
The album includes their cover of Fin.,6,34,"== History == | === 2014–2015: Second line-up changes, Day & Night, In Love and Girl's Story ===",16176403
"K. L's ""Forever Love.",7,34,"== History == | === 2014–2015: Second line-up changes, Day & Night, In Love and Girl's Story ===",16176403
"""On July 17, 2015, it was announced that Kara would embark on their fourth Japanese tour beginning in September.",8,34,"== History == | === 2014–2015: Second line-up changes, Day & Night, In Love and Girl's Story ===",16176403
"The tour started on September 1, 2015, at Zepp Nanba in Osaka.",9,34,"== History == | === 2014–2015: Second line-up changes, Day & Night, In Love and Girl's Story ===",16176403
===,0,35,== History == | === 2016: Disbandment ===,16176403
2016:,1,35,== History == | === 2016: Disbandment ===,16176403
Disbandment ===,2,35,== History == | === 2016: Disbandment ===,16176403
"On January 15, 2016, DSP Media announced Gyuri, Seungyeon and Hara's departure from the group due to contracts expiring, resulting in the group's disbandment.",0,36,== History == | === 2016: Disbandment ===,16176403
The company also noted that Youngji would continue her music career as a solo artist.,1,36,== History == | === 2016: Disbandment ===,16176403
"Members Gyuri and Youngji have mentioned the possibility of reunion in the future, though as of September 2016, no further updates have been released.",2,36,== History == | === 2016: Disbandment ===,16176403
==,0,37,== Other ventures ==,16176403
Other ventures ==,1,37,== Other ventures ==,16176403
===,0,38,== Other ventures == | === Soundtracks ===,16176403
Soundtracks ===,1,38,== Other ventures == | === Soundtracks ===,16176403
"The original group recorded a song titled ""Fighting"" on the soundtrack for 강남엄마 따라잡기 (""Chasing a Mother from Kangnam""), a drama that aired on SBS; the soundtrack was released on July 25, 2007.",0,39,== Other ventures == | === Soundtracks ===,16176403
"Their second song was ""Butterfly"" on the soundtrack for the anime Naruto, which was released on September 29, 2008.",1,39,== Other ventures == | === Soundtracks ===,16176403
"The group also participated in the second soundtrack for Boys Over Flowers, recording the song ""Love is Fire"".",2,39,== Other ventures == | === Soundtracks ===,16176403
"""Ddokateun Mam"" (""똑 같은 맘"", ""The Same Heart"") was a song used in i-Musician, an upcoming mobile game that the group promoted; the song was released digitally in June 2009.",0,40,== Other ventures == | === Soundtracks ===,16176403
"In January 2010, they sang the main original soundtrack of drama series ""별을 따다줘"" (Catch Me a Star).",1,40,== Other ventures == | === Soundtracks ===,16176403
"The group appeared on MBC's Music Travel LaLaLa on October 22, 2009, where they performed ""길"" (""Road"") by g.o.d and  ""빙글 빙글"" (""Round and Round"") with NoBrain.",2,40,== Other ventures == | === Soundtracks ===,16176403
"These tracks were included on Music Travel LaLaLa's soundtrack, released in February 2010.",3,40,== Other ventures == | === Soundtracks ===,16176403
"In April 2010, it was revealed that the group will sing a cheer song for the 2010 FIFA World Cup entitled ""We're with You"".",4,40,== Other ventures == | === Soundtracks ===,16176403
Behind-the-scenes and individual member teaser videos were revealed along with photos of the group wearing cheerleader outfits.,5,40,== Other ventures == | === Soundtracks ===,16176403
"The song was later included on the repackaged version of their second Japanese studio album, Super Girl.",6,40,== Other ventures == | === Soundtracks ===,16176403
"The single was released on May 3, 2010.",7,40,== Other ventures == | === Soundtracks ===,16176403
"The group also released a single ""2ME"", the soundtrack for online game We Online.",0,41,== Other ventures == | === Soundtracks ===,16176403
"In November 2010, Seungyeon's solo track ""Superstar"" for KBS's drama Mary Stayed Out All Night was revealed.",0,42,== Other ventures == | === Soundtracks ===,16176403
"In 2011, Gyuri and Hara recorded 2 songs for the soundtrack of the SBS's drama City Hunter.",0,43,== Other ventures == | === Soundtracks ===,16176403
"""시티헌터"" sung by Gyuri was released on June 23 and ""I Love U, I Want U, I Need U (Sweet Acoustic Version)"" sung by Hara was released on July 27.",1,43,== Other ventures == | === Soundtracks ===,16176403
===,0,44,== Other ventures == | === Endorsements ===,16176403
Endorsements ===,1,44,== Other ventures == | === Endorsements ===,16176403
"The group has endorsed online games, clothing, food & beverage, cosmetic products as well as shoes.",0,45,== Other ventures == | === Endorsements ===,16176403
"Kara became endorsers of a cosmetics product, Mistine BB Wonder Compact in Thailand by April 2010.",1,45,== Other ventures == | === Endorsements ===,16176403
"In May 2010, Kara became the female faces of Samsung Doogeun Doogeun Tomorrow Campaign.",2,45,== Other ventures == | === Endorsements ===,16176403
Kara has also been endorsing for Ask and also for fleece boot company Bear Paws.,3,45,== Other ventures == | === Endorsements ===,16176403
"With the group's successful debut in Japan in August 2010, offers from different electronics, clothing and beverage brands started coming.",4,45,== Other ventures == | === Endorsements ===,16176403
"In October 2010, it was revealed that group has sealed a revenue of 2 billion won from endorsements just 2 months after their Japanese debut.",5,45,== Other ventures == | === Endorsements ===,16176403
"Officials said, ""Kara shows a sophisticated image on stage while outside the stage, they show a friendly image"" On October 28, 2010, it was confirmed that Kara was chosen as the new models of one of the three biggest Carrier companies in Japan, ""KDDI"", showing their popularity.",6,45,== Other ventures == | === Endorsements ===,16176403
"Starting on November 1, the group promoted the ""Au Santa Letter of Challenge"", organized by the ""Au Smart Sports Run&Walk"", where the group members dressed up in Santa Claus costumes, offering the users gifts with various contents.",7,45,== Other ventures == | === Endorsements ===,16176403
"They also created a ""Challenge Live"" Twitter account where users posted support messages then 15 pairs people were chosen to attend the Limited Kara Live Event via lottery.",8,45,== Other ventures == | === Endorsements ===,16176403
"Furthermore, with their success in Japan, Japanese game production company Rhaon Japan revealed through their official TalesLand official website that Kara became the new models for their game.",9,45,== Other ventures == | === Endorsements ===,16176403
"Players were able to find group members as characters in the game, and were able to see a short animation of Kara, along with a promotional video on the landing page.",10,45,== Other ventures == | === Endorsements ===,16176403
"In 2010, the group opened their own online clothing franchise called ""Karaya"", which members Gyuri, Hara and Jiyoung were chosen as spokesmodels.",11,45,== Other ventures == | === Endorsements ===,16176403
The said online shop proved to be a big hit and rose to 4th place in popularity among celebrity owned internet shopping mall sites.,12,45,== Other ventures == | === Endorsements ===,16176403
"In June 2011, the group was chosen by LG Electronics as the Japanese CF models for their upcoming cellphone brand, LG 'Optimus Bright'.",13,45,== Other ventures == | === Endorsements ===,16176403
"They also released their Japanese single titled 'Go Go Summer', which was used for the commercial and was promoted at the same time.",14,45,== Other ventures == | === Endorsements ===,16176403
The commercial and print advertisements were launched on June 17.,15,45,== Other ventures == | === Endorsements ===,16176403
"Moreover, members Park Gyuri, Goo Hara and Kang Jiyoung became the female models for Korean cosmetic brand ""Nature Republic"".",16,45,== Other ventures == | === Endorsements ===,16176403
"The three members started their exclusive activities with Nature Republic on June 3, 2011.",17,45,== Other ventures == | === Endorsements ===,16176403
"On March 15, the group announced the release of their own figure dolls created with the ""Mister"" theme making them the first girl group launch their own toy-brand based upon themselves.",18,45,== Other ventures == | === Endorsements ===,16176403
The dolls were sold in South Korea and Japan.,19,45,== Other ventures == | === Endorsements ===,16176403
"They were produced by professionals from Hot Toys, DC Comics, Nokia, and Enterbay.",20,45,== Other ventures == | === Endorsements ===,16176403
"This also marked the first time that a doll-based on South Korean idol group has been released because in the past, figures were created for celebrities in Korea, namely actors.",21,45,== Other ventures == | === Endorsements ===,16176403
"On June 18, 2012, the group released their own premium fragrance line called ""K5J"", an acronym for ""Kara 5 Jewel"" and members participated in the development of the perfume from the beginning.",22,45,== Other ventures == | === Endorsements ===,16176403
The fragrance is a special gift for the fans and to bring them even closer together.,23,45,== Other ventures == | === Endorsements ===,16176403
"The perfume was created in Paris in partnership with 3CY, a premium Asian lifestyle brand.",24,45,== Other ventures == | === Endorsements ===,16176403
"The perfume also went on sales at 1,200 offline stores in Japan.",25,45,== Other ventures == | === Endorsements ===,16176403
"On August 29, 2012, DSP revealed that the group has been selected as the ambassadors to bring awareness to K-Food by the MAF and the aT Korea Agro-Fisheries Trade Corporation.",26,45,== Other ventures == | === Endorsements ===,16176403
"Their advertisement campaign was distributed in China, Japan, and as well as Southeast Asia.",27,45,== Other ventures == | === Endorsements ===,16176403
===,0,46,== Other ventures == | === Solo activities ===,16176403
Solo activities ===,1,46,== Other ventures == | === Solo activities ===,16176403
"On January 16, 2012, it was announced that the members of the group will each release their own solo material for their concerts in February.",0,47,== Other ventures == | === Solo activities ===,16176403
"Park Gyuri's song entitled ""Daydream"", Han Seung-yeon's song entitled ""Guilty"", Jung Nicole's song entitled ""Lost"" featuring 2AM's Jinwoon, Goo Ha-ra's song entitled ""Secret Love"", and Kang Jiyoung's song entitled ""Wanna Do"" were all performed during their Karasia tour.",1,47,== Other ventures == | === Solo activities ===,16176403
All the songs were released one by one from August 22 to 26.,2,47,== Other ventures == | === Solo activities ===,16176403
"The teasers for all the videos were released on August 31, 2012.",3,47,== Other ventures == | === Solo activities ===,16176403
"The music videos for ""Daydream"" and ""Secret Love"" were released on September 1, 2012.",4,47,== Other ventures == | === Solo activities ===,16176403
"The music videos for ""Lost"" and ""Wanna Do"" were released on September 3, 2012.",5,47,== Other ventures == | === Solo activities ===,16176403
"The next day, the music video for ""Guilty"" was released.",6,47,== Other ventures == | === Solo activities ===,16176403
The songs were included in their compilation album entitled Kara Collection.,7,47,== Other ventures == | === Solo activities ===,16176403
==,0,48,== Controversy ==,16176403
Controversy ==,1,48,== Controversy ==,16176403
===,0,49,== Controversy == | === Request for contract termination ===,16176403
Request for contract termination =,1,49,== Controversy == | === Request for contract termination ===,16176403
==,2,49,== Controversy == | === Request for contract termination ===,16176403
"On January 19, 2011, a lawyer representing four of the five Kara members announced to the media that they would be terminating their contract with DSP Entertainment, effective immediately; a lawsuit was also filed on their behalf.",0,50,== Controversy == | === Request for contract termination ===,16176403
"Park Gyuri, the leader of the group, was the only one remaining with their management company.",1,50,== Controversy == | === Request for contract termination ===,16176403
"In one statement, the lawyer representing the four stated that ""the company repeatedly denied any requests and unilaterally forced tasks upon the members"", and that they have been preparing for legal action for two months.",2,50,== Controversy == | === Request for contract termination ===,16176403
"Later that day, it was announced that Goo Hara would discontinue her involvement with the lawsuit and has rejoined the company, as she apparently was not fully aware of the lawsuit's details.",3,50,== Controversy == | === Request for contract termination ===,16176403
"In a statement, DSP Entertainment firmly rebutted all accusations, also stating that they wished to resolve the issues and reconcile with the members quickly.",4,50,== Controversy == | === Request for contract termination ===,16176403
"DSP also denied earlier reports of denying Kara members their fair share of profits, stating that each member was paid ₩300,000,000 for their work.",5,50,== Controversy == | === Request for contract termination ===,16176403
The lawyer for the three remaining members released another statement giving further details of their allegations.,6,50,== Controversy == | === Request for contract termination ===,16176403
"Their representatives stated that they were misinformed regarding their Japanese promotions, and that their relationship with the company severely deteriorated with the hospitalization of CEO Lee Ho-yeon in March 2010.",7,50,== Controversy == | === Request for contract termination ===,16176403
"On April 28, 2011, the dispute between DSP Entertainment and Kara's 3 members (Han Seung-yeon, Nicole Jung, Kang Ji-young) was finally resolved.",8,50,== Controversy == | === Request for contract termination ===,16176403
"But two years later, in October 2013, DSP released statement that Nicole would not be renewing her contract with DSP Media upon its termination in January 2014.",9,50,== Controversy == | === Request for contract termination ===,16176403
"Seungyeon, Gyuri and Hara all renewed their contracts for a further two years, and Jiyoung is taking her time to decide whether or not to study abroad, as her contract doesn't end until April 2014.",10,50,== Controversy == | === Request for contract termination ===,16176403
"However, it was confirmed later on by Nicole through her Twitter account that they are still in the midst of discussing and resolving the contract issues as Nicole still wants to work as a member of KARA while managed by a different agency.",11,50,== Controversy == | === Request for contract termination ===,16176403
"Alongside Nicole's contract issue, DSP Media however has revealed that ""Because Kang Ji Young contract expires in April next year, she has decided to think over her future.""",12,50,== Controversy == | === Request for contract termination ===,16176403
An exclusive report from news outlet OSEN however had shed a bit more light regarding her circumstances with the news outlet claiming that Kang Ji Young was leaning towards making a decision to go abroad to study.,13,50,== Controversy == | === Request for contract termination ===,16176403
"The report claimed that while she wasn't outright saying that she wanted to leave the group, she had stated that she needed a certain amount of time to rest.",14,50,== Controversy == | === Request for contract termination ===,16176403
"On January 14, Jiyoung had officially made her decision to leave Kara once her contract expires in April 2014.",15,50,== Controversy == | === Request for contract termination ===,16176403
"Jiyoung's father stated that it will be difficult, but is necessary for Jiyoung so she may leave DSP to pursue her dreams.",16,50,== Controversy == | === Request for contract termination ===,16176403
===,0,51,== Controversy == | === Rumor of North Korea connection ===,16176403
Rumor of North Korea connection ===,1,51,== Controversy == | === Rumor of North Korea connection ===,16176403
"On February 2, 2012, DSP Media refuted accusations that the man who followed Kara during their time in Japan was a Chongryon-affiliated North Korean agent but was actually their schedule manager.",0,52,== Controversy == | === Rumor of North Korea connection ===,16176403
==,0,53,== Members ==,16176403
Members ==,1,53,== Members ==,16176403
"First Lineup (2007–2008): Gyuri, Seungyeon, Sunghee, Nicole",0,54,== Members ==,16176403
"Second Lineup (2008–2014): Gyuri, Seungyeon, Nicole, Hara, Jiyoung",0,55,== Members ==,16176403
"Third Lineup (2014–2016): Gyuri, Seungyeon, Hara, Youngji",0,56,== Members ==,16176403
===,0,57,== Members == | === Timeline ===,16176403
Timeline =,1,57,== Members == | === Timeline ===,16176403
==,2,57,== Members == | === Timeline ===,16176403
Black (vertical) = studio album,0,58,== Members == | === Timeline ===,16176403
==,0,59,== Discography ==,16176403
Discography ==,1,59,== Discography ==,16176403
Korean albums,0,60,== Discography ==,16176403
The First Blooming (2007),0,61,== Discography ==,16176403
Revolution (2009),0,62,== Discography ==,16176403
Step (2011),0,63,== Discography ==,16176403
Full Bloom (2013)Japanese albums,0,64,== Discography ==,16176403
Girl's Talk (2010),0,65,== Discography ==,16176403
Super Girl (2011),0,66,== Discography ==,16176403
Girls Forever (2012),0,67,== Discography ==,16176403
Fantastic Girls (2013),0,68,== Discography ==,16176403
Girl's Story (2015),0,69,== Discography ==,16176403
==,0,70,== Tours ==,16176403
Tours ==,1,70,== Tours ==,16176403
"Karasia – Includes Kara's first concert tour in 2012, as well as their second, third and fourth tour also titled Karasia in 2013, 2014 and 2015 (2012–15)",0,71,== Tours ==,16176403
==,0,72,== Awards and achievements ==,16176403
Awards and achievements ==,1,72,== Awards and achievements ==,16176403
