sentences,sentenceIndex,paragraphIndex,section,wikiId
The group began their weekly promotion cycles starting from MBC's Show!,6,21,"== History == | === 2010: Lupin, Japanese debut, and Girl's Talk ===",16176403
"Music Core on November 20, 2010.",7,21,"== History == | === 2010: Lupin, Japanese debut, and Girl's Talk ===",16176403
"On December 10, the group eventually got their fourth number one win on KBS's Music Bank for ""Jumping"".",8,21,"== History == | === 2010: Lupin, Japanese debut, and Girl's Talk ===",16176403
"Two days after their win on Music Bank, the group won the Mutizen award for ""Jumping"" on SBS's Inkigayo's 600th episode.",9,21,"== History == | === 2010: Lupin, Japanese debut, and Girl's Talk ===",16176403
"After a very successful year in Japan, the group was chosen as the Best Rookie Artist according to a popular Japanese mobile ringtone site, Recochoku.",10,21,"== History == | === 2010: Lupin, Japanese debut, and Girl's Talk ===",16176403
"On December 20, 2010, Oricon also announced the group as 2010's Best Rookie Artist, generating revenue to some 1.3 billion yen (or US$15.4 million); and with a total of 493,000 copies of their releases sold this year.",11,21,"== History == | === 2010: Lupin, Japanese debut, and Girl's Talk ===",16176403
"=== 2011: Rise in popularity in Japan, Step, and Super Girl ===",0,22,"== History == | === 2011: Rise in popularity in Japan, Step, and Super Girl ===",16176403
"On February 23, 2011, the group released a DVD called Kara Best Clips, which is a compilation of their past music videos.",0,23,"== History == | === 2011: Rise in popularity in Japan, Step, and Super Girl ===",16176403
"After one week, the group was able to set a record when they ranked number one in the Oricon’s Weekly Composite DVD Chart for two weeks.",1,23,"== History == | === 2011: Rise in popularity in Japan, Step, and Super Girl ===",16176403
This made them the first ever foreign artist to be number one for two consecutive weeks since the charts implementation in 1999.,2,23,"== History == | === 2011: Rise in popularity in Japan, Step, and Super Girl ===",16176403
"The DVD has sold approximately 230,183 copies.",3,23,"== History == | === 2011: Rise in popularity in Japan, Step, and Super Girl ===",16176403
"On April 6, 2011, the group released their third Japanese single, ""Jet Coaster Love"", after the original release date was pushed back due to the 2011 Tōhoku earthquake and tsunami.",4,23,"== History == | === 2011: Rise in popularity in Japan, Step, and Super Girl ===",16176403
"The single debuted at number one on Oricon's Weekly Singles Chart with 122,820 copies sold on its first week.",5,23,"== History == | === 2011: Rise in popularity in Japan, Step, and Super Girl ===",16176403
It also peaked at number two on Billboard's Japan Hot 100.,6,23,"== History == | === 2011: Rise in popularity in Japan, Step, and Super Girl ===",16176403
"Despite its success, plans for promotion in Japan were hindered due to the natural disaster.",7,23,"== History == | === 2011: Rise in popularity in Japan, Step, and Super Girl ===",16176403
"Instead, the group announced that all proceeds from the single will be donated to Japan's natural disaster relief aid.",8,23,"== History == | === 2011: Rise in popularity in Japan, Step, and Super Girl ===",16176403
"On June 22, the group released their fourth Japanese single, ""Go Go Summer!"".",9,23,"== History == | === 2011: Rise in popularity in Japan, Step, and Super Girl ===",16176403
"The single debuted at number two on Oricon's Weekly Singles Chart with sales of 113,873 copies sold on its first week.",10,23,"== History == | === 2011: Rise in popularity in Japan, Step, and Super Girl ===",16176403
"The song became the group's second single to sell over 100,000 copies on its first week.",11,23,"== History == | === 2011: Rise in popularity in Japan, Step, and Super Girl ===",16176403
"On August 4, 2011, the group officially announced that they will be releasing their third official album in mid-September and will resume their activities in South Korea for the first time in over six months.",0,24,"== History == | === 2011: Rise in popularity in Japan, Step, and Super Girl ===",16176403
"According to industry representatives, the group has used some of their spare time recording songs for the album while they were busy promoting their fourth Japanese single, ""Go Go Summer!"".",1,24,"== History == | === 2011: Rise in popularity in Japan, Step, and Super Girl ===",16176403
"However, the group would only promote in Korea for about three weeks as they have many things scheduled in Japan.",2,24,"== History == | === 2011: Rise in popularity in Japan, Step, and Super Girl ===",16176403
"The group eventually released their third Korean studio album titled Step, on September 6.",3,24,"== History == | === 2011: Rise in popularity in Japan, Step, and Super Girl ===",16176403
"The album's title song, ""Step"", immediately topped various music charts in South Korea hours after its release.",4,24,"== History == | === 2011: Rise in popularity in Japan, Step, and Super Girl ===",16176403
The song peaked at number two on Gaon's Weekly Singles Chart and number two Billboard's Korea K-Pop Hot 100.,5,24,"== History == | === 2011: Rise in popularity in Japan, Step, and Super Girl ===",16176403
"The group won first place on M! Countdown on September 15 and Music Bank on September 16, holding onto both positions for two consecutive weeks.",6,24,"== History == | === 2011: Rise in popularity in Japan, Step, and Super Girl ===",16176403
The song also won first place on Ingikayo on September 25.,7,24,"== History == | === 2011: Rise in popularity in Japan, Step, and Super Girl ===",16176403
"By the end of 2011, the album has sold over 100,000 copies in South Korea.",8,24,"== History == | === 2011: Rise in popularity in Japan, Step, and Super Girl ===",16176403
"After the group finished their promotions in South Korea, they returned to Japan to release their fifth Japanese single, ""Winter Magic"", on October 19.",9,24,"== History == | === 2011: Rise in popularity in Japan, Step, and Super Girl ===",16176403
"The single ranked at number three on Oricon's Weekly Singles Chart with around 79,000 copies sold in the first week.",10,24,"== History == | === 2011: Rise in popularity in Japan, Step, and Super Girl ===",16176403
"On November 21, the group released their second Japanese studio album, Super Girl, which included all their Japanese singles released that year.",11,24,"== History == | === 2011: Rise in popularity in Japan, Step, and Super Girl ===",16176403
"The album received over 360,000 pre-orders alone.",12,24,"== History == | === 2011: Rise in popularity in Japan, Step, and Super Girl ===",16176403
"The album eventually went on to debut at number one on Oricon's Weekly Album Chart with sales of 275,206 copies sold, making it the group's first number one album in Japan.",13,24,"== History == | === 2011: Rise in popularity in Japan, Step, and Super Girl ===",16176403
"With it, the group broke the record set by The Nolans, becoming the first foreign female group in thirty years to top both the singles and albums rankings.",14,24,"== History == | === 2011: Rise in popularity in Japan, Step, and Super Girl ===",16176403
"The album was eventually certified triple platinum by the RIAJ with sales exceeding 750,000 copies.",15,24,"== History == | === 2011: Rise in popularity in Japan, Step, and Super Girl ===",16176403
"After a busy year, the group celebrated their success by appearing on six major end-show programs in Japan.",16,24,"== History == | === 2011: Rise in popularity in Japan, Step, and Super Girl ===",16176403
"Among these were the 53rd annual Japanese Record Awards after ""Go Go Summer!""",17,24,"== History == | === 2011: Rise in popularity in Japan, Step, and Super Girl ===",16176403
"was nominated in the category for ""Best Song"".",18,24,"== History == | === 2011: Rise in popularity in Japan, Step, and Super Girl ===",16176403
"They were also invited to the prestigious 62nd Kōhaku Uta Gassen, which is held annually at the end of the year, marking the group's first appearance on the program.",19,24,"== History == | === 2011: Rise in popularity in Japan, Step, and Super Girl ===",16176403
"They opened the second half of the program by performing a special medley of ""Jet Coaster Love"" and ""Mister"".",20,24,"== History == | === 2011: Rise in popularity in Japan, Step, and Super Girl ===",16176403
"Oricon also ranked the group at number four on the ""Top 5 Best Selling Artists of the Year"" in 2011 with fellow South Korean idol group Girls' Generation following closely at number five.",21,24,"== History == | === 2011: Rise in popularity in Japan, Step, and Super Girl ===",16176403
"On December 30, DSP announced that the group will embark on their first concert titled, Karasia, in early 2012.",22,24,"== History == | === 2011: Rise in popularity in Japan, Step, and Super Girl ===",16176403
"Expectation for the group's first concert has risen since they are among the most successful girl groups in South Korea alongside Girls' Generation, 2NE1 and Wonder Girls.",23,24,"== History == | === 2011: Rise in popularity in Japan, Step, and Super Girl ===",16176403
===,0,25,"== History == | === 2012: Karasia, Pandora, and Girls Forever ===",16176403
2012:,1,25,"== History == | === 2012: Karasia, Pandora, and Girls Forever ===",16176403
"Karasia, Pandora, and Girls",2,25,"== History == | === 2012: Karasia, Pandora, and Girls Forever ===",16176403
Forever ===,3,25,"== History == | === 2012: Karasia, Pandora, and Girls Forever ===",16176403
"On January 11, 2012, the group attended the Golden Disk Awards which was held in Osaka, where they won two awards; ""Disk Bonsang"" and ""Best Hallyu Star Award"".",0,26,"== History == | === 2012: Karasia, Pandora, and Girls Forever ===",16176403
"On January 18, the group was awarded with the ""Asia Star Award"" at the 7th Asia Model Awards Ceremony.",1,26,"== History == | === 2012: Karasia, Pandora, and Girls Forever ===",16176403
The prize is a special honor only given to entertainers who played a pivotal role in spreading Asian culture throughout the world for a given year.,2,26,"== History == | === 2012: Karasia, Pandora, and Girls Forever ===",16176403
The group was selected as the winner of the prize for the considerable achievement they've earned during the year of 2011 as one of the most favored Hallyu stars.,3,26,"== History == | === 2012: Karasia, Pandora, and Girls Forever ===",16176403
"On January 19, the group attended the Seoul Music Awards and were awarded the ""Hallyu Special Award"" and ""Bonsang Award"".",4,26,"== History == | === 2012: Karasia, Pandora, and Girls Forever ===",16176403
"On January 27, the RIAJ held the 26th annual Japan Gold Disc Awards ceremony, where the group was honored in five categories including ""Best Asian Artist"", ""Best 3 Asian Albums"" for Girl's Talk, ""Song of the Year by Download""  and ""Best 5 Songs by Download"" for ""Jumping"", and ""Best Music Video"" for Kara Best Clips.",5,26,"== History == | === 2012: Karasia, Pandora, and Girls Forever ===",16176403
"The group also received the GCS International Grand Award: ""Korea-based Global Social Movement Proposed and Initiated"" because of their donations to Japan's tsunami and earthquake relief.",6,26,"== History == | === 2012: Karasia, Pandora, and Girls Forever ===",16176403
"On February 18, 2012, the group embarked on their first headlining Asian tour, Karasia.",7,26,"== History == | === 2012: Karasia, Pandora, and Girls Forever ===",16176403
"They held their first solo concert at Seoul Olympic Park on February 18, and held another concert there on the 19th.",8,26,"== History == | === 2012: Karasia, Pandora, and Girls Forever ===",16176403
The tour extended into Japan for twelve shows beginning on April 14 in Yokohama.,9,26,"== History == | === 2012: Karasia, Pandora, and Girls Forever ===",16176403
"On May 27, the group successfully concluded their first Japanese tour in Saitama.",10,26,"== History == | === 2012: Karasia, Pandora, and Girls Forever ===",16176403
"The tour drew around 150,000 people.",11,26,"== History == | === 2012: Karasia, Pandora, and Girls Forever ===",16176403
with every single seat for each concert being sold.,12,26,"== History == | === 2012: Karasia, Pandora, and Girls Forever ===",16176403
"The last concert was broadcast live through streaming in sixty different theaters throughout Japan, and all the tickets to the theaters were sold out as well.",13,26,"== History == | === 2012: Karasia, Pandora, and Girls Forever ===",16176403
"On February 29, 2012, the group became the first foreign artist to seize the top spot of two different categories on Oricon; the DVD and Blu-ray Disc ranking charts following the release of Kara Best Clips II & Shows.",14,26,"== History == | === 2012: Karasia, Pandora, and Girls Forever ===",16176403
"The group also became the fifth artist in Japan to achieve this record after Namie Amuro, AKB48, Mr. Children, and Radwimps.",15,26,"== History == | === 2012: Karasia, Pandora, and Girls Forever ===",16176403
"On March 21, the group released their sixth Japanese single and first double A-side single, ""Speed Up / Girl's Power"".",16,26,"== History == | === 2012: Karasia, Pandora, and Girls Forever ===",16176403
"The single debuted at number two on Oricon's Weekly Singles Chart with sales of 99,236 copies sold on its first week.",17,26,"== History == | === 2012: Karasia, Pandora, and Girls Forever ===",16176403
"On April 13, following the gold certification of their sixth Japanese single for sales exceeding 100,000 copies, it was reported that the group had sold more than one million physical copies of their singles in Japan, making them the third South Korean artist to do so after BoA and TVXQ.",18,26,"== History == | === 2012: Karasia, Pandora, and Girls Forever ===",16176403
"On July 14, 2012, the group performed at the MTV World Stage in Malaysia.",19,26,"== History == | === 2012: Karasia, Pandora, and Girls Forever ===",16176403
"They were one of the four acts including Justin Bieber, Jay Park, and Malaysian singer Mizz Nina.",20,26,"== History == | === 2012: Karasia, Pandora, and Girls Forever ===",16176403
"On August 3, 2012, DSP announced that the group are set to release their fifth mini-album in South Korea at the end of August and will be aiming to show their matured charms through its concept.",21,26,"== History == | === 2012: Karasia, Pandora, and Girls Forever ===",16176403
"On August 6, their agency revealed the album's title, Pandora, based on Greek mythology.",22,26,"== History == | === 2012: Karasia, Pandora, and Girls Forever ===",16176403
"They explained that the girls will be ""reinterpreting the myth to express the most captivating and beautiful woman of this generation"".",23,26,"== History == | === 2012: Karasia, Pandora, and Girls Forever ===",16176403
"From August 13 onwards, teasers featuring each of the members were released on consecutive days, starting with Jiyoung, then Hara, Gyuri, Nicole, then Seungyeon.",24,26,"== History == | === 2012: Karasia, Pandora, and Girls Forever ===",16176403
"On August 20, a group teaser was released.",25,26,"== History == | === 2012: Karasia, Pandora, and Girls Forever ===",16176403
"The mini-album along with the music video for the title track, ""Pandora"", was released on August 22.",26,26,"== History == | === 2012: Karasia, Pandora, and Girls Forever ===",16176403
A showcase was held on the same day and was streamed live worldwide.,27,26,"== History == | === 2012: Karasia, Pandora, and Girls Forever ===",16176403
"Hours after release, the album's title track topped various music charts in Korea.",28,26,"== History == | === 2012: Karasia, Pandora, and Girls Forever ===",16176403
"The song peaked at number two on Gaon's Weekly Singles chart and number three on Billboard's Korea K-Pop Hot 100, and was voted the most popular song in the month of August on Melon.",29,26,"== History == | === 2012: Karasia, Pandora, and Girls Forever ===",16176403
"On August 28, the group won their first award on Show Champion.",30,26,"== History == | === 2012: Karasia, Pandora, and Girls Forever ===",16176403
"On September 7, the group won an award on Music Bank, and on September 13, they won an award on M! Countdown.",31,26,"== History == | === 2012: Karasia, Pandora, and Girls Forever ===",16176403
"By the end of September 2012, the mini-album has sold over 70,000 copies.",32,26,"== History == | === 2012: Karasia, Pandora, and Girls Forever ===",16176403
"On September 5, 2012, the group released a special album entitled Kara Collection in Japan.",33,26,"== History == | === 2012: Karasia, Pandora, and Girls Forever ===",16176403
"The album includes the members' solo songs performed on their first tour, Karasia, in Japanese.",34,26,"== History == | === 2012: Karasia, Pandora, and Girls Forever ===",16176403
"The album debuted at number three on Oricon's Weekly Albums Chart with debut sales of 47,533 copies sold on its first week.",35,26,"== History == | === 2012: Karasia, Pandora, and Girls Forever ===",16176403
"On October 17, the group released their seventh Japanese single, ""Electric Boy"".",36,26,"== History == | === 2012: Karasia, Pandora, and Girls Forever ===",16176403
"The single debuted at number two on Oricon's Weekly Singles Chart with sales of 57,942 copies sold on its first week.",37,26,"== History == | === 2012: Karasia, Pandora, and Girls Forever ===",16176403
"On October 29, the group achieved their first number one single on Billboard's Japan Hot 100 when ""Electric Boy"" jumped to the top position.",38,26,"== History == | === 2012: Karasia, Pandora, and Girls Forever ===",16176403
The single has been certified gold by the RIAJ.,39,26,"== History == | === 2012: Karasia, Pandora, and Girls Forever ===",16176403
"In the same month, DSP announced the release of the group's third Japanese album, Girls Forever, which was released on November 14.",40,26,"== History == | === 2012: Karasia, Pandora, and Girls Forever ===",16176403
"The album included the singles ""Speed Up / Girl's Power"" and ""Electric Boy"" as well as the 2012 versions of the singles from their previous album.",41,26,"== History == | === 2012: Karasia, Pandora, and Girls Forever ===",16176403
"It debuted on Oricon's Weekly Album Chart at number two with first week sales of 73,224 copies.",42,26,"== History == | === 2012: Karasia, Pandora, and Girls Forever ===",16176403
"DSP also announced that the group will hold a concert in the Tokyo Dome on January 6, 2013.",43,26,"== History == | === 2012: Karasia, Pandora, and Girls Forever ===",16176403
This makes the group the first female South Korean act to hold a concert at this particular venue.,44,26,"== History == | === 2012: Karasia, Pandora, and Girls Forever ===",16176403
"On December 14, 2012, Kara released a short version of Orion.",45,26,"== History == | === 2012: Karasia, Pandora, and Girls Forever ===",16176403
"The full version was released on December 17, 2012.",46,26,"== History == | === 2012: Karasia, Pandora, and Girls Forever ===",16176403
===,0,27,== History == | === 2013: Fantastic Girls and Full Bloom ===,16176403
2013:,1,27,== History == | === 2013: Fantastic Girls and Full Bloom ===,16176403
Fantastic Girls and Full Bloom =,2,27,== History == | === 2013: Fantastic Girls and Full Bloom ===,16176403
==,3,27,== History == | === 2013: Fantastic Girls and Full Bloom ===,16176403
"On January 6, Kara held a special New Years concert at Tokyo Dome in Japan, titled ""Karasia 2013 Happy New Year in Tokyo Dome"".",0,28,== History == | === 2013: Fantastic Girls and Full Bloom ===,16176403
"The concert was successful, selling out all 45,000 tickets within five minutes and became the first Korean girl group to hold a concert at the Tokyo Dome.",1,28,== History == | === 2013: Fantastic Girls and Full Bloom ===,16176403
"During the concert, the group announced that there will be an anime series from the girl group, entitled ""KARA the Animation,"" and it is expected to air in early 2013.",2,28,== History == | === 2013: Fantastic Girls and Full Bloom ===,16176403
The show depicted the animated version of the members.,3,28,== History == | === 2013: Fantastic Girls and Full Bloom ===,16176403
"On March 1, the anime series premiered, which featured five 27 minute episodes about each of the members pursuing different careers.",4,28,== History == | === 2013: Fantastic Girls and Full Bloom ===,16176403
Two feature Jiyoung as a firefighter and Nicole as a captain of a ship.,5,28,== History == | === 2013: Fantastic Girls and Full Bloom ===,16176403
The show aired in Japan and South Korea.,6,28,== History == | === 2013: Fantastic Girls and Full Bloom ===,16176403
"On March 27, Kara  released their 8th Japanese single titled ""Bye Bye Happy Days!"".",0,29,== History == | === 2013: Fantastic Girls and Full Bloom ===,16176403
"The single debuted at number 2 on the Oricon Weekly Single Chart, with sales of 65,588.",1,29,== History == | === 2013: Fantastic Girls and Full Bloom ===,16176403
"On June 23, KARA held their 2nd Japanese fan-meeting called 'Kamilia School' at the Yokohama Arena on the 23rd with total 24,000 Fans attendees.",0,30,== History == | === 2013: Fantastic Girls and Full Bloom ===,16176403
"Kara transformed into professors and split up the meeting into three educational sessions focusing on music, art, and language.",1,30,== History == | === 2013: Fantastic Girls and Full Bloom ===,16176403
"On July 24, the group released their ninth Japanese single titled ""Thank You Summer Love"".",0,31,== History == | === 2013: Fantastic Girls and Full Bloom ===,16176403
"It was announced on July 29 that the group's fourth Japanese album, Fantastic Girls, will be released August 28.",1,31,== History == | === 2013: Fantastic Girls and Full Bloom ===,16176403
"On August 16, it was announced that the group will be releasing their fourth South Korean full-length album with a title-track called ""Damaged Lady (숙녀가 못 돼)"", on September 2.",2,31,== History == | === 2013: Fantastic Girls and Full Bloom ===,16176403
Teaser pictures show each member wearing formal androgynous attire.,3,31,== History == | === 2013: Fantastic Girls and Full Bloom ===,16176403
"The album's first single, ""Runaway"", was released ahead of the album on August 21.",4,31,== History == | === 2013: Fantastic Girls and Full Bloom ===,16176403
The music video for the song contained scenes from the group's upcoming Korean drama titled Secret Love.,5,31,== History == | === 2013: Fantastic Girls and Full Bloom ===,16176403
The group will be holding an album showcase at UNIQLO-AX Hall to celebrate its release and will be live streamed on Naver.,6,31,== History == | === 2013: Fantastic Girls and Full Bloom ===,16176403
"On August 22, a photo album was uploaded on the group's Facebook page titled 'Princesses' showing each member in white feminine dresses and unveiling the title of the album to be Full Bloom.",7,31,== History == | === 2013: Fantastic Girls and Full Bloom ===,16176403
"The following day, another photo album was uploaded titled 'Queens' where the members can be seen wearing tiaras and unveiling the English name of the promotional track as ""Damaged Lady"".",8,31,== History == | === 2013: Fantastic Girls and Full Bloom ===,16176403
"On October 19, the group received the Best Female Group Award at the Korean Entertainment 10th Anniversary Awards.",9,31,== History == | === 2013: Fantastic Girls and Full Bloom ===,16176403
===,0,32,"== History == | === 2014–2015: Second line-up changes, Day & Night, In Love and Girl's Story ===",16176403
2014–2015:,1,32,"== History == | === 2014–2015: Second line-up changes, Day & Night, In Love and Girl's Story ===",16176403
"Second line-up changes, Day & Night, In Love and Girl's Story =",2,32,"== History == | === 2014–2015: Second line-up changes, Day & Night, In Love and Girl's Story ===",16176403
==,3,32,"== History == | === 2014–2015: Second line-up changes, Day & Night, In Love and Girl's Story ===",16176403
"On January 13, 2014, it was announced that Nicole would be withdrawing from the group due to the expiration of her contract with DSP Media.",0,33,"== History == | === 2014–2015: Second line-up changes, Day & Night, In Love and Girl's Story ===",16176403
"Then on January 15, it was announced that Jiyoung would also leave the group after her contract expired in April 2014.",1,33,"== History == | === 2014–2015: Second line-up changes, Day & Night, In Love and Girl's Story ===",16176403
"The group then reorganized with Gyuri, Seungyeon, and Hara as a trio who would be carrying on future schedules.",2,33,"== History == | === 2014–2015: Second line-up changes, Day & Night, In Love and Girl's Story ===",16176403
"In May 2014, DSP Media launched a reality TV show called Kara Project which revolves around seven trainees (including former members of DSP's group Puretty) who will compete to become future members of the group.",3,33,"== History == | === 2014–2015: Second line-up changes, Day & Night, In Love and Girl's Story ===",16176403
"On July 1, the live voting results commenced on 6:45 pm (KST).",4,33,"== History == | === 2014–2015: Second line-up changes, Day & Night, In Love and Girl's Story ===",16176403
"Heo Youngji was proclaimed the winner with a total score of 49,591.",5,33,"== History == | === 2014–2015: Second line-up changes, Day & Night, In Love and Girl's Story ===",16176403
"The group's drama series, titled Secret Love, first aired on June 13, 2014, at DRAMAcube and ran for six weeks.",6,33,"== History == | === 2014–2015: Second line-up changes, Day & Night, In Love and Girl's Story ===",16176403
