sentences,sentenceIndex,paragraphIndex,section,wikiId
"Jovan Ćulibrk (Serbian Cyrillic: Јован Ћулибрк; born 16 April 1965), is a Serbian Orthodox prelate who is the current bishop of Pakrac and Slavonia of the Serbian Orthodox Church, from 2014.",0,0,N/A,65793125
"Before that, he was titular bishop of Lipljan between 1999 and 2014.",1,0,N/A,65793125
Ćulibrk was an active music critic and author about rock and roll and pop culture.,2,0,N/A,65793125
==,0,1,== Early life and education ==,65793125
Early life and education,1,1,== Early life and education ==,65793125
==,2,1,== Early life and education ==,65793125
"Jovan was born as Neven Ćulibrk (Serbian Cyrillic: Невен Ћулибрк) on 16 April 1965, in Zenica, SR Bosnia and Herzegovina, Yugoslavia (now in Bosnia and Herzegovina).",0,2,== Early life and education ==,65793125
He finished elementary school and a high school in Bosanska Gradiška.,1,2,== Early life and education ==,65793125
"Ćulibrk studied literature in Banja Luka, then literature and South Slavic languages at the Faculty of Philosophy University of Zagreb, from which he graduated in 1991 with a thesis on the work of Miloš Crnjanski.",2,2,== Early life and education ==,65793125
His work on Crnjanski was awarded with the Branko Award by Matica Srpska.,3,2,== Early life and education ==,65793125
"Hereupon, he studied theology at the University of Belgrade and at the Faculty of Orthodox Theology in Foča, Bosnia and Herzegovina where he graduated with a work on Nikon the Jerusalemite.",4,2,== Early life and education ==,65793125
"Afterwards, Ćulibrk attended postgraduate studies on Jewish culture at the Yad Vashem and at the Hebrew University of Jerusalem.",5,2,== Early life and education ==,65793125
"He defended his master's degree thesis under the guidance of David Bankier, head of the International Institute for Holocaust Research in Yad Vashem.",6,2,== Early life and education ==,65793125
"In 2004, he was awarded Golda Meir Award.",7,2,== Early life and education ==,65793125
"In the 1980s, Ćulibrk was an active rock critic, interested in contemporary art, and published a number of essays and articles about pop culture and rock and roll.",8,2,== Early life and education ==,65793125
"He speaks English, Russian, Yiddish and uses German, Greek and several Slavic languages.",9,2,== Early life and education ==,65793125
==,0,3,== Monasticism ==,65793125
Monasticism ==,1,3,== Monasticism ==,65793125
"In 1991, Ćulibrk entered the Savina Monastery as a novice.",0,4,== Monasticism ==,65793125
"In 1992, he moved to the Cetinje Monastery.",1,4,== Monasticism ==,65793125
"On the eve of Nativity of John the Baptist in 1993, he was tonsured a monk there, receiving the monastic name of Jovan (from Church Slavonic: Їωан).",2,4,== Monasticism ==,65793125
"From 1993 to 2003, Jovan lectured on Serbian and Slovene literature, general history, and was also the secretary of Theological Seminary of St. Peter of Cetinje.",3,4,== Monasticism ==,65793125
"On 31 October 1995 in the Stanjevići Monastery, Budva Metropolitan bishop Amfilohije Radović of Montenegro and the Littoral ordained him as a hierodeacon.",4,4,== Monasticism ==,65793125
"On 16 June 1997, he was ordained hieromonk.",5,4,== Monasticism ==,65793125
"In 1997, Jovan was appointed monk of Moračnik Monastery, Moračnik Island.",6,4,== Monasticism ==,65793125
He worked on the renovation of churches and monasteries on Lake Skadar.,7,4,== Monasticism ==,65793125
"In 1998, he participated in the creation of the Radio Svetigora, the first radio channel of the Serbian Orthodox Church, and since then has remained its employee.",8,4,== Monasticism ==,65793125
"Since June 1999, Jovan has been at the Patriarchate of Peć in Kosovo and Metochia.",9,4,== Monasticism ==,65793125
He supervised the Church relations with the KFOR and United Nations Interim Administration Mission in Kosovo.,10,4,== Monasticism ==,65793125
"He worked for the salvation of religious objects, refugee protection, calculating and determining the number of victims, wounded, lost, expelled and working on the documentation of the suffering of Serbs civilians.",11,4,== Monasticism ==,65793125
"In January 2001, Jovan visited Israel, as a member of the Yugoslavia State Delegation, and prestented his viewpoints on the Kosovo Question.",12,4,== Monasticism ==,65793125
"In the same year, this connection went to Italy to build cooperation with Italian institutions for the protection of the heritage of the Serbian Orthodox Church in Kosovo and Metochia.",13,4,== Monasticism ==,65793125
"During the 2000s, Jovan served at a number of temples and monasteries in the Holy Land, including Sarandar Monastery on Mount of Temptation.",14,4,== Monasticism ==,65793125
"In the early 2000s, Jovan contributed to the efforts of the Serbian Orthodox Church for the rehabilitation of Nikolaj Velimirović, a controversial figure due to his extensive anti-Semitic rhetoric in the 1930s.",15,4,== Monasticism ==,65793125
Jovan has faced criticism by some authors for not addressing antisemitism within the Church and the work of Velimirović.,16,4,== Monasticism ==,65793125
"He organised and led the project of adapting poems written by Nikolaj Velimirović into rock music album, titled Pesme iznad istoka",17,4,== Monasticism ==,65793125
"i zapada (Songs beyond East and West), which gathered a number of Serbian and Yugoslav rock bands.",18,4,== Monasticism ==,65793125
"In 2004, he was awarded Golda Meir Award and in 2020 he was awarded the Israeli order ""Knight of Ladino"".",19,4,== Monasticism ==,65793125
"On 12 July 2007 in Cetinje, Jovan was erected as Protosyncellus.",20,4,== Monasticism ==,65793125
Jovan has emphasized the necessity for political and military victories of the Bosnian Serb community over that of spiritual victory despite military defeat which other figures in Republika Srpska have emphasized.,0,5,== Monasticism ==,65793125
"According to Ćulibrk, this victory is reflected in the ""cleansing"" of a part of multiethnic Bosnia by the Serb forces.",1,5,== Monasticism ==,65793125
"As such Ćulibrk has claimed that ""Serbian Sarajevo is also the symbol of a town cleansed by fire"".",2,5,== Monasticism ==,65793125
===,0,6,== Monasticism == | === Jasenovac Committee ===,65793125
Jasenovac Committee ===,1,6,== Monasticism == | === Jasenovac Committee ===,65793125
In 2002 participated in the third international conference about Jasenovac concentration camp in Jerusalem.,0,7,== Monasticism == | === Jasenovac Committee ===,65793125
"He led Serbian delegations to international conferences on the Holocaust in 2004, 2006, 2008 and 2010.",1,7,== Monasticism == | === Jasenovac Committee ===,65793125
"In 2006 in Israel, he gave lectures on Breakup of Yugoslavia and interethnic relations at the Vidal Sassoon Center in Jerusalem.",2,7,== Monasticism == | === Jasenovac Committee ===,65793125
"On March 14–15, 2007, as a representative of the Serbian Orthodox Church, he participated in the 6th meeting between Orthodoxy and Judaism at Van Leer Jerusalem Institute.",3,7,== Monasticism == | === Jasenovac Committee ===,65793125
"In his role as the director of the Jasenovac Committee, Jovan has claimed that the Jasenovac concentration camp was the ""worst of all camps and extermination sites in WWII"".",4,7,== Monasticism == | === Jasenovac Committee ===,65793125
Widely developing the work of the Jasenovac Commission of the Serbian Church to promote the worldwide awareness of the Genocide of Serbs.,5,7,== Monasticism == | === Jasenovac Committee ===,65793125
"In 2009, he gave two lectures on Jewish history and culture at the Faculty of Philosophy in Belgrade and he gave lectures again on Jewish culture in Belgrade in 2020.",6,7,== Monasticism == | === Jasenovac Committee ===,65793125
==,0,8,== Titular bishop of Lipljan (2011–2014) ==,65793125
Titular bishop of Lipljan (2011–2014) ==,1,8,== Titular bishop of Lipljan (2011–2014) ==,65793125
"Elected in May 2011, Jovan was consecrated Bishop of Lipljan, a vicar to the Serbian Patriarch, on 4 September.",0,9,== Titular bishop of Lipljan (2011–2014) ==,65793125
The consecration was performed by the Serbian Patriarch Irinej.,1,9,== Titular bishop of Lipljan (2011–2014) ==,65793125
"After three years, he left the position following his election for the bishop of Slavonia.",2,9,== Titular bishop of Lipljan (2011–2014) ==,65793125
==,0,10,== Bishop of Pakrac and Slavonia (2014–present) ==,65793125
Bishop of Pakrac and Slavonia (2014–present),1,10,== Bishop of Pakrac and Slavonia (2014–present) ==,65793125
==,2,10,== Bishop of Pakrac and Slavonia (2014–present) ==,65793125
The Bishops' Council of the Serbian Orthodox Church appointed Jovan as the new Bishop Bishop of Pakrac and Slavonia in May 2014.,0,11,== Bishop of Pakrac and Slavonia (2014–present) ==,65793125
"On 13 September, he was enthroned as the head of Eparchy of Pakrac and Slavonia in the Holy Trinity Cathedral in Pakrac, Croatia.",1,11,== Bishop of Pakrac and Slavonia (2014–present) ==,65793125
The consecration was performed by the Serbian Patriarch Irinej.,2,11,== Bishop of Pakrac and Slavonia (2014–present) ==,65793125
==,0,12,== Personal life ==,65793125
Personal life ==,1,12,== Personal life ==,65793125
"In October 2002, Jovan was introduced to the reserve composition of the 63rd Parachute Brigade of the Serbian Army, where he received military training and non-commissioned officer rank.",0,13,== Personal life ==,65793125
"In 2002, he visited Italy as a guest of the Italian Paratroopers Brigade ""Folgore"" and established good relations of the brigade and the Serbian Church.",1,13,== Personal life ==,65793125
He emphasized the importance of getting vaccinated during the COVID-19 pandemic crisis.,2,13,== Personal life ==,65793125
==,0,14,== Selected works ==,65793125
Selected works ==,1,14,== Selected works ==,65793125
"BooksHistoriography of the holocaust in Yugoslavia, 2014ArticlesCrno sunce i oko njega krug : geometrija jedne tajne pjesme Miloša Crnjanskog, 2001",0,15,== Selected works ==,65793125
"O muzici i vaspitanju, 2001",0,16,== Selected works ==,65793125
"The State of Israel and its Relations with Successor States of Former Yugoslavia During the Balkan Conflict of 1991-1999 and in its Aftermath, 2008",0,17,== Selected works ==,65793125
==,0,18,== References ==,65793125
References ==,1,18,== References ==,65793125
==,0,19,== External links ==,65793125
External links ==,1,19,== External links ==,65793125
Interview with bishop Jovan for Croatian Radio Television,0,20,== External links ==,65793125
