sentences,sentenceIndex,paragraphIndex,section,wikiId
"James Montgomery (4 November 1771 – 30 April 1854) was a Scottish-born hymn writer, poet and editor, who eventually settled in Sheffield.",0,0,N/A,837456
"He was raised in the Moravian Church and theologically trained there, so that his writings often reflect concern for humanitarian causes, such as the abolition of slavery and the exploitation of child chimney sweeps.",1,0,N/A,837456
== Early life and poetry ==,0,1,== Early life and poetry ==,837456
"Montgomery was born at Irvine in south-west Scotland, the son of a pastor and missionary of the Moravian Brethren.",0,2,== Early life and poetry ==,837456
"He was sent to be trained for the ministry at the Moravian School at Fulneck, near Leeds, while his parents left for the West Indies, where both died within a year of each other.",1,2,== Early life and poetry ==,837456
"At Fulneck, secular studies were banned, but James still found means of borrowing and reading a good deal of poetry and made ambitious plans to write epics of his own.",2,2,== Early life and poetry ==,837456
"On failing to complete his schooling, Montgomery was apprenticed to a baker in Mirfield, then to a store-keeper at Wath-upon-Dearne.",0,3,== Early life and poetry ==,837456
"After further efforts, including an unsuccessful attempt at a literary career in London, he moved north again to Sheffield in 1792 as an assistant to Joseph Gales, auctioneer, bookseller and printer of the Sheffield Register, who introduced him into the local Lodge of Oddfellows, to which he later addressed a song.",1,3,== Early life and poetry ==,837456
"In 1794, Gales left England to avoid political prosecution and Montgomery took the paper in hand, changing its name to the Sheffield Iris.",2,3,== Early life and poetry ==,837456
These were times of political repression.,0,4,== Early life and poetry ==,837456
"Montgomery was twice imprisoned on charges of sedition, first in 1795 for printing a poem to celebrate the fall of the Bastille in revolutionary France, and secondly in 1796 for criticising a magistrate for forcibly dispersing a political protest in Sheffield.",1,4,== Early life and poetry ==,837456
"Turning his jail experiences to some profit, he then published a pamphlet of poems written during his captivity: Prison Amusements (1797).",2,4,== Early life and poetry ==,837456
"His later prose account of the period appeared in 1840.For some time the Iris was the only newspaper in Sheffield, but beyond an ability to produce fairly creditable articles from week to week, Montgomery lacked the journalistic skills to take full advantage of his position.",3,4,== Early life and poetry ==,837456
"Other newspapers arose to fill the place which his might have held and in 1825 he sold out to a local bookseller, John Blackwell.",4,4,== Early life and poetry ==,837456
"Meanwhile, Montgomery continued to write poetry.",0,5,== Early life and poetry ==,837456
"He achieved some fame with The Wanderer of Switzerland (1806), a poem in six parts written in seven-syllable cross-rhymed quatrains.",1,5,== Early life and poetry ==,837456
It addressed the French annexation of Switzerland and quickly went through two editions.,2,5,== Early life and poetry ==,837456
"When it was denounced the following year in the conservative Edinburgh Review as a poem that would be speedily forgotten, Lord Byron came to its defence in the satire English Bards and Scotch Reviewers.",3,5,== Early life and poetry ==,837456
"Nevertheless, within 18 months a fourth impression of 1500 copies was issued from the very presses that had printed the criticism, and several more would follow.",4,5,== Early life and poetry ==,837456
"This success brought Montgomery a commission from the printer Bowyer to write a poem on the abolition of the slave trade, to be published with other poems on the subject by Elizabeth Benger and James Grahame in a handsome illustrated volume.",5,5,== Early life and poetry ==,837456
The subject appealed to the poet's philanthropic enthusiasm and his own family associations with the West Indies.,6,5,== Early life and poetry ==,837456
"The four-part poem in heroic couplets appeared in 1809 as The West Indies.Montgomery also used heroic couplets for The World before the Flood (1812), a piece of historical reconstruction in ten cantos.",7,5,== Early life and poetry ==,837456
He then turned to attacking the lottery in Thoughts on Wheels (1817) and took up the cause of chimney sweeps' apprentices in The Climbing Boys' Soliloquies.,8,5,== Early life and poetry ==,837456
His next major poem was Greenland (1819) in five cantos of heroic couplets.,9,5,== Early life and poetry ==,837456
"It was prefaced by a description of the ancient Moravian church, its 18th-century revival and its mission to Greenland in 1733.",10,5,== Early life and poetry ==,837456
The poem was noted for the beauty of its descriptions:,11,5,== Early life and poetry ==,837456
== Later career ==,0,6,== Later career ==,837456
"Montgomery's only other long poem, after retiring from newspaper editorship, was The Pelican Island (1828): nine cantos of descriptive blank verse, which garnered mixed responses, ranging between the summarily dismissive and Blackwood's Magazine's ""the best of all Montgomery's poems: in idea the most original, in execution the most powerful.",0,7,== Later career ==,837456
"""Montgomery himself expected that his name would live, if at all, in his hymns.",1,7,== Later career ==,837456
"Some of these, such as ""Hail to the Lord's Anointed"", ""Prayer is the Soul's Sincere Desire"", ""Stand up and Bless the Lord"" and the carol ""Angels from the Realms of Glory"", are still sung.",2,7,== Later career ==,837456
"""The Lord Is My Shepherd"" is a popular hymn with many denominations, based on Psalm 23.",3,7,== Later career ==,837456
"""A Poor Wayfaring Man of Grief"" has been adopted as a favourite in the Latter Day Saint movement.",4,7,== Later career ==,837456
The earliest of his hymns dates from his days in Wath on Dearne and he added to their number over the years.,5,7,== Later career ==,837456
The main boost came when the Rev.,6,7,== Later career ==,837456
"James Cotterill arrived at the parish church St Paul's, a chapel of ease to St Peter's, Sheffield's only parish church, in 1817.",7,7,== Later career ==,837456
"Cotterill had compiled and published A Selection of Psalms and Hymns Adapted to the Services of the Church of England in 1810, but to his disappointment and concern he found that his new parishioners did not take kindly to using it.",0,8,== Later career ==,837456
He therefore enlisted the help of James Montgomery to help him revise the collection and improve it by adding some hymns of the poet's own composition.,1,8,== Later career ==,837456
"This new edition, meeting with the approval of the Archbishop of York (and eventually of the parishioners at St Paul's), was finally published in 1820.",2,8,== Later career ==,837456
"In 1822 Montgomery published his own Songs of Zion: Being Imitations of Psalms, the first of several more collections of hymns.",3,8,== Later career ==,837456
"During his life he composed some 400 hymns, although less than a hundred of them are commonly sung today.From 1835 until his death, Montgomery lived at The Mount in Glossop Road, Sheffield.",4,8,== Later career ==,837456
He was well regarded in the city and played an active part in its philanthropy and religious life.,5,8,== Later career ==,837456
"He died on 30 April 1854, was honoured by a public funeral, and buried in Sheffield General Cemetery.",6,8,== Later career ==,837456
He had remained unmarried.,7,8,== Later career ==,837456
== Legacy ==,0,9,== Legacy ==,837456
"In 1861, a monument designed by John Bell (1811–1895) was erected over his grave in the Sheffield cemetery at a cost of £1000, raised by public subscription on the initiative of the Sheffield Sunday School Union, of which he was among the founding members.",0,10,== Legacy ==,837456
"On its granite pedestal is inscribed: ""Here lies interred, beloved by all who knew him, the Christian poet, patriot, and philanthropist.",1,10,== Legacy ==,837456
"Wherever poetry is read, or Christian hymns sung, in the English language, 'he being dead, yet speaketh' by the genius, piety and taste embodied in his writings.""",2,10,== Legacy ==,837456
"There are also extracts from his poems ""Prayer"" and ""The Grave"".",3,10,== Legacy ==,837456
"After the statue fell into disrepair it was moved in 1971 to the precincts of Sheffield Cathedral, where there is also a memorial window to him.",4,10,== Legacy ==,837456
"Elsewhere in Sheffield there are various streets named after Montgomery, as is a Grade II-listed drinking fountain on Broad Lane.",0,11,== Legacy ==,837456
The Surrey Street meeting hall of the Sunday Schools Union (now known as The Montgomery) was named in his honour in 1886.,1,11,== Legacy ==,837456
"It houses a 420-seat theatre, which also bears his name.",2,11,== Legacy ==,837456
"Elsewhere, Wath-upon-Dearne, flattered by being called ""the queen of villages"" in his work, has repaid the compliment by naming after him a community hall, a street and a square.",3,11,== Legacy ==,837456
"His birthplace in Irvine was renamed Montgomery House after he had paid the town a return visit in 1841, but it has since been demolished.",4,11,== Legacy ==,837456
== Other works ==,0,12,== Other works ==,837456
"Montgomery, James (1816).",0,13,== Other works ==,837456
"Verses to the memory of the late Richard Reynolds, of Bristol.",1,13,== Other works ==,837456
"Poetical Works, four editions in 1821, 1836, 1841, and 1854",0,14,== Other works ==,837456
"Editor: The Chimney-Sweeper's Friend and Climbing-Boy's Album, London: Longman, Hurst, Rees, Orme, Brown and Green, 1824",0,15,== Other works ==,837456
"Editor: The Christian Psalmist; or, Hymns, Selected and Original, Glasgow: Chalmers and Collins, 1825. sixth edn.",0,16,== Other works ==,837456
"1829; Read Books, 2008, ISBN 9781409799900",1,16,== Other works ==,837456
"Editor: The Christian poet; or, selections in verse on sacred subjects, Wm Collins, Glasgow, 1825",0,17,== Other works ==,837456
"An Essay on the Phrenology of the Hindoos and Negroes, London: Printed for E. Lloyd, 1829",0,18,== Other works ==,837456
"Original Hymns For Public, Private, and Social Devotion, London: Longman, Brown, Green, 1853",0,19,== Other works ==,837456
Sacred Poems and Hymns: For Public and Private Devotion.,0,20,== Other works ==,837456
D. Appleton.,1,20,== Other works ==,837456
1854.,2,20,== Other works ==,837456
"Prose by a Poet, 2 vols, London: Longman, Hurst, Rees, Orme, Brown and Green, 1824",0,21,== Other works ==,837456
"Montgomery, James (1833).",0,22,== Other works ==,837456
Lectures on poetry and general literature.,1,22,== Other works ==,837456
A practical detail of the cotton manufacture of the United States of America: and the state of the cotton manufacture of that country contrasted and compared with that of Great Britain; with comparative estimates of the cost of manufacturing in both countries ... J. Niven.,0,23,== Other works ==,837456
1840.,1,23,== Other works ==,837456
== References ==,0,24,== References ==,837456
== External links ==,0,25,== External links ==,837456
Works by or about James Montgomery at Internet Archive,0,26,== External links ==,837456
Works by James Montgomery at LibriVox (public domain audiobooks),0,27,== External links ==,837456
The 1854 illustrated edition of Montgomery's poems,0,28,== External links ==,837456
"John Holland and James Everett, Memoirs of the life and writings of James Montgomery: including selections from his correspondence, remains in prose and verse, and conversations on various subjects, London, 1855",0,29,== External links ==,837456
"""Montgomery, James"" .",0,30,== External links ==,837456
New International Encyclopedia.,1,30,== External links ==,837456
1905.,2,30,== External links ==,837456
James Montgomery Collection.,0,31,== External links ==,837456
"General Collection, Beinecke Rare Book and Manuscript Library, Yale University.",1,31,== External links ==,837456
