sentences,sentenceIndex,paragraphIndex,section,wikiId
"María Fernanda Blázquez Gil (born July 21, 1973), known artistically  as Fey, is a Latin Grammy Award-nominated Mexican singer, songwriter, designer, dancer, record producer, director and actress.",0,0,N/A,1483568
She has released seven studio albums and done one international tour and a short tour to promote her third studio album.,1,0,N/A,1483568
"She rose to fame with her self-titled debut album, Fey, released in 1995, which was followed by Tierna La Noche, and El Color De Los Sueños.",2,0,N/A,1483568
All three studio albums were produced by José Ramón Florez.,3,0,N/A,1483568
Tierna La Noche reached #10 on the Billboard Top Latin Albums chart.,4,0,N/A,1483568
==,0,1,== Career ==,1483568
Career ==,1,1,== Career ==,1483568
=== 1990s,0,2,== Career == | === 1990s ===,1483568
===,1,2,== Career == | === 1990s ===,1483568
"Fey released her first album, titled Fey, in 1995, through Sony Music (Mexico).",0,3,== Career == | === 1990s ===,1483568
"Within a couple of months of the album's release, Fey had scored several hits in her native Mexico, and had reached #1 with ""Media naranja"", ""Gatos en el balcon"", ""Me enamoro de ti"" and ""La noche se mueve"".",1,3,== Career == | === 1990s ===,1483568
"Fey toured Mexico, including consecutive concerts in the Teatro Metropolitan, and all of Latin America, and reached Gold status sales by the end of the year.",2,3,== Career == | === 1990s ===,1483568
In 1996 Fey released Tierna la Noche.,3,3,== Career == | === 1990s ===,1483568
"""Azucar Amargo"", the CD's first single, stayed in the Billboard chart for more than 30 weeks.",4,3,== Career == | === 1990s ===,1483568
"Her tour, Tierna la noche, was also successful.",5,3,== Career == | === 1990s ===,1483568
"Overall the tour consisted of more than 40 presentations in Mexico, the U.S. and Latin America, as well as some presentations in Europe.",6,3,== Career == | === 1990s ===,1483568
"At the 9th Lo Nuestro Awards, Fey received a nomination for Pop New Artist.",7,3,== Career == | === 1990s ===,1483568
She is a vegetarian.,8,3,== Career == | === 1990s ===,1483568
"In 1998, and after more than 8 months of absence, Fey released her third album El color de los sueños, which itself was different from the preceding two in that the album was a mix of different rhythms and styles.",9,3,== Career == | === 1990s ===,1483568
"""Ni tu ni nadie"", the album's first single, instantly reached number one in the Latin charts; ""Diselo con flores"", ""Canela"" and ""Cielo Liquido"" soon followed.",10,3,== Career == | === 1990s ===,1483568
"Although the record did very well in sales, it did not compare to the over-the-top success of Tierna la noche.",11,3,== Career == | === 1990s ===,1483568
"In the overall period of the three first albums, Fey's amazing popularity and promotion caused all but 4 of the singles released to hit #1 in Mexico, with the most important being ""Azucar Amargo"", ""Media Naranja"", ""Ni tu Ni Nadie"", ""Muevelo"" and ""Te Pertenezco"", all of them spending more than a month in the top position in Mexico.",12,3,== Career == | === 1990s ===,1483568
"After almost a year of promotion, Fey announced, at a 1999 charity concert, that: ""everything has a cycle, and this is the end of mine"".",13,3,== Career == | === 1990s ===,1483568
===,0,4,== Career == | === Vertigo (fourth studio album) ===,1483568
Vertigo (fourth studio album),1,4,== Career == | === Vertigo (fourth studio album) ===,1483568
===,2,4,== Career == | === Vertigo (fourth studio album) ===,1483568
Vertigo was released as a double edition with both an English and Spanish album.,0,5,== Career == | === Vertigo (fourth studio album) ===,1483568
The English album contains three songs not included on the Spanish version.,1,5,== Career == | === Vertigo (fourth studio album) ===,1483568
"After two singles (""The Other Side"" and ""Dressing to Kill""), Fey left Sony and then retired for two years.",2,5,== Career == | === Vertigo (fourth studio album) ===,1483568
===,0,6,== Career == | === La Fuerza del Destino (fifth studio album) ===,1483568
La Fuerza del Destino (fifth studio album),1,6,== Career == | === La Fuerza del Destino (fifth studio album) ===,1483568
===,2,6,== Career == | === La Fuerza del Destino (fifth studio album) ===,1483568
"In 2005, Fey, now a married woman, relaunched her career with La Fuerza del Destino, a tribute to the Spanish group Mecano.",0,7,== Career == | === La Fuerza del Destino (fifth studio album) ===,1483568
"This album was successful; it contained three top-ten singles: ""La Fuerza Del Destino"", ""Barco A Venus"" and ""Me Cuesta Tanto Olvidarte"".",1,7,== Career == | === La Fuerza del Destino (fifth studio album) ===,1483568
"A radio-only single, ""Un Año Más"", was released for the holiday season in Mexico.",2,7,== Career == | === La Fuerza del Destino (fifth studio album) ===,1483568
"Fey toured in support of this album at the Viña del Mar festival 2005, the Selena Vive! festival, and many local clubs across the United States and Latin America.",0,8,== Career == | === La Fuerza del Destino (fifth studio album) ===,1483568
"The record excelled sales-wise, and it gave Fey her very first Latin Grammy nomination for ""Best Pop Female Vocal Album"".",1,8,== Career == | === La Fuerza del Destino (fifth studio album) ===,1483568
She also received 4 nominations for Premios Orgullosamente Latino 2005 & 2006-Ritmoson Latino and a Premio Oye nomination.,2,8,== Career == | === La Fuerza del Destino (fifth studio album) ===,1483568
She was recognized by the Gay & Lesbian Alliance Against Defamation (GLAAD) in Miami in 2006 for supporting gay human rights.,3,8,== Career == | === La Fuerza del Destino (fifth studio album) ===,1483568
===,0,9,== Career == | === Faltan Lunas (sixth studio album) ===,1483568
Faltan Lunas (sixth studio album),1,9,== Career == | === Faltan Lunas (sixth studio album) ===,1483568
===,2,9,== Career == | === Faltan Lunas (sixth studio album) ===,1483568
"After the success of her fifth album, Fey released a sixth one, Faltan Lunas and was produced by Carlos Jean.",0,10,== Career == | === Faltan Lunas (sixth studio album) ===,1483568
"It was slated for an August 1, 2006, release, but was released on July 21, Fey's birthday.",1,10,== Career == | === Faltan Lunas (sixth studio album) ===,1483568
It features a pop/dance sound along with acoustic elements.,2,10,== Career == | === Faltan Lunas (sixth studio album) ===,1483568
"The first single released was ""Y Aquí Estoy"".",3,10,== Career == | === Faltan Lunas (sixth studio album) ===,1483568
"It was announced by Fey herself that the second single would be ""Me Has Vuelto Loca"", but it was changed to ""Como Un Ángel"".",4,10,== Career == | === Faltan Lunas (sixth studio album) ===,1483568
"The album was only released in a few Latin American countries, and sold around 10,000 copies worldwide, making it her lowest selling album ever.",5,10,== Career == | === Faltan Lunas (sixth studio album) ===,1483568
"""Como Un Ángel"" was released in January 2007, but it failed to make an impact on the charts.",6,10,== Career == | === Faltan Lunas (sixth studio album) ===,1483568
===,0,11,== Career == | === Dulce Tentación & Sweet Temptation (seventh studio album) ===,1483568
Dulce Tentación & Sweet Temptation (seventh studio album),1,11,== Career == | === Dulce Tentación & Sweet Temptation (seventh studio album) ===,1483568
===,2,11,== Career == | === Dulce Tentación & Sweet Temptation (seventh studio album) ===,1483568
"Dulce Tentación was released April 28, 2009, and the English version called ""Sweet Temptation"" was set to be released over the next months.",0,12,== Career == | === Dulce Tentación & Sweet Temptation (seventh studio album) ===,1483568
"The album was produced by Sam 'FISH' Fisher, who also co-wrote more than half of the songs on the record and will be distributed internationally by Universal Music.",1,12,== Career == | === Dulce Tentación & Sweet Temptation (seventh studio album) ===,1483568
"One track, ""Cicatrices"" [""Monsters""] was available for download Fey's official site  at the end of 2008.",2,12,== Career == | === Dulce Tentación & Sweet Temptation (seventh studio album) ===,1483568
"More than 170,000 downloads were registered while the track was available.",3,12,== Career == | === Dulce Tentación & Sweet Temptation (seventh studio album) ===,1483568
"The first official single was ""Lentamente"" (Let Me Show You), a song that put Fey back in the top of the charts in México.",0,13,== Career == | === Dulce Tentación & Sweet Temptation (seventh studio album) ===,1483568
"The album was an unexpected success, winning a gold status for over 50.000 copies sold in less than one month in México.",1,13,== Career == | === Dulce Tentación & Sweet Temptation (seventh studio album) ===,1483568
"The second single Provócame (Games That you Play) was released in July 2009, however, a conflict between Fey and her new record label Mi Rey Music over promotion differences and the concept of the new video led Fey to part ways with the record label.",2,13,== Career == | === Dulce Tentación & Sweet Temptation (seventh studio album) ===,1483568
Fey decided to create her own record label by buying the rights to her music and to Elephant Music from Mi Rey Music.,3,13,== Career == | === Dulce Tentación & Sweet Temptation (seventh studio album) ===,1483568
"Late August 2009 Fey announced on her website that she was now in complete control of Elephant Music and continued to promote ""Provócame"", however, she suspended promotion of the single due to laryngitis.",0,14,== Career == | === Dulce Tentación & Sweet Temptation (seventh studio album) ===,1483568
"The video debuted on September 21, 2009; she also announced that she was to go on tour at the National Auditorium and record a live DVD.",1,14,== Career == | === Dulce Tentación & Sweet Temptation (seventh studio album) ===,1483568
Fey toured clubs in the United States and Mexico.,2,14,== Career == | === Dulce Tentación & Sweet Temptation (seventh studio album) ===,1483568
"The last single from the album was ""Adicto A Mi Cuerpo"".",0,15,== Career == | === Dulce Tentación & Sweet Temptation (seventh studio album) ===,1483568
"Initial plans for a music video were scrapped due to Fey deciding to move on and record a new album, making the single a radio-only release.",1,15,== Career == | === Dulce Tentación & Sweet Temptation (seventh studio album) ===,1483568
"However, it did chart on several online radio stations.",2,15,== Career == | === Dulce Tentación & Sweet Temptation (seventh studio album) ===,1483568
"""Sweet Temptation"" was shelved as Fey decided to record a new album.",3,15,== Career == | === Dulce Tentación & Sweet Temptation (seventh studio album) ===,1483568
===,0,16,"== Career == | === Family, return to Sony Music, Primera Fila (2012 - 2014) ===",1483568
"Family, return to Sony Music, Primera Fila (2012 - 2014)",1,16,"== Career == | === Family, return to Sony Music, Primera Fila (2012 - 2014) ===",1483568
===,2,16,"== Career == | === Family, return to Sony Music, Primera Fila (2012 - 2014) ===",1483568
"During April 2010, it was announced via a press conference that Fey was in the studio recording her eighth studio album, with a lead single tentatively called ""Te Amo A Mi Manera"" previewed at the conference.",0,17,"== Career == | === Family, return to Sony Music, Primera Fila (2012 - 2014) ===",1483568
The project went to hiatus because of her marriage to Alonso Orozco in September 2010.,1,17,"== Career == | === Family, return to Sony Music, Primera Fila (2012 - 2014) ===",1483568
"Fey gave birth to her first child, Isabella, in January, 2011.",2,17,"== Career == | === Family, return to Sony Music, Primera Fila (2012 - 2014) ===",1483568
"On March 8, 2012, it was confirmed via Sony Music Mexico that Fey would be returning to the record company, after almost ten years since the release of Vértigo, and three years after the release of Dulce Tentación/Sweet Temptation, her last studio album.",3,17,"== Career == | === Family, return to Sony Music, Primera Fila (2012 - 2014) ===",1483568
"She had announced that her eighth album would be a Primera Fila, an album composed entirely of live renditions of her past hits and a few new songs.",4,17,"== Career == | === Family, return to Sony Music, Primera Fila (2012 - 2014) ===",1483568
"It was recorded in June, and it was released in October 2012.",5,17,"== Career == | === Family, return to Sony Music, Primera Fila (2012 - 2014) ===",1483568
"The first single, ""Frío"", was released on July, 21st during Fey's 39th birthday celebration.",6,17,"== Career == | === Family, return to Sony Music, Primera Fila (2012 - 2014) ===",1483568
"The album was certified gold just three weeks after its release, marking it a success in Fey's career.",7,17,"== Career == | === Family, return to Sony Music, Primera Fila (2012 - 2014) ===",1483568
"She began her ""Todo Lo Que Soy"" (All That I Am) tour in February 2013 in Mexico's National Auditorium, where she had set a record years before for most sold-out performances by a female artist, to positive reviews.",8,17,"== Career == | === Family, return to Sony Music, Primera Fila (2012 - 2014) ===",1483568
"In March 2013, Premios Oye announced Fey as the official image and spokesperson for that year's ceremony, where she also performed.",9,17,"== Career == | === Family, return to Sony Music, Primera Fila (2012 - 2014) ===",1483568
"On August 15, 2013, Fey performed ""Azucar Amargo"" at Premios Texas where she also won the ""Best Pop/Rock Artist"" award.",10,17,"== Career == | === Family, return to Sony Music, Primera Fila (2012 - 2014) ===",1483568
"In January 2014, Fey announced her divorce from Orozco.",11,17,"== Career == | === Family, return to Sony Music, Primera Fila (2012 - 2014) ===",1483568
"Fey confirmed in April 2014 that she will be a judge for the 2014 season of the dance competition show, ""Bailando Por Un Sueño"" (Dancing for a Dream).",12,17,"== Career == | === Family, return to Sony Music, Primera Fila (2012 - 2014) ===",1483568
"On December 11, 2014, Fey announced the release date of her Todo Lo Que Soy live CD & DVD package to be released on December 17 physically and December 24 digitally of the same year.",13,17,"== Career == | === Family, return to Sony Music, Primera Fila (2012 - 2014) ===",1483568
=== 90's Pop & Desnuda Tours (2016 - onwards),0,18,== Career == | === 90's Pop & Desnuda Tours (2016 - onwards) ===,1483568
===,1,18,== Career == | === 90's Pop & Desnuda Tours (2016 - onwards) ===,1483568
"In February 2016, Fey officially released the single ""No Me Acostumbro"" alongside Cuban singer/actor Lenny de la Rosa, whom she had met as a judge on ""Bailando Por Un Sueño"" when he was a contestant.",0,19,== Career == | === 90's Pop & Desnuda Tours (2016 - onwards) ===,1483568
"In the spring of 2016, Fey began promoting an upcoming tour called ""Fey: 9.0 American Tour"" which had a preview date in June 2016 in Mexico City's National Auditorium, home to Fey's own attendance record for a female recording artist.",1,19,== Career == | === 90's Pop & Desnuda Tours (2016 - onwards) ===,1483568
"In September 2016, Fey released the digital single entitled ""Amo"", which was accompanied by a Fifty Shades of Grey inspired video.",2,19,== Career == | === 90's Pop & Desnuda Tours (2016 - onwards) ===,1483568
"In 2017, Fey joined the line-up of the 90's Pop Tour, joining artists Aleks Syntek, OV7, Erik Rubin, Beto Cuevas, JNS, and others.",3,19,== Career == | === 90's Pop & Desnuda Tours (2016 - onwards) ===,1483568
The tour had many dates during the spring and summer of 2017 across Mexico and the US.,4,19,== Career == | === 90's Pop & Desnuda Tours (2016 - onwards) ===,1483568
"After this tour, Fey announced plans to start her own tour in wanting to record a live CD & DVD.",5,19,== Career == | === 90's Pop & Desnuda Tours (2016 - onwards) ===,1483568
"In 2018, Fey released two new singles, ""Comiendote Tu Besos,"" and ""No Te Necesito"" alongside with the announcement of a new tour called ""Desnuda Tour"" (Nude Tour), an entirely different show from what the 9.0 American Tour was set to be.",0,20,== Career == | === 90's Pop & Desnuda Tours (2016 - onwards) ===,1483568
The tour began in October 2018 in Mexico with rave reviews its opening night as she performed songs from each of her previous albums.,1,20,== Career == | === 90's Pop & Desnuda Tours (2016 - onwards) ===,1483568
"On September 25, 2020, to celebrate the 25th anniversary of her career, Fey launched the English-language electronic single, ""The Perfect Song"" featuring Paul Oakenfold.",0,21,== Career == | === 90's Pop & Desnuda Tours (2016 - onwards) ===,1483568
"In November 2020, Fey launched the recorded version of her ""Desnuda Tour"" via Cinepolis during a stream to raise funds for World Vision, a charity she is the ambassador for.",1,21,== Career == | === 90's Pop & Desnuda Tours (2016 - onwards) ===,1483568
==,0,22,== Discography ==,1483568
Discography ==,1,22,== Discography ==,1483568
===,0,23,== Discography == | === Studio albums ===,1483568
Studio albums ===,1,23,== Discography == | === Studio albums ===,1483568
1995:,0,24,== Discography == | === Studio albums ===,1483568
Fey,1,24,== Discography == | === Studio albums ===,1483568
1996:,0,25,== Discography == | === Studio albums ===,1483568
Tierna La Noche,1,25,== Discography == | === Studio albums ===,1483568
1998:,0,26,== Discography == | === Studio albums ===,1483568
El Color de los Sueños,1,26,== Discography == | === Studio albums ===,1483568
2002:,0,27,== Discography == | === Studio albums ===,1483568
Vértigo,1,27,== Discography == | === Studio albums ===,1483568
2006: Faltan Lunas,0,28,== Discography == | === Studio albums ===,1483568
2009:,0,29,== Discography == | === Studio albums ===,1483568
Dulce Tentación/Sweet Temptation,1,29,== Discography == | === Studio albums ===,1483568
2012:,0,30,== Discography == | === Studio albums ===,1483568
Fey: Primera Fila,1,30,== Discography == | === Studio albums ===,1483568
2014:,0,31,== Discography == | === Studio albums ===,1483568
Todo Lo Que Soy-En Vivo,1,31,== Discography == | === Studio albums ===,1483568
==,0,32,== References ==,1483568
References ==,1,32,== References ==,1483568
==,0,33,== External links ==,1483568
External links ==,1,33,== External links ==,1483568
Official website,0,34,== External links ==,1483568
"""Fey deja compañía de Borovoy, pero sigue en su tour"".",0,35,== External links ==,1483568
El Universal.,1,35,== External links ==,1483568
"March 8, 2018.",2,35,== External links ==,1483568
"Retrieved March 25, 2019.",3,35,== External links ==,1483568
