sentences,sentenceIndex,paragraphIndex,section,wikiId
"Charles Arthur Russell Jr. (May 21, 1951 – April 4, 1992) was an American cellist, composer, producer, singer, and musician from Iowa, whose work spanned a disparate range of styles.",0,0,N/A,602666
"Trained in contemporary experimental composition and Indian classical music, Russell relocated to New York in the mid-1970s, where he became associated with Lower Manhattan's avant-garde community and eventually embraced the city's disco scene.",1,0,N/A,602666
"Throughout the 1970s and 1980s, Russell produced a considerable collection of material, including several underground dance hits under aliases such as Dinosaur L and Indian Ocean, but his difficulty in completing projects resulted in a limited amount of released output; 24→24 Music (1982, as Dinosaur L), Tower of Meaning (1983), and World of Echo  (1986) were the only solo albums he released during his lifetime.",2,0,N/A,602666
"Over the course of his career, he collaborated with a wide variety of artists, including composers Steve Reich and Philip Glass, poet Allen Ginsberg, musicians such as Peter Gordon, David Van Tieghem, Peter Zummo and David Byrne, and DJs such as Walter Gibbons, Larry Levan, Nicky Siano, and Steve D'Aquisto.",3,0,N/A,602666
"Russell died from AIDS-related illnesses in 1992, still in relative obscurity and poverty.",4,0,N/A,602666
"Throughout the 2000s, a series of reissues, compilations, books, and a biographical documentary significantly raised his profile.",5,0,N/A,602666
"Following his death, several albums of his various unheard recordings were compiled and released, including The World of Arthur Russell (2004) and Calling Out of Context (2004).",6,0,N/A,602666
The documentary Wild Combination: A Portrait of Arthur Russell was released in 2008.,7,0,N/A,602666
==,0,1,== Early life ==,602666
Early life ==,1,1,== Early life ==,602666
"Russell was born and raised in Oskaloosa, Iowa; his father was a former naval officer who eventually served as mayor of the town.",0,2,== Early life ==,602666
"As a child and adolescent, he studied the cello and piano and began to compose his own music.",1,2,== Early life ==,602666
"When he was 18 he moved to San Francisco, where he lived in a Buddhist commune led by Neville G. Pemchekov Warwick.",2,2,== Early life ==,602666
"After earning his high school equivalency, he studied North Indian classical music at the Ali Akbar College of Music and Western composition part-time at the San Francisco Conservatory of Music.",3,2,== Early life ==,602666
"He met Allen Ginsberg, with whom he began to work, accompanying him on the cello as a soloist or in groups while Ginsberg sang or read his poetry.",4,2,== Early life ==,602666
==,0,3,== Career ==,602666
Career ==,1,3,== Career ==,602666
===,0,4,== Career == | === 1973–1975: Early years in New York and The Kitchen ===,602666
1973–1975: Early years in New York and The Kitchen =,1,4,== Career == | === 1973–1975: Early years in New York and The Kitchen ===,602666
==,2,4,== Career == | === 1973–1975: Early years in New York and The Kitchen ===,602666
"In 1973, Russell moved to New York and enrolled in a formal degree program at the Manhattan School of Music, cross-registering in electronic music and linguistics classes at Columbia University.",0,5,== Career == | === 1973–1975: Early years in New York and The Kitchen ===,602666
"While studying at the conservatory, Russell repeatedly clashed with Pulitzer Prize-winning serialist composer and instructor Charles Wuorinen, who disparaged the composition ""City Park"" (a minimalist, non-narrative suite incorporating readings from the works of Ezra Pound and Gertrude Stein) as ""the most unattractive thing I've ever heard"".",1,5,== Career == | === 1973–1975: Early years in New York and The Kitchen ===,602666
"Embittered by his experience, Russell briefly considered transferring to Dartmouth College at the behest of experimental composer Christian Wolff, whom he had sought out and befriended upon arriving in the Northeast.",2,5,== Career == | === 1973–1975: Early years in New York and The Kitchen ===,602666
"But after a chance meeting at a Wolff concert in Manhattan, he became close with Rhys Chatham, who arranged for Russell to succeed him as music director of The Kitchen, a downtown avant-garde performance space.",3,5,== Career == | === 1973–1975: Early years in New York and The Kitchen ===,602666
"As a result, he abandoned his studies and remained in New York.",4,5,== Career == | === 1973–1975: Early years in New York and The Kitchen ===,602666
Russell and Chatham later briefly roomed together in a sixth-story walkup apartment at 437 East 12th Street in the East Village; Ginsberg (who maintained his primary residence in the building from 1975 to 1996 and helped Russell secure the apartment) supplied electricity to the impoverished composers through an extension cord.,5,5,== Career == | === 1973–1975: Early years in New York and The Kitchen ===,602666
Russell resided in the apartment for the rest of his life.,6,5,== Career == | === 1973–1975: Early years in New York and The Kitchen ===,602666
"During his tenure at The Kitchen (from the autumn of 1974 to the summer of 1975), he greatly expanded the breadth and purview of the venue's offerings, crafting a program that ""support[ed] other local and relatively low profile composers rather than... accentuat[ing] the work of composers who were beginning to acquire an international reputation.""",7,5,== Career == | === 1973–1975: Early years in New York and The Kitchen ===,602666
"This approach elicited controversy when Russell booked Boston-based proto-punk band The Modern Lovers for an engagement at the venue, widely regarded as a leading bastion of minimalism.",8,5,== Career == | === 1973–1975: Early years in New York and The Kitchen ===,602666
"Russell's booking of Fluxus stalwart Henry Flynt's ""punkabilly"" ensemble Nova'billy, concluding his season as director, was likewise unsettling to the avant-garde establishment.",9,5,== Career == | === 1973–1975: Early years in New York and The Kitchen ===,602666
"According to biographer Tim Lawrence, ""the decision to program the Modern Lovers and Talking Heads was Russell’s way of demonstrating that minimalism could be found outside of compositional music, as well as his belief that pop music could be arty, energetic and fun at the same time.",10,5,== Career == | === 1973–1975: Early years in New York and The Kitchen ===,602666
"""From 1975 to 1979, Russell was a member of The Flying Hearts, recorded by John Hammond, which consisted of Russell (keyboards/vocals), ex-Modern Lovers member Ernie Brooks (bass/vocals), Larry Saltzman (guitar), and David Van Tieghem (drums, vocals); a later incarnation in the 1980s included Joyce Bowden (vocals) and Jesse Chamberlain (drums).",11,5,== Career == | === 1973–1975: Early years in New York and The Kitchen ===,602666
"This ensemble was frequently augmented in live and studio performances by the likes of Chatham, David Byrne, Jon Gibson, Peter Gordon, Jerry Harrison, Garrett List (who succeeded Russell as musical director of The Kitchen), Andy Paley, Lenny Pickett and Peter Zummo.",12,5,== Career == | === 1973–1975: Early years in New York and The Kitchen ===,602666
"During the same period, various permutations of this ensemble, together with Glenn Iamaro, Bill Ruyle and Jon Sholle, performed & recorded excerpts from Instrumentals, a 48-hour-long orchestral work that constituted Russell's first major work in the idiom.",13,5,== Career == | === 1973–1975: Early years in New York and The Kitchen ===,602666
"Selections from the Instrumentals sessions were eventually collected on an eponymously titled album, released by Belgian label Disques du Crepuscule in 1984.",14,5,== Career == | === 1973–1975: Early years in New York and The Kitchen ===,602666
"The collaboration among Russell (once again as a keyboardist), Brooks, and Chamberlain extended into The Necessaries, a power pop quartet fronted by guitarist Ed Tomney.",15,5,== Career == | === 1973–1975: Early years in New York and The Kitchen ===,602666
"Their lone 1981 album on Sire Records (initially released as Big Sky before being tweaked and re-released as Event Horizon) featured few songwriting contributions from Russell, who abruptly left the band at the approach to the Holland Tunnel before an important concert in Washington, D.C.",16,5,== Career == | === 1973–1975: Early years in New York and The Kitchen ===,602666
===,0,6,== Career == | === 1976–1980: Discovery of disco and early singles ===,602666
1976–1980:,1,6,== Career == | === 1976–1980: Discovery of disco and early singles ===,602666
Discovery of disco and early singles ===,2,6,== Career == | === 1976–1980: Discovery of disco and early singles ===,602666
"Around 1976, Russell became a habitue of New York's nascent underground disco scene, namely Nicky Siano's Gallery on Houston Street in SoHo.",0,7,== Career == | === 1976–1980: Discovery of disco and early singles ===,602666
"In a 2007 interview with Wax Poetics magazine, Siano downplayed the popular myth that Russell's interest in the genre solidified over the course of a single night, noting that ""Louis [Aquilone, Siano's best friend and Russell's then-lover] was at the Gallery every single Saturday night.",1,7,== Career == | === 1976–1980: Discovery of disco and early singles ===,602666
"After spending a few Saturday nights without Louis, Arthur decided to come.",2,7,== Career == | === 1976–1980: Discovery of disco and early singles ===,602666
"After the third or fourth time there, he started to come without Louis"".",3,7,== Career == | === 1976–1980: Discovery of disco and early singles ===,602666
"Though an eager dancer, Siano has described Russell's style as ""strange... outrageous, weird...",4,7,== Career == | === 1976–1980: Discovery of disco and early singles ===,602666
"he was definitely a 'white-boy' dancer.""",5,7,== Career == | === 1976–1980: Discovery of disco and early singles ===,602666
"By the time Russell was involved with Tom Lee in the 1980s, his nightlife activities had subsided to a large extent.",6,7,== Career == | === 1976–1980: Discovery of disco and early singles ===,602666
"""It wasn't like Arthur and I were in some gay disco world, getting dressed to go out to the club and dancing the night away,"" Lee has said.",7,7,== Career == | === 1976–1980: Discovery of disco and early singles ===,602666
"""We’d go to CBGB, we'd go to Max's Kansas City, we'd go to Tier 3 but we'd listen to the group and then go home.",8,7,== Career == | === 1976–1980: Discovery of disco and early singles ===,602666
For him it was about the daily grind of actually playing music.,9,7,== Career == | === 1976–1980: Discovery of disco and early singles ===,602666
"""In 1977, trenchantly attracted to the minimalist rhythms of disco and funded by Siano's ""Gallery war chest"", Russell wrote and co-produced ""Kiss Me Again"" in collaboration with a diverse array of musicians—Flynt, Zummo, Byrne (on rhythm guitar) and Gloria Gaynor veterans Wilbur Bascomb (bass) and Alan Schwartzberg (drums)—under the moniker of Dinosaur L.",10,7,== Career == | === 1976–1980: Discovery of disco and early singles ===,602666
"The first disco single to be released by Sire Records, it was a fairly large club hit, reportedly selling ""some ungodly amount, like two hundred thousand copies"".",11,7,== Career == | === 1976–1980: Discovery of disco and early singles ===,602666
"Despite the modicum of commercial success and ""ecstatic reaction"" elicited by the record in the New York underground, according to Siano, ""Ray Caviano [head of Warner/Sire's disco division] never really pushed it,"" and the record failed to cross over into the mainstream.",12,7,== Career == | === 1976–1980: Discovery of disco and early singles ===,602666
"The song's main hook was interpolated by Desmond Child (who was acquainted with Russell via Larry Salzman) on his minor 1979 hit ""Our Love Is Insane,"" leading Russell to accuse the musician of infringement among his friends.",13,7,== Career == | === 1976–1980: Discovery of disco and early singles ===,602666
"Although the duo was signed to Sire to produce a follow-up single featuring Gerri Griffin of the Voices of East Harlem, the sessions stalled because of Siano's burgeoning drug habit (leading him to take temporary refuge in California) and Russell's myopic approach to recording.",14,7,== Career == | === 1976–1980: Discovery of disco and early singles ===,602666
"In 1980, Loose Joints (initially known as the Little All-Stars) was formed with Russell, onetime DJ Steve D'Aquisto, Columbia student and Russell confidante Steven Hall, three singers found on The Loft's dancefloor, miscellaneous other musicians, and the Ingram Brothers rhythm section (best known for later backing Patti LaBelle).",15,7,== Career == | === 1976–1980: Discovery of disco and early singles ===,602666
"With a stated ambition to create ""the disco White Album"", the group—under contract to leading underground disco label West End Records—recorded hours of music but only released three songs: ""Is It All Over My Face"", ""Pop Your Funk"" (in two disparate arrangements, including a no wave-influenced single edit), and ""Tell You Today"".",16,7,== Career == | === 1976–1980: Discovery of disco and early singles ===,602666
"D'Aquisto, a non-musician who favored such extemporaneous touches as off-key singing and the input of street buskers, repeatedly clashed with the perfectionist Russell throughout the sessions.",17,7,== Career == | === 1976–1980: Discovery of disco and early singles ===,602666
"Despite the acrimony, Hall felt that ""[D'Aquisto] allowed shy Arthur to come out of his shell in the gayest sense.",18,7,== Career == | === 1976–1980: Discovery of disco and early singles ===,602666
"He also taught him how to let go in terms of slavishly and clairvoyantly searching for and then locking in the groove.""",19,7,== Career == | === 1976–1980: Discovery of disco and early singles ===,602666
"The experimental recordings bemused many of downtown New York's disco cognoscenti, including West End head Mel Cheren and Loft proprietor David Mancuso, a predicament that led Larry Levan to remix ""Is It All Over My Face"" for club play; the ensuing track, based around a female vocal wiped from the original mix (and recorded on stolen studio time with Francois Kevorkian as an uncredited co-mixer) was an enduring staple of Levan's sets at the Paradise Garage and a formative influence on Chicago house, in addition to becoming a bona fide commercial hit in the New York area via airplay on WBLS.",20,7,== Career == | === 1976–1980: Discovery of disco and early singles ===,602666
"In 1981, Russell and entrepreneur Will Socolov (who partially financed the Loose Joints sessions) founded Sleeping Bag Records.",21,7,== Career == | === 1976–1980: Discovery of disco and early singles ===,602666
"Their first release was a recording of 24→24 Music, a controversial disco-influenced composition (with rhythmic shifts every 24 bars, hence the title) that had been commissioned by and first performed at The Kitchen in 1979.",22,7,== Career == | === 1976–1980: Discovery of disco and early singles ===,602666
The first limited pressing of this record had a hand made silk-screened cover.,23,7,== Career == | === 1976–1980: Discovery of disco and early singles ===,602666
"Steven Hall later described its debut as ""the best performance of Arthur's work that I ever attended... it was like really hot dance music and no one got it.",24,7,== Career == | === 1976–1980: Discovery of disco and early singles ===,602666
"The idea that Arthur would turn around and bring that [dance] music into their venue and present it as serious music was really very challenging to them, and very threatening to them.""",25,7,== Career == | === 1976–1980: Discovery of disco and early singles ===,602666
"""Go Bang,"" originally released on this album but recorded three years earlier by an ensemble that included Zummo, Peter Gordon, academic/composer Julius Eastman, Bascomb, and John and Jimmy Ingram was remixed as a 12"" single by Francois Kevorkian.",26,7,== Career == | === 1976–1980: Discovery of disco and early singles ===,602666
"Kevorkian's remix of ""Go Bang"" and Levan's remix of ""In the Cornbelt"" (another track from the 24→24 suite) were frequently played at the Paradise Garage.",27,7,== Career == | === 1976–1980: Discovery of disco and early singles ===,602666
===,0,8,== Career == | === 1983–1986: Further collaborations and World of Echo ===,602666
1983–1986:,1,8,== Career == | === 1983–1986: Further collaborations and World of Echo ===,602666
Further collaborations and World of Echo =,2,8,== Career == | === 1983–1986: Further collaborations and World of Echo ===,602666
==,3,8,== Career == | === 1983–1986: Further collaborations and World of Echo ===,602666
"Russell continued to release dance singles such as ""Tell You Today"" (4th and Broadway, 1983), an upbeat dance groove and Loose Joints holdover featuring the vocals of Joyce Bowden.",0,9,== Career == | === 1983–1986: Further collaborations and World of Echo ===,602666
"Additional releases that followed included ""Wax the Van"" (Jump Street, 1987) and ""I Need More"" (Vinylmania, 1988), which paired Russell with erstwhile James Brown foil Lola Blank (then married to Bob Blank, Russell's preferred studio engineer); the Peter Zummo collaboration ""School Bell/Treehouse"" (Sleeping Bag, 1986); and ""Let's Go Swimming"" (Upside/Rough Trade, 1986), which anticipated later developments in tech house and was Russell's only dance single to be released under his own name.",1,9,== Career == | === 1983–1986: Further collaborations and World of Echo ===,602666
"The latter two records were remixed by legendary 70s-era DJ Walter Gibbons, who had renounced his career for evangelical Christianity and was employed as a buyer at Rock and Soul Records in Midtown.",2,9,== Career == | === 1983–1986: Further collaborations and World of Echo ===,602666
"Despite Gibbons's religious predilections, the two forged a dependable (if occasionally tempestuous) working relationship.",3,9,== Career == | === 1983–1986: Further collaborations and World of Echo ===,602666
"Further Gibbons/Russell collaborations include ""C-Thru"" (a dance version of ""See Through"" on World of Echo that remained unreleased until 2010) and a remix of Russell's ""Calling All Kids"" (eventually released on the 2004 compilation Calling out of Context).",4,9,== Career == | === 1983–1986: Further collaborations and World of Echo ===,602666
"At the same time, the album Tower of Meaning (Chatham Square) was released in a limited pressing on Philip Glass's private label.",5,9,== Career == | === 1983–1986: Further collaborations and World of Echo ===,602666
"The recording was made up of incidental music intended to accompany director Robert Wilson's staging of Medea, a partnership arranged by Glass.",6,9,== Career == | === 1983–1986: Further collaborations and World of Echo ===,602666
"Although widely perceived as an important breakthrough for Russell in the compositional world, creative squabbling between the downtown luminaries culminated in Wilson barring the composer from attending rehearsals and eventually ousting Russell from the project altogether in favor of British composer Gavin Bryars.",7,9,== Career == | === 1983–1986: Further collaborations and World of Echo ===,602666
"The ""compelling and meditative recording"", conducted by Julius Eastman, represents just a fragment of Russell's score, which includes voices along with its instrumentation.",8,9,== Career == | === 1983–1986: Further collaborations and World of Echo ===,602666
"While Russell tangentially remained affiliated with the new music sphere in New York until his death, continuing to perform in solo and group configurations at The Kitchen and Experimental Intermedia Foundation, Tower of Meaning was his final orchestral effort.",0,10,== Career == | === 1983–1986: Further collaborations and World of Echo ===,602666
"The rejection of Russell's Corn album (a suite of hip-hop-infused electropop including material later released on Calling Out of Context) by Socolov in 1985, coupled with creative disagreements between the two over ""Wax the Van"", resulted in Russell divesting himself from Sleeping Bag Records shortly after the release of ""Schoolbell/Treehouse"" in 1986.",1,10,== Career == | === 1983–1986: Further collaborations and World of Echo ===,602666
"According to Bob Blank in a followup to an Internet reposting of the (purportedly fallacious) 1986 article that detailed the subterfuge, Socolov ""wanted to take the label to 'another level"".",2,10,== Career == | === 1983–1986: Further collaborations and World of Echo ===,602666
"During the mid-1980s, Russell gave many performances, either accompanying himself on cello with a myriad of effects, or working with a small ensemble consisting of Steven Hall, Ernie Brooks, Peter Zummo, percussionist Mustafa Ahmed, and composer Elodie Lauten.",3,10,== Career == | === 1983–1986: Further collaborations and World of Echo ===,602666
"September 1986 saw the release of World of Echo (Upside/Rough Trade, 1986).",0,11,== Career == | === 1983–1986: Further collaborations and World of Echo ===,602666
"Heralded as ""a magnum opus of sorts"" by contemporary critics, it incorporated many of his ideas for pop, dance and classical music for both solo and cello format.",1,11,== Career == | === 1983–1986: Further collaborations and World of Echo ===,602666
"The album was well-reviewed in Britain and included in Melody Maker's ""Top Thirty Releases of 1986"", but failed commercially.",2,11,== Career == | === 1983–1986: Further collaborations and World of Echo ===,602666
"Russell also collaborated with a number of choreographers, including John Bernd, Diane Madden, Alison Salzinger and Stephanie Woodard.",3,11,== Career == | === 1983–1986: Further collaborations and World of Echo ===,602666
===,0,12,"== Career == | === 1986–1992: Later work, illness, and death ===",602666
"1986–1992: Later work, illness, and death",1,12,"== Career == | === 1986–1992: Later work, illness, and death ===",602666
===,2,12,"== Career == | === 1986–1992: Later work, illness, and death ===",602666
"Shortly after the release of World of Echo, Russell was diagnosed as HIV-positive.",0,13,"== Career == | === 1986–1992: Later work, illness, and death ===",602666
"Though the disease caused throat cancer (forcing Russell to undergo chemotherapy), he remained prolific, working on voice-and-cello songs for an album to be released by Philip Glass's Point Music (some of which surfaced on the posthumous Another Thought in 1994) and an electronic pop album (influenced by the likes of 808 State and William Orbit and provisionally titled 1-800-Dinosaur) for Rough Trade Records.",1,13,"== Career == | === 1986–1992: Later work, illness, and death ===",602666
Much of the material intended for this project was included on 2004's Calling Out of Context.,2,13,"== Career == | === 1986–1992: Later work, illness, and death ===",602666
"Although Russell reportedly planned to submit the album in the summer of 1987, he continued tinkering with potential songs for another four years.",3,13,"== Career == | === 1986–1992: Later work, illness, and death ===",602666
"According to Rough Trade founder Geoff Travis, ""It was frustrating, but I knew he needed my support to keep financing his music.",4,13,"== Career == | === 1986–1992: Later work, illness, and death ===",602666
"""Russell died of AIDS-related illnesses on April 4, 1992, at the age of 40.",5,13,"== Career == | === 1986–1992: Later work, illness, and death ===",602666
"In an April 28 column, Kyle Gann of The Village Voice wrote: ""His recent performances had been so infrequent due to illness, his songs were so personal, that it seems as though he simply vanished into his music.",6,13,"== Career == | === 1986–1992: Later work, illness, and death ===",602666
"""Russell was prolific, but was also notorious for leaving songs unfinished and continually revising his music.",7,13,"== Career == | === 1986–1992: Later work, illness, and death ===",602666
"Ernie Brooks said Russell ""never arrived at a completed version of anything.""",8,13,"== Career == | === 1986–1992: Later work, illness, and death ===",602666
"Peter Gordon stated, ""his quest wasn't really to do a finished product but more to do with exploring his different ways of working musically.""",9,13,"== Career == | === 1986–1992: Later work, illness, and death ===",602666
"He left behind more than 1,000 tapes when he died, 40 of them different mixes of one song.",10,13,"== Career == | === 1986–1992: Later work, illness, and death ===",602666
"According to Russell archivist Steve Knutson, the musician's estate consists of around 800 reels of 2"" and ¼"" tape, ""another few hundred cassettes, several dozen DAT tapes, hundreds and hundreds of pages of song lyrics and poetry"".",11,13,"== Career == | === 1986–1992: Later work, illness, and death ===",602666
==,0,14,== Personal life ==,602666
Personal life ==,1,14,== Personal life ==,602666
"As a young adult, Russell led a seemingly heterosexual lifestyle; at least two of these relationships (with Muriel Fujii in San Francisco and later Sydney Murray in New York) have been substantiated.",0,15,== Personal life ==,602666
"Although he briefly dated Allen Ginsberg in 1973, Russell did not identify as a gay man until becoming involved with hairdresser Louis Aquilone in 1976.",1,15,== Personal life ==,602666
