sentences,sentenceIndex,paragraphIndex,section,wikiId
"Jazz critic Leonard Feather responded in the October 3, 1956, issue of Down Beat with an open letter that questioned Kenton's racial views.",8,33,== Career == | === 1950s ===,661052
"Feather implied that Kenton's failure to win the Critics Poll was probably the real reason for the complaint, and wondered if racial prejudice was involved.",9,33,== Career == | === 1950s ===,661052
In hindsight the record shows Kenton's biggest sin is to have hastily fired off the comments.,10,33,== Career == | === 1950s ===,661052
"However, less than 2% of the over 600 sidemen with the Kenton band were African American.",11,33,== Career == | === 1950s ===,661052
"By the end of the decade Kenton was with the last incarnation of a 19-piece, 1950s-style Kenton orchestra.",12,33,== Career == | === 1950s ===,661052
"Many bands have been called a leader's ""best""; this last Kenton 1959 incarnation of the 1950s bands may very well be the best.",13,33,== Career == | === 1950s ===,661052
"The group would pull off one of Kenton's most artistic, subtle and introspective recordings, Standards in Silhouette.",14,33,== Career == | === 1950s ===,661052
"As trombonist Archie LeCoque recalled of this album of very slow ballads, ""...it was hard, but at the time we were all young and straight-ahead, we got through it and (two) albums came out well.""",15,33,== Career == | === 1950s ===,661052
By 1959 Stereophonic sound recording was now being fully utilized with all major labels.,16,33,== Career == | === 1950s ===,661052
"One of the great triumphs of the Standards in Silhouette album is the mature writing, the combination of the room used, a live group with very few overdubs, and the recording being in full stereo fidelity (and later remastered to digital).",17,33,== Career == | === 1950s ===,661052
Bill Mathieu was highly skeptical of the decision to record his music like Cuban Fire!,18,33,== Career == | === 1950s ===,661052
in a cavernous ballroom.,19,33,== Career == | === 1950s ===,661052
"Mathieu adds: ""Stan and producer Lee Gillette were absolutely right: the band sounds alive and awake (which is not easy when recording many hours of slow-tempo music in a studio), and most importantly, the players could hear themselves well in the live room.",20,33,== Career == | === 1950s ===,661052
"The end result is the band sounds strong and cohesive, and the album is well recorded.""",21,33,== Career == | === 1950s ===,661052
This is the last set of studio dates before Kenton would retool the entire orchestra in 1960.,22,33,== Career == | === 1950s ===,661052
=== 1960s,0,34,== Career == | === 1960s ===,661052
===,1,34,== Career == | === 1960s ===,661052
"The Kenton orchestra had been on a slow decline in sales and popularity in the late 1950s with having to compete with newer, popular music artists such as Elvis Presley, Bobby Darin and The Platters.",0,35,== Career == | === 1960s ===,661052
The nadir of this decline was around 1958 and coincided with a recession that was affecting the entire country.,1,35,== Career == | === 1960s ===,661052
There were far fewer big bands on the road and live music venues were hard to book for the Kenton orchestra.,2,35,== Career == | === 1960s ===,661052
The band would end 1959 beaten up by poor attendance at concerts and having to rely far more on dance halls than real jazz concerts.,3,35,== Career == | === 1960s ===,661052
"The band would reform in 1960 with a new look, a new sound, a larger group with a 'mellophonium' section added and an upsurge in Kenton's popularity.",4,35,== Career == | === 1960s ===,661052
"The new instrument was used by Kenton to ""bridge the gap"" in range, color, and tonality between his trumpet and trombone sections.",0,36,== Career == | === 1960s ===,661052
"Essentially it creates a conical, midrange sound that is common in a symphonic setting with a horn (French horn) but the bell of the instrument faces forward.",1,36,== Career == | === 1960s ===,661052
"Kenton's 1961 recording The Romantic Approach for Capitol is the first of 11 LPs that would feature the ""mellophonium band"".",2,36,== Career == | === 1960s ===,661052
Kenton arranged the whole first mellophonium album himself and it was very well received in a September 1961 review in Down Beat.,3,36,== Career == | === 1960s ===,661052
The Kenton Orchestra from 1960 to 1963 had numerous successes; the band had a relentless recording schedule.,0,37,== Career == | === 1960s ===,661052
"The albums Kenton's West Side Story (arrangements by Johnny Richards) and Adventures In Jazz, each won Grammy awards in 1962 and 1963 respectively.",1,37,== Career == | === 1960s ===,661052
Ralph Carmichael wrote a superb set of Christmas charts for Kenton which translated into one of the most popular recordings from the band leader to date: A Merry Christmas!.,2,37,== Career == | === 1960s ===,661052
"Also, Johnny Richards' Adventures in Time suite (recorded in 1962) was the culmination of all things the mellophonium band was capable of.",3,37,== Career == | === 1960s ===,661052
"After the Fall 1963 U.S./U.K. tour ended in November, the mellophonium incarnation of Kenton bands was done.",4,37,== Career == | === 1960s ===,661052
The conditions of Stan's divorce from jazz singer Ann Richards was that a judge ordered Stan to take a year off the road to help raise their two children or lose custody all together.,5,37,== Career == | === 1960s ===,661052
Kenton would not reform another road band for tour until 1965.,6,37,== Career == | === 1960s ===,661052
Kenton had ties from earlier writing of country/western songs that were a success with Capitol and again he tried his hand in that genre during the early 1960s.,0,38,== Career == | === 1960s ===,661052
"In a music market that was becoming increasingly tight, in 1962 he cut the hit single ""Mama Sang a Song""; his last Top-40 (No. 32 Billboard, No. 22 Music Vendor).",1,38,== Career == | === 1960s ===,661052
The song was a narration written by country singer Bill Anderson and spoken by Kenton.,2,38,== Career == | === 1960s ===,661052
The single also received a Grammy nomination the following year in the Best Documentary or Spoken Word Recording category.,3,38,== Career == | === 1960s ===,661052
The other attempt he made into that market was the far less successful Stan Kenton!,4,38,== Career == | === 1960s ===,661052
"Tex Ritter!, released in 1962 as a full LP.",5,38,== Career == | === 1960s ===,661052
"After the breakup of the mellophonium band, Kenton / Wagner (1964) was an important recording project that Kenton arranged himself, again moving towards ""progressive jazz"" or third stream music.",0,39,== Career == | === 1960s ===,661052
This album was not a financial success but kept Kenton at the forefront of 'art music' interpretation in the commercial music world.,1,39,== Career == | === 1960s ===,661052
Stan Kenton Conducts the Los Angeles Neophonic Orchestra (1965) was an artistic success that garnered another Grammy nomination for the band leader.,2,39,== Career == | === 1960s ===,661052
During this time Kenton also co-wrote the theme music for the short lived NBC television series Mister Roberts (1965–66).,3,39,== Career == | === 1960s ===,661052
The 1966–1969 Capitol releases for Stan Kenton were a severe low point for his recording career.,0,40,== Career == | === 1960s ===,661052
Capitol producer Lee Gillette was trying to exploit the money making possibilities of numerous popular hits to include the 1968 musical Hair featuring contemporary rock music.,1,40,== Career == | === 1960s ===,661052
"Due to lack of promotion by Capitol, four LPs were financial failures; this would be the last releases for Kenton under the aegis of long time Kenton producer Lee Gillette and Capitol.",2,40,== Career == | === 1960s ===,661052
"In fact, by the time it was recorded Kenton had no involvement in the Hair LP except for Kenton's name placed on the jacket cover; Ralph Carmichael and Lennie Niehaus were placed in charge of the project.",3,40,== Career == | === 1960s ===,661052
Two exceptions to this late 1960s period are the Billboard charted single the band cut of the Dragnet theme (1967) and another Kenton presents release featuring the music of composer and ex-bandsman Dee Barton: The Jazz Compositions of Dee Barton (1967).,4,40,== Career == | === 1960s ===,661052
The album featuring Barton's music was another unsung artistic success for the Kenton band though widely unseen commercially by the a music listening public.,5,40,== Career == | === 1960s ===,661052
=== 1970s,0,41,== Career == | === 1970s ===,661052
===,1,41,== Career == | === 1970s ===,661052
The transition from Capitol to Creative World Records in 1970 was fraught with difficulties during a time when the music business was changing rapidly.,0,42,== Career == | === 1970s ===,661052
"As a viable jazz artist who was trying to keep a loyal but dwindling following, Kenton turned to arrangers such as Hank Levy and Bob Curnow to write material that appealed to a younger audience.",1,42,== Career == | === 1970s ===,661052
"The first releases for the Creative World label were live concerts and Kenton had the control he wanted over content but lacked substantial resources to engineer, mix, and promote what Capitol underwrote in the past.",2,42,== Career == | === 1970s ===,661052
Kenton would take a big gamble to bypass the current record industry and rely far more on the direct mail lists of jazz fans which the newly formed Creative World label would need to sell records.,3,42,== Career == | === 1970s ===,661052
Kenton also made his print music available to college and high-school stage bands with several publishers.,4,42,== Career == | === 1970s ===,661052
"Kenton continued leading and touring with his big band up to his final performance on August 20, 1978; he disbanded the group due to his failing health.",5,42,== Career == | === 1970s ===,661052
In June 1973 Bob Curnow had started as the new artists and repertoire manager overseeing the whole operation of the Creative World Records.,0,43,== Career == | === 1970s ===,661052
It was just the year before (in 1972),1,43,== Career == | === 1970s ===,661052
the Kenton orchestra recorded the National Anthems of the World double LP with 40 arrangements all done by Curnow.,2,43,== Career == | === 1970s ===,661052
"As per Curnow himself, ""That was a remarkable and very difficult time for me.",3,43,== Career == | === 1970s ===,661052
"I was managing (Stan's) record company with NO experience in business, writing music like mad, living in a new place and culture (Los Angeles was another world), traveling a LOT (out with the band at least 1 week a month) and trying to keep it together at home.",4,43,== Career == | === 1970s ===,661052
"""When",5,43,== Career == | === 1970s ===,661052
"Kenton took to the road during the early 1970s and up to his last tour, he took with him seasoned veteran musicians (John Worster, Willie Maiden, Warren Gale, Graham Ellis and others) teaming them with relatively unknown young artists, and new arrangements (including those by Hank Levy, Bill Holman, Bob Curnow, Willie Maiden and Ken Hanna) were used.",6,43,== Career == | === 1970s ===,661052
"Many alumni associated with Kenton from this era became educators (Mike Vax, John Von Ohlen, Chuck Carter, Lisa Hittle and Richard Torres), and a few went on to take their musical careers to the next level, such as Peter Erskine, Douglas Purviance and Tim Hagans.",7,43,== Career == | === 1970s ===,661052
==,0,44,== Timeline of Stan Kenton Orchestras ==,661052
Timeline of Stan Kenton Orchestras ==,1,44,== Timeline of Stan Kenton Orchestras ==,661052
===,0,45,== Timeline of Stan Kenton Orchestras == | === Legacy ===,661052
Legacy =,1,45,== Timeline of Stan Kenton Orchestras == | === Legacy ===,661052
==,2,45,== Timeline of Stan Kenton Orchestras == | === Legacy ===,661052
Kenton was a salient figure on the American musical scene and made an indelible mark on the arranged type of big band jazz.,0,46,== Timeline of Stan Kenton Orchestras == | === Legacy ===,661052
Kenton's music evolved with the times from 1940 through the 1970s.,1,46,== Timeline of Stan Kenton Orchestras == | === Legacy ===,661052
He was at the vanguard of promoting jazz and jazz improvisation through his service as an educator through his Stan Kenton Band Clinics.,2,46,== Timeline of Stan Kenton Orchestras == | === Legacy ===,661052
"The ""Kenton Style"" continues to permeate big bands at the high school and collegiate level, and the framework he designed for the ""jazz clinic"" is still widely in use today.",3,46,== Timeline of Stan Kenton Orchestras == | === Legacy ===,661052
"Starting in the waning days of the big band era, Kenton found a multitude of ways in which to progress his art form.",0,47,== Timeline of Stan Kenton Orchestras == | === Legacy ===,661052
"In his hands the size of the jazz orchestra expanded greatly, at times exceeding forty musicians.",1,47,== Timeline of Stan Kenton Orchestras == | === Legacy ===,661052
"The frequency range (high and low notes) was also increased with the use of bass trombones and tuba, and baritone and bass saxophones.",2,47,== Timeline of Stan Kenton Orchestras == | === Legacy ===,661052
The dynamic range was pushed on both ends; the band could play softer and louder than any other big band.,3,47,== Timeline of Stan Kenton Orchestras == | === Legacy ===,661052
Kenton was the primary band leader responsible for moving the big band from the dance hall to the concert hall; one of the most important and successful players in the Third Stream movement.,4,47,== Timeline of Stan Kenton Orchestras == | === Legacy ===,661052
"Interest in his music has experienced somewhat of a resurgence, with critical ""rediscovery"" of his music and many reissues of his recordings.",0,48,== Timeline of Stan Kenton Orchestras == | === Legacy ===,661052
"An alumni band named for him tours, led by lead trumpeter Mike Vax, which performs not only classic Kenton arrangements, but also new music written and performed by the band members (much like Kenton's own groups).",1,48,== Timeline of Stan Kenton Orchestras == | === Legacy ===,661052
"Kenton donated his entire library to the music library of North Texas State University (now the University of North Texas), and the Stan Kenton Jazz Recital Hall is named in his honor.",2,48,== Timeline of Stan Kenton Orchestras == | === Legacy ===,661052
His arrangements are now published by Sierra Music Publications.,3,48,== Timeline of Stan Kenton Orchestras == | === Legacy ===,661052
"When comparing the four longest running touring jazz orchestras (Stan Kenton, Woody Herman, Count Basie, and Duke Ellington), Kenton's band had a higher turnover of personnel.",4,48,== Timeline of Stan Kenton Orchestras == | === Legacy ===,661052
"Bob Gioga, Buddy Childers, and Dick Shearer are among only a very few who played for Kenton for over a decade.",5,48,== Timeline of Stan Kenton Orchestras == | === Legacy ===,661052
"Other important soloists such as Lennie Niehaus, Bill Perkins and Chico Alvarez had lengthy stays on the band as well.",6,48,== Timeline of Stan Kenton Orchestras == | === Legacy ===,661052
"The list of noted jazz players, studio musicians is impressive and the consistency of the group from 1941 to Kenton's passing in 1979 is notable.",7,48,== Timeline of Stan Kenton Orchestras == | === Legacy ===,661052
Stan Kenton's leadership and music vision was clear to marshal the forces of such a diverse set of players and arrangers over this long period of time; Kenton stands alone in the respect.,8,48,== Timeline of Stan Kenton Orchestras == | === Legacy ===,661052
==,0,49,== Personal life ==,661052
Personal life ==,1,49,== Personal life ==,661052
"Kenton was born on December 15, 1911, according to his birth certificate, according to British biographer Michael Sparke.",0,50,== Personal life ==,661052
"Kenton was conceived out of wedlock, and his parents told him that he was born two months later than the actual date, February 19, 1912, to obscure this fact.",1,50,== Personal life ==,661052
"Kenton believed well into adulthood that the February date was his birthday, and recorded the Birthday In Britain concert album on February 19, 1973.",2,50,== Personal life ==,661052
"The true date remained a closely held secret, and his grave marker shows the incorrect February birthdate.",3,50,== Personal life ==,661052
Kenton was married three times.,4,50,== Personal life ==,661052
Three children were produced from the first two marriages.,5,50,== Personal life ==,661052
His first marriage was to Violet Rhoda Peters in 1935 and lasted for 15 years.,6,50,== Personal life ==,661052
"The couple had a daughter in 1941, Leslie.",7,50,== Personal life ==,661052
"In her 2010 memoir Love Affair, Leslie Kenton wrote that, from 1952 to 1954, when she was between the ages of 11 and 13, her father sexually molested and raped her.",8,50,== Personal life ==,661052
"She nonetheless maintained a close relationship with him during his lifetime, though she states that she was emotionally scarred by the experience.",9,50,== Personal life ==,661052
"She stated that the rapes always occurred under the influence of alcohol, that he was not fully aware of his actions, and that 20 years later he apologized profusely.",10,50,== Personal life ==,661052
"Leslie was an author of several books about health, spirituality and beauty.",11,50,== Personal life ==,661052
"In 1955, Stan Kenton married San Diego-born singer Ann Richards, who was 23 years his junior.",12,50,== Personal life ==,661052
The relationship produced two children: daughter Dana Lynn and son Lance.,13,50,== Personal life ==,661052
"In 1961, Richards posed for a nude layout in Playboy magazine's June 1961 issue.",14,50,== Personal life ==,661052
"She signed a contract to record with Atco, a company other than Capitol Records that her husband was unaware of.",15,50,== Personal life ==,661052
"The Playboy shoot was done without Kenton's knowledge, and he only found out about it while playing at the Aragon Ballroom in Chicago when handed the magazine by Charles Suter, who was the editor of Down Beat magazine at the time.",16,50,== Personal life ==,661052
"Richards was not typically on the road with the band, though she had recorded the album Two Much!",17,50,== Personal life ==,661052
with Kenton in 1960.,18,50,== Personal life ==,661052
"Kenton filed for divorce in August 1961 and it was finalized in 1962, he would retain custody of their two children.",19,50,== Personal life ==,661052
"Kenton's third marriage was to KABC production assistant Jo Ann Hill, in 1967.",20,50,== Personal life ==,661052
This also ended in a separation in 1969 with the divorce following in 1970.,21,50,== Personal life ==,661052
"In his later years he lived with his public relations secretary and last business manager, Audree Coke Kenton, though they never formally married.",22,50,== Personal life ==,661052
Kenton's heavy consumption of alcohol contributed to ongoing accidents and the physical difficulties he encountered during the last 10 years of his life.,23,50,== Personal life ==,661052
"Kenton's son Lance became a member of the controversial Synanon new-age community in California, and served as one of its ""Imperial Marines,"" a group entrusted with committing violence against former members and others considered enemies of the community.",24,50,== Personal life ==,661052
"In 1978 he was arrested for helping to put a rattlesnake in the mailbox of an anti-Synanon lawyer, and was sentenced to a year in prison.",25,50,== Personal life ==,661052
"Kenton had two serious accidental falls, one in the early 1970s and one in May of 1977 while on tour in Reading, Pennsylvania.",26,50,== Personal life ==,661052
The second fall was very serious as he fractured his skull.,27,50,== Personal life ==,661052
The last two years of his life became far more physically challenging for Kenton from the effects of the two accidents.,28,50,== Personal life ==,661052
"On August 17, 1979, he was admitted to Midway Hospital near his home in Los Angeles after a stroke; he died eight days later, on August 25.",0,51,== Personal life ==,661052
At the time of his death he had three grandchildren.,1,51,== Personal life ==,661052
"Kenton was interred in the Westwood Village Memorial Park Cemetery, Los Angeles.",2,51,== Personal life ==,661052
==,0,52,== Gold records and charts (singles and albums) ==,661052
Gold records and charts (singles and albums),1,52,== Gold records and charts (singles and albums) ==,661052
==,2,52,== Gold records and charts (singles and albums) ==,661052
Gold Records,0,53,== Gold records and charts (singles and albums) ==,661052
1944 Artistry in Rhythm (Capitol Records) instrumental,0,54,== Gold records and charts (singles and albums) ==,661052
1945 Tampico (Capitol Records) vocal by June Christy and band,0,55,== Gold records and charts (singles and albums) ==,661052
1945 Shoo-Fly Pie and Apple Pan Dowdy (Capitol Records) vocal by June Christy and band,0,56,== Gold records and charts (singles and albums) ==,661052
===,0,57,== Gold records and charts (singles and albums) == | === Hits as charted singles ===,661052
Hits as charted singles ===,1,57,== Gold records and charts (singles and albums) == | === Hits as charted singles ===,661052
(Songs that reached the top of the US or UK charts),0,58,== Gold records and charts (singles and albums) == | === Hits as charted singles ===,661052
"Between 1944 and 1967, Stan Kenton had numerous hits on Billboard's charts.",0,59,== Gold records and charts (singles and albums) == | === Hits as charted singles ===,661052
===,0,60,== Gold records and charts (singles and albums) == | === Hits as charted albums ===,661052
Hits as charted albums ===,1,60,== Gold records and charts (singles and albums) == | === Hits as charted albums ===,661052
(Albums charting history with Billboard Magazine),0,61,== Gold records and charts (singles and albums) == | === Hits as charted albums ===,661052
==,0,62,== Awards and honors ==,661052
Awards and honors ==,1,62,== Awards and honors ==,661052
===,0,63,== Awards and honors == | === Wins and honors from major publications ===,661052
Wins and honors from major publications ===,1,63,== Awards and honors == | === Wins and honors from major publications ===,661052
===,0,64,== Awards and honors == | === Grammy Awards ===,661052
Grammy Awards ===,1,64,== Awards and honors == | === Grammy Awards ===,661052
Grammy Hall of Fame,0,65,== Awards and honors == | === Grammy Awards ===,661052
===,0,66,== Awards and honors == | === International Music Awards ===,661052
International Music Awards =,1,66,== Awards and honors == | === International Music Awards ===,661052
==,2,66,== Awards and honors == | === International Music Awards ===,661052
===,0,67,== Awards and honors == | === Other awards and honors ===,661052
Other awards and honors ===,1,67,== Awards and honors == | === Other awards and honors ===,661052
1978 – Honorary Doctorate of Music: University of Redlands,0,68,== Awards and honors == | === Other awards and honors ===,661052
1974 – Honorary Doctorate of Humane Letters: Drury College,0,69,== Awards and honors == | === Other awards and honors ===,661052
1968 – Honorary Doctorate of Music: Villanova University,0,70,== Awards and honors == | === Other awards and honors ===,661052
1967 – Intercollegiate Music Festival Hall of Fame Award,0,71,== Awards and honors == | === Other awards and honors ===,661052
Named to the International Association for Jazz Education Hall of Fame (1980),0,72,== Awards and honors == | === Other awards and honors ===,661052
Honored on the Hollywood Walk of Fame (Recording – 6340 Hollywood Blvd.),0,73,== Awards and honors == | === Other awards and honors ===,661052
"""City of Glass"" is honored in The Wire's ""100 Records That Set The World on Fire"" (While No One Was Listening).""",0,74,== Awards and honors == | === Other awards and honors ===,661052
===,0,75,== Awards and honors == | === Posthumously honored ===,661052
Posthumously honored ===,1,75,== Awards and honors == | === Posthumously honored ===,661052
"2011 – ""Stan Kenton: Artistry In Rhythm- Portrait Of A Jazz Legend"" (DVD)EMPixx Awards – Platinum Award in the Documentary Category/Platinum Award in the Use of Music Category.",0,76,== Awards and honors == | === Posthumously honored ===,661052
United States Library of Congress National Recording Registry,0,77,== Awards and honors == | === Posthumously honored ===,661052
Artistry in Rhythm (single) – Stan Kenton – Released:1943 – Inducted: 2011 -	Category: Jazz,0,78,== Awards and honors == | === Posthumously honored ===,661052
==,0,79,== Noted band personnel ==,661052
Noted band personnel ==,1,79,== Noted band personnel ==,661052
==,0,80,== Discography and on film and television ==,661052
Discography and on film and television ==,1,80,== Discography and on film and television ==,661052
===,0,81,== Discography and on film and television == | === Studio albums ===,661052
Studio albums ===,1,81,== Discography and on film and television == | === Studio albums ===,661052
===,0,82,== Discography and on film and television == | === Live albums ===,661052
Live albums ===,1,82,== Discography and on film and television == | === Live albums ===,661052
===,0,83,== Discography and on film and television == | === Compilations ===,661052
Compilations ===,1,83,== Discography and on film and television == | === Compilations ===,661052
===,0,84,== Discography and on film and television == | === On film or television ===,661052
On film or television ===,1,84,== Discography and on film and television == | === On film or television ===,661052
==,0,85,== Compositions ==,661052
Compositions ==,1,85,== Compositions ==,661052
"Stan Kenton's compositions include ""Artistry in Rhythm"", released as V-Disc No.",0,86,== Compositions ==,661052
