sentences,sentenceIndex,paragraphIndex,section,wikiId
"Stanley Newcomb Kenton (December 15, 1911 – August 25, 1979) was an American popular music and jazz artist.",0,0,N/A,661052
"As a pianist, composer, arranger and band leader, he led an innovative and influential jazz orchestra for almost four decades.",1,0,N/A,661052
"Though Kenton had several pop hits from the early 1940s into the 1960s, his music was always forward-looking.",2,0,N/A,661052
"Kenton was also a pioneer in the field of jazz education, creating the Stan Kenton Jazz Camp in 1959 at Indiana University.",3,0,N/A,661052
==,0,1,== Early life ==,661052
Early life ==,1,1,== Early life ==,661052
"Stan Kenton was born on December 15, 1911, in Wichita, Kansas; he had two sisters (Beulah and Erma Mae) born three and eight years after him.",0,2,== Early life ==,661052
"His parents, Floyd and Stella Kenton, had moved the family back to Colorado, then, finally in 1924 to the Greater Los Angeles Area, settling in suburban Bell, California.",1,2,== Early life ==,661052
"Kenton attended Bell High School; his high-school yearbook picture has the prophetic notation ""Old Man Jazz"".",2,2,== Early life ==,661052
Kenton started learning piano as a teen from a local pianist and organist.,3,2,== Early life ==,661052
"When he was around 15 and in high school, pianist and arranger Ralph Yaw introduced him to the music of Louis Armstong and Earl Hines.",4,2,== Early life ==,661052
He graduated from high school in 1930.,5,2,== Early life ==,661052
"By the age of 16, Kenton was already playing a regular solo piano gig at a local hamburger eatery for 50 cents a night plus tips; during that time he had his own performing group named ""The Bell-Tones"".",0,3,== Early life ==,661052
His first arrangement was written during this time for a local eight-piece band that played in nearby Long Beach.,1,3,== Early life ==,661052
==,0,4,== Career ==,661052
Career ==,1,4,== Career ==,661052
=== 1930s,0,5,== Career == | === 1930s ===,661052
===,1,5,== Career == | === 1930s ===,661052
"With very little money, Kenton traveled to speakeasys in San Diego and Las Vegas playing piano.",0,6,== Career == | === 1930s ===,661052
"By 1932 he was playing with the Francis Gilbert Territory band and would tour through Arizona; he would go on to working with the Everett Hoagland Orchestra in 1933, which would be his first time playing at the Rendezvous Ballroom.",1,6,== Career == | === 1930s ===,661052
"He would then play with Russ Plummer, Hal Grayson and eventually got a big break with Gus Arnheim.",2,6,== Career == | === 1930s ===,661052
In April 1936 Arnheim was reorganizing his band into the style of Benny Goodman's groups and Kenton was to take the piano chair.,3,6,== Career == | === 1930s ===,661052
This is where Kenton would make his first recordings when Arnheim made 14 sides for the Brunswick label in summer of 1937.,4,6,== Career == | === 1930s ===,661052
"Once he departed from Gus Arnheim's group, Kenton went back to study with private teachers on both the piano and in composition.",5,6,== Career == | === 1930s ===,661052
In 1938 Kenton would join Vido Musso in a short-lived band but a very educational experience for him.,6,6,== Career == | === 1930s ===,661052
From the core of this group came the line up of the first Stan Kenton groups of the 1940s.,0,7,== Career == | === 1930s ===,661052
Kenton would also go on to working with the NBC House Band and in various Hollywood studios and clubs.,1,7,== Career == | === 1930s ===,661052
Producer George Avakian took notice of Kenton during this time while he worked as the pianist and Assistant Musical Director at the Earl Carroll Theatre Restaurant in Hollywood.,2,7,== Career == | === 1930s ===,661052
Kenton started to get the idea of running his own band from this experience; he created a rehearsal band of his own which eventually become his group in the 1940s.,3,7,== Career == | === 1930s ===,661052
===,0,8,== Career == | === 1940s ===,661052
1940s,1,8,== Career == | === 1940s ===,661052
===,2,8,== Career == | === 1940s ===,661052
"In 1940, Kenton formed his first orchestra.",0,9,== Career == | === 1940s ===,661052
Kenton worked in the early days with his own groups as much more of an arranger than a featured pianist.,1,9,== Career == | === 1940s ===,661052
"Although there were no ""name"" musicians in his first band (with the possible exception of bassist Howard Rumsey and trumpeter Chico Alvarez), Kenton spent the summer of 1941 playing regularly before an audience at the Rendezvous Ballroom in Balboa Beach, CA.",2,9,== Career == | === 1940s ===,661052
"Influenced by Benny Carter and Jimmie Lunceford, the Stan Kenton Orchestra struggled for a time after its initial success.",3,9,== Career == | === 1940s ===,661052
Its Decca recordings were not big sellers and a stint as Bob Hope's backup radio band during the 1943–44 season was an unhappy experience; Les Brown permanently took Kenton's place.,4,9,== Career == | === 1940s ===,661052
"Kenton's first appearance in New York was in February 1942 at the Roseland Ballroom, with the marquee featuring an endorsement by Fred Astaire.",0,10,== Career == | === 1940s ===,661052
"By late 1943, with a contract with the newly formed Capitol Records, a popular record in ""Eager Beaver"", and growing recognition, the Stan Kenton Orchestra was gradually catching on; it developed into one of the best-known West Coast ensembles of the 1940s.",1,10,== Career == | === 1940s ===,661052
"Its soloists during the war years included Art Pepper, briefly Stan Getz, altoist Boots Mussulli, and singer Anita O'Day.",2,10,== Career == | === 1940s ===,661052
"By 1945, the band had evolved.",3,10,== Career == | === 1940s ===,661052
"The songwriter Joe Greene provided the lyrics for hit songs like ""And Her Tears Flowed Like Wine"" and ""Don't Let the Sun Catch You Cryin'"".",4,10,== Career == | === 1940s ===,661052
"Pete Rugolo became the chief arranger (extending Kenton's ideas), Bob Cooper and Vido Musso offered very different tenor styles, and June Christy was Kenton's new singer; her hits (including ""Tampico"" and Greene's ""Across the Alley from the Alamo"") made it possible for Kenton to finance his more ambitious projects.",5,10,== Career == | === 1940s ===,661052
====,0,11,== Career == | ==== Artistry in Rhythm ====,661052
Artistry in Rhythm =,1,11,== Career == | ==== Artistry in Rhythm ====,661052
===,2,11,== Career == | ==== Artistry in Rhythm ====,661052
"When composer/arranger Pete Rugolo joined the Stan Kenton Orchestra as staff arranger in late 1945 he brought with him his love of jazz, Stravinsky and Bartók.",0,12,== Career == | ==== Artistry in Rhythm ====,661052
"Given free rein by Kenton, Rugolo experimented.",1,12,== Career == | ==== Artistry in Rhythm ====,661052
"Although Kenton himself was already trying experimental scores prior to Rugolo's tenure, it was Rugolo who brought extra jazz and classical influences much needed to move the band forward artistically.",2,12,== Career == | ==== Artistry in Rhythm ====,661052
"During his first six months on the staff, Rugolo tried to copy Kenton's sound; on encouragement from the leader he explored his own voice.",0,13,== Career == | ==== Artistry in Rhythm ====,661052
"By incorporating compositional techniques borrowed from the modern classical music he studied, Rugolo was a key part of one of Kenton's most fertile and creative periods.",1,13,== Career == | ==== Artistry in Rhythm ====,661052
"After a string of mostly arrangements, Rugolo turned out three originals that Kenton featured on the band's first album in 1946: (Artistry in Rhythm): ""Artistry in Percussion"", ""Safranski"" and ""Artistry in Bolero"".",0,14,== Career == | ==== Artistry in Rhythm ====,661052
"Added to this mix came ""Machito"", ""Rhythm Incorporated"", ""Monotony"" and ""Interlude"" in early 1947 (though some were not recorded until later in the year).",1,14,== Career == | ==== Artistry in Rhythm ====,661052
"These compositions, along with June Christy's voice, came to define the Artistry in Rhythm band.",2,14,== Career == | ==== Artistry in Rhythm ====,661052
"Afro-Cuban writing was added to the Kenton book with compositions like Rugolo's ""Machito.""",3,14,== Career == | ==== Artistry in Rhythm ====,661052
"The Artistry in Rhythm ensemble was a formative band, with outstanding soloists.",0,15,== Career == | ==== Artistry in Rhythm ====,661052
"By early 1947, the Stan Kenton Orchestra had reached a high point of financial and popular success.",1,15,== Career == | ==== Artistry in Rhythm ====,661052
They played in the best theaters and ballrooms in America and numerous hit records.,2,15,== Career == | ==== Artistry in Rhythm ====,661052
Dances at the many ballrooms were typically four hours a night and theater dates generally involved playing mini concerts between each showing of the movie.,3,15,== Career == | ==== Artistry in Rhythm ====,661052
"This was sometimes five or six a day, stretching from morning to late night.",4,15,== Career == | ==== Artistry in Rhythm ====,661052
Most days not actually playing were spent in buses or cars.,5,15,== Career == | ==== Artistry in Rhythm ====,661052
Days off from performing were rare.,6,15,== Career == | ==== Artistry in Rhythm ====,661052
"For Stan Kenton they just allowed for more record signing, radio station interviews, and advertising for Capitol Records.",7,15,== Career == | ==== Artistry in Rhythm ====,661052
"Due to the financial and personal demands, following an April performance in Tuscaloosa, he broke up the Artistry in Rhythm incarnation of Kenton ensembles.",8,15,== Career == | ==== Artistry in Rhythm ====,661052
====,0,16,== Career == | ==== Progressive Jazz ====,661052
Progressive Jazz =,1,16,== Career == | ==== Progressive Jazz ====,661052
===,2,16,== Career == | ==== Progressive Jazz ====,661052
"After a hiatus of five months, Kenton formed a new, larger ensemble to present Concerts in Progressive Jazz.",0,17,== Career == | ==== Progressive Jazz ====,661052
"This goal proved mostly obtainable but the band had to still fill in its schedule by booking dances and movie theater jobs, especially over the summer.",1,17,== Career == | ==== Progressive Jazz ====,661052
Pete Rugolo composed and arranged the great bulk of the new music; Kenton declared these works to be Progressive Jazz.,0,18,== Career == | ==== Progressive Jazz ====,661052
"A student of famed composer and educator Russ Garcia, Bob Graettinger wrote numerous works for the band, starting with his composition Thermopylae.",1,18,== Career == | ==== Progressive Jazz ====,661052
"His ground-breaking composition City of Glass was premiered by the band in Chicago in April, but not recorded for another two and a half years, in a reworked version for the Innovations Orchestra.",2,18,== Career == | ==== Progressive Jazz ====,661052
"Ken Hanna, who began the tour as a trumpet player, contributed a few compositions to the new band, including Somnambulism.",3,18,== Career == | ==== Progressive Jazz ====,661052
"Kenton contributed no new scores to the Progressive Jazz band, although several of his older works were performed on concerts, including Concerto to End All Concertos, Eager Beaver, Opus in Pastels, and Artistry in Rhythm.",4,18,== Career == | ==== Progressive Jazz ====,661052
"Cuban inflected titles from the Progressive Jazz period include Rugolo's Introduction to a Latin Rhythm, Cuban Carnival, The Peanut Vendor, and Journey to Brazil, and Bob Graettinger's Cuban Pastorale.",0,19,== Career == | ==== Progressive Jazz ====,661052
The addition of a full-time bongo player and a Brazilian guitarist in the band enabled Kenton's cadre of composers to explore Afro-Latin rhythms to far greater possibilities.,1,19,== Career == | ==== Progressive Jazz ====,661052
"The Progressive Jazz period lasted 14 months, beginning on September 24, 1947, when the Stan Kenton Orchestra played a concert at the Rendezvous Ballroom.",0,20,== Career == | ==== Progressive Jazz ====,661052
"And it ended after the last show at the Paramount Theatre in New York City on December 14, 1948.",1,20,== Career == | ==== Progressive Jazz ====,661052
"The band produced only one album and a handful of singles, due to a recording ban by the American Federation of Musicians that lasted the entirety of 1948.",2,20,== Career == | ==== Progressive Jazz ====,661052
"The lone record, ""A Presentation of Progressive Jazz,"" received a 3 out of 4 rating from Tom Herrick in DownBeat.",3,20,== Career == | ==== Progressive Jazz ====,661052
"Metronome rated it ""C"" calling it a ""jerry-built jumble of effects and counter-effects"" and ""this album presents very little that can justifiably be called either jazz or progressive.""",4,20,== Career == | ==== Progressive Jazz ====,661052
"Billboard scored it 80 out of 100, but declared it ""as mumbo-jumbo a collection of cacophony as has ever been loosed on an unsuspecting public.",5,20,== Career == | ==== Progressive Jazz ====,661052
"Many sidemen from the Artistry band returned, but there were significant changes.",6,20,== Career == | ==== Progressive Jazz ====,661052
"Laurindo Almeida on classical guitar, and Jack Costanzo on bongos dramatically changed the band's timbre.",7,20,== Career == | ==== Progressive Jazz ====,661052
"Both were firsts for the Kenton band, or any jazz band for that matter.",8,20,== Career == | ==== Progressive Jazz ====,661052
"The rhythm section included returnees Eddie Safranski (bass) and Shelly Manne (drums), both destined to win first place Down Beat awards.",9,20,== Career == | ==== Progressive Jazz ====,661052
Kids are going haywire over the sheer noise of this band…There is a danger of an entire generation growing up with the idea that jazz and the atom bomb are essentially the same natural phenomenon.,0,21,== Career == | ==== Progressive Jazz ====,661052
"Four of the five trumpet players returned: Buddy Childers, Ray Wetzel, Chico Alvarez, and Ken Hanna.",0,22,== Career == | ==== Progressive Jazz ====,661052
Al Porcino was added to the already powerhouse section.,1,22,== Career == | ==== Progressive Jazz ====,661052
"Conte Candoli joined the band, replacing Porcino, in February 1948.",2,22,== Career == | ==== Progressive Jazz ====,661052
"Kai Winding, star trombonist of the Artistry in Rhythm band would not be a part of the Progressive Jazz era, except for a few dates on which he subbed.",0,23,== Career == | ==== Progressive Jazz ====,661052
Milt Bernhart came in on lead trombone.,1,23,== Career == | ==== Progressive Jazz ====,661052
And Bart Varsalona returned on bass trombone.,2,23,== Career == | ==== Progressive Jazz ====,661052
"Bernhart's first big solo with the Kenton band proved to be a major hit, The Peanut Vendor.",3,23,== Career == | ==== Progressive Jazz ====,661052
The saxophone section was much improved and modernized.,0,24,== Career == | ==== Progressive Jazz ====,661052
"Returning saxophonists included baritone Bob Gioga, holding down his chair since the very start, and Bob Cooper on tenor.",1,24,== Career == | ==== Progressive Jazz ====,661052
"With Vido Musso's departure, Cooper and his modernist sound became the featured tenor soloist.",2,24,== Career == | ==== Progressive Jazz ====,661052
"Art Pepper came on as second alto, the ""jazz"" chair.",3,24,== Career == | ==== Progressive Jazz ====,661052
And the new lead alto was George Weidler.,4,24,== Career == | ==== Progressive Jazz ====,661052
This was literally a band of all-stars.,0,25,== Career == | ==== Progressive Jazz ====,661052
"They received five first place awards in the Down Beat poll at the end of 1947, and similar awards from the other magazines.",1,25,== Career == | ==== Progressive Jazz ====,661052
The arrangers continued to push the limits of these superb instrumentalists in their compositions.,2,25,== Career == | ==== Progressive Jazz ====,661052
"Works from this period are more sophisticated than those written for the Artistry band, and are some of the first and most successful ""third stream"" compositions.",3,25,== Career == | ==== Progressive Jazz ====,661052
"The band criss-crossed the country, appearing in the nation's top concert venues, including Carnegie Hall, Boston Symphony Hall, Chicago Civic Opera House, Academy of Music (Philadelphia), and the Hollywood Bowl.",0,26,== Career == | ==== Progressive Jazz ====,661052
"They had extended stays at New York's Paramount Theatre and Hotel Commodore, Philadelphia's Click, Detroit's Eastwood Gardens, Radio City Theater in Minneapolis, and the Rendezvous Ballroom, a special place in Kenton's musical life.",1,26,== Career == | ==== Progressive Jazz ====,661052
"Kenton's band was the first to present a concert in the famous outdoor arena, the Hollywood Bowl.",0,27,== Career == | ==== Progressive Jazz ====,661052
"His concert there on June 12, 1948, drew more than 15,000 people, and was both an artistic and commercial success.",1,27,== Career == | ==== Progressive Jazz ====,661052
"Kenton pocketed half of the box office, walking away with $13,000 for the evening's concert.",2,27,== Career == | ==== Progressive Jazz ====,661052
The band broke attendance records all across the country.,3,27,== Career == | ==== Progressive Jazz ====,661052
"Thanks to Kenton's public relations acumen, he was able to convince concert goers and record buyers of the importance of his music.",4,27,== Career == | ==== Progressive Jazz ====,661052
Comedy numbers and June Christy vocals helped break up the seriousness of the new music.,5,27,== Career == | ==== Progressive Jazz ====,661052
Kenton's successes did not sit well with everyone.,0,28,== Career == | ==== Progressive Jazz ====,661052
"In an essay entitled Economics and Race in Jazz, Leslie B. Rout Jr. wrote that ""the real scourge of the 1946–1949 period was the all-white Stan Kenton band.",1,28,== Career == | ==== Progressive Jazz ====,661052
"Dubbing his musical repertoire 'progressive jazz,' Kenton saw his orchestra become the first in jazz history to reach an annual gross of $1,000,000 in 1948.""",2,28,== Career == | ==== Progressive Jazz ====,661052
"He contrasted this with a situation in which critical and public recognition of ""Dizzy Gillespie as the premiere bopper could not be transformed into coin of the realm.",3,28,== Career == | ==== Progressive Jazz ====,661052
"""At the end of 1948, as the band was fulfilling an extended engagement at the Paramount Theater in New York City, the leader notified his sidemen, his bookers, and the press, that he would be disbanding once more.",4,28,== Career == | ==== Progressive Jazz ====,661052
Kenton's most artistically and commercially successful band ceased to be at the top of their game.,5,28,== Career == | ==== Progressive Jazz ====,661052
"On December 14, the Stan Kenton Orchestra played their last notes for over a year.",6,28,== Career == | ==== Progressive Jazz ====,661052
"When they returned, there would be new faces, new music and a string section.",7,28,== Career == | ==== Progressive Jazz ====,661052
=== 1950s,0,29,== Career == | === 1950s ===,661052
===,1,29,== Career == | === 1950s ===,661052
"After a year's hiatus, in 1950 Kenton finally put together the large 39-piece Innovations in Modern Music Orchestra that included 16 strings, a woodwind section, and two French horns.",0,30,== Career == | === 1950s ===,661052
"The music was an extension of the works composed and recorded since 1947 by Bob Graettinger, Manny Albam, Franklyn Marks and others.",1,30,== Career == | === 1950s ===,661052
"Name jazz musicians such as Maynard Ferguson, Shorty Rogers, Milt Bernhart, John Graas, Art Pepper, Bud Shank, Bob Cooper, Laurindo Almeida, Shelly Manne, and June Christy were part of these musical ensembles.",2,30,== Career == | === 1950s ===,661052
"The groups managed two tours during 1950–51, from a commercial standpoint it would be Stan Kenton's first major failure.",3,30,== Career == | === 1950s ===,661052
Kenton soon reverted to a more standard 19-piece lineup.,4,30,== Career == | === 1950s ===,661052
"In order to be more commercially viable, Kenton reformed the band in 1951 to a much more standard instrumentation: five saxes, five trombones, five trumpets, piano, guitar, bass, drums.",5,30,== Career == | === 1950s ===,661052
"The charts of such arrangers as Gerry Mulligan, Johnny Richards, and particularly Bill Holman and Bill Russo began to dominate the repertoire.",6,30,== Career == | === 1950s ===,661052
"The music was written to better reflect the style of cutting edge, be-bop oriented big bands, such as those of Dizzy Gillespie or Woody Herman.",7,30,== Career == | === 1950s ===,661052
"Young, talented players and outstanding jazz soloists such as Maynard Ferguson, Lee Konitz, Conte Candoli, Sal Salvador, and Frank Rosolino made strong contributions to the level of the 1952–53 band.",8,30,== Career == | === 1950s ===,661052
The music composed and arranged during this time was far more tailor-made to contemporary jazz tastes; the 1953 album New Concepts of Artistry in Rhythm is noted as one of the high points in Kenton's career as band leader.,9,30,== Career == | === 1950s ===,661052
"Though the band was to have a very strong ""concert book"", Kenton also made sure the dance book was made new, fresh and contemporary.",10,30,== Career == | === 1950s ===,661052
The album Sketches on Standards from 1953 is an excellent example of Kenton appealing to a wider audience while using the band and Bill Russo's arranging skills to their fullest potential.,11,30,== Career == | === 1950s ===,661052
"Even though the personnel changed rather rapidly, Kenton's focus was very clear on where he would lead things musically.",12,30,== Career == | === 1950s ===,661052
By this time producer Lee Gillette worked well in concert with Kenton to create a balanced set of recordings that were both commercially viable and cutting edge musically.,13,30,== Career == | === 1950s ===,661052
"Arguably the most ""swinging"" band Kenton was to field came when legendary drummer Mel Lewis joined the orchestra in 1954.",0,31,== Career == | === 1950s ===,661052
Kenton's Contemporary Concepts (1955) and Kenton in Hi-Fi (1956) albums during this time are very impressive as a be-bop recording and then a standard dance recording (respectively).,1,31,== Career == | === 1950s ===,661052
"Kenton in Hi-Fis wide popularity and sales benefited from the fact it was his greatest hits of ten years earlier re-recorded in stereo with a contemporary, much higher level band.",2,31,== Career == | === 1950s ===,661052
The album climbed all the way up to #22 on the Billboard album charts and provided much needed revenue at a time when Rock n Roll had started to become the dominant pop music in the United States.,3,31,== Career == | === 1950s ===,661052
It would become more and more difficult for Kenton to alternate between 'dance' and serious 'jazz' albums while staying financially solvent.,4,31,== Career == | === 1950s ===,661052
"During the summer of the summer of 1955 (July–September), Kenton was to become the host of the CBS television series Music 55.",0,32,== Career == | === 1950s ===,661052
"While it offered 10 weeks of great exposure to a rapidly expanding television audience, the show failed.",1,32,== Career == | === 1950s ===,661052
It was plagued by poor production techniques and a strange combination of guests that did not work well with what Kenton had envisioned.,2,32,== Career == | === 1950s ===,661052
He ended up being stiff and out of place with what the producers tried to achieve.,3,32,== Career == | === 1950s ===,661052
Kenton had to burn the candle at both ends flying in to do the show then flying back out to meet his band out on the road.,4,32,== Career == | === 1950s ===,661052
The New York production team was limited by using an American Federation of Musicians roster of local players; Kenton wanted his own band to do the show.,5,32,== Career == | === 1950s ===,661052
There would be another attempt for the Kenton organization to place the band on regularly scheduled television programming in 1958.,6,32,== Career == | === 1950s ===,661052
"After six Kenton financed episodes on KTTV in Los Angeles, there would be no sponsors to step up and back the show.",7,32,== Career == | === 1950s ===,661052
One of the standout projects and recordings for the mid-1950s band is the Cuban Fire! album released in 1956.,0,33,== Career == | === 1950s ===,661052
"Though Stan Kenton had recorded earlier hits such as The Peanut Vendor in 1947 with Latin percussionist Machito, as well as many other Latin flavored singles, the Cuban Fire! suite and LP stands as a watershed set of compositions for Johnny Richards' career and an outstanding commercial/artistic achievement for the Kenton orchestra, and a singular landmark in large ensemble Latin jazz recordings.",1,33,== Career == | === 1950s ===,661052
"""CUBAN FIRE is completely authentic, the way it combines big-band jazz with genuine Latin-American rhythms.""",2,33,== Career == | === 1950s ===,661052
The success of the Cuban Fire!,3,33,== Career == | === 1950s ===,661052
album can be gauged in part by the immediate ascent of Johnny Richards' star after its release; he was suddenly offered a contract by Bethlehem Records to record what would be the first of several recordings with his own groups.,4,33,== Career == | === 1950s ===,661052
"At one point, Kenton faced a controversy in 1956 with comments he made when the band returned from a European tour.",5,33,== Career == | === 1950s ===,661052
The current Critics Poll in Down Beat was now dominated by African-American musicians in virtually every category.,6,33,== Career == | === 1950s ===,661052
"The Kenton band was playing in Ontario, Canada, at the time, and Kenton dispatched a telegram which lamented ""a new minority, white jazz musicians,"" and stated his ""disgust [with the so-called] literary geniuses of jazz.""",7,33,== Career == | === 1950s ===,661052
