time_expression,POST_tag,time_token,type_token,time_expression_type,sentences,sentenceIndex,paragraphIndex,section,wikiId
"September 21 , 1968","NNP CD , CD",MONTH_REGEX DIGIT_REGEX_1 COMMA_REGEX YEAR_REGEX_1,TIME NUMERAL MODIFIER TIME,time_reference,"Ronna Renee Reeves (born September 21, 1968 in Big Spring, Texas) is a country music singer.",0,0,,17586273
Spring,NN,SEASON_REGEX,TIME,time_reference,"Ronna Renee Reeves (born September 21, 1968 in Big Spring, Texas) is a country music singer.",0,0,,17586273
1990 and 1998,CD CC CD,YEAR_REGEX_1 LINKAGE_REGEX YEAR_REGEX_1,TIME MODIFIER TIME,time_range,"Between 1990 and 1998, she released five studio albums, including three on Mercury Records; she has also charted five singles on the Hot Country Songs charts.",1,0,,17586273
1992,CD,YEAR_REGEX_1,TIME,time_reference,"Her highest-charting single was ""The More I Learn (The Less I Understand About Love)"", which reached number 49 in 1992.",2,0,,17586273
1992,CD,YEAR_REGEX_1,TIME,time_reference,"Also in 1992, she was nominated for Top New Female Vocalist at the Academy of Country Music Awards, along with Paulette Carlson and Trisha Yearwood, but lost to Trisha.",3,0,,17586273
Yearwood,NNP,TIME_UNIT_REGEX,TIME,time_reference,"Also in 1992, she was nominated for Top New Female Vocalist at the Academy of Country Music Awards, along with Paulette Carlson and Trisha Yearwood, but lost to Trisha.",3,0,,17586273
1995,CD,YEAR_REGEX_1,TIME,time_reference,"After leaving Mercury in 1995, Reeves signed to River North Records and released two more albums.",0,1,,17586273
Day 14,NNP CD,TIME_UNIT_REGEX DIGIT_REGEX_1,TIME NUMERAL,time_reference,"The second album she recorded for River North Records, Day 14, was more pop-oriented and she simply went by Ronna.",1,1,,17586273
2010,CD,YEAR_REGEX_1,TIME,time_reference,"Since 2010, Ronna along with Liz Morin and Morgan Mills manage, ShowBiz-Ro Music, an Independent Songplugging & Writer Management Service, in Nashville, TN.",0,2,,17586273
