time_expression,POST_tag,time_token,type_token,time_expression_type,sentences,sentenceIndex,paragraphIndex,section,wikiId
Tonite,NNP,DAY_TIME_REGEX,TIME,time_reference,"His debut single, consisting of two songs, ""Rock U Tonite"" and ""Stoopid"", was released in 2013.",2,0,,54227051
2013,CD,YEAR_REGEX_1,TIME,time_reference,"His debut single, consisting of two songs, ""Rock U Tonite"" and ""Stoopid"", was released in 2013.",2,0,,54227051
year,NN,TIME_UNIT_REGEX,TIME,time_reference,"The same year, he signed with Australian independent record label Future Classic, who also signed other electronic artists including Cashmere Cat and Flume.",3,0,,54227051
Future,NNP,TIMELINE_REGEX,TIME,time_reference,"The same year, he signed with Australian independent record label Future Classic, who also signed other electronic artists including Cashmere Cat and Flume.",3,0,,54227051
2015,CD,YEAR_REGEX_1,TIME,time_reference,"His ""Flash Drive"" EP was released in 2015, featuring a guest appearance by Lido.",4,0,,54227051
2021,CD,YEAR_REGEX_1,TIME,time_reference,"In 2021, he released his debut full-length album, To Stop From Falling Off The Earth.",5,0,,54227051
Day,NNP,TIME_UNIT_REGEX,TIME,time_reference,"Australian festival highlights include Splendour In The Grass, Field Day, Groovin' the Moo and Falls Festival.",7,0,,54227051
Falls,NNP,SEASON_REGEX,TIME,time_reference,"Australian festival highlights include Splendour In The Grass, Field Day, Groovin' the Moo and Falls Festival.",7,0,,54227051
2014,CD,YEAR_REGEX_1,TIME,time_reference,"He has also toured in support of Disclosure during their Australian tour in 2014, and Porter Robinson during his Australian tour in 2015, alongside Cosmo's Midnight.",8,0,,54227051
2015,CD,YEAR_REGEX_1,TIME,time_reference,"He has also toured in support of Disclosure during their Australian tour in 2014, and Porter Robinson during his Australian tour in 2015, alongside Cosmo's Midnight.",8,0,,54227051
Midnight,NNP,DAY_TIME_REGEX,TIME,time_reference,"He has also toured in support of Disclosure during their Australian tour in 2014, and Porter Robinson during his Australian tour in 2015, alongside Cosmo's Midnight.",8,0,,54227051
26 April 1992,CD NNP CD,DIGIT_REGEX_1 MONTH_REGEX YEAR_REGEX_1,NUMERAL TIME TIME,time_point,"Purcell was born in Sydney, New South Wales on 26 April 1992.",0,2,== Early life and career ==,54227051
2014,CD,YEAR_REGEX_1,TIME,time_reference,"In 2014, he released the stand-alone single ""Streamers"".",3,2,== Early life and career ==,54227051
2015,CD,YEAR_REGEX_1,TIME,time_reference,"In 2015, he released the songs ""Flash Drive (featuring B▲BY)"" and ""World Record (featuring Lido)"", as singles for his debut EP Flash Drive.",5,2,== Early life and career ==,54227051
"October 15 , 2015","NNP CD , CD",MONTH_REGEX DIGIT_REGEX_1 COMMA_REGEX YEAR_REGEX_1,TIME NUMERAL MODIFIER TIME,time_reference,"The EP consisted of 4 tracks and was released on October 15, 2015.",6,2,== Early life and career ==,54227051
the 2016,DT CD,PREFIX_REGEX_1 YEAR_REGEX_1,MODIFIER TIME,time_reference,"The title track, ""Flash Drive"", was featured in the official soundtrack for the 2016 racing video game Forza Horizon 3.",7,2,== Early life and career ==,54227051
2017,CD,YEAR_REGEX_1,TIME,time_reference,"In 2017, Wave Racer's remix of Flight Facilities' ""Stand Still"" was sampled without clearance by Fetty Wap in his song ""Way You Are"".",8,2,== Early life and career ==,54227051
"April 24 , 2021","NNP CD , CD",MONTH_REGEX DIGIT_REGEX_1 COMMA_REGEX YEAR_REGEX_1,TIME NUMERAL MODIFIER TIME,time_reference,"On April 24, 2021, Wave Racer performed live as a part of Porter Robinson's virtual festival Secret Sky.",9,2,== Early life and career ==,54227051
"August 6 , 2021","NNP CD , CD",MONTH_REGEX DIGIT_REGEX_1 COMMA_REGEX YEAR_REGEX_1,TIME NUMERAL MODIFIER TIME,time_reference,"On August 6, 2021, Wave Racer was featured on Triple J's ""Like A Version"" segment, in which he performed a cover of The 1975's ""It's Not Living (If It's Not With You)"", as well as his single ""Look Up To Yourself"".",11,2,== Early life and career ==,54227051
of The 1975,IN DT CD,PREFIX_REGEX_1 PREFIX_REGEX_1 YEAR_REGEX_1,MODIFIER MODIFIER TIME,time_reference,"On August 6, 2021, Wave Racer was featured on Triple J's ""Like A Version"" segment, in which he performed a cover of The 1975's ""It's Not Living (If It's Not With You)"", as well as his single ""Look Up To Yourself"".",11,2,== Early life and career ==,54227051
"October 29 , 2021","NNP CD , CD",MONTH_REGEX DIGIT_REGEX_1 COMMA_REGEX YEAR_REGEX_1,TIME NUMERAL MODIFIER TIME,time_reference,"On October 29, 2021, Wave Racer released his debut full-length album To Stop From Falling Off The Earth through Astral People Recordings, a co-operative record label formed with PIAS.",12,2,== Early life and career ==,54227051
2013,CD,YEAR_REGEX_1,TIME,time_reference,"In 2013, Wave Racer was nominated for a J Award in the ""Unearthed Artist of the Year"" category.",0,4,== Awards ==,54227051
of the Year,IN DT NN,PREFIX_REGEX_1 PREFIX_REGEX_1 TIME_UNIT_REGEX,MODIFIER MODIFIER TIME,time_reference,"In 2013, Wave Racer was nominated for a J Award in the ""Unearthed Artist of the Year"" category.",0,4,== Awards ==,54227051
2015,CD,YEAR_REGEX_1,TIME,time_reference,"In 2015, he won the FBi Radio SMAC award (Sydney's Music Arts & Culture award) for ""Best Producer"".",1,4,== Awards ==,54227051
2013,CD,YEAR_REGEX_1,TIME,time_reference,2013,0,10,== Discography == | === Remixes ===,54227051
Midnight,NNP,DAY_TIME_REGEX,TIME,time_reference,"Cosmo's Midnight – ""The Dofflin (Wave Racer Remix)""",0,14,== Discography == | === Remixes ===,54227051
2014,CD,YEAR_REGEX_1,TIME,time_reference,"Ghost Town DJ's – ""My Boo (Wave Racer Remix)""2014",0,15,== Discography == | === Remixes ===,54227051
2015,CD,YEAR_REGEX_1,TIME,time_reference,"Ryan Hemsworth – ""Ryan Must Be Destroyed (Wave Racer Remix)""2015",0,17,== Discography == | === Remixes ===,54227051
2016,CD,YEAR_REGEX_1,TIME,time_reference,"Snakehips featuring Chance The Rapper & Tinashe – ""All My Friends (Wave Racer Remix)""2016",0,19,== Discography == | === Remixes ===,54227051
2017,CD,YEAR_REGEX_1,TIME,time_reference,"Flume featuring Kai – ""Never Be like You (Wave Racer Remix)""2017",0,20,== Discography == | === Remixes ===,54227051
2021,CD,YEAR_REGEX_1,TIME,time_reference,2021,0,23,== Discography == | === Covers ===,54227051
of The 1975,IN DT CD,PREFIX_REGEX_1 PREFIX_REGEX_1 YEAR_REGEX_1,MODIFIER MODIFIER TIME,time_reference,"""It's Not Living (If It's Not With You)"" – cover of The 1975 (performed live for Triple J's ""Like A Version"")",0,25,== Discography == | === Covers ===,54227051
