time_expression,POST_tag,time_token,type_token,time_expression_type,sentences,sentenceIndex,paragraphIndex,section,wikiId
"March 11 , 1890 – May 11 , 1969","NNP CD , CD NN NNP CD , CD",MONTH_REGEX DIGIT_REGEX_1 COMMA_REGEX YEAR_REGEX_1 LINKAGE_REGEX MONTH_REGEX DIGIT_REGEX_1 COMMA_REGEX YEAR_REGEX_1,TIME NUMERAL MODIFIER TIME MODIFIER TIME NUMERAL MODIFIER TIME,time_reference,"Wilbert Lee ""Pappy"" O'Daniel (March 11, 1890 – May 11, 1969) was an American Democratic Party politician from Texas, who came to prominence by hosting a popular radio program.",0,0,,615400
1939–1941,CD,YEAR_REGEX_1,TIME,time_reference,"Known for his populist appeal and support of Texas's business community, O'Daniel served as the 34th governor of Texas (1939–1941) and later its junior United States senator (1941–1949).",1,0,,615400
1941–1949,CD,YEAR_REGEX_1,TIME,time_reference,"Known for his populist appeal and support of Texas's business community, O'Daniel served as the 34th governor of Texas (1939–1941) and later its junior United States senator (1941–1949).",1,0,,615400
1909,CD,YEAR_REGEX_1,TIME,time_reference,"In 1909 he relocated to Anthony, Kansas to become a stenographer and bookkeeper for a flour milling company.",4,2,== Early life ==,615400
1925,CD,YEAR_REGEX_1,TIME,time_reference,"After time with companies in Kansas City, Missouri and New Orleans, in 1925 he began to work for the Burrus Mill flour company in Fort Worth.",5,2,== Early life ==,615400
the late 1920s,DT JJ CD,PREFIX_REGEX_1 PREFIX_REGEX_1 YEAR_REGEX_1,MODIFIER MODIFIER TIME,time_reference,"In the late 1920s, O'Daniel assumed responsibility for the Burrus company's radio advertising.",0,4,== Radio fame ==,615400
noontime,NN,DAY_TIME_REGEX,TIME,time_reference,"O'Daniel also hosted a regular noontime radio show heard statewide, which gave him his nickname after a catchphrase used frequently on air – ""pass the biscuits, Pappy"" – and propelled him into the public spotlight.",5,4,== Radio fame ==,615400
each day,DT NN,PREFIX_REGEX_1 TIME_UNIT_REGEX,MODIFIER TIME,time_reference,"As a national magazine reporter wrote at the time: ""At twelve-thirty sharp each day, a fifteen-minute silence reigned in the state of Texas, broken only by mountain music, and the dulcet voice of W. Lee O'Daniel.""",7,4,== Radio fame ==,615400
1938,CD,YEAR_REGEX_1,TIME,time_reference,"In 1938, he ran for governor of Texas as a Democrat.",0,7,== Political career == | === Governor ===,615400
1940,CD,YEAR_REGEX_1,TIME,time_reference,"Despite this position change, he remained personally popular and handily won re-election in 1940.",5,7,== Political career == | === Governor ===,615400
1941,CD,YEAR_REGEX_1,TIME,time_reference,"In 1941, O'Daniel ran for the United States Senate in a special election.",0,9,== Political career == | === U.S. Senate ===,615400
the 1948,DT CD,PREFIX_REGEX_1 YEAR_REGEX_1,MODIFIER TIME,time_reference,"As a result of this experience, in the 1948 election, Johnson prepared for a close runoff by arranging for his supporters who controlled votes, including George Parr, to withhold their final tallies until the statewide results were announced.",2,9,== Political career == | === U.S. Senate ===,615400
the 1944,DT CD,PREFIX_REGEX_1 YEAR_REGEX_1,MODIFIER TIME,time_reference,He endorsed the anti-Roosevelt Texas Regulars in the 1944 presidential election.,4,9,== Political career == | === U.S. Senate ===,615400
1942,CD,YEAR_REGEX_1,TIME,time_reference,"Elected to a full term in 1942, O'Daniel refused to run for another term in 1948.",5,9,== Political career == | === U.S. Senate ===,615400
1948,CD,YEAR_REGEX_1,TIME,time_reference,"Elected to a full term in 1942, O'Daniel refused to run for another term in 1948.",5,9,== Political career == | === U.S. Senate ===,615400
1956 and 1958,CD CC CD,YEAR_REGEX_1 LINKAGE_REGEX YEAR_REGEX_1,TIME MODIFIER TIME,time_range,O'Daniel ran for governor in 1956 and 1958 and claimed that the Brown v. Board of Education decision was part of a Communist conspiracy.,0,12,== Later career ==,615400
"May 11 , 1969","NNP CD , CD",MONTH_REGEX DIGIT_REGEX_1 COMMA_REGEX YEAR_REGEX_1,TIME NUMERAL MODIFIER TIME,time_reference,"O'Daniel died in Dallas on May 11, 1969.",0,14,== Death and burial ==,615400
The 2000,DT CD,PREFIX_REGEX_1 YEAR_REGEX_1,MODIFIER TIME,time_reference,"The 2000 Coen Brothers film O Brother, Where Art Thou? featured a character played by Charles Durning and named Governor Pappy O'Daniel, loosely based on the real O'Daniel, and set in Mississippi.",0,16,== In popular culture ==,615400
1935,CD,YEAR_REGEX_1,TIME,time_reference,Dallas 1935 on YouTube,1,19,== External links ==,615400
