time_expression,POST_tag,time_token,type_token,time_expression_type,sentences,sentenceIndex,paragraphIndex,section,wikiId
2004,CD,YEAR_REGEX_1,TIME,time_reference,"Broken Promises Of America: At Home And Abroad, Past And Present: An Encyclopedia For Our Times by (Douglas F. Dowd (2004) ISBN 978-1-56751-313-4.",0,137,== Bibliography == | === Contributor ===,88493
1950–2000,CD,YEAR_REGEX_1,TIME,time_reference,Deserter From Death: Dispatches From Western Europe 1950–2000 by Daniel Singer (2005) ISBN 978-1-56025-642-7.,0,138,== Bibliography == | === Contributor ===,88493
2005,CD,YEAR_REGEX_1,TIME,time_reference,Deserter From Death: Dispatches From Western Europe 1950–2000 by Daniel Singer (2005) ISBN 978-1-56025-642-7.,0,138,== Bibliography == | === Contributor ===,88493
1994,CD,YEAR_REGEX_1,TIME,time_reference,"Ecocide of Native America: Environmental Destruction of Indian Lands and Peoples by Donald Grinde, Bruce Johansen (1994) ISBN 978-0-940666-52-8.",0,139,== Bibliography == | === Contributor ===,88493
2000,CD,YEAR_REGEX_1,TIME,time_reference,Eugene V. Debs Reader: Socialism and the Class Struggle by William A. Pelz (2000) ISBN 978-0-9704669-0-7.,0,140,== Bibliography == | === Contributor ===,88493
1985–1995,CD,YEAR_REGEX_1,TIME,time_reference,"From a Native Son: Selected Essays in Indigenism, 1985–1995 by Ward Churchill (1996) ISBN 978-0-89608-553-4.",0,141,== Bibliography == | === Contributor ===,88493
1996,CD,YEAR_REGEX_1,TIME,time_reference,"From a Native Son: Selected Essays in Indigenism, 1985–1995 by Ward Churchill (1996) ISBN 978-0-89608-553-4.",0,141,== Bibliography == | === Contributor ===,88493
2005,CD,YEAR_REGEX_1,TIME,time_reference,Green Parrots: A War Surgeon's Diary by Gino Strada (2005) ISBN 978-88-8158-420-8.,0,142,== Bibliography == | === Contributor ===,88493
2004,CD,YEAR_REGEX_1,TIME,time_reference,"And The Selling Of American Empire by Sut Jhally editor, Jeremy Earp editor (2004) ISBN 978-1-56656-581-3.",1,143,== Bibliography == | === Contributor ===,88493
2004,CD,YEAR_REGEX_1,TIME,time_reference,by Micah Ian Wright (2004) ISBN 978-1-58322-626-1.,1,144,== Bibliography == | === Contributor ===,88493
2006,CD,YEAR_REGEX_1,TIME,time_reference,Iraq: The Logic of Withdrawal by Anthony Arnove (2006) ISBN 978-1-59558-079-5.,0,145,== Bibliography == | === Contributor ===,88493
2006,CD,YEAR_REGEX_1,TIME,time_reference,"Impeach the President: The Case Against Bush and Cheney Dennis Loo (Editor), Peter Phillips (Editor), Seven Stories Press: 2006 ISBN 978-1-58322-743-5.",0,146,== Bibliography == | === Contributor ===,88493
2004,CD,YEAR_REGEX_1,TIME,time_reference,"Life of an Anarchist: The Alexander Berkman Reader by Alexander Berkman Gene Fellner, editor (2004) ISBN 978-1-58322-662-9.",0,147,== Bibliography == | === Contributor ===,88493
2006,CD,YEAR_REGEX_1,TIME,time_reference,Long Shadows: Veterans' Paths to Peace by David Giffey editor (2006) ISBN 978-1-891859-64-9.,0,148,== Bibliography == | === Contributor ===,88493
Years,NNP,TIME_UNIT_REGEX,TIME,time_reference,"Masters of War: Latin America and United States Aggression from the Cuban Revolution Through the Clinton Years by Clara Nieto, Chris Brandt (trans) (2003) ISBN 978-1-58322-545-5.",0,149,== Bibliography == | === Contributor ===,88493
2003,CD,YEAR_REGEX_1,TIME,time_reference,"Masters of War: Latin America and United States Aggression from the Cuban Revolution Through the Clinton Years by Clara Nieto, Chris Brandt (trans) (2003) ISBN 978-1-58322-545-5.",0,149,== Bibliography == | === Contributor ===,88493
2004,CD,YEAR_REGEX_1,TIME,time_reference,"Peace Signs: The Anti-War Movement Illustrated by James Mann, editor (2004) ISBN 978-3-283-00487-3.",0,150,== Bibliography == | === Contributor ===,88493
the Morning,DT NNP,PREFIX_REGEX_1 DAY_TIME_REGEX,MODIFIER TIME,time_reference,Prayer for the Morning Headlines: On the Sanctity of Life and Death by Daniel Berrigan (poetry) and Adrianna Amari (photography) (2007) ISBN 978-1-934074-16-9.,0,151,== Bibliography == | === Contributor ===,88493
2007,CD,YEAR_REGEX_1,TIME,time_reference,Prayer for the Morning Headlines: On the Sanctity of Life and Death by Daniel Berrigan (poetry) and Adrianna Amari (photography) (2007) ISBN 978-1-934074-16-9.,0,151,== Bibliography == | === Contributor ===,88493
2002,CD,YEAR_REGEX_1,TIME,time_reference,"Silencing Political Dissent: How Post-9-11 Anti-terrorism Measures Threaten Our Civil Liberties by Nancy Chang, Center for Constitutional Rights (2002) ISBN 978-1-58322-494-6.",0,152,== Bibliography == | === Contributor ===,88493
2005,CD,YEAR_REGEX_1,TIME,time_reference,Soldiers In Revolt: GI Resistance During The Vietnam War by David Cortright (2005) ISBN 978-1-931859-27-1.,0,153,== Bibliography == | === Contributor ===,88493
2002,CD,YEAR_REGEX_1,TIME,time_reference,Sold to the Highest Bidder: The Presidency from Dwight D. Eisenhower to George W. Bush by Daniel M. Friedenberg (2002) ISBN 978-1-57392-923-3.,0,154,== Bibliography == | === Contributor ===,88493
2000,CD,YEAR_REGEX_1,TIME,time_reference,"The Autobiography of Abbie Hoffman Intro by Norman Mailer, Afterword by HZ (2000) ISBN 978-1-56858-197-2.",0,155,== Bibliography == | === Contributor ===,88493
2004,CD,YEAR_REGEX_1,TIME,time_reference,The Case for Socialism by Alan Maass (2004) ISBN 978-1-931859-09-7.,0,156,== Bibliography == | === Contributor ===,88493
2003,CD,YEAR_REGEX_1,TIME,time_reference,"The Forging of the American Empire: From the Revolution to Vietnam, a History of U.S. Imperialism by Sidney Lens (2003) ISBN 978-0-7453-2101-1.",0,157,== Bibliography == | === Contributor ===,88493
2004,CD,YEAR_REGEX_1,TIME,time_reference,"The Higher Law: Thoreau on Civil Disobedience and Reform by Henry David Thoreau, Wendell Glick, editor (2004) ISBN 978-0-691-11876-5.",0,158,== Bibliography == | === Contributor ===,88493
1971,CD,YEAR_REGEX_1,TIME,time_reference,The Iron Heel by Jack London (1971) ISBN 978-0-14-303971-6.,0,159,== Bibliography == | === Contributor ===,88493
1992,CD,YEAR_REGEX_1,TIME,time_reference,The Sixties Experience: Hard Lessons about Modern America by Edward P. Morgan (1992) ISBN 978-1-56639-014-9.,0,160,== Bibliography == | === Contributor ===,88493
2003,CD,YEAR_REGEX_1,TIME,time_reference,"You Back the Attack, We'll Bomb Who We Want by Micah Ian Wright (2003) ISBN 978-1-58322-584-4.",0,161,== Bibliography == | === Contributor ===,88493
2002,CD,YEAR_REGEX_1,TIME,time_reference,A People's History of the American Revolution by Ray Raphael (2002) ISBN 978-0-06-000440-8.,0,162,== Bibliography == | === Contributor ===,88493
1999,CD,YEAR_REGEX_1,TIME,time_reference,A People's History of the United States (1999),0,164,== Bibliography == | === Recordings ===,88493
2002,CD,YEAR_REGEX_1,TIME,time_reference,Artists in the Time of War (2002),0,165,== Bibliography == | === Recordings ===,88493
2000,CD,YEAR_REGEX_1,TIME,time_reference,"Heroes & Martyrs: Emma Goldman, Sacco & Vanzetti, and the Revolutionary Struggle (2000)",0,166,== Bibliography == | === Recordings ===,88493
2000,CD,YEAR_REGEX_1,TIME,time_reference,Stories Hollywood Never Tells (2000),0,167,== Bibliography == | === Recordings ===,88493
2005,CD,YEAR_REGEX_1,TIME,time_reference,"You Can't Blow Up A Social Relationship, CD including Zinn lectures and performances by rock band Resident Genius (Thick Records, 2005)",0,168,== Bibliography == | === Recordings ===,88493
1976,CD,YEAR_REGEX_1,TIME,time_reference,Emma (1976),0,170,== Bibliography == | === Theatre ===,88493
1985,CD,YEAR_REGEX_1,TIME,time_reference,Daughter of Venus (1985),0,171,== Bibliography == | === Theatre ===,88493
1999,CD,YEAR_REGEX_1,TIME,time_reference,Marx in Soho (1999),0,172,== Bibliography == | === Theatre ===,88493
