time_expression,POST_tag,time_token,type_token,time_expression_type,sentences,sentenceIndex,paragraphIndex,section,wikiId
"August 24 , 1922 – January 27 , 2010","NNP CD , CD NNP NNP CD , CD",MONTH_REGEX DIGIT_REGEX_1 COMMA_REGEX YEAR_REGEX_1 LINKAGE_REGEX MONTH_REGEX DIGIT_REGEX_1 COMMA_REGEX YEAR_REGEX_1,TIME NUMERAL MODIFIER TIME MODIFIER TIME NUMERAL MODIFIER TIME,time_reference,"Howard Zinn (August 24, 1922 – January 27, 2010) was an American historian, playwright, philosopher, socialist thinker and World War II veteran.",0,0,,88493
1980,CD,YEAR_REGEX_1,TIME,time_reference,"Zinn wrote over 20 books, including his best-selling and influential A People's History of the United States in 1980.",2,0,,88493
2007,CD,YEAR_REGEX_1,TIME,time_reference,"In 2007, he published a version of it for younger readers, A Young People's History of the United States.",3,0,,88493
2002,CD,YEAR_REGEX_1,TIME,time_reference,"His memoir, You Can't Be Neutral on a Moving Train (Beacon Press, 2002), was also the title of a 2004 documentary about Zinn's life and work.",7,0,,88493
of a 2004,IN DT CD,PREFIX_REGEX_1 INARTICLE_REGEX YEAR_REGEX_1,MODIFIER MODIFIER TIME,time_reference,"His memoir, You Can't Be Neutral on a Moving Train (Beacon Press, 2002), was also the title of a 2004 documentary about Zinn's life and work.",7,0,,88493
2010,CD,YEAR_REGEX_1,TIME,time_reference,"Zinn died of a heart attack in 2010, at age 87.",8,0,,88493
"August 24 , 1922","NNP CD , CD",MONTH_REGEX DIGIT_REGEX_1 COMMA_REGEX YEAR_REGEX_1,TIME NUMERAL MODIFIER TIME,time_reference,"Zinn was born to a Jewish immigrant family in Brooklyn on August 24, 1922.",0,3,== Life and career == | === Early life ===,88493
the Eastern,DT JJ,PREFIX_REGEX_1 HOLIDAY_REGEX,MODIFIER TIME,time_reference,"His father, Eddie Zinn, born in Austria-Hungary, immigrated to the U.S. with his brother Samuel before the outbreak of World War I. His mother, Jenny (Rabinowitz) Zinn, emigrated from the Eastern Siberian city of Irkutsk.",1,3,== Life and career == | === Early life ===,88493
many years,JJ NNS,PREFIX_REGEX_1 TIME_UNIT_REGEX,MODIFIER TIME,time_reference,"For many years, his father was in the waiters' union and worked as a waiter for weddings and bar mitzvahs.",5,3,== Life and career == | === Early life ===,88493
1940,CD,YEAR_REGEX_1,TIME,time_reference,"Thus, after graduating from high school in 1940, Zinn took the Civil Service exam and became an apprentice shipfitter in the New York Navy Yard at the age of 18.",17,3,== Life and career == | === Early life ===,88493
a week,DT NN,INARTICLE_REGEX TIME_UNIT_REGEX,MODIFIER TIME,time_reference,"The head organizers of the association, which included Zinn himself, would meet once a week outside of work to discuss strategy and read books that at the time were considered radical.",20,3,== Life and career == | === Early life ===,88493
April 1945,NNP CD,MONTH_REGEX YEAR_REGEX_1,TIME TIME,time_reference,"As bombardier, Zinn dropped napalm bombs in April 1945 on Royan, a seaside resort in western France.",2,5,== Life and career == | === World War II ===,88493
nine years,CD NNS,BASIC_NUMBER_REGEX_1 TIME_UNIT_REGEX,NUMERAL TIME,time_reference,"On a post-doctoral research mission nine years later, Zinn visited the resort near Bordeaux where he interviewed residents, reviewed municipal documents, and read wartime newspaper clippings at the local library.",4,5,== Life and career == | === World War II ===,88493
1966,CD,YEAR_REGEX_1,TIME,time_reference,"In 1966, Zinn returned to Royan after which he gave his fullest account of that research in his book, The Politics of History.",5,5,== Life and career == | === World War II ===,88493
weeks,NNS,TIME_UNIT_REGEX,TIME,time_reference,"In The Politics of History, Zinn described how the bombing was ordered—three weeks before the war in Europe ended—by military officials who were, in part, motivated more by the desire for their own career advancement than in legitimate military objectives.",7,5,== Life and career == | === World War II ===,88493
recently,RB,TIMELINE_REGEX,TIME,time_reference,"Two Czech citizens who lived in Pilsen at the time told me, recently, that several hundred people were killed in that raid (that is, Czechs)—not five.",1,6,== Life and career == | === World War II ===,88493
1995,CD,YEAR_REGEX_1,TIME,time_reference,"In his pamphlet, Hiroshima: Breaking the Silence written in 1995, he laid out the case against targeting civilians with aerial bombing.",2,7,== Life and career == | === World War II ===,88493
Six years,CD NNS,BASIC_NUMBER_REGEX_1 TIME_UNIT_REGEX,NUMERAL TIME,time_reference,"Six years later, he wrote:Recall that in the midst of the Gulf War, the U.S. military bombed an air raid shelter, killing 400 to 500 men, women, and children who were huddled to escape bombs.",0,8,== Life and career == | === World War II ===,88493
1951,CD,YEAR_REGEX_1,TIME,time_reference,"After World War II, Zinn attended New York University on the GI Bill, graduating with a B.A. in 1951.",0,10,== Life and career == | === Education ===,88493
1952,CD,YEAR_REGEX_1,TIME,time_reference,"At Columbia University, he earned an M.A. (1952) and a Ph.D. in history with a minor in political science (1958).",1,10,== Life and career == | === Education ===,88493
1958,CD,YEAR_REGEX_1,TIME,time_reference,"At Columbia University, he earned an M.A. (1952) and a Ph.D. in history with a minor in political science (1958).",1,10,== Life and career == | === Education ===,88493
of 1914,IN CD,PREFIX_REGEX_1 YEAR_REGEX_1,MODIFIER TIME,time_reference,His master's thesis examined the Colorado coal strikes of 1914.,2,10,== Life and career == | === Education ===,88493
of the twenties,IN DT NNS,PREFIX_REGEX_1 PREFIX_REGEX_1 DECADE_REGEX,MODIFIER MODIFIER TIME,time_reference,"His doctoral dissertation Fiorello LaGuardia in Congress was a study of Fiorello LaGuardia's congressional career, and it depicted ""the conscience of the twenties"" as LaGuardia fought for public power, the right to strike, and the redistribution of wealth by taxation.",3,10,== Life and career == | === Education ===,88493
1960–61,CD,YEAR_REGEX_1,TIME,time_reference,"""In 1960–61, Zinn was a post-doctoral fellow in East Asian Studies at Harvard University.",10,10,== Life and career == | === Education ===,88493
1956 to 1963,CD TO CD,YEAR_REGEX_1 LINKAGE_REGEX YEAR_REGEX_1,TIME MODIFIER TIME,time_range,"Zinn was professor of history at Spelman College in Atlanta from 1956 to 1963, and visiting professor at both the University of Paris and University of Bologna.",0,12,== Life and career == | === Academic career ===,88493
year,NN,TIME_UNIT_REGEX,TIME,time_reference,"At the end of the academic year in 1963, Zinn was fired from Spelman for insubordination.",1,12,== Life and career == | === Academic career ===,88493
1963,CD,YEAR_REGEX_1,TIME,time_reference,"At the end of the academic year in 1963, Zinn was fired from Spelman for insubordination.",1,12,== Life and career == | === Academic career ===,88493
1964,CD,YEAR_REGEX_1,TIME,time_reference,"In 1964, he accepted a position at Boston University (BU), after writing two books and participating in the Civil Rights Movement in the South.",3,12,== Life and career == | === Academic career ===,88493
24 years,CD NNS,DIGIT_REGEX_1 TIME_UNIT_REGEX,NUMERAL TIME,time_reference,"A professor of political science, he taught at BU for 24 years and retired in 1988 at age 66.",5,12,== Life and career == | === Academic career ===,88493
1988,CD,YEAR_REGEX_1,TIME,time_reference,"A professor of political science, he taught at BU for 24 years and retired in 1988 at age 66.",5,12,== Life and career == | === Academic career ===,88493
1979,CD,YEAR_REGEX_1,TIME,time_reference,Rivers and Zinn were among a group of faculty members who in 1979 defended the right of the school's clerical workers to strike and were threatened with dismissal after refusing to cross a picket line.,3,13,== Life and career == | === Academic career ===,88493
1981,CD,YEAR_REGEX_1,TIME,time_reference,The book was a finalist for the National Book Award in 1981.,10,13,== Life and career == | === Academic career ===,88493
the years,DT NNS,PREFIX_REGEX_1 TIME_UNIT_REGEX,MODIFIER TIME,time_reference,"In the years since the first edition of A People's History was published in 1980, it has been used as an alternative to standard textbooks in many college history courses, and it is one of the most widely known examples of critical pedagogy.",0,14,== Life and career == | === Academic career ===,88493
1980,CD,YEAR_REGEX_1,TIME,time_reference,"In the years since the first edition of A People's History was published in 1980, it has been used as an alternative to standard textbooks in many college history courses, and it is one of the most widely known examples of critical pedagogy.",0,14,== Life and career == | === Academic career ===,88493
2006,CD,YEAR_REGEX_1,TIME,time_reference,"The New York Times Book Review stated in 2006 that the book ""routinely sells more than 100,000 copies a year.",1,14,== Life and career == | === Academic career ===,88493
a year,DT NN,INARTICLE_REGEX TIME_UNIT_REGEX,MODIFIER TIME,time_reference,"The New York Times Book Review stated in 2006 that the book ""routinely sells more than 100,000 copies a year.",1,14,== Life and career == | === Academic career ===,88493
2004,CD,YEAR_REGEX_1,TIME,time_reference,"""In 2004, Zinn published Voices of a People's History of the United States with Anthony Arnove.",2,14,== Life and career == | === Academic career ===,88493
2008,CD,YEAR_REGEX_1,TIME,time_reference,"In 2008, the Zinn Education Project was launched to support educators using A People's History of the United States as a source for middle and high school history.",0,15,== Life and career == | === Academic career ===,88493
2010,CD,YEAR_REGEX_1,TIME,time_reference,"The People Speak, released in 2010, is a documentary movie based on A People's History of the United States and inspired by the lives of ordinary people who fought back against oppressive conditions over the course of the history of the United States.",0,16,== Life and career == | === Academic career ===,88493
Springsteen,NNP,SEASON_REGEX,TIME,time_reference,"The film, narrated by Zinn, includes performances by Matt Damon, Morgan Freeman, Bob Dylan, Bruce Springsteen, Eddie Vedder, Viggo Mortensen, Josh Brolin, Danny Glover, Marisa Tomei, Don Cheadle, and Sandra Oh.",1,16,== Life and career == | === Academic career ===,88493
1956,CD,YEAR_REGEX_1,TIME,time_reference,"From 1956 through 1963, Zinn chaired the Department of History and Social Sciences at Spelman College.",0,18,== Life and career == | === Civil rights movement ===,88493
1963,CD,YEAR_REGEX_1,TIME,time_reference,"From 1956 through 1963, Zinn chaired the Department of History and Social Sciences at Spelman College.",0,18,== Life and career == | === Civil rights movement ===,88493
August,NNP,MONTH_REGEX,TIME,time_reference,"He participated in the Civil Rights Movement and lobbied with historian August Meier ""to end the practice of the Southern Historical Association of holding meetings at segregated hotels.",1,18,== Life and career == | === Civil rights movement ===,88493
1964,CD,YEAR_REGEX_1,TIME,time_reference,"In 1964, Beacon Press published his book SNCC:",3,18,== Life and career == | === Civil rights movement ===,88493
1964,CD,YEAR_REGEX_1,TIME,time_reference,"In 1964 Zinn, with the SNCC, began developing an educational program so that the 200 volunteer SNCC civil rights workers in the South, many of whom were college dropouts, could continue with their civil rights work and at the same time be involved in an educational system.",5,18,== Life and career == | === Civil rights movement ===,88493
December 1963,NNP CD,MONTH_REGEX YEAR_REGEX_1,TIME TIME,time_reference,"The program had been endorsed by the SNCC in December 1963 and was envisioned by Zinn as having a curriculum that ranged from novels to books about ""major currents"" in 20th-century world history, such as fascism, communism, and anti-colonial movements.",8,18,== Life and career == | === Civil rights movement ===,88493
1964,CD,YEAR_REGEX_1,TIME,time_reference,"Zinn also attended an assortment of SNCC meetings in 1964, traveling back and forth from Boston.",10,18,== Life and career == | === Civil rights movement ===,88493
January 1964,NNP CD,MONTH_REGEX YEAR_REGEX_1,TIME TIME,time_reference,"One of those trips was to Hattiesburg, Mississippi, in January 1964 to participate in a SNCC voter registration drive.",11,18,== Life and career == | === Civil rights movement ===,88493
six months,CD NNS,BASIC_NUMBER_REGEX_1 TIME_UNIT_REGEX,NUMERAL TIME,time_reference,"At a mass meeting held during the visit to Hattiesburg, Zinn and another SNCC representative, Ella Baker, emphasized the risks that went along with their efforts, a subject probably in their minds since a well-known civil rights activist, Medgar Evers, had been murdered getting out of his car in the driveway of his home in Jackson, Mississippi, only six months earlier.",13,18,== Life and career == | === Civil rights movement ===,88493
Summer,NNP,SEASON_REGEX,TIME,time_reference,Zinn was also involved in what became known as Freedom Summer in Mississippi in the summer of 1964.,15,18,== Life and career == | === Civil rights movement ===,88493
the summer,DT NN,PREFIX_REGEX_1 SEASON_REGEX,MODIFIER TIME,time_reference,Zinn was also involved in what became known as Freedom Summer in Mississippi in the summer of 1964.,15,18,== Life and career == | === Civil rights movement ===,88493
of 1964,IN CD,PREFIX_REGEX_1 YEAR_REGEX_1,MODIFIER TIME,time_reference,Zinn was also involved in what became known as Freedom Summer in Mississippi in the summer of 1964.,15,18,== Life and career == | === Civil rights movement ===,88493
Summer,NNP,SEASON_REGEX,TIME,time_reference,"Freedom Summer involved bringing 1,000 college students to Mississippi to work for the summer in various roles as civil rights activists.",16,18,== Life and career == | === Civil rights movement ===,88493
the summer,DT NN,PREFIX_REGEX_1 SEASON_REGEX,MODIFIER TIME,time_reference,"Freedom Summer involved bringing 1,000 college students to Mississippi to work for the summer in various roles as civil rights activists.",16,18,== Life and career == | === Civil rights movement ===,88493
the summer,DT NN,PREFIX_REGEX_1 SEASON_REGEX,MODIFIER TIME,time_reference,"Planning for the summer went forward under the umbrella of the SNCC, the Congress of Racial Equality (""CORE"") and the Council of Federated Organizations (""COFO"").",22,18,== Life and career == | === Civil rights movement ===,88493
"June 20 , 1964","NNP CD , CD",MONTH_REGEX DIGIT_REGEX_1 COMMA_REGEX YEAR_REGEX_1,TIME NUMERAL MODIFIER TIME,time_reference,"On June 20, 1964, just as civil rights activists were beginning to arrive in Mississippi, CORE activists James Chaney, Andrew Goodman, and Michael Schwerner were en route to investigate the burning of Mount Zion Methodist Church in Neshoba County when two carloads of KKK members led by deputy sheriff Cecil Price abducted and murdered them.",23,18,== Life and career == | === Civil rights movement ===,88493
Two months,CD NNS,BASIC_NUMBER_REGEX_1 TIME_UNIT_REGEX,NUMERAL TIME,time_reference,"Two months later, after their bodies were located, Zinn and other representatives of the SNCC attended a memorial service for the three at the ruins of Mount Zion Methodist Church.",24,18,== Life and career == | === Civil rights movement ===,88493
June 1963,NNP CD,MONTH_REGEX YEAR_REGEX_1,TIME TIME,time_reference,"Although Zinn was a tenured professor, he was dismissed in June 1963 after siding with students in the struggle against segregation.",28,18,== Life and career == | === Civil rights movement ===,88493
years,NNS,TIME_UNIT_REGEX,TIME,time_reference,Zinn's years at Spelman are recounted in his autobiography You Can't Be Neutral on a Moving Train: A Personal History of Our Times.,30,18,== Life and career == | === Civil rights movement ===,88493
seven years,CD NNS,BASIC_NUMBER_REGEX_1 TIME_UNIT_REGEX,NUMERAL TIME,time_reference,"His seven years at Spelman College, Zinn said, ""are probably the most interesting, exciting, most educational years for me.",31,18,== Life and career == | === Civil rights movement ===,88493
years,NNS,TIME_UNIT_REGEX,TIME,time_reference,"His seven years at Spelman College, Zinn said, ""are probably the most interesting, exciting, most educational years for me.",31,18,== Life and career == | === Civil rights movement ===,88493
1964,CD,YEAR_REGEX_1,TIME,time_reference,"His second book, The Southern Mystique, was published in 1964, the same year as his SNCC:",37,18,== Life and career == | === Civil rights movement ===,88493
year,NN,TIME_UNIT_REGEX,TIME,time_reference,"His second book, The Southern Mystique, was published in 1964, the same year as his SNCC:",37,18,== Life and career == | === Civil rights movement ===,88493
2005,CD,YEAR_REGEX_1,TIME,time_reference,"In 2005, forty-one years after he was sacked from Spelman, Zinn returned to the college, where he was given an honorary Doctor of Humane Letters.",0,19,== Life and career == | === Civil rights movement ===,88493
forty-one years,CD NNS,BASIC_NUMBER_REGEX_1 TIME_UNIT_REGEX,NUMERAL TIME,time_reference,"In 2005, forty-one years after he was sacked from Spelman, Zinn returned to the college, where he was given an honorary Doctor of Humane Letters.",0,19,== Life and career == | === Civil rights movement ===,88493
1967,CD,YEAR_REGEX_1,TIME,time_reference,"Vietnam: The Logic of Withdrawal was published by Beacon Press in 1967 based on his articles in Commonweal, The Nation, and Ramparts.",1,22,== Life and career == | ==== Vietnam ====,88493
January 1968,NNP CD,MONTH_REGEX YEAR_REGEX_1,TIME TIME,time_reference,"Zinn's diplomatic visit to Hanoi with Reverend Daniel Berrigan, during the Tet Offensive in January 1968, resulted in the return of three American airmen, the first American POWs released by the North Vietnamese since the U.S. bombing of that nation had begun.",0,23,== Life and career == | ==== Vietnam ====,88493
1963–1975,CD,YEAR_REGEX_1,TIME,time_reference,American Protest Against the War in Vietnam 1963–1975 by Nancy Zaroulis and Gerald Sullivan.,2,23,== Life and career == | ==== Vietnam ====,88493
the years,DT NNS,PREFIX_REGEX_1 TIME_UNIT_REGEX,MODIFIER TIME,time_reference,"Zinn and the Berrigan brothers, Dan and Philip, remained friends and allies over the years.",3,23,== Life and career == | ==== Vietnam ====,88493
January 1968,NNP CD,MONTH_REGEX YEAR_REGEX_1,TIME TIME,time_reference,"Also in January 1968, he signed the ""Writers and Editors War Tax Protest"" pledge, vowing to refuse tax payments in protest against the war.",0,24,== Life and career == | ==== Vietnam ====,88493
December 1969,NNP CD,MONTH_REGEX YEAR_REGEX_1,TIME TIME,time_reference,"In December 1969, radical historians tried unsuccessfully to persuade the American Historical Association to pass an anti-Vietnam War resolution.",1,24,== Life and career == | ==== Vietnam ====,88493
1968,CD,YEAR_REGEX_1,TIME,time_reference,"""A debacle unfolded as Harvard historian (and AHA president in 1968)",2,24,== Life and career == | ==== Vietnam ====,88493
August 17,NNP CD,MONTH_REGEX DIGIT_REGEX_1,TIME NUMERAL,time_reference,"Announced on August 17 and published on October 10, 1971, this four-volume, relatively expensive set became the ""Senator Gravel Edition"", which studies from Cornell University and the Annenberg Center for Communication have labeled as the most complete edition of the Pentagon Papers to be published.",0,25,== Life and career == | ==== Vietnam ====,88493
"October 10 , 1971","NNP CD , CD",MONTH_REGEX DIGIT_REGEX_1 COMMA_REGEX YEAR_REGEX_1,TIME NUMERAL MODIFIER TIME,time_reference,"Announced on August 17 and published on October 10, 1971, this four-volume, relatively expensive set became the ""Senator Gravel Edition"", which studies from Cornell University and the Annenberg Center for Communication have labeled as the most complete edition of the Pentagon Papers to be published.",0,25,== Life and career == | ==== Vietnam ====,88493
June 1972,NNP CD,MONTH_REGEX YEAR_REGEX_1,TIME TIME,time_reference,"Beacon Press became the subject of an FBI investigation, an outgrowth of which was Gravel v. United States in which the U.S. Supreme Court ruled in June 1972 that the Speech or Debate Clause in the US Constitution did grant immunity to Gravel for his reading the papers in his subcommittee, and did grant some immunity to Gravel's congressional aide, but granted no immunity to Beacon Press in relation to its publishing the same papers.",2,25,== Life and career == | ==== Vietnam ====,88493
1963,CD,YEAR_REGEX_1,TIME,time_reference,Defense attorneys asked Zinn to explain to the jury the history of U.S. involvement in Vietnam from World War II through 1963.,1,26,== Life and career == | ==== Vietnam ====,88493
several hours,JJ NNS,PREFIX_REGEX_1 TIME_UNIT_REGEX,MODIFIER TIME,time_reference,"Zinn discussed that history for several hours, and later reflected on his time before the jury.",2,26,== Life and career == | ==== Vietnam ====,88493
1989,CD,YEAR_REGEX_1,TIME,time_reference,"Zinn's testimony on the motivation for government secrecy was confirmed in 1989 by Erwin Griswold, who as U.S. solicitor general during the Nixon administration sued The New York Times in the Pentagon Papers case in 1971 to stop publication.",0,27,== Life and career == | ==== Vietnam ====,88493
1971,CD,YEAR_REGEX_1,TIME,time_reference,"Zinn's testimony on the motivation for government secrecy was confirmed in 1989 by Erwin Griswold, who as U.S. solicitor general during the Nixon administration sued The New York Times in the Pentagon Papers case in 1971 to stop publication.",0,27,== Life and career == | ==== Vietnam ====,88493
1989,CD,YEAR_REGEX_1,TIME,time_reference,"In 1989, Griswold admitted there had been no national security damage resulting from publication.",3,27,== Life and career == | ==== Vietnam ====,88493
the 2001,DT CD,PREFIX_REGEX_1 YEAR_REGEX_1,MODIFIER TIME,time_reference,"In the 2001 film Unfinished Symphony: Democracy and Dissent, Zinn provides a historical context for the 1971 anti-war march by Vietnam Veterans against the War.",1,28,== Life and career == | ==== Vietnam ====,88493
the 1971,DT CD,PREFIX_REGEX_1 YEAR_REGEX_1,MODIFIER TIME,time_reference,"In the 2001 film Unfinished Symphony: Democracy and Dissent, Zinn provides a historical context for the 1971 anti-war march by Vietnam Veterans against the War.",1,28,== Life and career == | ==== Vietnam ====,88493
march,NN,MONTH_REGEX,TIME,time_reference,"In the 2001 film Unfinished Symphony: Democracy and Dissent, Zinn provides a historical context for the 1971 anti-war march by Vietnam Veterans against the War.",1,28,== Life and career == | ==== Vietnam ====,88493
of 1775,IN CD,PREFIX_REGEX_1 YEAR_REGEX_1,MODIFIER TIME,time_reference,"The marchers traveled from Bunker Hill near Boston to Lexington, Massachusetts, ""which retraced Paul Revere's ride of 1775 and ended in the massive arrest of 410 veterans and civilians by the Lexington police.""",2,28,== Life and career == | ==== Vietnam ====,88493
the 1971 Winter,DT CD NNP,PREFIX_REGEX_1 YEAR_REGEX_1 SEASON_REGEX,MODIFIER TIME TIME,time_reference,"The film depicts ""scenes from the 1971 Winter Soldier hearings, during which former G.I.s testified about ""atrocities"" they either participated in or said they had witnessed committed by U.S. forces in Vietnam.",3,28,== Life and career == | ==== Vietnam ====,88493
the 1971 May Day,DT CD NNP NNP,PREFIX_REGEX_1 YEAR_REGEX_1 MONTH_REGEX TIME_UNIT_REGEX,MODIFIER TIME TIME TIME,time_reference,Zinn also took part in the 1971 May Day protests (with among others Noam Chomsky and Daniel Ellsberg).,4,28,== Life and career == | ==== Vietnam ====,88493
later years,JJ NNS,PREFIX_REGEX_1 TIME_UNIT_REGEX,MODIFIER TIME,time_reference,"In later years, Zinn was an adviser to the Disarm Education Fund.",5,28,== Life and career == | ==== Vietnam ====,88493
the 2003,DT CD,PREFIX_REGEX_1 YEAR_REGEX_1,MODIFIER TIME,time_reference,Zinn opposed the 2003 invasion and occupation of Iraq and wrote several books about it.,0,30,== Life and career == | ==== Iraq ====,88493
every year,DT NN,PREFIX_REGEX_1 TIME_UNIT_REGEX,MODIFIER TIME,time_reference,Israel has violated Security Council resolutions every year since 1967.,7,30,== Life and career == | ==== Iraq ====,88493
1967,CD,YEAR_REGEX_1,TIME,time_reference,Israel has violated Security Council resolutions every year since 1967.,7,30,== Life and career == | ==== Iraq ====,88493
Now,RB,TIMELINE_REGEX,TIME,time_reference,"Now, however, the U.S. is violating a fundamental principle of the U.N. Charter, which is that nations can't initiate a war—they can only do so after being attacked.",8,30,== Life and career == | ==== Iraq ====,88493
May 2007,NNP CD,MONTH_REGEX YEAR_REGEX_1,TIME TIME,time_reference,"Jean-Christophe Agnew, Professor of History and American Studies at Yale University, told the Yale Daily News in May 2007 that Zinn's historical work is ""highly influential and widely used"".",13,30,== Life and career == | ==== Iraq ====,88493
recently,RB,TIMELINE_REGEX,TIME,time_reference,"He observed that it is not unusual for prominent professors such as Zinn to weigh in on current events, citing a resolution opposing the war in Iraq that was recently ratified by the American Historical Association.",14,30,== Life and career == | ==== Iraq ====,88493
these moments,DT NNS,PREFIX_REGEX_1 TIMELINE_REGEX,MODIFIER TIME,time_reference,"Agnew added: ""In these moments of crisis, when the country is split—so historians are split.""",15,30,== Life and career == | ==== Iraq ====,88493
2009,CD,YEAR_REGEX_1,TIME,time_reference,"In Madison, Wisconsin, in 2009, Zinn said:",3,32,== Life and career == | === Socialism ===,88493
