time_expression,POST_tag,time_token,type_token,time_expression_type,sentences,sentenceIndex,paragraphIndex,section,wikiId
century,NN,TIME_UNIT_REGEX,TIME,time_reference,I think it's very important to bring back the idea of socialism into the national discussion to where it was at the turn of the [last] century before the Soviet Union gave it a bad name.,1,33,== Life and career == | === Socialism ===,88493
"July 30 , 2010","NNP CD , CD",MONTH_REGEX DIGIT_REGEX_1 COMMA_REGEX YEAR_REGEX_1,TIME NUMERAL MODIFIER TIME,time_reference,"On July 30, 2010, a Freedom of Information Act (FOIA) request resulted in the Federal Bureau of Investigation (FBI) releasing a file with 423 pages of information on Howard Zinn's life and activities.",0,35,== Life and career == | === FBI files ===,88493
1949,CD,YEAR_REGEX_1,TIME,time_reference,"During the height of McCarthyism in 1949, the FBI first opened a domestic security investigation on Zinn (FBI File # 100-360217), based on Zinn's activities in what the agency considered to be communist front groups, such as the American Labor Party, and informant reports that Zinn was an active member of the Communist Party of the United States (CPUSA).",1,35,== Life and career == | === FBI files ===,88493
the 1950s,DT CD,PREFIX_REGEX_1 YEAR_REGEX_1,MODIFIER TIME,time_reference,"According to journalist Chris Hedges, Zinn ""steadfastly refused to cooperate in the anti-communist witchhunts in the 1950s.",3,35,== Life and career == | === FBI files ===,88493
the 1960s,DT NNS,PREFIX_REGEX_1 YEAR_REGEX_1,MODIFIER TIME,time_reference,"""Later in the 1960s, as a result of Zinn's campaigning against the Vietnam War and his communicating with Martin Luther King Jr. (prior to disavowing any communication with communists) the FBI designated him a high security risk to the country by adding him to the Security Index, a list of American citizens who could be summarily arrested if a state of emergency were to be declared.",4,35,== Life and career == | === FBI files ===,88493
1944,CD,YEAR_REGEX_1,TIME,time_reference,Zinn married Roslyn Shechter in 1944.,0,37,== Life and career == | === Personal life ===,88493
2008,CD,YEAR_REGEX_1,TIME,time_reference,They remained married until her death in 2008.,1,37,== Life and career == | === Personal life ===,88493
"January 27 , 2010","NNP CD , CD",MONTH_REGEX DIGIT_REGEX_1 COMMA_REGEX YEAR_REGEX_1,TIME NUMERAL MODIFIER TIME,time_reference,"Zinn was swimming in a hotel pool when he died of an apparent heart attack in Santa Monica, California, on January 27, 2010, at age 87.",0,39,== Death ==,88493
2008,CD,YEAR_REGEX_1,TIME,time_reference,"2008 Howard Zinn was selected as a special senior advisor to Miguel d'Escoto Brockmann, the president of the United Nations General Assembly 63rd session.",0,43,== Notable recognition ==,88493
1991,CD,YEAR_REGEX_1,TIME,time_reference,In 1991 the Thomas Merton Center for Peace and Social Justice in Pittsburgh awarded Zinn the Thomas Merton Award for his activism and work on national and international issues that transform our world.,0,46,== Awards ==,88493
1996,CD,YEAR_REGEX_1,TIME,time_reference,"For his leadership in the Peace Movement, Zinn received the Peace Abbey Courage of Conscience Award in 1996.",1,46,== Awards ==,88493
1998,CD,YEAR_REGEX_1,TIME,time_reference,"In 1998 he received the Eugene V. Debs Award, the Firecracker Alternative Booksellers Award in the Politics category for The Zinn Reader: Writings on Disobedience and Democracy, and the Lannan Literary Award for nonfiction.",2,46,== Awards ==,88493
The following year,DT JJ NN,PREFIX_REGEX_1 PREFIX_REGEX_1 TIME_UNIT_REGEX,MODIFIER MODIFIER TIME,time_reference,"The following year he won the Upton Sinclair Award, which honors those whose work illustrates an abiding commitment to social justice and equality.",3,46,== Awards ==,88493
2003,CD,YEAR_REGEX_1,TIME,time_reference,"In 2003, Zinn was awarded the Prix des Amis du Monde diplomatique for the French version of his seminal work, Une histoire populaire des Etats-Unis.",4,46,== Awards ==,88493
"October 5 , 2006","NNP CD , CD",MONTH_REGEX DIGIT_REGEX_1 COMMA_REGEX YEAR_REGEX_1,TIME NUMERAL MODIFIER TIME,time_reference,"On October 5, 2006, Zinn received the Haven's Center Award for Lifetime Contribution to Critical Scholarship in Madison, Wisconsin.",5,46,== Awards ==,88493
July 2013,NNP CD,MONTH_REGEX YEAR_REGEX_1,TIME TIME,time_reference,"In July 2013, the Associated Press revealed that Mitch Daniels, when he was the sitting Republican Governor of Indiana, asked for assurance from his education advisors that Zinn's works were not taught in K–12 public schools in the state.",0,48,== Controversy and critiques ==,88493
the past,DT NN,PREFIX_REGEX_1 TIMELINE_REGEX,MODIFIER TIME,time_reference,Zinn reduces the past to a Manichean fable.,8,50,== Controversy and critiques ==,88493
early 2017,JJ CD,PREFIX_REGEX_1 YEAR_REGEX_1,MODIFIER TIME,time_reference,"""In early 2017, Arkansas Representative Kim Hendren (R) submitted a ""Bill introduced to ban Zinn's books from Arkansas public schools.""",9,50,== Controversy and critiques ==,88493
1997,CD,YEAR_REGEX_1,TIME,time_reference,"Actors Matt Damon and Ben Affleck, who grew up near Zinn and were family friends, gave A People's History a plug in their Academy Award-winning screenplay for Good Will Hunting (1997).",0,53,== References in popular culture == | === In film ===,88493
the 2007,DT CD,PREFIX_REGEX_1 YEAR_REGEX_1,MODIFIER TIME,time_reference,A People's History was the basis for the 2007 documentary Profit Motive and the Whispering Wind.,0,54,== References in popular culture == | === In film ===,88493
2007,CD,YEAR_REGEX_1,TIME,time_reference,An interview with Zinn is featured in the documentary film Sacco and Vanzetti (2007).,0,55,== References in popular culture == | === In film ===,88493
The 2010,DT CD,PREFIX_REGEX_1 YEAR_REGEX_1,MODIFIER TIME,time_reference,"The 2010 Spanish film También la lluvia (Even the Rain), depicting the struggle of the indigenous people of Bolivia against the privatization of their water supply, is dedicated to his memory.",0,56,== References in popular culture == | === In film ===,88493
Am,VBP,HALFDAY_REGEX_1,TIME,,An Interview with Zinn is featured in the documentary film I Am (2010).,0,57,== References in popular culture == | === In film ===,88493
2010,CD,YEAR_REGEX_1,TIME,time_reference,An Interview with Zinn is featured in the documentary film I Am (2010).,0,57,== References in popular culture == | === In film ===,88493
2013,CD,YEAR_REGEX_1,TIME,time_reference,An interview with Zinn is featured in the documentary film Hit & Stay (2013).,0,58,== References in popular culture == | === In film ===,88493
"July 3 , 2014","NNP CD , CD",MONTH_REGEX DIGIT_REGEX_1 COMMA_REGEX YEAR_REGEX_1,TIME NUMERAL MODIFIER TIME,time_reference,"Zinn's book A People's History of The United States is criticized in Dinesh D'Souza's movie, America: Imagine the World Without Her, released July 3, 2014.",0,59,== References in popular culture == | === In film ===,88493
2017,CD,YEAR_REGEX_1,TIME,time_reference,"One of the characters in the coming-of-age story, Lady Bird (2017), is seen reading Howard Zinn's book A People's History of the United States.",0,60,== References in popular culture == | === In film ===,88493
currently,RB,TIMELINE_REGEX,TIME,time_reference,"Leguizamo's one-man Broadway show, John Leguizamo's Latin History for Morons, is currently streaming on Netflix.",1,61,== References in popular culture == | === In film ===,88493
"October 16 , 2017","NNP CD , CD",MONTH_REGEX DIGIT_REGEX_1 COMMA_REGEX YEAR_REGEX_1,TIME NUMERAL MODIFIER TIME,time_reference,"Who is Howard Zinn was the answer to a Jeopardy! question on October 16, 2017.",0,65,== References in popular culture == | === In television ===,88493
2007,CD,YEAR_REGEX_1,TIME,time_reference,"Rapper Brother Ali mentions Howard Zinn in his song ""Lookin'at Me Sideways"" on his heralded 2007 album The Undisputed Truth.",0,67,== References in popular culture == | === In music ===,88493
2002,CD,YEAR_REGEX_1,TIME,time_reference,"in 2002, a compilation CD featuring many punk rock bands and a spoken word track by Zinn.",1,68,== References in popular culture == | === In music ===,88493
Springsteen,NNP,SEASON_REGEX,TIME,time_reference,Musician Bruce Springsteen's bleak album Nebraska was inspired in part by A People's History.,0,70,== References in popular culture == | === In music ===,88493
A.D.,NNP,ERA_REGEX,TIME,time_reference,"In the System Of A Down's ""Deer Dance"", a song about police brutality against peaceful protest, Zinn is paraphrased in the line, ""We can't afford to be neutral on a moving train,"" and in their song ""A.D. D (American Dream Denial)"" from their album Steal This Album!:",0,71,== References in popular culture == | === In music ===,88493
the 2003,DT CD,PREFIX_REGEX_1 YEAR_REGEX_1,MODIFIER TIME,time_reference,"The song ""Franco Un-American"", on the 2003 album The War on Errorism by American punk rock band NOFX, references lead singer Fat Mike reading Howard Zinn as part of learning more about the world: ""I never looked around, never second-guessed, then I read some Howard Zinn, now I'm always depressed.""",0,73,== References in popular culture == | === In music ===,88493
now,RB,TIMELINE_REGEX,TIME,time_reference,"The song ""Franco Un-American"", on the 2003 album The War on Errorism by American punk rock band NOFX, references lead singer Fat Mike reading Howard Zinn as part of learning more about the world: ""I never looked around, never second-guessed, then I read some Howard Zinn, now I'm always depressed.""",0,73,== References in popular culture == | === In music ===,88493
2011,CD,YEAR_REGEX_1,TIME,time_reference,"Lupe Fiasco samples part of Howard Zinn's speech ""War and Social Justice"" on the Introduction track of his 2011 mixtape ""Friend of the People: I Fight Evil"".",0,74,== References in popular culture == | === In music ===,88493
2012,CD,YEAR_REGEX_1,TIME,time_reference,"Rapper Vinnie Paz samples quotes from Howard Zinn's speech ""You Can't Be Neutral On A Moving Train"" on his album released in 2012, God of the Serengeti, on the track of the same name.",0,75,== References in popular culture == | === In music ===,88493
1959,CD,YEAR_REGEX_1,TIME,time_reference,LaGuardia in Congress (1959; based on his 1958 Ph.D. dissertation Fiorello LaGuardia in Congress) OCLC 642325734.,0,80,== Bibliography == | === Author ===,88493
1958,CD,YEAR_REGEX_1,TIME,time_reference,LaGuardia in Congress (1959; based on his 1958 Ph.D. dissertation Fiorello LaGuardia in Congress) OCLC 642325734.,0,80,== Bibliography == | === Author ===,88493
1962,CD,YEAR_REGEX_1,TIME,time_reference,The Southern Mystique (1962) OCLC 423360.,0,81,== Bibliography == | === Author ===,88493
1964,CD,YEAR_REGEX_1,TIME,time_reference,The New Abolitionists (1964) OCLC 466264063.,1,82,== Bibliography == | === Author ===,88493
1965,CD,YEAR_REGEX_1,TIME,time_reference,New Deal Thought (editor) (1965) OCLC 422649795.,0,83,== Bibliography == | === Author ===,88493
1967,CD,YEAR_REGEX_1,TIME,time_reference,Vietnam: The Logic of Withdrawal (1967) OCLC 411235.,0,84,== Bibliography == | === Author ===,88493
Nine Fallacies,JJ NNS,BASIC_NUMBER_REGEX_1 SEASON_REGEX,NUMERAL TIME,time_reference,"Disobedience and Democracy: Nine Fallacies on Law and Order (1968, re-issued 2002) ISBN 978-0-89608-675-3.",0,85,== Bibliography == | === Author ===,88493
1968,CD,YEAR_REGEX_1,TIME,time_reference,"Disobedience and Democracy: Nine Fallacies on Law and Order (1968, re-issued 2002) ISBN 978-0-89608-675-3.",0,85,== Bibliography == | === Author ===,88493
2002,CD,YEAR_REGEX_1,TIME,time_reference,"Disobedience and Democracy: Nine Fallacies on Law and Order (1968, re-issued 2002) ISBN 978-0-89608-675-3.",0,85,== Bibliography == | === Author ===,88493
1970,CD,YEAR_REGEX_1,TIME,time_reference,The Politics of History (1970) (2nd edition 1990) ISBN 978-0-252-06122-6.,0,86,== Bibliography == | === Author ===,88493
1990,CD,YEAR_REGEX_1,TIME,time_reference,The Politics of History (1970) (2nd edition 1990) ISBN 978-0-252-06122-6.,0,86,== Bibliography == | === Author ===,88493
1972,CD,YEAR_REGEX_1,TIME,time_reference,"Beacon Press, 1972.",5,87,== Bibliography == | === Author ===,88493
1974,CD,YEAR_REGEX_1,TIME,time_reference,Justice in Everyday Life: The Way It Really Works (Editor) (1974) ISBN 978-0-688-00284-8.,0,88,== Bibliography == | === Author ===,88493
1977,CD,YEAR_REGEX_1,TIME,time_reference,Eyewitness Accounts (1977) ISBN 978-0-8070-4479-7.,1,89,== Bibliography == | === Author ===,88493
1492 – Present,CD NN NNP,YEAR_REGEX_1 LINKAGE_REGEX TIMELINE_REGEX,TIME MODIFIER TIME,,"A People's History of the United States: 1492 – Present (1980), revised (1995)(1998)(1999)(2003)(2004)(2005)(2010) ISBN 978-0-06-052837-9.",0,90,== Bibliography == | === Author ===,88493
1980,CD,YEAR_REGEX_1,TIME,time_reference,"A People's History of the United States: 1492 – Present (1980), revised (1995)(1998)(1999)(2003)(2004)(2005)(2010) ISBN 978-0-06-052837-9.",0,90,== Bibliography == | === Author ===,88493
1995,CD,YEAR_REGEX_1,TIME,time_reference,"A People's History of the United States: 1492 – Present (1980), revised (1995)(1998)(1999)(2003)(2004)(2005)(2010) ISBN 978-0-06-052837-9.",0,90,== Bibliography == | === Author ===,88493
1998,CD,YEAR_REGEX_1,TIME,time_reference,"A People's History of the United States: 1492 – Present (1980), revised (1995)(1998)(1999)(2003)(2004)(2005)(2010) ISBN 978-0-06-052837-9.",0,90,== Bibliography == | === Author ===,88493
1999,CD,YEAR_REGEX_1,TIME,time_reference,"A People's History of the United States: 1492 – Present (1980), revised (1995)(1998)(1999)(2003)(2004)(2005)(2010) ISBN 978-0-06-052837-9.",0,90,== Bibliography == | === Author ===,88493
2003,CD,YEAR_REGEX_1,TIME,time_reference,"A People's History of the United States: 1492 – Present (1980), revised (1995)(1998)(1999)(2003)(2004)(2005)(2010) ISBN 978-0-06-052837-9.",0,90,== Bibliography == | === Author ===,88493
2004,CD,YEAR_REGEX_1,TIME,time_reference,"A People's History of the United States: 1492 – Present (1980), revised (1995)(1998)(1999)(2003)(2004)(2005)(2010) ISBN 978-0-06-052837-9.",0,90,== Bibliography == | === Author ===,88493
2005,CD,YEAR_REGEX_1,TIME,time_reference,"A People's History of the United States: 1492 – Present (1980), revised (1995)(1998)(1999)(2003)(2004)(2005)(2010) ISBN 978-0-06-052837-9.",0,90,== Bibliography == | === Author ===,88493
2010,CD,YEAR_REGEX_1,TIME,time_reference,"A People's History of the United States: 1492 – Present (1980), revised (1995)(1998)(1999)(2003)(2004)(2005)(2010) ISBN 978-0-06-052837-9.",0,90,== Bibliography == | === Author ===,88493
1986,CD,YEAR_REGEX_1,TIME,time_reference,"Playbook by Maxine Klein, Lydia Sargent and Howard Zinn (1986) ISBN 978-0-89608-309-7.",0,91,== Bibliography == | === Author ===,88493
1991,CD,YEAR_REGEX_1,TIME,time_reference,Declarations of Independence: Cross-Examining American Ideology (1991) ISBN 978-0-06-092108-8.,0,92,== Bibliography == | === Author ===,88493
the Present,DT NNP,PREFIX_REGEX_1 TIMELINE_REGEX,MODIFIER TIME,time_reference,"A People's History of the United States: The Civil War to the Present Kathy Emery and Ellen Reeves, Howard Zinn (2003 teaching edition)",0,93,== Bibliography == | === Author ===,88493
2003,CD,YEAR_REGEX_1,TIME,time_reference,"A People's History of the United States: The Civil War to the Present Kathy Emery and Ellen Reeves, Howard Zinn (2003 teaching edition)",0,93,== Bibliography == | === Author ===,88493
1993,CD,YEAR_REGEX_1,TIME,time_reference,Failure to Quit: Reflections of an Optimistic Historian (1993) ISBN 978-1-56751-013-3.,0,94,== Bibliography == | === Author ===,88493
1994,CD,YEAR_REGEX_1,TIME,time_reference,You Can't Be Neutral on a Moving Train: A Personal History of Our Times (autobiography)(1994) ISBN 978-0-8070-7127-4,0,95,== Bibliography == | === Author ===,88493
1995,CD,YEAR_REGEX_1,TIME,time_reference,A People's History of the United States: The Wall Charts by Howard Zinn and George Kirschner (1995),0,96,== Bibliography == | === Author ===,88493
1995,CD,YEAR_REGEX_1,TIME,time_reference,"Hiroshima: Breaking the Silence (pamphlet, 1995) ISBN 978-1-884519-14-7.",0,97,== Bibliography == | === Author ===,88493
1997,CD,YEAR_REGEX_1,TIME,time_reference,The Zinn Reader: Writings on Disobedience and Democracy (1997) ISBN 978-1-888363-54-8; 2nd edition (2009) ISBN 978-1-58322-870-8.,0,98,== Bibliography == | === Author ===,88493
2009,CD,YEAR_REGEX_1,TIME,time_reference,The Zinn Reader: Writings on Disobedience and Democracy (1997) ISBN 978-1-888363-54-8; 2nd edition (2009) ISBN 978-1-58322-870-8.,0,98,== Bibliography == | === Author ===,88493
Years,NNP,TIME_UNIT_REGEX,TIME,time_reference,"The Cold War & the University: Toward an Intellectual History of the Postwar Years (Noam Chomsky (Editor) Authors: Ira Katznelson, R. C. Lewontin, David Montgomery, Laura Nader, Richard Ohmann, Ray Siever, Immanuel Wallerstein, Howard Zinn (1997) ISBN 978-1-56584-005-8.",0,99,== Bibliography == | === Author ===,88493
1997,CD,YEAR_REGEX_1,TIME,time_reference,"The Cold War & the University: Toward an Intellectual History of the Postwar Years (Noam Chomsky (Editor) Authors: Ira Katznelson, R. C. Lewontin, David Montgomery, Laura Nader, Richard Ohmann, Ray Siever, Immanuel Wallerstein, Howard Zinn (1997) ISBN 978-1-56584-005-8.",0,99,== Bibliography == | === Author ===,88493
1999,CD,YEAR_REGEX_1,TIME,time_reference,Marx in Soho: A Play on History (1999) ISBN 978-0-89608-593-0.,0,100,== Bibliography == | === Author ===,88493
The Future,DT NN,PREFIX_REGEX_1 TIMELINE_REGEX,MODIFIER TIME,time_reference,The Future of History: Interviews With David Barsamian (1999) ISBN 978-1-56751-157-4.,0,101,== Bibliography == | === Author ===,88493
1999,CD,YEAR_REGEX_1,TIME,time_reference,The Future of History: Interviews With David Barsamian (1999) ISBN 978-1-56751-157-4.,0,101,== Bibliography == | === Author ===,88493
2000,CD,YEAR_REGEX_1,TIME,time_reference,Howard Zinn on War (2000) ISBN 978-1-58322-049-8.,0,102,== Bibliography == | === Author ===,88493
2000,CD,YEAR_REGEX_1,TIME,time_reference,Howard Zinn on History (2000) ISBN 978-1-58322-048-1.,0,103,== Bibliography == | === Author ===,88493
2000,CD,YEAR_REGEX_1,TIME,time_reference,La Otra Historia De Los Estados Unidos (2000) ISBN 978-1-58322-054-2.,0,104,== Bibliography == | === Author ===,88493
Last Century,JJ NNP,PREFIX_REGEX_1 TIME_UNIT_REGEX,MODIFIER TIME,time_reference,"Three Strikes: Miners, Musicians, Salesgirls, and the Fighting Spirit of Labor's Last Century (Dana Frank, Robin Kelley, and Howard Zinn) (2002) ISBN 978-0-8070-5013-2.",0,105,== Bibliography == | === Author ===,88493
2002,CD,YEAR_REGEX_1,TIME,time_reference,"Three Strikes: Miners, Musicians, Salesgirls, and the Fighting Spirit of Labor's Last Century (Dana Frank, Robin Kelley, and Howard Zinn) (2002) ISBN 978-0-8070-5013-2.",0,105,== Bibliography == | === Author ===,88493
2002,CD,YEAR_REGEX_1,TIME,time_reference,Terrorism and War (2002) ISBN 978-1-58322-493-9.,0,106,== Bibliography == | === Author ===,88493
2002,CD,YEAR_REGEX_1,TIME,time_reference,The Power of Nonviolence: Writings by Advocates of Peace Editor (2002) ISBN 978-0-8070-1407-3.,0,107,== Bibliography == | === Author ===,88493
2002,CD,YEAR_REGEX_1,TIME,time_reference,"Emma: A Play in Two Acts About Emma Goldman, American Anarchist (2002) ISBN 978-0-89608-664-7.",0,108,== Bibliography == | === Author ===,88493
2003,CD,YEAR_REGEX_1,TIME,time_reference,Artists in Times of War (2003) ISBN 978-1-58322-602-5.,0,109,== Bibliography == | === Author ===,88493
The 20th century,DT JJ NN,PREFIX_REGEX_1 DIGIT_REGEX_1 TIME_UNIT_REGEX,MODIFIER NUMERAL TIME,time_reference,The 20th century: A People's History (2003) ISBN 978-0-06-053034-1.,0,110,== Bibliography == | === Author ===,88493
2003,CD,YEAR_REGEX_1,TIME,time_reference,The 20th century: A People's History (2003) ISBN 978-0-06-053034-1.,0,110,== Bibliography == | === Author ===,88493
2003,CD,YEAR_REGEX_1,TIME,time_reference,A People's History of the United States: Teaching Edition Abridged (2003 updated) ISBN 978-1-56584-826-9.,0,111,== Bibliography == | === Author ===,88493
2003,CD,YEAR_REGEX_1,TIME,time_reference,Passionate Declarations: Essays on War and Justice (2003) ISBN 978-0-06-055767-6.,0,112,== Bibliography == | === Author ===,88493
2003,CD,YEAR_REGEX_1,TIME,time_reference,"Iraq Under Siege, The Deadly Impact of Sanctions and War, co-author (2003)",0,113,== Bibliography == | === Author ===,88493
2004,CD,YEAR_REGEX_1,TIME,time_reference,"Howard Zinn On Democratic Education Donaldo Macedo, Editor (2004) ISBN 978-1-59451-054-0.",0,114,== Bibliography == | === Author ===,88493
2004,CD,YEAR_REGEX_1,TIME,time_reference,"The People Speak: American Voices, Some Famous, Some Little Known (2004) ISBN 978-0-06-057826-8.",0,115,== Bibliography == | === Author ===,88493
2004,CD,YEAR_REGEX_1,TIME,time_reference,"Voices of a People’s History of the United States (with Anthony Arnove, 2004) ISBN 978-1-58322-647-6; 2nd edition (2009) ISBN 978-1-58322-916-3.",0,116,== Bibliography == | === Author ===,88493
2009,CD,YEAR_REGEX_1,TIME,time_reference,"Voices of a People’s History of the United States (with Anthony Arnove, 2004) ISBN 978-1-58322-647-6; 2nd edition (2009) ISBN 978-1-58322-916-3.",0,116,== Bibliography == | === Author ===,88493
2005,CD,YEAR_REGEX_1,TIME,time_reference,"A People's History of the Civil War: Struggles for the Meaning of Freedom by David Williams, Howard Zinn (Series Editor) (2005) ISBN 978-1-59558-018-4.",0,117,== Bibliography == | === Author ===,88493
2006,CD,YEAR_REGEX_1,TIME,time_reference,A Power Governments Cannot Suppress (2006) ISBN 978-0-87286-475-7.,0,118,== Bibliography == | === Author ===,88493
2006,CD,YEAR_REGEX_1,TIME,time_reference,Original Zinn: Conversations on History and Politics (2006),0,119,== Bibliography == | === Author ===,88493
2008,CD,YEAR_REGEX_1,TIME,time_reference,"A People's History of American Empire (2008) by Howard Zinn, Mike Konopacki and Paul Buhle.",0,120,== Bibliography == | === Author ===,88493
2006,CD,YEAR_REGEX_1,TIME,time_reference,"A Young People's History of the United States, adapted from the original text by Rebecca Stefoff; illustrated and updated through 2006, with new introduction and afterword by Howard Zinn; two volumes, Seven Stories Press, New York, 2007.",0,121,== Bibliography == | === Author ===,88493
2007,CD,YEAR_REGEX_1,TIME,time_reference,"A Young People's History of the United States, adapted from the original text by Rebecca Stefoff; illustrated and updated through 2006, with new introduction and afterword by Howard Zinn; two volumes, Seven Stories Press, New York, 2007.",0,121,== Bibliography == | === Author ===,88493
2009,CD,YEAR_REGEX_1,TIME,time_reference,One-volume edition (2009) ISBN 978-1-58322-869-2.,0,124,== Bibliography == | === Author ===,88493
2010,CD,YEAR_REGEX_1,TIME,time_reference,"The Bomb (City Lights Publishers, 2010) ISBN 978-0-87286-509-9.",0,125,== Bibliography == | === Author ===,88493
2012,CD,YEAR_REGEX_1,TIME,time_reference,"The Historic Unfulfilled Promise (City Lights Publishers, 2012) ISBN 978-0-87286-555-6.",0,126,== Bibliography == | === Author ===,88493
1963-2009,CD,YEAR_REGEX_1,TIME,time_reference,"Howard Zinn Speaks: Collected Speeches 1963-2009 (Haymarket Books, 2012) ISBN",0,127,== Bibliography == | === Author ===,88493
2012,CD,YEAR_REGEX_1,TIME,time_reference,"Howard Zinn Speaks: Collected Speeches 1963-2009 (Haymarket Books, 2012) ISBN",0,127,== Bibliography == | === Author ===,88493
2019,CD,YEAR_REGEX_1,TIME,time_reference,"Truth Has a Power of Its Own: Conversations About A People’s History by Howard Zinn and Ray Suarez (The New Press, 2019) ISBN 978-1-62097-517-6.",0,128,== Bibliography == | === Author ===,88493
2010,CD,YEAR_REGEX_1,TIME,time_reference,by Peter Swirski (2010) ISBN 978-0-7735-3766-8.,1,130,== Bibliography == | === Contributor ===,88493
1945–1970,CD,YEAR_REGEX_1,TIME,time_reference,"Admirable Radical: Staughton Lynd and Cold War Dissent, 1945–1970 (2010), Kent State University Press by Carl Mirra ISBN 978-1-60635-051-5.",0,131,== Bibliography == | === Contributor ===,88493
2010,CD,YEAR_REGEX_1,TIME,time_reference,"Admirable Radical: Staughton Lynd and Cold War Dissent, 1945–1970 (2010), Kent State University Press by Carl Mirra ISBN 978-1-60635-051-5.",0,131,== Bibliography == | === Contributor ===,88493
2004,CD,YEAR_REGEX_1,TIME,time_reference,A Gigantic Mistake by Mickey Z (2004) ISBN 978-1-930997-97-4.,0,132,== Bibliography == | === Contributor ===,88493
2000,CD,YEAR_REGEX_1,TIME,time_reference,A People's History of the Supreme Court by Peter H. Irons (2000) ISBN 978-0-14-029201-5.,0,133,== Bibliography == | === Contributor ===,88493
1933–1967,CD,YEAR_REGEX_1,TIME,time_reference,"A Political Dynasty In North Idaho, 1933–1967 by Randall Doyle (2004) ISBN 978-0-7618-2843-3.",0,134,== Bibliography == | === Contributor ===,88493
2004,CD,YEAR_REGEX_1,TIME,time_reference,"A Political Dynasty In North Idaho, 1933–1967 by Randall Doyle (2004) ISBN 978-0-7618-2843-3.",0,134,== Bibliography == | === Contributor ===,88493
1994,CD,YEAR_REGEX_1,TIME,time_reference,American Political Prisoners: Prosecutions Under the Espionage and Sedition Acts by Stephen M. Kohn (1994) ISBN 978-0-275-94415-5.,0,135,== Bibliography == | === Contributor ===,88493
2002,CD,YEAR_REGEX_1,TIME,time_reference,American Power and the New Mandarins by Noam Chomsky (2002) ISBN 978-1-56584-775-0.,0,136,== Bibliography == | === Contributor ===,88493
Past And Present,NNP CC NNP,TIMELINE_REGEX LINKAGE_REGEX TIMELINE_REGEX,TIME MODIFIER TIME,time_reference,"Broken Promises Of America: At Home And Abroad, Past And Present: An Encyclopedia For Our Times by (Douglas F. Dowd (2004) ISBN 978-1-56751-313-4.",0,137,== Bibliography == | === Contributor ===,88493
