before,after,paragraphIndex,annotation,sentences
,0,0,HT,"Joe ""Seven"" Franco (born 1951) is an American drummer best known for his work with the band The Good Rats in the late 1970s and later as a replacement member of Twisted Sister."
,0,2,HT,"Joe Franco, a 1969 graduate of Brooklyn Technical High School, became a member of the band The Good Rats in 1972."
,1,2,HT,"He also produced and played in the horror rock band Van Helsing's Curse, which also featured Twisted Sister lead vocalist Dee Snider, and on the Magellan album Hundred Year Flood."
,2,2,HT,"Franco replaced A. J. Pero in Twisted Sister in 1986, and stayed in the band for about a year until its break-up in 1987."
,3,2,N,
,4,2,HT,and also former Kansas vocalist Steve Walsh on his solo album Shadowman.
,0,3,HT,"Franco is the author of the book Double Bass Drumming (1984; Alfred, 1993) and is featured in the accompanying video (1988; Warner Bros., 2005)."
,1,3,HT,"He has also lectured and written articles about drumming and is a music producer involved in recording and post-production work as owner of Beatstreet Productions in the Flatiron District of New York City, New York."
