URI,support,types,entity,offset,similarityScore,percentageOfSecondRank,sentence,sentenceIndex,paragraphIndex,section,entType,wikiPageID
http://dbpedia.org/resource/John_Ogdon,126,http://dbpedia.org/ontology/Person,John Ogdon,328,1.0,0.0,"After attending Leigh Boys Grammar School, Davies studied at the University of Manchester and at the Royal Manchester College of Music (amalgamated into the Royal Northern College of Music in 1973), where one of his teachers was Hedwig Stein; his fellow students included Harrison Birtwistle, Alexander Goehr, Elgar Howarth and John Ogdon.",8,3,== Early life and education ==,person,392501
http://dbpedia.org/resource/Aaron_Copland,1404,http://dbpedia.org/ontology/Person,Aaron Copland,95,1.0,0.0,"He left in 1962 after securing a Harkness Fellowship at Princeton University (with the help of Aaron Copland and Benjamin Britten); there he studied with Roger Sessions, Milton Babbitt and Earl Kim.",12,3,== Early life and education ==,person,392501
http://dbpedia.org/resource/Benjamin_Britten,3060,http://dbpedia.org/ontology/Person,Benjamin Britten,113,1.0,6.868488522728851e-17,"He left in 1962 after securing a Harkness Fellowship at Princeton University (with the help of Aaron Copland and Benjamin Britten); there he studied with Roger Sessions, Milton Babbitt and Earl Kim.",12,3,== Early life and education ==,person,392501
http://dbpedia.org/resource/Roger_Sessions,355,http://dbpedia.org/ontology/Person,Roger Sessions,154,1.0,0.0,"He left in 1962 after securing a Harkness Fellowship at Princeton University (with the help of Aaron Copland and Benjamin Britten); there he studied with Roger Sessions, Milton Babbitt and Earl Kim.",12,3,== Early life and education ==,person,392501
http://dbpedia.org/resource/Milton_Babbitt,413,http://dbpedia.org/ontology/Person,Babbitt,177,0.9999999999875228,1.24780371546766e-11,"He left in 1962 after securing a Harkness Fellowship at Princeton University (with the help of Aaron Copland and Benjamin Britten); there he studied with Roger Sessions, Milton Babbitt and Earl Kim.",12,3,== Early life and education ==,person,392501
http://dbpedia.org/resource/President_of_the_Swiss_Confederation,13626,http://dbpedia.org/ontology/Person,President,12,0.5934176962877921,0.6585688363965762,He had been President of Making Music (The National Federation of Music Societies) since 1989.,1,6,== Career ==,person,392501
http://dbpedia.org/resource/LGBT_rights_by_country_or_territory,3179,http://dbpedia.org/ontology/Person,gay rights,36,0.9734868257875008,0.0186562701531961,Davies was a life-long supporter of gay rights and a Vice-President of the Campaign for Homosexual Equality.,0,12,== Political views ==,person,392501
http://dbpedia.org/resource/Harrison_Birtwistle,463,http://dbpedia.org/ontology/Person,Harrison Birtwistle,93,1.0,0.0,"Many works from this period were performed by the Pierrot Players, which Davies founded with Harrison Birtwistle in 1967; they were reformed as the Fires of London in 1970, then disbanded in 1987.",5,17,== Music ==,person,392501
http://dbpedia.org/resource/Scotland,104399,http://dbpedia.org/ontology/MusicalArtist,Scottish,74,0.6023005367051437,0.6188520926883847,"After his move to Orkney, Davies often drew on Orcadian or more generally Scottish themes in his music, and has sometimes set the words of Orcadian writer George Mackay Brown.",0,18,== Music ==,person,392501
http://dbpedia.org/resource/Harrison_Birtwistle,463,http://dbpedia.org/ontology/Person,Harrison Birtwistle,23,1.0,0.0,"1967 – together with Harrison Birtwistle, founded the contemporary music touring ensemble the Pierrot Players (later renamed The Fires of London).",0,24,== Music == | === Career highlights ===,person,392501
